Sheet: Sheet1
A1: Model Parameters | D1: Date | F1: Infected | G1: Infected | H1: ICU | I1: ICU | J1: ICU | K1: No ICU Avail | L1: Deaths | M1: Deaths
A2: Yellow = Editable, Green = Calculated | E2: New | F2: Total | G2: New | H2: Active | I2: Unavailable | J2: Deaths | K2: New | L2: Total
A3: Case increase per day: | B3: 0.134 | D3: of:=[.$B$16] -> 2020-01-20T00:00:00.000 | F3: of:=[.$B$17] -> 8 | G3: of:=[.F3] -> 8 | H3: 0 | I3: 0 | J3: 0 | K3: 0 | L3: 0 | M3: of:=SUM([.L$3:.L3]) -> 0
A4: Doubling time (days): | B4: of:=2/[.B3] -> 14.9253731343284 | D4: of:=[.D3]+1 -> 2020-01-21T00:00:00.000 | F4: of:=IF([.G3] < [.$B$25];CEILING([.G3]*[.$B$3];1);0) -> 2 | G4: of:=IF([.G3] < [.$B$25];SUM([.F$3:.F4]);[.$B$25]) -> 10 | H4: of:=IF((ROW() - [.$B$21] < 3);0;FLOOR(IFERROR(OFFSET([.$F4];-1*[.$B$21];0 );0) * [.$B$10])) -> 0 | I4: of:=SUM(INDEX([.H$1:.H$736];MAX(ROW()+(-1*[.$B$22])+1;3);1):INDEX([.H$1:.H$736];ROW();1)) -> 0 | J4: of:=IF([.I4] > [.$B$20];[.I4]-[.$B$20];0) -> 0 | K4: of:=IF([.J4] > 0; ROUND([.$B$23] *MIN([.J4];[.H4])); 0) -> 0 | L4: of:=IF((ROW() - [.$B$13] < 3);0;FLOOR(IFERROR(OFFSET([.$F4];-1*[.$B$13];0 );0) * [.$B$14])) -> 0 | M4: of:=SUM([.L$3:.L4]) -> 0
D5: of:=[.D4]+1 -> 2020-01-22T00:00:00.000 | F5: of:=IF([.G4] < [.$B$25];CEILING([.G4]*[.$B$3];1);0) -> 2 | G5: of:=IF([.G4] < [.$B$25];SUM([.F$3:.F5]);[.$B$25]) -> 12 | H5: of:=IF((ROW() - [.$B$21] < 3);0;FLOOR(IFERROR(OFFSET([.$F5];-1*[.$B$21];0 );0) * [.$B$10])) -> 0 | I5: of:=SUM(INDEX([.H$1:.H$736];MAX(ROW()+(-1*[.$B$22])+1;3);1):INDEX([.H$1:.H$736];ROW();1)) -> 0 | J5: of:=IF([.I5] > [.$B$20];[.I5]-[.$B$20];0) -> 0 | K5: of:=IF([.J5] > 0; ROUND([.$B$23] *MIN([.J5];[.H5])); 0) -> 0 | L5: of:=IF((ROW() - [.$B$13] < 3);0;FLOOR(IFERROR(OFFSET([.$F5];-1*[.$B$13];0 );0) * [.$B$14])) -> 0 | M5: of:=SUM([.L$3:.L5]) -> 0
A6: Total Population: | B6: 329407500 | D6: of:=[.D5]+1 -> 2020-01-23T00:00:00.000 | F6: of:=IF([.G5] < [.$B$25];CEILING([.G5]*[.$B$3];1);0) -> 2 | G6: of:=IF([.G5] < [.$B$25];SUM([.F$3:.F6]);[.$B$25]) -> 14 | H6: of:=IF((ROW() - [.$B$21] < 3);0;FLOOR(IFERROR(OFFSET([.$F6];-1*[.$B$21];0 );0) * [.$B$10])) -> 0 | I6: of:=SUM(INDEX([.H$1:.H$736];MAX(ROW()+(-1*[.$B$22])+1;3);1):INDEX([.H$1:.H$736];ROW();1)) -> 0 | J6: of:=IF([.I6] > [.$B$20];[.I6]-[.$B$20];0) -> 0 | K6: of:=IF([.J6] > 0; ROUND([.$B$23] *MIN([.J6];[.H6])); 0) -> 0 | L6: of:=IF((ROW() - [.$B$13] < 3);0;FLOOR(IFERROR(OFFSET([.$F6];-1*[.$B$13];0 );0) * [.$B$14])) -> 0 | M6: of:=SUM([.L$3:.L6]) -> 0
A7: Percent of pop infected: | B7: 0.675 | D7: of:=[.D6]+1 -> 2020-01-24T00:00:00.000 | F7: of:=IF([.G6] < [.$B$25];CEILING([.G6]*[.$B$3];1);0) -> 2 | G7: of:=IF([.G6] < [.$B$25];SUM([.F$3:.F7]);[.$B$25]) -> 16 | H7: of:=IF((ROW() - [.$B$21] < 3);0;FLOOR(IFERROR(OFFSET([.$F7];-1*[.$B$21];0 );0) * [.$B$10])) -> 0 | I7: of:=SUM(INDEX([.H$1:.H$736];MAX(ROW()+(-1*[.$B$22])+1;3);1):INDEX([.H$1:.H$736];ROW();1)) -> 0 | J7: of:=IF([.I7] > [.$B$20];[.I7]-[.$B$20];0) -> 0 | K7: of:=IF([.J7] > 0; ROUND([.$B$23] *MIN([.J7];[.H7])); 0) -> 0 | L7: of:=IF((ROW() - [.$B$13] < 3);0;FLOOR(IFERROR(OFFSET([.$F7];-1*[.$B$13];0 );0) * [.$B$14])) -> 0 | M7: of:=SUM([.L$3:.L7]) -> 0
D8: of:=[.D7]+1 -> 2020-01-25T00:00:00.000 | F8: of:=IF([.G7] < [.$B$25];CEILING([.G7]*[.$B$3];1);0) -> 3 | G8: of:=IF([.G7] < [.$B$25];SUM([.F$3:.F8]);[.$B$25]) -> 19 | H8: of:=IF((ROW() - [.$B$21] < 3);0;FLOOR(IFERROR(OFFSET([.$F8];-1*[.$B$21];0 );0) * [.$B$10])) -> 0 | I8: of:=SUM(INDEX([.H$1:.H$736];MAX(ROW()+(-1*[.$B$22])+1;3);1):INDEX([.H$1:.H$736];ROW();1)) -> 0 | J8: of:=IF([.I8] > [.$B$20];[.I8]-[.$B$20];0) -> 0 | K8: of:=IF([.J8] > 0; ROUND([.$B$23] *MIN([.J8];[.H8])); 0) -> 0 | L8: of:=IF((ROW() - [.$B$13] < 3);0;FLOOR(IFERROR(OFFSET([.$F8];-1*[.$B$13];0 );0) * [.$B$14])) -> 0 | M8: of:=SUM([.L$3:.L8]) -> 0
A9: Mild: | B9: 0.83 | D9: of:=[.D8]+1 -> 2020-01-26T00:00:00.000 | F9: of:=IF([.G8] < [.$B$25];CEILING([.G8]*[.$B$3];1);0) -> 3 | G9: of:=IF([.G8] < [.$B$25];SUM([.F$3:.F9]);[.$B$25]) -> 22 | H9: of:=IF((ROW() - [.$B$21] < 3);0;FLOOR(IFERROR(OFFSET([.$F9];-1*[.$B$21];0 );0) * [.$B$10])) -> 0 | I9: of:=SUM(INDEX([.H$1:.H$736];MAX(ROW()+(-1*[.$B$22])+1;3);1):INDEX([.H$1:.H$736];ROW();1)) -> 0 | J9: of:=IF([.I9] > [.$B$20];[.I9]-[.$B$20];0) -> 0 | K9: of:=IF([.J9] > 0; ROUND([.$B$23] *MIN([.J9];[.H9])); 0) -> 0 | L9: of:=IF((ROW() - [.$B$13] < 3);0;FLOOR(IFERROR(OFFSET([.$F9];-1*[.$B$13];0 );0) * [.$B$14])) -> 0 | M9: of:=SUM([.L$3:.L9]) -> 0
A10: ICU: | B10: 0.17 | D10: of:=[.D9]+1 -> 2020-01-27T00:00:00.000 | F10: of:=IF([.G9] < [.$B$25];CEILING([.G9]*[.$B$3];1);0) -> 3 | G10: of:=IF([.G9] < [.$B$25];SUM([.F$3:.F10]);[.$B$25]) -> 25 | H10: of:=IF((ROW() - [.$B$21] < 3);0;FLOOR(IFERROR(OFFSET([.$F10];-1*[.$B$21];0 );0) * [.$B$10])) -> 0 | I10: of:=SUM(INDEX([.H$1:.H$736];MAX(ROW()+(-1*[.$B$22])+1;3);1):INDEX([.H$1:.H$736];ROW();1)) -> 0 | J10: of:=IF([.I10] > [.$B$20];[.I10]-[.$B$20];0) -> 0 | K10: of:=IF([.J10] > 0; ROUND([.$B$23] *MIN([.J10];[.H10])); 0) -> 0 | L10: of:=IF((ROW() - [.$B$13] < 3);0;FLOOR(IFERROR(OFFSET([.$F10];-1*[.$B$13];0 );0) * [.$B$14])) -> 0 | M10: of:=SUM([.L$3:.L10]) -> 0
A11: Total: | B11: of:=[.B9]+[.B10] -> 1 | D11: of:=[.D10]+1 -> 2020-01-28T00:00:00.000 | F11: of:=IF([.G10] < [.$B$25];CEILING([.G10]*[.$B$3];1);0) -> 4 | G11: of:=IF([.G10] < [.$B$25];SUM([.F$3:.F11]);[.$B$25]) -> 29 | H11: of:=IF((ROW() - [.$B$21] < 3);0;FLOOR(IFERROR(OFFSET([.$F11];-1*[.$B$21];0 );0) * [.$B$10])) -> 0 | I11: of:=SUM(INDEX([.H$1:.H$736];MAX(ROW()+(-1*[.$B$22])+1;3);1):INDEX([.H$1:.H$736];ROW();1)) -> 0 | J11: of:=IF([.I11] > [.$B$20];[.I11]-[.$B$20];0) -> 0 | K11: of:=IF([.J11] > 0; ROUND([.$B$23] *MIN([.J11];[.H11])); 0) -> 0 | L11: of:=IF((ROW() - [.$B$13] < 3);0;FLOOR(IFERROR(OFFSET([.$F11];-1*[.$B$13];0 );0) * [.$B$14])) -> 0 | M11: of:=SUM([.L$3:.L11]) -> 0
D12: of:=[.D11]+1 -> 2020-01-29T00:00:00.000 | F12: of:=IF([.G11] < [.$B$25];CEILING([.G11]*[.$B$3];1);0) -> 4 | G12: of:=IF([.G11] < [.$B$25];SUM([.F$3:.F12]);[.$B$25]) -> 33 | H12: of:=IF((ROW() - [.$B$21] < 3);0;FLOOR(IFERROR(OFFSET([.$F12];-1*[.$B$21];0 );0) * [.$B$10])) -> 1 | I12: of:=SUM(INDEX([.H$1:.H$736];MAX(ROW()+(-1*[.$B$22])+1;3);1):INDEX([.H$1:.H$736];ROW();1)) -> 1 | J12: of:=IF([.I12] > [.$B$20];[.I12]-[.$B$20];0) -> 0 | K12: of:=IF([.J12] > 0; ROUND([.$B$23] *MIN([.J12];[.H12])); 0) -> 0 | L12: of:=IF((ROW() - [.$B$13] < 3);0;FLOOR(IFERROR(OFFSET([.$F12];-1*[.$B$13];0 );0) * [.$B$14])) -> 0 | M12: of:=SUM([.L$3:.L12]) -> 0
A13: Days infected prior to Death: | B13: 23 | D13: of:=[.D12]+1 -> 2020-01-30T00:00:00.000 | F13: of:=IF([.G12] < [.$B$25];CEILING([.G12]*[.$B$3];1);0) -> 5 | G13: of:=IF([.G12] < [.$B$25];SUM([.F$3:.F13]);[.$B$25]) -> 38 | H13: of:=IF((ROW() - [.$B$21] < 3);0;FLOOR(IFERROR(OFFSET([.$F13];-1*[.$B$21];0 );0) * [.$B$10])) -> 0 | I13: of:=SUM(INDEX([.H$1:.H$736];MAX(ROW()+(-1*[.$B$22])+1;3);1):INDEX([.H$1:.H$736];ROW();1)) -> 1 | J13: of:=IF([.I13] > [.$B$20];[.I13]-[.$B$20];0) -> 0 | K13: of:=IF([.J13] > 0; ROUND([.$B$23] *MIN([.J13];[.H13])); 0) -> 0 | L13: of:=IF((ROW() - [.$B$13] < 3);0;FLOOR(IFERROR(OFFSET([.$F13];-1*[.$B$13];0 );0) * [.$B$14])) -> 0 | M13: of:=SUM([.L$3:.L13]) -> 0
A14: Death Rate: | B14: 0.025 | D14: of:=[.D13]+1 -> 2020-01-31T00:00:00.000 | F14: of:=IF([.G13] < [.$B$25];CEILING([.G13]*[.$B$3];1);0) -> 6 | G14: of:=IF([.G13] < [.$B$25];SUM([.F$3:.F14]);[.$B$25]) -> 44 | H14: of:=IF((ROW() - [.$B$21] < 3);0;FLOOR(IFERROR(OFFSET([.$F14];-1*[.$B$21];0 );0) * [.$B$10])) -> 0 | I14: of:=SUM(INDEX([.H$1:.H$736];MAX(ROW()+(-1*[.$B$22])+1;3);1):INDEX([.H$1:.H$736];ROW();1)) -> 1 | J14: of:=IF([.I14] > [.$B$20];[.I14]-[.$B$20];0) -> 0 | K14: of:=IF([.J14] > 0; ROUND([.$B$23] *MIN([.J14];[.H14])); 0) -> 0 | L14: of:=IF((ROW() - [.$B$13] < 3);0;FLOOR(IFERROR(OFFSET([.$F14];-1*[.$B$13];0 );0) * [.$B$14])) -> 0 | M14: of:=SUM([.L$3:.L14]) -> 0
D15: of:=[.D14]+1 -> 2020-02-01T00:00:00.000 | F15: of:=IF([.G14] < [.$B$25];CEILING([.G14]*[.$B$3];1);0) -> 6 | G15: of:=IF([.G14] < [.$B$25];SUM([.F$3:.F15]);[.$B$25]) -> 50 | H15: of:=IF((ROW() - [.$B$21] < 3);0;FLOOR(IFERROR(OFFSET([.$F15];-1*[.$B$21];0 );0) * [.$B$10])) -> 0 | I15: of:=SUM(INDEX([.H$1:.H$736];MAX(ROW()+(-1*[.$B$22])+1;3);1):INDEX([.H$1:.H$736];ROW();1)) -> 1 | J15: of:=IF([.I15] > [.$B$20];[.I15]-[.$B$20];0) -> 0 | K15: of:=IF([.J15] > 0; ROUND([.$B$23] *MIN([.J15];[.H15])); 0) -> 0 | L15: of:=IF((ROW() - [.$B$13] < 3);0;FLOOR(IFERROR(OFFSET([.$F15];-1*[.$B$13];0 );0) * [.$B$14])) -> 0 | M15: of:=SUM([.L$3:.L15]) -> 0
A16: Start Date: | B16: 2020-01-20T00:00:00.000 | D16: of:=[.D15]+1 -> 2020-02-02T00:00:00.000 | F16: of:=IF([.G15] < [.$B$25];CEILING([.G15]*[.$B$3];1);0) -> 7 | G16: of:=IF([.G15] < [.$B$25];SUM([.F$3:.F16]);[.$B$25]) -> 57 | H16: of:=IF((ROW() - [.$B$21] < 3);0;FLOOR(IFERROR(OFFSET([.$F16];-1*[.$B$21];0 );0) * [.$B$10])) -> 0 | I16: of:=SUM(INDEX([.H$1:.H$736];MAX(ROW()+(-1*[.$B$22])+1;3);1):INDEX([.H$1:.H$736];ROW();1)) -> 1 | J16: of:=IF([.I16] > [.$B$20];[.I16]-[.$B$20];0) -> 0 | K16: of:=IF([.J16] > 0; ROUND([.$B$23] *MIN([.J16];[.H16])); 0) -> 0 | L16: of:=IF((ROW() - [.$B$13] < 3);0;FLOOR(IFERROR(OFFSET([.$F16];-1*[.$B$13];0 );0) * [.$B$14])) -> 0 | M16: of:=SUM([.L$3:.L16]) -> 0
A17: Initial number infected: | B17: 8 | D17: of:=[.D16]+1 -> 2020-02-03T00:00:00.000 | F17: of:=IF([.G16] < [.$B$25];CEILING([.G16]*[.$B$3];1);0) -> 8 | G17: of:=IF([.G16] < [.$B$25];SUM([.F$3:.F17]);[.$B$25]) -> 65 | H17: of:=IF((ROW() - [.$B$21] < 3);0;FLOOR(IFERROR(OFFSET([.$F17];-1*[.$B$21];0 );0) * [.$B$10])) -> 0 | I17: of:=SUM(INDEX([.H$1:.H$736];MAX(ROW()+(-1*[.$B$22])+1;3);1):INDEX([.H$1:.H$736];ROW();1)) -> 1 | J17: of:=IF([.I17] > [.$B$20];[.I17]-[.$B$20];0) -> 0 | K17: of:=IF([.J17] > 0; ROUND([.$B$23] *MIN([.J17];[.H17])); 0) -> 0 | L17: of:=IF((ROW() - [.$B$13] < 3);0;FLOOR(IFERROR(OFFSET([.$F17];-1*[.$B$13];0 );0) * [.$B$14])) -> 0 | M17: of:=SUM([.L$3:.L17]) -> 0
A18: Uncounted Infected %: | B18: 0.18 | D18: of:=[.D17]+1 -> 2020-02-04T00:00:00.000 | F18: of:=IF([.G17] < [.$B$25];CEILING([.G17]*[.$B$3];1);0) -> 9 | G18: of:=IF([.G17] < [.$B$25];SUM([.F$3:.F18]);[.$B$25]) -> 74 | H18: of:=IF((ROW() - [.$B$21] < 3);0;FLOOR(IFERROR(OFFSET([.$F18];-1*[.$B$21];0 );0) * [.$B$10])) -> 0 | I18: of:=SUM(INDEX([.H$1:.H$736];MAX(ROW()+(-1*[.$B$22])+1;3);1):INDEX([.H$1:.H$736];ROW();1)) -> 1 | J18: of:=IF([.I18] > [.$B$20];[.I18]-[.$B$20];0) -> 0 | K18: of:=IF([.J18] > 0; ROUND([.$B$23] *MIN([.J18];[.H18])); 0) -> 0 | L18: of:=IF((ROW() - [.$B$13] < 3);0;FLOOR(IFERROR(OFFSET([.$F18];-1*[.$B$13];0 );0) * [.$B$14])) -> 0 | M18: of:=SUM([.L$3:.L18]) -> 0
D19: of:=[.D18]+1 -> 2020-02-05T00:00:00.000 | F19: of:=IF([.G18] < [.$B$25];CEILING([.G18]*[.$B$3];1);0) -> 10 | G19: of:=IF([.G18] < [.$B$25];SUM([.F$3:.F19]);[.$B$25]) -> 84 | H19: of:=IF((ROW() - [.$B$21] < 3);0;FLOOR(IFERROR(OFFSET([.$F19];-1*[.$B$21];0 );0) * [.$B$10])) -> 0 | I19: of:=SUM(INDEX([.H$1:.H$736];MAX(ROW()+(-1*[.$B$22])+1;3);1):INDEX([.H$1:.H$736];ROW();1)) -> 1 | J19: of:=IF([.I19] > [.$B$20];[.I19]-[.$B$20];0) -> 0 | K19: of:=IF([.J19] > 0; ROUND([.$B$23] *MIN([.J19];[.H19])); 0) -> 0 | L19: of:=IF((ROW() - [.$B$13] < 3);0;FLOOR(IFERROR(OFFSET([.$F19];-1*[.$B$13];0 );0) * [.$B$14])) -> 0 | M19: of:=SUM([.L$3:.L19]) -> 0
A20: ICU Beds: | B20: of:=([.B6]/100000) * 34.7 -> 114,304 | D20: of:=[.D19]+1 -> 2020-02-06T00:00:00.000 | F20: of:=IF([.G19] < [.$B$25];CEILING([.G19]*[.$B$3];1);0) -> 12 | G20: of:=IF([.G19] < [.$B$25];SUM([.F$3:.F20]);[.$B$25]) -> 96 | H20: of:=IF((ROW() - [.$B$21] < 3);0;FLOOR(IFERROR(OFFSET([.$F20];-1*[.$B$21];0 );0) * [.$B$10])) -> 0 | I20: of:=SUM(INDEX([.H$1:.H$736];MAX(ROW()+(-1*[.$B$22])+1;3);1):INDEX([.H$1:.H$736];ROW();1)) -> 1 | J20: of:=IF([.I20] > [.$B$20];[.I20]-[.$B$20];0) -> 0 | K20: of:=IF([.J20] > 0; ROUND([.$B$23] *MIN([.J20];[.H20])); 0) -> 0 | L20: of:=IF((ROW() - [.$B$13] < 3);0;FLOOR(IFERROR(OFFSET([.$F20];-1*[.$B$13];0 );0) * [.$B$14])) -> 0 | M20: of:=SUM([.L$3:.L20]) -> 0
A21: Avg days infected prior to ICU: | B21: 9 | D21: of:=[.D20]+1 -> 2020-02-07T00:00:00.000 | F21: of:=IF([.G20] < [.$B$25];CEILING([.G20]*[.$B$3];1);0) -> 13 | G21: of:=IF([.G20] < [.$B$25];SUM([.F$3:.F21]);[.$B$25]) -> 109 | H21: of:=IF((ROW() - [.$B$21] < 3);0;FLOOR(IFERROR(OFFSET([.$F21];-1*[.$B$21];0 );0) * [.$B$10])) -> 0 | I21: of:=SUM(INDEX([.H$1:.H$736];MAX(ROW()+(-1*[.$B$22])+1;3);1):INDEX([.H$1:.H$736];ROW();1)) -> 1 | J21: of:=IF([.I21] > [.$B$20];[.I21]-[.$B$20];0) -> 0 | K21: of:=IF([.J21] > 0; ROUND([.$B$23] *MIN([.J21];[.H21])); 0) -> 0 | L21: of:=IF((ROW() - [.$B$13] < 3);0;FLOOR(IFERROR(OFFSET([.$F21];-1*[.$B$13];0 );0) * [.$B$14])) -> 0 | M21: of:=SUM([.L$3:.L21]) -> 0
A22: Avg ICU time (days): | B22: 23 | D22: of:=[.D21]+1 -> 2020-02-08T00:00:00.000 | F22: of:=IF([.G21] < [.$B$25];CEILING([.G21]*[.$B$3];1);0) -> 15 | G22: of:=IF([.G21] < [.$B$25];SUM([.F$3:.F22]);[.$B$25]) -> 124 | H22: of:=IF((ROW() - [.$B$21] < 3);0;FLOOR(IFERROR(OFFSET([.$F22];-1*[.$B$21];0 );0) * [.$B$10])) -> 0 | I22: of:=SUM(INDEX([.H$1:.H$736];MAX(ROW()+(-1*[.$B$22])+1;3);1):INDEX([.H$1:.H$736];ROW();1)) -> 1 | J22: of:=IF([.I22] > [.$B$20];[.I22]-[.$B$20];0) -> 0 | K22: of:=IF([.J22] > 0; ROUND([.$B$23] *MIN([.J22];[.H22])); 0) -> 0 | L22: of:=IF((ROW() - [.$B$13] < 3);0;FLOOR(IFERROR(OFFSET([.$F22];-1*[.$B$13];0 );0) * [.$B$14])) -> 0 | M22: of:=SUM([.L$3:.L22]) -> 0
A23: ICU Overload death rate: | B23: 18.00% | D23: of:=[.D22]+1 -> 2020-02-09T00:00:00.000 | F23: of:=IF([.G22] < [.$B$25];CEILING([.G22]*[.$B$3];1);0) -> 17 | G23: of:=IF([.G22] < [.$B$25];SUM([.F$3:.F23]);[.$B$25]) -> 141 | H23: of:=IF((ROW() - [.$B$21] < 3);0;FLOOR(IFERROR(OFFSET([.$F23];-1*[.$B$21];0 );0) * [.$B$10])) -> 1 | I23: of:=SUM(INDEX([.H$1:.H$736];MAX(ROW()+(-1*[.$B$22])+1;3);1):INDEX([.H$1:.H$736];ROW();1)) -> 2 | J23: of:=IF([.I23] > [.$B$20];[.I23]-[.$B$20];0) -> 0 | K23: of:=IF([.J23] > 0; ROUND([.$B$23] *MIN([.J23];[.H23])); 0) -> 0 | L23: of:=IF((ROW() - [.$B$13] < 3);0;FLOOR(IFERROR(OFFSET([.$F23];-1*[.$B$13];0 );0) * [.$B$14])) -> 0 | M23: of:=SUM([.L$3:.L23]) -> 0
D24: of:=[.D23]+1 -> 2020-02-10T00:00:00.000 | F24: of:=IF([.G23] < [.$B$25];CEILING([.G23]*[.$B$3];1);0) -> 19 | G24: of:=IF([.G23] < [.$B$25];SUM([.F$3:.F24]);[.$B$25]) -> 160 | H24: of:=IF((ROW() - [.$B$21] < 3);0;FLOOR(IFERROR(OFFSET([.$F24];-1*[.$B$21];0 );0) * [.$B$10])) -> 1 | I24: of:=SUM(INDEX([.H$1:.H$736];MAX(ROW()+(-1*[.$B$22])+1;3);1):INDEX([.H$1:.H$736];ROW();1)) -> 3 | J24: of:=IF([.I24] > [.$B$20];[.I24]-[.$B$20];0) -> 0 | K24: of:=IF([.J24] > 0; ROUND([.$B$23] *MIN([.J24];[.H24])); 0) -> 0 | L24: of:=IF((ROW() - [.$B$13] < 3);0;FLOOR(IFERROR(OFFSET([.$F24];-1*[.$B$13];0 );0) * [.$B$14])) -> 0 | M24: of:=SUM([.L$3:.L24]) -> 0
A25: Total Infected Calc : | B25: of:=[.B6]*[.B7] -> 222350062.5 | D25: of:=[.D24]+1 -> 2020-02-11T00:00:00.000 | F25: of:=IF([.G24] < [.$B$25];CEILING([.G24]*[.$B$3];1);0) -> 22 | G25: of:=IF([.G24] < [.$B$25];SUM([.F$3:.F25]);[.$B$25]) -> 182 | H25: of:=IF((ROW() - [.$B$21] < 3);0;FLOOR(IFERROR(OFFSET([.$F25];-1*[.$B$21];0 );0) * [.$B$10])) -> 1 | I25: of:=SUM(INDEX([.H$1:.H$736];MAX(ROW()+(-1*[.$B$22])+1;3);1):INDEX([.H$1:.H$736];ROW();1)) -> 4 | J25: of:=IF([.I25] > [.$B$20];[.I25]-[.$B$20];0) -> 0 | K25: of:=IF([.J25] > 0; ROUND([.$B$23] *MIN([.J25];[.H25])); 0) -> 0 | L25: of:=IF((ROW() - [.$B$13] < 3);0;FLOOR(IFERROR(OFFSET([.$F25];-1*[.$B$13];0 );0) * [.$B$14])) -> 0 | M25: of:=SUM([.L$3:.L25]) -> 0
A26: Total Infected Summed: | B26: of:=SUM([.F3:.F736]) -> 242480494 | D26: of:=[.D25]+1 -> 2020-02-12T00:00:00.000 | F26: of:=IF([.G25] < [.$B$25];CEILING([.G25]*[.$B$3];1);0) -> 25 | G26: of:=IF([.G25] < [.$B$25];SUM([.F$3:.F26]);[.$B$25]) -> 207 | H26: of:=IF((ROW() - [.$B$21] < 3);0;FLOOR(IFERROR(OFFSET([.$F26];-1*[.$B$21];0 );0) * [.$B$10])) -> 1 | I26: of:=SUM(INDEX([.H$1:.H$736];MAX(ROW()+(-1*[.$B$22])+1;3);1):INDEX([.H$1:.H$736];ROW();1)) -> 5 | J26: of:=IF([.I26] > [.$B$20];[.I26]-[.$B$20];0) -> 0 | K26: of:=IF([.J26] > 0; ROUND([.$B$23] *MIN([.J26];[.H26])); 0) -> 0 | L26: of:=IF((ROW() - [.$B$13] < 3);0;FLOOR(IFERROR(OFFSET([.$F26];-1*[.$B$13];0 );0) * [.$B$14])) -> 0 | M26: of:=SUM([.L$3:.L26]) -> 0
A27: Total ICU Calc: | B27: of:=[.B25]*[.B10] -> 37799510.625 | D27: of:=[.D26]+1 -> 2020-02-13T00:00:00.000 | F27: of:=IF([.G26] < [.$B$25];CEILING([.G26]*[.$B$3];1);0) -> 28 | G27: of:=IF([.G26] < [.$B$25];SUM([.F$3:.F27]);[.$B$25]) -> 235 | H27: of:=IF((ROW() - [.$B$21] < 3);0;FLOOR(IFERROR(OFFSET([.$F27];-1*[.$B$21];0 );0) * [.$B$10])) -> 1 | I27: of:=SUM(INDEX([.H$1:.H$736];MAX(ROW()+(-1*[.$B$22])+1;3);1):INDEX([.H$1:.H$736];ROW();1)) -> 6 | J27: of:=IF([.I27] > [.$B$20];[.I27]-[.$B$20];0) -> 0 | K27: of:=IF([.J27] > 0; ROUND([.$B$23] *MIN([.J27];[.H27])); 0) -> 0 | L27: of:=IF((ROW() - [.$B$13] < 3);0;FLOOR(IFERROR(OFFSET([.$F27];-1*[.$B$13];0 );0) * [.$B$14])) -> 0 | M27: of:=SUM([.L$3:.L27]) -> 0
A28: Total ICU Summed: | B28: of:=SUM([.H3:.H736]) -> 41221618 | D28: of:=[.D27]+1 -> 2020-02-14T00:00:00.000 | F28: of:=IF([.G27] < [.$B$25];CEILING([.G27]*[.$B$3];1);0) -> 32 | G28: of:=IF([.G27] < [.$B$25];SUM([.F$3:.F28]);[.$B$25]) -> 267 | H28: of:=IF((ROW() - [.$B$21] < 3);0;FLOOR(IFERROR(OFFSET([.$F28];-1*[.$B$21];0 );0) * [.$B$10])) -> 1 | I28: of:=SUM(INDEX([.H$1:.H$736];MAX(ROW()+(-1*[.$B$22])+1;3);1):INDEX([.H$1:.H$736];ROW();1)) -> 7 | J28: of:=IF([.I28] > [.$B$20];[.I28]-[.$B$20];0) -> 0 | K28: of:=IF([.J28] > 0; ROUND([.$B$23] *MIN([.J28];[.H28])); 0) -> 0 | L28: of:=IF((ROW() - [.$B$13] < 3);0;FLOOR(IFERROR(OFFSET([.$F28];-1*[.$B$13];0 );0) * [.$B$14])) -> 0 | M28: of:=SUM([.L$3:.L28]) -> 0
A29: Total Deaths: Calc | B29: of:=[.B14]*[.B25] -> 5558751.5625 | D29: of:=[.D28]+1 -> 2020-02-15T00:00:00.000 | F29: of:=IF([.G28] < [.$B$25];CEILING([.G28]*[.$B$3];1);0) -> 36 | G29: of:=IF([.G28] < [.$B$25];SUM([.F$3:.F29]);[.$B$25]) -> 303 | H29: of:=IF((ROW() - [.$B$21] < 3);0;FLOOR(IFERROR(OFFSET([.$F29];-1*[.$B$21];0 );0) * [.$B$10])) -> 2 | I29: of:=SUM(INDEX([.H$1:.H$736];MAX(ROW()+(-1*[.$B$22])+1;3);1):INDEX([.H$1:.H$736];ROW();1)) -> 9 | J29: of:=IF([.I29] > [.$B$20];[.I29]-[.$B$20];0) -> 0 | K29: of:=IF([.J29] > 0; ROUND([.$B$23] *MIN([.J29];[.H29])); 0) -> 0 | L29: of:=IF((ROW() - [.$B$13] < 3);0;FLOOR(IFERROR(OFFSET([.$F29];-1*[.$B$13];0 );0) * [.$B$14])) -> 0 | M29: of:=SUM([.L$3:.L29]) -> 0
A30: Total Death Summed: | B30: of:=[.M736] -> 6,061,951 | D30: of:=[.D29]+1 -> 2020-02-16T00:00:00.000 | F30: of:=IF([.G29] < [.$B$25];CEILING([.G29]*[.$B$3];1);0) -> 41 | G30: of:=IF([.G29] < [.$B$25];SUM([.F$3:.F30]);[.$B$25]) -> 344 | H30: of:=IF((ROW() - [.$B$21] < 3);0;FLOOR(IFERROR(OFFSET([.$F30];-1*[.$B$21];0 );0) * [.$B$10])) -> 2 | I30: of:=SUM(INDEX([.H$1:.H$736];MAX(ROW()+(-1*[.$B$22])+1;3);1):INDEX([.H$1:.H$736];ROW();1)) -> 11 | J30: of:=IF([.I30] > [.$B$20];[.I30]-[.$B$20];0) -> 0 | K30: of:=IF([.J30] > 0; ROUND([.$B$23] *MIN([.J30];[.H30])); 0) -> 0 | L30: of:=IF((ROW() - [.$B$13] < 3);0;FLOOR(IFERROR(OFFSET([.$F30];-1*[.$B$13];0 );0) * [.$B$14])) -> 0 | M30: of:=SUM([.L$3:.L30]) -> 0
A31: Deaths from ICU overload: | B31: of:=SUM([.K3:.K736]) -> 7,398,057 | D31: of:=[.D30]+1 -> 2020-02-17T00:00:00.000 | F31: of:=IF([.G30] < [.$B$25];CEILING([.G30]*[.$B$3];1);0) -> 47 | G31: of:=IF([.G30] < [.$B$25];SUM([.F$3:.F31]);[.$B$25]) -> 391 | H31: of:=IF((ROW() - [.$B$21] < 3);0;FLOOR(IFERROR(OFFSET([.$F31];-1*[.$B$21];0 );0) * [.$B$10])) -> 2 | I31: of:=SUM(INDEX([.H$1:.H$736];MAX(ROW()+(-1*[.$B$22])+1;3);1):INDEX([.H$1:.H$736];ROW();1)) -> 13 | J31: of:=IF([.I31] > [.$B$20];[.I31]-[.$B$20];0) -> 0 | K31: of:=IF([.J31] > 0; ROUND([.$B$23] *MIN([.J31];[.H31])); 0) -> 0 | L31: of:=IF((ROW() - [.$B$13] < 3);0;FLOOR(IFERROR(OFFSET([.$F31];-1*[.$B$13];0 );0) * [.$B$14])) -> 0 | M31: of:=SUM([.L$3:.L31]) -> 0
A32: Total + ICU overload Deaths | B32: of:=[.B29]+[.B31] -> 12956808.5625 | D32: of:=[.D31]+1 -> 2020-02-18T00:00:00.000 | F32: of:=IF([.G31] < [.$B$25];CEILING([.G31]*[.$B$3];1);0) -> 53 | G32: of:=IF([.G31] < [.$B$25];SUM([.F$3:.F32]);[.$B$25]) -> 444 | H32: of:=IF((ROW() - [.$B$21] < 3);0;FLOOR(IFERROR(OFFSET([.$F32];-1*[.$B$21];0 );0) * [.$B$10])) -> 2 | I32: of:=SUM(INDEX([.H$1:.H$736];MAX(ROW()+(-1*[.$B$22])+1;3);1):INDEX([.H$1:.H$736];ROW();1)) -> 15 | J32: of:=IF([.I32] > [.$B$20];[.I32]-[.$B$20];0) -> 0 | K32: of:=IF([.J32] > 0; ROUND([.$B$23] *MIN([.J32];[.H32])); 0) -> 0 | L32: of:=IF((ROW() - [.$B$13] < 3);0;FLOOR(IFERROR(OFFSET([.$F32];-1*[.$B$13];0 );0) * [.$B$14])) -> 0 | M32: of:=SUM([.L$3:.L32]) -> 0
D33: of:=[.D32]+1 -> 2020-02-19T00:00:00.000 | F33: of:=IF([.G32] < [.$B$25];CEILING([.G32]*[.$B$3];1);0) -> 60 | G33: of:=IF([.G32] < [.$B$25];SUM([.F$3:.F33]);[.$B$25]) -> 504 | H33: of:=IF((ROW() - [.$B$21] < 3);0;FLOOR(IFERROR(OFFSET([.$F33];-1*[.$B$21];0 );0) * [.$B$10])) -> 3 | I33: of:=SUM(INDEX([.H$1:.H$736];MAX(ROW()+(-1*[.$B$22])+1;3);1):INDEX([.H$1:.H$736];ROW();1)) -> 18 | J33: of:=IF([.I33] > [.$B$20];[.I33]-[.$B$20];0) -> 0 | K33: of:=IF([.J33] > 0; ROUND([.$B$23] *MIN([.J33];[.H33])); 0) -> 0 | L33: of:=IF((ROW() - [.$B$13] < 3);0;FLOOR(IFERROR(OFFSET([.$F33];-1*[.$B$13];0 );0) * [.$B$14])) -> 0 | M33: of:=SUM([.L$3:.L33]) -> 0
A34: Not peer reviewed! | D34: of:=[.D33]+1 -> 2020-02-20T00:00:00.000 | F34: of:=IF([.G33] < [.$B$25];CEILING([.G33]*[.$B$3];1);0) -> 68 | G34: of:=IF([.G33] < [.$B$25];SUM([.F$3:.F34]);[.$B$25]) -> 572 | H34: of:=IF((ROW() - [.$B$21] < 3);0;FLOOR(IFERROR(OFFSET([.$F34];-1*[.$B$21];0 );0) * [.$B$10])) -> 3 | I34: of:=SUM(INDEX([.H$1:.H$736];MAX(ROW()+(-1*[.$B$22])+1;3);1):INDEX([.H$1:.H$736];ROW();1)) -> 21 | J34: of:=IF([.I34] > [.$B$20];[.I34]-[.$B$20];0) -> 0 | K34: of:=IF([.J34] > 0; ROUND([.$B$23] *MIN([.J34];[.H34])); 0) -> 0 | L34: of:=IF((ROW() - [.$B$13] < 3);0;FLOOR(IFERROR(OFFSET([.$F34];-1*[.$B$13];0 );0) * [.$B$14])) -> 0 | M34: of:=SUM([.L$3:.L34]) -> 0
A35: Not authorized by rooms full of officials | D35: of:=[.D34]+1 -> 2020-02-21T00:00:00.000 | F35: of:=IF([.G34] < [.$B$25];CEILING([.G34]*[.$B$3];1);0) -> 77 | G35: of:=IF([.G34] < [.$B$25];SUM([.F$3:.F35]);[.$B$25]) -> 649 | H35: of:=IF((ROW() - [.$B$21] < 3);0;FLOOR(IFERROR(OFFSET([.$F35];-1*[.$B$21];0 );0) * [.$B$10])) -> 4 | I35: of:=SUM(INDEX([.H$1:.H$736];MAX(ROW()+(-1*[.$B$22])+1;3);1):INDEX([.H$1:.H$736];ROW();1)) -> 24 | J35: of:=IF([.I35] > [.$B$20];[.I35]-[.$B$20];0) -> 0 | K35: of:=IF([.J35] > 0; ROUND([.$B$23] *MIN([.J35];[.H35])); 0) -> 0 | L35: of:=IF((ROW() - [.$B$13] < 3);0;FLOOR(IFERROR(OFFSET([.$F35];-1*[.$B$13];0 );0) * [.$B$14])) -> 0 | M35: of:=SUM([.L$3:.L35]) -> 0
A36: SK, TW and SG are competently responding, not USA | D36: of:=[.D35]+1 -> 2020-02-22T00:00:00.000 | F36: of:=IF([.G35] < [.$B$25];CEILING([.G35]*[.$B$3];1);0) -> 87 | G36: of:=IF([.G35] < [.$B$25];SUM([.F$3:.F36]);[.$B$25]) -> 736 | H36: of:=IF((ROW() - [.$B$21] < 3);0;FLOOR(IFERROR(OFFSET([.$F36];-1*[.$B$21];0 );0) * [.$B$10])) -> 4 | I36: of:=SUM(INDEX([.H$1:.H$736];MAX(ROW()+(-1*[.$B$22])+1;3);1):INDEX([.H$1:.H$736];ROW();1)) -> 28 | J36: of:=IF([.I36] > [.$B$20];[.I36]-[.$B$20];0) -> 0 | K36: of:=IF([.J36] > 0; ROUND([.$B$23] *MIN([.J36];[.H36])); 0) -> 0 | L36: of:=IF((ROW() - [.$B$13] < 3);0;FLOOR(IFERROR(OFFSET([.$F36];-1*[.$B$13];0 );0) * [.$B$14])) -> 0 | M36: of:=SUM([.L$3:.L36]) -> 0
A37: copyright u/classicrando | D37: of:=[.D36]+1 -> 2020-02-23T00:00:00.000 | F37: of:=IF([.G36] < [.$B$25];CEILING([.G36]*[.$B$3];1);0) -> 99 | G37: of:=IF([.G36] < [.$B$25];SUM([.F$3:.F37]);[.$B$25]) -> 835 | H37: of:=IF((ROW() - [.$B$21] < 3);0;FLOOR(IFERROR(OFFSET([.$F37];-1*[.$B$21];0 );0) * [.$B$10])) -> 5 | I37: of:=SUM(INDEX([.H$1:.H$736];MAX(ROW()+(-1*[.$B$22])+1;3);1):INDEX([.H$1:.H$736];ROW();1)) -> 33 | J37: of:=IF([.I37] > [.$B$20];[.I37]-[.$B$20];0) -> 0 | K37: of:=IF([.J37] > 0; ROUND([.$B$23] *MIN([.J37];[.H37])); 0) -> 0 | L37: of:=IF((ROW() - [.$B$13] < 3);0;FLOOR(IFERROR(OFFSET([.$F37];-1*[.$B$13];0 );0) * [.$B$14])) -> 0 | M37: of:=SUM([.L$3:.L37]) -> 0
D38: of:=[.D37]+1 -> 2020-02-24T00:00:00.000 | F38: of:=IF([.G37] < [.$B$25];CEILING([.G37]*[.$B$3];1);0) -> 112 | G38: of:=IF([.G37] < [.$B$25];SUM([.F$3:.F38]);[.$B$25]) -> 947 | H38: of:=IF((ROW() - [.$B$21] < 3);0;FLOOR(IFERROR(OFFSET([.$F38];-1*[.$B$21];0 );0) * [.$B$10])) -> 6 | I38: of:=SUM(INDEX([.H$1:.H$736];MAX(ROW()+(-1*[.$B$22])+1;3);1):INDEX([.H$1:.H$736];ROW();1)) -> 39 | J38: of:=IF([.I38] > [.$B$20];[.I38]-[.$B$20];0) -> 0 | K38: of:=IF([.J38] > 0; ROUND([.$B$23] *MIN([.J38];[.H38])); 0) -> 0 | L38: of:=IF((ROW() - [.$B$13] < 3);0;FLOOR(IFERROR(OFFSET([.$F38];-1*[.$B$13];0 );0) * [.$B$14])) -> 0 | M38: of:=SUM([.L$3:.L38]) -> 0
D39: of:=[.D38]+1 -> 2020-02-25T00:00:00.000 | F39: of:=IF([.G38] < [.$B$25];CEILING([.G38]*[.$B$3];1);0) -> 127 | G39: of:=IF([.G38] < [.$B$25];SUM([.F$3:.F39]);[.$B$25]) -> 1074 | H39: of:=IF((ROW() - [.$B$21] < 3);0;FLOOR(IFERROR(OFFSET([.$F39];-1*[.$B$21];0 );0) * [.$B$10])) -> 6 | I39: of:=SUM(INDEX([.H$1:.H$736];MAX(ROW()+(-1*[.$B$22])+1;3);1):INDEX([.H$1:.H$736];ROW();1)) -> 45 | J39: of:=IF([.I39] > [.$B$20];[.I39]-[.$B$20];0) -> 0 | K39: of:=IF([.J39] > 0; ROUND([.$B$23] *MIN([.J39];[.H39])); 0) -> 0 | L39: of:=IF((ROW() - [.$B$13] < 3);0;FLOOR(IFERROR(OFFSET([.$F39];-1*[.$B$13];0 );0) * [.$B$14])) -> 0 | M39: of:=SUM([.L$3:.L39]) -> 0
D40: of:=[.D39]+1 -> 2020-02-26T00:00:00.000 | F40: of:=IF([.G39] < [.$B$25];CEILING([.G39]*[.$B$3];1);0) -> 144 | G40: of:=IF([.G39] < [.$B$25];SUM([.F$3:.F40]);[.$B$25]) -> 1218 | H40: of:=IF((ROW() - [.$B$21] < 3);0;FLOOR(IFERROR(OFFSET([.$F40];-1*[.$B$21];0 );0) * [.$B$10])) -> 7 | I40: of:=SUM(INDEX([.H$1:.H$736];MAX(ROW()+(-1*[.$B$22])+1;3);1):INDEX([.H$1:.H$736];ROW();1)) -> 52 | J40: of:=IF([.I40] > [.$B$20];[.I40]-[.$B$20];0) -> 0 | K40: of:=IF([.J40] > 0; ROUND([.$B$23] *MIN([.J40];[.H40])); 0) -> 0 | L40: of:=IF((ROW() - [.$B$13] < 3);0;FLOOR(IFERROR(OFFSET([.$F40];-1*[.$B$13];0 );0) * [.$B$14])) -> 0 | M40: of:=SUM([.L$3:.L40]) -> 0
D41: of:=[.D40]+1 -> 2020-02-27T00:00:00.000 | F41: of:=IF([.G40] < [.$B$25];CEILING([.G40]*[.$B$3];1);0) -> 164 | G41: of:=IF([.G40] < [.$B$25];SUM([.F$3:.F41]);[.$B$25]) -> 1382 | H41: of:=IF((ROW() - [.$B$21] < 3);0;FLOOR(IFERROR(OFFSET([.$F41];-1*[.$B$21];0 );0) * [.$B$10])) -> 9 | I41: of:=SUM(INDEX([.H$1:.H$736];MAX(ROW()+(-1*[.$B$22])+1;3);1):INDEX([.H$1:.H$736];ROW();1)) -> 61 | J41: of:=IF([.I41] > [.$B$20];[.I41]-[.$B$20];0) -> 0 | K41: of:=IF([.J41] > 0; ROUND([.$B$23] *MIN([.J41];[.H41])); 0) -> 0 | L41: of:=IF((ROW() - [.$B$13] < 3);0;FLOOR(IFERROR(OFFSET([.$F41];-1*[.$B$13];0 );0) * [.$B$14])) -> 0 | M41: of:=SUM([.L$3:.L41]) -> 0
D42: of:=[.D41]+1 -> 2020-02-28T00:00:00.000 | F42: of:=IF([.G41] < [.$B$25];CEILING([.G41]*[.$B$3];1);0) -> 186 | G42: of:=IF([.G41] < [.$B$25];SUM([.F$3:.F42]);[.$B$25]) -> 1568 | H42: of:=IF((ROW() - [.$B$21] < 3);0;FLOOR(IFERROR(OFFSET([.$F42];-1*[.$B$21];0 );0) * [.$B$10])) -> 10 | I42: of:=SUM(INDEX([.H$1:.H$736];MAX(ROW()+(-1*[.$B$22])+1;3);1):INDEX([.H$1:.H$736];ROW();1)) -> 71 | J42: of:=IF([.I42] > [.$B$20];[.I42]-[.$B$20];0) -> 0 | K42: of:=IF([.J42] > 0; ROUND([.$B$23] *MIN([.J42];[.H42])); 0) -> 0 | L42: of:=IF((ROW() - [.$B$13] < 3);0;FLOOR(IFERROR(OFFSET([.$F42];-1*[.$B$13];0 );0) * [.$B$14])) -> 0 | M42: of:=SUM([.L$3:.L42]) -> 0
D43: of:=[.D42]+1 -> 2020-02-29T00:00:00.000 | F43: of:=IF([.G42] < [.$B$25];CEILING([.G42]*[.$B$3];1);0) -> 211 | G43: of:=IF([.G42] < [.$B$25];SUM([.F$3:.F43]);[.$B$25]) -> 1779 | H43: of:=IF((ROW() - [.$B$21] < 3);0;FLOOR(IFERROR(OFFSET([.$F43];-1*[.$B$21];0 );0) * [.$B$10])) -> 11 | I43: of:=SUM(INDEX([.H$1:.H$736];MAX(ROW()+(-1*[.$B$22])+1;3);1):INDEX([.H$1:.H$736];ROW();1)) -> 82 | J43: of:=IF([.I43] > [.$B$20];[.I43]-[.$B$20];0) -> 0 | K43: of:=IF([.J43] > 0; ROUND([.$B$23] *MIN([.J43];[.H43])); 0) -> 0 | L43: of:=IF((ROW() - [.$B$13] < 3);0;FLOOR(IFERROR(OFFSET([.$F43];-1*[.$B$13];0 );0) * [.$B$14])) -> 0 | M43: of:=SUM([.L$3:.L43]) -> 0
D44: of:=[.D43]+1 -> 2020-03-01T00:00:00.000 | F44: of:=IF([.G43] < [.$B$25];CEILING([.G43]*[.$B$3];1);0) -> 239 | G44: of:=IF([.G43] < [.$B$25];SUM([.F$3:.F44]);[.$B$25]) -> 2018 | H44: of:=IF((ROW() - [.$B$21] < 3);0;FLOOR(IFERROR(OFFSET([.$F44];-1*[.$B$21];0 );0) * [.$B$10])) -> 13 | I44: of:=SUM(INDEX([.H$1:.H$736];MAX(ROW()+(-1*[.$B$22])+1;3);1):INDEX([.H$1:.H$736];ROW();1)) -> 95 | J44: of:=IF([.I44] > [.$B$20];[.I44]-[.$B$20];0) -> 0 | K44: of:=IF([.J44] > 0; ROUND([.$B$23] *MIN([.J44];[.H44])); 0) -> 0 | L44: of:=IF((ROW() - [.$B$13] < 3);0;FLOOR(IFERROR(OFFSET([.$F44];-1*[.$B$13];0 );0) * [.$B$14])) -> 0 | M44: of:=SUM([.L$3:.L44]) -> 0
D45: of:=[.D44]+1 -> 2020-03-02T00:00:00.000 | F45: of:=IF([.G44] < [.$B$25];CEILING([.G44]*[.$B$3];1);0) -> 271 | G45: of:=IF([.G44] < [.$B$25];SUM([.F$3:.F45]);[.$B$25]) -> 2289 | H45: of:=IF((ROW() - [.$B$21] < 3);0;FLOOR(IFERROR(OFFSET([.$F45];-1*[.$B$21];0 );0) * [.$B$10])) -> 14 | I45: of:=SUM(INDEX([.H$1:.H$736];MAX(ROW()+(-1*[.$B$22])+1;3);1):INDEX([.H$1:.H$736];ROW();1)) -> 109 | J45: of:=IF([.I45] > [.$B$20];[.I45]-[.$B$20];0) -> 0 | K45: of:=IF([.J45] > 0; ROUND([.$B$23] *MIN([.J45];[.H45])); 0) -> 0 | L45: of:=IF((ROW() - [.$B$13] < 3);0;FLOOR(IFERROR(OFFSET([.$F45];-1*[.$B$13];0 );0) * [.$B$14])) -> 0 | M45: of:=SUM([.L$3:.L45]) -> 0
D46: of:=[.D45]+1 -> 2020-03-03T00:00:00.000 | F46: of:=IF([.G45] < [.$B$25];CEILING([.G45]*[.$B$3];1);0) -> 307 | G46: of:=IF([.G45] < [.$B$25];SUM([.F$3:.F46]);[.$B$25]) -> 2596 | H46: of:=IF((ROW() - [.$B$21] < 3);0;FLOOR(IFERROR(OFFSET([.$F46];-1*[.$B$21];0 );0) * [.$B$10])) -> 16 | I46: of:=SUM(INDEX([.H$1:.H$736];MAX(ROW()+(-1*[.$B$22])+1;3);1):INDEX([.H$1:.H$736];ROW();1)) -> 124 | J46: of:=IF([.I46] > [.$B$20];[.I46]-[.$B$20];0) -> 0 | K46: of:=IF([.J46] > 0; ROUND([.$B$23] *MIN([.J46];[.H46])); 0) -> 0 | L46: of:=IF((ROW() - [.$B$13] < 3);0;FLOOR(IFERROR(OFFSET([.$F46];-1*[.$B$13];0 );0) * [.$B$14])) -> 0 | M46: of:=SUM([.L$3:.L46]) -> 0
D47: of:=[.D46]+1 -> 2020-03-04T00:00:00.000 | F47: of:=IF([.G46] < [.$B$25];CEILING([.G46]*[.$B$3];1);0) -> 348 | G47: of:=IF([.G46] < [.$B$25];SUM([.F$3:.F47]);[.$B$25]) -> 2944 | H47: of:=IF((ROW() - [.$B$21] < 3);0;FLOOR(IFERROR(OFFSET([.$F47];-1*[.$B$21];0 );0) * [.$B$10])) -> 19 | I47: of:=SUM(INDEX([.H$1:.H$736];MAX(ROW()+(-1*[.$B$22])+1;3);1):INDEX([.H$1:.H$736];ROW();1)) -> 142 | J47: of:=IF([.I47] > [.$B$20];[.I47]-[.$B$20];0) -> 0 | K47: of:=IF([.J47] > 0; ROUND([.$B$23] *MIN([.J47];[.H47])); 0) -> 0 | L47: of:=IF((ROW() - [.$B$13] < 3);0;FLOOR(IFERROR(OFFSET([.$F47];-1*[.$B$13];0 );0) * [.$B$14])) -> 0 | M47: of:=SUM([.L$3:.L47]) -> 0
D48: of:=[.D47]+1 -> 2020-03-05T00:00:00.000 | F48: of:=IF([.G47] < [.$B$25];CEILING([.G47]*[.$B$3];1);0) -> 395 | G48: of:=IF([.G47] < [.$B$25];SUM([.F$3:.F48]);[.$B$25]) -> 3339 | H48: of:=IF((ROW() - [.$B$21] < 3);0;FLOOR(IFERROR(OFFSET([.$F48];-1*[.$B$21];0 );0) * [.$B$10])) -> 21 | I48: of:=SUM(INDEX([.H$1:.H$736];MAX(ROW()+(-1*[.$B$22])+1;3);1):INDEX([.H$1:.H$736];ROW();1)) -> 162 | J48: of:=IF([.I48] > [.$B$20];[.I48]-[.$B$20];0) -> 0 | K48: of:=IF([.J48] > 0; ROUND([.$B$23] *MIN([.J48];[.H48])); 0) -> 0 | L48: of:=IF((ROW() - [.$B$13] < 3);0;FLOOR(IFERROR(OFFSET([.$F48];-1*[.$B$13];0 );0) * [.$B$14])) -> 0 | M48: of:=SUM([.L$3:.L48]) -> 0
D49: of:=[.D48]+1 -> 2020-03-06T00:00:00.000 | F49: of:=IF([.G48] < [.$B$25];CEILING([.G48]*[.$B$3];1);0) -> 448 | G49: of:=IF([.G48] < [.$B$25];SUM([.F$3:.F49]);[.$B$25]) -> 3787 | H49: of:=IF((ROW() - [.$B$21] < 3);0;FLOOR(IFERROR(OFFSET([.$F49];-1*[.$B$21];0 );0) * [.$B$10])) -> 24 | I49: of:=SUM(INDEX([.H$1:.H$736];MAX(ROW()+(-1*[.$B$22])+1;3);1):INDEX([.H$1:.H$736];ROW();1)) -> 185 | J49: of:=IF([.I49] > [.$B$20];[.I49]-[.$B$20];0) -> 0 | K49: of:=IF([.J49] > 0; ROUND([.$B$23] *MIN([.J49];[.H49])); 0) -> 0 | L49: of:=IF((ROW() - [.$B$13] < 3);0;FLOOR(IFERROR(OFFSET([.$F49];-1*[.$B$13];0 );0) * [.$B$14])) -> 0 | M49: of:=SUM([.L$3:.L49]) -> 0
D50: of:=[.D49]+1 -> 2020-03-07T00:00:00.000 | F50: of:=IF([.G49] < [.$B$25];CEILING([.G49]*[.$B$3];1);0) -> 508 | G50: of:=IF([.G49] < [.$B$25];SUM([.F$3:.F50]);[.$B$25]) -> 4295 | H50: of:=IF((ROW() - [.$B$21] < 3);0;FLOOR(IFERROR(OFFSET([.$F50];-1*[.$B$21];0 );0) * [.$B$10])) -> 27 | I50: of:=SUM(INDEX([.H$1:.H$736];MAX(ROW()+(-1*[.$B$22])+1;3);1):INDEX([.H$1:.H$736];ROW();1)) -> 211 | J50: of:=IF([.I50] > [.$B$20];[.I50]-[.$B$20];0) -> 0 | K50: of:=IF([.J50] > 0; ROUND([.$B$23] *MIN([.J50];[.H50])); 0) -> 0 | L50: of:=IF((ROW() - [.$B$13] < 3);0;FLOOR(IFERROR(OFFSET([.$F50];-1*[.$B$13];0 );0) * [.$B$14])) -> 0 | M50: of:=SUM([.L$3:.L50]) -> 0
D51: of:=[.D50]+1 -> 2020-03-08T00:00:00.000 | F51: of:=IF([.G50] < [.$B$25];CEILING([.G50]*[.$B$3];1);0) -> 576 | G51: of:=IF([.G50] < [.$B$25];SUM([.F$3:.F51]);[.$B$25]) -> 4871 | H51: of:=IF((ROW() - [.$B$21] < 3);0;FLOOR(IFERROR(OFFSET([.$F51];-1*[.$B$21];0 );0) * [.$B$10])) -> 31 | I51: of:=SUM(INDEX([.H$1:.H$736];MAX(ROW()+(-1*[.$B$22])+1;3);1):INDEX([.H$1:.H$736];ROW();1)) -> 241 | J51: of:=IF([.I51] > [.$B$20];[.I51]-[.$B$20];0) -> 0 | K51: of:=IF([.J51] > 0; ROUND([.$B$23] *MIN([.J51];[.H51])); 0) -> 0 | L51: of:=IF((ROW() - [.$B$13] < 3);0;FLOOR(IFERROR(OFFSET([.$F51];-1*[.$B$13];0 );0) * [.$B$14])) -> 0 | M51: of:=SUM([.L$3:.L51]) -> 0
D52: of:=[.D51]+1 -> 2020-03-09T00:00:00.000 | F52: of:=IF([.G51] < [.$B$25];CEILING([.G51]*[.$B$3];1);0) -> 653 | G52: of:=IF([.G51] < [.$B$25];SUM([.F$3:.F52]);[.$B$25]) -> 5524 | H52: of:=IF((ROW() - [.$B$21] < 3);0;FLOOR(IFERROR(OFFSET([.$F52];-1*[.$B$21];0 );0) * [.$B$10])) -> 35 | I52: of:=SUM(INDEX([.H$1:.H$736];MAX(ROW()+(-1*[.$B$22])+1;3);1):INDEX([.H$1:.H$736];ROW();1)) -> 274 | J52: of:=IF([.I52] > [.$B$20];[.I52]-[.$B$20];0) -> 0 | K52: of:=IF([.J52] > 0; ROUND([.$B$23] *MIN([.J52];[.H52])); 0) -> 0 | L52: of:=IF((ROW() - [.$B$13] < 3);0;FLOOR(IFERROR(OFFSET([.$F52];-1*[.$B$13];0 );0) * [.$B$14])) -> 0 | M52: of:=SUM([.L$3:.L52]) -> 0
D53: of:=[.D52]+1 -> 2020-03-10T00:00:00.000 | F53: of:=IF([.G52] < [.$B$25];CEILING([.G52]*[.$B$3];1);0) -> 741 | G53: of:=IF([.G52] < [.$B$25];SUM([.F$3:.F53]);[.$B$25]) -> 6265 | H53: of:=IF((ROW() - [.$B$21] < 3);0;FLOOR(IFERROR(OFFSET([.$F53];-1*[.$B$21];0 );0) * [.$B$10])) -> 40 | I53: of:=SUM(INDEX([.H$1:.H$736];MAX(ROW()+(-1*[.$B$22])+1;3);1):INDEX([.H$1:.H$736];ROW();1)) -> 312 | J53: of:=IF([.I53] > [.$B$20];[.I53]-[.$B$20];0) -> 0 | K53: of:=IF([.J53] > 0; ROUND([.$B$23] *MIN([.J53];[.H53])); 0) -> 0 | L53: of:=IF((ROW() - [.$B$13] < 3);0;FLOOR(IFERROR(OFFSET([.$F53];-1*[.$B$13];0 );0) * [.$B$14])) -> 1 | M53: of:=SUM([.L$3:.L53]) -> 1
D54: of:=[.D53]+1 -> 2020-03-11T00:00:00.000 | F54: of:=IF([.G53] < [.$B$25];CEILING([.G53]*[.$B$3];1);0) -> 840 | G54: of:=IF([.G53] < [.$B$25];SUM([.F$3:.F54]);[.$B$25]) -> 7105 | H54: of:=IF((ROW() - [.$B$21] < 3);0;FLOOR(IFERROR(OFFSET([.$F54];-1*[.$B$21];0 );0) * [.$B$10])) -> 46 | I54: of:=SUM(INDEX([.H$1:.H$736];MAX(ROW()+(-1*[.$B$22])+1;3);1):INDEX([.H$1:.H$736];ROW();1)) -> 356 | J54: of:=IF([.I54] > [.$B$20];[.I54]-[.$B$20];0) -> 0 | K54: of:=IF([.J54] > 0; ROUND([.$B$23] *MIN([.J54];[.H54])); 0) -> 0 | L54: of:=IF((ROW() - [.$B$13] < 3);0;FLOOR(IFERROR(OFFSET([.$F54];-1*[.$B$13];0 );0) * [.$B$14])) -> 1 | M54: of:=SUM([.L$3:.L54]) -> 2
D55: of:=[.D54]+1 -> 2020-03-12T00:00:00.000 | F55: of:=IF([.G54] < [.$B$25];CEILING([.G54]*[.$B$3];1);0) -> 953 | G55: of:=IF([.G54] < [.$B$25];SUM([.F$3:.F55]);[.$B$25]) -> 8058 | H55: of:=IF((ROW() - [.$B$21] < 3);0;FLOOR(IFERROR(OFFSET([.$F55];-1*[.$B$21];0 );0) * [.$B$10])) -> 52 | I55: of:=SUM(INDEX([.H$1:.H$736];MAX(ROW()+(-1*[.$B$22])+1;3);1):INDEX([.H$1:.H$736];ROW();1)) -> 406 | J55: of:=IF([.I55] > [.$B$20];[.I55]-[.$B$20];0) -> 0 | K55: of:=IF([.J55] > 0; ROUND([.$B$23] *MIN([.J55];[.H55])); 0) -> 0 | L55: of:=IF((ROW() - [.$B$13] < 3);0;FLOOR(IFERROR(OFFSET([.$F55];-1*[.$B$13];0 );0) * [.$B$14])) -> 1 | M55: of:=SUM([.L$3:.L55]) -> 3
D56: of:=[.D55]+1 -> 2020-03-13T00:00:00.000 | F56: of:=IF([.G55] < [.$B$25];CEILING([.G55]*[.$B$3];1);0) -> 1080 | G56: of:=IF([.G55] < [.$B$25];SUM([.F$3:.F56]);[.$B$25]) -> 9138 | H56: of:=IF((ROW() - [.$B$21] < 3);0;FLOOR(IFERROR(OFFSET([.$F56];-1*[.$B$21];0 );0) * [.$B$10])) -> 59 | I56: of:=SUM(INDEX([.H$1:.H$736];MAX(ROW()+(-1*[.$B$22])+1;3);1):INDEX([.H$1:.H$736];ROW();1)) -> 462 | J56: of:=IF([.I56] > [.$B$20];[.I56]-[.$B$20];0) -> 0 | K56: of:=IF([.J56] > 0; ROUND([.$B$23] *MIN([.J56];[.H56])); 0) -> 0 | L56: of:=IF((ROW() - [.$B$13] < 3);0;FLOOR(IFERROR(OFFSET([.$F56];-1*[.$B$13];0 );0) * [.$B$14])) -> 1 | M56: of:=SUM([.L$3:.L56]) -> 4
D57: of:=[.D56]+1 -> 2020-03-14T00:00:00.000 | F57: of:=IF([.G56] < [.$B$25];CEILING([.G56]*[.$B$3];1);0) -> 1225 | G57: of:=IF([.G56] < [.$B$25];SUM([.F$3:.F57]);[.$B$25]) -> 10363 | H57: of:=IF((ROW() - [.$B$21] < 3);0;FLOOR(IFERROR(OFFSET([.$F57];-1*[.$B$21];0 );0) * [.$B$10])) -> 67 | I57: of:=SUM(INDEX([.H$1:.H$736];MAX(ROW()+(-1*[.$B$22])+1;3);1):INDEX([.H$1:.H$736];ROW();1)) -> 526 | J57: of:=IF([.I57] > [.$B$20];[.I57]-[.$B$20];0) -> 0 | K57: of:=IF([.J57] > 0; ROUND([.$B$23] *MIN([.J57];[.H57])); 0) -> 0 | L57: of:=IF((ROW() - [.$B$13] < 3);0;FLOOR(IFERROR(OFFSET([.$F57];-1*[.$B$13];0 );0) * [.$B$14])) -> 1 | M57: of:=SUM([.L$3:.L57]) -> 5
D58: of:=[.D57]+1 -> 2020-03-15T00:00:00.000 | F58: of:=IF([.G57] < [.$B$25];CEILING([.G57]*[.$B$3];1);0) -> 1389 | G58: of:=IF([.G57] < [.$B$25];SUM([.F$3:.F58]);[.$B$25]) -> 11752 | H58: of:=IF((ROW() - [.$B$21] < 3);0;FLOOR(IFERROR(OFFSET([.$F58];-1*[.$B$21];0 );0) * [.$B$10])) -> 76 | I58: of:=SUM(INDEX([.H$1:.H$736];MAX(ROW()+(-1*[.$B$22])+1;3);1):INDEX([.H$1:.H$736];ROW();1)) -> 598 | J58: of:=IF([.I58] > [.$B$20];[.I58]-[.$B$20];0) -> 0 | K58: of:=IF([.J58] > 0; ROUND([.$B$23] *MIN([.J58];[.H58])); 0) -> 0 | L58: of:=IF((ROW() - [.$B$13] < 3);0;FLOOR(IFERROR(OFFSET([.$F58];-1*[.$B$13];0 );0) * [.$B$14])) -> 1 | M58: of:=SUM([.L$3:.L58]) -> 6
D59: of:=[.D58]+1 -> 2020-03-16T00:00:00.000 | F59: of:=IF([.G58] < [.$B$25];CEILING([.G58]*[.$B$3];1);0) -> 1575 | G59: of:=IF([.G58] < [.$B$25];SUM([.F$3:.F59]);[.$B$25]) -> 13327 | H59: of:=IF((ROW() - [.$B$21] < 3);0;FLOOR(IFERROR(OFFSET([.$F59];-1*[.$B$21];0 );0) * [.$B$10])) -> 86 | I59: of:=SUM(INDEX([.H$1:.H$736];MAX(ROW()+(-1*[.$B$22])+1;3);1):INDEX([.H$1:.H$736];ROW();1)) -> 680 | J59: of:=IF([.I59] > [.$B$20];[.I59]-[.$B$20];0) -> 0 | K59: of:=IF([.J59] > 0; ROUND([.$B$23] *MIN([.J59];[.H59])); 0) -> 0 | L59: of:=IF((ROW() - [.$B$13] < 3);0;FLOOR(IFERROR(OFFSET([.$F59];-1*[.$B$13];0 );0) * [.$B$14])) -> 2 | M59: of:=SUM([.L$3:.L59]) -> 8
D60: of:=[.D59]+1 -> 2020-03-17T00:00:00.000 | F60: of:=IF([.G59] < [.$B$25];CEILING([.G59]*[.$B$3];1);0) -> 1786 | G60: of:=IF([.G59] < [.$B$25];SUM([.F$3:.F60]);[.$B$25]) -> 15113 | H60: of:=IF((ROW() - [.$B$21] < 3);0;FLOOR(IFERROR(OFFSET([.$F60];-1*[.$B$21];0 );0) * [.$B$10])) -> 97 | I60: of:=SUM(INDEX([.H$1:.H$736];MAX(ROW()+(-1*[.$B$22])+1;3);1):INDEX([.H$1:.H$736];ROW();1)) -> 772 | J60: of:=IF([.I60] > [.$B$20];[.I60]-[.$B$20];0) -> 0 | K60: of:=IF([.J60] > 0; ROUND([.$B$23] *MIN([.J60];[.H60])); 0) -> 0 | L60: of:=IF((ROW() - [.$B$13] < 3);0;FLOOR(IFERROR(OFFSET([.$F60];-1*[.$B$13];0 );0) * [.$B$14])) -> 2 | M60: of:=SUM([.L$3:.L60]) -> 10
D61: of:=[.D60]+1 -> 2020-03-18T00:00:00.000 | F61: of:=IF([.G60] < [.$B$25];CEILING([.G60]*[.$B$3];1);0) -> 2026 | G61: of:=IF([.G60] < [.$B$25];SUM([.F$3:.F61]);[.$B$25]) -> 17139 | H61: of:=IF((ROW() - [.$B$21] < 3);0;FLOOR(IFERROR(OFFSET([.$F61];-1*[.$B$21];0 );0) * [.$B$10])) -> 111 | I61: of:=SUM(INDEX([.H$1:.H$736];MAX(ROW()+(-1*[.$B$22])+1;3);1):INDEX([.H$1:.H$736];ROW();1)) -> 877 | J61: of:=IF([.I61] > [.$B$20];[.I61]-[.$B$20];0) -> 0 | K61: of:=IF([.J61] > 0; ROUND([.$B$23] *MIN([.J61];[.H61])); 0) -> 0 | L61: of:=IF((ROW() - [.$B$13] < 3);0;FLOOR(IFERROR(OFFSET([.$F61];-1*[.$B$13];0 );0) * [.$B$14])) -> 2 | M61: of:=SUM([.L$3:.L61]) -> 12
D62: of:=[.D61]+1 -> 2020-03-19T00:00:00.000 | F62: of:=IF([.G61] < [.$B$25];CEILING([.G61]*[.$B$3];1);0) -> 2297 | G62: of:=IF([.G61] < [.$B$25];SUM([.F$3:.F62]);[.$B$25]) -> 19436 | H62: of:=IF((ROW() - [.$B$21] < 3);0;FLOOR(IFERROR(OFFSET([.$F62];-1*[.$B$21];0 );0) * [.$B$10])) -> 125 | I62: of:=SUM(INDEX([.H$1:.H$736];MAX(ROW()+(-1*[.$B$22])+1;3);1):INDEX([.H$1:.H$736];ROW();1)) -> 996 | J62: of:=IF([.I62] > [.$B$20];[.I62]-[.$B$20];0) -> 0 | K62: of:=IF([.J62] > 0; ROUND([.$B$23] *MIN([.J62];[.H62])); 0) -> 0 | L62: of:=IF((ROW() - [.$B$13] < 3);0;FLOOR(IFERROR(OFFSET([.$F62];-1*[.$B$13];0 );0) * [.$B$14])) -> 3 | M62: of:=SUM([.L$3:.L62]) -> 15
D63: of:=[.D62]+1 -> 2020-03-20T00:00:00.000 | F63: of:=IF([.G62] < [.$B$25];CEILING([.G62]*[.$B$3];1);0) -> 2605 | G63: of:=IF([.G62] < [.$B$25];SUM([.F$3:.F63]);[.$B$25]) -> 22041 | H63: of:=IF((ROW() - [.$B$21] < 3);0;FLOOR(IFERROR(OFFSET([.$F63];-1*[.$B$21];0 );0) * [.$B$10])) -> 142 | I63: of:=SUM(INDEX([.H$1:.H$736];MAX(ROW()+(-1*[.$B$22])+1;3);1):INDEX([.H$1:.H$736];ROW();1)) -> 1131 | J63: of:=IF([.I63] > [.$B$20];[.I63]-[.$B$20];0) -> 0 | K63: of:=IF([.J63] > 0; ROUND([.$B$23] *MIN([.J63];[.H63])); 0) -> 0 | L63: of:=IF((ROW() - [.$B$13] < 3);0;FLOOR(IFERROR(OFFSET([.$F63];-1*[.$B$13];0 );0) * [.$B$14])) -> 3 | M63: of:=SUM([.L$3:.L63]) -> 18
D64: of:=[.D63]+1 -> 2020-03-21T00:00:00.000 | F64: of:=IF([.G63] < [.$B$25];CEILING([.G63]*[.$B$3];1);0) -> 2954 | G64: of:=IF([.G63] < [.$B$25];SUM([.F$3:.F64]);[.$B$25]) -> 24995 | H64: of:=IF((ROW() - [.$B$21] < 3);0;FLOOR(IFERROR(OFFSET([.$F64];-1*[.$B$21];0 );0) * [.$B$10])) -> 162 | I64: of:=SUM(INDEX([.H$1:.H$736];MAX(ROW()+(-1*[.$B$22])+1;3);1):INDEX([.H$1:.H$736];ROW();1)) -> 1284 | J64: of:=IF([.I64] > [.$B$20];[.I64]-[.$B$20];0) -> 0 | K64: of:=IF([.J64] > 0; ROUND([.$B$23] *MIN([.J64];[.H64])); 0) -> 0 | L64: of:=IF((ROW() - [.$B$13] < 3);0;FLOOR(IFERROR(OFFSET([.$F64];-1*[.$B$13];0 );0) * [.$B$14])) -> 4 | M64: of:=SUM([.L$3:.L64]) -> 22
D65: of:=[.D64]+1 -> 2020-03-22T00:00:00.000 | F65: of:=IF([.G64] < [.$B$25];CEILING([.G64]*[.$B$3];1);0) -> 3350 | G65: of:=IF([.G64] < [.$B$25];SUM([.F$3:.F65]);[.$B$25]) -> 28345 | H65: of:=IF((ROW() - [.$B$21] < 3);0;FLOOR(IFERROR(OFFSET([.$F65];-1*[.$B$21];0 );0) * [.$B$10])) -> 183 | I65: of:=SUM(INDEX([.H$1:.H$736];MAX(ROW()+(-1*[.$B$22])+1;3);1):INDEX([.H$1:.H$736];ROW();1)) -> 1457 | J65: of:=IF([.I65] > [.$B$20];[.I65]-[.$B$20];0) -> 0 | K65: of:=IF([.J65] > 0; ROUND([.$B$23] *MIN([.J65];[.H65])); 0) -> 0 | L65: of:=IF((ROW() - [.$B$13] < 3);0;FLOOR(IFERROR(OFFSET([.$F65];-1*[.$B$13];0 );0) * [.$B$14])) -> 4 | M65: of:=SUM([.L$3:.L65]) -> 26
D66: of:=[.D65]+1 -> 2020-03-23T00:00:00.000 | F66: of:=IF([.G65] < [.$B$25];CEILING([.G65]*[.$B$3];1);0) -> 3799 | G66: of:=IF([.G65] < [.$B$25];SUM([.F$3:.F66]);[.$B$25]) -> 32144 | H66: of:=IF((ROW() - [.$B$21] < 3);0;FLOOR(IFERROR(OFFSET([.$F66];-1*[.$B$21];0 );0) * [.$B$10])) -> 208 | I66: of:=SUM(INDEX([.H$1:.H$736];MAX(ROW()+(-1*[.$B$22])+1;3);1):INDEX([.H$1:.H$736];ROW();1)) -> 1654 | J66: of:=IF([.I66] > [.$B$20];[.I66]-[.$B$20];0) -> 0 | K66: of:=IF([.J66] > 0; ROUND([.$B$23] *MIN([.J66];[.H66])); 0) -> 0 | L66: of:=IF((ROW() - [.$B$13] < 3);0;FLOOR(IFERROR(OFFSET([.$F66];-1*[.$B$13];0 );0) * [.$B$14])) -> 5 | M66: of:=SUM([.L$3:.L66]) -> 31
D67: of:=[.D66]+1 -> 2020-03-24T00:00:00.000 | F67: of:=IF([.G66] < [.$B$25];CEILING([.G66]*[.$B$3];1);0) -> 4308 | G67: of:=IF([.G66] < [.$B$25];SUM([.F$3:.F67]);[.$B$25]) -> 36452 | H67: of:=IF((ROW() - [.$B$21] < 3);0;FLOOR(IFERROR(OFFSET([.$F67];-1*[.$B$21];0 );0) * [.$B$10])) -> 236 | I67: of:=SUM(INDEX([.H$1:.H$736];MAX(ROW()+(-1*[.$B$22])+1;3);1):INDEX([.H$1:.H$736];ROW();1)) -> 1877 | J67: of:=IF([.I67] > [.$B$20];[.I67]-[.$B$20];0) -> 0 | K67: of:=IF([.J67] > 0; ROUND([.$B$23] *MIN([.J67];[.H67])); 0) -> 0 | L67: of:=IF((ROW() - [.$B$13] < 3);0;FLOOR(IFERROR(OFFSET([.$F67];-1*[.$B$13];0 );0) * [.$B$14])) -> 5 | M67: of:=SUM([.L$3:.L67]) -> 36
D68: of:=[.D67]+1 -> 2020-03-25T00:00:00.000 | F68: of:=IF([.G67] < [.$B$25];CEILING([.G67]*[.$B$3];1);0) -> 4885 | G68: of:=IF([.G67] < [.$B$25];SUM([.F$3:.F68]);[.$B$25]) -> 41337 | H68: of:=IF((ROW() - [.$B$21] < 3);0;FLOOR(IFERROR(OFFSET([.$F68];-1*[.$B$21];0 );0) * [.$B$10])) -> 267 | I68: of:=SUM(INDEX([.H$1:.H$736];MAX(ROW()+(-1*[.$B$22])+1;3);1):INDEX([.H$1:.H$736];ROW();1)) -> 2130 | J68: of:=IF([.I68] > [.$B$20];[.I68]-[.$B$20];0) -> 0 | K68: of:=IF([.J68] > 0; ROUND([.$B$23] *MIN([.J68];[.H68])); 0) -> 0 | L68: of:=IF((ROW() - [.$B$13] < 3);0;FLOOR(IFERROR(OFFSET([.$F68];-1*[.$B$13];0 );0) * [.$B$14])) -> 6 | M68: of:=SUM([.L$3:.L68]) -> 42
D69: of:=[.D68]+1 -> 2020-03-26T00:00:00.000 | F69: of:=IF([.G68] < [.$B$25];CEILING([.G68]*[.$B$3];1);0) -> 5540 | G69: of:=IF([.G68] < [.$B$25];SUM([.F$3:.F69]);[.$B$25]) -> 46877 | H69: of:=IF((ROW() - [.$B$21] < 3);0;FLOOR(IFERROR(OFFSET([.$F69];-1*[.$B$21];0 );0) * [.$B$10])) -> 303 | I69: of:=SUM(INDEX([.H$1:.H$736];MAX(ROW()+(-1*[.$B$22])+1;3);1):INDEX([.H$1:.H$736];ROW();1)) -> 2417 | J69: of:=IF([.I69] > [.$B$20];[.I69]-[.$B$20];0) -> 0 | K69: of:=IF([.J69] > 0; ROUND([.$B$23] *MIN([.J69];[.H69])); 0) -> 0 | L69: of:=IF((ROW() - [.$B$13] < 3);0;FLOOR(IFERROR(OFFSET([.$F69];-1*[.$B$13];0 );0) * [.$B$14])) -> 7 | M69: of:=SUM([.L$3:.L69]) -> 49
D70: of:=[.D69]+1 -> 2020-03-27T00:00:00.000 | F70: of:=IF([.G69] < [.$B$25];CEILING([.G69]*[.$B$3];1);0) -> 6282 | G70: of:=IF([.G69] < [.$B$25];SUM([.F$3:.F70]);[.$B$25]) -> 53159 | H70: of:=IF((ROW() - [.$B$21] < 3);0;FLOOR(IFERROR(OFFSET([.$F70];-1*[.$B$21];0 );0) * [.$B$10])) -> 344 | I70: of:=SUM(INDEX([.H$1:.H$736];MAX(ROW()+(-1*[.$B$22])+1;3);1):INDEX([.H$1:.H$736];ROW();1)) -> 2742 | J70: of:=IF([.I70] > [.$B$20];[.I70]-[.$B$20];0) -> 0 | K70: of:=IF([.J70] > 0; ROUND([.$B$23] *MIN([.J70];[.H70])); 0) -> 0 | L70: of:=IF((ROW() - [.$B$13] < 3);0;FLOOR(IFERROR(OFFSET([.$F70];-1*[.$B$13];0 );0) * [.$B$14])) -> 8 | M70: of:=SUM([.L$3:.L70]) -> 57
D71: of:=[.D70]+1 -> 2020-03-28T00:00:00.000 | F71: of:=IF([.G70] < [.$B$25];CEILING([.G70]*[.$B$3];1);0) -> 7124 | G71: of:=IF([.G70] < [.$B$25];SUM([.F$3:.F71]);[.$B$25]) -> 60283 | H71: of:=IF((ROW() - [.$B$21] < 3);0;FLOOR(IFERROR(OFFSET([.$F71];-1*[.$B$21];0 );0) * [.$B$10])) -> 390 | I71: of:=SUM(INDEX([.H$1:.H$736];MAX(ROW()+(-1*[.$B$22])+1;3);1):INDEX([.H$1:.H$736];ROW();1)) -> 3111 | J71: of:=IF([.I71] > [.$B$20];[.I71]-[.$B$20];0) -> 0 | K71: of:=IF([.J71] > 0; ROUND([.$B$23] *MIN([.J71];[.H71])); 0) -> 0 | L71: of:=IF((ROW() - [.$B$13] < 3);0;FLOOR(IFERROR(OFFSET([.$F71];-1*[.$B$13];0 );0) * [.$B$14])) -> 9 | M71: of:=SUM([.L$3:.L71]) -> 66
D72: of:=[.D71]+1 -> 2020-03-29T00:00:00.000 | F72: of:=IF([.G71] < [.$B$25];CEILING([.G71]*[.$B$3];1);0) -> 8078 | G72: of:=IF([.G71] < [.$B$25];SUM([.F$3:.F72]);[.$B$25]) -> 68361 | H72: of:=IF((ROW() - [.$B$21] < 3);0;FLOOR(IFERROR(OFFSET([.$F72];-1*[.$B$21];0 );0) * [.$B$10])) -> 442 | I72: of:=SUM(INDEX([.H$1:.H$736];MAX(ROW()+(-1*[.$B$22])+1;3);1):INDEX([.H$1:.H$736];ROW();1)) -> 3529 | J72: of:=IF([.I72] > [.$B$20];[.I72]-[.$B$20];0) -> 0 | K72: of:=IF([.J72] > 0; ROUND([.$B$23] *MIN([.J72];[.H72])); 0) -> 0 | L72: of:=IF((ROW() - [.$B$13] < 3);0;FLOOR(IFERROR(OFFSET([.$F72];-1*[.$B$13];0 );0) * [.$B$14])) -> 11 | M72: of:=SUM([.L$3:.L72]) -> 77
D73: of:=[.D72]+1 -> 2020-03-30T00:00:00.000 | F73: of:=IF([.G72] < [.$B$25];CEILING([.G72]*[.$B$3];1);0) -> 9161 | G73: of:=IF([.G72] < [.$B$25];SUM([.F$3:.F73]);[.$B$25]) -> 77522 | H73: of:=IF((ROW() - [.$B$21] < 3);0;FLOOR(IFERROR(OFFSET([.$F73];-1*[.$B$21];0 );0) * [.$B$10])) -> 502 | I73: of:=SUM(INDEX([.H$1:.H$736];MAX(ROW()+(-1*[.$B$22])+1;3);1):INDEX([.H$1:.H$736];ROW();1)) -> 4004 | J73: of:=IF([.I73] > [.$B$20];[.I73]-[.$B$20];0) -> 0 | K73: of:=IF([.J73] > 0; ROUND([.$B$23] *MIN([.J73];[.H73])); 0) -> 0 | L73: of:=IF((ROW() - [.$B$13] < 3);0;FLOOR(IFERROR(OFFSET([.$F73];-1*[.$B$13];0 );0) * [.$B$14])) -> 12 | M73: of:=SUM([.L$3:.L73]) -> 89
D74: of:=[.D73]+1 -> 2020-03-31T00:00:00.000 | F74: of:=IF([.G73] < [.$B$25];CEILING([.G73]*[.$B$3];1);0) -> 10388 | G74: of:=IF([.G73] < [.$B$25];SUM([.F$3:.F74]);[.$B$25]) -> 87910 | H74: of:=IF((ROW() - [.$B$21] < 3);0;FLOOR(IFERROR(OFFSET([.$F74];-1*[.$B$21];0 );0) * [.$B$10])) -> 569 | I74: of:=SUM(INDEX([.H$1:.H$736];MAX(ROW()+(-1*[.$B$22])+1;3);1):INDEX([.H$1:.H$736];ROW();1)) -> 4542 | J74: of:=IF([.I74] > [.$B$20];[.I74]-[.$B$20];0) -> 0 | K74: of:=IF([.J74] > 0; ROUND([.$B$23] *MIN([.J74];[.H74])); 0) -> 0 | L74: of:=IF((ROW() - [.$B$13] < 3);0;FLOOR(IFERROR(OFFSET([.$F74];-1*[.$B$13];0 );0) * [.$B$14])) -> 14 | M74: of:=SUM([.L$3:.L74]) -> 103
D75: of:=[.D74]+1 -> 2020-04-01T00:00:00.000 | F75: of:=IF([.G74] < [.$B$25];CEILING([.G74]*[.$B$3];1);0) -> 11780 | G75: of:=IF([.G74] < [.$B$25];SUM([.F$3:.F75]);[.$B$25]) -> 99690 | H75: of:=IF((ROW() - [.$B$21] < 3);0;FLOOR(IFERROR(OFFSET([.$F75];-1*[.$B$21];0 );0) * [.$B$10])) -> 645 | I75: of:=SUM(INDEX([.H$1:.H$736];MAX(ROW()+(-1*[.$B$22])+1;3);1):INDEX([.H$1:.H$736];ROW();1)) -> 5152 | J75: of:=IF([.I75] > [.$B$20];[.I75]-[.$B$20];0) -> 0 | K75: of:=IF([.J75] > 0; ROUND([.$B$23] *MIN([.J75];[.H75])); 0) -> 0 | L75: of:=IF((ROW() - [.$B$13] < 3);0;FLOOR(IFERROR(OFFSET([.$F75];-1*[.$B$13];0 );0) * [.$B$14])) -> 16 | M75: of:=SUM([.L$3:.L75]) -> 119
D76: of:=[.D75]+1 -> 2020-04-02T00:00:00.000 | F76: of:=IF([.G75] < [.$B$25];CEILING([.G75]*[.$B$3];1);0) -> 13359 | G76: of:=IF([.G75] < [.$B$25];SUM([.F$3:.F76]);[.$B$25]) -> 113049 | H76: of:=IF((ROW() - [.$B$21] < 3);0;FLOOR(IFERROR(OFFSET([.$F76];-1*[.$B$21];0 );0) * [.$B$10])) -> 732 | I76: of:=SUM(INDEX([.H$1:.H$736];MAX(ROW()+(-1*[.$B$22])+1;3);1):INDEX([.H$1:.H$736];ROW();1)) -> 5844 | J76: of:=IF([.I76] > [.$B$20];[.I76]-[.$B$20];0) -> 0 | K76: of:=IF([.J76] > 0; ROUND([.$B$23] *MIN([.J76];[.H76])); 0) -> 0 | L76: of:=IF((ROW() - [.$B$13] < 3);0;FLOOR(IFERROR(OFFSET([.$F76];-1*[.$B$13];0 );0) * [.$B$14])) -> 18 | M76: of:=SUM([.L$3:.L76]) -> 137
D77: of:=[.D76]+1 -> 2020-04-03T00:00:00.000 | F77: of:=IF([.G76] < [.$B$25];CEILING([.G76]*[.$B$3];1);0) -> 15149 | G77: of:=IF([.G76] < [.$B$25];SUM([.F$3:.F77]);[.$B$25]) -> 128198 | H77: of:=IF((ROW() - [.$B$21] < 3);0;FLOOR(IFERROR(OFFSET([.$F77];-1*[.$B$21];0 );0) * [.$B$10])) -> 830 | I77: of:=SUM(INDEX([.H$1:.H$736];MAX(ROW()+(-1*[.$B$22])+1;3);1):INDEX([.H$1:.H$736];ROW();1)) -> 6628 | J77: of:=IF([.I77] > [.$B$20];[.I77]-[.$B$20];0) -> 0 | K77: of:=IF([.J77] > 0; ROUND([.$B$23] *MIN([.J77];[.H77])); 0) -> 0 | L77: of:=IF((ROW() - [.$B$13] < 3);0;FLOOR(IFERROR(OFFSET([.$F77];-1*[.$B$13];0 );0) * [.$B$14])) -> 21 | M77: of:=SUM([.L$3:.L77]) -> 158
D78: of:=[.D77]+1 -> 2020-04-04T00:00:00.000 | F78: of:=IF([.G77] < [.$B$25];CEILING([.G77]*[.$B$3];1);0) -> 17179 | G78: of:=IF([.G77] < [.$B$25];SUM([.F$3:.F78]);[.$B$25]) -> 145377 | H78: of:=IF((ROW() - [.$B$21] < 3);0;FLOOR(IFERROR(OFFSET([.$F78];-1*[.$B$21];0 );0) * [.$B$10])) -> 941 | I78: of:=SUM(INDEX([.H$1:.H$736];MAX(ROW()+(-1*[.$B$22])+1;3);1):INDEX([.H$1:.H$736];ROW();1)) -> 7517 | J78: of:=IF([.I78] > [.$B$20];[.I78]-[.$B$20];0) -> 0 | K78: of:=IF([.J78] > 0; ROUND([.$B$23] *MIN([.J78];[.H78])); 0) -> 0 | L78: of:=IF((ROW() - [.$B$13] < 3);0;FLOOR(IFERROR(OFFSET([.$F78];-1*[.$B$13];0 );0) * [.$B$14])) -> 23 | M78: of:=SUM([.L$3:.L78]) -> 181
D79: of:=[.D78]+1 -> 2020-04-05T00:00:00.000 | F79: of:=IF([.G78] < [.$B$25];CEILING([.G78]*[.$B$3];1);0) -> 19481 | G79: of:=IF([.G78] < [.$B$25];SUM([.F$3:.F79]);[.$B$25]) -> 164858 | H79: of:=IF((ROW() - [.$B$21] < 3);0;FLOOR(IFERROR(OFFSET([.$F79];-1*[.$B$21];0 );0) * [.$B$10])) -> 1067 | I79: of:=SUM(INDEX([.H$1:.H$736];MAX(ROW()+(-1*[.$B$22])+1;3);1):INDEX([.H$1:.H$736];ROW();1)) -> 8525 | J79: of:=IF([.I79] > [.$B$20];[.I79]-[.$B$20];0) -> 0 | K79: of:=IF([.J79] > 0; ROUND([.$B$23] *MIN([.J79];[.H79])); 0) -> 0 | L79: of:=IF((ROW() - [.$B$13] < 3);0;FLOOR(IFERROR(OFFSET([.$F79];-1*[.$B$13];0 );0) * [.$B$14])) -> 27 | M79: of:=SUM([.L$3:.L79]) -> 208
D80: of:=[.D79]+1 -> 2020-04-06T00:00:00.000 | F80: of:=IF([.G79] < [.$B$25];CEILING([.G79]*[.$B$3];1);0) -> 22091 | G80: of:=IF([.G79] < [.$B$25];SUM([.F$3:.F80]);[.$B$25]) -> 186949 | H80: of:=IF((ROW() - [.$B$21] < 3);0;FLOOR(IFERROR(OFFSET([.$F80];-1*[.$B$21];0 );0) * [.$B$10])) -> 1211 | I80: of:=SUM(INDEX([.H$1:.H$736];MAX(ROW()+(-1*[.$B$22])+1;3);1):INDEX([.H$1:.H$736];ROW();1)) -> 9669 | J80: of:=IF([.I80] > [.$B$20];[.I80]-[.$B$20];0) -> 0 | K80: of:=IF([.J80] > 0; ROUND([.$B$23] *MIN([.J80];[.H80])); 0) -> 0 | L80: of:=IF((ROW() - [.$B$13] < 3);0;FLOOR(IFERROR(OFFSET([.$F80];-1*[.$B$13];0 );0) * [.$B$14])) -> 30 | M80: of:=SUM([.L$3:.L80]) -> 238
D81: of:=[.D80]+1 -> 2020-04-07T00:00:00.000 | F81: of:=IF([.G80] < [.$B$25];CEILING([.G80]*[.$B$3];1);0) -> 25052 | G81: of:=IF([.G80] < [.$B$25];SUM([.F$3:.F81]);[.$B$25]) -> 212001 | H81: of:=IF((ROW() - [.$B$21] < 3);0;FLOOR(IFERROR(OFFSET([.$F81];-1*[.$B$21];0 );0) * [.$B$10])) -> 1373 | I81: of:=SUM(INDEX([.H$1:.H$736];MAX(ROW()+(-1*[.$B$22])+1;3);1):INDEX([.H$1:.H$736];ROW();1)) -> 10966 | J81: of:=IF([.I81] > [.$B$20];[.I81]-[.$B$20];0) -> 0 | K81: of:=IF([.J81] > 0; ROUND([.$B$23] *MIN([.J81];[.H81])); 0) -> 0 | L81: of:=IF((ROW() - [.$B$13] < 3);0;FLOOR(IFERROR(OFFSET([.$F81];-1*[.$B$13];0 );0) * [.$B$14])) -> 34 | M81: of:=SUM([.L$3:.L81]) -> 272
D82: of:=[.D81]+1 -> 2020-04-08T00:00:00.000 | F82: of:=IF([.G81] < [.$B$25];CEILING([.G81]*[.$B$3];1);0) -> 28409 | G82: of:=IF([.G81] < [.$B$25];SUM([.F$3:.F82]);[.$B$25]) -> 240410 | H82: of:=IF((ROW() - [.$B$21] < 3);0;FLOOR(IFERROR(OFFSET([.$F82];-1*[.$B$21];0 );0) * [.$B$10])) -> 1557 | I82: of:=SUM(INDEX([.H$1:.H$736];MAX(ROW()+(-1*[.$B$22])+1;3);1):INDEX([.H$1:.H$736];ROW();1)) -> 12437 | J82: of:=IF([.I82] > [.$B$20];[.I82]-[.$B$20];0) -> 0 | K82: of:=IF([.J82] > 0; ROUND([.$B$23] *MIN([.J82];[.H82])); 0) -> 0 | L82: of:=IF((ROW() - [.$B$13] < 3);0;FLOOR(IFERROR(OFFSET([.$F82];-1*[.$B$13];0 );0) * [.$B$14])) -> 39 | M82: of:=SUM([.L$3:.L82]) -> 311
D83: of:=[.D82]+1 -> 2020-04-09T00:00:00.000 | F83: of:=IF([.G82] < [.$B$25];CEILING([.G82]*[.$B$3];1);0) -> 32215 | G83: of:=IF([.G82] < [.$B$25];SUM([.F$3:.F83]);[.$B$25]) -> 272625 | H83: of:=IF((ROW() - [.$B$21] < 3);0;FLOOR(IFERROR(OFFSET([.$F83];-1*[.$B$21];0 );0) * [.$B$10])) -> 1765 | I83: of:=SUM(INDEX([.H$1:.H$736];MAX(ROW()+(-1*[.$B$22])+1;3);1):INDEX([.H$1:.H$736];ROW();1)) -> 14105 | J83: of:=IF([.I83] > [.$B$20];[.I83]-[.$B$20];0) -> 0 | K83: of:=IF([.J83] > 0; ROUND([.$B$23] *MIN([.J83];[.H83])); 0) -> 0 | L83: of:=IF((ROW() - [.$B$13] < 3);0;FLOOR(IFERROR(OFFSET([.$F83];-1*[.$B$13];0 );0) * [.$B$14])) -> 44 | M83: of:=SUM([.L$3:.L83]) -> 355
D84: of:=[.D83]+1 -> 2020-04-10T00:00:00.000 | F84: of:=IF([.G83] < [.$B$25];CEILING([.G83]*[.$B$3];1);0) -> 36532 | G84: of:=IF([.G83] < [.$B$25];SUM([.F$3:.F84]);[.$B$25]) -> 309157 | H84: of:=IF((ROW() - [.$B$21] < 3);0;FLOOR(IFERROR(OFFSET([.$F84];-1*[.$B$21];0 );0) * [.$B$10])) -> 2002 | I84: of:=SUM(INDEX([.H$1:.H$736];MAX(ROW()+(-1*[.$B$22])+1;3);1):INDEX([.H$1:.H$736];ROW();1)) -> 15996 | J84: of:=IF([.I84] > [.$B$20];[.I84]-[.$B$20];0) -> 0 | K84: of:=IF([.J84] > 0; ROUND([.$B$23] *MIN([.J84];[.H84])); 0) -> 0 | L84: of:=IF((ROW() - [.$B$13] < 3);0;FLOOR(IFERROR(OFFSET([.$F84];-1*[.$B$13];0 );0) * [.$B$14])) -> 50 | M84: of:=SUM([.L$3:.L84]) -> 405
D85: of:=[.D84]+1 -> 2020-04-11T00:00:00.000 | F85: of:=IF([.G84] < [.$B$25];CEILING([.G84]*[.$B$3];1);0) -> 41428 | G85: of:=IF([.G84] < [.$B$25];SUM([.F$3:.F85]);[.$B$25]) -> 350585 | H85: of:=IF((ROW() - [.$B$21] < 3);0;FLOOR(IFERROR(OFFSET([.$F85];-1*[.$B$21];0 );0) * [.$B$10])) -> 2271 | I85: of:=SUM(INDEX([.H$1:.H$736];MAX(ROW()+(-1*[.$B$22])+1;3);1):INDEX([.H$1:.H$736];ROW();1)) -> 18142 | J85: of:=IF([.I85] > [.$B$20];[.I85]-[.$B$20];0) -> 0 | K85: of:=IF([.J85] > 0; ROUND([.$B$23] *MIN([.J85];[.H85])); 0) -> 0 | L85: of:=IF((ROW() - [.$B$13] < 3);0;FLOOR(IFERROR(OFFSET([.$F85];-1*[.$B$13];0 );0) * [.$B$14])) -> 57 | M85: of:=SUM([.L$3:.L85]) -> 462
D86: of:=[.D85]+1 -> 2020-04-12T00:00:00.000 | F86: of:=IF([.G85] < [.$B$25];CEILING([.G85]*[.$B$3];1);0) -> 46979 | G86: of:=IF([.G85] < [.$B$25];SUM([.F$3:.F86]);[.$B$25]) -> 397564 | H86: of:=IF((ROW() - [.$B$21] < 3);0;FLOOR(IFERROR(OFFSET([.$F86];-1*[.$B$21];0 );0) * [.$B$10])) -> 2575 | I86: of:=SUM(INDEX([.H$1:.H$736];MAX(ROW()+(-1*[.$B$22])+1;3);1):INDEX([.H$1:.H$736];ROW();1)) -> 20575 | J86: of:=IF([.I86] > [.$B$20];[.I86]-[.$B$20];0) -> 0 | K86: of:=IF([.J86] > 0; ROUND([.$B$23] *MIN([.J86];[.H86])); 0) -> 0 | L86: of:=IF((ROW() - [.$B$13] < 3);0;FLOOR(IFERROR(OFFSET([.$F86];-1*[.$B$13];0 );0) * [.$B$14])) -> 65 | M86: of:=SUM([.L$3:.L86]) -> 527
D87: of:=[.D86]+1 -> 2020-04-13T00:00:00.000 | F87: of:=IF([.G86] < [.$B$25];CEILING([.G86]*[.$B$3];1);0) -> 53274 | G87: of:=IF([.G86] < [.$B$25];SUM([.F$3:.F87]);[.$B$25]) -> 450838 | H87: of:=IF((ROW() - [.$B$21] < 3);0;FLOOR(IFERROR(OFFSET([.$F87];-1*[.$B$21];0 );0) * [.$B$10])) -> 2920 | I87: of:=SUM(INDEX([.H$1:.H$736];MAX(ROW()+(-1*[.$B$22])+1;3);1):INDEX([.H$1:.H$736];ROW();1)) -> 23333 | J87: of:=IF([.I87] > [.$B$20];[.I87]-[.$B$20];0) -> 0 | K87: of:=IF([.J87] > 0; ROUND([.$B$23] *MIN([.J87];[.H87])); 0) -> 0 | L87: of:=IF((ROW() - [.$B$13] < 3);0;FLOOR(IFERROR(OFFSET([.$F87];-1*[.$B$13];0 );0) * [.$B$14])) -> 73 | M87: of:=SUM([.L$3:.L87]) -> 600
D88: of:=[.D87]+1 -> 2020-04-14T00:00:00.000 | F88: of:=IF([.G87] < [.$B$25];CEILING([.G87]*[.$B$3];1);0) -> 60413 | G88: of:=IF([.G87] < [.$B$25];SUM([.F$3:.F88]);[.$B$25]) -> 511251 | H88: of:=IF((ROW() - [.$B$21] < 3);0;FLOOR(IFERROR(OFFSET([.$F88];-1*[.$B$21];0 );0) * [.$B$10])) -> 3311 | I88: of:=SUM(INDEX([.H$1:.H$736];MAX(ROW()+(-1*[.$B$22])+1;3);1):INDEX([.H$1:.H$736];ROW();1)) -> 26461 | J88: of:=IF([.I88] > [.$B$20];[.I88]-[.$B$20];0) -> 0 | K88: of:=IF([.J88] > 0; ROUND([.$B$23] *MIN([.J88];[.H88])); 0) -> 0 | L88: of:=IF((ROW() - [.$B$13] < 3);0;FLOOR(IFERROR(OFFSET([.$F88];-1*[.$B$13];0 );0) * [.$B$14])) -> 83 | M88: of:=SUM([.L$3:.L88]) -> 683
D89: of:=[.D88]+1 -> 2020-04-15T00:00:00.000 | F89: of:=IF([.G88] < [.$B$25];CEILING([.G88]*[.$B$3];1);0) -> 68508 | G89: of:=IF([.G88] < [.$B$25];SUM([.F$3:.F89]);[.$B$25]) -> 579759 | H89: of:=IF((ROW() - [.$B$21] < 3);0;FLOOR(IFERROR(OFFSET([.$F89];-1*[.$B$21];0 );0) * [.$B$10])) -> 3755 | I89: of:=SUM(INDEX([.H$1:.H$736];MAX(ROW()+(-1*[.$B$22])+1;3);1):INDEX([.H$1:.H$736];ROW();1)) -> 30008 | J89: of:=IF([.I89] > [.$B$20];[.I89]-[.$B$20];0) -> 0 | K89: of:=IF([.J89] > 0; ROUND([.$B$23] *MIN([.J89];[.H89])); 0) -> 0 | L89: of:=IF((ROW() - [.$B$13] < 3);0;FLOOR(IFERROR(OFFSET([.$F89];-1*[.$B$13];0 );0) * [.$B$14])) -> 94 | M89: of:=SUM([.L$3:.L89]) -> 777
D90: of:=[.D89]+1 -> 2020-04-16T00:00:00.000 | F90: of:=IF([.G89] < [.$B$25];CEILING([.G89]*[.$B$3];1);0) -> 77688 | G90: of:=IF([.G89] < [.$B$25];SUM([.F$3:.F90]);[.$B$25]) -> 657447 | H90: of:=IF((ROW() - [.$B$21] < 3);0;FLOOR(IFERROR(OFFSET([.$F90];-1*[.$B$21];0 );0) * [.$B$10])) -> 4258 | I90: of:=SUM(INDEX([.H$1:.H$736];MAX(ROW()+(-1*[.$B$22])+1;3);1):INDEX([.H$1:.H$736];ROW();1)) -> 34030 | J90: of:=IF([.I90] > [.$B$20];[.I90]-[.$B$20];0) -> 0 | K90: of:=IF([.J90] > 0; ROUND([.$B$23] *MIN([.J90];[.H90])); 0) -> 0 | L90: of:=IF((ROW() - [.$B$13] < 3);0;FLOOR(IFERROR(OFFSET([.$F90];-1*[.$B$13];0 );0) * [.$B$14])) -> 107 | M90: of:=SUM([.L$3:.L90]) -> 884
D91: of:=[.D90]+1 -> 2020-04-17T00:00:00.000 | F91: of:=IF([.G90] < [.$B$25];CEILING([.G90]*[.$B$3];1);0) -> 88098 | G91: of:=IF([.G90] < [.$B$25];SUM([.F$3:.F91]);[.$B$25]) -> 745545 | H91: of:=IF((ROW() - [.$B$21] < 3);0;FLOOR(IFERROR(OFFSET([.$F91];-1*[.$B$21];0 );0) * [.$B$10])) -> 4829 | I91: of:=SUM(INDEX([.H$1:.H$736];MAX(ROW()+(-1*[.$B$22])+1;3);1):INDEX([.H$1:.H$736];ROW();1)) -> 38592 | J91: of:=IF([.I91] > [.$B$20];[.I91]-[.$B$20];0) -> 0 | K91: of:=IF([.J91] > 0; ROUND([.$B$23] *MIN([.J91];[.H91])); 0) -> 0 | L91: of:=IF((ROW() - [.$B$13] < 3);0;FLOOR(IFERROR(OFFSET([.$F91];-1*[.$B$13];0 );0) * [.$B$14])) -> 122 | M91: of:=SUM([.L$3:.L91]) -> 1006
D92: of:=[.D91]+1 -> 2020-04-18T00:00:00.000 | F92: of:=IF([.G91] < [.$B$25];CEILING([.G91]*[.$B$3];1);0) -> 99904 | G92: of:=IF([.G91] < [.$B$25];SUM([.F$3:.F92]);[.$B$25]) -> 845449 | H92: of:=IF((ROW() - [.$B$21] < 3);0;FLOOR(IFERROR(OFFSET([.$F92];-1*[.$B$21];0 );0) * [.$B$10])) -> 5476 | I92: of:=SUM(INDEX([.H$1:.H$736];MAX(ROW()+(-1*[.$B$22])+1;3);1):INDEX([.H$1:.H$736];ROW();1)) -> 43765 | J92: of:=IF([.I92] > [.$B$20];[.I92]-[.$B$20];0) -> 0 | K92: of:=IF([.J92] > 0; ROUND([.$B$23] *MIN([.J92];[.H92])); 0) -> 0 | L92: of:=IF((ROW() - [.$B$13] < 3);0;FLOOR(IFERROR(OFFSET([.$F92];-1*[.$B$13];0 );0) * [.$B$14])) -> 138 | M92: of:=SUM([.L$3:.L92]) -> 1144
D93: of:=[.D92]+1 -> 2020-04-19T00:00:00.000 | F93: of:=IF([.G92] < [.$B$25];CEILING([.G92]*[.$B$3];1);0) -> 113291 | G93: of:=IF([.G92] < [.$B$25];SUM([.F$3:.F93]);[.$B$25]) -> 958740 | H93: of:=IF((ROW() - [.$B$21] < 3);0;FLOOR(IFERROR(OFFSET([.$F93];-1*[.$B$21];0 );0) * [.$B$10])) -> 6210 | I93: of:=SUM(INDEX([.H$1:.H$736];MAX(ROW()+(-1*[.$B$22])+1;3);1):INDEX([.H$1:.H$736];ROW();1)) -> 49631 | J93: of:=IF([.I93] > [.$B$20];[.I93]-[.$B$20];0) -> 0 | K93: of:=IF([.J93] > 0; ROUND([.$B$23] *MIN([.J93];[.H93])); 0) -> 0 | L93: of:=IF((ROW() - [.$B$13] < 3);0;FLOOR(IFERROR(OFFSET([.$F93];-1*[.$B$13];0 );0) * [.$B$14])) -> 157 | M93: of:=SUM([.L$3:.L93]) -> 1301
D94: of:=[.D93]+1 -> 2020-04-20T00:00:00.000 | F94: of:=IF([.G93] < [.$B$25];CEILING([.G93]*[.$B$3];1);0) -> 128472 | G94: of:=IF([.G93] < [.$B$25];SUM([.F$3:.F94]);[.$B$25]) -> 1087212 | H94: of:=IF((ROW() - [.$B$21] < 3);0;FLOOR(IFERROR(OFFSET([.$F94];-1*[.$B$21];0 );0) * [.$B$10])) -> 7042 | I94: of:=SUM(INDEX([.H$1:.H$736];MAX(ROW()+(-1*[.$B$22])+1;3);1):INDEX([.H$1:.H$736];ROW();1)) -> 56283 | J94: of:=IF([.I94] > [.$B$20];[.I94]-[.$B$20];0) -> 0 | K94: of:=IF([.J94] > 0; ROUND([.$B$23] *MIN([.J94];[.H94])); 0) -> 0 | L94: of:=IF((ROW() - [.$B$13] < 3);0;FLOOR(IFERROR(OFFSET([.$F94];-1*[.$B$13];0 );0) * [.$B$14])) -> 178 | M94: of:=SUM([.L$3:.L94]) -> 1479
D95: of:=[.D94]+1 -> 2020-04-21T00:00:00.000 | F95: of:=IF([.G94] < [.$B$25];CEILING([.G94]*[.$B$3];1);0) -> 145687 | G95: of:=IF([.G94] < [.$B$25];SUM([.F$3:.F95]);[.$B$25]) -> 1232899 | H95: of:=IF((ROW() - [.$B$21] < 3);0;FLOOR(IFERROR(OFFSET([.$F95];-1*[.$B$21];0 );0) * [.$B$10])) -> 7986 | I95: of:=SUM(INDEX([.H$1:.H$736];MAX(ROW()+(-1*[.$B$22])+1;3);1):INDEX([.H$1:.H$736];ROW();1)) -> 63827 | J95: of:=IF([.I95] > [.$B$20];[.I95]-[.$B$20];0) -> 0 | K95: of:=IF([.J95] > 0; ROUND([.$B$23] *MIN([.J95];[.H95])); 0) -> 0 | L95: of:=IF((ROW() - [.$B$13] < 3);0;FLOOR(IFERROR(OFFSET([.$F95];-1*[.$B$13];0 );0) * [.$B$14])) -> 201 | M95: of:=SUM([.L$3:.L95]) -> 1680
D96: of:=[.D95]+1 -> 2020-04-22T00:00:00.000 | F96: of:=IF([.G95] < [.$B$25];CEILING([.G95]*[.$B$3];1);0) -> 165209 | G96: of:=IF([.G95] < [.$B$25];SUM([.F$3:.F96]);[.$B$25]) -> 1398108 | H96: of:=IF((ROW() - [.$B$21] < 3);0;FLOOR(IFERROR(OFFSET([.$F96];-1*[.$B$21];0 );0) * [.$B$10])) -> 9056 | I96: of:=SUM(INDEX([.H$1:.H$736];MAX(ROW()+(-1*[.$B$22])+1;3);1):INDEX([.H$1:.H$736];ROW();1)) -> 72381 | J96: of:=IF([.I96] > [.$B$20];[.I96]-[.$B$20];0) -> 0 | K96: of:=IF([.J96] > 0; ROUND([.$B$23] *MIN([.J96];[.H96])); 0) -> 0 | L96: of:=IF((ROW() - [.$B$13] < 3);0;FLOOR(IFERROR(OFFSET([.$F96];-1*[.$B$13];0 );0) * [.$B$14])) -> 229 | M96: of:=SUM([.L$3:.L96]) -> 1909
D97: of:=[.D96]+1 -> 2020-04-23T00:00:00.000 | F97: of:=IF([.G96] < [.$B$25];CEILING([.G96]*[.$B$3];1);0) -> 187347 | G97: of:=IF([.G96] < [.$B$25];SUM([.F$3:.F97]);[.$B$25]) -> 1585455 | H97: of:=IF((ROW() - [.$B$21] < 3);0;FLOOR(IFERROR(OFFSET([.$F97];-1*[.$B$21];0 );0) * [.$B$10])) -> 10270 | I97: of:=SUM(INDEX([.H$1:.H$736];MAX(ROW()+(-1*[.$B$22])+1;3);1):INDEX([.H$1:.H$736];ROW();1)) -> 82082 | J97: of:=IF([.I97] > [.$B$20];[.I97]-[.$B$20];0) -> 0 | K97: of:=IF([.J97] > 0; ROUND([.$B$23] *MIN([.J97];[.H97])); 0) -> 0 | L97: of:=IF((ROW() - [.$B$13] < 3);0;FLOOR(IFERROR(OFFSET([.$F97];-1*[.$B$13];0 );0) * [.$B$14])) -> 259 | M97: of:=SUM([.L$3:.L97]) -> 2168
D98: of:=[.D97]+1 -> 2020-04-24T00:00:00.000 | F98: of:=IF([.G97] < [.$B$25];CEILING([.G97]*[.$B$3];1);0) -> 212451 | G98: of:=IF([.G97] < [.$B$25];SUM([.F$3:.F98]);[.$B$25]) -> 1797906 | H98: of:=IF((ROW() - [.$B$21] < 3);0;FLOOR(IFERROR(OFFSET([.$F98];-1*[.$B$21];0 );0) * [.$B$10])) -> 11646 | I98: of:=SUM(INDEX([.H$1:.H$736];MAX(ROW()+(-1*[.$B$22])+1;3);1):INDEX([.H$1:.H$736];ROW();1)) -> 93083 | J98: of:=IF([.I98] > [.$B$20];[.I98]-[.$B$20];0) -> 0 | K98: of:=IF([.J98] > 0; ROUND([.$B$23] *MIN([.J98];[.H98])); 0) -> 0 | L98: of:=IF((ROW() - [.$B$13] < 3);0;FLOOR(IFERROR(OFFSET([.$F98];-1*[.$B$13];0 );0) * [.$B$14])) -> 294 | M98: of:=SUM([.L$3:.L98]) -> 2462
D99: of:=[.D98]+1 -> 2020-04-25T00:00:00.000 | F99: of:=IF([.G98] < [.$B$25];CEILING([.G98]*[.$B$3];1);0) -> 240920 | G99: of:=IF([.G98] < [.$B$25];SUM([.F$3:.F99]);[.$B$25]) -> 2038826 | H99: of:=IF((ROW() - [.$B$21] < 3);0;FLOOR(IFERROR(OFFSET([.$F99];-1*[.$B$21];0 );0) * [.$B$10])) -> 13206 | I99: of:=SUM(INDEX([.H$1:.H$736];MAX(ROW()+(-1*[.$B$22])+1;3);1):INDEX([.H$1:.H$736];ROW();1)) -> 105557 | J99: of:=IF([.I99] > [.$B$20];[.I99]-[.$B$20];0) -> 0 | K99: of:=IF([.J99] > 0; ROUND([.$B$23] *MIN([.J99];[.H99])); 0) -> 0 | L99: of:=IF((ROW() - [.$B$13] < 3);0;FLOOR(IFERROR(OFFSET([.$F99];-1*[.$B$13];0 );0) * [.$B$14])) -> 333 | M99: of:=SUM([.L$3:.L99]) -> 2795
D100: of:=[.D99]+1 -> 2020-04-26T00:00:00.000 | F100: of:=IF([.G99] < [.$B$25];CEILING([.G99]*[.$B$3];1);0) -> 273203 | G100: of:=IF([.G99] < [.$B$25];SUM([.F$3:.F100]);[.$B$25]) -> 2312029 | H100: of:=IF((ROW() - [.$B$21] < 3);0;FLOOR(IFERROR(OFFSET([.$F100];-1*[.$B$21];0 );0) * [.$B$10])) -> 14976 | I100: of:=SUM(INDEX([.H$1:.H$736];MAX(ROW()+(-1*[.$B$22])+1;3);1):INDEX([.H$1:.H$736];ROW();1)) -> 119703 | J100: of:=IF([.I100] > [.$B$20];[.I100]-[.$B$20];0) -> 5398.5975 | K100: of:=IF([.J100] > 0; ROUND([.$B$23] *MIN([.J100];[.H100])); 0) -> 972 | L100: of:=IF((ROW() - [.$B$13] < 3);0;FLOOR(IFERROR(OFFSET([.$F100];-1*[.$B$13];0 );0) * [.$B$14])) -> 378 | M100: of:=SUM([.L$3:.L100]) -> 3173
D101: of:=[.D100]+1 -> 2020-04-27T00:00:00.000 | F101: of:=IF([.G100] < [.$B$25];CEILING([.G100]*[.$B$3];1);0) -> 309812 | G101: of:=IF([.G100] < [.$B$25];SUM([.F$3:.F101]);[.$B$25]) -> 2621841 | H101: of:=IF((ROW() - [.$B$21] < 3);0;FLOOR(IFERROR(OFFSET([.$F101];-1*[.$B$21];0 );0) * [.$B$10])) -> 16983 | I101: of:=SUM(INDEX([.H$1:.H$736];MAX(ROW()+(-1*[.$B$22])+1;3);1):INDEX([.H$1:.H$736];ROW();1)) -> 135745 | J101: of:=IF([.I101] > [.$B$20];[.I101]-[.$B$20];0) -> 21440.5975 | K101: of:=IF([.J101] > 0; ROUND([.$B$23] *MIN([.J101];[.H101])); 0) -> 3057 | L101: of:=IF((ROW() - [.$B$13] < 3);0;FLOOR(IFERROR(OFFSET([.$F101];-1*[.$B$13];0 );0) * [.$B$14])) -> 429 | M101: of:=SUM([.L$3:.L101]) -> 3602
D102: of:=[.D101]+1 -> 2020-04-28T00:00:00.000 | F102: of:=IF([.G101] < [.$B$25];CEILING([.G101]*[.$B$3];1);0) -> 351327 | G102: of:=IF([.G101] < [.$B$25];SUM([.F$3:.F102]);[.$B$25]) -> 2973168 | H102: of:=IF((ROW() - [.$B$21] < 3);0;FLOOR(IFERROR(OFFSET([.$F102];-1*[.$B$21];0 );0) * [.$B$10])) -> 19259 | I102: of:=SUM(INDEX([.H$1:.H$736];MAX(ROW()+(-1*[.$B$22])+1;3);1):INDEX([.H$1:.H$736];ROW();1)) -> 153937 | J102: of:=IF([.I102] > [.$B$20];[.I102]-[.$B$20];0) -> 39632.5975 | K102: of:=IF([.J102] > 0; ROUND([.$B$23] *MIN([.J102];[.H102])); 0) -> 3467 | L102: of:=IF((ROW() - [.$B$13] < 3);0;FLOOR(IFERROR(OFFSET([.$F102];-1*[.$B$13];0 );0) * [.$B$14])) -> 487 | M102: of:=SUM([.L$3:.L102]) -> 4089
D103: of:=[.D102]+1 -> 2020-04-29T00:00:00.000 | F103: of:=IF([.G102] < [.$B$25];CEILING([.G102]*[.$B$3];1);0) -> 398405 | G103: of:=IF([.G102] < [.$B$25];SUM([.F$3:.F103]);[.$B$25]) -> 3371573 | H103: of:=IF((ROW() - [.$B$21] < 3);0;FLOOR(IFERROR(OFFSET([.$F103];-1*[.$B$21];0 );0) * [.$B$10])) -> 21840 | I103: of:=SUM(INDEX([.H$1:.H$736];MAX(ROW()+(-1*[.$B$22])+1;3);1):INDEX([.H$1:.H$736];ROW();1)) -> 174566 | J103: of:=IF([.I103] > [.$B$20];[.I103]-[.$B$20];0) -> 60261.5975 | K103: of:=IF([.J103] > 0; ROUND([.$B$23] *MIN([.J103];[.H103])); 0) -> 3931 | L103: of:=IF((ROW() - [.$B$13] < 3);0;FLOOR(IFERROR(OFFSET([.$F103];-1*[.$B$13];0 );0) * [.$B$14])) -> 552 | M103: of:=SUM([.L$3:.L103]) -> 4641
D104: of:=[.D103]+1 -> 2020-04-30T00:00:00.000 | F104: of:=IF([.G103] < [.$B$25];CEILING([.G103]*[.$B$3];1);0) -> 451791 | G104: of:=IF([.G103] < [.$B$25];SUM([.F$3:.F104]);[.$B$25]) -> 3823364 | H104: of:=IF((ROW() - [.$B$21] < 3);0;FLOOR(IFERROR(OFFSET([.$F104];-1*[.$B$21];0 );0) * [.$B$10])) -> 24766 | I104: of:=SUM(INDEX([.H$1:.H$736];MAX(ROW()+(-1*[.$B$22])+1;3);1):INDEX([.H$1:.H$736];ROW();1)) -> 197959 | J104: of:=IF([.I104] > [.$B$20];[.I104]-[.$B$20];0) -> 83654.5975 | K104: of:=IF([.J104] > 0; ROUND([.$B$23] *MIN([.J104];[.H104])); 0) -> 4458 | L104: of:=IF((ROW() - [.$B$13] < 3);0;FLOOR(IFERROR(OFFSET([.$F104];-1*[.$B$13];0 );0) * [.$B$14])) -> 626 | M104: of:=SUM([.L$3:.L104]) -> 5267
D105: of:=[.D104]+1 -> 2020-05-01T00:00:00.000 | F105: of:=IF([.G104] < [.$B$25];CEILING([.G104]*[.$B$3];1);0) -> 512331 | G105: of:=IF([.G104] < [.$B$25];SUM([.F$3:.F105]);[.$B$25]) -> 4335695 | H105: of:=IF((ROW() - [.$B$21] < 3);0;FLOOR(IFERROR(OFFSET([.$F105];-1*[.$B$21];0 );0) * [.$B$10])) -> 28085 | I105: of:=SUM(INDEX([.H$1:.H$736];MAX(ROW()+(-1*[.$B$22])+1;3);1):INDEX([.H$1:.H$736];ROW();1)) -> 224487 | J105: of:=IF([.I105] > [.$B$20];[.I105]-[.$B$20];0) -> 110182.5975 | K105: of:=IF([.J105] > 0; ROUND([.$B$23] *MIN([.J105];[.H105])); 0) -> 5055 | L105: of:=IF((ROW() - [.$B$13] < 3);0;FLOOR(IFERROR(OFFSET([.$F105];-1*[.$B$13];0 );0) * [.$B$14])) -> 710 | M105: of:=SUM([.L$3:.L105]) -> 5977
D106: of:=[.D105]+1 -> 2020-05-02T00:00:00.000 | F106: of:=IF([.G105] < [.$B$25];CEILING([.G105]*[.$B$3];1);0) -> 580984 | G106: of:=IF([.G105] < [.$B$25];SUM([.F$3:.F106]);[.$B$25]) -> 4916679 | H106: of:=IF((ROW() - [.$B$21] < 3);0;FLOOR(IFERROR(OFFSET([.$F106];-1*[.$B$21];0 );0) * [.$B$10])) -> 31848 | I106: of:=SUM(INDEX([.H$1:.H$736];MAX(ROW()+(-1*[.$B$22])+1;3);1):INDEX([.H$1:.H$736];ROW();1)) -> 254570 | J106: of:=IF([.I106] > [.$B$20];[.I106]-[.$B$20];0) -> 140265.5975 | K106: of:=IF([.J106] > 0; ROUND([.$B$23] *MIN([.J106];[.H106])); 0) -> 5733 | L106: of:=IF((ROW() - [.$B$13] < 3);0;FLOOR(IFERROR(OFFSET([.$F106];-1*[.$B$13];0 );0) * [.$B$14])) -> 805 | M106: of:=SUM([.L$3:.L106]) -> 6782
D107: of:=[.D106]+1 -> 2020-05-03T00:00:00.000 | F107: of:=IF([.G106] < [.$B$25];CEILING([.G106]*[.$B$3];1);0) -> 658835 | G107: of:=IF([.G106] < [.$B$25];SUM([.F$3:.F107]);[.$B$25]) -> 5575514 | H107: of:=IF((ROW() - [.$B$21] < 3);0;FLOOR(IFERROR(OFFSET([.$F107];-1*[.$B$21];0 );0) * [.$B$10])) -> 36116 | I107: of:=SUM(INDEX([.H$1:.H$736];MAX(ROW()+(-1*[.$B$22])+1;3);1):INDEX([.H$1:.H$736];ROW();1)) -> 288684 | J107: of:=IF([.I107] > [.$B$20];[.I107]-[.$B$20];0) -> 174379.5975 | K107: of:=IF([.J107] > 0; ROUND([.$B$23] *MIN([.J107];[.H107])); 0) -> 6501 | L107: of:=IF((ROW() - [.$B$13] < 3);0;FLOOR(IFERROR(OFFSET([.$F107];-1*[.$B$13];0 );0) * [.$B$14])) -> 913 | M107: of:=SUM([.L$3:.L107]) -> 7695
D108: of:=[.D107]+1 -> 2020-05-04T00:00:00.000 | F108: of:=IF([.G107] < [.$B$25];CEILING([.G107]*[.$B$3];1);0) -> 747119 | G108: of:=IF([.G107] < [.$B$25];SUM([.F$3:.F108]);[.$B$25]) -> 6322633 | H108: of:=IF((ROW() - [.$B$21] < 3);0;FLOOR(IFERROR(OFFSET([.$F108];-1*[.$B$21];0 );0) * [.$B$10])) -> 40956 | I108: of:=SUM(INDEX([.H$1:.H$736];MAX(ROW()+(-1*[.$B$22])+1;3);1):INDEX([.H$1:.H$736];ROW();1)) -> 327369 | J108: of:=IF([.I108] > [.$B$20];[.I108]-[.$B$20];0) -> 213064.5975 | K108: of:=IF([.J108] > 0; ROUND([.$B$23] *MIN([.J108];[.H108])); 0) -> 7372 | L108: of:=IF((ROW() - [.$B$13] < 3);0;FLOOR(IFERROR(OFFSET([.$F108];-1*[.$B$13];0 );0) * [.$B$14])) -> 1035 | M108: of:=SUM([.L$3:.L108]) -> 8730
D109: of:=[.D108]+1 -> 2020-05-05T00:00:00.000 | F109: of:=IF([.G108] < [.$B$25];CEILING([.G108]*[.$B$3];1);0) -> 847233 | G109: of:=IF([.G108] < [.$B$25];SUM([.F$3:.F109]);[.$B$25]) -> 7169866 | H109: of:=IF((ROW() - [.$B$21] < 3);0;FLOOR(IFERROR(OFFSET([.$F109];-1*[.$B$21];0 );0) * [.$B$10])) -> 46444 | I109: of:=SUM(INDEX([.H$1:.H$736];MAX(ROW()+(-1*[.$B$22])+1;3);1):INDEX([.H$1:.H$736];ROW();1)) -> 371238 | J109: of:=IF([.I109] > [.$B$20];[.I109]-[.$B$20];0) -> 256933.5975 | K109: of:=IF([.J109] > 0; ROUND([.$B$23] *MIN([.J109];[.H109])); 0) -> 8360 | L109: of:=IF((ROW() - [.$B$13] < 3);0;FLOOR(IFERROR(OFFSET([.$F109];-1*[.$B$13];0 );0) * [.$B$14])) -> 1174 | M109: of:=SUM([.L$3:.L109]) -> 9904
D110: of:=[.D109]+1 -> 2020-05-06T00:00:00.000 | F110: of:=IF([.G109] < [.$B$25];CEILING([.G109]*[.$B$3];1);0) -> 960763 | G110: of:=IF([.G109] < [.$B$25];SUM([.F$3:.F110]);[.$B$25]) -> 8130629 | H110: of:=IF((ROW() - [.$B$21] < 3);0;FLOOR(IFERROR(OFFSET([.$F110];-1*[.$B$21];0 );0) * [.$B$10])) -> 52668 | I110: of:=SUM(INDEX([.H$1:.H$736];MAX(ROW()+(-1*[.$B$22])+1;3);1):INDEX([.H$1:.H$736];ROW();1)) -> 420986 | J110: of:=IF([.I110] > [.$B$20];[.I110]-[.$B$20];0) -> 306681.5975 | K110: of:=IF([.J110] > 0; ROUND([.$B$23] *MIN([.J110];[.H110])); 0) -> 9480 | L110: of:=IF((ROW() - [.$B$13] < 3);0;FLOOR(IFERROR(OFFSET([.$F110];-1*[.$B$13];0 );0) * [.$B$14])) -> 1331 | M110: of:=SUM([.L$3:.L110]) -> 11235
D111: of:=[.D110]+1 -> 2020-05-07T00:00:00.000 | F111: of:=IF([.G110] < [.$B$25];CEILING([.G110]*[.$B$3];1);0) -> 1089505 | G111: of:=IF([.G110] < [.$B$25];SUM([.F$3:.F111]);[.$B$25]) -> 9220134 | H111: of:=IF((ROW() - [.$B$21] < 3);0;FLOOR(IFERROR(OFFSET([.$F111];-1*[.$B$21];0 );0) * [.$B$10])) -> 59725 | I111: of:=SUM(INDEX([.H$1:.H$736];MAX(ROW()+(-1*[.$B$22])+1;3);1):INDEX([.H$1:.H$736];ROW();1)) -> 477400 | J111: of:=IF([.I111] > [.$B$20];[.I111]-[.$B$20];0) -> 363095.5975 | K111: of:=IF([.J111] > 0; ROUND([.$B$23] *MIN([.J111];[.H111])); 0) -> 10751 | L111: of:=IF((ROW() - [.$B$13] < 3);0;FLOOR(IFERROR(OFFSET([.$F111];-1*[.$B$13];0 );0) * [.$B$14])) -> 1510 | M111: of:=SUM([.L$3:.L111]) -> 12745
D112: of:=[.D111]+1 -> 2020-05-08T00:00:00.000 | F112: of:=IF([.G111] < [.$B$25];CEILING([.G111]*[.$B$3];1);0) -> 1235498 | G112: of:=IF([.G111] < [.$B$25];SUM([.F$3:.F112]);[.$B$25]) -> 10455632 | H112: of:=IF((ROW() - [.$B$21] < 3);0;FLOOR(IFERROR(OFFSET([.$F112];-1*[.$B$21];0 );0) * [.$B$10])) -> 67728 | I112: of:=SUM(INDEX([.H$1:.H$736];MAX(ROW()+(-1*[.$B$22])+1;3);1):INDEX([.H$1:.H$736];ROW();1)) -> 541373 | J112: of:=IF([.I112] > [.$B$20];[.I112]-[.$B$20];0) -> 427068.5975 | K112: of:=IF([.J112] > 0; ROUND([.$B$23] *MIN([.J112];[.H112])); 0) -> 12191 | L112: of:=IF((ROW() - [.$B$13] < 3);0;FLOOR(IFERROR(OFFSET([.$F112];-1*[.$B$13];0 );0) * [.$B$14])) -> 1712 | M112: of:=SUM([.L$3:.L112]) -> 14457
D113: of:=[.D112]+1 -> 2020-05-09T00:00:00.000 | F113: of:=IF([.G112] < [.$B$25];CEILING([.G112]*[.$B$3];1);0) -> 1401055 | G113: of:=IF([.G112] < [.$B$25];SUM([.F$3:.F113]);[.$B$25]) -> 11856687 | H113: of:=IF((ROW() - [.$B$21] < 3);0;FLOOR(IFERROR(OFFSET([.$F113];-1*[.$B$21];0 );0) * [.$B$10])) -> 76804 | I113: of:=SUM(INDEX([.H$1:.H$736];MAX(ROW()+(-1*[.$B$22])+1;3);1):INDEX([.H$1:.H$736];ROW();1)) -> 613919 | J113: of:=IF([.I113] > [.$B$20];[.I113]-[.$B$20];0) -> 499614.5975 | K113: of:=IF([.J113] > 0; ROUND([.$B$23] *MIN([.J113];[.H113])); 0) -> 13825 | L113: of:=IF((ROW() - [.$B$13] < 3);0;FLOOR(IFERROR(OFFSET([.$F113];-1*[.$B$13];0 );0) * [.$B$14])) -> 1942 | M113: of:=SUM([.L$3:.L113]) -> 16399
D114: of:=[.D113]+1 -> 2020-05-10T00:00:00.000 | F114: of:=IF([.G113] < [.$B$25];CEILING([.G113]*[.$B$3];1);0) -> 1588797 | G114: of:=IF([.G113] < [.$B$25];SUM([.F$3:.F114]);[.$B$25]) -> 13445484 | H114: of:=IF((ROW() - [.$B$21] < 3);0;FLOOR(IFERROR(OFFSET([.$F114];-1*[.$B$21];0 );0) * [.$B$10])) -> 87096 | I114: of:=SUM(INDEX([.H$1:.H$736];MAX(ROW()+(-1*[.$B$22])+1;3);1):INDEX([.H$1:.H$736];ROW();1)) -> 696186 | J114: of:=IF([.I114] > [.$B$20];[.I114]-[.$B$20];0) -> 581881.5975 | K114: of:=IF([.J114] > 0; ROUND([.$B$23] *MIN([.J114];[.H114])); 0) -> 15677 | L114: of:=IF((ROW() - [.$B$13] < 3);0;FLOOR(IFERROR(OFFSET([.$F114];-1*[.$B$13];0 );0) * [.$B$14])) -> 2202 | M114: of:=SUM([.L$3:.L114]) -> 18601
D115: of:=[.D114]+1 -> 2020-05-11T00:00:00.000 | F115: of:=IF([.G114] < [.$B$25];CEILING([.G114]*[.$B$3];1);0) -> 1801695 | G115: of:=IF([.G114] < [.$B$25];SUM([.F$3:.F115]);[.$B$25]) -> 15247179 | H115: of:=IF((ROW() - [.$B$21] < 3);0;FLOOR(IFERROR(OFFSET([.$F115];-1*[.$B$21];0 );0) * [.$B$10])) -> 98767 | I115: of:=SUM(INDEX([.H$1:.H$736];MAX(ROW()+(-1*[.$B$22])+1;3);1):INDEX([.H$1:.H$736];ROW();1)) -> 789477 | J115: of:=IF([.I115] > [.$B$20];[.I115]-[.$B$20];0) -> 675172.5975 | K115: of:=IF([.J115] > 0; ROUND([.$B$23] *MIN([.J115];[.H115])); 0) -> 17778 | L115: of:=IF((ROW() - [.$B$13] < 3);0;FLOOR(IFERROR(OFFSET([.$F115];-1*[.$B$13];0 );0) * [.$B$14])) -> 2497 | M115: of:=SUM([.L$3:.L115]) -> 21098
D116: of:=[.D115]+1 -> 2020-05-12T00:00:00.000 | F116: of:=IF([.G115] < [.$B$25];CEILING([.G115]*[.$B$3];1);0) -> 2043122 | G116: of:=IF([.G115] < [.$B$25];SUM([.F$3:.F116]);[.$B$25]) -> 17290301 | H116: of:=IF((ROW() - [.$B$21] < 3);0;FLOOR(IFERROR(OFFSET([.$F116];-1*[.$B$21];0 );0) * [.$B$10])) -> 112001 | I116: of:=SUM(INDEX([.H$1:.H$736];MAX(ROW()+(-1*[.$B$22])+1;3);1):INDEX([.H$1:.H$736];ROW();1)) -> 895268 | J116: of:=IF([.I116] > [.$B$20];[.I116]-[.$B$20];0) -> 780963.5975 | K116: of:=IF([.J116] > 0; ROUND([.$B$23] *MIN([.J116];[.H116])); 0) -> 20160 | L116: of:=IF((ROW() - [.$B$13] < 3);0;FLOOR(IFERROR(OFFSET([.$F116];-1*[.$B$13];0 );0) * [.$B$14])) -> 2832 | M116: of:=SUM([.L$3:.L116]) -> 23930
D117: of:=[.D116]+1 -> 2020-05-13T00:00:00.000 | F117: of:=IF([.G116] < [.$B$25];CEILING([.G116]*[.$B$3];1);0) -> 2316901 | G117: of:=IF([.G116] < [.$B$25];SUM([.F$3:.F117]);[.$B$25]) -> 19607202 | H117: of:=IF((ROW() - [.$B$21] < 3);0;FLOOR(IFERROR(OFFSET([.$F117];-1*[.$B$21];0 );0) * [.$B$10])) -> 127010 | I117: of:=SUM(INDEX([.H$1:.H$736];MAX(ROW()+(-1*[.$B$22])+1;3);1):INDEX([.H$1:.H$736];ROW();1)) -> 1015236 | J117: of:=IF([.I117] > [.$B$20];[.I117]-[.$B$20];0) -> 900931.5975 | K117: of:=IF([.J117] > 0; ROUND([.$B$23] *MIN([.J117];[.H117])); 0) -> 22862 | L117: of:=IF((ROW() - [.$B$13] < 3);0;FLOOR(IFERROR(OFFSET([.$F117];-1*[.$B$13];0 );0) * [.$B$14])) -> 3211 | M117: of:=SUM([.L$3:.L117]) -> 27141
D118: of:=[.D117]+1 -> 2020-05-14T00:00:00.000 | F118: of:=IF([.G117] < [.$B$25];CEILING([.G117]*[.$B$3];1);0) -> 2627366 | G118: of:=IF([.G117] < [.$B$25];SUM([.F$3:.F118]);[.$B$25]) -> 22234568 | H118: of:=IF((ROW() - [.$B$21] < 3);0;FLOOR(IFERROR(OFFSET([.$F118];-1*[.$B$21];0 );0) * [.$B$10])) -> 144029 | I118: of:=SUM(INDEX([.H$1:.H$736];MAX(ROW()+(-1*[.$B$22])+1;3);1):INDEX([.H$1:.H$736];ROW();1)) -> 1151279 | J118: of:=IF([.I118] > [.$B$20];[.I118]-[.$B$20];0) -> 1036974.5975 | K118: of:=IF([.J118] > 0; ROUND([.$B$23] *MIN([.J118];[.H118])); 0) -> 25925 | L118: of:=IF((ROW() - [.$B$13] < 3);0;FLOOR(IFERROR(OFFSET([.$F118];-1*[.$B$13];0 );0) * [.$B$14])) -> 3642 | M118: of:=SUM([.L$3:.L118]) -> 30783
D119: of:=[.D118]+1 -> 2020-05-15T00:00:00.000 | F119: of:=IF([.G118] < [.$B$25];CEILING([.G118]*[.$B$3];1);0) -> 2979433 | G119: of:=IF([.G118] < [.$B$25];SUM([.F$3:.F119]);[.$B$25]) -> 25214001 | H119: of:=IF((ROW() - [.$B$21] < 3);0;FLOOR(IFERROR(OFFSET([.$F119];-1*[.$B$21];0 );0) * [.$B$10])) -> 163329 | I119: of:=SUM(INDEX([.H$1:.H$736];MAX(ROW()+(-1*[.$B$22])+1;3);1):INDEX([.H$1:.H$736];ROW();1)) -> 1305552 | J119: of:=IF([.I119] > [.$B$20];[.I119]-[.$B$20];0) -> 1191247.5975 | K119: of:=IF([.J119] > 0; ROUND([.$B$23] *MIN([.J119];[.H119])); 0) -> 29399 | L119: of:=IF((ROW() - [.$B$13] < 3);0;FLOOR(IFERROR(OFFSET([.$F119];-1*[.$B$13];0 );0) * [.$B$14])) -> 4130 | M119: of:=SUM([.L$3:.L119]) -> 34913
D120: of:=[.D119]+1 -> 2020-05-16T00:00:00.000 | F120: of:=IF([.G119] < [.$B$25];CEILING([.G119]*[.$B$3];1);0) -> 3378677 | G120: of:=IF([.G119] < [.$B$25];SUM([.F$3:.F120]);[.$B$25]) -> 28592678 | H120: of:=IF((ROW() - [.$B$21] < 3);0;FLOOR(IFERROR(OFFSET([.$F120];-1*[.$B$21];0 );0) * [.$B$10])) -> 185215 | I120: of:=SUM(INDEX([.H$1:.H$736];MAX(ROW()+(-1*[.$B$22])+1;3);1):INDEX([.H$1:.H$736];ROW();1)) -> 1480497 | J120: of:=IF([.I120] > [.$B$20];[.I120]-[.$B$20];0) -> 1366192.5975 | K120: of:=IF([.J120] > 0; ROUND([.$B$23] *MIN([.J120];[.H120])); 0) -> 33339 | L120: of:=IF((ROW() - [.$B$13] < 3);0;FLOOR(IFERROR(OFFSET([.$F120];-1*[.$B$13];0 );0) * [.$B$14])) -> 4683 | M120: of:=SUM([.L$3:.L120]) -> 39596
D121: of:=[.D120]+1 -> 2020-05-17T00:00:00.000 | F121: of:=IF([.G120] < [.$B$25];CEILING([.G120]*[.$B$3];1);0) -> 3831419 | G121: of:=IF([.G120] < [.$B$25];SUM([.F$3:.F121]);[.$B$25]) -> 32424097 | H121: of:=IF((ROW() - [.$B$21] < 3);0;FLOOR(IFERROR(OFFSET([.$F121];-1*[.$B$21];0 );0) * [.$B$10])) -> 210034 | I121: of:=SUM(INDEX([.H$1:.H$736];MAX(ROW()+(-1*[.$B$22])+1;3);1):INDEX([.H$1:.H$736];ROW();1)) -> 1678885 | J121: of:=IF([.I121] > [.$B$20];[.I121]-[.$B$20];0) -> 1564580.5975 | K121: of:=IF([.J121] > 0; ROUND([.$B$23] *MIN([.J121];[.H121])); 0) -> 37806 | L121: of:=IF((ROW() - [.$B$13] < 3);0;FLOOR(IFERROR(OFFSET([.$F121];-1*[.$B$13];0 );0) * [.$B$14])) -> 5311 | M121: of:=SUM([.L$3:.L121]) -> 44907
D122: of:=[.D121]+1 -> 2020-05-18T00:00:00.000 | F122: of:=IF([.G121] < [.$B$25];CEILING([.G121]*[.$B$3];1);0) -> 4344829 | G122: of:=IF([.G121] < [.$B$25];SUM([.F$3:.F122]);[.$B$25]) -> 36768926 | H122: of:=IF((ROW() - [.$B$21] < 3);0;FLOOR(IFERROR(OFFSET([.$F122];-1*[.$B$21];0 );0) * [.$B$10])) -> 238179 | I122: of:=SUM(INDEX([.H$1:.H$736];MAX(ROW()+(-1*[.$B$22])+1;3);1):INDEX([.H$1:.H$736];ROW();1)) -> 1903858 | J122: of:=IF([.I122] > [.$B$20];[.I122]-[.$B$20];0) -> 1789553.5975 | K122: of:=IF([.J122] > 0; ROUND([.$B$23] *MIN([.J122];[.H122])); 0) -> 42872 | L122: of:=IF((ROW() - [.$B$13] < 3);0;FLOOR(IFERROR(OFFSET([.$F122];-1*[.$B$13];0 );0) * [.$B$14])) -> 6023 | M122: of:=SUM([.L$3:.L122]) -> 50930
D123: of:=[.D122]+1 -> 2020-05-19T00:00:00.000 | F123: of:=IF([.G122] < [.$B$25];CEILING([.G122]*[.$B$3];1);0) -> 4927037 | G123: of:=IF([.G122] < [.$B$25];SUM([.F$3:.F123]);[.$B$25]) -> 41695963 | H123: of:=IF((ROW() - [.$B$21] < 3);0;FLOOR(IFERROR(OFFSET([.$F123];-1*[.$B$21];0 );0) * [.$B$10])) -> 270095 | I123: of:=SUM(INDEX([.H$1:.H$736];MAX(ROW()+(-1*[.$B$22])+1;3);1):INDEX([.H$1:.H$736];ROW();1)) -> 2158977 | J123: of:=IF([.I123] > [.$B$20];[.I123]-[.$B$20];0) -> 2044672.5975 | K123: of:=IF([.J123] > 0; ROUND([.$B$23] *MIN([.J123];[.H123])); 0) -> 48617 | L123: of:=IF((ROW() - [.$B$13] < 3);0;FLOOR(IFERROR(OFFSET([.$F123];-1*[.$B$13];0 );0) * [.$B$14])) -> 6830 | M123: of:=SUM([.L$3:.L123]) -> 57760
D124: of:=[.D123]+1 -> 2020-05-20T00:00:00.000 | F124: of:=IF([.G123] < [.$B$25];CEILING([.G123]*[.$B$3];1);0) -> 5587260 | G124: of:=IF([.G123] < [.$B$25];SUM([.F$3:.F124]);[.$B$25]) -> 47283223 | H124: of:=IF((ROW() - [.$B$21] < 3);0;FLOOR(IFERROR(OFFSET([.$F124];-1*[.$B$21];0 );0) * [.$B$10])) -> 306288 | I124: of:=SUM(INDEX([.H$1:.H$736];MAX(ROW()+(-1*[.$B$22])+1;3);1):INDEX([.H$1:.H$736];ROW();1)) -> 2448282 | J124: of:=IF([.I124] > [.$B$20];[.I124]-[.$B$20];0) -> 2333977.5975 | K124: of:=IF([.J124] > 0; ROUND([.$B$23] *MIN([.J124];[.H124])); 0) -> 55132 | L124: of:=IF((ROW() - [.$B$13] < 3);0;FLOOR(IFERROR(OFFSET([.$F124];-1*[.$B$13];0 );0) * [.$B$14])) -> 7745 | M124: of:=SUM([.L$3:.L124]) -> 65505
D125: of:=[.D124]+1 -> 2020-05-21T00:00:00.000 | F125: of:=IF([.G124] < [.$B$25];CEILING([.G124]*[.$B$3];1);0) -> 6335952 | G125: of:=IF([.G124] < [.$B$25];SUM([.F$3:.F125]);[.$B$25]) -> 53619175 | H125: of:=IF((ROW() - [.$B$21] < 3);0;FLOOR(IFERROR(OFFSET([.$F125];-1*[.$B$21];0 );0) * [.$B$10])) -> 347330 | I125: of:=SUM(INDEX([.H$1:.H$736];MAX(ROW()+(-1*[.$B$22])+1;3);1):INDEX([.H$1:.H$736];ROW();1)) -> 2776353 | J125: of:=IF([.I125] > [.$B$20];[.I125]-[.$B$20];0) -> 2662048.5975 | K125: of:=IF([.J125] > 0; ROUND([.$B$23] *MIN([.J125];[.H125])); 0) -> 62519 | L125: of:=IF((ROW() - [.$B$13] < 3);0;FLOOR(IFERROR(OFFSET([.$F125];-1*[.$B$13];0 );0) * [.$B$14])) -> 8783 | M125: of:=SUM([.L$3:.L125]) -> 74288
D126: of:=[.D125]+1 -> 2020-05-22T00:00:00.000 | F126: of:=IF([.G125] < [.$B$25];CEILING([.G125]*[.$B$3];1);0) -> 7184970 | G126: of:=IF([.G125] < [.$B$25];SUM([.F$3:.F126]);[.$B$25]) -> 60804145 | H126: of:=IF((ROW() - [.$B$21] < 3);0;FLOOR(IFERROR(OFFSET([.$F126];-1*[.$B$21];0 );0) * [.$B$10])) -> 393873 | I126: of:=SUM(INDEX([.H$1:.H$736];MAX(ROW()+(-1*[.$B$22])+1;3);1):INDEX([.H$1:.H$736];ROW();1)) -> 3148386 | J126: of:=IF([.I126] > [.$B$20];[.I126]-[.$B$20];0) -> 3034081.5975 | K126: of:=IF([.J126] > 0; ROUND([.$B$23] *MIN([.J126];[.H126])); 0) -> 70897 | L126: of:=IF((ROW() - [.$B$13] < 3);0;FLOOR(IFERROR(OFFSET([.$F126];-1*[.$B$13];0 );0) * [.$B$14])) -> 9960 | M126: of:=SUM([.L$3:.L126]) -> 84248
D127: of:=[.D126]+1 -> 2020-05-23T00:00:00.000 | F127: of:=IF([.G126] < [.$B$25];CEILING([.G126]*[.$B$3];1);0) -> 8147756 | G127: of:=IF([.G126] < [.$B$25];SUM([.F$3:.F127]);[.$B$25]) -> 68951901 | H127: of:=IF((ROW() - [.$B$21] < 3);0;FLOOR(IFERROR(OFFSET([.$F127];-1*[.$B$21];0 );0) * [.$B$10])) -> 446652 | I127: of:=SUM(INDEX([.H$1:.H$736];MAX(ROW()+(-1*[.$B$22])+1;3);1):INDEX([.H$1:.H$736];ROW();1)) -> 3570272 | J127: of:=IF([.I127] > [.$B$20];[.I127]-[.$B$20];0) -> 3455967.5975 | K127: of:=IF([.J127] > 0; ROUND([.$B$23] *MIN([.J127];[.H127])); 0) -> 80397 | L127: of:=IF((ROW() - [.$B$13] < 3);0;FLOOR(IFERROR(OFFSET([.$F127];-1*[.$B$13];0 );0) * [.$B$14])) -> 11294 | M127: of:=SUM([.L$3:.L127]) -> 95542
D128: of:=[.D127]+1 -> 2020-05-24T00:00:00.000 | F128: of:=IF([.G127] < [.$B$25];CEILING([.G127]*[.$B$3];1);0) -> 9239555 | G128: of:=IF([.G127] < [.$B$25];SUM([.F$3:.F128]);[.$B$25]) -> 78191456 | H128: of:=IF((ROW() - [.$B$21] < 3);0;FLOOR(IFERROR(OFFSET([.$F128];-1*[.$B$21];0 );0) * [.$B$10])) -> 506503 | I128: of:=SUM(INDEX([.H$1:.H$736];MAX(ROW()+(-1*[.$B$22])+1;3);1):INDEX([.H$1:.H$736];ROW();1)) -> 4048690 | J128: of:=IF([.I128] > [.$B$20];[.I128]-[.$B$20];0) -> 3934385.5975 | K128: of:=IF([.J128] > 0; ROUND([.$B$23] *MIN([.J128];[.H128])); 0) -> 91171 | L128: of:=IF((ROW() - [.$B$13] < 3);0;FLOOR(IFERROR(OFFSET([.$F128];-1*[.$B$13];0 );0) * [.$B$14])) -> 12808 | M128: of:=SUM([.L$3:.L128]) -> 108350
D129: of:=[.D128]+1 -> 2020-05-25T00:00:00.000 | F129: of:=IF([.G128] < [.$B$25];CEILING([.G128]*[.$B$3];1);0) -> 10477656 | G129: of:=IF([.G128] < [.$B$25];SUM([.F$3:.F129]);[.$B$25]) -> 88669112 | H129: of:=IF((ROW() - [.$B$21] < 3);0;FLOOR(IFERROR(OFFSET([.$F129];-1*[.$B$21];0 );0) * [.$B$10])) -> 574375 | I129: of:=SUM(INDEX([.H$1:.H$736];MAX(ROW()+(-1*[.$B$22])+1;3);1):INDEX([.H$1:.H$736];ROW();1)) -> 4591217 | J129: of:=IF([.I129] > [.$B$20];[.I129]-[.$B$20];0) -> 4476912.5975 | K129: of:=IF([.J129] > 0; ROUND([.$B$23] *MIN([.J129];[.H129])); 0) -> 103388 | L129: of:=IF((ROW() - [.$B$13] < 3);0;FLOOR(IFERROR(OFFSET([.$F129];-1*[.$B$13];0 );0) * [.$B$14])) -> 14524 | M129: of:=SUM([.L$3:.L129]) -> 122874
D130: of:=[.D129]+1 -> 2020-05-26T00:00:00.000 | F130: of:=IF([.G129] < [.$B$25];CEILING([.G129]*[.$B$3];1);0) -> 11881662 | G130: of:=IF([.G129] < [.$B$25];SUM([.F$3:.F130]);[.$B$25]) -> 100550774 | H130: of:=IF((ROW() - [.$B$21] < 3);0;FLOOR(IFERROR(OFFSET([.$F130];-1*[.$B$21];0 );0) * [.$B$10])) -> 651341 | I130: of:=SUM(INDEX([.H$1:.H$736];MAX(ROW()+(-1*[.$B$22])+1;3);1):INDEX([.H$1:.H$736];ROW();1)) -> 5206442 | J130: of:=IF([.I130] > [.$B$20];[.I130]-[.$B$20];0) -> 5092137.5975 | K130: of:=IF([.J130] > 0; ROUND([.$B$23] *MIN([.J130];[.H130])); 0) -> 117241 | L130: of:=IF((ROW() - [.$B$13] < 3);0;FLOOR(IFERROR(OFFSET([.$F130];-1*[.$B$13];0 );0) * [.$B$14])) -> 16470 | M130: of:=SUM([.L$3:.L130]) -> 139344
D131: of:=[.D130]+1 -> 2020-05-27T00:00:00.000 | F131: of:=IF([.G130] < [.$B$25];CEILING([.G130]*[.$B$3];1);0) -> 13473804 | G131: of:=IF([.G130] < [.$B$25];SUM([.F$3:.F131]);[.$B$25]) -> 114024578 | H131: of:=IF((ROW() - [.$B$21] < 3);0;FLOOR(IFERROR(OFFSET([.$F131];-1*[.$B$21];0 );0) * [.$B$10])) -> 738620 | I131: of:=SUM(INDEX([.H$1:.H$736];MAX(ROW()+(-1*[.$B$22])+1;3);1):INDEX([.H$1:.H$736];ROW();1)) -> 5904106 | J131: of:=IF([.I131] > [.$B$20];[.I131]-[.$B$20];0) -> 5789801.5975 | K131: of:=IF([.J131] > 0; ROUND([.$B$23] *MIN([.J131];[.H131])); 0) -> 132952 | L131: of:=IF((ROW() - [.$B$13] < 3);0;FLOOR(IFERROR(OFFSET([.$F131];-1*[.$B$13];0 );0) * [.$B$14])) -> 18677 | M131: of:=SUM([.L$3:.L131]) -> 158021
D132: of:=[.D131]+1 -> 2020-05-28T00:00:00.000 | F132: of:=IF([.G131] < [.$B$25];CEILING([.G131]*[.$B$3];1);0) -> 15279294 | G132: of:=IF([.G131] < [.$B$25];SUM([.F$3:.F132]);[.$B$25]) -> 129303872 | H132: of:=IF((ROW() - [.$B$21] < 3);0;FLOOR(IFERROR(OFFSET([.$F132];-1*[.$B$21];0 );0) * [.$B$10])) -> 837596 | I132: of:=SUM(INDEX([.H$1:.H$736];MAX(ROW()+(-1*[.$B$22])+1;3);1):INDEX([.H$1:.H$736];ROW();1)) -> 6695258 | J132: of:=IF([.I132] > [.$B$20];[.I132]-[.$B$20];0) -> 6580953.5975 | K132: of:=IF([.J132] > 0; ROUND([.$B$23] *MIN([.J132];[.H132])); 0) -> 150767 | L132: of:=IF((ROW() - [.$B$13] < 3);0;FLOOR(IFERROR(OFFSET([.$F132];-1*[.$B$13];0 );0) * [.$B$14])) -> 21180 | M132: of:=SUM([.L$3:.L132]) -> 179201
D133: of:=[.D132]+1 -> 2020-05-29T00:00:00.000 | F133: of:=IF([.G132] < [.$B$25];CEILING([.G132]*[.$B$3];1);0) -> 17326719 | G133: of:=IF([.G132] < [.$B$25];SUM([.F$3:.F133]);[.$B$25]) -> 146630591 | H133: of:=IF((ROW() - [.$B$21] < 3);0;FLOOR(IFERROR(OFFSET([.$F133];-1*[.$B$21];0 );0) * [.$B$10])) -> 949834 | I133: of:=SUM(INDEX([.H$1:.H$736];MAX(ROW()+(-1*[.$B$22])+1;3);1):INDEX([.H$1:.H$736];ROW();1)) -> 7592424 | J133: of:=IF([.I133] > [.$B$20];[.I133]-[.$B$20];0) -> 7478119.5975 | K133: of:=IF([.J133] > 0; ROUND([.$B$23] *MIN([.J133];[.H133])); 0) -> 170970 | L133: of:=IF((ROW() - [.$B$13] < 3);0;FLOOR(IFERROR(OFFSET([.$F133];-1*[.$B$13];0 );0) * [.$B$14])) -> 24019 | M133: of:=SUM([.L$3:.L133]) -> 203220
D134: of:=[.D133]+1 -> 2020-05-30T00:00:00.000 | F134: of:=IF([.G133] < [.$B$25];CEILING([.G133]*[.$B$3];1);0) -> 19648500 | G134: of:=IF([.G133] < [.$B$25];SUM([.F$3:.F134]);[.$B$25]) -> 166279091 | H134: of:=IF((ROW() - [.$B$21] < 3);0;FLOOR(IFERROR(OFFSET([.$F134];-1*[.$B$21];0 );0) * [.$B$10])) -> 1077111 | I134: of:=SUM(INDEX([.H$1:.H$736];MAX(ROW()+(-1*[.$B$22])+1;3);1):INDEX([.H$1:.H$736];ROW();1)) -> 8609810 | J134: of:=IF([.I134] > [.$B$20];[.I134]-[.$B$20];0) -> 8495505.5975 | K134: of:=IF([.J134] > 0; ROUND([.$B$23] *MIN([.J134];[.H134])); 0) -> 193880 | L134: of:=IF((ROW() - [.$B$13] < 3);0;FLOOR(IFERROR(OFFSET([.$F134];-1*[.$B$13];0 );0) * [.$B$14])) -> 27237 | M134: of:=SUM([.L$3:.L134]) -> 230457
D135: of:=[.D134]+1 -> 2020-05-31T00:00:00.000 | F135: of:=IF([.G134] < [.$B$25];CEILING([.G134]*[.$B$3];1);0) -> 22281399 | G135: of:=IF([.G134] < [.$B$25];SUM([.F$3:.F135]);[.$B$25]) -> 188560490 | H135: of:=IF((ROW() - [.$B$21] < 3);0;FLOOR(IFERROR(OFFSET([.$F135];-1*[.$B$21];0 );0) * [.$B$10])) -> 1221444 | I135: of:=SUM(INDEX([.H$1:.H$736];MAX(ROW()+(-1*[.$B$22])+1;3);1):INDEX([.H$1:.H$736];ROW();1)) -> 9763526 | J135: of:=IF([.I135] > [.$B$20];[.I135]-[.$B$20];0) -> 9649221.5975 | K135: of:=IF([.J135] > 0; ROUND([.$B$23] *MIN([.J135];[.H135])); 0) -> 219860 | L135: of:=IF((ROW() - [.$B$13] < 3);0;FLOOR(IFERROR(OFFSET([.$F135];-1*[.$B$13];0 );0) * [.$B$14])) -> 30887 | M135: of:=SUM([.L$3:.L135]) -> 261344
D136: of:=[.D135]+1 -> 2020-06-01T00:00:00.000 | F136: of:=IF([.G135] < [.$B$25];CEILING([.G135]*[.$B$3];1);0) -> 25267106 | G136: of:=IF([.G135] < [.$B$25];SUM([.F$3:.F136]);[.$B$25]) -> 213827596 | H136: of:=IF((ROW() - [.$B$21] < 3);0;FLOOR(IFERROR(OFFSET([.$F136];-1*[.$B$21];0 );0) * [.$B$10])) -> 1385118 | I136: of:=SUM(INDEX([.H$1:.H$736];MAX(ROW()+(-1*[.$B$22])+1;3);1):INDEX([.H$1:.H$736];ROW();1)) -> 11071840 | J136: of:=IF([.I136] > [.$B$20];[.I136]-[.$B$20];0) -> 10957535.5975 | K136: of:=IF([.J136] > 0; ROUND([.$B$23] *MIN([.J136];[.H136])); 0) -> 249321 | L136: of:=IF((ROW() - [.$B$13] < 3);0;FLOOR(IFERROR(OFFSET([.$F136];-1*[.$B$13];0 );0) * [.$B$14])) -> 35026 | M136: of:=SUM([.L$3:.L136]) -> 296370
D137: of:=[.D136]+1 -> 2020-06-02T00:00:00.000 | F137: of:=IF([.G136] < [.$B$25];CEILING([.G136]*[.$B$3];1);0) -> 28652898 | G137: of:=IF([.G136] < [.$B$25];SUM([.F$3:.F137]);[.$B$25]) -> 242480494 | H137: of:=IF((ROW() - [.$B$21] < 3);0;FLOOR(IFERROR(OFFSET([.$F137];-1*[.$B$21];0 );0) * [.$B$10])) -> 1570724 | I137: of:=SUM(INDEX([.H$1:.H$736];MAX(ROW()+(-1*[.$B$22])+1;3);1):INDEX([.H$1:.H$736];ROW();1)) -> 12555468 | J137: of:=IF([.I137] > [.$B$20];[.I137]-[.$B$20];0) -> 12441163.5975 | K137: of:=IF([.J137] > 0; ROUND([.$B$23] *MIN([.J137];[.H137])); 0) -> 282730 | L137: of:=IF((ROW() - [.$B$13] < 3);0;FLOOR(IFERROR(OFFSET([.$F137];-1*[.$B$13];0 );0) * [.$B$14])) -> 39719 | M137: of:=SUM([.L$3:.L137]) -> 336089
D138: of:=[.D137]+1 -> 2020-06-03T00:00:00.000 | F138: of:=IF([.G137] < [.$B$25];CEILING([.G137]*[.$B$3];1);0) -> 0 | G138: of:=IF([.G137] < [.$B$25];SUM([.F$3:.F138]);[.$B$25]) -> 222350062.5 | H138: of:=IF((ROW() - [.$B$21] < 3);0;FLOOR(IFERROR(OFFSET([.$F138];-1*[.$B$21];0 );0) * [.$B$10])) -> 1781201 | I138: of:=SUM(INDEX([.H$1:.H$736];MAX(ROW()+(-1*[.$B$22])+1;3);1):INDEX([.H$1:.H$736];ROW();1)) -> 14237902 | J138: of:=IF([.I138] > [.$B$20];[.I138]-[.$B$20];0) -> 14123597.5975 | K138: of:=IF([.J138] > 0; ROUND([.$B$23] *MIN([.J138];[.H138])); 0) -> 320616 | L138: of:=IF((ROW() - [.$B$13] < 3);0;FLOOR(IFERROR(OFFSET([.$F138];-1*[.$B$13];0 );0) * [.$B$14])) -> 45042 | M138: of:=SUM([.L$3:.L138]) -> 381131
D139: of:=[.D138]+1 -> 2020-06-04T00:00:00.000 | F139: of:=IF([.G138] < [.$B$25];CEILING([.G138]*[.$B$3];1);0) -> 0 | G139: of:=IF([.G138] < [.$B$25];SUM([.F$3:.F139]);[.$B$25]) -> 222350062.5 | H139: of:=IF((ROW() - [.$B$21] < 3);0;FLOOR(IFERROR(OFFSET([.$F139];-1*[.$B$21];0 );0) * [.$B$10])) -> 2019882 | I139: of:=SUM(INDEX([.H$1:.H$736];MAX(ROW()+(-1*[.$B$22])+1;3);1):INDEX([.H$1:.H$736];ROW();1)) -> 16145783 | J139: of:=IF([.I139] > [.$B$20];[.I139]-[.$B$20];0) -> 16031478.5975 | K139: of:=IF([.J139] > 0; ROUND([.$B$23] *MIN([.J139];[.H139])); 0) -> 363579 | L139: of:=IF((ROW() - [.$B$13] < 3);0;FLOOR(IFERROR(OFFSET([.$F139];-1*[.$B$13];0 );0) * [.$B$14])) -> 51078 | M139: of:=SUM([.L$3:.L139]) -> 432209
D140: of:=[.D139]+1 -> 2020-06-05T00:00:00.000 | F140: of:=IF([.G139] < [.$B$25];CEILING([.G139]*[.$B$3];1);0) -> 0 | G140: of:=IF([.G139] < [.$B$25];SUM([.F$3:.F140]);[.$B$25]) -> 222350062.5 | H140: of:=IF((ROW() - [.$B$21] < 3);0;FLOOR(IFERROR(OFFSET([.$F140];-1*[.$B$21];0 );0) * [.$B$10])) -> 2290546 | I140: of:=SUM(INDEX([.H$1:.H$736];MAX(ROW()+(-1*[.$B$22])+1;3);1):INDEX([.H$1:.H$736];ROW();1)) -> 18309319 | J140: of:=IF([.I140] > [.$B$20];[.I140]-[.$B$20];0) -> 18195014.5975 | K140: of:=IF([.J140] > 0; ROUND([.$B$23] *MIN([.J140];[.H140])); 0) -> 412298 | L140: of:=IF((ROW() - [.$B$13] < 3);0;FLOOR(IFERROR(OFFSET([.$F140];-1*[.$B$13];0 );0) * [.$B$14])) -> 57922 | M140: of:=SUM([.L$3:.L140]) -> 490131
D141: of:=[.D140]+1 -> 2020-06-06T00:00:00.000 | F141: of:=IF([.G140] < [.$B$25];CEILING([.G140]*[.$B$3];1);0) -> 0 | G141: of:=IF([.G140] < [.$B$25];SUM([.F$3:.F141]);[.$B$25]) -> 222350062.5 | H141: of:=IF((ROW() - [.$B$21] < 3);0;FLOOR(IFERROR(OFFSET([.$F141];-1*[.$B$21];0 );0) * [.$B$10])) -> 2597479 | I141: of:=SUM(INDEX([.H$1:.H$736];MAX(ROW()+(-1*[.$B$22])+1;3);1):INDEX([.H$1:.H$736];ROW();1)) -> 20762769 | J141: of:=IF([.I141] > [.$B$20];[.I141]-[.$B$20];0) -> 20648464.5975 | K141: of:=IF([.J141] > 0; ROUND([.$B$23] *MIN([.J141];[.H141])); 0) -> 467546 | L141: of:=IF((ROW() - [.$B$13] < 3);0;FLOOR(IFERROR(OFFSET([.$F141];-1*[.$B$13];0 );0) * [.$B$14])) -> 65684 | M141: of:=SUM([.L$3:.L141]) -> 555815
D142: of:=[.D141]+1 -> 2020-06-07T00:00:00.000 | F142: of:=IF([.G141] < [.$B$25];CEILING([.G141]*[.$B$3];1);0) -> 0 | G142: of:=IF([.G141] < [.$B$25];SUM([.F$3:.F142]);[.$B$25]) -> 222350062.5 | H142: of:=IF((ROW() - [.$B$21] < 3);0;FLOOR(IFERROR(OFFSET([.$F142];-1*[.$B$21];0 );0) * [.$B$10])) -> 2945542 | I142: of:=SUM(INDEX([.H$1:.H$736];MAX(ROW()+(-1*[.$B$22])+1;3);1):INDEX([.H$1:.H$736];ROW();1)) -> 23544982 | J142: of:=IF([.I142] > [.$B$20];[.I142]-[.$B$20];0) -> 23430677.5975 | K142: of:=IF([.J142] > 0; ROUND([.$B$23] *MIN([.J142];[.H142])); 0) -> 530198 | L142: of:=IF((ROW() - [.$B$13] < 3);0;FLOOR(IFERROR(OFFSET([.$F142];-1*[.$B$13];0 );0) * [.$B$14])) -> 74485 | M142: of:=SUM([.L$3:.L142]) -> 630300
D143: of:=[.D142]+1 -> 2020-06-08T00:00:00.000 | F143: of:=IF([.G142] < [.$B$25];CEILING([.G142]*[.$B$3];1);0) -> 0 | G143: of:=IF([.G142] < [.$B$25];SUM([.F$3:.F143]);[.$B$25]) -> 222350062.5 | H143: of:=IF((ROW() - [.$B$21] < 3);0;FLOOR(IFERROR(OFFSET([.$F143];-1*[.$B$21];0 );0) * [.$B$10])) -> 3340245 | I143: of:=SUM(INDEX([.H$1:.H$736];MAX(ROW()+(-1*[.$B$22])+1;3);1):INDEX([.H$1:.H$736];ROW();1)) -> 26700012 | J143: of:=IF([.I143] > [.$B$20];[.I143]-[.$B$20];0) -> 26585707.5975 | K143: of:=IF([.J143] > 0; ROUND([.$B$23] *MIN([.J143];[.H143])); 0) -> 601244 | L143: of:=IF((ROW() - [.$B$13] < 3);0;FLOOR(IFERROR(OFFSET([.$F143];-1*[.$B$13];0 );0) * [.$B$14])) -> 84466 | M143: of:=SUM([.L$3:.L143]) -> 714766
D144: of:=[.D143]+1 -> 2020-06-09T00:00:00.000 | F144: of:=IF([.G143] < [.$B$25];CEILING([.G143]*[.$B$3];1);0) -> 0 | G144: of:=IF([.G143] < [.$B$25];SUM([.F$3:.F144]);[.$B$25]) -> 222350062.5 | H144: of:=IF((ROW() - [.$B$21] < 3);0;FLOOR(IFERROR(OFFSET([.$F144];-1*[.$B$21];0 );0) * [.$B$10])) -> 3787837 | I144: of:=SUM(INDEX([.H$1:.H$736];MAX(ROW()+(-1*[.$B$22])+1;3);1):INDEX([.H$1:.H$736];ROW();1)) -> 30277815 | J144: of:=IF([.I144] > [.$B$20];[.I144]-[.$B$20];0) -> 30163510.5975 | K144: of:=IF([.J144] > 0; ROUND([.$B$23] *MIN([.J144];[.H144])); 0) -> 681811 | L144: of:=IF((ROW() - [.$B$13] < 3);0;FLOOR(IFERROR(OFFSET([.$F144];-1*[.$B$13];0 );0) * [.$B$14])) -> 95785 | M144: of:=SUM([.L$3:.L144]) -> 810551
D145: of:=[.D144]+1 -> 2020-06-10T00:00:00.000 | F145: of:=IF([.G144] < [.$B$25];CEILING([.G144]*[.$B$3];1);0) -> 0 | G145: of:=IF([.G144] < [.$B$25];SUM([.F$3:.F145]);[.$B$25]) -> 222350062.5 | H145: of:=IF((ROW() - [.$B$21] < 3);0;FLOOR(IFERROR(OFFSET([.$F145];-1*[.$B$21];0 );0) * [.$B$10])) -> 4295408 | I145: of:=SUM(INDEX([.H$1:.H$736];MAX(ROW()+(-1*[.$B$22])+1;3);1):INDEX([.H$1:.H$736];ROW();1)) -> 34335044 | J145: of:=IF([.I145] > [.$B$20];[.I145]-[.$B$20];0) -> 34220739.5975 | K145: of:=IF([.J145] > 0; ROUND([.$B$23] *MIN([.J145];[.H145])); 0) -> 773173 | L145: of:=IF((ROW() - [.$B$13] < 3);0;FLOOR(IFERROR(OFFSET([.$F145];-1*[.$B$13];0 );0) * [.$B$14])) -> 108620 | M145: of:=SUM([.L$3:.L145]) -> 919171
D146: of:=[.D145]+1 -> 2020-06-11T00:00:00.000 | F146: of:=IF([.G145] < [.$B$25];CEILING([.G145]*[.$B$3];1);0) -> 0 | G146: of:=IF([.G145] < [.$B$25];SUM([.F$3:.F146]);[.$B$25]) -> 222350062.5 | H146: of:=IF((ROW() - [.$B$21] < 3);0;FLOOR(IFERROR(OFFSET([.$F146];-1*[.$B$21];0 );0) * [.$B$10])) -> 4870992 | I146: of:=SUM(INDEX([.H$1:.H$736];MAX(ROW()+(-1*[.$B$22])+1;3);1):INDEX([.H$1:.H$736];ROW();1)) -> 38935941 | J146: of:=IF([.I146] > [.$B$20];[.I146]-[.$B$20];0) -> 38821636.5975 | K146: of:=IF([.J146] > 0; ROUND([.$B$23] *MIN([.J146];[.H146])); 0) -> 876779 | L146: of:=IF((ROW() - [.$B$13] < 3);0;FLOOR(IFERROR(OFFSET([.$F146];-1*[.$B$13];0 );0) * [.$B$14])) -> 123175 | M146: of:=SUM([.L$3:.L146]) -> 1042346
D147: of:=[.D146]+1 -> 2020-06-12T00:00:00.000 | F147: of:=IF([.G146] < [.$B$25];CEILING([.G146]*[.$B$3];1);0) -> 0 | G147: of:=IF([.G146] < [.$B$25];SUM([.F$3:.F147]);[.$B$25]) -> 222350062.5 | H147: of:=IF((ROW() - [.$B$21] < 3);0;FLOOR(IFERROR(OFFSET([.$F147];-1*[.$B$21];0 );0) * [.$B$10])) -> 0 | I147: of:=SUM(INDEX([.H$1:.H$736];MAX(ROW()+(-1*[.$B$22])+1;3);1):INDEX([.H$1:.H$736];ROW();1)) -> 38629653 | J147: of:=IF([.I147] > [.$B$20];[.I147]-[.$B$20];0) -> 38515348.5975 | K147: of:=IF([.J147] > 0; ROUND([.$B$23] *MIN([.J147];[.H147])); 0) -> 0 | L147: of:=IF((ROW() - [.$B$13] < 3);0;FLOOR(IFERROR(OFFSET([.$F147];-1*[.$B$13];0 );0) * [.$B$14])) -> 139681 | M147: of:=SUM([.L$3:.L147]) -> 1182027
D148: of:=[.D147]+1 -> 2020-06-13T00:00:00.000 | F148: of:=IF([.G147] < [.$B$25];CEILING([.G147]*[.$B$3];1);0) -> 0 | G148: of:=IF([.G147] < [.$B$25];SUM([.F$3:.F148]);[.$B$25]) -> 222350062.5 | H148: of:=IF((ROW() - [.$B$21] < 3);0;FLOOR(IFERROR(OFFSET([.$F148];-1*[.$B$21];0 );0) * [.$B$10])) -> 0 | I148: of:=SUM(INDEX([.H$1:.H$736];MAX(ROW()+(-1*[.$B$22])+1;3);1):INDEX([.H$1:.H$736];ROW();1)) -> 38282323 | J148: of:=IF([.I148] > [.$B$20];[.I148]-[.$B$20];0) -> 38168018.5975 | K148: of:=IF([.J148] > 0; ROUND([.$B$23] *MIN([.J148];[.H148])); 0) -> 0 | L148: of:=IF((ROW() - [.$B$13] < 3);0;FLOOR(IFERROR(OFFSET([.$F148];-1*[.$B$13];0 );0) * [.$B$14])) -> 158398 | M148: of:=SUM([.L$3:.L148]) -> 1340425
D149: of:=[.D148]+1 -> 2020-06-14T00:00:00.000 | F149: of:=IF([.G148] < [.$B$25];CEILING([.G148]*[.$B$3];1);0) -> 0 | G149: of:=IF([.G148] < [.$B$25];SUM([.F$3:.F149]);[.$B$25]) -> 222350062.5 | H149: of:=IF((ROW() - [.$B$21] < 3);0;FLOOR(IFERROR(OFFSET([.$F149];-1*[.$B$21];0 );0) * [.$B$10])) -> 0 | I149: of:=SUM(INDEX([.H$1:.H$736];MAX(ROW()+(-1*[.$B$22])+1;3);1):INDEX([.H$1:.H$736];ROW();1)) -> 37888450 | J149: of:=IF([.I149] > [.$B$20];[.I149]-[.$B$20];0) -> 37774145.5975 | K149: of:=IF([.J149] > 0; ROUND([.$B$23] *MIN([.J149];[.H149])); 0) -> 0 | L149: of:=IF((ROW() - [.$B$13] < 3);0;FLOOR(IFERROR(OFFSET([.$F149];-1*[.$B$13];0 );0) * [.$B$14])) -> 179624 | M149: of:=SUM([.L$3:.L149]) -> 1520049
D150: of:=[.D149]+1 -> 2020-06-15T00:00:00.000 | F150: of:=IF([.G149] < [.$B$25];CEILING([.G149]*[.$B$3];1);0) -> 0 | G150: of:=IF([.G149] < [.$B$25];SUM([.F$3:.F150]);[.$B$25]) -> 222350062.5 | H150: of:=IF((ROW() - [.$B$21] < 3);0;FLOOR(IFERROR(OFFSET([.$F150];-1*[.$B$21];0 );0) * [.$B$10])) -> 0 | I150: of:=SUM(INDEX([.H$1:.H$736];MAX(ROW()+(-1*[.$B$22])+1;3);1):INDEX([.H$1:.H$736];ROW();1)) -> 37441798 | J150: of:=IF([.I150] > [.$B$20];[.I150]-[.$B$20];0) -> 37327493.5975 | K150: of:=IF([.J150] > 0; ROUND([.$B$23] *MIN([.J150];[.H150])); 0) -> 0 | L150: of:=IF((ROW() - [.$B$13] < 3);0;FLOOR(IFERROR(OFFSET([.$F150];-1*[.$B$13];0 );0) * [.$B$14])) -> 203693 | M150: of:=SUM([.L$3:.L150]) -> 1723742
D151: of:=[.D150]+1 -> 2020-06-16T00:00:00.000 | F151: of:=IF([.G150] < [.$B$25];CEILING([.G150]*[.$B$3];1);0) -> 0 | G151: of:=IF([.G150] < [.$B$25];SUM([.F$3:.F151]);[.$B$25]) -> 222350062.5 | H151: of:=IF((ROW() - [.$B$21] < 3);0;FLOOR(IFERROR(OFFSET([.$F151];-1*[.$B$21];0 );0) * [.$B$10])) -> 0 | I151: of:=SUM(INDEX([.H$1:.H$736];MAX(ROW()+(-1*[.$B$22])+1;3);1):INDEX([.H$1:.H$736];ROW();1)) -> 36935295 | J151: of:=IF([.I151] > [.$B$20];[.I151]-[.$B$20];0) -> 36820990.5975 | K151: of:=IF([.J151] > 0; ROUND([.$B$23] *MIN([.J151];[.H151])); 0) -> 0 | L151: of:=IF((ROW() - [.$B$13] < 3);0;FLOOR(IFERROR(OFFSET([.$F151];-1*[.$B$13];0 );0) * [.$B$14])) -> 230988 | M151: of:=SUM([.L$3:.L151]) -> 1954730
D152: of:=[.D151]+1 -> 2020-06-17T00:00:00.000 | F152: of:=IF([.G151] < [.$B$25];CEILING([.G151]*[.$B$3];1);0) -> 0 | G152: of:=IF([.G151] < [.$B$25];SUM([.F$3:.F152]);[.$B$25]) -> 222350062.5 | H152: of:=IF((ROW() - [.$B$21] < 3);0;FLOOR(IFERROR(OFFSET([.$F152];-1*[.$B$21];0 );0) * [.$B$10])) -> 0 | I152: of:=SUM(INDEX([.H$1:.H$736];MAX(ROW()+(-1*[.$B$22])+1;3);1):INDEX([.H$1:.H$736];ROW();1)) -> 36360920 | J152: of:=IF([.I152] > [.$B$20];[.I152]-[.$B$20];0) -> 36246615.5975 | K152: of:=IF([.J152] > 0; ROUND([.$B$23] *MIN([.J152];[.H152])); 0) -> 0 | L152: of:=IF((ROW() - [.$B$13] < 3);0;FLOOR(IFERROR(OFFSET([.$F152];-1*[.$B$13];0 );0) * [.$B$14])) -> 261941 | M152: of:=SUM([.L$3:.L152]) -> 2216671
D153: of:=[.D152]+1 -> 2020-06-18T00:00:00.000 | F153: of:=IF([.G152] < [.$B$25];CEILING([.G152]*[.$B$3];1);0) -> 0 | G153: of:=IF([.G152] < [.$B$25];SUM([.F$3:.F153]);[.$B$25]) -> 222350062.5 | H153: of:=IF((ROW() - [.$B$21] < 3);0;FLOOR(IFERROR(OFFSET([.$F153];-1*[.$B$21];0 );0) * [.$B$10])) -> 0 | I153: of:=SUM(INDEX([.H$1:.H$736];MAX(ROW()+(-1*[.$B$22])+1;3);1):INDEX([.H$1:.H$736];ROW();1)) -> 35709579 | J153: of:=IF([.I153] > [.$B$20];[.I153]-[.$B$20];0) -> 35595274.5975 | K153: of:=IF([.J153] > 0; ROUND([.$B$23] *MIN([.J153];[.H153])); 0) -> 0 | L153: of:=IF((ROW() - [.$B$13] < 3);0;FLOOR(IFERROR(OFFSET([.$F153];-1*[.$B$13];0 );0) * [.$B$14])) -> 297041 | M153: of:=SUM([.L$3:.L153]) -> 2513712
D154: of:=[.D153]+1 -> 2020-06-19T00:00:00.000 | F154: of:=IF([.G153] < [.$B$25];CEILING([.G153]*[.$B$3];1);0) -> 0 | G154: of:=IF([.G153] < [.$B$25];SUM([.F$3:.F154]);[.$B$25]) -> 222350062.5 | H154: of:=IF((ROW() - [.$B$21] < 3);0;FLOOR(IFERROR(OFFSET([.$F154];-1*[.$B$21];0 );0) * [.$B$10])) -> 0 | I154: of:=SUM(INDEX([.H$1:.H$736];MAX(ROW()+(-1*[.$B$22])+1;3);1):INDEX([.H$1:.H$736];ROW();1)) -> 34970959 | J154: of:=IF([.I154] > [.$B$20];[.I154]-[.$B$20];0) -> 34856654.5975 | K154: of:=IF([.J154] > 0; ROUND([.$B$23] *MIN([.J154];[.H154])); 0) -> 0 | L154: of:=IF((ROW() - [.$B$13] < 3);0;FLOOR(IFERROR(OFFSET([.$F154];-1*[.$B$13];0 );0) * [.$B$14])) -> 336845 | M154: of:=SUM([.L$3:.L154]) -> 2850557
D155: of:=[.D154]+1 -> 2020-06-20T00:00:00.000 | F155: of:=IF([.G154] < [.$B$25];CEILING([.G154]*[.$B$3];1);0) -> 0 | G155: of:=IF([.G154] < [.$B$25];SUM([.F$3:.F155]);[.$B$25]) -> 222350062.5 | H155: of:=IF((ROW() - [.$B$21] < 3);0;FLOOR(IFERROR(OFFSET([.$F155];-1*[.$B$21];0 );0) * [.$B$10])) -> 0 | I155: of:=SUM(INDEX([.H$1:.H$736];MAX(ROW()+(-1*[.$B$22])+1;3);1):INDEX([.H$1:.H$736];ROW();1)) -> 34133363 | J155: of:=IF([.I155] > [.$B$20];[.I155]-[.$B$20];0) -> 34019058.5975 | K155: of:=IF([.J155] > 0; ROUND([.$B$23] *MIN([.J155];[.H155])); 0) -> 0 | L155: of:=IF((ROW() - [.$B$13] < 3);0;FLOOR(IFERROR(OFFSET([.$F155];-1*[.$B$13];0 );0) * [.$B$14])) -> 381982 | M155: of:=SUM([.L$3:.L155]) -> 3232539
D156: of:=[.D155]+1 -> 2020-06-21T00:00:00.000 | F156: of:=IF([.G155] < [.$B$25];CEILING([.G155]*[.$B$3];1);0) -> 0 | G156: of:=IF([.G155] < [.$B$25];SUM([.F$3:.F156]);[.$B$25]) -> 222350062.5 | H156: of:=IF((ROW() - [.$B$21] < 3);0;FLOOR(IFERROR(OFFSET([.$F156];-1*[.$B$21];0 );0) * [.$B$10])) -> 0 | I156: of:=SUM(INDEX([.H$1:.H$736];MAX(ROW()+(-1*[.$B$22])+1;3);1):INDEX([.H$1:.H$736];ROW();1)) -> 33183529 | J156: of:=IF([.I156] > [.$B$20];[.I156]-[.$B$20];0) -> 33069224.5975 | K156: of:=IF([.J156] > 0; ROUND([.$B$23] *MIN([.J156];[.H156])); 0) -> 0 | L156: of:=IF((ROW() - [.$B$13] < 3);0;FLOOR(IFERROR(OFFSET([.$F156];-1*[.$B$13];0 );0) * [.$B$14])) -> 433167 | M156: of:=SUM([.L$3:.L156]) -> 3665706
D157: of:=[.D156]+1 -> 2020-06-22T00:00:00.000 | F157: of:=IF([.G156] < [.$B$25];CEILING([.G156]*[.$B$3];1);0) -> 0 | G157: of:=IF([.G156] < [.$B$25];SUM([.F$3:.F157]);[.$B$25]) -> 222350062.5 | H157: of:=IF((ROW() - [.$B$21] < 3);0;FLOOR(IFERROR(OFFSET([.$F157];-1*[.$B$21];0 );0) * [.$B$10])) -> 0 | I157: of:=SUM(INDEX([.H$1:.H$736];MAX(ROW()+(-1*[.$B$22])+1;3);1):INDEX([.H$1:.H$736];ROW();1)) -> 32106418 | J157: of:=IF([.I157] > [.$B$20];[.I157]-[.$B$20];0) -> 31992113.5975 | K157: of:=IF([.J157] > 0; ROUND([.$B$23] *MIN([.J157];[.H157])); 0) -> 0 | L157: of:=IF((ROW() - [.$B$13] < 3);0;FLOOR(IFERROR(OFFSET([.$F157];-1*[.$B$13];0 );0) * [.$B$14])) -> 491212 | M157: of:=SUM([.L$3:.L157]) -> 4156918
D158: of:=[.D157]+1 -> 2020-06-23T00:00:00.000 | F158: of:=IF([.G157] < [.$B$25];CEILING([.G157]*[.$B$3];1);0) -> 0 | G158: of:=IF([.G157] < [.$B$25];SUM([.F$3:.F158]);[.$B$25]) -> 222350062.5 | H158: of:=IF((ROW() - [.$B$21] < 3);0;FLOOR(IFERROR(OFFSET([.$F158];-1*[.$B$21];0 );0) * [.$B$10])) -> 0 | I158: of:=SUM(INDEX([.H$1:.H$736];MAX(ROW()+(-1*[.$B$22])+1;3);1):INDEX([.H$1:.H$736];ROW();1)) -> 30884974 | J158: of:=IF([.I158] > [.$B$20];[.I158]-[.$B$20];0) -> 30770669.5975 | K158: of:=IF([.J158] > 0; ROUND([.$B$23] *MIN([.J158];[.H158])); 0) -> 0 | L158: of:=IF((ROW() - [.$B$13] < 3);0;FLOOR(IFERROR(OFFSET([.$F158];-1*[.$B$13];0 );0) * [.$B$14])) -> 557034 | M158: of:=SUM([.L$3:.L158]) -> 4713952
D159: of:=[.D158]+1 -> 2020-06-24T00:00:00.000 | F159: of:=IF([.G158] < [.$B$25];CEILING([.G158]*[.$B$3];1);0) -> 0 | G159: of:=IF([.G158] < [.$B$25];SUM([.F$3:.F159]);[.$B$25]) -> 222350062.5 | H159: of:=IF((ROW() - [.$B$21] < 3);0;FLOOR(IFERROR(OFFSET([.$F159];-1*[.$B$21];0 );0) * [.$B$10])) -> 0 | I159: of:=SUM(INDEX([.H$1:.H$736];MAX(ROW()+(-1*[.$B$22])+1;3);1):INDEX([.H$1:.H$736];ROW();1)) -> 29499856 | J159: of:=IF([.I159] > [.$B$20];[.I159]-[.$B$20];0) -> 29385551.5975 | K159: of:=IF([.J159] > 0; ROUND([.$B$23] *MIN([.J159];[.H159])); 0) -> 0 | L159: of:=IF((ROW() - [.$B$13] < 3);0;FLOOR(IFERROR(OFFSET([.$F159];-1*[.$B$13];0 );0) * [.$B$14])) -> 631677 | M159: of:=SUM([.L$3:.L159]) -> 5345629
D160: of:=[.D159]+1 -> 2020-06-25T00:00:00.000 | F160: of:=IF([.G159] < [.$B$25];CEILING([.G159]*[.$B$3];1);0) -> 0 | G160: of:=IF([.G159] < [.$B$25];SUM([.F$3:.F160]);[.$B$25]) -> 222350062.5 | H160: of:=IF((ROW() - [.$B$21] < 3);0;FLOOR(IFERROR(OFFSET([.$F160];-1*[.$B$21];0 );0) * [.$B$10])) -> 0 | I160: of:=SUM(INDEX([.H$1:.H$736];MAX(ROW()+(-1*[.$B$22])+1;3);1):INDEX([.H$1:.H$736];ROW();1)) -> 27929132 | J160: of:=IF([.I160] > [.$B$20];[.I160]-[.$B$20];0) -> 27814827.5975 | K160: of:=IF([.J160] > 0; ROUND([.$B$23] *MIN([.J160];[.H160])); 0) -> 0 | L160: of:=IF((ROW() - [.$B$13] < 3);0;FLOOR(IFERROR(OFFSET([.$F160];-1*[.$B$13];0 );0) * [.$B$14])) -> 716322 | M160: of:=SUM([.L$3:.L160]) -> 6061951
D161: of:=[.D160]+1 -> 2020-06-26T00:00:00.000 | F161: of:=IF([.G160] < [.$B$25];CEILING([.G160]*[.$B$3];1);0) -> 0 | G161: of:=IF([.G160] < [.$B$25];SUM([.F$3:.F161]);[.$B$25]) -> 222350062.5 | H161: of:=IF((ROW() - [.$B$21] < 3);0;FLOOR(IFERROR(OFFSET([.$F161];-1*[.$B$21];0 );0) * [.$B$10])) -> 0 | I161: of:=SUM(INDEX([.H$1:.H$736];MAX(ROW()+(-1*[.$B$22])+1;3);1):INDEX([.H$1:.H$736];ROW();1)) -> 26147931 | J161: of:=IF([.I161] > [.$B$20];[.I161]-[.$B$20];0) -> 26033626.5975 | K161: of:=IF([.J161] > 0; ROUND([.$B$23] *MIN([.J161];[.H161])); 0) -> 0 | L161: of:=IF((ROW() - [.$B$13] < 3);0;FLOOR(IFERROR(OFFSET([.$F161];-1*[.$B$13];0 );0) * [.$B$14])) -> 0 | M161: of:=SUM([.L$3:.L161]) -> 6061951
D162: of:=[.D161]+1 -> 2020-06-27T00:00:00.000 | F162: of:=IF([.G161] < [.$B$25];CEILING([.G161]*[.$B$3];1);0) -> 0 | G162: of:=IF([.G161] < [.$B$25];SUM([.F$3:.F162]);[.$B$25]) -> 222350062.5 | H162: of:=IF((ROW() - [.$B$21] < 3);0;FLOOR(IFERROR(OFFSET([.$F162];-1*[.$B$21];0 );0) * [.$B$10])) -> 0 | I162: of:=SUM(INDEX([.H$1:.H$736];MAX(ROW()+(-1*[.$B$22])+1;3);1):INDEX([.H$1:.H$736];ROW();1)) -> 24128049 | J162: of:=IF([.I162] > [.$B$20];[.I162]-[.$B$20];0) -> 24013744.5975 | K162: of:=IF([.J162] > 0; ROUND([.$B$23] *MIN([.J162];[.H162])); 0) -> 0 | L162: of:=IF((ROW() - [.$B$13] < 3);0;FLOOR(IFERROR(OFFSET([.$F162];-1*[.$B$13];0 );0) * [.$B$14])) -> 0 | M162: of:=SUM([.L$3:.L162]) -> 6061951
D163: of:=[.D162]+1 -> 2020-06-28T00:00:00.000 | F163: of:=IF([.G162] < [.$B$25];CEILING([.G162]*[.$B$3];1);0) -> 0 | G163: of:=IF([.G162] < [.$B$25];SUM([.F$3:.F163]);[.$B$25]) -> 222350062.5 | H163: of:=IF((ROW() - [.$B$21] < 3);0;FLOOR(IFERROR(OFFSET([.$F163];-1*[.$B$21];0 );0) * [.$B$10])) -> 0 | I163: of:=SUM(INDEX([.H$1:.H$736];MAX(ROW()+(-1*[.$B$22])+1;3);1):INDEX([.H$1:.H$736];ROW();1)) -> 21837503 | J163: of:=IF([.I163] > [.$B$20];[.I163]-[.$B$20];0) -> 21723198.5975 | K163: of:=IF([.J163] > 0; ROUND([.$B$23] *MIN([.J163];[.H163])); 0) -> 0 | L163: of:=IF((ROW() - [.$B$13] < 3);0;FLOOR(IFERROR(OFFSET([.$F163];-1*[.$B$13];0 );0) * [.$B$14])) -> 0 | M163: of:=SUM([.L$3:.L163]) -> 6061951
D164: of:=[.D163]+1 -> 2020-06-29T00:00:00.000 | F164: of:=IF([.G163] < [.$B$25];CEILING([.G163]*[.$B$3];1);0) -> 0 | G164: of:=IF([.G163] < [.$B$25];SUM([.F$3:.F164]);[.$B$25]) -> 222350062.5 | H164: of:=IF((ROW() - [.$B$21] < 3);0;FLOOR(IFERROR(OFFSET([.$F164];-1*[.$B$21];0 );0) * [.$B$10])) -> 0 | I164: of:=SUM(INDEX([.H$1:.H$736];MAX(ROW()+(-1*[.$B$22])+1;3);1):INDEX([.H$1:.H$736];ROW();1)) -> 19240024 | J164: of:=IF([.I164] > [.$B$20];[.I164]-[.$B$20];0) -> 19125719.5975 | K164: of:=IF([.J164] > 0; ROUND([.$B$23] *MIN([.J164];[.H164])); 0) -> 0 | L164: of:=IF((ROW() - [.$B$13] < 3);0;FLOOR(IFERROR(OFFSET([.$F164];-1*[.$B$13];0 );0) * [.$B$14])) -> 0 | M164: of:=SUM([.L$3:.L164]) -> 6061951
D165: of:=[.D164]+1 -> 2020-06-30T00:00:00.000 | F165: of:=IF([.G164] < [.$B$25];CEILING([.G164]*[.$B$3];1);0) -> 0 | G165: of:=IF([.G164] < [.$B$25];SUM([.F$3:.F165]);[.$B$25]) -> 222350062.5 | H165: of:=IF((ROW() - [.$B$21] < 3);0;FLOOR(IFERROR(OFFSET([.$F165];-1*[.$B$21];0 );0) * [.$B$10])) -> 0 | I165: of:=SUM(INDEX([.H$1:.H$736];MAX(ROW()+(-1*[.$B$22])+1;3);1):INDEX([.H$1:.H$736];ROW();1)) -> 16294482 | J165: of:=IF([.I165] > [.$B$20];[.I165]-[.$B$20];0) -> 16180177.5975 | K165: of:=IF([.J165] > 0; ROUND([.$B$23] *MIN([.J165];[.H165])); 0) -> 0 | L165: of:=IF((ROW() - [.$B$13] < 3);0;FLOOR(IFERROR(OFFSET([.$F165];-1*[.$B$13];0 );0) * [.$B$14])) -> 0 | M165: of:=SUM([.L$3:.L165]) -> 6061951
D166: of:=[.D165]+1 -> 2020-07-01T00:00:00.000 | F166: of:=IF([.G165] < [.$B$25];CEILING([.G165]*[.$B$3];1);0) -> 0 | G166: of:=IF([.G165] < [.$B$25];SUM([.F$3:.F166]);[.$B$25]) -> 222350062.5 | H166: of:=IF((ROW() - [.$B$21] < 3);0;FLOOR(IFERROR(OFFSET([.$F166];-1*[.$B$21];0 );0) * [.$B$10])) -> 0 | I166: of:=SUM(INDEX([.H$1:.H$736];MAX(ROW()+(-1*[.$B$22])+1;3);1):INDEX([.H$1:.H$736];ROW();1)) -> 12954237 | J166: of:=IF([.I166] > [.$B$20];[.I166]-[.$B$20];0) -> 12839932.5975 | K166: of:=IF([.J166] > 0; ROUND([.$B$23] *MIN([.J166];[.H166])); 0) -> 0 | L166: of:=IF((ROW() - [.$B$13] < 3);0;FLOOR(IFERROR(OFFSET([.$F166];-1*[.$B$13];0 );0) * [.$B$14])) -> 0 | M166: of:=SUM([.L$3:.L166]) -> 6061951
D167: of:=[.D166]+1 -> 2020-07-02T00:00:00.000 | F167: of:=IF([.G166] < [.$B$25];CEILING([.G166]*[.$B$3];1);0) -> 0 | G167: of:=IF([.G166] < [.$B$25];SUM([.F$3:.F167]);[.$B$25]) -> 222350062.5 | H167: of:=IF((ROW() - [.$B$21] < 3);0;FLOOR(IFERROR(OFFSET([.$F167];-1*[.$B$21];0 );0) * [.$B$10])) -> 0 | I167: of:=SUM(INDEX([.H$1:.H$736];MAX(ROW()+(-1*[.$B$22])+1;3);1):INDEX([.H$1:.H$736];ROW();1)) -> 9166400 | J167: of:=IF([.I167] > [.$B$20];[.I167]-[.$B$20];0) -> 9052095.5975 | K167: of:=IF([.J167] > 0; ROUND([.$B$23] *MIN([.J167];[.H167])); 0) -> 0 | L167: of:=IF((ROW() - [.$B$13] < 3);0;FLOOR(IFERROR(OFFSET([.$F167];-1*[.$B$13];0 );0) * [.$B$14])) -> 0 | M167: of:=SUM([.L$3:.L167]) -> 6061951
D168: of:=[.D167]+1 -> 2020-07-03T00:00:00.000 | F168: of:=IF([.G167] < [.$B$25];CEILING([.G167]*[.$B$3];1);0) -> 0 | G168: of:=IF([.G167] < [.$B$25];SUM([.F$3:.F168]);[.$B$25]) -> 222350062.5 | H168: of:=IF((ROW() - [.$B$21] < 3);0;FLOOR(IFERROR(OFFSET([.$F168];-1*[.$B$21];0 );0) * [.$B$10])) -> 0 | I168: of:=SUM(INDEX([.H$1:.H$736];MAX(ROW()+(-1*[.$B$22])+1;3);1):INDEX([.H$1:.H$736];ROW();1)) -> 4870992 | J168: of:=IF([.I168] > [.$B$20];[.I168]-[.$B$20];0) -> 4756687.5975 | K168: of:=IF([.J168] > 0; ROUND([.$B$23] *MIN([.J168];[.H168])); 0) -> 0 | L168: of:=IF((ROW() - [.$B$13] < 3);0;FLOOR(IFERROR(OFFSET([.$F168];-1*[.$B$13];0 );0) * [.$B$14])) -> 0 | M168: of:=SUM([.L$3:.L168]) -> 6061951
D169: of:=[.D168]+1 -> 2020-07-04T00:00:00.000 | F169: of:=IF([.G168] < [.$B$25];CEILING([.G168]*[.$B$3];1);0) -> 0 | G169: of:=IF([.G168] < [.$B$25];SUM([.F$3:.F169]);[.$B$25]) -> 222350062.5 | H169: of:=IF((ROW() - [.$B$21] < 3);0;FLOOR(IFERROR(OFFSET([.$F169];-1*[.$B$21];0 );0) * [.$B$10])) -> 0 | I169: of:=SUM(INDEX([.H$1:.H$736];MAX(ROW()+(-1*[.$B$22])+1;3);1):INDEX([.H$1:.H$736];ROW();1)) -> 0 | J169: of:=IF([.I169] > [.$B$20];[.I169]-[.$B$20];0) -> 0 | K169: of:=IF([.J169] > 0; ROUND([.$B$23] *MIN([.J169];[.H169])); 0) -> 0 | L169: of:=IF((ROW() - [.$B$13] < 3);0;FLOOR(IFERROR(OFFSET([.$F169];-1*[.$B$13];0 );0) * [.$B$14])) -> 0 | M169: of:=SUM([.L$3:.L169]) -> 6061951
D170: of:=[.D169]+1 -> 2020-07-05T00:00:00.000 | F170: of:=IF([.G169] < [.$B$25];CEILING([.G169]*[.$B$3];1);0) -> 0 | G170: of:=IF([.G169] < [.$B$25];SUM([.F$3:.F170]);[.$B$25]) -> 222350062.5 | H170: of:=IF((ROW() - [.$B$21] < 3);0;FLOOR(IFERROR(OFFSET([.$F170];-1*[.$B$21];0 );0) * [.$B$10])) -> 0 | I170: of:=SUM(INDEX([.H$1:.H$736];MAX(ROW()+(-1*[.$B$22])+1;3);1):INDEX([.H$1:.H$736];ROW();1)) -> 0 | J170: of:=IF([.I170] > [.$B$20];[.I170]-[.$B$20];0) -> 0 | K170: of:=IF([.J170] > 0; ROUND([.$B$23] *MIN([.J170];[.H170])); 0) -> 0 | L170: of:=IF((ROW() - [.$B$13] < 3);0;FLOOR(IFERROR(OFFSET([.$F170];-1*[.$B$13];0 );0) * [.$B$14])) -> 0 | M170: of:=SUM([.L$3:.L170]) -> 6061951
D171: of:=[.D170]+1 -> 2020-07-06T00:00:00.000 | F171: of:=IF([.G170] < [.$B$25];CEILING([.G170]*[.$B$3];1);0) -> 0 | G171: of:=IF([.G170] < [.$B$25];SUM([.F$3:.F171]);[.$B$25]) -> 222350062.5 | H171: of:=IF((ROW() - [.$B$21] < 3);0;FLOOR(IFERROR(OFFSET([.$F171];-1*[.$B$21];0 );0) * [.$B$10])) -> 0 | I171: of:=SUM(INDEX([.H$1:.H$736];MAX(ROW()+(-1*[.$B$22])+1;3);1):INDEX([.H$1:.H$736];ROW();1)) -> 0 | J171: of:=IF([.I171] > [.$B$20];[.I171]-[.$B$20];0) -> 0 | K171: of:=IF([.J171] > 0; ROUND([.$B$23] *MIN([.J171];[.H171])); 0) -> 0 | L171: of:=IF((ROW() - [.$B$13] < 3);0;FLOOR(IFERROR(OFFSET([.$F171];-1*[.$B$13];0 );0) * [.$B$14])) -> 0 | M171: of:=SUM([.L$3:.L171]) -> 6061951
D172: of:=[.D171]+1 -> 2020-07-07T00:00:00.000 | F172: of:=IF([.G171] < [.$B$25];CEILING([.G171]*[.$B$3];1);0) -> 0 | G172: of:=IF([.G171] < [.$B$25];SUM([.F$3:.F172]);[.$B$25]) -> 222350062.5 | H172: of:=IF((ROW() - [.$B$21] < 3);0;FLOOR(IFERROR(OFFSET([.$F172];-1*[.$B$21];0 );0) * [.$B$10])) -> 0 | I172: of:=SUM(INDEX([.H$1:.H$736];MAX(ROW()+(-1*[.$B$22])+1;3);1):INDEX([.H$1:.H$736];ROW();1)) -> 0 | J172: of:=IF([.I172] > [.$B$20];[.I172]-[.$B$20];0) -> 0 | K172: of:=IF([.J172] > 0; ROUND([.$B$23] *MIN([.J172];[.H172])); 0) -> 0 | L172: of:=IF((ROW() - [.$B$13] < 3);0;FLOOR(IFERROR(OFFSET([.$F172];-1*[.$B$13];0 );0) * [.$B$14])) -> 0 | M172: of:=SUM([.L$3:.L172]) -> 6061951
D173: of:=[.D172]+1 -> 2020-07-08T00:00:00.000 | F173: of:=IF([.G172] < [.$B$25];CEILING([.G172]*[.$B$3];1);0) -> 0 | G173: of:=IF([.G172] < [.$B$25];SUM([.F$3:.F173]);[.$B$25]) -> 222350062.5 | H173: of:=IF((ROW() - [.$B$21] < 3);0;FLOOR(IFERROR(OFFSET([.$F173];-1*[.$B$21];0 );0) * [.$B$10])) -> 0 | I173: of:=SUM(INDEX([.H$1:.H$736];MAX(ROW()+(-1*[.$B$22])+1;3);1):INDEX([.H$1:.H$736];ROW();1)) -> 0 | J173: of:=IF([.I173] > [.$B$20];[.I173]-[.$B$20];0) -> 0 | K173: of:=IF([.J173] > 0; ROUND([.$B$23] *MIN([.J173];[.H173])); 0) -> 0 | L173: of:=IF((ROW() - [.$B$13] < 3);0;FLOOR(IFERROR(OFFSET([.$F173];-1*[.$B$13];0 );0) * [.$B$14])) -> 0 | M173: of:=SUM([.L$3:.L173]) -> 6061951
D174: of:=[.D173]+1 -> 2020-07-09T00:00:00.000 | F174: of:=IF([.G173] < [.$B$25];CEILING([.G173]*[.$B$3];1);0) -> 0 | G174: of:=IF([.G173] < [.$B$25];SUM([.F$3:.F174]);[.$B$25]) -> 222350062.5 | H174: of:=IF((ROW() - [.$B$21] < 3);0;FLOOR(IFERROR(OFFSET([.$F174];-1*[.$B$21];0 );0) * [.$B$10])) -> 0 | I174: of:=SUM(INDEX([.H$1:.H$736];MAX(ROW()+(-1*[.$B$22])+1;3);1):INDEX([.H$1:.H$736];ROW();1)) -> 0 | J174: of:=IF([.I174] > [.$B$20];[.I174]-[.$B$20];0) -> 0 | K174: of:=IF([.J174] > 0; ROUND([.$B$23] *MIN([.J174];[.H174])); 0) -> 0 | L174: of:=IF((ROW() - [.$B$13] < 3);0;FLOOR(IFERROR(OFFSET([.$F174];-1*[.$B$13];0 );0) * [.$B$14])) -> 0 | M174: of:=SUM([.L$3:.L174]) -> 6061951
D175: of:=[.D174]+1 -> 2020-07-10T00:00:00.000 | F175: of:=IF([.G174] < [.$B$25];CEILING([.G174]*[.$B$3];1);0) -> 0 | G175: of:=IF([.G174] < [.$B$25];SUM([.F$3:.F175]);[.$B$25]) -> 222350062.5 | H175: of:=IF((ROW() - [.$B$21] < 3);0;FLOOR(IFERROR(OFFSET([.$F175];-1*[.$B$21];0 );0) * [.$B$10])) -> 0 | I175: of:=SUM(INDEX([.H$1:.H$736];MAX(ROW()+(-1*[.$B$22])+1;3);1):INDEX([.H$1:.H$736];ROW();1)) -> 0 | J175: of:=IF([.I175] > [.$B$20];[.I175]-[.$B$20];0) -> 0 | K175: of:=IF([.J175] > 0; ROUND([.$B$23] *MIN([.J175];[.H175])); 0) -> 0 | L175: of:=IF((ROW() - [.$B$13] < 3);0;FLOOR(IFERROR(OFFSET([.$F175];-1*[.$B$13];0 );0) * [.$B$14])) -> 0 | M175: of:=SUM([.L$3:.L175]) -> 6061951
D176: of:=[.D175]+1 -> 2020-07-11T00:00:00.000 | F176: of:=IF([.G175] < [.$B$25];CEILING([.G175]*[.$B$3];1);0) -> 0 | G176: of:=IF([.G175] < [.$B$25];SUM([.F$3:.F176]);[.$B$25]) -> 222350062.5 | H176: of:=IF((ROW() - [.$B$21] < 3);0;FLOOR(IFERROR(OFFSET([.$F176];-1*[.$B$21];0 );0) * [.$B$10])) -> 0 | I176: of:=SUM(INDEX([.H$1:.H$736];MAX(ROW()+(-1*[.$B$22])+1;3);1):INDEX([.H$1:.H$736];ROW();1)) -> 0 | J176: of:=IF([.I176] > [.$B$20];[.I176]-[.$B$20];0) -> 0 | K176: of:=IF([.J176] > 0; ROUND([.$B$23] *MIN([.J176];[.H176])); 0) -> 0 | L176: of:=IF((ROW() - [.$B$13] < 3);0;FLOOR(IFERROR(OFFSET([.$F176];-1*[.$B$13];0 );0) * [.$B$14])) -> 0 | M176: of:=SUM([.L$3:.L176]) -> 6061951
D177: of:=[.D176]+1 -> 2020-07-12T00:00:00.000 | F177: of:=IF([.G176] < [.$B$25];CEILING([.G176]*[.$B$3];1);0) -> 0 | G177: of:=IF([.G176] < [.$B$25];SUM([.F$3:.F177]);[.$B$25]) -> 222350062.5 | H177: of:=IF((ROW() - [.$B$21] < 3);0;FLOOR(IFERROR(OFFSET([.$F177];-1*[.$B$21];0 );0) * [.$B$10])) -> 0 | I177: of:=SUM(INDEX([.H$1:.H$736];MAX(ROW()+(-1*[.$B$22])+1;3);1):INDEX([.H$1:.H$736];ROW();1)) -> 0 | J177: of:=IF([.I177] > [.$B$20];[.I177]-[.$B$20];0) -> 0 | K177: of:=IF([.J177] > 0; ROUND([.$B$23] *MIN([.J177];[.H177])); 0) -> 0 | L177: of:=IF((ROW() - [.$B$13] < 3);0;FLOOR(IFERROR(OFFSET([.$F177];-1*[.$B$13];0 );0) * [.$B$14])) -> 0 | M177: of:=SUM([.L$3:.L177]) -> 6061951
D178: of:=[.D177]+1 -> 2020-07-13T00:00:00.000 | F178: of:=IF([.G177] < [.$B$25];CEILING([.G177]*[.$B$3];1);0) -> 0 | G178: of:=IF([.G177] < [.$B$25];SUM([.F$3:.F178]);[.$B$25]) -> 222350062.5 | H178: of:=IF((ROW() - [.$B$21] < 3);0;FLOOR(IFERROR(OFFSET([.$F178];-1*[.$B$21];0 );0) * [.$B$10])) -> 0 | I178: of:=SUM(INDEX([.H$1:.H$736];MAX(ROW()+(-1*[.$B$22])+1;3);1):INDEX([.H$1:.H$736];ROW();1)) -> 0 | J178: of:=IF([.I178] > [.$B$20];[.I178]-[.$B$20];0) -> 0 | K178: of:=IF([.J178] > 0; ROUND([.$B$23] *MIN([.J178];[.H178])); 0) -> 0 | L178: of:=IF((ROW() - [.$B$13] < 3);0;FLOOR(IFERROR(OFFSET([.$F178];-1*[.$B$13];0 );0) * [.$B$14])) -> 0 | M178: of:=SUM([.L$3:.L178]) -> 6061951
D179: of:=[.D178]+1 -> 2020-07-14T00:00:00.000 | F179: of:=IF([.G178] < [.$B$25];CEILING([.G178]*[.$B$3];1);0) -> 0 | G179: of:=IF([.G178] < [.$B$25];SUM([.F$3:.F179]);[.$B$25]) -> 222350062.5 | H179: of:=IF((ROW() - [.$B$21] < 3);0;FLOOR(IFERROR(OFFSET([.$F179];-1*[.$B$21];0 );0) * [.$B$10])) -> 0 | I179: of:=SUM(INDEX([.H$1:.H$736];MAX(ROW()+(-1*[.$B$22])+1;3);1):INDEX([.H$1:.H$736];ROW();1)) -> 0 | J179: of:=IF([.I179] > [.$B$20];[.I179]-[.$B$20];0) -> 0 | K179: of:=IF([.J179] > 0; ROUND([.$B$23] *MIN([.J179];[.H179])); 0) -> 0 | L179: of:=IF((ROW() - [.$B$13] < 3);0;FLOOR(IFERROR(OFFSET([.$F179];-1*[.$B$13];0 );0) * [.$B$14])) -> 0 | M179: of:=SUM([.L$3:.L179]) -> 6061951
D180: of:=[.D179]+1 -> 2020-07-15T00:00:00.000 | F180: of:=IF([.G179] < [.$B$25];CEILING([.G179]*[.$B$3];1);0) -> 0 | G180: of:=IF([.G179] < [.$B$25];SUM([.F$3:.F180]);[.$B$25]) -> 222350062.5 | H180: of:=IF((ROW() - [.$B$21] < 3);0;FLOOR(IFERROR(OFFSET([.$F180];-1*[.$B$21];0 );0) * [.$B$10])) -> 0 | I180: of:=SUM(INDEX([.H$1:.H$736];MAX(ROW()+(-1*[.$B$22])+1;3);1):INDEX([.H$1:.H$736];ROW();1)) -> 0 | J180: of:=IF([.I180] > [.$B$20];[.I180]-[.$B$20];0) -> 0 | K180: of:=IF([.J180] > 0; ROUND([.$B$23] *MIN([.J180];[.H180])); 0) -> 0 | L180: of:=IF((ROW() - [.$B$13] < 3);0;FLOOR(IFERROR(OFFSET([.$F180];-1*[.$B$13];0 );0) * [.$B$14])) -> 0 | M180: of:=SUM([.L$3:.L180]) -> 6061951
D181: of:=[.D180]+1 -> 2020-07-16T00:00:00.000 | F181: of:=IF([.G180] < [.$B$25];CEILING([.G180]*[.$B$3];1);0) -> 0 | G181: of:=IF([.G180] < [.$B$25];SUM([.F$3:.F181]);[.$B$25]) -> 222350062.5 | H181: of:=IF((ROW() - [.$B$21] < 3);0;FLOOR(IFERROR(OFFSET([.$F181];-1*[.$B$21];0 );0) * [.$B$10])) -> 0 | I181: of:=SUM(INDEX([.H$1:.H$736];MAX(ROW()+(-1*[.$B$22])+1;3);1):INDEX([.H$1:.H$736];ROW();1)) -> 0 | J181: of:=IF([.I181] > [.$B$20];[.I181]-[.$B$20];0) -> 0 | K181: of:=IF([.J181] > 0; ROUND([.$B$23] *MIN([.J181];[.H181])); 0) -> 0 | L181: of:=IF((ROW() - [.$B$13] < 3);0;FLOOR(IFERROR(OFFSET([.$F181];-1*[.$B$13];0 );0) * [.$B$14])) -> 0 | M181: of:=SUM([.L$3:.L181]) -> 6061951
D182: of:=[.D181]+1 -> 2020-07-17T00:00:00.000 | F182: of:=IF([.G181] < [.$B$25];CEILING([.G181]*[.$B$3];1);0) -> 0 | G182: of:=IF([.G181] < [.$B$25];SUM([.F$3:.F182]);[.$B$25]) -> 222350062.5 | H182: of:=IF((ROW() - [.$B$21] < 3);0;FLOOR(IFERROR(OFFSET([.$F182];-1*[.$B$21];0 );0) * [.$B$10])) -> 0 | I182: of:=SUM(INDEX([.H$1:.H$736];MAX(ROW()+(-1*[.$B$22])+1;3);1):INDEX([.H$1:.H$736];ROW();1)) -> 0 | J182: of:=IF([.I182] > [.$B$20];[.I182]-[.$B$20];0) -> 0 | K182: of:=IF([.J182] > 0; ROUND([.$B$23] *MIN([.J182];[.H182])); 0) -> 0 | L182: of:=IF((ROW() - [.$B$13] < 3);0;FLOOR(IFERROR(OFFSET([.$F182];-1*[.$B$13];0 );0) * [.$B$14])) -> 0 | M182: of:=SUM([.L$3:.L182]) -> 6061951
D183: of:=[.D182]+1 -> 2020-07-18T00:00:00.000 | F183: of:=IF([.G182] < [.$B$25];CEILING([.G182]*[.$B$3];1);0) -> 0 | G183: of:=IF([.G182] < [.$B$25];SUM([.F$3:.F183]);[.$B$25]) -> 222350062.5 | H183: of:=IF((ROW() - [.$B$21] < 3);0;FLOOR(IFERROR(OFFSET([.$F183];-1*[.$B$21];0 );0) * [.$B$10])) -> 0 | I183: of:=SUM(INDEX([.H$1:.H$736];MAX(ROW()+(-1*[.$B$22])+1;3);1):INDEX([.H$1:.H$736];ROW();1)) -> 0 | J183: of:=IF([.I183] > [.$B$20];[.I183]-[.$B$20];0) -> 0 | K183: of:=IF([.J183] > 0; ROUND([.$B$23] *MIN([.J183];[.H183])); 0) -> 0 | L183: of:=IF((ROW() - [.$B$13] < 3);0;FLOOR(IFERROR(OFFSET([.$F183];-1*[.$B$13];0 );0) * [.$B$14])) -> 0 | M183: of:=SUM([.L$3:.L183]) -> 6061951
D184: of:=[.D183]+1 -> 2020-07-19T00:00:00.000 | F184: of:=IF([.G183] < [.$B$25];CEILING([.G183]*[.$B$3];1);0) -> 0 | G184: of:=IF([.G183] < [.$B$25];SUM([.F$3:.F184]);[.$B$25]) -> 222350062.5 | H184: of:=IF((ROW() - [.$B$21] < 3);0;FLOOR(IFERROR(OFFSET([.$F184];-1*[.$B$21];0 );0) * [.$B$10])) -> 0 | I184: of:=SUM(INDEX([.H$1:.H$736];MAX(ROW()+(-1*[.$B$22])+1;3);1):INDEX([.H$1:.H$736];ROW();1)) -> 0 | J184: of:=IF([.I184] > [.$B$20];[.I184]-[.$B$20];0) -> 0 | K184: of:=IF([.J184] > 0; ROUND([.$B$23] *MIN([.J184];[.H184])); 0) -> 0 | L184: of:=IF((ROW() - [.$B$13] < 3);0;FLOOR(IFERROR(OFFSET([.$F184];-1*[.$B$13];0 );0) * [.$B$14])) -> 0 | M184: of:=SUM([.L$3:.L184]) -> 6061951
D185: of:=[.D184]+1 -> 2020-07-20T00:00:00.000 | F185: of:=IF([.G184] < [.$B$25];CEILING([.G184]*[.$B$3];1);0) -> 0 | G185: of:=IF([.G184] < [.$B$25];SUM([.F$3:.F185]);[.$B$25]) -> 222350062.5 | H185: of:=IF((ROW() - [.$B$21] < 3);0;FLOOR(IFERROR(OFFSET([.$F185];-1*[.$B$21];0 );0) * [.$B$10])) -> 0 | I185: of:=SUM(INDEX([.H$1:.H$736];MAX(ROW()+(-1*[.$B$22])+1;3);1):INDEX([.H$1:.H$736];ROW();1)) -> 0 | J185: of:=IF([.I185] > [.$B$20];[.I185]-[.$B$20];0) -> 0 | K185: of:=IF([.J185] > 0; ROUND([.$B$23] *MIN([.J185];[.H185])); 0) -> 0 | L185: of:=IF((ROW() - [.$B$13] < 3);0;FLOOR(IFERROR(OFFSET([.$F185];-1*[.$B$13];0 );0) * [.$B$14])) -> 0 | M185: of:=SUM([.L$3:.L185]) -> 6061951
D186: of:=[.D185]+1 -> 2020-07-21T00:00:00.000 | F186: of:=IF([.G185] < [.$B$25];CEILING([.G185]*[.$B$3];1);0) -> 0 | G186: of:=IF([.G185] < [.$B$25];SUM([.F$3:.F186]);[.$B$25]) -> 222350062.5 | H186: of:=IF((ROW() - [.$B$21] < 3);0;FLOOR(IFERROR(OFFSET([.$F186];-1*[.$B$21];0 );0) * [.$B$10])) -> 0 | I186: of:=SUM(INDEX([.H$1:.H$736];MAX(ROW()+(-1*[.$B$22])+1;3);1):INDEX([.H$1:.H$736];ROW();1)) -> 0 | J186: of:=IF([.I186] > [.$B$20];[.I186]-[.$B$20];0) -> 0 | K186: of:=IF([.J186] > 0; ROUND([.$B$23] *MIN([.J186];[.H186])); 0) -> 0 | L186: of:=IF((ROW() - [.$B$13] < 3);0;FLOOR(IFERROR(OFFSET([.$F186];-1*[.$B$13];0 );0) * [.$B$14])) -> 0 | M186: of:=SUM([.L$3:.L186]) -> 6061951
D187: of:=[.D186]+1 -> 2020-07-22T00:00:00.000 | F187: of:=IF([.G186] < [.$B$25];CEILING([.G186]*[.$B$3];1);0) -> 0 | G187: of:=IF([.G186] < [.$B$25];SUM([.F$3:.F187]);[.$B$25]) -> 222350062.5 | H187: of:=IF((ROW() - [.$B$21] < 3);0;FLOOR(IFERROR(OFFSET([.$F187];-1*[.$B$21];0 );0) * [.$B$10])) -> 0 | I187: of:=SUM(INDEX([.H$1:.H$736];MAX(ROW()+(-1*[.$B$22])+1;3);1):INDEX([.H$1:.H$736];ROW();1)) -> 0 | J187: of:=IF([.I187] > [.$B$20];[.I187]-[.$B$20];0) -> 0 | K187: of:=IF([.J187] > 0; ROUND([.$B$23] *MIN([.J187];[.H187])); 0) -> 0 | L187: of:=IF((ROW() - [.$B$13] < 3);0;FLOOR(IFERROR(OFFSET([.$F187];-1*[.$B$13];0 );0) * [.$B$14])) -> 0 | M187: of:=SUM([.L$3:.L187]) -> 6061951
D188: of:=[.D187]+1 -> 2020-07-23T00:00:00.000 | F188: of:=IF([.G187] < [.$B$25];CEILING([.G187]*[.$B$3];1);0) -> 0 | G188: of:=IF([.G187] < [.$B$25];SUM([.F$3:.F188]);[.$B$25]) -> 222350062.5 | H188: of:=IF((ROW() - [.$B$21] < 3);0;FLOOR(IFERROR(OFFSET([.$F188];-1*[.$B$21];0 );0) * [.$B$10])) -> 0 | I188: of:=SUM(INDEX([.H$1:.H$736];MAX(ROW()+(-1*[.$B$22])+1;3);1):INDEX([.H$1:.H$736];ROW();1)) -> 0 | J188: of:=IF([.I188] > [.$B$20];[.I188]-[.$B$20];0) -> 0 | K188: of:=IF([.J188] > 0; ROUND([.$B$23] *MIN([.J188];[.H188])); 0) -> 0 | L188: of:=IF((ROW() - [.$B$13] < 3);0;FLOOR(IFERROR(OFFSET([.$F188];-1*[.$B$13];0 );0) * [.$B$14])) -> 0 | M188: of:=SUM([.L$3:.L188]) -> 6061951
D189: of:=[.D188]+1 -> 2020-07-24T00:00:00.000 | F189: of:=IF([.G188] < [.$B$25];CEILING([.G188]*[.$B$3];1);0) -> 0 | G189: of:=IF([.G188] < [.$B$25];SUM([.F$3:.F189]);[.$B$25]) -> 222350062.5 | H189: of:=IF((ROW() - [.$B$21] < 3);0;FLOOR(IFERROR(OFFSET([.$F189];-1*[.$B$21];0 );0) * [.$B$10])) -> 0 | I189: of:=SUM(INDEX([.H$1:.H$736];MAX(ROW()+(-1*[.$B$22])+1;3);1):INDEX([.H$1:.H$736];ROW();1)) -> 0 | J189: of:=IF([.I189] > [.$B$20];[.I189]-[.$B$20];0) -> 0 | K189: of:=IF([.J189] > 0; ROUND([.$B$23] *MIN([.J189];[.H189])); 0) -> 0 | L189: of:=IF((ROW() - [.$B$13] < 3);0;FLOOR(IFERROR(OFFSET([.$F189];-1*[.$B$13];0 );0) * [.$B$14])) -> 0 | M189: of:=SUM([.L$3:.L189]) -> 6061951
D190: of:=[.D189]+1 -> 2020-07-25T00:00:00.000 | F190: of:=IF([.G189] < [.$B$25];CEILING([.G189]*[.$B$3];1);0) -> 0 | G190: of:=IF([.G189] < [.$B$25];SUM([.F$3:.F190]);[.$B$25]) -> 222350062.5 | H190: of:=IF((ROW() - [.$B$21] < 3);0;FLOOR(IFERROR(OFFSET([.$F190];-1*[.$B$21];0 );0) * [.$B$10])) -> 0 | I190: of:=SUM(INDEX([.H$1:.H$736];MAX(ROW()+(-1*[.$B$22])+1;3);1):INDEX([.H$1:.H$736];ROW();1)) -> 0 | J190: of:=IF([.I190] > [.$B$20];[.I190]-[.$B$20];0) -> 0 | K190: of:=IF([.J190] > 0; ROUND([.$B$23] *MIN([.J190];[.H190])); 0) -> 0 | L190: of:=IF((ROW() - [.$B$13] < 3);0;FLOOR(IFERROR(OFFSET([.$F190];-1*[.$B$13];0 );0) * [.$B$14])) -> 0 | M190: of:=SUM([.L$3:.L190]) -> 6061951
D191: of:=[.D190]+1 -> 2020-07-26T00:00:00.000 | F191: of:=IF([.G190] < [.$B$25];CEILING([.G190]*[.$B$3];1);0) -> 0 | G191: of:=IF([.G190] < [.$B$25];SUM([.F$3:.F191]);[.$B$25]) -> 222350062.5 | H191: of:=IF((ROW() - [.$B$21] < 3);0;FLOOR(IFERROR(OFFSET([.$F191];-1*[.$B$21];0 );0) * [.$B$10])) -> 0 | I191: of:=SUM(INDEX([.H$1:.H$736];MAX(ROW()+(-1*[.$B$22])+1;3);1):INDEX([.H$1:.H$736];ROW();1)) -> 0 | J191: of:=IF([.I191] > [.$B$20];[.I191]-[.$B$20];0) -> 0 | K191: of:=IF([.J191] > 0; ROUND([.$B$23] *MIN([.J191];[.H191])); 0) -> 0 | L191: of:=IF((ROW() - [.$B$13] < 3);0;FLOOR(IFERROR(OFFSET([.$F191];-1*[.$B$13];0 );0) * [.$B$14])) -> 0 | M191: of:=SUM([.L$3:.L191]) -> 6061951
D192: of:=[.D191]+1 -> 2020-07-27T00:00:00.000 | F192: of:=IF([.G191] < [.$B$25];CEILING([.G191]*[.$B$3];1);0) -> 0 | G192: of:=IF([.G191] < [.$B$25];SUM([.F$3:.F192]);[.$B$25]) -> 222350062.5 | H192: of:=IF((ROW() - [.$B$21] < 3);0;FLOOR(IFERROR(OFFSET([.$F192];-1*[.$B$21];0 );0) * [.$B$10])) -> 0 | I192: of:=SUM(INDEX([.H$1:.H$736];MAX(ROW()+(-1*[.$B$22])+1;3);1):INDEX([.H$1:.H$736];ROW();1)) -> 0 | J192: of:=IF([.I192] > [.$B$20];[.I192]-[.$B$20];0) -> 0 | K192: of:=IF([.J192] > 0; ROUND([.$B$23] *MIN([.J192];[.H192])); 0) -> 0 | L192: of:=IF((ROW() - [.$B$13] < 3);0;FLOOR(IFERROR(OFFSET([.$F192];-1*[.$B$13];0 );0) * [.$B$14])) -> 0 | M192: of:=SUM([.L$3:.L192]) -> 6061951
D193: of:=[.D192]+1 -> 2020-07-28T00:00:00.000 | F193: of:=IF([.G192] < [.$B$25];CEILING([.G192]*[.$B$3];1);0) -> 0 | G193: of:=IF([.G192] < [.$B$25];SUM([.F$3:.F193]);[.$B$25]) -> 222350062.5 | H193: of:=IF((ROW() - [.$B$21] < 3);0;FLOOR(IFERROR(OFFSET([.$F193];-1*[.$B$21];0 );0) * [.$B$10])) -> 0 | I193: of:=SUM(INDEX([.H$1:.H$736];MAX(ROW()+(-1*[.$B$22])+1;3);1):INDEX([.H$1:.H$736];ROW();1)) -> 0 | J193: of:=IF([.I193] > [.$B$20];[.I193]-[.$B$20];0) -> 0 | K193: of:=IF([.J193] > 0; ROUND([.$B$23] *MIN([.J193];[.H193])); 0) -> 0 | L193: of:=IF((ROW() - [.$B$13] < 3);0;FLOOR(IFERROR(OFFSET([.$F193];-1*[.$B$13];0 );0) * [.$B$14])) -> 0 | M193: of:=SUM([.L$3:.L193]) -> 6061951
D194: of:=[.D193]+1 -> 2020-07-29T00:00:00.000 | F194: of:=IF([.G193] < [.$B$25];CEILING([.G193]*[.$B$3];1);0) -> 0 | G194: of:=IF([.G193] < [.$B$25];SUM([.F$3:.F194]);[.$B$25]) -> 222350062.5 | H194: of:=IF((ROW() - [.$B$21] < 3);0;FLOOR(IFERROR(OFFSET([.$F194];-1*[.$B$21];0 );0) * [.$B$10])) -> 0 | I194: of:=SUM(INDEX([.H$1:.H$736];MAX(ROW()+(-1*[.$B$22])+1;3);1):INDEX([.H$1:.H$736];ROW();1)) -> 0 | J194: of:=IF([.I194] > [.$B$20];[.I194]-[.$B$20];0) -> 0 | K194: of:=IF([.J194] > 0; ROUND([.$B$23] *MIN([.J194];[.H194])); 0) -> 0 | L194: of:=IF((ROW() - [.$B$13] < 3);0;FLOOR(IFERROR(OFFSET([.$F194];-1*[.$B$13];0 );0) * [.$B$14])) -> 0 | M194: of:=SUM([.L$3:.L194]) -> 6061951
D195: of:=[.D194]+1 -> 2020-07-30T00:00:00.000 | F195: of:=IF([.G194] < [.$B$25];CEILING([.G194]*[.$B$3];1);0) -> 0 | G195: of:=IF([.G194] < [.$B$25];SUM([.F$3:.F195]);[.$B$25]) -> 222350062.5 | H195: of:=IF((ROW() - [.$B$21] < 3);0;FLOOR(IFERROR(OFFSET([.$F195];-1*[.$B$21];0 );0) * [.$B$10])) -> 0 | I195: of:=SUM(INDEX([.H$1:.H$736];MAX(ROW()+(-1*[.$B$22])+1;3);1):INDEX([.H$1:.H$736];ROW();1)) -> 0 | J195: of:=IF([.I195] > [.$B$20];[.I195]-[.$B$20];0) -> 0 | K195: of:=IF([.J195] > 0; ROUND([.$B$23] *MIN([.J195];[.H195])); 0) -> 0 | L195: of:=IF((ROW() - [.$B$13] < 3);0;FLOOR(IFERROR(OFFSET([.$F195];-1*[.$B$13];0 );0) * [.$B$14])) -> 0 | M195: of:=SUM([.L$3:.L195]) -> 6061951
D196: of:=[.D195]+1 -> 2020-07-31T00:00:00.000 | F196: of:=IF([.G195] < [.$B$25];CEILING([.G195]*[.$B$3];1);0) -> 0 | G196: of:=IF([.G195] < [.$B$25];SUM([.F$3:.F196]);[.$B$25]) -> 222350062.5 | H196: of:=IF((ROW() - [.$B$21] < 3);0;FLOOR(IFERROR(OFFSET([.$F196];-1*[.$B$21];0 );0) * [.$B$10])) -> 0 | I196: of:=SUM(INDEX([.H$1:.H$736];MAX(ROW()+(-1*[.$B$22])+1;3);1):INDEX([.H$1:.H$736];ROW();1)) -> 0 | J196: of:=IF([.I196] > [.$B$20];[.I196]-[.$B$20];0) -> 0 | K196: of:=IF([.J196] > 0; ROUND([.$B$23] *MIN([.J196];[.H196])); 0) -> 0 | L196: of:=IF((ROW() - [.$B$13] < 3);0;FLOOR(IFERROR(OFFSET([.$F196];-1*[.$B$13];0 );0) * [.$B$14])) -> 0 | M196: of:=SUM([.L$3:.L196]) -> 6061951
D197: of:=[.D196]+1 -> 2020-08-01T00:00:00.000 | F197: of:=IF([.G196] < [.$B$25];CEILING([.G196]*[.$B$3];1);0) -> 0 | G197: of:=IF([.G196] < [.$B$25];SUM([.F$3:.F197]);[.$B$25]) -> 222350062.5 | H197: of:=IF((ROW() - [.$B$21] < 3);0;FLOOR(IFERROR(OFFSET([.$F197];-1*[.$B$21];0 );0) * [.$B$10])) -> 0 | I197: of:=SUM(INDEX([.H$1:.H$736];MAX(ROW()+(-1*[.$B$22])+1;3);1):INDEX([.H$1:.H$736];ROW();1)) -> 0 | J197: of:=IF([.I197] > [.$B$20];[.I197]-[.$B$20];0) -> 0 | K197: of:=IF([.J197] > 0; ROUND([.$B$23] *MIN([.J197];[.H197])); 0) -> 0 | L197: of:=IF((ROW() - [.$B$13] < 3);0;FLOOR(IFERROR(OFFSET([.$F197];-1*[.$B$13];0 );0) * [.$B$14])) -> 0 | M197: of:=SUM([.L$3:.L197]) -> 6061951
D198: of:=[.D197]+1 -> 2020-08-02T00:00:00.000 | F198: of:=IF([.G197] < [.$B$25];CEILING([.G197]*[.$B$3];1);0) -> 0 | G198: of:=IF([.G197] < [.$B$25];SUM([.F$3:.F198]);[.$B$25]) -> 222350062.5 | H198: of:=IF((ROW() - [.$B$21] < 3);0;FLOOR(IFERROR(OFFSET([.$F198];-1*[.$B$21];0 );0) * [.$B$10])) -> 0 | I198: of:=SUM(INDEX([.H$1:.H$736];MAX(ROW()+(-1*[.$B$22])+1;3);1):INDEX([.H$1:.H$736];ROW();1)) -> 0 | J198: of:=IF([.I198] > [.$B$20];[.I198]-[.$B$20];0) -> 0 | K198: of:=IF([.J198] > 0; ROUND([.$B$23] *MIN([.J198];[.H198])); 0) -> 0 | L198: of:=IF((ROW() - [.$B$13] < 3);0;FLOOR(IFERROR(OFFSET([.$F198];-1*[.$B$13];0 );0) * [.$B$14])) -> 0 | M198: of:=SUM([.L$3:.L198]) -> 6061951
D199: of:=[.D198]+1 -> 2020-08-03T00:00:00.000 | F199: of:=IF([.G198] < [.$B$25];CEILING([.G198]*[.$B$3];1);0) -> 0 | G199: of:=IF([.G198] < [.$B$25];SUM([.F$3:.F199]);[.$B$25]) -> 222350062.5 | H199: of:=IF((ROW() - [.$B$21] < 3);0;FLOOR(IFERROR(OFFSET([.$F199];-1*[.$B$21];0 );0) * [.$B$10])) -> 0 | I199: of:=SUM(INDEX([.H$1:.H$736];MAX(ROW()+(-1*[.$B$22])+1;3);1):INDEX([.H$1:.H$736];ROW();1)) -> 0 | J199: of:=IF([.I199] > [.$B$20];[.I199]-[.$B$20];0) -> 0 | K199: of:=IF([.J199] > 0; ROUND([.$B$23] *MIN([.J199];[.H199])); 0) -> 0 | L199: of:=IF((ROW() - [.$B$13] < 3);0;FLOOR(IFERROR(OFFSET([.$F199];-1*[.$B$13];0 );0) * [.$B$14])) -> 0 | M199: of:=SUM([.L$3:.L199]) -> 6061951
D200: of:=[.D199]+1 -> 2020-08-04T00:00:00.000 | F200: of:=IF([.G199] < [.$B$25];CEILING([.G199]*[.$B$3];1);0) -> 0 | G200: of:=IF([.G199] < [.$B$25];SUM([.F$3:.F200]);[.$B$25]) -> 222350062.5 | H200: of:=IF((ROW() - [.$B$21] < 3);0;FLOOR(IFERROR(OFFSET([.$F200];-1*[.$B$21];0 );0) * [.$B$10])) -> 0 | I200: of:=SUM(INDEX([.H$1:.H$736];MAX(ROW()+(-1*[.$B$22])+1;3);1):INDEX([.H$1:.H$736];ROW();1)) -> 0 | J200: of:=IF([.I200] > [.$B$20];[.I200]-[.$B$20];0) -> 0 | K200: of:=IF([.J200] > 0; ROUND([.$B$23] *MIN([.J200];[.H200])); 0) -> 0 | L200: of:=IF((ROW() - [.$B$13] < 3);0;FLOOR(IFERROR(OFFSET([.$F200];-1*[.$B$13];0 );0) * [.$B$14])) -> 0 | M200: of:=SUM([.L$3:.L200]) -> 6061951
D201: of:=[.D200]+1 -> 2020-08-05T00:00:00.000 | F201: of:=IF([.G200] < [.$B$25];CEILING([.G200]*[.$B$3];1);0) -> 0 | G201: of:=IF([.G200] < [.$B$25];SUM([.F$3:.F201]);[.$B$25]) -> 222350062.5 | H201: of:=IF((ROW() - [.$B$21] < 3);0;FLOOR(IFERROR(OFFSET([.$F201];-1*[.$B$21];0 );0) * [.$B$10])) -> 0 | I201: of:=SUM(INDEX([.H$1:.H$736];MAX(ROW()+(-1*[.$B$22])+1;3);1):INDEX([.H$1:.H$736];ROW();1)) -> 0 | J201: of:=IF([.I201] > [.$B$20];[.I201]-[.$B$20];0) -> 0 | K201: of:=IF([.J201] > 0; ROUND([.$B$23] *MIN([.J201];[.H201])); 0) -> 0 | L201: of:=IF((ROW() - [.$B$13] < 3);0;FLOOR(IFERROR(OFFSET([.$F201];-1*[.$B$13];0 );0) * [.$B$14])) -> 0 | M201: of:=SUM([.L$3:.L201]) -> 6061951
D202: of:=[.D201]+1 -> 2020-08-06T00:00:00.000 | F202: of:=IF([.G201] < [.$B$25];CEILING([.G201]*[.$B$3];1);0) -> 0 | G202: of:=IF([.G201] < [.$B$25];SUM([.F$3:.F202]);[.$B$25]) -> 222350062.5 | H202: of:=IF((ROW() - [.$B$21] < 3);0;FLOOR(IFERROR(OFFSET([.$F202];-1*[.$B$21];0 );0) * [.$B$10])) -> 0 | I202: of:=SUM(INDEX([.H$1:.H$736];MAX(ROW()+(-1*[.$B$22])+1;3);1):INDEX([.H$1:.H$736];ROW();1)) -> 0 | J202: of:=IF([.I202] > [.$B$20];[.I202]-[.$B$20];0) -> 0 | K202: of:=IF([.J202] > 0; ROUND([.$B$23] *MIN([.J202];[.H202])); 0) -> 0 | L202: of:=IF((ROW() - [.$B$13] < 3);0;FLOOR(IFERROR(OFFSET([.$F202];-1*[.$B$13];0 );0) * [.$B$14])) -> 0 | M202: of:=SUM([.L$3:.L202]) -> 6061951
D203: of:=[.D202]+1 -> 2020-08-07T00:00:00.000 | F203: of:=IF([.G202] < [.$B$25];CEILING([.G202]*[.$B$3];1);0) -> 0 | G203: of:=IF([.G202] < [.$B$25];SUM([.F$3:.F203]);[.$B$25]) -> 222350062.5 | H203: of:=IF((ROW() - [.$B$21] < 3);0;FLOOR(IFERROR(OFFSET([.$F203];-1*[.$B$21];0 );0) * [.$B$10])) -> 0 | I203: of:=SUM(INDEX([.H$1:.H$736];MAX(ROW()+(-1*[.$B$22])+1;3);1):INDEX([.H$1:.H$736];ROW();1)) -> 0 | J203: of:=IF([.I203] > [.$B$20];[.I203]-[.$B$20];0) -> 0 | K203: of:=IF([.J203] > 0; ROUND([.$B$23] *MIN([.J203];[.H203])); 0) -> 0 | L203: of:=IF((ROW() - [.$B$13] < 3);0;FLOOR(IFERROR(OFFSET([.$F203];-1*[.$B$13];0 );0) * [.$B$14])) -> 0 | M203: of:=SUM([.L$3:.L203]) -> 6061951
D204: of:=[.D203]+1 -> 2020-08-08T00:00:00.000 | F204: of:=IF([.G203] < [.$B$25];CEILING([.G203]*[.$B$3];1);0) -> 0 | G204: of:=IF([.G203] < [.$B$25];SUM([.F$3:.F204]);[.$B$25]) -> 222350062.5 | H204: of:=IF((ROW() - [.$B$21] < 3);0;FLOOR(IFERROR(OFFSET([.$F204];-1*[.$B$21];0 );0) * [.$B$10])) -> 0 | I204: of:=SUM(INDEX([.H$1:.H$736];MAX(ROW()+(-1*[.$B$22])+1;3);1):INDEX([.H$1:.H$736];ROW();1)) -> 0 | J204: of:=IF([.I204] > [.$B$20];[.I204]-[.$B$20];0) -> 0 | K204: of:=IF([.J204] > 0; ROUND([.$B$23] *MIN([.J204];[.H204])); 0) -> 0 | L204: of:=IF((ROW() - [.$B$13] < 3);0;FLOOR(IFERROR(OFFSET([.$F204];-1*[.$B$13];0 );0) * [.$B$14])) -> 0 | M204: of:=SUM([.L$3:.L204]) -> 6061951
D205: of:=[.D204]+1 -> 2020-08-09T00:00:00.000 | F205: of:=IF([.G204] < [.$B$25];CEILING([.G204]*[.$B$3];1);0) -> 0 | G205: of:=IF([.G204] < [.$B$25];SUM([.F$3:.F205]);[.$B$25]) -> 222350062.5 | H205: of:=IF((ROW() - [.$B$21] < 3);0;FLOOR(IFERROR(OFFSET([.$F205];-1*[.$B$21];0 );0) * [.$B$10])) -> 0 | I205: of:=SUM(INDEX([.H$1:.H$736];MAX(ROW()+(-1*[.$B$22])+1;3);1):INDEX([.H$1:.H$736];ROW();1)) -> 0 | J205: of:=IF([.I205] > [.$B$20];[.I205]-[.$B$20];0) -> 0 | K205: of:=IF([.J205] > 0; ROUND([.$B$23] *MIN([.J205];[.H205])); 0) -> 0 | L205: of:=IF((ROW() - [.$B$13] < 3);0;FLOOR(IFERROR(OFFSET([.$F205];-1*[.$B$13];0 );0) * [.$B$14])) -> 0 | M205: of:=SUM([.L$3:.L205]) -> 6061951
D206: of:=[.D205]+1 -> 2020-08-10T00:00:00.000 | F206: of:=IF([.G205] < [.$B$25];CEILING([.G205]*[.$B$3];1);0) -> 0 | G206: of:=IF([.G205] < [.$B$25];SUM([.F$3:.F206]);[.$B$25]) -> 222350062.5 | H206: of:=IF((ROW() - [.$B$21] < 3);0;FLOOR(IFERROR(OFFSET([.$F206];-1*[.$B$21];0 );0) * [.$B$10])) -> 0 | I206: of:=SUM(INDEX([.H$1:.H$736];MAX(ROW()+(-1*[.$B$22])+1;3);1):INDEX([.H$1:.H$736];ROW();1)) -> 0 | J206: of:=IF([.I206] > [.$B$20];[.I206]-[.$B$20];0) -> 0 | K206: of:=IF([.J206] > 0; ROUND([.$B$23] *MIN([.J206];[.H206])); 0) -> 0 | L206: of:=IF((ROW() - [.$B$13] < 3);0;FLOOR(IFERROR(OFFSET([.$F206];-1*[.$B$13];0 );0) * [.$B$14])) -> 0 | M206: of:=SUM([.L$3:.L206]) -> 6061951
D207: of:=[.D206]+1 -> 2020-08-11T00:00:00.000 | F207: of:=IF([.G206] < [.$B$25];CEILING([.G206]*[.$B$3];1);0) -> 0 | G207: of:=IF([.G206] < [.$B$25];SUM([.F$3:.F207]);[.$B$25]) -> 222350062.5 | H207: of:=IF((ROW() - [.$B$21] < 3);0;FLOOR(IFERROR(OFFSET([.$F207];-1*[.$B$21];0 );0) * [.$B$10])) -> 0 | I207: of:=SUM(INDEX([.H$1:.H$736];MAX(ROW()+(-1*[.$B$22])+1;3);1):INDEX([.H$1:.H$736];ROW();1)) -> 0 | J207: of:=IF([.I207] > [.$B$20];[.I207]-[.$B$20];0) -> 0 | K207: of:=IF([.J207] > 0; ROUND([.$B$23] *MIN([.J207];[.H207])); 0) -> 0 | L207: of:=IF((ROW() - [.$B$13] < 3);0;FLOOR(IFERROR(OFFSET([.$F207];-1*[.$B$13];0 );0) * [.$B$14])) -> 0 | M207: of:=SUM([.L$3:.L207]) -> 6061951
D208: of:=[.D207]+1 -> 2020-08-12T00:00:00.000 | F208: of:=IF([.G207] < [.$B$25];CEILING([.G207]*[.$B$3];1);0) -> 0 | G208: of:=IF([.G207] < [.$B$25];SUM([.F$3:.F208]);[.$B$25]) -> 222350062.5 | H208: of:=IF((ROW() - [.$B$21] < 3);0;FLOOR(IFERROR(OFFSET([.$F208];-1*[.$B$21];0 );0) * [.$B$10])) -> 0 | I208: of:=SUM(INDEX([.H$1:.H$736];MAX(ROW()+(-1*[.$B$22])+1;3);1):INDEX([.H$1:.H$736];ROW();1)) -> 0 | J208: of:=IF([.I208] > [.$B$20];[.I208]-[.$B$20];0) -> 0 | K208: of:=IF([.J208] > 0; ROUND([.$B$23] *MIN([.J208];[.H208])); 0) -> 0 | L208: of:=IF((ROW() - [.$B$13] < 3);0;FLOOR(IFERROR(OFFSET([.$F208];-1*[.$B$13];0 );0) * [.$B$14])) -> 0 | M208: of:=SUM([.L$3:.L208]) -> 6061951
D209: of:=[.D208]+1 -> 2020-08-13T00:00:00.000 | F209: of:=IF([.G208] < [.$B$25];CEILING([.G208]*[.$B$3];1);0) -> 0 | G209: of:=IF([.G208] < [.$B$25];SUM([.F$3:.F209]);[.$B$25]) -> 222350062.5 | H209: of:=IF((ROW() - [.$B$21] < 3);0;FLOOR(IFERROR(OFFSET([.$F209];-1*[.$B$21];0 );0) * [.$B$10])) -> 0 | I209: of:=SUM(INDEX([.H$1:.H$736];MAX(ROW()+(-1*[.$B$22])+1;3);1):INDEX([.H$1:.H$736];ROW();1)) -> 0 | J209: of:=IF([.I209] > [.$B$20];[.I209]-[.$B$20];0) -> 0 | K209: of:=IF([.J209] > 0; ROUND([.$B$23] *MIN([.J209];[.H209])); 0) -> 0 | L209: of:=IF((ROW() - [.$B$13] < 3);0;FLOOR(IFERROR(OFFSET([.$F209];-1*[.$B$13];0 );0) * [.$B$14])) -> 0 | M209: of:=SUM([.L$3:.L209]) -> 6061951
D210: of:=[.D209]+1 -> 2020-08-14T00:00:00.000 | F210: of:=IF([.G209] < [.$B$25];CEILING([.G209]*[.$B$3];1);0) -> 0 | G210: of:=IF([.G209] < [.$B$25];SUM([.F$3:.F210]);[.$B$25]) -> 222350062.5 | H210: of:=IF((ROW() - [.$B$21] < 3);0;FLOOR(IFERROR(OFFSET([.$F210];-1*[.$B$21];0 );0) * [.$B$10])) -> 0 | I210: of:=SUM(INDEX([.H$1:.H$736];MAX(ROW()+(-1*[.$B$22])+1;3);1):INDEX([.H$1:.H$736];ROW();1)) -> 0 | J210: of:=IF([.I210] > [.$B$20];[.I210]-[.$B$20];0) -> 0 | K210: of:=IF([.J210] > 0; ROUND([.$B$23] *MIN([.J210];[.H210])); 0) -> 0 | L210: of:=IF((ROW() - [.$B$13] < 3);0;FLOOR(IFERROR(OFFSET([.$F210];-1*[.$B$13];0 );0) * [.$B$14])) -> 0 | M210: of:=SUM([.L$3:.L210]) -> 6061951
D211: of:=[.D210]+1 -> 2020-08-15T00:00:00.000 | F211: of:=IF([.G210] < [.$B$25];CEILING([.G210]*[.$B$3];1);0) -> 0 | G211: of:=IF([.G210] < [.$B$25];SUM([.F$3:.F211]);[.$B$25]) -> 222350062.5 | H211: of:=IF((ROW() - [.$B$21] < 3);0;FLOOR(IFERROR(OFFSET([.$F211];-1*[.$B$21];0 );0) * [.$B$10])) -> 0 | I211: of:=SUM(INDEX([.H$1:.H$736];MAX(ROW()+(-1*[.$B$22])+1;3);1):INDEX([.H$1:.H$736];ROW();1)) -> 0 | J211: of:=IF([.I211] > [.$B$20];[.I211]-[.$B$20];0) -> 0 | K211: of:=IF([.J211] > 0; ROUND([.$B$23] *MIN([.J211];[.H211])); 0) -> 0 | L211: of:=IF((ROW() - [.$B$13] < 3);0;FLOOR(IFERROR(OFFSET([.$F211];-1*[.$B$13];0 );0) * [.$B$14])) -> 0 | M211: of:=SUM([.L$3:.L211]) -> 6061951
D212: of:=[.D211]+1 -> 2020-08-16T00:00:00.000 | F212: of:=IF([.G211] < [.$B$25];CEILING([.G211]*[.$B$3];1);0) -> 0 | G212: of:=IF([.G211] < [.$B$25];SUM([.F$3:.F212]);[.$B$25]) -> 222350062.5 | H212: of:=IF((ROW() - [.$B$21] < 3);0;FLOOR(IFERROR(OFFSET([.$F212];-1*[.$B$21];0 );0) * [.$B$10])) -> 0 | I212: of:=SUM(INDEX([.H$1:.H$736];MAX(ROW()+(-1*[.$B$22])+1;3);1):INDEX([.H$1:.H$736];ROW();1)) -> 0 | J212: of:=IF([.I212] > [.$B$20];[.I212]-[.$B$20];0) -> 0 | K212: of:=IF([.J212] > 0; ROUND([.$B$23] *MIN([.J212];[.H212])); 0) -> 0 | L212: of:=IF((ROW() - [.$B$13] < 3);0;FLOOR(IFERROR(OFFSET([.$F212];-1*[.$B$13];0 );0) * [.$B$14])) -> 0 | M212: of:=SUM([.L$3:.L212]) -> 6061951
D213: of:=[.D212]+1 -> 2020-08-17T00:00:00.000 | F213: of:=IF([.G212] < [.$B$25];CEILING([.G212]*[.$B$3];1);0) -> 0 | G213: of:=IF([.G212] < [.$B$25];SUM([.F$3:.F213]);[.$B$25]) -> 222350062.5 | H213: of:=IF((ROW() - [.$B$21] < 3);0;FLOOR(IFERROR(OFFSET([.$F213];-1*[.$B$21];0 );0) * [.$B$10])) -> 0 | I213: of:=SUM(INDEX([.H$1:.H$736];MAX(ROW()+(-1*[.$B$22])+1;3);1):INDEX([.H$1:.H$736];ROW();1)) -> 0 | J213: of:=IF([.I213] > [.$B$20];[.I213]-[.$B$20];0) -> 0 | K213: of:=IF([.J213] > 0; ROUND([.$B$23] *MIN([.J213];[.H213])); 0) -> 0 | L213: of:=IF((ROW() - [.$B$13] < 3);0;FLOOR(IFERROR(OFFSET([.$F213];-1*[.$B$13];0 );0) * [.$B$14])) -> 0 | M213: of:=SUM([.L$3:.L213]) -> 6061951
D214: of:=[.D213]+1 -> 2020-08-18T00:00:00.000 | F214: of:=IF([.G213] < [.$B$25];CEILING([.G213]*[.$B$3];1);0) -> 0 | G214: of:=IF([.G213] < [.$B$25];SUM([.F$3:.F214]);[.$B$25]) -> 222350062.5 | H214: of:=IF((ROW() - [.$B$21] < 3);0;FLOOR(IFERROR(OFFSET([.$F214];-1*[.$B$21];0 );0) * [.$B$10])) -> 0 | I214: of:=SUM(INDEX([.H$1:.H$736];MAX(ROW()+(-1*[.$B$22])+1;3);1):INDEX([.H$1:.H$736];ROW();1)) -> 0 | J214: of:=IF([.I214] > [.$B$20];[.I214]-[.$B$20];0) -> 0 | K214: of:=IF([.J214] > 0; ROUND([.$B$23] *MIN([.J214];[.H214])); 0) -> 0 | L214: of:=IF((ROW() - [.$B$13] < 3);0;FLOOR(IFERROR(OFFSET([.$F214];-1*[.$B$13];0 );0) * [.$B$14])) -> 0 | M214: of:=SUM([.L$3:.L214]) -> 6061951
D215: of:=[.D214]+1 -> 2020-08-19T00:00:00.000 | F215: of:=IF([.G214] < [.$B$25];CEILING([.G214]*[.$B$3];1);0) -> 0 | G215: of:=IF([.G214] < [.$B$25];SUM([.F$3:.F215]);[.$B$25]) -> 222350062.5 | H215: of:=IF((ROW() - [.$B$21] < 3);0;FLOOR(IFERROR(OFFSET([.$F215];-1*[.$B$21];0 );0) * [.$B$10])) -> 0 | I215: of:=SUM(INDEX([.H$1:.H$736];MAX(ROW()+(-1*[.$B$22])+1;3);1):INDEX([.H$1:.H$736];ROW();1)) -> 0 | J215: of:=IF([.I215] > [.$B$20];[.I215]-[.$B$20];0) -> 0 | K215: of:=IF([.J215] > 0; ROUND([.$B$23] *MIN([.J215];[.H215])); 0) -> 0 | L215: of:=IF((ROW() - [.$B$13] < 3);0;FLOOR(IFERROR(OFFSET([.$F215];-1*[.$B$13];0 );0) * [.$B$14])) -> 0 | M215: of:=SUM([.L$3:.L215]) -> 6061951
D216: of:=[.D215]+1 -> 2020-08-20T00:00:00.000 | F216: of:=IF([.G215] < [.$B$25];CEILING([.G215]*[.$B$3];1);0) -> 0 | G216: of:=IF([.G215] < [.$B$25];SUM([.F$3:.F216]);[.$B$25]) -> 222350062.5 | H216: of:=IF((ROW() - [.$B$21] < 3);0;FLOOR(IFERROR(OFFSET([.$F216];-1*[.$B$21];0 );0) * [.$B$10])) -> 0 | I216: of:=SUM(INDEX([.H$1:.H$736];MAX(ROW()+(-1*[.$B$22])+1;3);1):INDEX([.H$1:.H$736];ROW();1)) -> 0 | J216: of:=IF([.I216] > [.$B$20];[.I216]-[.$B$20];0) -> 0 | K216: of:=IF([.J216] > 0; ROUND([.$B$23] *MIN([.J216];[.H216])); 0) -> 0 | L216: of:=IF((ROW() - [.$B$13] < 3);0;FLOOR(IFERROR(OFFSET([.$F216];-1*[.$B$13];0 );0) * [.$B$14])) -> 0 | M216: of:=SUM([.L$3:.L216]) -> 6061951
D217: of:=[.D216]+1 -> 2020-08-21T00:00:00.000 | F217: of:=IF([.G216] < [.$B$25];CEILING([.G216]*[.$B$3];1);0) -> 0 | G217: of:=IF([.G216] < [.$B$25];SUM([.F$3:.F217]);[.$B$25]) -> 222350062.5 | H217: of:=IF((ROW() - [.$B$21] < 3);0;FLOOR(IFERROR(OFFSET([.$F217];-1*[.$B$21];0 );0) * [.$B$10])) -> 0 | I217: of:=SUM(INDEX([.H$1:.H$736];MAX(ROW()+(-1*[.$B$22])+1;3);1):INDEX([.H$1:.H$736];ROW();1)) -> 0 | J217: of:=IF([.I217] > [.$B$20];[.I217]-[.$B$20];0) -> 0 | K217: of:=IF([.J217] > 0; ROUND([.$B$23] *MIN([.J217];[.H217])); 0) -> 0 | L217: of:=IF((ROW() - [.$B$13] < 3);0;FLOOR(IFERROR(OFFSET([.$F217];-1*[.$B$13];0 );0) * [.$B$14])) -> 0 | M217: of:=SUM([.L$3:.L217]) -> 6061951
D218: of:=[.D217]+1 -> 2020-08-22T00:00:00.000 | F218: of:=IF([.G217] < [.$B$25];CEILING([.G217]*[.$B$3];1);0) -> 0 | G218: of:=IF([.G217] < [.$B$25];SUM([.F$3:.F218]);[.$B$25]) -> 222350062.5 | H218: of:=IF((ROW() - [.$B$21] < 3);0;FLOOR(IFERROR(OFFSET([.$F218];-1*[.$B$21];0 );0) * [.$B$10])) -> 0 | I218: of:=SUM(INDEX([.H$1:.H$736];MAX(ROW()+(-1*[.$B$22])+1;3);1):INDEX([.H$1:.H$736];ROW();1)) -> 0 | J218: of:=IF([.I218] > [.$B$20];[.I218]-[.$B$20];0) -> 0 | K218: of:=IF([.J218] > 0; ROUND([.$B$23] *MIN([.J218];[.H218])); 0) -> 0 | L218: of:=IF((ROW() - [.$B$13] < 3);0;FLOOR(IFERROR(OFFSET([.$F218];-1*[.$B$13];0 );0) * [.$B$14])) -> 0 | M218: of:=SUM([.L$3:.L218]) -> 6061951
D219: of:=[.D218]+1 -> 2020-08-23T00:00:00.000 | F219: of:=IF([.G218] < [.$B$25];CEILING([.G218]*[.$B$3];1);0) -> 0 | G219: of:=IF([.G218] < [.$B$25];SUM([.F$3:.F219]);[.$B$25]) -> 222350062.5 | H219: of:=IF((ROW() - [.$B$21] < 3);0;FLOOR(IFERROR(OFFSET([.$F219];-1*[.$B$21];0 );0) * [.$B$10])) -> 0 | I219: of:=SUM(INDEX([.H$1:.H$736];MAX(ROW()+(-1*[.$B$22])+1;3);1):INDEX([.H$1:.H$736];ROW();1)) -> 0 | J219: of:=IF([.I219] > [.$B$20];[.I219]-[.$B$20];0) -> 0 | K219: of:=IF([.J219] > 0; ROUND([.$B$23] *MIN([.J219];[.H219])); 0) -> 0 | L219: of:=IF((ROW() - [.$B$13] < 3);0;FLOOR(IFERROR(OFFSET([.$F219];-1*[.$B$13];0 );0) * [.$B$14])) -> 0 | M219: of:=SUM([.L$3:.L219]) -> 6061951
D220: of:=[.D219]+1 -> 2020-08-24T00:00:00.000 | F220: of:=IF([.G219] < [.$B$25];CEILING([.G219]*[.$B$3];1);0) -> 0 | G220: of:=IF([.G219] < [.$B$25];SUM([.F$3:.F220]);[.$B$25]) -> 222350062.5 | H220: of:=IF((ROW() - [.$B$21] < 3);0;FLOOR(IFERROR(OFFSET([.$F220];-1*[.$B$21];0 );0) * [.$B$10])) -> 0 | I220: of:=SUM(INDEX([.H$1:.H$736];MAX(ROW()+(-1*[.$B$22])+1;3);1):INDEX([.H$1:.H$736];ROW();1)) -> 0 | J220: of:=IF([.I220] > [.$B$20];[.I220]-[.$B$20];0) -> 0 | K220: of:=IF([.J220] > 0; ROUND([.$B$23] *MIN([.J220];[.H220])); 0) -> 0 | L220: of:=IF((ROW() - [.$B$13] < 3);0;FLOOR(IFERROR(OFFSET([.$F220];-1*[.$B$13];0 );0) * [.$B$14])) -> 0 | M220: of:=SUM([.L$3:.L220]) -> 6061951
D221: of:=[.D220]+1 -> 2020-08-25T00:00:00.000 | F221: of:=IF([.G220] < [.$B$25];CEILING([.G220]*[.$B$3];1);0) -> 0 | G221: of:=IF([.G220] < [.$B$25];SUM([.F$3:.F221]);[.$B$25]) -> 222350062.5 | H221: of:=IF((ROW() - [.$B$21] < 3);0;FLOOR(IFERROR(OFFSET([.$F221];-1*[.$B$21];0 );0) * [.$B$10])) -> 0 | I221: of:=SUM(INDEX([.H$1:.H$736];MAX(ROW()+(-1*[.$B$22])+1;3);1):INDEX([.H$1:.H$736];ROW();1)) -> 0 | J221: of:=IF([.I221] > [.$B$20];[.I221]-[.$B$20];0) -> 0 | K221: of:=IF([.J221] > 0; ROUND([.$B$23] *MIN([.J221];[.H221])); 0) -> 0 | L221: of:=IF((ROW() - [.$B$13] < 3);0;FLOOR(IFERROR(OFFSET([.$F221];-1*[.$B$13];0 );0) * [.$B$14])) -> 0 | M221: of:=SUM([.L$3:.L221]) -> 6061951
D222: of:=[.D221]+1 -> 2020-08-26T00:00:00.000 | F222: of:=IF([.G221] < [.$B$25];CEILING([.G221]*[.$B$3];1);0) -> 0 | G222: of:=IF([.G221] < [.$B$25];SUM([.F$3:.F222]);[.$B$25]) -> 222350062.5 | H222: of:=IF((ROW() - [.$B$21] < 3);0;FLOOR(IFERROR(OFFSET([.$F222];-1*[.$B$21];0 );0) * [.$B$10])) -> 0 | I222: of:=SUM(INDEX([.H$1:.H$736];MAX(ROW()+(-1*[.$B$22])+1;3);1):INDEX([.H$1:.H$736];ROW();1)) -> 0 | J222: of:=IF([.I222] > [.$B$20];[.I222]-[.$B$20];0) -> 0 | K222: of:=IF([.J222] > 0; ROUND([.$B$23] *MIN([.J222];[.H222])); 0) -> 0 | L222: of:=IF((ROW() - [.$B$13] < 3);0;FLOOR(IFERROR(OFFSET([.$F222];-1*[.$B$13];0 );0) * [.$B$14])) -> 0 | M222: of:=SUM([.L$3:.L222]) -> 6061951
D223: of:=[.D222]+1 -> 2020-08-27T00:00:00.000 | F223: of:=IF([.G222] < [.$B$25];CEILING([.G222]*[.$B$3];1);0) -> 0 | G223: of:=IF([.G222] < [.$B$25];SUM([.F$3:.F223]);[.$B$25]) -> 222350062.5 | H223: of:=IF((ROW() - [.$B$21] < 3);0;FLOOR(IFERROR(OFFSET([.$F223];-1*[.$B$21];0 );0) * [.$B$10])) -> 0 | I223: of:=SUM(INDEX([.H$1:.H$736];MAX(ROW()+(-1*[.$B$22])+1;3);1):INDEX([.H$1:.H$736];ROW();1)) -> 0 | J223: of:=IF([.I223] > [.$B$20];[.I223]-[.$B$20];0) -> 0 | K223: of:=IF([.J223] > 0; ROUND([.$B$23] *MIN([.J223];[.H223])); 0) -> 0 | L223: of:=IF((ROW() - [.$B$13] < 3);0;FLOOR(IFERROR(OFFSET([.$F223];-1*[.$B$13];0 );0) * [.$B$14])) -> 0 | M223: of:=SUM([.L$3:.L223]) -> 6061951
D224: of:=[.D223]+1 -> 2020-08-28T00:00:00.000 | F224: of:=IF([.G223] < [.$B$25];CEILING([.G223]*[.$B$3];1);0) -> 0 | G224: of:=IF([.G223] < [.$B$25];SUM([.F$3:.F224]);[.$B$25]) -> 222350062.5 | H224: of:=IF((ROW() - [.$B$21] < 3);0;FLOOR(IFERROR(OFFSET([.$F224];-1*[.$B$21];0 );0) * [.$B$10])) -> 0 | I224: of:=SUM(INDEX([.H$1:.H$736];MAX(ROW()+(-1*[.$B$22])+1;3);1):INDEX([.H$1:.H$736];ROW();1)) -> 0 | J224: of:=IF([.I224] > [.$B$20];[.I224]-[.$B$20];0) -> 0 | K224: of:=IF([.J224] > 0; ROUND([.$B$23] *MIN([.J224];[.H224])); 0) -> 0 | L224: of:=IF((ROW() - [.$B$13] < 3);0;FLOOR(IFERROR(OFFSET([.$F224];-1*[.$B$13];0 );0) * [.$B$14])) -> 0 | M224: of:=SUM([.L$3:.L224]) -> 6061951
D225: of:=[.D224]+1 -> 2020-08-29T00:00:00.000 | F225: of:=IF([.G224] < [.$B$25];CEILING([.G224]*[.$B$3];1);0) -> 0 | G225: of:=IF([.G224] < [.$B$25];SUM([.F$3:.F225]);[.$B$25]) -> 222350062.5 | H225: of:=IF((ROW() - [.$B$21] < 3);0;FLOOR(IFERROR(OFFSET([.$F225];-1*[.$B$21];0 );0) * [.$B$10])) -> 0 | I225: of:=SUM(INDEX([.H$1:.H$736];MAX(ROW()+(-1*[.$B$22])+1;3);1):INDEX([.H$1:.H$736];ROW();1)) -> 0 | J225: of:=IF([.I225] > [.$B$20];[.I225]-[.$B$20];0) -> 0 | K225: of:=IF([.J225] > 0; ROUND([.$B$23] *MIN([.J225];[.H225])); 0) -> 0 | L225: of:=IF((ROW() - [.$B$13] < 3);0;FLOOR(IFERROR(OFFSET([.$F225];-1*[.$B$13];0 );0) * [.$B$14])) -> 0 | M225: of:=SUM([.L$3:.L225]) -> 6061951
D226: of:=[.D225]+1 -> 2020-08-30T00:00:00.000 | F226: of:=IF([.G225] < [.$B$25];CEILING([.G225]*[.$B$3];1);0) -> 0 | G226: of:=IF([.G225] < [.$B$25];SUM([.F$3:.F226]);[.$B$25]) -> 222350062.5 | H226: of:=IF((ROW() - [.$B$21] < 3);0;FLOOR(IFERROR(OFFSET([.$F226];-1*[.$B$21];0 );0) * [.$B$10])) -> 0 | I226: of:=SUM(INDEX([.H$1:.H$736];MAX(ROW()+(-1*[.$B$22])+1;3);1):INDEX([.H$1:.H$736];ROW();1)) -> 0 | J226: of:=IF([.I226] > [.$B$20];[.I226]-[.$B$20];0) -> 0 | K226: of:=IF([.J226] > 0; ROUND([.$B$23] *MIN([.J226];[.H226])); 0) -> 0 | L226: of:=IF((ROW() - [.$B$13] < 3);0;FLOOR(IFERROR(OFFSET([.$F226];-1*[.$B$13];0 );0) * [.$B$14])) -> 0 | M226: of:=SUM([.L$3:.L226]) -> 6061951
D227: of:=[.D226]+1 -> 2020-08-31T00:00:00.000 | F227: of:=IF([.G226] < [.$B$25];CEILING([.G226]*[.$B$3];1);0) -> 0 | G227: of:=IF([.G226] < [.$B$25];SUM([.F$3:.F227]);[.$B$25]) -> 222350062.5 | H227: of:=IF((ROW() - [.$B$21] < 3);0;FLOOR(IFERROR(OFFSET([.$F227];-1*[.$B$21];0 );0) * [.$B$10])) -> 0 | I227: of:=SUM(INDEX([.H$1:.H$736];MAX(ROW()+(-1*[.$B$22])+1;3);1):INDEX([.H$1:.H$736];ROW();1)) -> 0 | J227: of:=IF([.I227] > [.$B$20];[.I227]-[.$B$20];0) -> 0 | K227: of:=IF([.J227] > 0; ROUND([.$B$23] *MIN([.J227];[.H227])); 0) -> 0 | L227: of:=IF((ROW() - [.$B$13] < 3);0;FLOOR(IFERROR(OFFSET([.$F227];-1*[.$B$13];0 );0) * [.$B$14])) -> 0 | M227: of:=SUM([.L$3:.L227]) -> 6061951
D228: of:=[.D227]+1 -> 2020-09-01T00:00:00.000 | F228: of:=IF([.G227] < [.$B$25];CEILING([.G227]*[.$B$3];1);0) -> 0 | G228: of:=IF([.G227] < [.$B$25];SUM([.F$3:.F228]);[.$B$25]) -> 222350062.5 | H228: of:=IF((ROW() - [.$B$21] < 3);0;FLOOR(IFERROR(OFFSET([.$F228];-1*[.$B$21];0 );0) * [.$B$10])) -> 0 | I228: of:=SUM(INDEX([.H$1:.H$736];MAX(ROW()+(-1*[.$B$22])+1;3);1):INDEX([.H$1:.H$736];ROW();1)) -> 0 | J228: of:=IF([.I228] > [.$B$20];[.I228]-[.$B$20];0) -> 0 | K228: of:=IF([.J228] > 0; ROUND([.$B$23] *MIN([.J228];[.H228])); 0) -> 0 | L228: of:=IF((ROW() - [.$B$13] < 3);0;FLOOR(IFERROR(OFFSET([.$F228];-1*[.$B$13];0 );0) * [.$B$14])) -> 0 | M228: of:=SUM([.L$3:.L228]) -> 6061951
D229: of:=[.D228]+1 -> 2020-09-02T00:00:00.000 | F229: of:=IF([.G228] < [.$B$25];CEILING([.G228]*[.$B$3];1);0) -> 0 | G229: of:=IF([.G228] < [.$B$25];SUM([.F$3:.F229]);[.$B$25]) -> 222350062.5 | H229: of:=IF((ROW() - [.$B$21] < 3);0;FLOOR(IFERROR(OFFSET([.$F229];-1*[.$B$21];0 );0) * [.$B$10])) -> 0 | I229: of:=SUM(INDEX([.H$1:.H$736];MAX(ROW()+(-1*[.$B$22])+1;3);1):INDEX([.H$1:.H$736];ROW();1)) -> 0 | J229: of:=IF([.I229] > [.$B$20];[.I229]-[.$B$20];0) -> 0 | K229: of:=IF([.J229] > 0; ROUND([.$B$23] *MIN([.J229];[.H229])); 0) -> 0 | L229: of:=IF((ROW() - [.$B$13] < 3);0;FLOOR(IFERROR(OFFSET([.$F229];-1*[.$B$13];0 );0) * [.$B$14])) -> 0 | M229: of:=SUM([.L$3:.L229]) -> 6061951
D230: of:=[.D229]+1 -> 2020-09-03T00:00:00.000 | F230: of:=IF([.G229] < [.$B$25];CEILING([.G229]*[.$B$3];1);0) -> 0 | G230: of:=IF([.G229] < [.$B$25];SUM([.F$3:.F230]);[.$B$25]) -> 222350062.5 | H230: of:=IF((ROW() - [.$B$21] < 3);0;FLOOR(IFERROR(OFFSET([.$F230];-1*[.$B$21];0 );0) * [.$B$10])) -> 0 | I230: of:=SUM(INDEX([.H$1:.H$736];MAX(ROW()+(-1*[.$B$22])+1;3);1):INDEX([.H$1:.H$736];ROW();1)) -> 0 | J230: of:=IF([.I230] > [.$B$20];[.I230]-[.$B$20];0) -> 0 | K230: of:=IF([.J230] > 0; ROUND([.$B$23] *MIN([.J230];[.H230])); 0) -> 0 | L230: of:=IF((ROW() - [.$B$13] < 3);0;FLOOR(IFERROR(OFFSET([.$F230];-1*[.$B$13];0 );0) * [.$B$14])) -> 0 | M230: of:=SUM([.L$3:.L230]) -> 6061951
D231: of:=[.D230]+1 -> 2020-09-04T00:00:00.000 | F231: of:=IF([.G230] < [.$B$25];CEILING([.G230]*[.$B$3];1);0) -> 0 | G231: of:=IF([.G230] < [.$B$25];SUM([.F$3:.F231]);[.$B$25]) -> 222350062.5 | H231: of:=IF((ROW() - [.$B$21] < 3);0;FLOOR(IFERROR(OFFSET([.$F231];-1*[.$B$21];0 );0) * [.$B$10])) -> 0 | I231: of:=SUM(INDEX([.H$1:.H$736];MAX(ROW()+(-1*[.$B$22])+1;3);1):INDEX([.H$1:.H$736];ROW();1)) -> 0 | J231: of:=IF([.I231] > [.$B$20];[.I231]-[.$B$20];0) -> 0 | K231: of:=IF([.J231] > 0; ROUND([.$B$23] *MIN([.J231];[.H231])); 0) -> 0 | L231: of:=IF((ROW() - [.$B$13] < 3);0;FLOOR(IFERROR(OFFSET([.$F231];-1*[.$B$13];0 );0) * [.$B$14])) -> 0 | M231: of:=SUM([.L$3:.L231]) -> 6061951
D232: of:=[.D231]+1 -> 2020-09-05T00:00:00.000 | F232: of:=IF([.G231] < [.$B$25];CEILING([.G231]*[.$B$3];1);0) -> 0 | G232: of:=IF([.G231] < [.$B$25];SUM([.F$3:.F232]);[.$B$25]) -> 222350062.5 | H232: of:=IF((ROW() - [.$B$21] < 3);0;FLOOR(IFERROR(OFFSET([.$F232];-1*[.$B$21];0 );0) * [.$B$10])) -> 0 | I232: of:=SUM(INDEX([.H$1:.H$736];MAX(ROW()+(-1*[.$B$22])+1;3);1):INDEX([.H$1:.H$736];ROW();1)) -> 0 | J232: of:=IF([.I232] > [.$B$20];[.I232]-[.$B$20];0) -> 0 | K232: of:=IF([.J232] > 0; ROUND([.$B$23] *MIN([.J232];[.H232])); 0) -> 0 | L232: of:=IF((ROW() - [.$B$13] < 3);0;FLOOR(IFERROR(OFFSET([.$F232];-1*[.$B$13];0 );0) * [.$B$14])) -> 0 | M232: of:=SUM([.L$3:.L232]) -> 6061951
D233: of:=[.D232]+1 -> 2020-09-06T00:00:00.000 | F233: of:=IF([.G232] < [.$B$25];CEILING([.G232]*[.$B$3];1);0) -> 0 | G233: of:=IF([.G232] < [.$B$25];SUM([.F$3:.F233]);[.$B$25]) -> 222350062.5 | H233: of:=IF((ROW() - [.$B$21] < 3);0;FLOOR(IFERROR(OFFSET([.$F233];-1*[.$B$21];0 );0) * [.$B$10])) -> 0 | I233: of:=SUM(INDEX([.H$1:.H$736];MAX(ROW()+(-1*[.$B$22])+1;3);1):INDEX([.H$1:.H$736];ROW();1)) -> 0 | J233: of:=IF([.I233] > [.$B$20];[.I233]-[.$B$20];0) -> 0 | K233: of:=IF([.J233] > 0; ROUND([.$B$23] *MIN([.J233];[.H233])); 0) -> 0 | L233: of:=IF((ROW() - [.$B$13] < 3);0;FLOOR(IFERROR(OFFSET([.$F233];-1*[.$B$13];0 );0) * [.$B$14])) -> 0 | M233: of:=SUM([.L$3:.L233]) -> 6061951
D234: of:=[.D233]+1 -> 2020-09-07T00:00:00.000 | F234: of:=IF([.G233] < [.$B$25];CEILING([.G233]*[.$B$3];1);0) -> 0 | G234: of:=IF([.G233] < [.$B$25];SUM([.F$3:.F234]);[.$B$25]) -> 222350062.5 | H234: of:=IF((ROW() - [.$B$21] < 3);0;FLOOR(IFERROR(OFFSET([.$F234];-1*[.$B$21];0 );0) * [.$B$10])) -> 0 | I234: of:=SUM(INDEX([.H$1:.H$736];MAX(ROW()+(-1*[.$B$22])+1;3);1):INDEX([.H$1:.H$736];ROW();1)) -> 0 | J234: of:=IF([.I234] > [.$B$20];[.I234]-[.$B$20];0) -> 0 | K234: of:=IF([.J234] > 0; ROUND([.$B$23] *MIN([.J234];[.H234])); 0) -> 0 | L234: of:=IF((ROW() - [.$B$13] < 3);0;FLOOR(IFERROR(OFFSET([.$F234];-1*[.$B$13];0 );0) * [.$B$14])) -> 0 | M234: of:=SUM([.L$3:.L234]) -> 6061951
D235: of:=[.D234]+1 -> 2020-09-08T00:00:00.000 | F235: of:=IF([.G234] < [.$B$25];CEILING([.G234]*[.$B$3];1);0) -> 0 | G235: of:=IF([.G234] < [.$B$25];SUM([.F$3:.F235]);[.$B$25]) -> 222350062.5 | H235: of:=IF((ROW() - [.$B$21] < 3);0;FLOOR(IFERROR(OFFSET([.$F235];-1*[.$B$21];0 );0) * [.$B$10])) -> 0 | I235: of:=SUM(INDEX([.H$1:.H$736];MAX(ROW()+(-1*[.$B$22])+1;3);1):INDEX([.H$1:.H$736];ROW();1)) -> 0 | J235: of:=IF([.I235] > [.$B$20];[.I235]-[.$B$20];0) -> 0 | K235: of:=IF([.J235] > 0; ROUND([.$B$23] *MIN([.J235];[.H235])); 0) -> 0 | L235: of:=IF((ROW() - [.$B$13] < 3);0;FLOOR(IFERROR(OFFSET([.$F235];-1*[.$B$13];0 );0) * [.$B$14])) -> 0 | M235: of:=SUM([.L$3:.L235]) -> 6061951
D236: of:=[.D235]+1 -> 2020-09-09T00:00:00.000 | F236: of:=IF([.G235] < [.$B$25];CEILING([.G235]*[.$B$3];1);0) -> 0 | G236: of:=IF([.G235] < [.$B$25];SUM([.F$3:.F236]);[.$B$25]) -> 222350062.5 | H236: of:=IF((ROW() - [.$B$21] < 3);0;FLOOR(IFERROR(OFFSET([.$F236];-1*[.$B$21];0 );0) * [.$B$10])) -> 0 | I236: of:=SUM(INDEX([.H$1:.H$736];MAX(ROW()+(-1*[.$B$22])+1;3);1):INDEX([.H$1:.H$736];ROW();1)) -> 0 | J236: of:=IF([.I236] > [.$B$20];[.I236]-[.$B$20];0) -> 0 | K236: of:=IF([.J236] > 0; ROUND([.$B$23] *MIN([.J236];[.H236])); 0) -> 0 | L236: of:=IF((ROW() - [.$B$13] < 3);0;FLOOR(IFERROR(OFFSET([.$F236];-1*[.$B$13];0 );0) * [.$B$14])) -> 0 | M236: of:=SUM([.L$3:.L236]) -> 6061951
D237: of:=[.D236]+1 -> 2020-09-10T00:00:00.000 | F237: of:=IF([.G236] < [.$B$25];CEILING([.G236]*[.$B$3];1);0) -> 0 | G237: of:=IF([.G236] < [.$B$25];SUM([.F$3:.F237]);[.$B$25]) -> 222350062.5 | H237: of:=IF((ROW() - [.$B$21] < 3);0;FLOOR(IFERROR(OFFSET([.$F237];-1*[.$B$21];0 );0) * [.$B$10])) -> 0 | I237: of:=SUM(INDEX([.H$1:.H$736];MAX(ROW()+(-1*[.$B$22])+1;3);1):INDEX([.H$1:.H$736];ROW();1)) -> 0 | J237: of:=IF([.I237] > [.$B$20];[.I237]-[.$B$20];0) -> 0 | K237: of:=IF([.J237] > 0; ROUND([.$B$23] *MIN([.J237];[.H237])); 0) -> 0 | L237: of:=IF((ROW() - [.$B$13] < 3);0;FLOOR(IFERROR(OFFSET([.$F237];-1*[.$B$13];0 );0) * [.$B$14])) -> 0 | M237: of:=SUM([.L$3:.L237]) -> 6061951
D238: of:=[.D237]+1 -> 2020-09-11T00:00:00.000 | F238: of:=IF([.G237] < [.$B$25];CEILING([.G237]*[.$B$3];1);0) -> 0 | G238: of:=IF([.G237] < [.$B$25];SUM([.F$3:.F238]);[.$B$25]) -> 222350062.5 | H238: of:=IF((ROW() - [.$B$21] < 3);0;FLOOR(IFERROR(OFFSET([.$F238];-1*[.$B$21];0 );0) * [.$B$10])) -> 0 | I238: of:=SUM(INDEX([.H$1:.H$736];MAX(ROW()+(-1*[.$B$22])+1;3);1):INDEX([.H$1:.H$736];ROW();1)) -> 0 | J238: of:=IF([.I238] > [.$B$20];[.I238]-[.$B$20];0) -> 0 | K238: of:=IF([.J238] > 0; ROUND([.$B$23] *MIN([.J238];[.H238])); 0) -> 0 | L238: of:=IF((ROW() - [.$B$13] < 3);0;FLOOR(IFERROR(OFFSET([.$F238];-1*[.$B$13];0 );0) * [.$B$14])) -> 0 | M238: of:=SUM([.L$3:.L238]) -> 6061951
D239: of:=[.D238]+1 -> 2020-09-12T00:00:00.000 | F239: of:=IF([.G238] < [.$B$25];CEILING([.G238]*[.$B$3];1);0) -> 0 | G239: of:=IF([.G238] < [.$B$25];SUM([.F$3:.F239]);[.$B$25]) -> 222350062.5 | H239: of:=IF((ROW() - [.$B$21] < 3);0;FLOOR(IFERROR(OFFSET([.$F239];-1*[.$B$21];0 );0) * [.$B$10])) -> 0 | I239: of:=SUM(INDEX([.H$1:.H$736];MAX(ROW()+(-1*[.$B$22])+1;3);1):INDEX([.H$1:.H$736];ROW();1)) -> 0 | J239: of:=IF([.I239] > [.$B$20];[.I239]-[.$B$20];0) -> 0 | K239: of:=IF([.J239] > 0; ROUND([.$B$23] *MIN([.J239];[.H239])); 0) -> 0 | L239: of:=IF((ROW() - [.$B$13] < 3);0;FLOOR(IFERROR(OFFSET([.$F239];-1*[.$B$13];0 );0) * [.$B$14])) -> 0 | M239: of:=SUM([.L$3:.L239]) -> 6061951
D240: of:=[.D239]+1 -> 2020-09-13T00:00:00.000 | F240: of:=IF([.G239] < [.$B$25];CEILING([.G239]*[.$B$3];1);0) -> 0 | G240: of:=IF([.G239] < [.$B$25];SUM([.F$3:.F240]);[.$B$25]) -> 222350062.5 | H240: of:=IF((ROW() - [.$B$21] < 3);0;FLOOR(IFERROR(OFFSET([.$F240];-1*[.$B$21];0 );0) * [.$B$10])) -> 0 | I240: of:=SUM(INDEX([.H$1:.H$736];MAX(ROW()+(-1*[.$B$22])+1;3);1):INDEX([.H$1:.H$736];ROW();1)) -> 0 | J240: of:=IF([.I240] > [.$B$20];[.I240]-[.$B$20];0) -> 0 | K240: of:=IF([.J240] > 0; ROUND([.$B$23] *MIN([.J240];[.H240])); 0) -> 0 | L240: of:=IF((ROW() - [.$B$13] < 3);0;FLOOR(IFERROR(OFFSET([.$F240];-1*[.$B$13];0 );0) * [.$B$14])) -> 0 | M240: of:=SUM([.L$3:.L240]) -> 6061951
D241: of:=[.D240]+1 -> 2020-09-14T00:00:00.000 | F241: of:=IF([.G240] < [.$B$25];CEILING([.G240]*[.$B$3];1);0) -> 0 | G241: of:=IF([.G240] < [.$B$25];SUM([.F$3:.F241]);[.$B$25]) -> 222350062.5 | H241: of:=IF((ROW() - [.$B$21] < 3);0;FLOOR(IFERROR(OFFSET([.$F241];-1*[.$B$21];0 );0) * [.$B$10])) -> 0 | I241: of:=SUM(INDEX([.H$1:.H$736];MAX(ROW()+(-1*[.$B$22])+1;3);1):INDEX([.H$1:.H$736];ROW();1)) -> 0 | J241: of:=IF([.I241] > [.$B$20];[.I241]-[.$B$20];0) -> 0 | K241: of:=IF([.J241] > 0; ROUND([.$B$23] *MIN([.J241];[.H241])); 0) -> 0 | L241: of:=IF((ROW() - [.$B$13] < 3);0;FLOOR(IFERROR(OFFSET([.$F241];-1*[.$B$13];0 );0) * [.$B$14])) -> 0 | M241: of:=SUM([.L$3:.L241]) -> 6061951
D242: of:=[.D241]+1 -> 2020-09-15T00:00:00.000 | F242: of:=IF([.G241] < [.$B$25];CEILING([.G241]*[.$B$3];1);0) -> 0 | G242: of:=IF([.G241] < [.$B$25];SUM([.F$3:.F242]);[.$B$25]) -> 222350062.5 | H242: of:=IF((ROW() - [.$B$21] < 3);0;FLOOR(IFERROR(OFFSET([.$F242];-1*[.$B$21];0 );0) * [.$B$10])) -> 0 | I242: of:=SUM(INDEX([.H$1:.H$736];MAX(ROW()+(-1*[.$B$22])+1;3);1):INDEX([.H$1:.H$736];ROW();1)) -> 0 | J242: of:=IF([.I242] > [.$B$20];[.I242]-[.$B$20];0) -> 0 | K242: of:=IF([.J242] > 0; ROUND([.$B$23] *MIN([.J242];[.H242])); 0) -> 0 | L242: of:=IF((ROW() - [.$B$13] < 3);0;FLOOR(IFERROR(OFFSET([.$F242];-1*[.$B$13];0 );0) * [.$B$14])) -> 0 | M242: of:=SUM([.L$3:.L242]) -> 6061951
D243: of:=[.D242]+1 -> 2020-09-16T00:00:00.000 | F243: of:=IF([.G242] < [.$B$25];CEILING([.G242]*[.$B$3];1);0) -> 0 | G243: of:=IF([.G242] < [.$B$25];SUM([.F$3:.F243]);[.$B$25]) -> 222350062.5 | H243: of:=IF((ROW() - [.$B$21] < 3);0;FLOOR(IFERROR(OFFSET([.$F243];-1*[.$B$21];0 );0) * [.$B$10])) -> 0 | I243: of:=SUM(INDEX([.H$1:.H$736];MAX(ROW()+(-1*[.$B$22])+1;3);1):INDEX([.H$1:.H$736];ROW();1)) -> 0 | J243: of:=IF([.I243] > [.$B$20];[.I243]-[.$B$20];0) -> 0 | K243: of:=IF([.J243] > 0; ROUND([.$B$23] *MIN([.J243];[.H243])); 0) -> 0 | L243: of:=IF((ROW() - [.$B$13] < 3);0;FLOOR(IFERROR(OFFSET([.$F243];-1*[.$B$13];0 );0) * [.$B$14])) -> 0 | M243: of:=SUM([.L$3:.L243]) -> 6061951
D244: of:=[.D243]+1 -> 2020-09-17T00:00:00.000 | F244: of:=IF([.G243] < [.$B$25];CEILING([.G243]*[.$B$3];1);0) -> 0 | G244: of:=IF([.G243] < [.$B$25];SUM([.F$3:.F244]);[.$B$25]) -> 222350062.5 | H244: of:=IF((ROW() - [.$B$21] < 3);0;FLOOR(IFERROR(OFFSET([.$F244];-1*[.$B$21];0 );0) * [.$B$10])) -> 0 | I244: of:=SUM(INDEX([.H$1:.H$736];MAX(ROW()+(-1*[.$B$22])+1;3);1):INDEX([.H$1:.H$736];ROW();1)) -> 0 | J244: of:=IF([.I244] > [.$B$20];[.I244]-[.$B$20];0) -> 0 | K244: of:=IF([.J244] > 0; ROUND([.$B$23] *MIN([.J244];[.H244])); 0) -> 0 | L244: of:=IF((ROW() - [.$B$13] < 3);0;FLOOR(IFERROR(OFFSET([.$F244];-1*[.$B$13];0 );0) * [.$B$14])) -> 0 | M244: of:=SUM([.L$3:.L244]) -> 6061951
D245: of:=[.D244]+1 -> 2020-09-18T00:00:00.000 | F245: of:=IF([.G244] < [.$B$25];CEILING([.G244]*[.$B$3];1);0) -> 0 | G245: of:=IF([.G244] < [.$B$25];SUM([.F$3:.F245]);[.$B$25]) -> 222350062.5 | H245: of:=IF((ROW() - [.$B$21] < 3);0;FLOOR(IFERROR(OFFSET([.$F245];-1*[.$B$21];0 );0) * [.$B$10])) -> 0 | I245: of:=SUM(INDEX([.H$1:.H$736];MAX(ROW()+(-1*[.$B$22])+1;3);1):INDEX([.H$1:.H$736];ROW();1)) -> 0 | J245: of:=IF([.I245] > [.$B$20];[.I245]-[.$B$20];0) -> 0 | K245: of:=IF([.J245] > 0; ROUND([.$B$23] *MIN([.J245];[.H245])); 0) -> 0 | L245: of:=IF((ROW() - [.$B$13] < 3);0;FLOOR(IFERROR(OFFSET([.$F245];-1*[.$B$13];0 );0) * [.$B$14])) -> 0 | M245: of:=SUM([.L$3:.L245]) -> 6061951
D246: of:=[.D245]+1 -> 2020-09-19T00:00:00.000 | F246: of:=IF([.G245] < [.$B$25];CEILING([.G245]*[.$B$3];1);0) -> 0 | G246: of:=IF([.G245] < [.$B$25];SUM([.F$3:.F246]);[.$B$25]) -> 222350062.5 | H246: of:=IF((ROW() - [.$B$21] < 3);0;FLOOR(IFERROR(OFFSET([.$F246];-1*[.$B$21];0 );0) * [.$B$10])) -> 0 | I246: of:=SUM(INDEX([.H$1:.H$736];MAX(ROW()+(-1*[.$B$22])+1;3);1):INDEX([.H$1:.H$736];ROW();1)) -> 0 | J246: of:=IF([.I246] > [.$B$20];[.I246]-[.$B$20];0) -> 0 | K246: of:=IF([.J246] > 0; ROUND([.$B$23] *MIN([.J246];[.H246])); 0) -> 0 | L246: of:=IF((ROW() - [.$B$13] < 3);0;FLOOR(IFERROR(OFFSET([.$F246];-1*[.$B$13];0 );0) * [.$B$14])) -> 0 | M246: of:=SUM([.L$3:.L246]) -> 6061951
D247: of:=[.D246]+1 -> 2020-09-20T00:00:00.000 | F247: of:=IF([.G246] < [.$B$25];CEILING([.G246]*[.$B$3];1);0) -> 0 | G247: of:=IF([.G246] < [.$B$25];SUM([.F$3:.F247]);[.$B$25]) -> 222350062.5 | H247: of:=IF((ROW() - [.$B$21] < 3);0;FLOOR(IFERROR(OFFSET([.$F247];-1*[.$B$21];0 );0) * [.$B$10])) -> 0 | I247: of:=SUM(INDEX([.H$1:.H$736];MAX(ROW()+(-1*[.$B$22])+1;3);1):INDEX([.H$1:.H$736];ROW();1)) -> 0 | J247: of:=IF([.I247] > [.$B$20];[.I247]-[.$B$20];0) -> 0 | K247: of:=IF([.J247] > 0; ROUND([.$B$23] *MIN([.J247];[.H247])); 0) -> 0 | L247: of:=IF((ROW() - [.$B$13] < 3);0;FLOOR(IFERROR(OFFSET([.$F247];-1*[.$B$13];0 );0) * [.$B$14])) -> 0 | M247: of:=SUM([.L$3:.L247]) -> 6061951
D248: of:=[.D247]+1 -> 2020-09-21T00:00:00.000 | F248: of:=IF([.G247] < [.$B$25];CEILING([.G247]*[.$B$3];1);0) -> 0 | G248: of:=IF([.G247] < [.$B$25];SUM([.F$3:.F248]);[.$B$25]) -> 222350062.5 | H248: of:=IF((ROW() - [.$B$21] < 3);0;FLOOR(IFERROR(OFFSET([.$F248];-1*[.$B$21];0 );0) * [.$B$10])) -> 0 | I248: of:=SUM(INDEX([.H$1:.H$736];MAX(ROW()+(-1*[.$B$22])+1;3);1):INDEX([.H$1:.H$736];ROW();1)) -> 0 | J248: of:=IF([.I248] > [.$B$20];[.I248]-[.$B$20];0) -> 0 | K248: of:=IF([.J248] > 0; ROUND([.$B$23] *MIN([.J248];[.H248])); 0) -> 0 | L248: of:=IF((ROW() - [.$B$13] < 3);0;FLOOR(IFERROR(OFFSET([.$F248];-1*[.$B$13];0 );0) * [.$B$14])) -> 0 | M248: of:=SUM([.L$3:.L248]) -> 6061951
D249: of:=[.D248]+1 -> 2020-09-22T00:00:00.000 | F249: of:=IF([.G248] < [.$B$25];CEILING([.G248]*[.$B$3];1);0) -> 0 | G249: of:=IF([.G248] < [.$B$25];SUM([.F$3:.F249]);[.$B$25]) -> 222350062.5 | H249: of:=IF((ROW() - [.$B$21] < 3);0;FLOOR(IFERROR(OFFSET([.$F249];-1*[.$B$21];0 );0) * [.$B$10])) -> 0 | I249: of:=SUM(INDEX([.H$1:.H$736];MAX(ROW()+(-1*[.$B$22])+1;3);1):INDEX([.H$1:.H$736];ROW();1)) -> 0 | J249: of:=IF([.I249] > [.$B$20];[.I249]-[.$B$20];0) -> 0 | K249: of:=IF([.J249] > 0; ROUND([.$B$23] *MIN([.J249];[.H249])); 0) -> 0 | L249: of:=IF((ROW() - [.$B$13] < 3);0;FLOOR(IFERROR(OFFSET([.$F249];-1*[.$B$13];0 );0) * [.$B$14])) -> 0 | M249: of:=SUM([.L$3:.L249]) -> 6061951
D250: of:=[.D249]+1 -> 2020-09-23T00:00:00.000 | F250: of:=IF([.G249] < [.$B$25];CEILING([.G249]*[.$B$3];1);0) -> 0 | G250: of:=IF([.G249] < [.$B$25];SUM([.F$3:.F250]);[.$B$25]) -> 222350062.5 | H250: of:=IF((ROW() - [.$B$21] < 3);0;FLOOR(IFERROR(OFFSET([.$F250];-1*[.$B$21];0 );0) * [.$B$10])) -> 0 | I250: of:=SUM(INDEX([.H$1:.H$736];MAX(ROW()+(-1*[.$B$22])+1;3);1):INDEX([.H$1:.H$736];ROW();1)) -> 0 | J250: of:=IF([.I250] > [.$B$20];[.I250]-[.$B$20];0) -> 0 | K250: of:=IF([.J250] > 0; ROUND([.$B$23] *MIN([.J250];[.H250])); 0) -> 0 | L250: of:=IF((ROW() - [.$B$13] < 3);0;FLOOR(IFERROR(OFFSET([.$F250];-1*[.$B$13];0 );0) * [.$B$14])) -> 0 | M250: of:=SUM([.L$3:.L250]) -> 6061951
D251: of:=[.D250]+1 -> 2020-09-24T00:00:00.000 | F251: of:=IF([.G250] < [.$B$25];CEILING([.G250]*[.$B$3];1);0) -> 0 | G251: of:=IF([.G250] < [.$B$25];SUM([.F$3:.F251]);[.$B$25]) -> 222350062.5 | H251: of:=IF((ROW() - [.$B$21] < 3);0;FLOOR(IFERROR(OFFSET([.$F251];-1*[.$B$21];0 );0) * [.$B$10])) -> 0 | I251: of:=SUM(INDEX([.H$1:.H$736];MAX(ROW()+(-1*[.$B$22])+1;3);1):INDEX([.H$1:.H$736];ROW();1)) -> 0 | J251: of:=IF([.I251] > [.$B$20];[.I251]-[.$B$20];0) -> 0 | K251: of:=IF([.J251] > 0; ROUND([.$B$23] *MIN([.J251];[.H251])); 0) -> 0 | L251: of:=IF((ROW() - [.$B$13] < 3);0;FLOOR(IFERROR(OFFSET([.$F251];-1*[.$B$13];0 );0) * [.$B$14])) -> 0 | M251: of:=SUM([.L$3:.L251]) -> 6061951
D252: of:=[.D251]+1 -> 2020-09-25T00:00:00.000 | F252: of:=IF([.G251] < [.$B$25];CEILING([.G251]*[.$B$3];1);0) -> 0 | G252: of:=IF([.G251] < [.$B$25];SUM([.F$3:.F252]);[.$B$25]) -> 222350062.5 | H252: of:=IF((ROW() - [.$B$21] < 3);0;FLOOR(IFERROR(OFFSET([.$F252];-1*[.$B$21];0 );0) * [.$B$10])) -> 0 | I252: of:=SUM(INDEX([.H$1:.H$736];MAX(ROW()+(-1*[.$B$22])+1;3);1):INDEX([.H$1:.H$736];ROW();1)) -> 0 | J252: of:=IF([.I252] > [.$B$20];[.I252]-[.$B$20];0) -> 0 | K252: of:=IF([.J252] > 0; ROUND([.$B$23] *MIN([.J252];[.H252])); 0) -> 0 | L252: of:=IF((ROW() - [.$B$13] < 3);0;FLOOR(IFERROR(OFFSET([.$F252];-1*[.$B$13];0 );0) * [.$B$14])) -> 0 | M252: of:=SUM([.L$3:.L252]) -> 6061951
D253: of:=[.D252]+1 -> 2020-09-26T00:00:00.000 | F253: of:=IF([.G252] < [.$B$25];CEILING([.G252]*[.$B$3];1);0) -> 0 | G253: of:=IF([.G252] < [.$B$25];SUM([.F$3:.F253]);[.$B$25]) -> 222350062.5 | H253: of:=IF((ROW() - [.$B$21] < 3);0;FLOOR(IFERROR(OFFSET([.$F253];-1*[.$B$21];0 );0) * [.$B$10])) -> 0 | I253: of:=SUM(INDEX([.H$1:.H$736];MAX(ROW()+(-1*[.$B$22])+1;3);1):INDEX([.H$1:.H$736];ROW();1)) -> 0 | J253: of:=IF([.I253] > [.$B$20];[.I253]-[.$B$20];0) -> 0 | K253: of:=IF([.J253] > 0; ROUND([.$B$23] *MIN([.J253];[.H253])); 0) -> 0 | L253: of:=IF((ROW() - [.$B$13] < 3);0;FLOOR(IFERROR(OFFSET([.$F253];-1*[.$B$13];0 );0) * [.$B$14])) -> 0 | M253: of:=SUM([.L$3:.L253]) -> 6061951
D254: of:=[.D253]+1 -> 2020-09-27T00:00:00.000 | F254: of:=IF([.G253] < [.$B$25];CEILING([.G253]*[.$B$3];1);0) -> 0 | G254: of:=IF([.G253] < [.$B$25];SUM([.F$3:.F254]);[.$B$25]) -> 222350062.5 | H254: of:=IF((ROW() - [.$B$21] < 3);0;FLOOR(IFERROR(OFFSET([.$F254];-1*[.$B$21];0 );0) * [.$B$10])) -> 0 | I254: of:=SUM(INDEX([.H$1:.H$736];MAX(ROW()+(-1*[.$B$22])+1;3);1):INDEX([.H$1:.H$736];ROW();1)) -> 0 | J254: of:=IF([.I254] > [.$B$20];[.I254]-[.$B$20];0) -> 0 | K254: of:=IF([.J254] > 0; ROUND([.$B$23] *MIN([.J254];[.H254])); 0) -> 0 | L254: of:=IF((ROW() - [.$B$13] < 3);0;FLOOR(IFERROR(OFFSET([.$F254];-1*[.$B$13];0 );0) * [.$B$14])) -> 0 | M254: of:=SUM([.L$3:.L254]) -> 6061951
D255: of:=[.D254]+1 -> 2020-09-28T00:00:00.000 | F255: of:=IF([.G254] < [.$B$25];CEILING([.G254]*[.$B$3];1);0) -> 0 | G255: of:=IF([.G254] < [.$B$25];SUM([.F$3:.F255]);[.$B$25]) -> 222350062.5 | H255: of:=IF((ROW() - [.$B$21] < 3);0;FLOOR(IFERROR(OFFSET([.$F255];-1*[.$B$21];0 );0) * [.$B$10])) -> 0 | I255: of:=SUM(INDEX([.H$1:.H$736];MAX(ROW()+(-1*[.$B$22])+1;3);1):INDEX([.H$1:.H$736];ROW();1)) -> 0 | J255: of:=IF([.I255] > [.$B$20];[.I255]-[.$B$20];0) -> 0 | K255: of:=IF([.J255] > 0; ROUND([.$B$23] *MIN([.J255];[.H255])); 0) -> 0 | L255: of:=IF((ROW() - [.$B$13] < 3);0;FLOOR(IFERROR(OFFSET([.$F255];-1*[.$B$13];0 );0) * [.$B$14])) -> 0 | M255: of:=SUM([.L$3:.L255]) -> 6061951
D256: of:=[.D255]+1 -> 2020-09-29T00:00:00.000 | F256: of:=IF([.G255] < [.$B$25];CEILING([.G255]*[.$B$3];1);0) -> 0 | G256: of:=IF([.G255] < [.$B$25];SUM([.F$3:.F256]);[.$B$25]) -> 222350062.5 | H256: of:=IF((ROW() - [.$B$21] < 3);0;FLOOR(IFERROR(OFFSET([.$F256];-1*[.$B$21];0 );0) * [.$B$10])) -> 0 | I256: of:=SUM(INDEX([.H$1:.H$736];MAX(ROW()+(-1*[.$B$22])+1;3);1):INDEX([.H$1:.H$736];ROW();1)) -> 0 | J256: of:=IF([.I256] > [.$B$20];[.I256]-[.$B$20];0) -> 0 | K256: of:=IF([.J256] > 0; ROUND([.$B$23] *MIN([.J256];[.H256])); 0) -> 0 | L256: of:=IF((ROW() - [.$B$13] < 3);0;FLOOR(IFERROR(OFFSET([.$F256];-1*[.$B$13];0 );0) * [.$B$14])) -> 0 | M256: of:=SUM([.L$3:.L256]) -> 6061951
D257: of:=[.D256]+1 -> 2020-09-30T00:00:00.000 | F257: of:=IF([.G256] < [.$B$25];CEILING([.G256]*[.$B$3];1);0) -> 0 | G257: of:=IF([.G256] < [.$B$25];SUM([.F$3:.F257]);[.$B$25]) -> 222350062.5 | H257: of:=IF((ROW() - [.$B$21] < 3);0;FLOOR(IFERROR(OFFSET([.$F257];-1*[.$B$21];0 );0) * [.$B$10])) -> 0 | I257: of:=SUM(INDEX([.H$1:.H$736];MAX(ROW()+(-1*[.$B$22])+1;3);1):INDEX([.H$1:.H$736];ROW();1)) -> 0 | J257: of:=IF([.I257] > [.$B$20];[.I257]-[.$B$20];0) -> 0 | K257: of:=IF([.J257] > 0; ROUND([.$B$23] *MIN([.J257];[.H257])); 0) -> 0 | L257: of:=IF((ROW() - [.$B$13] < 3);0;FLOOR(IFERROR(OFFSET([.$F257];-1*[.$B$13];0 );0) * [.$B$14])) -> 0 | M257: of:=SUM([.L$3:.L257]) -> 6061951
D258: of:=[.D257]+1 -> 2020-10-01T00:00:00.000 | F258: of:=IF([.G257] < [.$B$25];CEILING([.G257]*[.$B$3];1);0) -> 0 | G258: of:=IF([.G257] < [.$B$25];SUM([.F$3:.F258]);[.$B$25]) -> 222350062.5 | H258: of:=IF((ROW() - [.$B$21] < 3);0;FLOOR(IFERROR(OFFSET([.$F258];-1*[.$B$21];0 );0) * [.$B$10])) -> 0 | I258: of:=SUM(INDEX([.H$1:.H$736];MAX(ROW()+(-1*[.$B$22])+1;3);1):INDEX([.H$1:.H$736];ROW();1)) -> 0 | J258: of:=IF([.I258] > [.$B$20];[.I258]-[.$B$20];0) -> 0 | K258: of:=IF([.J258] > 0; ROUND([.$B$23] *MIN([.J258];[.H258])); 0) -> 0 | L258: of:=IF((ROW() - [.$B$13] < 3);0;FLOOR(IFERROR(OFFSET([.$F258];-1*[.$B$13];0 );0) * [.$B$14])) -> 0 | M258: of:=SUM([.L$3:.L258]) -> 6061951
D259: of:=[.D258]+1 -> 2020-10-02T00:00:00.000 | F259: of:=IF([.G258] < [.$B$25];CEILING([.G258]*[.$B$3];1);0) -> 0 | G259: of:=IF([.G258] < [.$B$25];SUM([.F$3:.F259]);[.$B$25]) -> 222350062.5 | H259: of:=IF((ROW() - [.$B$21] < 3);0;FLOOR(IFERROR(OFFSET([.$F259];-1*[.$B$21];0 );0) * [.$B$10])) -> 0 | I259: of:=SUM(INDEX([.H$1:.H$736];MAX(ROW()+(-1*[.$B$22])+1;3);1):INDEX([.H$1:.H$736];ROW();1)) -> 0 | J259: of:=IF([.I259] > [.$B$20];[.I259]-[.$B$20];0) -> 0 | K259: of:=IF([.J259] > 0; ROUND([.$B$23] *MIN([.J259];[.H259])); 0) -> 0 | L259: of:=IF((ROW() - [.$B$13] < 3);0;FLOOR(IFERROR(OFFSET([.$F259];-1*[.$B$13];0 );0) * [.$B$14])) -> 0 | M259: of:=SUM([.L$3:.L259]) -> 6061951
D260: of:=[.D259]+1 -> 2020-10-03T00:00:00.000 | F260: of:=IF([.G259] < [.$B$25];CEILING([.G259]*[.$B$3];1);0) -> 0 | G260: of:=IF([.G259] < [.$B$25];SUM([.F$3:.F260]);[.$B$25]) -> 222350062.5 | H260: of:=IF((ROW() - [.$B$21] < 3);0;FLOOR(IFERROR(OFFSET([.$F260];-1*[.$B$21];0 );0) * [.$B$10])) -> 0 | I260: of:=SUM(INDEX([.H$1:.H$736];MAX(ROW()+(-1*[.$B$22])+1;3);1):INDEX([.H$1:.H$736];ROW();1)) -> 0 | J260: of:=IF([.I260] > [.$B$20];[.I260]-[.$B$20];0) -> 0 | K260: of:=IF([.J260] > 0; ROUND([.$B$23] *MIN([.J260];[.H260])); 0) -> 0 | L260: of:=IF((ROW() - [.$B$13] < 3);0;FLOOR(IFERROR(OFFSET([.$F260];-1*[.$B$13];0 );0) * [.$B$14])) -> 0 | M260: of:=SUM([.L$3:.L260]) -> 6061951
D261: of:=[.D260]+1 -> 2020-10-04T00:00:00.000 | F261: of:=IF([.G260] < [.$B$25];CEILING([.G260]*[.$B$3];1);0) -> 0 | G261: of:=IF([.G260] < [.$B$25];SUM([.F$3:.F261]);[.$B$25]) -> 222350062.5 | H261: of:=IF((ROW() - [.$B$21] < 3);0;FLOOR(IFERROR(OFFSET([.$F261];-1*[.$B$21];0 );0) * [.$B$10])) -> 0 | I261: of:=SUM(INDEX([.H$1:.H$736];MAX(ROW()+(-1*[.$B$22])+1;3);1):INDEX([.H$1:.H$736];ROW();1)) -> 0 | J261: of:=IF([.I261] > [.$B$20];[.I261]-[.$B$20];0) -> 0 | K261: of:=IF([.J261] > 0; ROUND([.$B$23] *MIN([.J261];[.H261])); 0) -> 0 | L261: of:=IF((ROW() - [.$B$13] < 3);0;FLOOR(IFERROR(OFFSET([.$F261];-1*[.$B$13];0 );0) * [.$B$14])) -> 0 | M261: of:=SUM([.L$3:.L261]) -> 6061951
D262: of:=[.D261]+1 -> 2020-10-05T00:00:00.000 | F262: of:=IF([.G261] < [.$B$25];CEILING([.G261]*[.$B$3];1);0) -> 0 | G262: of:=IF([.G261] < [.$B$25];SUM([.F$3:.F262]);[.$B$25]) -> 222350062.5 | H262: of:=IF((ROW() - [.$B$21] < 3);0;FLOOR(IFERROR(OFFSET([.$F262];-1*[.$B$21];0 );0) * [.$B$10])) -> 0 | I262: of:=SUM(INDEX([.H$1:.H$736];MAX(ROW()+(-1*[.$B$22])+1;3);1):INDEX([.H$1:.H$736];ROW();1)) -> 0 | J262: of:=IF([.I262] > [.$B$20];[.I262]-[.$B$20];0) -> 0 | K262: of:=IF([.J262] > 0; ROUND([.$B$23] *MIN([.J262];[.H262])); 0) -> 0 | L262: of:=IF((ROW() - [.$B$13] < 3);0;FLOOR(IFERROR(OFFSET([.$F262];-1*[.$B$13];0 );0) * [.$B$14])) -> 0 | M262: of:=SUM([.L$3:.L262]) -> 6061951
D263: of:=[.D262]+1 -> 2020-10-06T00:00:00.000 | F263: of:=IF([.G262] < [.$B$25];CEILING([.G262]*[.$B$3];1);0) -> 0 | G263: of:=IF([.G262] < [.$B$25];SUM([.F$3:.F263]);[.$B$25]) -> 222350062.5 | H263: of:=IF((ROW() - [.$B$21] < 3);0;FLOOR(IFERROR(OFFSET([.$F263];-1*[.$B$21];0 );0) * [.$B$10])) -> 0 | I263: of:=SUM(INDEX([.H$1:.H$736];MAX(ROW()+(-1*[.$B$22])+1;3);1):INDEX([.H$1:.H$736];ROW();1)) -> 0 | J263: of:=IF([.I263] > [.$B$20];[.I263]-[.$B$20];0) -> 0 | K263: of:=IF([.J263] > 0; ROUND([.$B$23] *MIN([.J263];[.H263])); 0) -> 0 | L263: of:=IF((ROW() - [.$B$13] < 3);0;FLOOR(IFERROR(OFFSET([.$F263];-1*[.$B$13];0 );0) * [.$B$14])) -> 0 | M263: of:=SUM([.L$3:.L263]) -> 6061951
D264: of:=[.D263]+1 -> 2020-10-07T00:00:00.000 | F264: of:=IF([.G263] < [.$B$25];CEILING([.G263]*[.$B$3];1);0) -> 0 | G264: of:=IF([.G263] < [.$B$25];SUM([.F$3:.F264]);[.$B$25]) -> 222350062.5 | H264: of:=IF((ROW() - [.$B$21] < 3);0;FLOOR(IFERROR(OFFSET([.$F264];-1*[.$B$21];0 );0) * [.$B$10])) -> 0 | I264: of:=SUM(INDEX([.H$1:.H$736];MAX(ROW()+(-1*[.$B$22])+1;3);1):INDEX([.H$1:.H$736];ROW();1)) -> 0 | J264: of:=IF([.I264] > [.$B$20];[.I264]-[.$B$20];0) -> 0 | K264: of:=IF([.J264] > 0; ROUND([.$B$23] *MIN([.J264];[.H264])); 0) -> 0 | L264: of:=IF((ROW() - [.$B$13] < 3);0;FLOOR(IFERROR(OFFSET([.$F264];-1*[.$B$13];0 );0) * [.$B$14])) -> 0 | M264: of:=SUM([.L$3:.L264]) -> 6061951
D265: of:=[.D264]+1 -> 2020-10-08T00:00:00.000 | F265: of:=IF([.G264] < [.$B$25];CEILING([.G264]*[.$B$3];1);0) -> 0 | G265: of:=IF([.G264] < [.$B$25];SUM([.F$3:.F265]);[.$B$25]) -> 222350062.5 | H265: of:=IF((ROW() - [.$B$21] < 3);0;FLOOR(IFERROR(OFFSET([.$F265];-1*[.$B$21];0 );0) * [.$B$10])) -> 0 | I265: of:=SUM(INDEX([.H$1:.H$736];MAX(ROW()+(-1*[.$B$22])+1;3);1):INDEX([.H$1:.H$736];ROW();1)) -> 0 | J265: of:=IF([.I265] > [.$B$20];[.I265]-[.$B$20];0) -> 0 | K265: of:=IF([.J265] > 0; ROUND([.$B$23] *MIN([.J265];[.H265])); 0) -> 0 | L265: of:=IF((ROW() - [.$B$13] < 3);0;FLOOR(IFERROR(OFFSET([.$F265];-1*[.$B$13];0 );0) * [.$B$14])) -> 0 | M265: of:=SUM([.L$3:.L265]) -> 6061951
D266: of:=[.D265]+1 -> 2020-10-09T00:00:00.000 | F266: of:=IF([.G265] < [.$B$25];CEILING([.G265]*[.$B$3];1);0) -> 0 | G266: of:=IF([.G265] < [.$B$25];SUM([.F$3:.F266]);[.$B$25]) -> 222350062.5 | H266: of:=IF((ROW() - [.$B$21] < 3);0;FLOOR(IFERROR(OFFSET([.$F266];-1*[.$B$21];0 );0) * [.$B$10])) -> 0 | I266: of:=SUM(INDEX([.H$1:.H$736];MAX(ROW()+(-1*[.$B$22])+1;3);1):INDEX([.H$1:.H$736];ROW();1)) -> 0 | J266: of:=IF([.I266] > [.$B$20];[.I266]-[.$B$20];0) -> 0 | K266: of:=IF([.J266] > 0; ROUND([.$B$23] *MIN([.J266];[.H266])); 0) -> 0 | L266: of:=IF((ROW() - [.$B$13] < 3);0;FLOOR(IFERROR(OFFSET([.$F266];-1*[.$B$13];0 );0) * [.$B$14])) -> 0 | M266: of:=SUM([.L$3:.L266]) -> 6061951
D267: of:=[.D266]+1 -> 2020-10-10T00:00:00.000 | F267: of:=IF([.G266] < [.$B$25];CEILING([.G266]*[.$B$3];1);0) -> 0 | G267: of:=IF([.G266] < [.$B$25];SUM([.F$3:.F267]);[.$B$25]) -> 222350062.5 | H267: of:=IF((ROW() - [.$B$21] < 3);0;FLOOR(IFERROR(OFFSET([.$F267];-1*[.$B$21];0 );0) * [.$B$10])) -> 0 | I267: of:=SUM(INDEX([.H$1:.H$736];MAX(ROW()+(-1*[.$B$22])+1;3);1):INDEX([.H$1:.H$736];ROW();1)) -> 0 | J267: of:=IF([.I267] > [.$B$20];[.I267]-[.$B$20];0) -> 0 | K267: of:=IF([.J267] > 0; ROUND([.$B$23] *MIN([.J267];[.H267])); 0) -> 0 | L267: of:=IF((ROW() - [.$B$13] < 3);0;FLOOR(IFERROR(OFFSET([.$F267];-1*[.$B$13];0 );0) * [.$B$14])) -> 0 | M267: of:=SUM([.L$3:.L267]) -> 6061951
D268: of:=[.D267]+1 -> 2020-10-11T00:00:00.000 | F268: of:=IF([.G267] < [.$B$25];CEILING([.G267]*[.$B$3];1);0) -> 0 | G268: of:=IF([.G267] < [.$B$25];SUM([.F$3:.F268]);[.$B$25]) -> 222350062.5 | H268: of:=IF((ROW() - [.$B$21] < 3);0;FLOOR(IFERROR(OFFSET([.$F268];-1*[.$B$21];0 );0) * [.$B$10])) -> 0 | I268: of:=SUM(INDEX([.H$1:.H$736];MAX(ROW()+(-1*[.$B$22])+1;3);1):INDEX([.H$1:.H$736];ROW();1)) -> 0 | J268: of:=IF([.I268] > [.$B$20];[.I268]-[.$B$20];0) -> 0 | K268: of:=IF([.J268] > 0; ROUND([.$B$23] *MIN([.J268];[.H268])); 0) -> 0 | L268: of:=IF((ROW() - [.$B$13] < 3);0;FLOOR(IFERROR(OFFSET([.$F268];-1*[.$B$13];0 );0) * [.$B$14])) -> 0 | M268: of:=SUM([.L$3:.L268]) -> 6061951
D269: of:=[.D268]+1 -> 2020-10-12T00:00:00.000 | F269: of:=IF([.G268] < [.$B$25];CEILING([.G268]*[.$B$3];1);0) -> 0 | G269: of:=IF([.G268] < [.$B$25];SUM([.F$3:.F269]);[.$B$25]) -> 222350062.5 | H269: of:=IF((ROW() - [.$B$21] < 3);0;FLOOR(IFERROR(OFFSET([.$F269];-1*[.$B$21];0 );0) * [.$B$10])) -> 0 | I269: of:=SUM(INDEX([.H$1:.H$736];MAX(ROW()+(-1*[.$B$22])+1;3);1):INDEX([.H$1:.H$736];ROW();1)) -> 0 | J269: of:=IF([.I269] > [.$B$20];[.I269]-[.$B$20];0) -> 0 | K269: of:=IF([.J269] > 0; ROUND([.$B$23] *MIN([.J269];[.H269])); 0) -> 0 | L269: of:=IF((ROW() - [.$B$13] < 3);0;FLOOR(IFERROR(OFFSET([.$F269];-1*[.$B$13];0 );0) * [.$B$14])) -> 0 | M269: of:=SUM([.L$3:.L269]) -> 6061951
D270: of:=[.D269]+1 -> 2020-10-13T00:00:00.000 | F270: of:=IF([.G269] < [.$B$25];CEILING([.G269]*[.$B$3];1);0) -> 0 | G270: of:=IF([.G269] < [.$B$25];SUM([.F$3:.F270]);[.$B$25]) -> 222350062.5 | H270: of:=IF((ROW() - [.$B$21] < 3);0;FLOOR(IFERROR(OFFSET([.$F270];-1*[.$B$21];0 );0) * [.$B$10])) -> 0 | I270: of:=SUM(INDEX([.H$1:.H$736];MAX(ROW()+(-1*[.$B$22])+1;3);1):INDEX([.H$1:.H$736];ROW();1)) -> 0 | J270: of:=IF([.I270] > [.$B$20];[.I270]-[.$B$20];0) -> 0 | K270: of:=IF([.J270] > 0; ROUND([.$B$23] *MIN([.J270];[.H270])); 0) -> 0 | L270: of:=IF((ROW() - [.$B$13] < 3);0;FLOOR(IFERROR(OFFSET([.$F270];-1*[.$B$13];0 );0) * [.$B$14])) -> 0 | M270: of:=SUM([.L$3:.L270]) -> 6061951
D271: of:=[.D270]+1 -> 2020-10-14T00:00:00.000 | F271: of:=IF([.G270] < [.$B$25];CEILING([.G270]*[.$B$3];1);0) -> 0 | G271: of:=IF([.G270] < [.$B$25];SUM([.F$3:.F271]);[.$B$25]) -> 222350062.5 | H271: of:=IF((ROW() - [.$B$21] < 3);0;FLOOR(IFERROR(OFFSET([.$F271];-1*[.$B$21];0 );0) * [.$B$10])) -> 0 | I271: of:=SUM(INDEX([.H$1:.H$736];MAX(ROW()+(-1*[.$B$22])+1;3);1):INDEX([.H$1:.H$736];ROW();1)) -> 0 | J271: of:=IF([.I271] > [.$B$20];[.I271]-[.$B$20];0) -> 0 | K271: of:=IF([.J271] > 0; ROUND([.$B$23] *MIN([.J271];[.H271])); 0) -> 0 | L271: of:=IF((ROW() - [.$B$13] < 3);0;FLOOR(IFERROR(OFFSET([.$F271];-1*[.$B$13];0 );0) * [.$B$14])) -> 0 | M271: of:=SUM([.L$3:.L271]) -> 6061951
D272: of:=[.D271]+1 -> 2020-10-15T00:00:00.000 | F272: of:=IF([.G271] < [.$B$25];CEILING([.G271]*[.$B$3];1);0) -> 0 | G272: of:=IF([.G271] < [.$B$25];SUM([.F$3:.F272]);[.$B$25]) -> 222350062.5 | H272: of:=IF((ROW() - [.$B$21] < 3);0;FLOOR(IFERROR(OFFSET([.$F272];-1*[.$B$21];0 );0) * [.$B$10])) -> 0 | I272: of:=SUM(INDEX([.H$1:.H$736];MAX(ROW()+(-1*[.$B$22])+1;3);1):INDEX([.H$1:.H$736];ROW();1)) -> 0 | J272: of:=IF([.I272] > [.$B$20];[.I272]-[.$B$20];0) -> 0 | K272: of:=IF([.J272] > 0; ROUND([.$B$23] *MIN([.J272];[.H272])); 0) -> 0 | L272: of:=IF((ROW() - [.$B$13] < 3);0;FLOOR(IFERROR(OFFSET([.$F272];-1*[.$B$13];0 );0) * [.$B$14])) -> 0 | M272: of:=SUM([.L$3:.L272]) -> 6061951
D273: of:=[.D272]+1 -> 2020-10-16T00:00:00.000 | F273: of:=IF([.G272] < [.$B$25];CEILING([.G272]*[.$B$3];1);0) -> 0 | G273: of:=IF([.G272] < [.$B$25];SUM([.F$3:.F273]);[.$B$25]) -> 222350062.5 | H273: of:=IF((ROW() - [.$B$21] < 3);0;FLOOR(IFERROR(OFFSET([.$F273];-1*[.$B$21];0 );0) * [.$B$10])) -> 0 | I273: of:=SUM(INDEX([.H$1:.H$736];MAX(ROW()+(-1*[.$B$22])+1;3);1):INDEX([.H$1:.H$736];ROW();1)) -> 0 | J273: of:=IF([.I273] > [.$B$20];[.I273]-[.$B$20];0) -> 0 | K273: of:=IF([.J273] > 0; ROUND([.$B$23] *MIN([.J273];[.H273])); 0) -> 0 | L273: of:=IF((ROW() - [.$B$13] < 3);0;FLOOR(IFERROR(OFFSET([.$F273];-1*[.$B$13];0 );0) * [.$B$14])) -> 0 | M273: of:=SUM([.L$3:.L273]) -> 6061951
D274: of:=[.D273]+1 -> 2020-10-17T00:00:00.000 | F274: of:=IF([.G273] < [.$B$25];CEILING([.G273]*[.$B$3];1);0) -> 0 | G274: of:=IF([.G273] < [.$B$25];SUM([.F$3:.F274]);[.$B$25]) -> 222350062.5 | H274: of:=IF((ROW() - [.$B$21] < 3);0;FLOOR(IFERROR(OFFSET([.$F274];-1*[.$B$21];0 );0) * [.$B$10])) -> 0 | I274: of:=SUM(INDEX([.H$1:.H$736];MAX(ROW()+(-1*[.$B$22])+1;3);1):INDEX([.H$1:.H$736];ROW();1)) -> 0 | J274: of:=IF([.I274] > [.$B$20];[.I274]-[.$B$20];0) -> 0 | K274: of:=IF([.J274] > 0; ROUND([.$B$23] *MIN([.J274];[.H274])); 0) -> 0 | L274: of:=IF((ROW() - [.$B$13] < 3);0;FLOOR(IFERROR(OFFSET([.$F274];-1*[.$B$13];0 );0) * [.$B$14])) -> 0 | M274: of:=SUM([.L$3:.L274]) -> 6061951
D275: of:=[.D274]+1 -> 2020-10-18T00:00:00.000 | F275: of:=IF([.G274] < [.$B$25];CEILING([.G274]*[.$B$3];1);0) -> 0 | G275: of:=IF([.G274] < [.$B$25];SUM([.F$3:.F275]);[.$B$25]) -> 222350062.5 | H275: of:=IF((ROW() - [.$B$21] < 3);0;FLOOR(IFERROR(OFFSET([.$F275];-1*[.$B$21];0 );0) * [.$B$10])) -> 0 | I275: of:=SUM(INDEX([.H$1:.H$736];MAX(ROW()+(-1*[.$B$22])+1;3);1):INDEX([.H$1:.H$736];ROW();1)) -> 0 | J275: of:=IF([.I275] > [.$B$20];[.I275]-[.$B$20];0) -> 0 | K275: of:=IF([.J275] > 0; ROUND([.$B$23] *MIN([.J275];[.H275])); 0) -> 0 | L275: of:=IF((ROW() - [.$B$13] < 3);0;FLOOR(IFERROR(OFFSET([.$F275];-1*[.$B$13];0 );0) * [.$B$14])) -> 0 | M275: of:=SUM([.L$3:.L275]) -> 6061951
D276: of:=[.D275]+1 -> 2020-10-19T00:00:00.000 | F276: of:=IF([.G275] < [.$B$25];CEILING([.G275]*[.$B$3];1);0) -> 0 | G276: of:=IF([.G275] < [.$B$25];SUM([.F$3:.F276]);[.$B$25]) -> 222350062.5 | H276: of:=IF((ROW() - [.$B$21] < 3);0;FLOOR(IFERROR(OFFSET([.$F276];-1*[.$B$21];0 );0) * [.$B$10])) -> 0 | I276: of:=SUM(INDEX([.H$1:.H$736];MAX(ROW()+(-1*[.$B$22])+1;3);1):INDEX([.H$1:.H$736];ROW();1)) -> 0 | J276: of:=IF([.I276] > [.$B$20];[.I276]-[.$B$20];0) -> 0 | K276: of:=IF([.J276] > 0; ROUND([.$B$23] *MIN([.J276];[.H276])); 0) -> 0 | L276: of:=IF((ROW() - [.$B$13] < 3);0;FLOOR(IFERROR(OFFSET([.$F276];-1*[.$B$13];0 );0) * [.$B$14])) -> 0 | M276: of:=SUM([.L$3:.L276]) -> 6061951
D277: of:=[.D276]+1 -> 2020-10-20T00:00:00.000 | F277: of:=IF([.G276] < [.$B$25];CEILING([.G276]*[.$B$3];1);0) -> 0 | G277: of:=IF([.G276] < [.$B$25];SUM([.F$3:.F277]);[.$B$25]) -> 222350062.5 | H277: of:=IF((ROW() - [.$B$21] < 3);0;FLOOR(IFERROR(OFFSET([.$F277];-1*[.$B$21];0 );0) * [.$B$10])) -> 0 | I277: of:=SUM(INDEX([.H$1:.H$736];MAX(ROW()+(-1*[.$B$22])+1;3);1):INDEX([.H$1:.H$736];ROW();1)) -> 0 | J277: of:=IF([.I277] > [.$B$20];[.I277]-[.$B$20];0) -> 0 | K277: of:=IF([.J277] > 0; ROUND([.$B$23] *MIN([.J277];[.H277])); 0) -> 0 | L277: of:=IF((ROW() - [.$B$13] < 3);0;FLOOR(IFERROR(OFFSET([.$F277];-1*[.$B$13];0 );0) * [.$B$14])) -> 0 | M277: of:=SUM([.L$3:.L277]) -> 6061951
D278: of:=[.D277]+1 -> 2020-10-21T00:00:00.000 | F278: of:=IF([.G277] < [.$B$25];CEILING([.G277]*[.$B$3];1);0) -> 0 | G278: of:=IF([.G277] < [.$B$25];SUM([.F$3:.F278]);[.$B$25]) -> 222350062.5 | H278: of:=IF((ROW() - [.$B$21] < 3);0;FLOOR(IFERROR(OFFSET([.$F278];-1*[.$B$21];0 );0) * [.$B$10])) -> 0 | I278: of:=SUM(INDEX([.H$1:.H$736];MAX(ROW()+(-1*[.$B$22])+1;3);1):INDEX([.H$1:.H$736];ROW();1)) -> 0 | J278: of:=IF([.I278] > [.$B$20];[.I278]-[.$B$20];0) -> 0 | K278: of:=IF([.J278] > 0; ROUND([.$B$23] *MIN([.J278];[.H278])); 0) -> 0 | L278: of:=IF((ROW() - [.$B$13] < 3);0;FLOOR(IFERROR(OFFSET([.$F278];-1*[.$B$13];0 );0) * [.$B$14])) -> 0 | M278: of:=SUM([.L$3:.L278]) -> 6061951
D279: of:=[.D278]+1 -> 2020-10-22T00:00:00.000 | F279: of:=IF([.G278] < [.$B$25];CEILING([.G278]*[.$B$3];1);0) -> 0 | G279: of:=IF([.G278] < [.$B$25];SUM([.F$3:.F279]);[.$B$25]) -> 222350062.5 | H279: of:=IF((ROW() - [.$B$21] < 3);0;FLOOR(IFERROR(OFFSET([.$F279];-1*[.$B$21];0 );0) * [.$B$10])) -> 0 | I279: of:=SUM(INDEX([.H$1:.H$736];MAX(ROW()+(-1*[.$B$22])+1;3);1):INDEX([.H$1:.H$736];ROW();1)) -> 0 | J279: of:=IF([.I279] > [.$B$20];[.I279]-[.$B$20];0) -> 0 | K279: of:=IF([.J279] > 0; ROUND([.$B$23] *MIN([.J279];[.H279])); 0) -> 0 | L279: of:=IF((ROW() - [.$B$13] < 3);0;FLOOR(IFERROR(OFFSET([.$F279];-1*[.$B$13];0 );0) * [.$B$14])) -> 0 | M279: of:=SUM([.L$3:.L279]) -> 6061951
D280: of:=[.D279]+1 -> 2020-10-23T00:00:00.000 | F280: of:=IF([.G279] < [.$B$25];CEILING([.G279]*[.$B$3];1);0) -> 0 | G280: of:=IF([.G279] < [.$B$25];SUM([.F$3:.F280]);[.$B$25]) -> 222350062.5 | H280: of:=IF((ROW() - [.$B$21] < 3);0;FLOOR(IFERROR(OFFSET([.$F280];-1*[.$B$21];0 );0) * [.$B$10])) -> 0 | I280: of:=SUM(INDEX([.H$1:.H$736];MAX(ROW()+(-1*[.$B$22])+1;3);1):INDEX([.H$1:.H$736];ROW();1)) -> 0 | J280: of:=IF([.I280] > [.$B$20];[.I280]-[.$B$20];0) -> 0 | K280: of:=IF([.J280] > 0; ROUND([.$B$23] *MIN([.J280];[.H280])); 0) -> 0 | L280: of:=IF((ROW() - [.$B$13] < 3);0;FLOOR(IFERROR(OFFSET([.$F280];-1*[.$B$13];0 );0) * [.$B$14])) -> 0 | M280: of:=SUM([.L$3:.L280]) -> 6061951
D281: of:=[.D280]+1 -> 2020-10-24T00:00:00.000 | F281: of:=IF([.G280] < [.$B$25];CEILING([.G280]*[.$B$3];1);0) -> 0 | G281: of:=IF([.G280] < [.$B$25];SUM([.F$3:.F281]);[.$B$25]) -> 222350062.5 | H281: of:=IF((ROW() - [.$B$21] < 3);0;FLOOR(IFERROR(OFFSET([.$F281];-1*[.$B$21];0 );0) * [.$B$10])) -> 0 | I281: of:=SUM(INDEX([.H$1:.H$736];MAX(ROW()+(-1*[.$B$22])+1;3);1):INDEX([.H$1:.H$736];ROW();1)) -> 0 | J281: of:=IF([.I281] > [.$B$20];[.I281]-[.$B$20];0) -> 0 | K281: of:=IF([.J281] > 0; ROUND([.$B$23] *MIN([.J281];[.H281])); 0) -> 0 | L281: of:=IF((ROW() - [.$B$13] < 3);0;FLOOR(IFERROR(OFFSET([.$F281];-1*[.$B$13];0 );0) * [.$B$14])) -> 0 | M281: of:=SUM([.L$3:.L281]) -> 6061951
D282: of:=[.D281]+1 -> 2020-10-25T00:00:00.000 | F282: of:=IF([.G281] < [.$B$25];CEILING([.G281]*[.$B$3];1);0) -> 0 | G282: of:=IF([.G281] < [.$B$25];SUM([.F$3:.F282]);[.$B$25]) -> 222350062.5 | H282: of:=IF((ROW() - [.$B$21] < 3);0;FLOOR(IFERROR(OFFSET([.$F282];-1*[.$B$21];0 );0) * [.$B$10])) -> 0 | I282: of:=SUM(INDEX([.H$1:.H$736];MAX(ROW()+(-1*[.$B$22])+1;3);1):INDEX([.H$1:.H$736];ROW();1)) -> 0 | J282: of:=IF([.I282] > [.$B$20];[.I282]-[.$B$20];0) -> 0 | K282: of:=IF([.J282] > 0; ROUND([.$B$23] *MIN([.J282];[.H282])); 0) -> 0 | L282: of:=IF((ROW() - [.$B$13] < 3);0;FLOOR(IFERROR(OFFSET([.$F282];-1*[.$B$13];0 );0) * [.$B$14])) -> 0 | M282: of:=SUM([.L$3:.L282]) -> 6061951
D283: of:=[.D282]+1 -> 2020-10-26T00:00:00.000 | F283: of:=IF([.G282] < [.$B$25];CEILING([.G282]*[.$B$3];1);0) -> 0 | G283: of:=IF([.G282] < [.$B$25];SUM([.F$3:.F283]);[.$B$25]) -> 222350062.5 | H283: of:=IF((ROW() - [.$B$21] < 3);0;FLOOR(IFERROR(OFFSET([.$F283];-1*[.$B$21];0 );0) * [.$B$10])) -> 0 | I283: of:=SUM(INDEX([.H$1:.H$736];MAX(ROW()+(-1*[.$B$22])+1;3);1):INDEX([.H$1:.H$736];ROW();1)) -> 0 | J283: of:=IF([.I283] > [.$B$20];[.I283]-[.$B$20];0) -> 0 | K283: of:=IF([.J283] > 0; ROUND([.$B$23] *MIN([.J283];[.H283])); 0) -> 0 | L283: of:=IF((ROW() - [.$B$13] < 3);0;FLOOR(IFERROR(OFFSET([.$F283];-1*[.$B$13];0 );0) * [.$B$14])) -> 0 | M283: of:=SUM([.L$3:.L283]) -> 6061951
D284: of:=[.D283]+1 -> 2020-10-27T00:00:00.000 | F284: of:=IF([.G283] < [.$B$25];CEILING([.G283]*[.$B$3];1);0) -> 0 | G284: of:=IF([.G283] < [.$B$25];SUM([.F$3:.F284]);[.$B$25]) -> 222350062.5 | H284: of:=IF((ROW() - [.$B$21] < 3);0;FLOOR(IFERROR(OFFSET([.$F284];-1*[.$B$21];0 );0) * [.$B$10])) -> 0 | I284: of:=SUM(INDEX([.H$1:.H$736];MAX(ROW()+(-1*[.$B$22])+1;3);1):INDEX([.H$1:.H$736];ROW();1)) -> 0 | J284: of:=IF([.I284] > [.$B$20];[.I284]-[.$B$20];0) -> 0 | K284: of:=IF([.J284] > 0; ROUND([.$B$23] *MIN([.J284];[.H284])); 0) -> 0 | L284: of:=IF((ROW() - [.$B$13] < 3);0;FLOOR(IFERROR(OFFSET([.$F284];-1*[.$B$13];0 );0) * [.$B$14])) -> 0 | M284: of:=SUM([.L$3:.L284]) -> 6061951
D285: of:=[.D284]+1 -> 2020-10-28T00:00:00.000 | F285: of:=IF([.G284] < [.$B$25];CEILING([.G284]*[.$B$3];1);0) -> 0 | G285: of:=IF([.G284] < [.$B$25];SUM([.F$3:.F285]);[.$B$25]) -> 222350062.5 | H285: of:=IF((ROW() - [.$B$21] < 3);0;FLOOR(IFERROR(OFFSET([.$F285];-1*[.$B$21];0 );0) * [.$B$10])) -> 0 | I285: of:=SUM(INDEX([.H$1:.H$736];MAX(ROW()+(-1*[.$B$22])+1;3);1):INDEX([.H$1:.H$736];ROW();1)) -> 0 | J285: of:=IF([.I285] > [.$B$20];[.I285]-[.$B$20];0) -> 0 | K285: of:=IF([.J285] > 0; ROUND([.$B$23] *MIN([.J285];[.H285])); 0) -> 0 | L285: of:=IF((ROW() - [.$B$13] < 3);0;FLOOR(IFERROR(OFFSET([.$F285];-1*[.$B$13];0 );0) * [.$B$14])) -> 0 | M285: of:=SUM([.L$3:.L285]) -> 6061951
D286: of:=[.D285]+1 -> 2020-10-29T00:00:00.000 | F286: of:=IF([.G285] < [.$B$25];CEILING([.G285]*[.$B$3];1);0) -> 0 | G286: of:=IF([.G285] < [.$B$25];SUM([.F$3:.F286]);[.$B$25]) -> 222350062.5 | H286: of:=IF((ROW() - [.$B$21] < 3);0;FLOOR(IFERROR(OFFSET([.$F286];-1*[.$B$21];0 );0) * [.$B$10])) -> 0 | I286: of:=SUM(INDEX([.H$1:.H$736];MAX(ROW()+(-1*[.$B$22])+1;3);1):INDEX([.H$1:.H$736];ROW();1)) -> 0 | J286: of:=IF([.I286] > [.$B$20];[.I286]-[.$B$20];0) -> 0 | K286: of:=IF([.J286] > 0; ROUND([.$B$23] *MIN([.J286];[.H286])); 0) -> 0 | L286: of:=IF((ROW() - [.$B$13] < 3);0;FLOOR(IFERROR(OFFSET([.$F286];-1*[.$B$13];0 );0) * [.$B$14])) -> 0 | M286: of:=SUM([.L$3:.L286]) -> 6061951
D287: of:=[.D286]+1 -> 2020-10-30T00:00:00.000 | F287: of:=IF([.G286] < [.$B$25];CEILING([.G286]*[.$B$3];1);0) -> 0 | G287: of:=IF([.G286] < [.$B$25];SUM([.F$3:.F287]);[.$B$25]) -> 222350062.5 | H287: of:=IF((ROW() - [.$B$21] < 3);0;FLOOR(IFERROR(OFFSET([.$F287];-1*[.$B$21];0 );0) * [.$B$10])) -> 0 | I287: of:=SUM(INDEX([.H$1:.H$736];MAX(ROW()+(-1*[.$B$22])+1;3);1):INDEX([.H$1:.H$736];ROW();1)) -> 0 | J287: of:=IF([.I287] > [.$B$20];[.I287]-[.$B$20];0) -> 0 | K287: of:=IF([.J287] > 0; ROUND([.$B$23] *MIN([.J287];[.H287])); 0) -> 0 | L287: of:=IF((ROW() - [.$B$13] < 3);0;FLOOR(IFERROR(OFFSET([.$F287];-1*[.$B$13];0 );0) * [.$B$14])) -> 0 | M287: of:=SUM([.L$3:.L287]) -> 6061951
D288: of:=[.D287]+1 -> 2020-10-31T00:00:00.000 | F288: of:=IF([.G287] < [.$B$25];CEILING([.G287]*[.$B$3];1);0) -> 0 | G288: of:=IF([.G287] < [.$B$25];SUM([.F$3:.F288]);[.$B$25]) -> 222350062.5 | H288: of:=IF((ROW() - [.$B$21] < 3);0;FLOOR(IFERROR(OFFSET([.$F288];-1*[.$B$21];0 );0) * [.$B$10])) -> 0 | I288: of:=SUM(INDEX([.H$1:.H$736];MAX(ROW()+(-1*[.$B$22])+1;3);1):INDEX([.H$1:.H$736];ROW();1)) -> 0 | J288: of:=IF([.I288] > [.$B$20];[.I288]-[.$B$20];0) -> 0 | K288: of:=IF([.J288] > 0; ROUND([.$B$23] *MIN([.J288];[.H288])); 0) -> 0 | L288: of:=IF((ROW() - [.$B$13] < 3);0;FLOOR(IFERROR(OFFSET([.$F288];-1*[.$B$13];0 );0) * [.$B$14])) -> 0 | M288: of:=SUM([.L$3:.L288]) -> 6061951
D289: of:=[.D288]+1 -> 2020-11-01T00:00:00.000 | F289: of:=IF([.G288] < [.$B$25];CEILING([.G288]*[.$B$3];1);0) -> 0 | G289: of:=IF([.G288] < [.$B$25];SUM([.F$3:.F289]);[.$B$25]) -> 222350062.5 | H289: of:=IF((ROW() - [.$B$21] < 3);0;FLOOR(IFERROR(OFFSET([.$F289];-1*[.$B$21];0 );0) * [.$B$10])) -> 0 | I289: of:=SUM(INDEX([.H$1:.H$736];MAX(ROW()+(-1*[.$B$22])+1;3);1):INDEX([.H$1:.H$736];ROW();1)) -> 0 | J289: of:=IF([.I289] > [.$B$20];[.I289]-[.$B$20];0) -> 0 | K289: of:=IF([.J289] > 0; ROUND([.$B$23] *MIN([.J289];[.H289])); 0) -> 0 | L289: of:=IF((ROW() - [.$B$13] < 3);0;FLOOR(IFERROR(OFFSET([.$F289];-1*[.$B$13];0 );0) * [.$B$14])) -> 0 | M289: of:=SUM([.L$3:.L289]) -> 6061951
D290: of:=[.D289]+1 -> 2020-11-02T00:00:00.000 | F290: of:=IF([.G289] < [.$B$25];CEILING([.G289]*[.$B$3];1);0) -> 0 | G290: of:=IF([.G289] < [.$B$25];SUM([.F$3:.F290]);[.$B$25]) -> 222350062.5 | H290: of:=IF((ROW() - [.$B$21] < 3);0;FLOOR(IFERROR(OFFSET([.$F290];-1*[.$B$21];0 );0) * [.$B$10])) -> 0 | I290: of:=SUM(INDEX([.H$1:.H$736];MAX(ROW()+(-1*[.$B$22])+1;3);1):INDEX([.H$1:.H$736];ROW();1)) -> 0 | J290: of:=IF([.I290] > [.$B$20];[.I290]-[.$B$20];0) -> 0 | K290: of:=IF([.J290] > 0; ROUND([.$B$23] *MIN([.J290];[.H290])); 0) -> 0 | L290: of:=IF((ROW() - [.$B$13] < 3);0;FLOOR(IFERROR(OFFSET([.$F290];-1*[.$B$13];0 );0) * [.$B$14])) -> 0 | M290: of:=SUM([.L$3:.L290]) -> 6061951
D291: of:=[.D290]+1 -> 2020-11-03T00:00:00.000 | F291: of:=IF([.G290] < [.$B$25];CEILING([.G290]*[.$B$3];1);0) -> 0 | G291: of:=IF([.G290] < [.$B$25];SUM([.F$3:.F291]);[.$B$25]) -> 222350062.5 | H291: of:=IF((ROW() - [.$B$21] < 3);0;FLOOR(IFERROR(OFFSET([.$F291];-1*[.$B$21];0 );0) * [.$B$10])) -> 0 | I291: of:=SUM(INDEX([.H$1:.H$736];MAX(ROW()+(-1*[.$B$22])+1;3);1):INDEX([.H$1:.H$736];ROW();1)) -> 0 | J291: of:=IF([.I291] > [.$B$20];[.I291]-[.$B$20];0) -> 0 | K291: of:=IF([.J291] > 0; ROUND([.$B$23] *MIN([.J291];[.H291])); 0) -> 0 | L291: of:=IF((ROW() - [.$B$13] < 3);0;FLOOR(IFERROR(OFFSET([.$F291];-1*[.$B$13];0 );0) * [.$B$14])) -> 0 | M291: of:=SUM([.L$3:.L291]) -> 6061951
D292: of:=[.D291]+1 -> 2020-11-04T00:00:00.000 | F292: of:=IF([.G291] < [.$B$25];CEILING([.G291]*[.$B$3];1);0) -> 0 | G292: of:=IF([.G291] < [.$B$25];SUM([.F$3:.F292]);[.$B$25]) -> 222350062.5 | H292: of:=IF((ROW() - [.$B$21] < 3);0;FLOOR(IFERROR(OFFSET([.$F292];-1*[.$B$21];0 );0) * [.$B$10])) -> 0 | I292: of:=SUM(INDEX([.H$1:.H$736];MAX(ROW()+(-1*[.$B$22])+1;3);1):INDEX([.H$1:.H$736];ROW();1)) -> 0 | J292: of:=IF([.I292] > [.$B$20];[.I292]-[.$B$20];0) -> 0 | K292: of:=IF([.J292] > 0; ROUND([.$B$23] *MIN([.J292];[.H292])); 0) -> 0 | L292: of:=IF((ROW() - [.$B$13] < 3);0;FLOOR(IFERROR(OFFSET([.$F292];-1*[.$B$13];0 );0) * [.$B$14])) -> 0 | M292: of:=SUM([.L$3:.L292]) -> 6061951
D293: of:=[.D292]+1 -> 2020-11-05T00:00:00.000 | F293: of:=IF([.G292] < [.$B$25];CEILING([.G292]*[.$B$3];1);0) -> 0 | G293: of:=IF([.G292] < [.$B$25];SUM([.F$3:.F293]);[.$B$25]) -> 222350062.5 | H293: of:=IF((ROW() - [.$B$21] < 3);0;FLOOR(IFERROR(OFFSET([.$F293];-1*[.$B$21];0 );0) * [.$B$10])) -> 0 | I293: of:=SUM(INDEX([.H$1:.H$736];MAX(ROW()+(-1*[.$B$22])+1;3);1):INDEX([.H$1:.H$736];ROW();1)) -> 0 | J293: of:=IF([.I293] > [.$B$20];[.I293]-[.$B$20];0) -> 0 | K293: of:=IF([.J293] > 0; ROUND([.$B$23] *MIN([.J293];[.H293])); 0) -> 0 | L293: of:=IF((ROW() - [.$B$13] < 3);0;FLOOR(IFERROR(OFFSET([.$F293];-1*[.$B$13];0 );0) * [.$B$14])) -> 0 | M293: of:=SUM([.L$3:.L293]) -> 6061951
D294: of:=[.D293]+1 -> 2020-11-06T00:00:00.000 | F294: of:=IF([.G293] < [.$B$25];CEILING([.G293]*[.$B$3];1);0) -> 0 | G294: of:=IF([.G293] < [.$B$25];SUM([.F$3:.F294]);[.$B$25]) -> 222350062.5 | H294: of:=IF((ROW() - [.$B$21] < 3);0;FLOOR(IFERROR(OFFSET([.$F294];-1*[.$B$21];0 );0) * [.$B$10])) -> 0 | I294: of:=SUM(INDEX([.H$1:.H$736];MAX(ROW()+(-1*[.$B$22])+1;3);1):INDEX([.H$1:.H$736];ROW();1)) -> 0 | J294: of:=IF([.I294] > [.$B$20];[.I294]-[.$B$20];0) -> 0 | K294: of:=IF([.J294] > 0; ROUND([.$B$23] *MIN([.J294];[.H294])); 0) -> 0 | L294: of:=IF((ROW() - [.$B$13] < 3);0;FLOOR(IFERROR(OFFSET([.$F294];-1*[.$B$13];0 );0) * [.$B$14])) -> 0 | M294: of:=SUM([.L$3:.L294]) -> 6061951
D295: of:=[.D294]+1 -> 2020-11-07T00:00:00.000 | F295: of:=IF([.G294] < [.$B$25];CEILING([.G294]*[.$B$3];1);0) -> 0 | G295: of:=IF([.G294] < [.$B$25];SUM([.F$3:.F295]);[.$B$25]) -> 222350062.5 | H295: of:=IF((ROW() - [.$B$21] < 3);0;FLOOR(IFERROR(OFFSET([.$F295];-1*[.$B$21];0 );0) * [.$B$10])) -> 0 | I295: of:=SUM(INDEX([.H$1:.H$736];MAX(ROW()+(-1*[.$B$22])+1;3);1):INDEX([.H$1:.H$736];ROW();1)) -> 0 | J295: of:=IF([.I295] > [.$B$20];[.I295]-[.$B$20];0) -> 0 | K295: of:=IF([.J295] > 0; ROUND([.$B$23] *MIN([.J295];[.H295])); 0) -> 0 | L295: of:=IF((ROW() - [.$B$13] < 3);0;FLOOR(IFERROR(OFFSET([.$F295];-1*[.$B$13];0 );0) * [.$B$14])) -> 0 | M295: of:=SUM([.L$3:.L295]) -> 6061951
D296: of:=[.D295]+1 -> 2020-11-08T00:00:00.000 | F296: of:=IF([.G295] < [.$B$25];CEILING([.G295]*[.$B$3];1);0) -> 0 | G296: of:=IF([.G295] < [.$B$25];SUM([.F$3:.F296]);[.$B$25]) -> 222350062.5 | H296: of:=IF((ROW() - [.$B$21] < 3);0;FLOOR(IFERROR(OFFSET([.$F296];-1*[.$B$21];0 );0) * [.$B$10])) -> 0 | I296: of:=SUM(INDEX([.H$1:.H$736];MAX(ROW()+(-1*[.$B$22])+1;3);1):INDEX([.H$1:.H$736];ROW();1)) -> 0 | J296: of:=IF([.I296] > [.$B$20];[.I296]-[.$B$20];0) -> 0 | K296: of:=IF([.J296] > 0; ROUND([.$B$23] *MIN([.J296];[.H296])); 0) -> 0 | L296: of:=IF((ROW() - [.$B$13] < 3);0;FLOOR(IFERROR(OFFSET([.$F296];-1*[.$B$13];0 );0) * [.$B$14])) -> 0 | M296: of:=SUM([.L$3:.L296]) -> 6061951
D297: of:=[.D296]+1 -> 2020-11-09T00:00:00.000 | F297: of:=IF([.G296] < [.$B$25];CEILING([.G296]*[.$B$3];1);0) -> 0 | G297: of:=IF([.G296] < [.$B$25];SUM([.F$3:.F297]);[.$B$25]) -> 222350062.5 | H297: of:=IF((ROW() - [.$B$21] < 3);0;FLOOR(IFERROR(OFFSET([.$F297];-1*[.$B$21];0 );0) * [.$B$10])) -> 0 | I297: of:=SUM(INDEX([.H$1:.H$736];MAX(ROW()+(-1*[.$B$22])+1;3);1):INDEX([.H$1:.H$736];ROW();1)) -> 0 | J297: of:=IF([.I297] > [.$B$20];[.I297]-[.$B$20];0) -> 0 | K297: of:=IF([.J297] > 0; ROUND([.$B$23] *MIN([.J297];[.H297])); 0) -> 0 | L297: of:=IF((ROW() - [.$B$13] < 3);0;FLOOR(IFERROR(OFFSET([.$F297];-1*[.$B$13];0 );0) * [.$B$14])) -> 0 | M297: of:=SUM([.L$3:.L297]) -> 6061951
D298: of:=[.D297]+1 -> 2020-11-10T00:00:00.000 | F298: of:=IF([.G297] < [.$B$25];CEILING([.G297]*[.$B$3];1);0) -> 0 | G298: of:=IF([.G297] < [.$B$25];SUM([.F$3:.F298]);[.$B$25]) -> 222350062.5 | H298: of:=IF((ROW() - [.$B$21] < 3);0;FLOOR(IFERROR(OFFSET([.$F298];-1*[.$B$21];0 );0) * [.$B$10])) -> 0 | I298: of:=SUM(INDEX([.H$1:.H$736];MAX(ROW()+(-1*[.$B$22])+1;3);1):INDEX([.H$1:.H$736];ROW();1)) -> 0 | J298: of:=IF([.I298] > [.$B$20];[.I298]-[.$B$20];0) -> 0 | K298: of:=IF([.J298] > 0; ROUND([.$B$23] *MIN([.J298];[.H298])); 0) -> 0 | L298: of:=IF((ROW() - [.$B$13] < 3);0;FLOOR(IFERROR(OFFSET([.$F298];-1*[.$B$13];0 );0) * [.$B$14])) -> 0 | M298: of:=SUM([.L$3:.L298]) -> 6061951
D299: of:=[.D298]+1 -> 2020-11-11T00:00:00.000 | F299: of:=IF([.G298] < [.$B$25];CEILING([.G298]*[.$B$3];1);0) -> 0 | G299: of:=IF([.G298] < [.$B$25];SUM([.F$3:.F299]);[.$B$25]) -> 222350062.5 | H299: of:=IF((ROW() - [.$B$21] < 3);0;FLOOR(IFERROR(OFFSET([.$F299];-1*[.$B$21];0 );0) * [.$B$10])) -> 0 | I299: of:=SUM(INDEX([.H$1:.H$736];MAX(ROW()+(-1*[.$B$22])+1;3);1):INDEX([.H$1:.H$736];ROW();1)) -> 0 | J299: of:=IF([.I299] > [.$B$20];[.I299]-[.$B$20];0) -> 0 | K299: of:=IF([.J299] > 0; ROUND([.$B$23] *MIN([.J299];[.H299])); 0) -> 0 | L299: of:=IF((ROW() - [.$B$13] < 3);0;FLOOR(IFERROR(OFFSET([.$F299];-1*[.$B$13];0 );0) * [.$B$14])) -> 0 | M299: of:=SUM([.L$3:.L299]) -> 6061951
D300: of:=[.D299]+1 -> 2020-11-12T00:00:00.000 | F300: of:=IF([.G299] < [.$B$25];CEILING([.G299]*[.$B$3];1);0) -> 0 | G300: of:=IF([.G299] < [.$B$25];SUM([.F$3:.F300]);[.$B$25]) -> 222350062.5 | H300: of:=IF((ROW() - [.$B$21] < 3);0;FLOOR(IFERROR(OFFSET([.$F300];-1*[.$B$21];0 );0) * [.$B$10])) -> 0 | I300: of:=SUM(INDEX([.H$1:.H$736];MAX(ROW()+(-1*[.$B$22])+1;3);1):INDEX([.H$1:.H$736];ROW();1)) -> 0 | J300: of:=IF([.I300] > [.$B$20];[.I300]-[.$B$20];0) -> 0 | K300: of:=IF([.J300] > 0; ROUND([.$B$23] *MIN([.J300];[.H300])); 0) -> 0 | L300: of:=IF((ROW() - [.$B$13] < 3);0;FLOOR(IFERROR(OFFSET([.$F300];-1*[.$B$13];0 );0) * [.$B$14])) -> 0 | M300: of:=SUM([.L$3:.L300]) -> 6061951
D301: of:=[.D300]+1 -> 2020-11-13T00:00:00.000 | F301: of:=IF([.G300] < [.$B$25];CEILING([.G300]*[.$B$3];1);0) -> 0 | G301: of:=IF([.G300] < [.$B$25];SUM([.F$3:.F301]);[.$B$25]) -> 222350062.5 | H301: of:=IF((ROW() - [.$B$21] < 3);0;FLOOR(IFERROR(OFFSET([.$F301];-1*[.$B$21];0 );0) * [.$B$10])) -> 0 | I301: of:=SUM(INDEX([.H$1:.H$736];MAX(ROW()+(-1*[.$B$22])+1;3);1):INDEX([.H$1:.H$736];ROW();1)) -> 0 | J301: of:=IF([.I301] > [.$B$20];[.I301]-[.$B$20];0) -> 0 | K301: of:=IF([.J301] > 0; ROUND([.$B$23] *MIN([.J301];[.H301])); 0) -> 0 | L301: of:=IF((ROW() - [.$B$13] < 3);0;FLOOR(IFERROR(OFFSET([.$F301];-1*[.$B$13];0 );0) * [.$B$14])) -> 0 | M301: of:=SUM([.L$3:.L301]) -> 6061951
D302: of:=[.D301]+1 -> 2020-11-14T00:00:00.000 | F302: of:=IF([.G301] < [.$B$25];CEILING([.G301]*[.$B$3];1);0) -> 0 | G302: of:=IF([.G301] < [.$B$25];SUM([.F$3:.F302]);[.$B$25]) -> 222350062.5 | H302: of:=IF((ROW() - [.$B$21] < 3);0;FLOOR(IFERROR(OFFSET([.$F302];-1*[.$B$21];0 );0) * [.$B$10])) -> 0 | I302: of:=SUM(INDEX([.H$1:.H$736];MAX(ROW()+(-1*[.$B$22])+1;3);1):INDEX([.H$1:.H$736];ROW();1)) -> 0 | J302: of:=IF([.I302] > [.$B$20];[.I302]-[.$B$20];0) -> 0 | K302: of:=IF([.J302] > 0; ROUND([.$B$23] *MIN([.J302];[.H302])); 0) -> 0 | L302: of:=IF((ROW() - [.$B$13] < 3);0;FLOOR(IFERROR(OFFSET([.$F302];-1*[.$B$13];0 );0) * [.$B$14])) -> 0 | M302: of:=SUM([.L$3:.L302]) -> 6061951
D303: of:=[.D302]+1 -> 2020-11-15T00:00:00.000 | F303: of:=IF([.G302] < [.$B$25];CEILING([.G302]*[.$B$3];1);0) -> 0 | G303: of:=IF([.G302] < [.$B$25];SUM([.F$3:.F303]);[.$B$25]) -> 222350062.5 | H303: of:=IF((ROW() - [.$B$21] < 3);0;FLOOR(IFERROR(OFFSET([.$F303];-1*[.$B$21];0 );0) * [.$B$10])) -> 0 | I303: of:=SUM(INDEX([.H$1:.H$736];MAX(ROW()+(-1*[.$B$22])+1;3);1):INDEX([.H$1:.H$736];ROW();1)) -> 0 | J303: of:=IF([.I303] > [.$B$20];[.I303]-[.$B$20];0) -> 0 | K303: of:=IF([.J303] > 0; ROUND([.$B$23] *MIN([.J303];[.H303])); 0) -> 0 | L303: of:=IF((ROW() - [.$B$13] < 3);0;FLOOR(IFERROR(OFFSET([.$F303];-1*[.$B$13];0 );0) * [.$B$14])) -> 0 | M303: of:=SUM([.L$3:.L303]) -> 6061951
D304: of:=[.D303]+1 -> 2020-11-16T00:00:00.000 | F304: of:=IF([.G303] < [.$B$25];CEILING([.G303]*[.$B$3];1);0) -> 0 | G304: of:=IF([.G303] < [.$B$25];SUM([.F$3:.F304]);[.$B$25]) -> 222350062.5 | H304: of:=IF((ROW() - [.$B$21] < 3);0;FLOOR(IFERROR(OFFSET([.$F304];-1*[.$B$21];0 );0) * [.$B$10])) -> 0 | I304: of:=SUM(INDEX([.H$1:.H$736];MAX(ROW()+(-1*[.$B$22])+1;3);1):INDEX([.H$1:.H$736];ROW();1)) -> 0 | J304: of:=IF([.I304] > [.$B$20];[.I304]-[.$B$20];0) -> 0 | K304: of:=IF([.J304] > 0; ROUND([.$B$23] *MIN([.J304];[.H304])); 0) -> 0 | L304: of:=IF((ROW() - [.$B$13] < 3);0;FLOOR(IFERROR(OFFSET([.$F304];-1*[.$B$13];0 );0) * [.$B$14])) -> 0 | M304: of:=SUM([.L$3:.L304]) -> 6061951
D305: of:=[.D304]+1 -> 2020-11-17T00:00:00.000 | F305: of:=IF([.G304] < [.$B$25];CEILING([.G304]*[.$B$3];1);0) -> 0 | G305: of:=IF([.G304] < [.$B$25];SUM([.F$3:.F305]);[.$B$25]) -> 222350062.5 | H305: of:=IF((ROW() - [.$B$21] < 3);0;FLOOR(IFERROR(OFFSET([.$F305];-1*[.$B$21];0 );0) * [.$B$10])) -> 0 | I305: of:=SUM(INDEX([.H$1:.H$736];MAX(ROW()+(-1*[.$B$22])+1;3);1):INDEX([.H$1:.H$736];ROW();1)) -> 0 | J305: of:=IF([.I305] > [.$B$20];[.I305]-[.$B$20];0) -> 0 | K305: of:=IF([.J305] > 0; ROUND([.$B$23] *MIN([.J305];[.H305])); 0) -> 0 | L305: of:=IF((ROW() - [.$B$13] < 3);0;FLOOR(IFERROR(OFFSET([.$F305];-1*[.$B$13];0 );0) * [.$B$14])) -> 0 | M305: of:=SUM([.L$3:.L305]) -> 6061951
D306: of:=[.D305]+1 -> 2020-11-18T00:00:00.000 | F306: of:=IF([.G305] < [.$B$25];CEILING([.G305]*[.$B$3];1);0) -> 0 | G306: of:=IF([.G305] < [.$B$25];SUM([.F$3:.F306]);[.$B$25]) -> 222350062.5 | H306: of:=IF((ROW() - [.$B$21] < 3);0;FLOOR(IFERROR(OFFSET([.$F306];-1*[.$B$21];0 );0) * [.$B$10])) -> 0 | I306: of:=SUM(INDEX([.H$1:.H$736];MAX(ROW()+(-1*[.$B$22])+1;3);1):INDEX([.H$1:.H$736];ROW();1)) -> 0 | J306: of:=IF([.I306] > [.$B$20];[.I306]-[.$B$20];0) -> 0 | K306: of:=IF([.J306] > 0; ROUND([.$B$23] *MIN([.J306];[.H306])); 0) -> 0 | L306: of:=IF((ROW() - [.$B$13] < 3);0;FLOOR(IFERROR(OFFSET([.$F306];-1*[.$B$13];0 );0) * [.$B$14])) -> 0 | M306: of:=SUM([.L$3:.L306]) -> 6061951
D307: of:=[.D306]+1 -> 2020-11-19T00:00:00.000 | F307: of:=IF([.G306] < [.$B$25];CEILING([.G306]*[.$B$3];1);0) -> 0 | G307: of:=IF([.G306] < [.$B$25];SUM([.F$3:.F307]);[.$B$25]) -> 222350062.5 | H307: of:=IF((ROW() - [.$B$21] < 3);0;FLOOR(IFERROR(OFFSET([.$F307];-1*[.$B$21];0 );0) * [.$B$10])) -> 0 | I307: of:=SUM(INDEX([.H$1:.H$736];MAX(ROW()+(-1*[.$B$22])+1;3);1):INDEX([.H$1:.H$736];ROW();1)) -> 0 | J307: of:=IF([.I307] > [.$B$20];[.I307]-[.$B$20];0) -> 0 | K307: of:=IF([.J307] > 0; ROUND([.$B$23] *MIN([.J307];[.H307])); 0) -> 0 | L307: of:=IF((ROW() - [.$B$13] < 3);0;FLOOR(IFERROR(OFFSET([.$F307];-1*[.$B$13];0 );0) * [.$B$14])) -> 0 | M307: of:=SUM([.L$3:.L307]) -> 6061951
D308: of:=[.D307]+1 -> 2020-11-20T00:00:00.000 | F308: of:=IF([.G307] < [.$B$25];CEILING([.G307]*[.$B$3];1);0) -> 0 | G308: of:=IF([.G307] < [.$B$25];SUM([.F$3:.F308]);[.$B$25]) -> 222350062.5 | H308: of:=IF((ROW() - [.$B$21] < 3);0;FLOOR(IFERROR(OFFSET([.$F308];-1*[.$B$21];0 );0) * [.$B$10])) -> 0 | I308: of:=SUM(INDEX([.H$1:.H$736];MAX(ROW()+(-1*[.$B$22])+1;3);1):INDEX([.H$1:.H$736];ROW();1)) -> 0 | J308: of:=IF([.I308] > [.$B$20];[.I308]-[.$B$20];0) -> 0 | K308: of:=IF([.J308] > 0; ROUND([.$B$23] *MIN([.J308];[.H308])); 0) -> 0 | L308: of:=IF((ROW() - [.$B$13] < 3);0;FLOOR(IFERROR(OFFSET([.$F308];-1*[.$B$13];0 );0) * [.$B$14])) -> 0 | M308: of:=SUM([.L$3:.L308]) -> 6061951
D309: of:=[.D308]+1 -> 2020-11-21T00:00:00.000 | F309: of:=IF([.G308] < [.$B$25];CEILING([.G308]*[.$B$3];1);0) -> 0 | G309: of:=IF([.G308] < [.$B$25];SUM([.F$3:.F309]);[.$B$25]) -> 222350062.5 | H309: of:=IF((ROW() - [.$B$21] < 3);0;FLOOR(IFERROR(OFFSET([.$F309];-1*[.$B$21];0 );0) * [.$B$10])) -> 0 | I309: of:=SUM(INDEX([.H$1:.H$736];MAX(ROW()+(-1*[.$B$22])+1;3);1):INDEX([.H$1:.H$736];ROW();1)) -> 0 | J309: of:=IF([.I309] > [.$B$20];[.I309]-[.$B$20];0) -> 0 | K309: of:=IF([.J309] > 0; ROUND([.$B$23] *MIN([.J309];[.H309])); 0) -> 0 | L309: of:=IF((ROW() - [.$B$13] < 3);0;FLOOR(IFERROR(OFFSET([.$F309];-1*[.$B$13];0 );0) * [.$B$14])) -> 0 | M309: of:=SUM([.L$3:.L309]) -> 6061951
D310: of:=[.D309]+1 -> 2020-11-22T00:00:00.000 | F310: of:=IF([.G309] < [.$B$25];CEILING([.G309]*[.$B$3];1);0) -> 0 | G310: of:=IF([.G309] < [.$B$25];SUM([.F$3:.F310]);[.$B$25]) -> 222350062.5 | H310: of:=IF((ROW() - [.$B$21] < 3);0;FLOOR(IFERROR(OFFSET([.$F310];-1*[.$B$21];0 );0) * [.$B$10])) -> 0 | I310: of:=SUM(INDEX([.H$1:.H$736];MAX(ROW()+(-1*[.$B$22])+1;3);1):INDEX([.H$1:.H$736];ROW();1)) -> 0 | J310: of:=IF([.I310] > [.$B$20];[.I310]-[.$B$20];0) -> 0 | K310: of:=IF([.J310] > 0; ROUND([.$B$23] *MIN([.J310];[.H310])); 0) -> 0 | L310: of:=IF((ROW() - [.$B$13] < 3);0;FLOOR(IFERROR(OFFSET([.$F310];-1*[.$B$13];0 );0) * [.$B$14])) -> 0 | M310: of:=SUM([.L$3:.L310]) -> 6061951
D311: of:=[.D310]+1 -> 2020-11-23T00:00:00.000 | F311: of:=IF([.G310] < [.$B$25];CEILING([.G310]*[.$B$3];1);0) -> 0 | G311: of:=IF([.G310] < [.$B$25];SUM([.F$3:.F311]);[.$B$25]) -> 222350062.5 | H311: of:=IF((ROW() - [.$B$21] < 3);0;FLOOR(IFERROR(OFFSET([.$F311];-1*[.$B$21];0 );0) * [.$B$10])) -> 0 | I311: of:=SUM(INDEX([.H$1:.H$736];MAX(ROW()+(-1*[.$B$22])+1;3);1):INDEX([.H$1:.H$736];ROW();1)) -> 0 | J311: of:=IF([.I311] > [.$B$20];[.I311]-[.$B$20];0) -> 0 | K311: of:=IF([.J311] > 0; ROUND([.$B$23] *MIN([.J311];[.H311])); 0) -> 0 | L311: of:=IF((ROW() - [.$B$13] < 3);0;FLOOR(IFERROR(OFFSET([.$F311];-1*[.$B$13];0 );0) * [.$B$14])) -> 0 | M311: of:=SUM([.L$3:.L311]) -> 6061951
D312: of:=[.D311]+1 -> 2020-11-24T00:00:00.000 | F312: of:=IF([.G311] < [.$B$25];CEILING([.G311]*[.$B$3];1);0) -> 0 | G312: of:=IF([.G311] < [.$B$25];SUM([.F$3:.F312]);[.$B$25]) -> 222350062.5 | H312: of:=IF((ROW() - [.$B$21] < 3);0;FLOOR(IFERROR(OFFSET([.$F312];-1*[.$B$21];0 );0) * [.$B$10])) -> 0 | I312: of:=SUM(INDEX([.H$1:.H$736];MAX(ROW()+(-1*[.$B$22])+1;3);1):INDEX([.H$1:.H$736];ROW();1)) -> 0 | J312: of:=IF([.I312] > [.$B$20];[.I312]-[.$B$20];0) -> 0 | K312: of:=IF([.J312] > 0; ROUND([.$B$23] *MIN([.J312];[.H312])); 0) -> 0 | L312: of:=IF((ROW() - [.$B$13] < 3);0;FLOOR(IFERROR(OFFSET([.$F312];-1*[.$B$13];0 );0) * [.$B$14])) -> 0 | M312: of:=SUM([.L$3:.L312]) -> 6061951
D313: of:=[.D312]+1 -> 2020-11-25T00:00:00.000 | F313: of:=IF([.G312] < [.$B$25];CEILING([.G312]*[.$B$3];1);0) -> 0 | G313: of:=IF([.G312] < [.$B$25];SUM([.F$3:.F313]);[.$B$25]) -> 222350062.5 | H313: of:=IF((ROW() - [.$B$21] < 3);0;FLOOR(IFERROR(OFFSET([.$F313];-1*[.$B$21];0 );0) * [.$B$10])) -> 0 | I313: of:=SUM(INDEX([.H$1:.H$736];MAX(ROW()+(-1*[.$B$22])+1;3);1):INDEX([.H$1:.H$736];ROW();1)) -> 0 | J313: of:=IF([.I313] > [.$B$20];[.I313]-[.$B$20];0) -> 0 | K313: of:=IF([.J313] > 0; ROUND([.$B$23] *MIN([.J313];[.H313])); 0) -> 0 | L313: of:=IF((ROW() - [.$B$13] < 3);0;FLOOR(IFERROR(OFFSET([.$F313];-1*[.$B$13];0 );0) * [.$B$14])) -> 0 | M313: of:=SUM([.L$3:.L313]) -> 6061951
D314: of:=[.D313]+1 -> 2020-11-26T00:00:00.000 | F314: of:=IF([.G313] < [.$B$25];CEILING([.G313]*[.$B$3];1);0) -> 0 | G314: of:=IF([.G313] < [.$B$25];SUM([.F$3:.F314]);[.$B$25]) -> 222350062.5 | H314: of:=IF((ROW() - [.$B$21] < 3);0;FLOOR(IFERROR(OFFSET([.$F314];-1*[.$B$21];0 );0) * [.$B$10])) -> 0 | I314: of:=SUM(INDEX([.H$1:.H$736];MAX(ROW()+(-1*[.$B$22])+1;3);1):INDEX([.H$1:.H$736];ROW();1)) -> 0 | J314: of:=IF([.I314] > [.$B$20];[.I314]-[.$B$20];0) -> 0 | K314: of:=IF([.J314] > 0; ROUND([.$B$23] *MIN([.J314];[.H314])); 0) -> 0 | L314: of:=IF((ROW() - [.$B$13] < 3);0;FLOOR(IFERROR(OFFSET([.$F314];-1*[.$B$13];0 );0) * [.$B$14])) -> 0 | M314: of:=SUM([.L$3:.L314]) -> 6061951
D315: of:=[.D314]+1 -> 2020-11-27T00:00:00.000 | F315: of:=IF([.G314] < [.$B$25];CEILING([.G314]*[.$B$3];1);0) -> 0 | G315: of:=IF([.G314] < [.$B$25];SUM([.F$3:.F315]);[.$B$25]) -> 222350062.5 | H315: of:=IF((ROW() - [.$B$21] < 3);0;FLOOR(IFERROR(OFFSET([.$F315];-1*[.$B$21];0 );0) * [.$B$10])) -> 0 | I315: of:=SUM(INDEX([.H$1:.H$736];MAX(ROW()+(-1*[.$B$22])+1;3);1):INDEX([.H$1:.H$736];ROW();1)) -> 0 | J315: of:=IF([.I315] > [.$B$20];[.I315]-[.$B$20];0) -> 0 | K315: of:=IF([.J315] > 0; ROUND([.$B$23] *MIN([.J315];[.H315])); 0) -> 0 | L315: of:=IF((ROW() - [.$B$13] < 3);0;FLOOR(IFERROR(OFFSET([.$F315];-1*[.$B$13];0 );0) * [.$B$14])) -> 0 | M315: of:=SUM([.L$3:.L315]) -> 6061951
D316: of:=[.D315]+1 -> 2020-11-28T00:00:00.000 | F316: of:=IF([.G315] < [.$B$25];CEILING([.G315]*[.$B$3];1);0) -> 0 | G316: of:=IF([.G315] < [.$B$25];SUM([.F$3:.F316]);[.$B$25]) -> 222350062.5 | H316: of:=IF((ROW() - [.$B$21] < 3);0;FLOOR(IFERROR(OFFSET([.$F316];-1*[.$B$21];0 );0) * [.$B$10])) -> 0 | I316: of:=SUM(INDEX([.H$1:.H$736];MAX(ROW()+(-1*[.$B$22])+1;3);1):INDEX([.H$1:.H$736];ROW();1)) -> 0 | J316: of:=IF([.I316] > [.$B$20];[.I316]-[.$B$20];0) -> 0 | K316: of:=IF([.J316] > 0; ROUND([.$B$23] *MIN([.J316];[.H316])); 0) -> 0 | L316: of:=IF((ROW() - [.$B$13] < 3);0;FLOOR(IFERROR(OFFSET([.$F316];-1*[.$B$13];0 );0) * [.$B$14])) -> 0 | M316: of:=SUM([.L$3:.L316]) -> 6061951
D317: of:=[.D316]+1 -> 2020-11-29T00:00:00.000 | F317: of:=IF([.G316] < [.$B$25];CEILING([.G316]*[.$B$3];1);0) -> 0 | G317: of:=IF([.G316] < [.$B$25];SUM([.F$3:.F317]);[.$B$25]) -> 222350062.5 | H317: of:=IF((ROW() - [.$B$21] < 3);0;FLOOR(IFERROR(OFFSET([.$F317];-1*[.$B$21];0 );0) * [.$B$10])) -> 0 | I317: of:=SUM(INDEX([.H$1:.H$736];MAX(ROW()+(-1*[.$B$22])+1;3);1):INDEX([.H$1:.H$736];ROW();1)) -> 0 | J317: of:=IF([.I317] > [.$B$20];[.I317]-[.$B$20];0) -> 0 | K317: of:=IF([.J317] > 0; ROUND([.$B$23] *MIN([.J317];[.H317])); 0) -> 0 | L317: of:=IF((ROW() - [.$B$13] < 3);0;FLOOR(IFERROR(OFFSET([.$F317];-1*[.$B$13];0 );0) * [.$B$14])) -> 0 | M317: of:=SUM([.L$3:.L317]) -> 6061951
D318: of:=[.D317]+1 -> 2020-11-30T00:00:00.000 | F318: of:=IF([.G317] < [.$B$25];CEILING([.G317]*[.$B$3];1);0) -> 0 | G318: of:=IF([.G317] < [.$B$25];SUM([.F$3:.F318]);[.$B$25]) -> 222350062.5 | H318: of:=IF((ROW() - [.$B$21] < 3);0;FLOOR(IFERROR(OFFSET([.$F318];-1*[.$B$21];0 );0) * [.$B$10])) -> 0 | I318: of:=SUM(INDEX([.H$1:.H$736];MAX(ROW()+(-1*[.$B$22])+1;3);1):INDEX([.H$1:.H$736];ROW();1)) -> 0 | J318: of:=IF([.I318] > [.$B$20];[.I318]-[.$B$20];0) -> 0 | K318: of:=IF([.J318] > 0; ROUND([.$B$23] *MIN([.J318];[.H318])); 0) -> 0 | L318: of:=IF((ROW() - [.$B$13] < 3);0;FLOOR(IFERROR(OFFSET([.$F318];-1*[.$B$13];0 );0) * [.$B$14])) -> 0 | M318: of:=SUM([.L$3:.L318]) -> 6061951
D319: of:=[.D318]+1 -> 2020-12-01T00:00:00.000 | F319: of:=IF([.G318] < [.$B$25];CEILING([.G318]*[.$B$3];1);0) -> 0 | G319: of:=IF([.G318] < [.$B$25];SUM([.F$3:.F319]);[.$B$25]) -> 222350062.5 | H319: of:=IF((ROW() - [.$B$21] < 3);0;FLOOR(IFERROR(OFFSET([.$F319];-1*[.$B$21];0 );0) * [.$B$10])) -> 0 | I319: of:=SUM(INDEX([.H$1:.H$736];MAX(ROW()+(-1*[.$B$22])+1;3);1):INDEX([.H$1:.H$736];ROW();1)) -> 0 | J319: of:=IF([.I319] > [.$B$20];[.I319]-[.$B$20];0) -> 0 | K319: of:=IF([.J319] > 0; ROUND([.$B$23] *MIN([.J319];[.H319])); 0) -> 0 | L319: of:=IF((ROW() - [.$B$13] < 3);0;FLOOR(IFERROR(OFFSET([.$F319];-1*[.$B$13];0 );0) * [.$B$14])) -> 0 | M319: of:=SUM([.L$3:.L319]) -> 6061951
D320: of:=[.D319]+1 -> 2020-12-02T00:00:00.000 | F320: of:=IF([.G319] < [.$B$25];CEILING([.G319]*[.$B$3];1);0) -> 0 | G320: of:=IF([.G319] < [.$B$25];SUM([.F$3:.F320]);[.$B$25]) -> 222350062.5 | H320: of:=IF((ROW() - [.$B$21] < 3);0;FLOOR(IFERROR(OFFSET([.$F320];-1*[.$B$21];0 );0) * [.$B$10])) -> 0 | I320: of:=SUM(INDEX([.H$1:.H$736];MAX(ROW()+(-1*[.$B$22])+1;3);1):INDEX([.H$1:.H$736];ROW();1)) -> 0 | J320: of:=IF([.I320] > [.$B$20];[.I320]-[.$B$20];0) -> 0 | K320: of:=IF([.J320] > 0; ROUND([.$B$23] *MIN([.J320];[.H320])); 0) -> 0 | L320: of:=IF((ROW() - [.$B$13] < 3);0;FLOOR(IFERROR(OFFSET([.$F320];-1*[.$B$13];0 );0) * [.$B$14])) -> 0 | M320: of:=SUM([.L$3:.L320]) -> 6061951
D321: of:=[.D320]+1 -> 2020-12-03T00:00:00.000 | F321: of:=IF([.G320] < [.$B$25];CEILING([.G320]*[.$B$3];1);0) -> 0 | G321: of:=IF([.G320] < [.$B$25];SUM([.F$3:.F321]);[.$B$25]) -> 222350062.5 | H321: of:=IF((ROW() - [.$B$21] < 3);0;FLOOR(IFERROR(OFFSET([.$F321];-1*[.$B$21];0 );0) * [.$B$10])) -> 0 | I321: of:=SUM(INDEX([.H$1:.H$736];MAX(ROW()+(-1*[.$B$22])+1;3);1):INDEX([.H$1:.H$736];ROW();1)) -> 0 | J321: of:=IF([.I321] > [.$B$20];[.I321]-[.$B$20];0) -> 0 | K321: of:=IF([.J321] > 0; ROUND([.$B$23] *MIN([.J321];[.H321])); 0) -> 0 | L321: of:=IF((ROW() - [.$B$13] < 3);0;FLOOR(IFERROR(OFFSET([.$F321];-1*[.$B$13];0 );0) * [.$B$14])) -> 0 | M321: of:=SUM([.L$3:.L321]) -> 6061951
D322: of:=[.D321]+1 -> 2020-12-04T00:00:00.000 | F322: of:=IF([.G321] < [.$B$25];CEILING([.G321]*[.$B$3];1);0) -> 0 | G322: of:=IF([.G321] < [.$B$25];SUM([.F$3:.F322]);[.$B$25]) -> 222350062.5 | H322: of:=IF((ROW() - [.$B$21] < 3);0;FLOOR(IFERROR(OFFSET([.$F322];-1*[.$B$21];0 );0) * [.$B$10])) -> 0 | I322: of:=SUM(INDEX([.H$1:.H$736];MAX(ROW()+(-1*[.$B$22])+1;3);1):INDEX([.H$1:.H$736];ROW();1)) -> 0 | J322: of:=IF([.I322] > [.$B$20];[.I322]-[.$B$20];0) -> 0 | K322: of:=IF([.J322] > 0; ROUND([.$B$23] *MIN([.J322];[.H322])); 0) -> 0 | L322: of:=IF((ROW() - [.$B$13] < 3);0;FLOOR(IFERROR(OFFSET([.$F322];-1*[.$B$13];0 );0) * [.$B$14])) -> 0 | M322: of:=SUM([.L$3:.L322]) -> 6061951
D323: of:=[.D322]+1 -> 2020-12-05T00:00:00.000 | F323: of:=IF([.G322] < [.$B$25];CEILING([.G322]*[.$B$3];1);0) -> 0 | G323: of:=IF([.G322] < [.$B$25];SUM([.F$3:.F323]);[.$B$25]) -> 222350062.5 | H323: of:=IF((ROW() - [.$B$21] < 3);0;FLOOR(IFERROR(OFFSET([.$F323];-1*[.$B$21];0 );0) * [.$B$10])) -> 0 | I323: of:=SUM(INDEX([.H$1:.H$736];MAX(ROW()+(-1*[.$B$22])+1;3);1):INDEX([.H$1:.H$736];ROW();1)) -> 0 | J323: of:=IF([.I323] > [.$B$20];[.I323]-[.$B$20];0) -> 0 | K323: of:=IF([.J323] > 0; ROUND([.$B$23] *MIN([.J323];[.H323])); 0) -> 0 | L323: of:=IF((ROW() - [.$B$13] < 3);0;FLOOR(IFERROR(OFFSET([.$F323];-1*[.$B$13];0 );0) * [.$B$14])) -> 0 | M323: of:=SUM([.L$3:.L323]) -> 6061951
D324: of:=[.D323]+1 -> 2020-12-06T00:00:00.000 | F324: of:=IF([.G323] < [.$B$25];CEILING([.G323]*[.$B$3];1);0) -> 0 | G324: of:=IF([.G323] < [.$B$25];SUM([.F$3:.F324]);[.$B$25]) -> 222350062.5 | H324: of:=IF((ROW() - [.$B$21] < 3);0;FLOOR(IFERROR(OFFSET([.$F324];-1*[.$B$21];0 );0) * [.$B$10])) -> 0 | I324: of:=SUM(INDEX([.H$1:.H$736];MAX(ROW()+(-1*[.$B$22])+1;3);1):INDEX([.H$1:.H$736];ROW();1)) -> 0 | J324: of:=IF([.I324] > [.$B$20];[.I324]-[.$B$20];0) -> 0 | K324: of:=IF([.J324] > 0; ROUND([.$B$23] *MIN([.J324];[.H324])); 0) -> 0 | L324: of:=IF((ROW() - [.$B$13] < 3);0;FLOOR(IFERROR(OFFSET([.$F324];-1*[.$B$13];0 );0) * [.$B$14])) -> 0 | M324: of:=SUM([.L$3:.L324]) -> 6061951
D325: of:=[.D324]+1 -> 2020-12-07T00:00:00.000 | F325: of:=IF([.G324] < [.$B$25];CEILING([.G324]*[.$B$3];1);0) -> 0 | G325: of:=IF([.G324] < [.$B$25];SUM([.F$3:.F325]);[.$B$25]) -> 222350062.5 | H325: of:=IF((ROW() - [.$B$21] < 3);0;FLOOR(IFERROR(OFFSET([.$F325];-1*[.$B$21];0 );0) * [.$B$10])) -> 0 | I325: of:=SUM(INDEX([.H$1:.H$736];MAX(ROW()+(-1*[.$B$22])+1;3);1):INDEX([.H$1:.H$736];ROW();1)) -> 0 | J325: of:=IF([.I325] > [.$B$20];[.I325]-[.$B$20];0) -> 0 | K325: of:=IF([.J325] > 0; ROUND([.$B$23] *MIN([.J325];[.H325])); 0) -> 0 | L325: of:=IF((ROW() - [.$B$13] < 3);0;FLOOR(IFERROR(OFFSET([.$F325];-1*[.$B$13];0 );0) * [.$B$14])) -> 0 | M325: of:=SUM([.L$3:.L325]) -> 6061951
D326: of:=[.D325]+1 -> 2020-12-08T00:00:00.000 | F326: of:=IF([.G325] < [.$B$25];CEILING([.G325]*[.$B$3];1);0) -> 0 | G326: of:=IF([.G325] < [.$B$25];SUM([.F$3:.F326]);[.$B$25]) -> 222350062.5 | H326: of:=IF((ROW() - [.$B$21] < 3);0;FLOOR(IFERROR(OFFSET([.$F326];-1*[.$B$21];0 );0) * [.$B$10])) -> 0 | I326: of:=SUM(INDEX([.H$1:.H$736];MAX(ROW()+(-1*[.$B$22])+1;3);1):INDEX([.H$1:.H$736];ROW();1)) -> 0 | J326: of:=IF([.I326] > [.$B$20];[.I326]-[.$B$20];0) -> 0 | K326: of:=IF([.J326] > 0; ROUND([.$B$23] *MIN([.J326];[.H326])); 0) -> 0 | L326: of:=IF((ROW() - [.$B$13] < 3);0;FLOOR(IFERROR(OFFSET([.$F326];-1*[.$B$13];0 );0) * [.$B$14])) -> 0 | M326: of:=SUM([.L$3:.L326]) -> 6061951
D327: of:=[.D326]+1 -> 2020-12-09T00:00:00.000 | F327: of:=IF([.G326] < [.$B$25];CEILING([.G326]*[.$B$3];1);0) -> 0 | G327: of:=IF([.G326] < [.$B$25];SUM([.F$3:.F327]);[.$B$25]) -> 222350062.5 | H327: of:=IF((ROW() - [.$B$21] < 3);0;FLOOR(IFERROR(OFFSET([.$F327];-1*[.$B$21];0 );0) * [.$B$10])) -> 0 | I327: of:=SUM(INDEX([.H$1:.H$736];MAX(ROW()+(-1*[.$B$22])+1;3);1):INDEX([.H$1:.H$736];ROW();1)) -> 0 | J327: of:=IF([.I327] > [.$B$20];[.I327]-[.$B$20];0) -> 0 | K327: of:=IF([.J327] > 0; ROUND([.$B$23] *MIN([.J327];[.H327])); 0) -> 0 | L327: of:=IF((ROW() - [.$B$13] < 3);0;FLOOR(IFERROR(OFFSET([.$F327];-1*[.$B$13];0 );0) * [.$B$14])) -> 0 | M327: of:=SUM([.L$3:.L327]) -> 6061951
D328: of:=[.D327]+1 -> 2020-12-10T00:00:00.000 | F328: of:=IF([.G327] < [.$B$25];CEILING([.G327]*[.$B$3];1);0) -> 0 | G328: of:=IF([.G327] < [.$B$25];SUM([.F$3:.F328]);[.$B$25]) -> 222350062.5 | H328: of:=IF((ROW() - [.$B$21] < 3);0;FLOOR(IFERROR(OFFSET([.$F328];-1*[.$B$21];0 );0) * [.$B$10])) -> 0 | I328: of:=SUM(INDEX([.H$1:.H$736];MAX(ROW()+(-1*[.$B$22])+1;3);1):INDEX([.H$1:.H$736];ROW();1)) -> 0 | J328: of:=IF([.I328] > [.$B$20];[.I328]-[.$B$20];0) -> 0 | K328: of:=IF([.J328] > 0; ROUND([.$B$23] *MIN([.J328];[.H328])); 0) -> 0 | L328: of:=IF((ROW() - [.$B$13] < 3);0;FLOOR(IFERROR(OFFSET([.$F328];-1*[.$B$13];0 );0) * [.$B$14])) -> 0 | M328: of:=SUM([.L$3:.L328]) -> 6061951
D329: of:=[.D328]+1 -> 2020-12-11T00:00:00.000 | F329: of:=IF([.G328] < [.$B$25];CEILING([.G328]*[.$B$3];1);0) -> 0 | G329: of:=IF([.G328] < [.$B$25];SUM([.F$3:.F329]);[.$B$25]) -> 222350062.5 | H329: of:=IF((ROW() - [.$B$21] < 3);0;FLOOR(IFERROR(OFFSET([.$F329];-1*[.$B$21];0 );0) * [.$B$10])) -> 0 | I329: of:=SUM(INDEX([.H$1:.H$736];MAX(ROW()+(-1*[.$B$22])+1;3);1):INDEX([.H$1:.H$736];ROW();1)) -> 0 | J329: of:=IF([.I329] > [.$B$20];[.I329]-[.$B$20];0) -> 0 | K329: of:=IF([.J329] > 0; ROUND([.$B$23] *MIN([.J329];[.H329])); 0) -> 0 | L329: of:=IF((ROW() - [.$B$13] < 3);0;FLOOR(IFERROR(OFFSET([.$F329];-1*[.$B$13];0 );0) * [.$B$14])) -> 0 | M329: of:=SUM([.L$3:.L329]) -> 6061951
D330: of:=[.D329]+1 -> 2020-12-12T00:00:00.000 | F330: of:=IF([.G329] < [.$B$25];CEILING([.G329]*[.$B$3];1);0) -> 0 | G330: of:=IF([.G329] < [.$B$25];SUM([.F$3:.F330]);[.$B$25]) -> 222350062.5 | H330: of:=IF((ROW() - [.$B$21] < 3);0;FLOOR(IFERROR(OFFSET([.$F330];-1*[.$B$21];0 );0) * [.$B$10])) -> 0 | I330: of:=SUM(INDEX([.H$1:.H$736];MAX(ROW()+(-1*[.$B$22])+1;3);1):INDEX([.H$1:.H$736];ROW();1)) -> 0 | J330: of:=IF([.I330] > [.$B$20];[.I330]-[.$B$20];0) -> 0 | K330: of:=IF([.J330] > 0; ROUND([.$B$23] *MIN([.J330];[.H330])); 0) -> 0 | L330: of:=IF((ROW() - [.$B$13] < 3);0;FLOOR(IFERROR(OFFSET([.$F330];-1*[.$B$13];0 );0) * [.$B$14])) -> 0 | M330: of:=SUM([.L$3:.L330]) -> 6061951
D331: of:=[.D330]+1 -> 2020-12-13T00:00:00.000 | F331: of:=IF([.G330] < [.$B$25];CEILING([.G330]*[.$B$3];1);0) -> 0 | G331: of:=IF([.G330] < [.$B$25];SUM([.F$3:.F331]);[.$B$25]) -> 222350062.5 | H331: of:=IF((ROW() - [.$B$21] < 3);0;FLOOR(IFERROR(OFFSET([.$F331];-1*[.$B$21];0 );0) * [.$B$10])) -> 0 | I331: of:=SUM(INDEX([.H$1:.H$736];MAX(ROW()+(-1*[.$B$22])+1;3);1):INDEX([.H$1:.H$736];ROW();1)) -> 0 | J331: of:=IF([.I331] > [.$B$20];[.I331]-[.$B$20];0) -> 0 | K331: of:=IF([.J331] > 0; ROUND([.$B$23] *MIN([.J331];[.H331])); 0) -> 0 | L331: of:=IF((ROW() - [.$B$13] < 3);0;FLOOR(IFERROR(OFFSET([.$F331];-1*[.$B$13];0 );0) * [.$B$14])) -> 0 | M331: of:=SUM([.L$3:.L331]) -> 6061951
D332: of:=[.D331]+1 -> 2020-12-14T00:00:00.000 | F332: of:=IF([.G331] < [.$B$25];CEILING([.G331]*[.$B$3];1);0) -> 0 | G332: of:=IF([.G331] < [.$B$25];SUM([.F$3:.F332]);[.$B$25]) -> 222350062.5 | H332: of:=IF((ROW() - [.$B$21] < 3);0;FLOOR(IFERROR(OFFSET([.$F332];-1*[.$B$21];0 );0) * [.$B$10])) -> 0 | I332: of:=SUM(INDEX([.H$1:.H$736];MAX(ROW()+(-1*[.$B$22])+1;3);1):INDEX([.H$1:.H$736];ROW();1)) -> 0 | J332: of:=IF([.I332] > [.$B$20];[.I332]-[.$B$20];0) -> 0 | K332: of:=IF([.J332] > 0; ROUND([.$B$23] *MIN([.J332];[.H332])); 0) -> 0 | L332: of:=IF((ROW() - [.$B$13] < 3);0;FLOOR(IFERROR(OFFSET([.$F332];-1*[.$B$13];0 );0) * [.$B$14])) -> 0 | M332: of:=SUM([.L$3:.L332]) -> 6061951
D333: of:=[.D332]+1 -> 2020-12-15T00:00:00.000 | F333: of:=IF([.G332] < [.$B$25];CEILING([.G332]*[.$B$3];1);0) -> 0 | G333: of:=IF([.G332] < [.$B$25];SUM([.F$3:.F333]);[.$B$25]) -> 222350062.5 | H333: of:=IF((ROW() - [.$B$21] < 3);0;FLOOR(IFERROR(OFFSET([.$F333];-1*[.$B$21];0 );0) * [.$B$10])) -> 0 | I333: of:=SUM(INDEX([.H$1:.H$736];MAX(ROW()+(-1*[.$B$22])+1;3);1):INDEX([.H$1:.H$736];ROW();1)) -> 0 | J333: of:=IF([.I333] > [.$B$20];[.I333]-[.$B$20];0) -> 0 | K333: of:=IF([.J333] > 0; ROUND([.$B$23] *MIN([.J333];[.H333])); 0) -> 0 | L333: of:=IF((ROW() - [.$B$13] < 3);0;FLOOR(IFERROR(OFFSET([.$F333];-1*[.$B$13];0 );0) * [.$B$14])) -> 0 | M333: of:=SUM([.L$3:.L333]) -> 6061951
D334: of:=[.D333]+1 -> 2020-12-16T00:00:00.000 | F334: of:=IF([.G333] < [.$B$25];CEILING([.G333]*[.$B$3];1);0) -> 0 | G334: of:=IF([.G333] < [.$B$25];SUM([.F$3:.F334]);[.$B$25]) -> 222350062.5 | H334: of:=IF((ROW() - [.$B$21] < 3);0;FLOOR(IFERROR(OFFSET([.$F334];-1*[.$B$21];0 );0) * [.$B$10])) -> 0 | I334: of:=SUM(INDEX([.H$1:.H$736];MAX(ROW()+(-1*[.$B$22])+1;3);1):INDEX([.H$1:.H$736];ROW();1)) -> 0 | J334: of:=IF([.I334] > [.$B$20];[.I334]-[.$B$20];0) -> 0 | K334: of:=IF([.J334] > 0; ROUND([.$B$23] *MIN([.J334];[.H334])); 0) -> 0 | L334: of:=IF((ROW() - [.$B$13] < 3);0;FLOOR(IFERROR(OFFSET([.$F334];-1*[.$B$13];0 );0) * [.$B$14])) -> 0 | M334: of:=SUM([.L$3:.L334]) -> 6061951
D335: of:=[.D334]+1 -> 2020-12-17T00:00:00.000 | F335: of:=IF([.G334] < [.$B$25];CEILING([.G334]*[.$B$3];1);0) -> 0 | G335: of:=IF([.G334] < [.$B$25];SUM([.F$3:.F335]);[.$B$25]) -> 222350062.5 | H335: of:=IF((ROW() - [.$B$21] < 3);0;FLOOR(IFERROR(OFFSET([.$F335];-1*[.$B$21];0 );0) * [.$B$10])) -> 0 | I335: of:=SUM(INDEX([.H$1:.H$736];MAX(ROW()+(-1*[.$B$22])+1;3);1):INDEX([.H$1:.H$736];ROW();1)) -> 0 | J335: of:=IF([.I335] > [.$B$20];[.I335]-[.$B$20];0) -> 0 | K335: of:=IF([.J335] > 0; ROUND([.$B$23] *MIN([.J335];[.H335])); 0) -> 0 | L335: of:=IF((ROW() - [.$B$13] < 3);0;FLOOR(IFERROR(OFFSET([.$F335];-1*[.$B$13];0 );0) * [.$B$14])) -> 0 | M335: of:=SUM([.L$3:.L335]) -> 6061951
D336: of:=[.D335]+1 -> 2020-12-18T00:00:00.000 | F336: of:=IF([.G335] < [.$B$25];CEILING([.G335]*[.$B$3];1);0) -> 0 | G336: of:=IF([.G335] < [.$B$25];SUM([.F$3:.F336]);[.$B$25]) -> 222350062.5 | H336: of:=IF((ROW() - [.$B$21] < 3);0;FLOOR(IFERROR(OFFSET([.$F336];-1*[.$B$21];0 );0) * [.$B$10])) -> 0 | I336: of:=SUM(INDEX([.H$1:.H$736];MAX(ROW()+(-1*[.$B$22])+1;3);1):INDEX([.H$1:.H$736];ROW();1)) -> 0 | J336: of:=IF([.I336] > [.$B$20];[.I336]-[.$B$20];0) -> 0 | K336: of:=IF([.J336] > 0; ROUND([.$B$23] *MIN([.J336];[.H336])); 0) -> 0 | L336: of:=IF((ROW() - [.$B$13] < 3);0;FLOOR(IFERROR(OFFSET([.$F336];-1*[.$B$13];0 );0) * [.$B$14])) -> 0 | M336: of:=SUM([.L$3:.L336]) -> 6061951
D337: of:=[.D336]+1 -> 2020-12-19T00:00:00.000 | F337: of:=IF([.G336] < [.$B$25];CEILING([.G336]*[.$B$3];1);0) -> 0 | G337: of:=IF([.G336] < [.$B$25];SUM([.F$3:.F337]);[.$B$25]) -> 222350062.5 | H337: of:=IF((ROW() - [.$B$21] < 3);0;FLOOR(IFERROR(OFFSET([.$F337];-1*[.$B$21];0 );0) * [.$B$10])) -> 0 | I337: of:=SUM(INDEX([.H$1:.H$736];MAX(ROW()+(-1*[.$B$22])+1;3);1):INDEX([.H$1:.H$736];ROW();1)) -> 0 | J337: of:=IF([.I337] > [.$B$20];[.I337]-[.$B$20];0) -> 0 | K337: of:=IF([.J337] > 0; ROUND([.$B$23] *MIN([.J337];[.H337])); 0) -> 0 | L337: of:=IF((ROW() - [.$B$13] < 3);0;FLOOR(IFERROR(OFFSET([.$F337];-1*[.$B$13];0 );0) * [.$B$14])) -> 0 | M337: of:=SUM([.L$3:.L337]) -> 6061951
D338: of:=[.D337]+1 -> 2020-12-20T00:00:00.000 | F338: of:=IF([.G337] < [.$B$25];CEILING([.G337]*[.$B$3];1);0) -> 0 | G338: of:=IF([.G337] < [.$B$25];SUM([.F$3:.F338]);[.$B$25]) -> 222350062.5 | H338: of:=IF((ROW() - [.$B$21] < 3);0;FLOOR(IFERROR(OFFSET([.$F338];-1*[.$B$21];0 );0) * [.$B$10])) -> 0 | I338: of:=SUM(INDEX([.H$1:.H$736];MAX(ROW()+(-1*[.$B$22])+1;3);1):INDEX([.H$1:.H$736];ROW();1)) -> 0 | J338: of:=IF([.I338] > [.$B$20];[.I338]-[.$B$20];0) -> 0 | K338: of:=IF([.J338] > 0; ROUND([.$B$23] *MIN([.J338];[.H338])); 0) -> 0 | L338: of:=IF((ROW() - [.$B$13] < 3);0;FLOOR(IFERROR(OFFSET([.$F338];-1*[.$B$13];0 );0) * [.$B$14])) -> 0 | M338: of:=SUM([.L$3:.L338]) -> 6061951
D339: of:=[.D338]+1 -> 2020-12-21T00:00:00.000 | F339: of:=IF([.G338] < [.$B$25];CEILING([.G338]*[.$B$3];1);0) -> 0 | G339: of:=IF([.G338] < [.$B$25];SUM([.F$3:.F339]);[.$B$25]) -> 222350062.5 | H339: of:=IF((ROW() - [.$B$21] < 3);0;FLOOR(IFERROR(OFFSET([.$F339];-1*[.$B$21];0 );0) * [.$B$10])) -> 0 | I339: of:=SUM(INDEX([.H$1:.H$736];MAX(ROW()+(-1*[.$B$22])+1;3);1):INDEX([.H$1:.H$736];ROW();1)) -> 0 | J339: of:=IF([.I339] > [.$B$20];[.I339]-[.$B$20];0) -> 0 | K339: of:=IF([.J339] > 0; ROUND([.$B$23] *MIN([.J339];[.H339])); 0) -> 0 | L339: of:=IF((ROW() - [.$B$13] < 3);0;FLOOR(IFERROR(OFFSET([.$F339];-1*[.$B$13];0 );0) * [.$B$14])) -> 0 | M339: of:=SUM([.L$3:.L339]) -> 6061951
D340: of:=[.D339]+1 -> 2020-12-22T00:00:00.000 | F340: of:=IF([.G339] < [.$B$25];CEILING([.G339]*[.$B$3];1);0) -> 0 | G340: of:=IF([.G339] < [.$B$25];SUM([.F$3:.F340]);[.$B$25]) -> 222350062.5 | H340: of:=IF((ROW() - [.$B$21] < 3);0;FLOOR(IFERROR(OFFSET([.$F340];-1*[.$B$21];0 );0) * [.$B$10])) -> 0 | I340: of:=SUM(INDEX([.H$1:.H$736];MAX(ROW()+(-1*[.$B$22])+1;3);1):INDEX([.H$1:.H$736];ROW();1)) -> 0 | J340: of:=IF([.I340] > [.$B$20];[.I340]-[.$B$20];0) -> 0 | K340: of:=IF([.J340] > 0; ROUND([.$B$23] *MIN([.J340];[.H340])); 0) -> 0 | L340: of:=IF((ROW() - [.$B$13] < 3);0;FLOOR(IFERROR(OFFSET([.$F340];-1*[.$B$13];0 );0) * [.$B$14])) -> 0 | M340: of:=SUM([.L$3:.L340]) -> 6061951
D341: of:=[.D340]+1 -> 2020-12-23T00:00:00.000 | F341: of:=IF([.G340] < [.$B$25];CEILING([.G340]*[.$B$3];1);0) -> 0 | G341: of:=IF([.G340] < [.$B$25];SUM([.F$3:.F341]);[.$B$25]) -> 222350062.5 | H341: of:=IF((ROW() - [.$B$21] < 3);0;FLOOR(IFERROR(OFFSET([.$F341];-1*[.$B$21];0 );0) * [.$B$10])) -> 0 | I341: of:=SUM(INDEX([.H$1:.H$736];MAX(ROW()+(-1*[.$B$22])+1;3);1):INDEX([.H$1:.H$736];ROW();1)) -> 0 | J341: of:=IF([.I341] > [.$B$20];[.I341]-[.$B$20];0) -> 0 | K341: of:=IF([.J341] > 0; ROUND([.$B$23] *MIN([.J341];[.H341])); 0) -> 0 | L341: of:=IF((ROW() - [.$B$13] < 3);0;FLOOR(IFERROR(OFFSET([.$F341];-1*[.$B$13];0 );0) * [.$B$14])) -> 0 | M341: of:=SUM([.L$3:.L341]) -> 6061951
D342: of:=[.D341]+1 -> 2020-12-24T00:00:00.000 | F342: of:=IF([.G341] < [.$B$25];CEILING([.G341]*[.$B$3];1);0) -> 0 | G342: of:=IF([.G341] < [.$B$25];SUM([.F$3:.F342]);[.$B$25]) -> 222350062.5 | H342: of:=IF((ROW() - [.$B$21] < 3);0;FLOOR(IFERROR(OFFSET([.$F342];-1*[.$B$21];0 );0) * [.$B$10])) -> 0 | I342: of:=SUM(INDEX([.H$1:.H$736];MAX(ROW()+(-1*[.$B$22])+1;3);1):INDEX([.H$1:.H$736];ROW();1)) -> 0 | J342: of:=IF([.I342] > [.$B$20];[.I342]-[.$B$20];0) -> 0 | K342: of:=IF([.J342] > 0; ROUND([.$B$23] *MIN([.J342];[.H342])); 0) -> 0 | L342: of:=IF((ROW() - [.$B$13] < 3);0;FLOOR(IFERROR(OFFSET([.$F342];-1*[.$B$13];0 );0) * [.$B$14])) -> 0 | M342: of:=SUM([.L$3:.L342]) -> 6061951
D343: of:=[.D342]+1 -> 2020-12-25T00:00:00.000 | F343: of:=IF([.G342] < [.$B$25];CEILING([.G342]*[.$B$3];1);0) -> 0 | G343: of:=IF([.G342] < [.$B$25];SUM([.F$3:.F343]);[.$B$25]) -> 222350062.5 | H343: of:=IF((ROW() - [.$B$21] < 3);0;FLOOR(IFERROR(OFFSET([.$F343];-1*[.$B$21];0 );0) * [.$B$10])) -> 0 | I343: of:=SUM(INDEX([.H$1:.H$736];MAX(ROW()+(-1*[.$B$22])+1;3);1):INDEX([.H$1:.H$736];ROW();1)) -> 0 | J343: of:=IF([.I343] > [.$B$20];[.I343]-[.$B$20];0) -> 0 | K343: of:=IF([.J343] > 0; ROUND([.$B$23] *MIN([.J343];[.H343])); 0) -> 0 | L343: of:=IF((ROW() - [.$B$13] < 3);0;FLOOR(IFERROR(OFFSET([.$F343];-1*[.$B$13];0 );0) * [.$B$14])) -> 0 | M343: of:=SUM([.L$3:.L343]) -> 6061951
D344: of:=[.D343]+1 -> 2020-12-26T00:00:00.000 | F344: of:=IF([.G343] < [.$B$25];CEILING([.G343]*[.$B$3];1);0) -> 0 | G344: of:=IF([.G343] < [.$B$25];SUM([.F$3:.F344]);[.$B$25]) -> 222350062.5 | H344: of:=IF((ROW() - [.$B$21] < 3);0;FLOOR(IFERROR(OFFSET([.$F344];-1*[.$B$21];0 );0) * [.$B$10])) -> 0 | I344: of:=SUM(INDEX([.H$1:.H$736];MAX(ROW()+(-1*[.$B$22])+1;3);1):INDEX([.H$1:.H$736];ROW();1)) -> 0 | J344: of:=IF([.I344] > [.$B$20];[.I344]-[.$B$20];0) -> 0 | K344: of:=IF([.J344] > 0; ROUND([.$B$23] *MIN([.J344];[.H344])); 0) -> 0 | L344: of:=IF((ROW() - [.$B$13] < 3);0;FLOOR(IFERROR(OFFSET([.$F344];-1*[.$B$13];0 );0) * [.$B$14])) -> 0 | M344: of:=SUM([.L$3:.L344]) -> 6061951
D345: of:=[.D344]+1 -> 2020-12-27T00:00:00.000 | F345: of:=IF([.G344] < [.$B$25];CEILING([.G344]*[.$B$3];1);0) -> 0 | G345: of:=IF([.G344] < [.$B$25];SUM([.F$3:.F345]);[.$B$25]) -> 222350062.5 | H345: of:=IF((ROW() - [.$B$21] < 3);0;FLOOR(IFERROR(OFFSET([.$F345];-1*[.$B$21];0 );0) * [.$B$10])) -> 0 | I345: of:=SUM(INDEX([.H$1:.H$736];MAX(ROW()+(-1*[.$B$22])+1;3);1):INDEX([.H$1:.H$736];ROW();1)) -> 0 | J345: of:=IF([.I345] > [.$B$20];[.I345]-[.$B$20];0) -> 0 | K345: of:=IF([.J345] > 0; ROUND([.$B$23] *MIN([.J345];[.H345])); 0) -> 0 | L345: of:=IF((ROW() - [.$B$13] < 3);0;FLOOR(IFERROR(OFFSET([.$F345];-1*[.$B$13];0 );0) * [.$B$14])) -> 0 | M345: of:=SUM([.L$3:.L345]) -> 6061951
D346: of:=[.D345]+1 -> 2020-12-28T00:00:00.000 | F346: of:=IF([.G345] < [.$B$25];CEILING([.G345]*[.$B$3];1);0) -> 0 | G346: of:=IF([.G345] < [.$B$25];SUM([.F$3:.F346]);[.$B$25]) -> 222350062.5 | H346: of:=IF((ROW() - [.$B$21] < 3);0;FLOOR(IFERROR(OFFSET([.$F346];-1*[.$B$21];0 );0) * [.$B$10])) -> 0 | I346: of:=SUM(INDEX([.H$1:.H$736];MAX(ROW()+(-1*[.$B$22])+1;3);1):INDEX([.H$1:.H$736];ROW();1)) -> 0 | J346: of:=IF([.I346] > [.$B$20];[.I346]-[.$B$20];0) -> 0 | K346: of:=IF([.J346] > 0; ROUND([.$B$23] *MIN([.J346];[.H346])); 0) -> 0 | L346: of:=IF((ROW() - [.$B$13] < 3);0;FLOOR(IFERROR(OFFSET([.$F346];-1*[.$B$13];0 );0) * [.$B$14])) -> 0 | M346: of:=SUM([.L$3:.L346]) -> 6061951
D347: of:=[.D346]+1 -> 2020-12-29T00:00:00.000 | F347: of:=IF([.G346] < [.$B$25];CEILING([.G346]*[.$B$3];1);0) -> 0 | G347: of:=IF([.G346] < [.$B$25];SUM([.F$3:.F347]);[.$B$25]) -> 222350062.5 | H347: of:=IF((ROW() - [.$B$21] < 3);0;FLOOR(IFERROR(OFFSET([.$F347];-1*[.$B$21];0 );0) * [.$B$10])) -> 0 | I347: of:=SUM(INDEX([.H$1:.H$736];MAX(ROW()+(-1*[.$B$22])+1;3);1):INDEX([.H$1:.H$736];ROW();1)) -> 0 | J347: of:=IF([.I347] > [.$B$20];[.I347]-[.$B$20];0) -> 0 | K347: of:=IF([.J347] > 0; ROUND([.$B$23] *MIN([.J347];[.H347])); 0) -> 0 | L347: of:=IF((ROW() - [.$B$13] < 3);0;FLOOR(IFERROR(OFFSET([.$F347];-1*[.$B$13];0 );0) * [.$B$14])) -> 0 | M347: of:=SUM([.L$3:.L347]) -> 6061951
D348: of:=[.D347]+1 -> 2020-12-30T00:00:00.000 | F348: of:=IF([.G347] < [.$B$25];CEILING([.G347]*[.$B$3];1);0) -> 0 | G348: of:=IF([.G347] < [.$B$25];SUM([.F$3:.F348]);[.$B$25]) -> 222350062.5 | H348: of:=IF((ROW() - [.$B$21] < 3);0;FLOOR(IFERROR(OFFSET([.$F348];-1*[.$B$21];0 );0) * [.$B$10])) -> 0 | I348: of:=SUM(INDEX([.H$1:.H$736];MAX(ROW()+(-1*[.$B$22])+1;3);1):INDEX([.H$1:.H$736];ROW();1)) -> 0 | J348: of:=IF([.I348] > [.$B$20];[.I348]-[.$B$20];0) -> 0 | K348: of:=IF([.J348] > 0; ROUND([.$B$23] *MIN([.J348];[.H348])); 0) -> 0 | L348: of:=IF((ROW() - [.$B$13] < 3);0;FLOOR(IFERROR(OFFSET([.$F348];-1*[.$B$13];0 );0) * [.$B$14])) -> 0 | M348: of:=SUM([.L$3:.L348]) -> 6061951
D349: of:=[.D348]+1 -> 2020-12-31T00:00:00.000 | F349: of:=IF([.G348] < [.$B$25];CEILING([.G348]*[.$B$3];1);0) -> 0 | G349: of:=IF([.G348] < [.$B$25];SUM([.F$3:.F349]);[.$B$25]) -> 222350062.5 | H349: of:=IF((ROW() - [.$B$21] < 3);0;FLOOR(IFERROR(OFFSET([.$F349];-1*[.$B$21];0 );0) * [.$B$10])) -> 0 | I349: of:=SUM(INDEX([.H$1:.H$736];MAX(ROW()+(-1*[.$B$22])+1;3);1):INDEX([.H$1:.H$736];ROW();1)) -> 0 | J349: of:=IF([.I349] > [.$B$20];[.I349]-[.$B$20];0) -> 0 | K349: of:=IF([.J349] > 0; ROUND([.$B$23] *MIN([.J349];[.H349])); 0) -> 0 | L349: of:=IF((ROW() - [.$B$13] < 3);0;FLOOR(IFERROR(OFFSET([.$F349];-1*[.$B$13];0 );0) * [.$B$14])) -> 0 | M349: of:=SUM([.L$3:.L349]) -> 6061951
D350: of:=[.D349]+1 -> 2021-01-01T00:00:00.000 | F350: of:=IF([.G349] < [.$B$25];CEILING([.G349]*[.$B$3];1);0) -> 0 | G350: of:=IF([.G349] < [.$B$25];SUM([.F$3:.F350]);[.$B$25]) -> 222350062.5 | H350: of:=IF((ROW() - [.$B$21] < 3);0;FLOOR(IFERROR(OFFSET([.$F350];-1*[.$B$21];0 );0) * [.$B$10])) -> 0 | I350: of:=SUM(INDEX([.H$1:.H$736];MAX(ROW()+(-1*[.$B$22])+1;3);1):INDEX([.H$1:.H$736];ROW();1)) -> 0 | J350: of:=IF([.I350] > [.$B$20];[.I350]-[.$B$20];0) -> 0 | K350: of:=IF([.J350] > 0; ROUND([.$B$23] *MIN([.J350];[.H350])); 0) -> 0 | L350: of:=IF((ROW() - [.$B$13] < 3);0;FLOOR(IFERROR(OFFSET([.$F350];-1*[.$B$13];0 );0) * [.$B$14])) -> 0 | M350: of:=SUM([.L$3:.L350]) -> 6061951
D351: of:=[.D350]+1 -> 2021-01-02T00:00:00.000 | F351: of:=IF([.G350] < [.$B$25];CEILING([.G350]*[.$B$3];1);0) -> 0 | G351: of:=IF([.G350] < [.$B$25];SUM([.F$3:.F351]);[.$B$25]) -> 222350062.5 | H351: of:=IF((ROW() - [.$B$21] < 3);0;FLOOR(IFERROR(OFFSET([.$F351];-1*[.$B$21];0 );0) * [.$B$10])) -> 0 | I351: of:=SUM(INDEX([.H$1:.H$736];MAX(ROW()+(-1*[.$B$22])+1;3);1):INDEX([.H$1:.H$736];ROW();1)) -> 0 | J351: of:=IF([.I351] > [.$B$20];[.I351]-[.$B$20];0) -> 0 | K351: of:=IF([.J351] > 0; ROUND([.$B$23] *MIN([.J351];[.H351])); 0) -> 0 | L351: of:=IF((ROW() - [.$B$13] < 3);0;FLOOR(IFERROR(OFFSET([.$F351];-1*[.$B$13];0 );0) * [.$B$14])) -> 0 | M351: of:=SUM([.L$3:.L351]) -> 6061951
D352: of:=[.D351]+1 -> 2021-01-03T00:00:00.000 | F352: of:=IF([.G351] < [.$B$25];CEILING([.G351]*[.$B$3];1);0) -> 0 | G352: of:=IF([.G351] < [.$B$25];SUM([.F$3:.F352]);[.$B$25]) -> 222350062.5 | H352: of:=IF((ROW() - [.$B$21] < 3);0;FLOOR(IFERROR(OFFSET([.$F352];-1*[.$B$21];0 );0) * [.$B$10])) -> 0 | I352: of:=SUM(INDEX([.H$1:.H$736];MAX(ROW()+(-1*[.$B$22])+1;3);1):INDEX([.H$1:.H$736];ROW();1)) -> 0 | J352: of:=IF([.I352] > [.$B$20];[.I352]-[.$B$20];0) -> 0 | K352: of:=IF([.J352] > 0; ROUND([.$B$23] *MIN([.J352];[.H352])); 0) -> 0 | L352: of:=IF((ROW() - [.$B$13] < 3);0;FLOOR(IFERROR(OFFSET([.$F352];-1*[.$B$13];0 );0) * [.$B$14])) -> 0 | M352: of:=SUM([.L$3:.L352]) -> 6061951
D353: of:=[.D352]+1 -> 2021-01-04T00:00:00.000 | F353: of:=IF([.G352] < [.$B$25];CEILING([.G352]*[.$B$3];1);0) -> 0 | G353: of:=IF([.G352] < [.$B$25];SUM([.F$3:.F353]);[.$B$25]) -> 222350062.5 | H353: of:=IF((ROW() - [.$B$21] < 3);0;FLOOR(IFERROR(OFFSET([.$F353];-1*[.$B$21];0 );0) * [.$B$10])) -> 0 | I353: of:=SUM(INDEX([.H$1:.H$736];MAX(ROW()+(-1*[.$B$22])+1;3);1):INDEX([.H$1:.H$736];ROW();1)) -> 0 | J353: of:=IF([.I353] > [.$B$20];[.I353]-[.$B$20];0) -> 0 | K353: of:=IF([.J353] > 0; ROUND([.$B$23] *MIN([.J353];[.H353])); 0) -> 0 | L353: of:=IF((ROW() - [.$B$13] < 3);0;FLOOR(IFERROR(OFFSET([.$F353];-1*[.$B$13];0 );0) * [.$B$14])) -> 0 | M353: of:=SUM([.L$3:.L353]) -> 6061951
D354: of:=[.D353]+1 -> 2021-01-05T00:00:00.000 | F354: of:=IF([.G353] < [.$B$25];CEILING([.G353]*[.$B$3];1);0) -> 0 | G354: of:=IF([.G353] < [.$B$25];SUM([.F$3:.F354]);[.$B$25]) -> 222350062.5 | H354: of:=IF((ROW() - [.$B$21] < 3);0;FLOOR(IFERROR(OFFSET([.$F354];-1*[.$B$21];0 );0) * [.$B$10])) -> 0 | I354: of:=SUM(INDEX([.H$1:.H$736];MAX(ROW()+(-1*[.$B$22])+1;3);1):INDEX([.H$1:.H$736];ROW();1)) -> 0 | J354: of:=IF([.I354] > [.$B$20];[.I354]-[.$B$20];0) -> 0 | K354: of:=IF([.J354] > 0; ROUND([.$B$23] *MIN([.J354];[.H354])); 0) -> 0 | L354: of:=IF((ROW() - [.$B$13] < 3);0;FLOOR(IFERROR(OFFSET([.$F354];-1*[.$B$13];0 );0) * [.$B$14])) -> 0 | M354: of:=SUM([.L$3:.L354]) -> 6061951
D355: of:=[.D354]+1 -> 2021-01-06T00:00:00.000 | F355: of:=IF([.G354] < [.$B$25];CEILING([.G354]*[.$B$3];1);0) -> 0 | G355: of:=IF([.G354] < [.$B$25];SUM([.F$3:.F355]);[.$B$25]) -> 222350062.5 | H355: of:=IF((ROW() - [.$B$21] < 3);0;FLOOR(IFERROR(OFFSET([.$F355];-1*[.$B$21];0 );0) * [.$B$10])) -> 0 | I355: of:=SUM(INDEX([.H$1:.H$736];MAX(ROW()+(-1*[.$B$22])+1;3);1):INDEX([.H$1:.H$736];ROW();1)) -> 0 | J355: of:=IF([.I355] > [.$B$20];[.I355]-[.$B$20];0) -> 0 | K355: of:=IF([.J355] > 0; ROUND([.$B$23] *MIN([.J355];[.H355])); 0) -> 0 | L355: of:=IF((ROW() - [.$B$13] < 3);0;FLOOR(IFERROR(OFFSET([.$F355];-1*[.$B$13];0 );0) * [.$B$14])) -> 0 | M355: of:=SUM([.L$3:.L355]) -> 6061951
D356: of:=[.D355]+1 -> 2021-01-07T00:00:00.000 | F356: of:=IF([.G355] < [.$B$25];CEILING([.G355]*[.$B$3];1);0) -> 0 | G356: of:=IF([.G355] < [.$B$25];SUM([.F$3:.F356]);[.$B$25]) -> 222350062.5 | H356: of:=IF((ROW() - [.$B$21] < 3);0;FLOOR(IFERROR(OFFSET([.$F356];-1*[.$B$21];0 );0) * [.$B$10])) -> 0 | I356: of:=SUM(INDEX([.H$1:.H$736];MAX(ROW()+(-1*[.$B$22])+1;3);1):INDEX([.H$1:.H$736];ROW();1)) -> 0 | J356: of:=IF([.I356] > [.$B$20];[.I356]-[.$B$20];0) -> 0 | K356: of:=IF([.J356] > 0; ROUND([.$B$23] *MIN([.J356];[.H356])); 0) -> 0 | L356: of:=IF((ROW() - [.$B$13] < 3);0;FLOOR(IFERROR(OFFSET([.$F356];-1*[.$B$13];0 );0) * [.$B$14])) -> 0 | M356: of:=SUM([.L$3:.L356]) -> 6061951
D357: of:=[.D356]+1 -> 2021-01-08T00:00:00.000 | F357: of:=IF([.G356] < [.$B$25];CEILING([.G356]*[.$B$3];1);0) -> 0 | G357: of:=IF([.G356] < [.$B$25];SUM([.F$3:.F357]);[.$B$25]) -> 222350062.5 | H357: of:=IF((ROW() - [.$B$21] < 3);0;FLOOR(IFERROR(OFFSET([.$F357];-1*[.$B$21];0 );0) * [.$B$10])) -> 0 | I357: of:=SUM(INDEX([.H$1:.H$736];MAX(ROW()+(-1*[.$B$22])+1;3);1):INDEX([.H$1:.H$736];ROW();1)) -> 0 | J357: of:=IF([.I357] > [.$B$20];[.I357]-[.$B$20];0) -> 0 | K357: of:=IF([.J357] > 0; ROUND([.$B$23] *MIN([.J357];[.H357])); 0) -> 0 | L357: of:=IF((ROW() - [.$B$13] < 3);0;FLOOR(IFERROR(OFFSET([.$F357];-1*[.$B$13];0 );0) * [.$B$14])) -> 0 | M357: of:=SUM([.L$3:.L357]) -> 6061951
D358: of:=[.D357]+1 -> 2021-01-09T00:00:00.000 | F358: of:=IF([.G357] < [.$B$25];CEILING([.G357]*[.$B$3];1);0) -> 0 | G358: of:=IF([.G357] < [.$B$25];SUM([.F$3:.F358]);[.$B$25]) -> 222350062.5 | H358: of:=IF((ROW() - [.$B$21] < 3);0;FLOOR(IFERROR(OFFSET([.$F358];-1*[.$B$21];0 );0) * [.$B$10])) -> 0 | I358: of:=SUM(INDEX([.H$1:.H$736];MAX(ROW()+(-1*[.$B$22])+1;3);1):INDEX([.H$1:.H$736];ROW();1)) -> 0 | J358: of:=IF([.I358] > [.$B$20];[.I358]-[.$B$20];0) -> 0 | K358: of:=IF([.J358] > 0; ROUND([.$B$23] *MIN([.J358];[.H358])); 0) -> 0 | L358: of:=IF((ROW() - [.$B$13] < 3);0;FLOOR(IFERROR(OFFSET([.$F358];-1*[.$B$13];0 );0) * [.$B$14])) -> 0 | M358: of:=SUM([.L$3:.L358]) -> 6061951
D359: of:=[.D358]+1 -> 2021-01-10T00:00:00.000 | F359: of:=IF([.G358] < [.$B$25];CEILING([.G358]*[.$B$3];1);0) -> 0 | G359: of:=IF([.G358] < [.$B$25];SUM([.F$3:.F359]);[.$B$25]) -> 222350062.5 | H359: of:=IF((ROW() - [.$B$21] < 3);0;FLOOR(IFERROR(OFFSET([.$F359];-1*[.$B$21];0 );0) * [.$B$10])) -> 0 | I359: of:=SUM(INDEX([.H$1:.H$736];MAX(ROW()+(-1*[.$B$22])+1;3);1):INDEX([.H$1:.H$736];ROW();1)) -> 0 | J359: of:=IF([.I359] > [.$B$20];[.I359]-[.$B$20];0) -> 0 | K359: of:=IF([.J359] > 0; ROUND([.$B$23] *MIN([.J359];[.H359])); 0) -> 0 | L359: of:=IF((ROW() - [.$B$13] < 3);0;FLOOR(IFERROR(OFFSET([.$F359];-1*[.$B$13];0 );0) * [.$B$14])) -> 0 | M359: of:=SUM([.L$3:.L359]) -> 6061951
D360: of:=[.D359]+1 -> 2021-01-11T00:00:00.000 | F360: of:=IF([.G359] < [.$B$25];CEILING([.G359]*[.$B$3];1);0) -> 0 | G360: of:=IF([.G359] < [.$B$25];SUM([.F$3:.F360]);[.$B$25]) -> 222350062.5 | H360: of:=IF((ROW() - [.$B$21] < 3);0;FLOOR(IFERROR(OFFSET([.$F360];-1*[.$B$21];0 );0) * [.$B$10])) -> 0 | I360: of:=SUM(INDEX([.H$1:.H$736];MAX(ROW()+(-1*[.$B$22])+1;3);1):INDEX([.H$1:.H$736];ROW();1)) -> 0 | J360: of:=IF([.I360] > [.$B$20];[.I360]-[.$B$20];0) -> 0 | K360: of:=IF([.J360] > 0; ROUND([.$B$23] *MIN([.J360];[.H360])); 0) -> 0 | L360: of:=IF((ROW() - [.$B$13] < 3);0;FLOOR(IFERROR(OFFSET([.$F360];-1*[.$B$13];0 );0) * [.$B$14])) -> 0 | M360: of:=SUM([.L$3:.L360]) -> 6061951
D361: of:=[.D360]+1 -> 2021-01-12T00:00:00.000 | F361: of:=IF([.G360] < [.$B$25];CEILING([.G360]*[.$B$3];1);0) -> 0 | G361: of:=IF([.G360] < [.$B$25];SUM([.F$3:.F361]);[.$B$25]) -> 222350062.5 | H361: of:=IF((ROW() - [.$B$21] < 3);0;FLOOR(IFERROR(OFFSET([.$F361];-1*[.$B$21];0 );0) * [.$B$10])) -> 0 | I361: of:=SUM(INDEX([.H$1:.H$736];MAX(ROW()+(-1*[.$B$22])+1;3);1):INDEX([.H$1:.H$736];ROW();1)) -> 0 | J361: of:=IF([.I361] > [.$B$20];[.I361]-[.$B$20];0) -> 0 | K361: of:=IF([.J361] > 0; ROUND([.$B$23] *MIN([.J361];[.H361])); 0) -> 0 | L361: of:=IF((ROW() - [.$B$13] < 3);0;FLOOR(IFERROR(OFFSET([.$F361];-1*[.$B$13];0 );0) * [.$B$14])) -> 0 | M361: of:=SUM([.L$3:.L361]) -> 6061951
D362: of:=[.D361]+1 -> 2021-01-13T00:00:00.000 | F362: of:=IF([.G361] < [.$B$25];CEILING([.G361]*[.$B$3];1);0) -> 0 | G362: of:=IF([.G361] < [.$B$25];SUM([.F$3:.F362]);[.$B$25]) -> 222350062.5 | H362: of:=IF((ROW() - [.$B$21] < 3);0;FLOOR(IFERROR(OFFSET([.$F362];-1*[.$B$21];0 );0) * [.$B$10])) -> 0 | I362: of:=SUM(INDEX([.H$1:.H$736];MAX(ROW()+(-1*[.$B$22])+1;3);1):INDEX([.H$1:.H$736];ROW();1)) -> 0 | J362: of:=IF([.I362] > [.$B$20];[.I362]-[.$B$20];0) -> 0 | K362: of:=IF([.J362] > 0; ROUND([.$B$23] *MIN([.J362];[.H362])); 0) -> 0 | L362: of:=IF((ROW() - [.$B$13] < 3);0;FLOOR(IFERROR(OFFSET([.$F362];-1*[.$B$13];0 );0) * [.$B$14])) -> 0 | M362: of:=SUM([.L$3:.L362]) -> 6061951
D363: of:=[.D362]+1 -> 2021-01-14T00:00:00.000 | F363: of:=IF([.G362] < [.$B$25];CEILING([.G362]*[.$B$3];1);0) -> 0 | G363: of:=IF([.G362] < [.$B$25];SUM([.F$3:.F363]);[.$B$25]) -> 222350062.5 | H363: of:=IF((ROW() - [.$B$21] < 3);0;FLOOR(IFERROR(OFFSET([.$F363];-1*[.$B$21];0 );0) * [.$B$10])) -> 0 | I363: of:=SUM(INDEX([.H$1:.H$736];MAX(ROW()+(-1*[.$B$22])+1;3);1):INDEX([.H$1:.H$736];ROW();1)) -> 0 | J363: of:=IF([.I363] > [.$B$20];[.I363]-[.$B$20];0) -> 0 | K363: of:=IF([.J363] > 0; ROUND([.$B$23] *MIN([.J363];[.H363])); 0) -> 0 | L363: of:=IF((ROW() - [.$B$13] < 3);0;FLOOR(IFERROR(OFFSET([.$F363];-1*[.$B$13];0 );0) * [.$B$14])) -> 0 | M363: of:=SUM([.L$3:.L363]) -> 6061951
D364: of:=[.D363]+1 -> 2021-01-15T00:00:00.000 | F364: of:=IF([.G363] < [.$B$25];CEILING([.G363]*[.$B$3];1);0) -> 0 | G364: of:=IF([.G363] < [.$B$25];SUM([.F$3:.F364]);[.$B$25]) -> 222350062.5 | H364: of:=IF((ROW() - [.$B$21] < 3);0;FLOOR(IFERROR(OFFSET([.$F364];-1*[.$B$21];0 );0) * [.$B$10])) -> 0 | I364: of:=SUM(INDEX([.H$1:.H$736];MAX(ROW()+(-1*[.$B$22])+1;3);1):INDEX([.H$1:.H$736];ROW();1)) -> 0 | J364: of:=IF([.I364] > [.$B$20];[.I364]-[.$B$20];0) -> 0 | K364: of:=IF([.J364] > 0; ROUND([.$B$23] *MIN([.J364];[.H364])); 0) -> 0 | L364: of:=IF((ROW() - [.$B$13] < 3);0;FLOOR(IFERROR(OFFSET([.$F364];-1*[.$B$13];0 );0) * [.$B$14])) -> 0 | M364: of:=SUM([.L$3:.L364]) -> 6061951
D365: of:=[.D364]+1 -> 2021-01-16T00:00:00.000 | F365: of:=IF([.G364] < [.$B$25];CEILING([.G364]*[.$B$3];1);0) -> 0 | G365: of:=IF([.G364] < [.$B$25];SUM([.F$3:.F365]);[.$B$25]) -> 222350062.5 | H365: of:=IF((ROW() - [.$B$21] < 3);0;FLOOR(IFERROR(OFFSET([.$F365];-1*[.$B$21];0 );0) * [.$B$10])) -> 0 | I365: of:=SUM(INDEX([.H$1:.H$736];MAX(ROW()+(-1*[.$B$22])+1;3);1):INDEX([.H$1:.H$736];ROW();1)) -> 0 | J365: of:=IF([.I365] > [.$B$20];[.I365]-[.$B$20];0) -> 0 | K365: of:=IF([.J365] > 0; ROUND([.$B$23] *MIN([.J365];[.H365])); 0) -> 0 | L365: of:=IF((ROW() - [.$B$13] < 3);0;FLOOR(IFERROR(OFFSET([.$F365];-1*[.$B$13];0 );0) * [.$B$14])) -> 0 | M365: of:=SUM([.L$3:.L365]) -> 6061951
D366: of:=[.D365]+1 -> 2021-01-17T00:00:00.000 | F366: of:=IF([.G365] < [.$B$25];CEILING([.G365]*[.$B$3];1);0) -> 0 | G366: of:=IF([.G365] < [.$B$25];SUM([.F$3:.F366]);[.$B$25]) -> 222350062.5 | H366: of:=IF((ROW() - [.$B$21] < 3);0;FLOOR(IFERROR(OFFSET([.$F366];-1*[.$B$21];0 );0) * [.$B$10])) -> 0 | I366: of:=SUM(INDEX([.H$1:.H$736];MAX(ROW()+(-1*[.$B$22])+1;3);1):INDEX([.H$1:.H$736];ROW();1)) -> 0 | J366: of:=IF([.I366] > [.$B$20];[.I366]-[.$B$20];0) -> 0 | K366: of:=IF([.J366] > 0; ROUND([.$B$23] *MIN([.J366];[.H366])); 0) -> 0 | L366: of:=IF((ROW() - [.$B$13] < 3);0;FLOOR(IFERROR(OFFSET([.$F366];-1*[.$B$13];0 );0) * [.$B$14])) -> 0 | M366: of:=SUM([.L$3:.L366]) -> 6061951
D367: of:=[.D366]+1 -> 2021-01-18T00:00:00.000 | F367: of:=IF([.G366] < [.$B$25];CEILING([.G366]*[.$B$3];1);0) -> 0 | G367: of:=IF([.G366] < [.$B$25];SUM([.F$3:.F367]);[.$B$25]) -> 222350062.5 | H367: of:=IF((ROW() - [.$B$21] < 3);0;FLOOR(IFERROR(OFFSET([.$F367];-1*[.$B$21];0 );0) * [.$B$10])) -> 0 | I367: of:=SUM(INDEX([.H$1:.H$736];MAX(ROW()+(-1*[.$B$22])+1;3);1):INDEX([.H$1:.H$736];ROW();1)) -> 0 | J367: of:=IF([.I367] > [.$B$20];[.I367]-[.$B$20];0) -> 0 | K367: of:=IF([.J367] > 0; ROUND([.$B$23] *MIN([.J367];[.H367])); 0) -> 0 | L367: of:=IF((ROW() - [.$B$13] < 3);0;FLOOR(IFERROR(OFFSET([.$F367];-1*[.$B$13];0 );0) * [.$B$14])) -> 0 | M367: of:=SUM([.L$3:.L367]) -> 6061951
D368: of:=[.D367]+1 -> 2021-01-19T00:00:00.000 | F368: of:=IF([.G367] < [.$B$25];CEILING([.G367]*[.$B$3];1);0) -> 0 | G368: of:=IF([.G367] < [.$B$25];SUM([.F$3:.F368]);[.$B$25]) -> 222350062.5 | H368: of:=IF((ROW() - [.$B$21] < 3);0;FLOOR(IFERROR(OFFSET([.$F368];-1*[.$B$21];0 );0) * [.$B$10])) -> 0 | I368: of:=SUM(INDEX([.H$1:.H$736];MAX(ROW()+(-1*[.$B$22])+1;3);1):INDEX([.H$1:.H$736];ROW();1)) -> 0 | J368: of:=IF([.I368] > [.$B$20];[.I368]-[.$B$20];0) -> 0 | K368: of:=IF([.J368] > 0; ROUND([.$B$23] *MIN([.J368];[.H368])); 0) -> 0 | L368: of:=IF((ROW() - [.$B$13] < 3);0;FLOOR(IFERROR(OFFSET([.$F368];-1*[.$B$13];0 );0) * [.$B$14])) -> 0 | M368: of:=SUM([.L$3:.L368]) -> 6061951
D369: of:=[.D368]+1 -> 2021-01-20T00:00:00.000 | F369: of:=IF([.G368] < [.$B$25];CEILING([.G368]*[.$B$3];1);0) -> 0 | G369: of:=IF([.G368] < [.$B$25];SUM([.F$3:.F369]);[.$B$25]) -> 222350062.5 | H369: of:=IF((ROW() - [.$B$21] < 3);0;FLOOR(IFERROR(OFFSET([.$F369];-1*[.$B$21];0 );0) * [.$B$10])) -> 0 | I369: of:=SUM(INDEX([.H$1:.H$736];MAX(ROW()+(-1*[.$B$22])+1;3);1):INDEX([.H$1:.H$736];ROW();1)) -> 0 | J369: of:=IF([.I369] > [.$B$20];[.I369]-[.$B$20];0) -> 0 | K369: of:=IF([.J369] > 0; ROUND([.$B$23] *MIN([.J369];[.H369])); 0) -> 0 | L369: of:=IF((ROW() - [.$B$13] < 3);0;FLOOR(IFERROR(OFFSET([.$F369];-1*[.$B$13];0 );0) * [.$B$14])) -> 0 | M369: of:=SUM([.L$3:.L369]) -> 6061951
D370: of:=[.D369]+1 -> 2021-01-21T00:00:00.000 | F370: of:=IF([.G369] < [.$B$25];CEILING([.G369]*[.$B$3];1);0) -> 0 | G370: of:=IF([.G369] < [.$B$25];SUM([.F$3:.F370]);[.$B$25]) -> 222350062.5 | H370: of:=IF((ROW() - [.$B$21] < 3);0;FLOOR(IFERROR(OFFSET([.$F370];-1*[.$B$21];0 );0) * [.$B$10])) -> 0 | I370: of:=SUM(INDEX([.H$1:.H$736];MAX(ROW()+(-1*[.$B$22])+1;3);1):INDEX([.H$1:.H$736];ROW();1)) -> 0 | J370: of:=IF([.I370] > [.$B$20];[.I370]-[.$B$20];0) -> 0 | K370: of:=IF([.J370] > 0; ROUND([.$B$23] *MIN([.J370];[.H370])); 0) -> 0 | L370: of:=IF((ROW() - [.$B$13] < 3);0;FLOOR(IFERROR(OFFSET([.$F370];-1*[.$B$13];0 );0) * [.$B$14])) -> 0 | M370: of:=SUM([.L$3:.L370]) -> 6061951
D371: of:=[.D370]+1 -> 2021-01-22T00:00:00.000 | F371: of:=IF([.G370] < [.$B$25];CEILING([.G370]*[.$B$3];1);0) -> 0 | G371: of:=IF([.G370] < [.$B$25];SUM([.F$3:.F371]);[.$B$25]) -> 222350062.5 | H371: of:=IF((ROW() - [.$B$21] < 3);0;FLOOR(IFERROR(OFFSET([.$F371];-1*[.$B$21];0 );0) * [.$B$10])) -> 0 | I371: of:=SUM(INDEX([.H$1:.H$736];MAX(ROW()+(-1*[.$B$22])+1;3);1):INDEX([.H$1:.H$736];ROW();1)) -> 0 | J371: of:=IF([.I371] > [.$B$20];[.I371]-[.$B$20];0) -> 0 | K371: of:=IF([.J371] > 0; ROUND([.$B$23] *MIN([.J371];[.H371])); 0) -> 0 | L371: of:=IF((ROW() - [.$B$13] < 3);0;FLOOR(IFERROR(OFFSET([.$F371];-1*[.$B$13];0 );0) * [.$B$14])) -> 0 | M371: of:=SUM([.L$3:.L371]) -> 6061951
D372: of:=[.D371]+1 -> 2021-01-23T00:00:00.000 | F372: of:=IF([.G371] < [.$B$25];CEILING([.G371]*[.$B$3];1);0) -> 0 | G372: of:=IF([.G371] < [.$B$25];SUM([.F$3:.F372]);[.$B$25]) -> 222350062.5 | H372: of:=IF((ROW() - [.$B$21] < 3);0;FLOOR(IFERROR(OFFSET([.$F372];-1*[.$B$21];0 );0) * [.$B$10])) -> 0 | I372: of:=SUM(INDEX([.H$1:.H$736];MAX(ROW()+(-1*[.$B$22])+1;3);1):INDEX([.H$1:.H$736];ROW();1)) -> 0 | J372: of:=IF([.I372] > [.$B$20];[.I372]-[.$B$20];0) -> 0 | K372: of:=IF([.J372] > 0; ROUND([.$B$23] *MIN([.J372];[.H372])); 0) -> 0 | L372: of:=IF((ROW() - [.$B$13] < 3);0;FLOOR(IFERROR(OFFSET([.$F372];-1*[.$B$13];0 );0) * [.$B$14])) -> 0 | M372: of:=SUM([.L$3:.L372]) -> 6061951
D373: of:=[.D372]+1 -> 2021-01-24T00:00:00.000 | F373: of:=IF([.G372] < [.$B$25];CEILING([.G372]*[.$B$3];1);0) -> 0 | G373: of:=IF([.G372] < [.$B$25];SUM([.F$3:.F373]);[.$B$25]) -> 222350062.5 | H373: of:=IF((ROW() - [.$B$21] < 3);0;FLOOR(IFERROR(OFFSET([.$F373];-1*[.$B$21];0 );0) * [.$B$10])) -> 0 | I373: of:=SUM(INDEX([.H$1:.H$736];MAX(ROW()+(-1*[.$B$22])+1;3);1):INDEX([.H$1:.H$736];ROW();1)) -> 0 | J373: of:=IF([.I373] > [.$B$20];[.I373]-[.$B$20];0) -> 0 | K373: of:=IF([.J373] > 0; ROUND([.$B$23] *MIN([.J373];[.H373])); 0) -> 0 | L373: of:=IF((ROW() - [.$B$13] < 3);0;FLOOR(IFERROR(OFFSET([.$F373];-1*[.$B$13];0 );0) * [.$B$14])) -> 0 | M373: of:=SUM([.L$3:.L373]) -> 6061951
D374: of:=[.D373]+1 -> 2021-01-25T00:00:00.000 | F374: of:=IF([.G373] < [.$B$25];CEILING([.G373]*[.$B$3];1);0) -> 0 | G374: of:=IF([.G373] < [.$B$25];SUM([.F$3:.F374]);[.$B$25]) -> 222350062.5 | H374: of:=IF((ROW() - [.$B$21] < 3);0;FLOOR(IFERROR(OFFSET([.$F374];-1*[.$B$21];0 );0) * [.$B$10])) -> 0 | I374: of:=SUM(INDEX([.H$1:.H$736];MAX(ROW()+(-1*[.$B$22])+1;3);1):INDEX([.H$1:.H$736];ROW();1)) -> 0 | J374: of:=IF([.I374] > [.$B$20];[.I374]-[.$B$20];0) -> 0 | K374: of:=IF([.J374] > 0; ROUND([.$B$23] *MIN([.J374];[.H374])); 0) -> 0 | L374: of:=IF((ROW() - [.$B$13] < 3);0;FLOOR(IFERROR(OFFSET([.$F374];-1*[.$B$13];0 );0) * [.$B$14])) -> 0 | M374: of:=SUM([.L$3:.L374]) -> 6061951
D375: of:=[.D374]+1 -> 2021-01-26T00:00:00.000 | F375: of:=IF([.G374] < [.$B$25];CEILING([.G374]*[.$B$3];1);0) -> 0 | G375: of:=IF([.G374] < [.$B$25];SUM([.F$3:.F375]);[.$B$25]) -> 222350062.5 | H375: of:=IF((ROW() - [.$B$21] < 3);0;FLOOR(IFERROR(OFFSET([.$F375];-1*[.$B$21];0 );0) * [.$B$10])) -> 0 | I375: of:=SUM(INDEX([.H$1:.H$736];MAX(ROW()+(-1*[.$B$22])+1;3);1):INDEX([.H$1:.H$736];ROW();1)) -> 0 | J375: of:=IF([.I375] > [.$B$20];[.I375]-[.$B$20];0) -> 0 | K375: of:=IF([.J375] > 0; ROUND([.$B$23] *MIN([.J375];[.H375])); 0) -> 0 | L375: of:=IF((ROW() - [.$B$13] < 3);0;FLOOR(IFERROR(OFFSET([.$F375];-1*[.$B$13];0 );0) * [.$B$14])) -> 0 | M375: of:=SUM([.L$3:.L375]) -> 6061951
D376: of:=[.D375]+1 -> 2021-01-27T00:00:00.000 | F376: of:=IF([.G375] < [.$B$25];CEILING([.G375]*[.$B$3];1);0) -> 0 | G376: of:=IF([.G375] < [.$B$25];SUM([.F$3:.F376]);[.$B$25]) -> 222350062.5 | H376: of:=IF((ROW() - [.$B$21] < 3);0;FLOOR(IFERROR(OFFSET([.$F376];-1*[.$B$21];0 );0) * [.$B$10])) -> 0 | I376: of:=SUM(INDEX([.H$1:.H$736];MAX(ROW()+(-1*[.$B$22])+1;3);1):INDEX([.H$1:.H$736];ROW();1)) -> 0 | J376: of:=IF([.I376] > [.$B$20];[.I376]-[.$B$20];0) -> 0 | K376: of:=IF([.J376] > 0; ROUND([.$B$23] *MIN([.J376];[.H376])); 0) -> 0 | L376: of:=IF((ROW() - [.$B$13] < 3);0;FLOOR(IFERROR(OFFSET([.$F376];-1*[.$B$13];0 );0) * [.$B$14])) -> 0 | M376: of:=SUM([.L$3:.L376]) -> 6061951
D377: of:=[.D376]+1 -> 2021-01-28T00:00:00.000 | F377: of:=IF([.G376] < [.$B$25];CEILING([.G376]*[.$B$3];1);0) -> 0 | G377: of:=IF([.G376] < [.$B$25];SUM([.F$3:.F377]);[.$B$25]) -> 222350062.5 | H377: of:=IF((ROW() - [.$B$21] < 3);0;FLOOR(IFERROR(OFFSET([.$F377];-1*[.$B$21];0 );0) * [.$B$10])) -> 0 | I377: of:=SUM(INDEX([.H$1:.H$736];MAX(ROW()+(-1*[.$B$22])+1;3);1):INDEX([.H$1:.H$736];ROW();1)) -> 0 | J377: of:=IF([.I377] > [.$B$20];[.I377]-[.$B$20];0) -> 0 | K377: of:=IF([.J377] > 0; ROUND([.$B$23] *MIN([.J377];[.H377])); 0) -> 0 | L377: of:=IF((ROW() - [.$B$13] < 3);0;FLOOR(IFERROR(OFFSET([.$F377];-1*[.$B$13];0 );0) * [.$B$14])) -> 0 | M377: of:=SUM([.L$3:.L377]) -> 6061951
D378: of:=[.D377]+1 -> 2021-01-29T00:00:00.000 | F378: of:=IF([.G377] < [.$B$25];CEILING([.G377]*[.$B$3];1);0) -> 0 | G378: of:=IF([.G377] < [.$B$25];SUM([.F$3:.F378]);[.$B$25]) -> 222350062.5 | H378: of:=IF((ROW() - [.$B$21] < 3);0;FLOOR(IFERROR(OFFSET([.$F378];-1*[.$B$21];0 );0) * [.$B$10])) -> 0 | I378: of:=SUM(INDEX([.H$1:.H$736];MAX(ROW()+(-1*[.$B$22])+1;3);1):INDEX([.H$1:.H$736];ROW();1)) -> 0 | J378: of:=IF([.I378] > [.$B$20];[.I378]-[.$B$20];0) -> 0 | K378: of:=IF([.J378] > 0; ROUND([.$B$23] *MIN([.J378];[.H378])); 0) -> 0 | L378: of:=IF((ROW() - [.$B$13] < 3);0;FLOOR(IFERROR(OFFSET([.$F378];-1*[.$B$13];0 );0) * [.$B$14])) -> 0 | M378: of:=SUM([.L$3:.L378]) -> 6061951
D379: of:=[.D378]+1 -> 2021-01-30T00:00:00.000 | F379: of:=IF([.G378] < [.$B$25];CEILING([.G378]*[.$B$3];1);0) -> 0 | G379: of:=IF([.G378] < [.$B$25];SUM([.F$3:.F379]);[.$B$25]) -> 222350062.5 | H379: of:=IF((ROW() - [.$B$21] < 3);0;FLOOR(IFERROR(OFFSET([.$F379];-1*[.$B$21];0 );0) * [.$B$10])) -> 0 | I379: of:=SUM(INDEX([.H$1:.H$736];MAX(ROW()+(-1*[.$B$22])+1;3);1):INDEX([.H$1:.H$736];ROW();1)) -> 0 | J379: of:=IF([.I379] > [.$B$20];[.I379]-[.$B$20];0) -> 0 | K379: of:=IF([.J379] > 0; ROUND([.$B$23] *MIN([.J379];[.H379])); 0) -> 0 | L379: of:=IF((ROW() - [.$B$13] < 3);0;FLOOR(IFERROR(OFFSET([.$F379];-1*[.$B$13];0 );0) * [.$B$14])) -> 0 | M379: of:=SUM([.L$3:.L379]) -> 6061951
D380: of:=[.D379]+1 -> 2021-01-31T00:00:00.000 | F380: of:=IF([.G379] < [.$B$25];CEILING([.G379]*[.$B$3];1);0) -> 0 | G380: of:=IF([.G379] < [.$B$25];SUM([.F$3:.F380]);[.$B$25]) -> 222350062.5 | H380: of:=IF((ROW() - [.$B$21] < 3);0;FLOOR(IFERROR(OFFSET([.$F380];-1*[.$B$21];0 );0) * [.$B$10])) -> 0 | I380: of:=SUM(INDEX([.H$1:.H$736];MAX(ROW()+(-1*[.$B$22])+1;3);1):INDEX([.H$1:.H$736];ROW();1)) -> 0 | J380: of:=IF([.I380] > [.$B$20];[.I380]-[.$B$20];0) -> 0 | K380: of:=IF([.J380] > 0; ROUND([.$B$23] *MIN([.J380];[.H380])); 0) -> 0 | L380: of:=IF((ROW() - [.$B$13] < 3);0;FLOOR(IFERROR(OFFSET([.$F380];-1*[.$B$13];0 );0) * [.$B$14])) -> 0 | M380: of:=SUM([.L$3:.L380]) -> 6061951
D381: of:=[.D380]+1 -> 2021-02-01T00:00:00.000 | F381: of:=IF([.G380] < [.$B$25];CEILING([.G380]*[.$B$3];1);0) -> 0 | G381: of:=IF([.G380] < [.$B$25];SUM([.F$3:.F381]);[.$B$25]) -> 222350062.5 | H381: of:=IF((ROW() - [.$B$21] < 3);0;FLOOR(IFERROR(OFFSET([.$F381];-1*[.$B$21];0 );0) * [.$B$10])) -> 0 | I381: of:=SUM(INDEX([.H$1:.H$736];MAX(ROW()+(-1*[.$B$22])+1;3);1):INDEX([.H$1:.H$736];ROW();1)) -> 0 | J381: of:=IF([.I381] > [.$B$20];[.I381]-[.$B$20];0) -> 0 | K381: of:=IF([.J381] > 0; ROUND([.$B$23] *MIN([.J381];[.H381])); 0) -> 0 | L381: of:=IF((ROW() - [.$B$13] < 3);0;FLOOR(IFERROR(OFFSET([.$F381];-1*[.$B$13];0 );0) * [.$B$14])) -> 0 | M381: of:=SUM([.L$3:.L381]) -> 6061951
D382: of:=[.D381]+1 -> 2021-02-02T00:00:00.000 | F382: of:=IF([.G381] < [.$B$25];CEILING([.G381]*[.$B$3];1);0) -> 0 | G382: of:=IF([.G381] < [.$B$25];SUM([.F$3:.F382]);[.$B$25]) -> 222350062.5 | H382: of:=IF((ROW() - [.$B$21] < 3);0;FLOOR(IFERROR(OFFSET([.$F382];-1*[.$B$21];0 );0) * [.$B$10])) -> 0 | I382: of:=SUM(INDEX([.H$1:.H$736];MAX(ROW()+(-1*[.$B$22])+1;3);1):INDEX([.H$1:.H$736];ROW();1)) -> 0 | J382: of:=IF([.I382] > [.$B$20];[.I382]-[.$B$20];0) -> 0 | K382: of:=IF([.J382] > 0; ROUND([.$B$23] *MIN([.J382];[.H382])); 0) -> 0 | L382: of:=IF((ROW() - [.$B$13] < 3);0;FLOOR(IFERROR(OFFSET([.$F382];-1*[.$B$13];0 );0) * [.$B$14])) -> 0 | M382: of:=SUM([.L$3:.L382]) -> 6061951
D383: of:=[.D382]+1 -> 2021-02-03T00:00:00.000 | F383: of:=IF([.G382] < [.$B$25];CEILING([.G382]*[.$B$3];1);0) -> 0 | G383: of:=IF([.G382] < [.$B$25];SUM([.F$3:.F383]);[.$B$25]) -> 222350062.5 | H383: of:=IF((ROW() - [.$B$21] < 3);0;FLOOR(IFERROR(OFFSET([.$F383];-1*[.$B$21];0 );0) * [.$B$10])) -> 0 | I383: of:=SUM(INDEX([.H$1:.H$736];MAX(ROW()+(-1*[.$B$22])+1;3);1):INDEX([.H$1:.H$736];ROW();1)) -> 0 | J383: of:=IF([.I383] > [.$B$20];[.I383]-[.$B$20];0) -> 0 | K383: of:=IF([.J383] > 0; ROUND([.$B$23] *MIN([.J383];[.H383])); 0) -> 0 | L383: of:=IF((ROW() - [.$B$13] < 3);0;FLOOR(IFERROR(OFFSET([.$F383];-1*[.$B$13];0 );0) * [.$B$14])) -> 0 | M383: of:=SUM([.L$3:.L383]) -> 6061951
D384: of:=[.D383]+1 -> 2021-02-04T00:00:00.000 | F384: of:=IF([.G383] < [.$B$25];CEILING([.G383]*[.$B$3];1);0) -> 0 | G384: of:=IF([.G383] < [.$B$25];SUM([.F$3:.F384]);[.$B$25]) -> 222350062.5 | H384: of:=IF((ROW() - [.$B$21] < 3);0;FLOOR(IFERROR(OFFSET([.$F384];-1*[.$B$21];0 );0) * [.$B$10])) -> 0 | I384: of:=SUM(INDEX([.H$1:.H$736];MAX(ROW()+(-1*[.$B$22])+1;3);1):INDEX([.H$1:.H$736];ROW();1)) -> 0 | J384: of:=IF([.I384] > [.$B$20];[.I384]-[.$B$20];0) -> 0 | K384: of:=IF([.J384] > 0; ROUND([.$B$23] *MIN([.J384];[.H384])); 0) -> 0 | L384: of:=IF((ROW() - [.$B$13] < 3);0;FLOOR(IFERROR(OFFSET([.$F384];-1*[.$B$13];0 );0) * [.$B$14])) -> 0 | M384: of:=SUM([.L$3:.L384]) -> 6061951
D385: of:=[.D384]+1 -> 2021-02-05T00:00:00.000 | F385: of:=IF([.G384] < [.$B$25];CEILING([.G384]*[.$B$3];1);0) -> 0 | G385: of:=IF([.G384] < [.$B$25];SUM([.F$3:.F385]);[.$B$25]) -> 222350062.5 | H385: of:=IF((ROW() - [.$B$21] < 3);0;FLOOR(IFERROR(OFFSET([.$F385];-1*[.$B$21];0 );0) * [.$B$10])) -> 0 | I385: of:=SUM(INDEX([.H$1:.H$736];MAX(ROW()+(-1*[.$B$22])+1;3);1):INDEX([.H$1:.H$736];ROW();1)) -> 0 | J385: of:=IF([.I385] > [.$B$20];[.I385]-[.$B$20];0) -> 0 | K385: of:=IF([.J385] > 0; ROUND([.$B$23] *MIN([.J385];[.H385])); 0) -> 0 | L385: of:=IF((ROW() - [.$B$13] < 3);0;FLOOR(IFERROR(OFFSET([.$F385];-1*[.$B$13];0 );0) * [.$B$14])) -> 0 | M385: of:=SUM([.L$3:.L385]) -> 6061951
D386: of:=[.D385]+1 -> 2021-02-06T00:00:00.000 | F386: of:=IF([.G385] < [.$B$25];CEILING([.G385]*[.$B$3];1);0) -> 0 | G386: of:=IF([.G385] < [.$B$25];SUM([.F$3:.F386]);[.$B$25]) -> 222350062.5 | H386: of:=IF((ROW() - [.$B$21] < 3);0;FLOOR(IFERROR(OFFSET([.$F386];-1*[.$B$21];0 );0) * [.$B$10])) -> 0 | I386: of:=SUM(INDEX([.H$1:.H$736];MAX(ROW()+(-1*[.$B$22])+1;3);1):INDEX([.H$1:.H$736];ROW();1)) -> 0 | J386: of:=IF([.I386] > [.$B$20];[.I386]-[.$B$20];0) -> 0 | K386: of:=IF([.J386] > 0; ROUND([.$B$23] *MIN([.J386];[.H386])); 0) -> 0 | L386: of:=IF((ROW() - [.$B$13] < 3);0;FLOOR(IFERROR(OFFSET([.$F386];-1*[.$B$13];0 );0) * [.$B$14])) -> 0 | M386: of:=SUM([.L$3:.L386]) -> 6061951
D387: of:=[.D386]+1 -> 2021-02-07T00:00:00.000 | F387: of:=IF([.G386] < [.$B$25];CEILING([.G386]*[.$B$3];1);0) -> 0 | G387: of:=IF([.G386] < [.$B$25];SUM([.F$3:.F387]);[.$B$25]) -> 222350062.5 | H387: of:=IF((ROW() - [.$B$21] < 3);0;FLOOR(IFERROR(OFFSET([.$F387];-1*[.$B$21];0 );0) * [.$B$10])) -> 0 | I387: of:=SUM(INDEX([.H$1:.H$736];MAX(ROW()+(-1*[.$B$22])+1;3);1):INDEX([.H$1:.H$736];ROW();1)) -> 0 | J387: of:=IF([.I387] > [.$B$20];[.I387]-[.$B$20];0) -> 0 | K387: of:=IF([.J387] > 0; ROUND([.$B$23] *MIN([.J387];[.H387])); 0) -> 0 | L387: of:=IF((ROW() - [.$B$13] < 3);0;FLOOR(IFERROR(OFFSET([.$F387];-1*[.$B$13];0 );0) * [.$B$14])) -> 0 | M387: of:=SUM([.L$3:.L387]) -> 6061951
D388: of:=[.D387]+1 -> 2021-02-08T00:00:00.000 | F388: of:=IF([.G387] < [.$B$25];CEILING([.G387]*[.$B$3];1);0) -> 0 | G388: of:=IF([.G387] < [.$B$25];SUM([.F$3:.F388]);[.$B$25]) -> 222350062.5 | H388: of:=IF((ROW() - [.$B$21] < 3);0;FLOOR(IFERROR(OFFSET([.$F388];-1*[.$B$21];0 );0) * [.$B$10])) -> 0 | I388: of:=SUM(INDEX([.H$1:.H$736];MAX(ROW()+(-1*[.$B$22])+1;3);1):INDEX([.H$1:.H$736];ROW();1)) -> 0 | J388: of:=IF([.I388] > [.$B$20];[.I388]-[.$B$20];0) -> 0 | K388: of:=IF([.J388] > 0; ROUND([.$B$23] *MIN([.J388];[.H388])); 0) -> 0 | L388: of:=IF((ROW() - [.$B$13] < 3);0;FLOOR(IFERROR(OFFSET([.$F388];-1*[.$B$13];0 );0) * [.$B$14])) -> 0 | M388: of:=SUM([.L$3:.L388]) -> 6061951
D389: of:=[.D388]+1 -> 2021-02-09T00:00:00.000 | F389: of:=IF([.G388] < [.$B$25];CEILING([.G388]*[.$B$3];1);0) -> 0 | G389: of:=IF([.G388] < [.$B$25];SUM([.F$3:.F389]);[.$B$25]) -> 222350062.5 | H389: of:=IF((ROW() - [.$B$21] < 3);0;FLOOR(IFERROR(OFFSET([.$F389];-1*[.$B$21];0 );0) * [.$B$10])) -> 0 | I389: of:=SUM(INDEX([.H$1:.H$736];MAX(ROW()+(-1*[.$B$22])+1;3);1):INDEX([.H$1:.H$736];ROW();1)) -> 0 | J389: of:=IF([.I389] > [.$B$20];[.I389]-[.$B$20];0) -> 0 | K389: of:=IF([.J389] > 0; ROUND([.$B$23] *MIN([.J389];[.H389])); 0) -> 0 | L389: of:=IF((ROW() - [.$B$13] < 3);0;FLOOR(IFERROR(OFFSET([.$F389];-1*[.$B$13];0 );0) * [.$B$14])) -> 0 | M389: of:=SUM([.L$3:.L389]) -> 6061951
D390: of:=[.D389]+1 -> 2021-02-10T00:00:00.000 | F390: of:=IF([.G389] < [.$B$25];CEILING([.G389]*[.$B$3];1);0) -> 0 | G390: of:=IF([.G389] < [.$B$25];SUM([.F$3:.F390]);[.$B$25]) -> 222350062.5 | H390: of:=IF((ROW() - [.$B$21] < 3);0;FLOOR(IFERROR(OFFSET([.$F390];-1*[.$B$21];0 );0) * [.$B$10])) -> 0 | I390: of:=SUM(INDEX([.H$1:.H$736];MAX(ROW()+(-1*[.$B$22])+1;3);1):INDEX([.H$1:.H$736];ROW();1)) -> 0 | J390: of:=IF([.I390] > [.$B$20];[.I390]-[.$B$20];0) -> 0 | K390: of:=IF([.J390] > 0; ROUND([.$B$23] *MIN([.J390];[.H390])); 0) -> 0 | L390: of:=IF((ROW() - [.$B$13] < 3);0;FLOOR(IFERROR(OFFSET([.$F390];-1*[.$B$13];0 );0) * [.$B$14])) -> 0 | M390: of:=SUM([.L$3:.L390]) -> 6061951
D391: of:=[.D390]+1 -> 2021-02-11T00:00:00.000 | F391: of:=IF([.G390] < [.$B$25];CEILING([.G390]*[.$B$3];1);0) -> 0 | G391: of:=IF([.G390] < [.$B$25];SUM([.F$3:.F391]);[.$B$25]) -> 222350062.5 | H391: of:=IF((ROW() - [.$B$21] < 3);0;FLOOR(IFERROR(OFFSET([.$F391];-1*[.$B$21];0 );0) * [.$B$10])) -> 0 | I391: of:=SUM(INDEX([.H$1:.H$736];MAX(ROW()+(-1*[.$B$22])+1;3);1):INDEX([.H$1:.H$736];ROW();1)) -> 0 | J391: of:=IF([.I391] > [.$B$20];[.I391]-[.$B$20];0) -> 0 | K391: of:=IF([.J391] > 0; ROUND([.$B$23] *MIN([.J391];[.H391])); 0) -> 0 | L391: of:=IF((ROW() - [.$B$13] < 3);0;FLOOR(IFERROR(OFFSET([.$F391];-1*[.$B$13];0 );0) * [.$B$14])) -> 0 | M391: of:=SUM([.L$3:.L391]) -> 6061951
D392: of:=[.D391]+1 -> 2021-02-12T00:00:00.000 | F392: of:=IF([.G391] < [.$B$25];CEILING([.G391]*[.$B$3];1);0) -> 0 | G392: of:=IF([.G391] < [.$B$25];SUM([.F$3:.F392]);[.$B$25]) -> 222350062.5 | H392: of:=IF((ROW() - [.$B$21] < 3);0;FLOOR(IFERROR(OFFSET([.$F392];-1*[.$B$21];0 );0) * [.$B$10])) -> 0 | I392: of:=SUM(INDEX([.H$1:.H$736];MAX(ROW()+(-1*[.$B$22])+1;3);1):INDEX([.H$1:.H$736];ROW();1)) -> 0 | J392: of:=IF([.I392] > [.$B$20];[.I392]-[.$B$20];0) -> 0 | K392: of:=IF([.J392] > 0; ROUND([.$B$23] *MIN([.J392];[.H392])); 0) -> 0 | L392: of:=IF((ROW() - [.$B$13] < 3);0;FLOOR(IFERROR(OFFSET([.$F392];-1*[.$B$13];0 );0) * [.$B$14])) -> 0 | M392: of:=SUM([.L$3:.L392]) -> 6061951
D393: of:=[.D392]+1 -> 2021-02-13T00:00:00.000 | F393: of:=IF([.G392] < [.$B$25];CEILING([.G392]*[.$B$3];1);0) -> 0 | G393: of:=IF([.G392] < [.$B$25];SUM([.F$3:.F393]);[.$B$25]) -> 222350062.5 | H393: of:=IF((ROW() - [.$B$21] < 3);0;FLOOR(IFERROR(OFFSET([.$F393];-1*[.$B$21];0 );0) * [.$B$10])) -> 0 | I393: of:=SUM(INDEX([.H$1:.H$736];MAX(ROW()+(-1*[.$B$22])+1;3);1):INDEX([.H$1:.H$736];ROW();1)) -> 0 | J393: of:=IF([.I393] > [.$B$20];[.I393]-[.$B$20];0) -> 0 | K393: of:=IF([.J393] > 0; ROUND([.$B$23] *MIN([.J393];[.H393])); 0) -> 0 | L393: of:=IF((ROW() - [.$B$13] < 3);0;FLOOR(IFERROR(OFFSET([.$F393];-1*[.$B$13];0 );0) * [.$B$14])) -> 0 | M393: of:=SUM([.L$3:.L393]) -> 6061951
D394: of:=[.D393]+1 -> 2021-02-14T00:00:00.000 | F394: of:=IF([.G393] < [.$B$25];CEILING([.G393]*[.$B$3];1);0) -> 0 | G394: of:=IF([.G393] < [.$B$25];SUM([.F$3:.F394]);[.$B$25]) -> 222350062.5 | H394: of:=IF((ROW() - [.$B$21] < 3);0;FLOOR(IFERROR(OFFSET([.$F394];-1*[.$B$21];0 );0) * [.$B$10])) -> 0 | I394: of:=SUM(INDEX([.H$1:.H$736];MAX(ROW()+(-1*[.$B$22])+1;3);1):INDEX([.H$1:.H$736];ROW();1)) -> 0 | J394: of:=IF([.I394] > [.$B$20];[.I394]-[.$B$20];0) -> 0 | K394: of:=IF([.J394] > 0; ROUND([.$B$23] *MIN([.J394];[.H394])); 0) -> 0 | L394: of:=IF((ROW() - [.$B$13] < 3);0;FLOOR(IFERROR(OFFSET([.$F394];-1*[.$B$13];0 );0) * [.$B$14])) -> 0 | M394: of:=SUM([.L$3:.L394]) -> 6061951
D395: of:=[.D394]+1 -> 2021-02-15T00:00:00.000 | F395: of:=IF([.G394] < [.$B$25];CEILING([.G394]*[.$B$3];1);0) -> 0 | G395: of:=IF([.G394] < [.$B$25];SUM([.F$3:.F395]);[.$B$25]) -> 222350062.5 | H395: of:=IF((ROW() - [.$B$21] < 3);0;FLOOR(IFERROR(OFFSET([.$F395];-1*[.$B$21];0 );0) * [.$B$10])) -> 0 | I395: of:=SUM(INDEX([.H$1:.H$736];MAX(ROW()+(-1*[.$B$22])+1;3);1):INDEX([.H$1:.H$736];ROW();1)) -> 0 | J395: of:=IF([.I395] > [.$B$20];[.I395]-[.$B$20];0) -> 0 | K395: of:=IF([.J395] > 0; ROUND([.$B$23] *MIN([.J395];[.H395])); 0) -> 0 | L395: of:=IF((ROW() - [.$B$13] < 3);0;FLOOR(IFERROR(OFFSET([.$F395];-1*[.$B$13];0 );0) * [.$B$14])) -> 0 | M395: of:=SUM([.L$3:.L395]) -> 6061951
D396: of:=[.D395]+1 -> 2021-02-16T00:00:00.000 | F396: of:=IF([.G395] < [.$B$25];CEILING([.G395]*[.$B$3];1);0) -> 0 | G396: of:=IF([.G395] < [.$B$25];SUM([.F$3:.F396]);[.$B$25]) -> 222350062.5 | H396: of:=IF((ROW() - [.$B$21] < 3);0;FLOOR(IFERROR(OFFSET([.$F396];-1*[.$B$21];0 );0) * [.$B$10])) -> 0 | I396: of:=SUM(INDEX([.H$1:.H$736];MAX(ROW()+(-1*[.$B$22])+1;3);1):INDEX([.H$1:.H$736];ROW();1)) -> 0 | J396: of:=IF([.I396] > [.$B$20];[.I396]-[.$B$20];0) -> 0 | K396: of:=IF([.J396] > 0; ROUND([.$B$23] *MIN([.J396];[.H396])); 0) -> 0 | L396: of:=IF((ROW() - [.$B$13] < 3);0;FLOOR(IFERROR(OFFSET([.$F396];-1*[.$B$13];0 );0) * [.$B$14])) -> 0 | M396: of:=SUM([.L$3:.L396]) -> 6061951
D397: of:=[.D396]+1 -> 2021-02-17T00:00:00.000 | F397: of:=IF([.G396] < [.$B$25];CEILING([.G396]*[.$B$3];1);0) -> 0 | G397: of:=IF([.G396] < [.$B$25];SUM([.F$3:.F397]);[.$B$25]) -> 222350062.5 | H397: of:=IF((ROW() - [.$B$21] < 3);0;FLOOR(IFERROR(OFFSET([.$F397];-1*[.$B$21];0 );0) * [.$B$10])) -> 0 | I397: of:=SUM(INDEX([.H$1:.H$736];MAX(ROW()+(-1*[.$B$22])+1;3);1):INDEX([.H$1:.H$736];ROW();1)) -> 0 | J397: of:=IF([.I397] > [.$B$20];[.I397]-[.$B$20];0) -> 0 | K397: of:=IF([.J397] > 0; ROUND([.$B$23] *MIN([.J397];[.H397])); 0) -> 0 | L397: of:=IF((ROW() - [.$B$13] < 3);0;FLOOR(IFERROR(OFFSET([.$F397];-1*[.$B$13];0 );0) * [.$B$14])) -> 0 | M397: of:=SUM([.L$3:.L397]) -> 6061951
D398: of:=[.D397]+1 -> 2021-02-18T00:00:00.000 | F398: of:=IF([.G397] < [.$B$25];CEILING([.G397]*[.$B$3];1);0) -> 0 | G398: of:=IF([.G397] < [.$B$25];SUM([.F$3:.F398]);[.$B$25]) -> 222350062.5 | H398: of:=IF((ROW() - [.$B$21] < 3);0;FLOOR(IFERROR(OFFSET([.$F398];-1*[.$B$21];0 );0) * [.$B$10])) -> 0 | I398: of:=SUM(INDEX([.H$1:.H$736];MAX(ROW()+(-1*[.$B$22])+1;3);1):INDEX([.H$1:.H$736];ROW();1)) -> 0 | J398: of:=IF([.I398] > [.$B$20];[.I398]-[.$B$20];0) -> 0 | K398: of:=IF([.J398] > 0; ROUND([.$B$23] *MIN([.J398];[.H398])); 0) -> 0 | L398: of:=IF((ROW() - [.$B$13] < 3);0;FLOOR(IFERROR(OFFSET([.$F398];-1*[.$B$13];0 );0) * [.$B$14])) -> 0 | M398: of:=SUM([.L$3:.L398]) -> 6061951
D399: of:=[.D398]+1 -> 2021-02-19T00:00:00.000 | F399: of:=IF([.G398] < [.$B$25];CEILING([.G398]*[.$B$3];1);0) -> 0 | G399: of:=IF([.G398] < [.$B$25];SUM([.F$3:.F399]);[.$B$25]) -> 222350062.5 | H399: of:=IF((ROW() - [.$B$21] < 3);0;FLOOR(IFERROR(OFFSET([.$F399];-1*[.$B$21];0 );0) * [.$B$10])) -> 0 | I399: of:=SUM(INDEX([.H$1:.H$736];MAX(ROW()+(-1*[.$B$22])+1;3);1):INDEX([.H$1:.H$736];ROW();1)) -> 0 | J399: of:=IF([.I399] > [.$B$20];[.I399]-[.$B$20];0) -> 0 | K399: of:=IF([.J399] > 0; ROUND([.$B$23] *MIN([.J399];[.H399])); 0) -> 0 | L399: of:=IF((ROW() - [.$B$13] < 3);0;FLOOR(IFERROR(OFFSET([.$F399];-1*[.$B$13];0 );0) * [.$B$14])) -> 0 | M399: of:=SUM([.L$3:.L399]) -> 6061951
D400: of:=[.D399]+1 -> 2021-02-20T00:00:00.000 | F400: of:=IF([.G399] < [.$B$25];CEILING([.G399]*[.$B$3];1);0) -> 0 | G400: of:=IF([.G399] < [.$B$25];SUM([.F$3:.F400]);[.$B$25]) -> 222350062.5 | H400: of:=IF((ROW() - [.$B$21] < 3);0;FLOOR(IFERROR(OFFSET([.$F400];-1*[.$B$21];0 );0) * [.$B$10])) -> 0 | I400: of:=SUM(INDEX([.H$1:.H$736];MAX(ROW()+(-1*[.$B$22])+1;3);1):INDEX([.H$1:.H$736];ROW();1)) -> 0 | J400: of:=IF([.I400] > [.$B$20];[.I400]-[.$B$20];0) -> 0 | K400: of:=IF([.J400] > 0; ROUND([.$B$23] *MIN([.J400];[.H400])); 0) -> 0 | L400: of:=IF((ROW() - [.$B$13] < 3);0;FLOOR(IFERROR(OFFSET([.$F400];-1*[.$B$13];0 );0) * [.$B$14])) -> 0 | M400: of:=SUM([.L$3:.L400]) -> 6061951
D401: of:=[.D400]+1 -> 2021-02-21T00:00:00.000 | F401: of:=IF([.G400] < [.$B$25];CEILING([.G400]*[.$B$3];1);0) -> 0 | G401: of:=IF([.G400] < [.$B$25];SUM([.F$3:.F401]);[.$B$25]) -> 222350062.5 | H401: of:=IF((ROW() - [.$B$21] < 3);0;FLOOR(IFERROR(OFFSET([.$F401];-1*[.$B$21];0 );0) * [.$B$10])) -> 0 | I401: of:=SUM(INDEX([.H$1:.H$736];MAX(ROW()+(-1*[.$B$22])+1;3);1):INDEX([.H$1:.H$736];ROW();1)) -> 0 | J401: of:=IF([.I401] > [.$B$20];[.I401]-[.$B$20];0) -> 0 | K401: of:=IF([.J401] > 0; ROUND([.$B$23] *MIN([.J401];[.H401])); 0) -> 0 | L401: of:=IF((ROW() - [.$B$13] < 3);0;FLOOR(IFERROR(OFFSET([.$F401];-1*[.$B$13];0 );0) * [.$B$14])) -> 0 | M401: of:=SUM([.L$3:.L401]) -> 6061951
D402: of:=[.D401]+1 -> 2021-02-22T00:00:00.000 | F402: of:=IF([.G401] < [.$B$25];CEILING([.G401]*[.$B$3];1);0) -> 0 | G402: of:=IF([.G401] < [.$B$25];SUM([.F$3:.F402]);[.$B$25]) -> 222350062.5 | H402: of:=IF((ROW() - [.$B$21] < 3);0;FLOOR(IFERROR(OFFSET([.$F402];-1*[.$B$21];0 );0) * [.$B$10])) -> 0 | I402: of:=SUM(INDEX([.H$1:.H$736];MAX(ROW()+(-1*[.$B$22])+1;3);1):INDEX([.H$1:.H$736];ROW();1)) -> 0 | J402: of:=IF([.I402] > [.$B$20];[.I402]-[.$B$20];0) -> 0 | K402: of:=IF([.J402] > 0; ROUND([.$B$23] *MIN([.J402];[.H402])); 0) -> 0 | L402: of:=IF((ROW() - [.$B$13] < 3);0;FLOOR(IFERROR(OFFSET([.$F402];-1*[.$B$13];0 );0) * [.$B$14])) -> 0 | M402: of:=SUM([.L$3:.L402]) -> 6061951
D403: of:=[.D402]+1 -> 2021-02-23T00:00:00.000 | F403: of:=IF([.G402] < [.$B$25];CEILING([.G402]*[.$B$3];1);0) -> 0 | G403: of:=IF([.G402] < [.$B$25];SUM([.F$3:.F403]);[.$B$25]) -> 222350062.5 | H403: of:=IF((ROW() - [.$B$21] < 3);0;FLOOR(IFERROR(OFFSET([.$F403];-1*[.$B$21];0 );0) * [.$B$10])) -> 0 | I403: of:=SUM(INDEX([.H$1:.H$736];MAX(ROW()+(-1*[.$B$22])+1;3);1):INDEX([.H$1:.H$736];ROW();1)) -> 0 | J403: of:=IF([.I403] > [.$B$20];[.I403]-[.$B$20];0) -> 0 | K403: of:=IF([.J403] > 0; ROUND([.$B$23] *MIN([.J403];[.H403])); 0) -> 0 | L403: of:=IF((ROW() - [.$B$13] < 3);0;FLOOR(IFERROR(OFFSET([.$F403];-1*[.$B$13];0 );0) * [.$B$14])) -> 0 | M403: of:=SUM([.L$3:.L403]) -> 6061951
D404: of:=[.D403]+1 -> 2021-02-24T00:00:00.000 | F404: of:=IF([.G403] < [.$B$25];CEILING([.G403]*[.$B$3];1);0) -> 0 | G404: of:=IF([.G403] < [.$B$25];SUM([.F$3:.F404]);[.$B$25]) -> 222350062.5 | H404: of:=IF((ROW() - [.$B$21] < 3);0;FLOOR(IFERROR(OFFSET([.$F404];-1*[.$B$21];0 );0) * [.$B$10])) -> 0 | I404: of:=SUM(INDEX([.H$1:.H$736];MAX(ROW()+(-1*[.$B$22])+1;3);1):INDEX([.H$1:.H$736];ROW();1)) -> 0 | J404: of:=IF([.I404] > [.$B$20];[.I404]-[.$B$20];0) -> 0 | K404: of:=IF([.J404] > 0; ROUND([.$B$23] *MIN([.J404];[.H404])); 0) -> 0 | L404: of:=IF((ROW() - [.$B$13] < 3);0;FLOOR(IFERROR(OFFSET([.$F404];-1*[.$B$13];0 );0) * [.$B$14])) -> 0 | M404: of:=SUM([.L$3:.L404]) -> 6061951
D405: of:=[.D404]+1 -> 2021-02-25T00:00:00.000 | F405: of:=IF([.G404] < [.$B$25];CEILING([.G404]*[.$B$3];1);0) -> 0 | G405: of:=IF([.G404] < [.$B$25];SUM([.F$3:.F405]);[.$B$25]) -> 222350062.5 | H405: of:=IF((ROW() - [.$B$21] < 3);0;FLOOR(IFERROR(OFFSET([.$F405];-1*[.$B$21];0 );0) * [.$B$10])) -> 0 | I405: of:=SUM(INDEX([.H$1:.H$736];MAX(ROW()+(-1*[.$B$22])+1;3);1):INDEX([.H$1:.H$736];ROW();1)) -> 0 | J405: of:=IF([.I405] > [.$B$20];[.I405]-[.$B$20];0) -> 0 | K405: of:=IF([.J405] > 0; ROUND([.$B$23] *MIN([.J405];[.H405])); 0) -> 0 | L405: of:=IF((ROW() - [.$B$13] < 3);0;FLOOR(IFERROR(OFFSET([.$F405];-1*[.$B$13];0 );0) * [.$B$14])) -> 0 | M405: of:=SUM([.L$3:.L405]) -> 6061951
D406: of:=[.D405]+1 -> 2021-02-26T00:00:00.000 | F406: of:=IF([.G405] < [.$B$25];CEILING([.G405]*[.$B$3];1);0) -> 0 | G406: of:=IF([.G405] < [.$B$25];SUM([.F$3:.F406]);[.$B$25]) -> 222350062.5 | H406: of:=IF((ROW() - [.$B$21] < 3);0;FLOOR(IFERROR(OFFSET([.$F406];-1*[.$B$21];0 );0) * [.$B$10])) -> 0 | I406: of:=SUM(INDEX([.H$1:.H$736];MAX(ROW()+(-1*[.$B$22])+1;3);1):INDEX([.H$1:.H$736];ROW();1)) -> 0 | J406: of:=IF([.I406] > [.$B$20];[.I406]-[.$B$20];0) -> 0 | K406: of:=IF([.J406] > 0; ROUND([.$B$23] *MIN([.J406];[.H406])); 0) -> 0 | L406: of:=IF((ROW() - [.$B$13] < 3);0;FLOOR(IFERROR(OFFSET([.$F406];-1*[.$B$13];0 );0) * [.$B$14])) -> 0 | M406: of:=SUM([.L$3:.L406]) -> 6061951
D407: of:=[.D406]+1 -> 2021-02-27T00:00:00.000 | F407: of:=IF([.G406] < [.$B$25];CEILING([.G406]*[.$B$3];1);0) -> 0 | G407: of:=IF([.G406] < [.$B$25];SUM([.F$3:.F407]);[.$B$25]) -> 222350062.5 | H407: of:=IF((ROW() - [.$B$21] < 3);0;FLOOR(IFERROR(OFFSET([.$F407];-1*[.$B$21];0 );0) * [.$B$10])) -> 0 | I407: of:=SUM(INDEX([.H$1:.H$736];MAX(ROW()+(-1*[.$B$22])+1;3);1):INDEX([.H$1:.H$736];ROW();1)) -> 0 | J407: of:=IF([.I407] > [.$B$20];[.I407]-[.$B$20];0) -> 0 | K407: of:=IF([.J407] > 0; ROUND([.$B$23] *MIN([.J407];[.H407])); 0) -> 0 | L407: of:=IF((ROW() - [.$B$13] < 3);0;FLOOR(IFERROR(OFFSET([.$F407];-1*[.$B$13];0 );0) * [.$B$14])) -> 0 | M407: of:=SUM([.L$3:.L407]) -> 6061951
D408: of:=[.D407]+1 -> 2021-02-28T00:00:00.000 | F408: of:=IF([.G407] < [.$B$25];CEILING([.G407]*[.$B$3];1);0) -> 0 | G408: of:=IF([.G407] < [.$B$25];SUM([.F$3:.F408]);[.$B$25]) -> 222350062.5 | H408: of:=IF((ROW() - [.$B$21] < 3);0;FLOOR(IFERROR(OFFSET([.$F408];-1*[.$B$21];0 );0) * [.$B$10])) -> 0 | I408: of:=SUM(INDEX([.H$1:.H$736];MAX(ROW()+(-1*[.$B$22])+1;3);1):INDEX([.H$1:.H$736];ROW();1)) -> 0 | J408: of:=IF([.I408] > [.$B$20];[.I408]-[.$B$20];0) -> 0 | K408: of:=IF([.J408] > 0; ROUND([.$B$23] *MIN([.J408];[.H408])); 0) -> 0 | L408: of:=IF((ROW() - [.$B$13] < 3);0;FLOOR(IFERROR(OFFSET([.$F408];-1*[.$B$13];0 );0) * [.$B$14])) -> 0 | M408: of:=SUM([.L$3:.L408]) -> 6061951
D409: of:=[.D408]+1 -> 2021-03-01T00:00:00.000 | F409: of:=IF([.G408] < [.$B$25];CEILING([.G408]*[.$B$3];1);0) -> 0 | G409: of:=IF([.G408] < [.$B$25];SUM([.F$3:.F409]);[.$B$25]) -> 222350062.5 | H409: of:=IF((ROW() - [.$B$21] < 3);0;FLOOR(IFERROR(OFFSET([.$F409];-1*[.$B$21];0 );0) * [.$B$10])) -> 0 | I409: of:=SUM(INDEX([.H$1:.H$736];MAX(ROW()+(-1*[.$B$22])+1;3);1):INDEX([.H$1:.H$736];ROW();1)) -> 0 | J409: of:=IF([.I409] > [.$B$20];[.I409]-[.$B$20];0) -> 0 | K409: of:=IF([.J409] > 0; ROUND([.$B$23] *MIN([.J409];[.H409])); 0) -> 0 | L409: of:=IF((ROW() - [.$B$13] < 3);0;FLOOR(IFERROR(OFFSET([.$F409];-1*[.$B$13];0 );0) * [.$B$14])) -> 0 | M409: of:=SUM([.L$3:.L409]) -> 6061951
D410: of:=[.D409]+1 -> 2021-03-02T00:00:00.000 | F410: of:=IF([.G409] < [.$B$25];CEILING([.G409]*[.$B$3];1);0) -> 0 | G410: of:=IF([.G409] < [.$B$25];SUM([.F$3:.F410]);[.$B$25]) -> 222350062.5 | H410: of:=IF((ROW() - [.$B$21] < 3);0;FLOOR(IFERROR(OFFSET([.$F410];-1*[.$B$21];0 );0) * [.$B$10])) -> 0 | I410: of:=SUM(INDEX([.H$1:.H$736];MAX(ROW()+(-1*[.$B$22])+1;3);1):INDEX([.H$1:.H$736];ROW();1)) -> 0 | J410: of:=IF([.I410] > [.$B$20];[.I410]-[.$B$20];0) -> 0 | K410: of:=IF([.J410] > 0; ROUND([.$B$23] *MIN([.J410];[.H410])); 0) -> 0 | L410: of:=IF((ROW() - [.$B$13] < 3);0;FLOOR(IFERROR(OFFSET([.$F410];-1*[.$B$13];0 );0) * [.$B$14])) -> 0 | M410: of:=SUM([.L$3:.L410]) -> 6061951
D411: of:=[.D410]+1 -> 2021-03-03T00:00:00.000 | F411: of:=IF([.G410] < [.$B$25];CEILING([.G410]*[.$B$3];1);0) -> 0 | G411: of:=IF([.G410] < [.$B$25];SUM([.F$3:.F411]);[.$B$25]) -> 222350062.5 | H411: of:=IF((ROW() - [.$B$21] < 3);0;FLOOR(IFERROR(OFFSET([.$F411];-1*[.$B$21];0 );0) * [.$B$10])) -> 0 | I411: of:=SUM(INDEX([.H$1:.H$736];MAX(ROW()+(-1*[.$B$22])+1;3);1):INDEX([.H$1:.H$736];ROW();1)) -> 0 | J411: of:=IF([.I411] > [.$B$20];[.I411]-[.$B$20];0) -> 0 | K411: of:=IF([.J411] > 0; ROUND([.$B$23] *MIN([.J411];[.H411])); 0) -> 0 | L411: of:=IF((ROW() - [.$B$13] < 3);0;FLOOR(IFERROR(OFFSET([.$F411];-1*[.$B$13];0 );0) * [.$B$14])) -> 0 | M411: of:=SUM([.L$3:.L411]) -> 6061951
D412: of:=[.D411]+1 -> 2021-03-04T00:00:00.000 | F412: of:=IF([.G411] < [.$B$25];CEILING([.G411]*[.$B$3];1);0) -> 0 | G412: of:=IF([.G411] < [.$B$25];SUM([.F$3:.F412]);[.$B$25]) -> 222350062.5 | H412: of:=IF((ROW() - [.$B$21] < 3);0;FLOOR(IFERROR(OFFSET([.$F412];-1*[.$B$21];0 );0) * [.$B$10])) -> 0 | I412: of:=SUM(INDEX([.H$1:.H$736];MAX(ROW()+(-1*[.$B$22])+1;3);1):INDEX([.H$1:.H$736];ROW();1)) -> 0 | J412: of:=IF([.I412] > [.$B$20];[.I412]-[.$B$20];0) -> 0 | K412: of:=IF([.J412] > 0; ROUND([.$B$23] *MIN([.J412];[.H412])); 0) -> 0 | L412: of:=IF((ROW() - [.$B$13] < 3);0;FLOOR(IFERROR(OFFSET([.$F412];-1*[.$B$13];0 );0) * [.$B$14])) -> 0 | M412: of:=SUM([.L$3:.L412]) -> 6061951
D413: of:=[.D412]+1 -> 2021-03-05T00:00:00.000 | F413: of:=IF([.G412] < [.$B$25];CEILING([.G412]*[.$B$3];1);0) -> 0 | G413: of:=IF([.G412] < [.$B$25];SUM([.F$3:.F413]);[.$B$25]) -> 222350062.5 | H413: of:=IF((ROW() - [.$B$21] < 3);0;FLOOR(IFERROR(OFFSET([.$F413];-1*[.$B$21];0 );0) * [.$B$10])) -> 0 | I413: of:=SUM(INDEX([.H$1:.H$736];MAX(ROW()+(-1*[.$B$22])+1;3);1):INDEX([.H$1:.H$736];ROW();1)) -> 0 | J413: of:=IF([.I413] > [.$B$20];[.I413]-[.$B$20];0) -> 0 | K413: of:=IF([.J413] > 0; ROUND([.$B$23] *MIN([.J413];[.H413])); 0) -> 0 | L413: of:=IF((ROW() - [.$B$13] < 3);0;FLOOR(IFERROR(OFFSET([.$F413];-1*[.$B$13];0 );0) * [.$B$14])) -> 0 | M413: of:=SUM([.L$3:.L413]) -> 6061951
D414: of:=[.D413]+1 -> 2021-03-06T00:00:00.000 | F414: of:=IF([.G413] < [.$B$25];CEILING([.G413]*[.$B$3];1);0) -> 0 | G414: of:=IF([.G413] < [.$B$25];SUM([.F$3:.F414]);[.$B$25]) -> 222350062.5 | H414: of:=IF((ROW() - [.$B$21] < 3);0;FLOOR(IFERROR(OFFSET([.$F414];-1*[.$B$21];0 );0) * [.$B$10])) -> 0 | I414: of:=SUM(INDEX([.H$1:.H$736];MAX(ROW()+(-1*[.$B$22])+1;3);1):INDEX([.H$1:.H$736];ROW();1)) -> 0 | J414: of:=IF([.I414] > [.$B$20];[.I414]-[.$B$20];0) -> 0 | K414: of:=IF([.J414] > 0; ROUND([.$B$23] *MIN([.J414];[.H414])); 0) -> 0 | L414: of:=IF((ROW() - [.$B$13] < 3);0;FLOOR(IFERROR(OFFSET([.$F414];-1*[.$B$13];0 );0) * [.$B$14])) -> 0 | M414: of:=SUM([.L$3:.L414]) -> 6061951
D415: of:=[.D414]+1 -> 2021-03-07T00:00:00.000 | F415: of:=IF([.G414] < [.$B$25];CEILING([.G414]*[.$B$3];1);0) -> 0 | G415: of:=IF([.G414] < [.$B$25];SUM([.F$3:.F415]);[.$B$25]) -> 222350062.5 | H415: of:=IF((ROW() - [.$B$21] < 3);0;FLOOR(IFERROR(OFFSET([.$F415];-1*[.$B$21];0 );0) * [.$B$10])) -> 0 | I415: of:=SUM(INDEX([.H$1:.H$736];MAX(ROW()+(-1*[.$B$22])+1;3);1):INDEX([.H$1:.H$736];ROW();1)) -> 0 | J415: of:=IF([.I415] > [.$B$20];[.I415]-[.$B$20];0) -> 0 | K415: of:=IF([.J415] > 0; ROUND([.$B$23] *MIN([.J415];[.H415])); 0) -> 0 | L415: of:=IF((ROW() - [.$B$13] < 3);0;FLOOR(IFERROR(OFFSET([.$F415];-1*[.$B$13];0 );0) * [.$B$14])) -> 0 | M415: of:=SUM([.L$3:.L415]) -> 6061951
D416: of:=[.D415]+1 -> 2021-03-08T00:00:00.000 | F416: of:=IF([.G415] < [.$B$25];CEILING([.G415]*[.$B$3];1);0) -> 0 | G416: of:=IF([.G415] < [.$B$25];SUM([.F$3:.F416]);[.$B$25]) -> 222350062.5 | H416: of:=IF((ROW() - [.$B$21] < 3);0;FLOOR(IFERROR(OFFSET([.$F416];-1*[.$B$21];0 );0) * [.$B$10])) -> 0 | I416: of:=SUM(INDEX([.H$1:.H$736];MAX(ROW()+(-1*[.$B$22])+1;3);1):INDEX([.H$1:.H$736];ROW();1)) -> 0 | J416: of:=IF([.I416] > [.$B$20];[.I416]-[.$B$20];0) -> 0 | K416: of:=IF([.J416] > 0; ROUND([.$B$23] *MIN([.J416];[.H416])); 0) -> 0 | L416: of:=IF((ROW() - [.$B$13] < 3);0;FLOOR(IFERROR(OFFSET([.$F416];-1*[.$B$13];0 );0) * [.$B$14])) -> 0 | M416: of:=SUM([.L$3:.L416]) -> 6061951
D417: of:=[.D416]+1 -> 2021-03-09T00:00:00.000 | F417: of:=IF([.G416] < [.$B$25];CEILING([.G416]*[.$B$3];1);0) -> 0 | G417: of:=IF([.G416] < [.$B$25];SUM([.F$3:.F417]);[.$B$25]) -> 222350062.5 | H417: of:=IF((ROW() - [.$B$21] < 3);0;FLOOR(IFERROR(OFFSET([.$F417];-1*[.$B$21];0 );0) * [.$B$10])) -> 0 | I417: of:=SUM(INDEX([.H$1:.H$736];MAX(ROW()+(-1*[.$B$22])+1;3);1):INDEX([.H$1:.H$736];ROW();1)) -> 0 | J417: of:=IF([.I417] > [.$B$20];[.I417]-[.$B$20];0) -> 0 | K417: of:=IF([.J417] > 0; ROUND([.$B$23] *MIN([.J417];[.H417])); 0) -> 0 | L417: of:=IF((ROW() - [.$B$13] < 3);0;FLOOR(IFERROR(OFFSET([.$F417];-1*[.$B$13];0 );0) * [.$B$14])) -> 0 | M417: of:=SUM([.L$3:.L417]) -> 6061951
D418: of:=[.D417]+1 -> 2021-03-10T00:00:00.000 | F418: of:=IF([.G417] < [.$B$25];CEILING([.G417]*[.$B$3];1);0) -> 0 | G418: of:=IF([.G417] < [.$B$25];SUM([.F$3:.F418]);[.$B$25]) -> 222350062.5 | H418: of:=IF((ROW() - [.$B$21] < 3);0;FLOOR(IFERROR(OFFSET([.$F418];-1*[.$B$21];0 );0) * [.$B$10])) -> 0 | I418: of:=SUM(INDEX([.H$1:.H$736];MAX(ROW()+(-1*[.$B$22])+1;3);1):INDEX([.H$1:.H$736];ROW();1)) -> 0 | J418: of:=IF([.I418] > [.$B$20];[.I418]-[.$B$20];0) -> 0 | K418: of:=IF([.J418] > 0; ROUND([.$B$23] *MIN([.J418];[.H418])); 0) -> 0 | L418: of:=IF((ROW() - [.$B$13] < 3);0;FLOOR(IFERROR(OFFSET([.$F418];-1*[.$B$13];0 );0) * [.$B$14])) -> 0 | M418: of:=SUM([.L$3:.L418]) -> 6061951
D419: of:=[.D418]+1 -> 2021-03-11T00:00:00.000 | F419: of:=IF([.G418] < [.$B$25];CEILING([.G418]*[.$B$3];1);0) -> 0 | G419: of:=IF([.G418] < [.$B$25];SUM([.F$3:.F419]);[.$B$25]) -> 222350062.5 | H419: of:=IF((ROW() - [.$B$21] < 3);0;FLOOR(IFERROR(OFFSET([.$F419];-1*[.$B$21];0 );0) * [.$B$10])) -> 0 | I419: of:=SUM(INDEX([.H$1:.H$736];MAX(ROW()+(-1*[.$B$22])+1;3);1):INDEX([.H$1:.H$736];ROW();1)) -> 0 | J419: of:=IF([.I419] > [.$B$20];[.I419]-[.$B$20];0) -> 0 | K419: of:=IF([.J419] > 0; ROUND([.$B$23] *MIN([.J419];[.H419])); 0) -> 0 | L419: of:=IF((ROW() - [.$B$13] < 3);0;FLOOR(IFERROR(OFFSET([.$F419];-1*[.$B$13];0 );0) * [.$B$14])) -> 0 | M419: of:=SUM([.L$3:.L419]) -> 6061951
D420: of:=[.D419]+1 -> 2021-03-12T00:00:00.000 | F420: of:=IF([.G419] < [.$B$25];CEILING([.G419]*[.$B$3];1);0) -> 0 | G420: of:=IF([.G419] < [.$B$25];SUM([.F$3:.F420]);[.$B$25]) -> 222350062.5 | H420: of:=IF((ROW() - [.$B$21] < 3);0;FLOOR(IFERROR(OFFSET([.$F420];-1*[.$B$21];0 );0) * [.$B$10])) -> 0 | I420: of:=SUM(INDEX([.H$1:.H$736];MAX(ROW()+(-1*[.$B$22])+1;3);1):INDEX([.H$1:.H$736];ROW();1)) -> 0 | J420: of:=IF([.I420] > [.$B$20];[.I420]-[.$B$20];0) -> 0 | K420: of:=IF([.J420] > 0; ROUND([.$B$23] *MIN([.J420];[.H420])); 0) -> 0 | L420: of:=IF((ROW() - [.$B$13] < 3);0;FLOOR(IFERROR(OFFSET([.$F420];-1*[.$B$13];0 );0) * [.$B$14])) -> 0 | M420: of:=SUM([.L$3:.L420]) -> 6061951
D421: of:=[.D420]+1 -> 2021-03-13T00:00:00.000 | F421: of:=IF([.G420] < [.$B$25];CEILING([.G420]*[.$B$3];1);0) -> 0 | G421: of:=IF([.G420] < [.$B$25];SUM([.F$3:.F421]);[.$B$25]) -> 222350062.5 | H421: of:=IF((ROW() - [.$B$21] < 3);0;FLOOR(IFERROR(OFFSET([.$F421];-1*[.$B$21];0 );0) * [.$B$10])) -> 0 | I421: of:=SUM(INDEX([.H$1:.H$736];MAX(ROW()+(-1*[.$B$22])+1;3);1):INDEX([.H$1:.H$736];ROW();1)) -> 0 | J421: of:=IF([.I421] > [.$B$20];[.I421]-[.$B$20];0) -> 0 | K421: of:=IF([.J421] > 0; ROUND([.$B$23] *MIN([.J421];[.H421])); 0) -> 0 | L421: of:=IF((ROW() - [.$B$13] < 3);0;FLOOR(IFERROR(OFFSET([.$F421];-1*[.$B$13];0 );0) * [.$B$14])) -> 0 | M421: of:=SUM([.L$3:.L421]) -> 6061951
D422: of:=[.D421]+1 -> 2021-03-14T00:00:00.000 | F422: of:=IF([.G421] < [.$B$25];CEILING([.G421]*[.$B$3];1);0) -> 0 | G422: of:=IF([.G421] < [.$B$25];SUM([.F$3:.F422]);[.$B$25]) -> 222350062.5 | H422: of:=IF((ROW() - [.$B$21] < 3);0;FLOOR(IFERROR(OFFSET([.$F422];-1*[.$B$21];0 );0) * [.$B$10])) -> 0 | I422: of:=SUM(INDEX([.H$1:.H$736];MAX(ROW()+(-1*[.$B$22])+1;3);1):INDEX([.H$1:.H$736];ROW();1)) -> 0 | J422: of:=IF([.I422] > [.$B$20];[.I422]-[.$B$20];0) -> 0 | K422: of:=IF([.J422] > 0; ROUND([.$B$23] *MIN([.J422];[.H422])); 0) -> 0 | L422: of:=IF((ROW() - [.$B$13] < 3);0;FLOOR(IFERROR(OFFSET([.$F422];-1*[.$B$13];0 );0) * [.$B$14])) -> 0 | M422: of:=SUM([.L$3:.L422]) -> 6061951
D423: of:=[.D422]+1 -> 2021-03-15T00:00:00.000 | F423: of:=IF([.G422] < [.$B$25];CEILING([.G422]*[.$B$3];1);0) -> 0 | G423: of:=IF([.G422] < [.$B$25];SUM([.F$3:.F423]);[.$B$25]) -> 222350062.5 | H423: of:=IF((ROW() - [.$B$21] < 3);0;FLOOR(IFERROR(OFFSET([.$F423];-1*[.$B$21];0 );0) * [.$B$10])) -> 0 | I423: of:=SUM(INDEX([.H$1:.H$736];MAX(ROW()+(-1*[.$B$22])+1;3);1):INDEX([.H$1:.H$736];ROW();1)) -> 0 | J423: of:=IF([.I423] > [.$B$20];[.I423]-[.$B$20];0) -> 0 | K423: of:=IF([.J423] > 0; ROUND([.$B$23] *MIN([.J423];[.H423])); 0) -> 0 | L423: of:=IF((ROW() - [.$B$13] < 3);0;FLOOR(IFERROR(OFFSET([.$F423];-1*[.$B$13];0 );0) * [.$B$14])) -> 0 | M423: of:=SUM([.L$3:.L423]) -> 6061951
D424: of:=[.D423]+1 -> 2021-03-16T00:00:00.000 | F424: of:=IF([.G423] < [.$B$25];CEILING([.G423]*[.$B$3];1);0) -> 0 | G424: of:=IF([.G423] < [.$B$25];SUM([.F$3:.F424]);[.$B$25]) -> 222350062.5 | H424: of:=IF((ROW() - [.$B$21] < 3);0;FLOOR(IFERROR(OFFSET([.$F424];-1*[.$B$21];0 );0) * [.$B$10])) -> 0 | I424: of:=SUM(INDEX([.H$1:.H$736];MAX(ROW()+(-1*[.$B$22])+1;3);1):INDEX([.H$1:.H$736];ROW();1)) -> 0 | J424: of:=IF([.I424] > [.$B$20];[.I424]-[.$B$20];0) -> 0 | K424: of:=IF([.J424] > 0; ROUND([.$B$23] *MIN([.J424];[.H424])); 0) -> 0 | L424: of:=IF((ROW() - [.$B$13] < 3);0;FLOOR(IFERROR(OFFSET([.$F424];-1*[.$B$13];0 );0) * [.$B$14])) -> 0 | M424: of:=SUM([.L$3:.L424]) -> 6061951
D425: of:=[.D424]+1 -> 2021-03-17T00:00:00.000 | F425: of:=IF([.G424] < [.$B$25];CEILING([.G424]*[.$B$3];1);0) -> 0 | G425: of:=IF([.G424] < [.$B$25];SUM([.F$3:.F425]);[.$B$25]) -> 222350062.5 | H425: of:=IF((ROW() - [.$B$21] < 3);0;FLOOR(IFERROR(OFFSET([.$F425];-1*[.$B$21];0 );0) * [.$B$10])) -> 0 | I425: of:=SUM(INDEX([.H$1:.H$736];MAX(ROW()+(-1*[.$B$22])+1;3);1):INDEX([.H$1:.H$736];ROW();1)) -> 0 | J425: of:=IF([.I425] > [.$B$20];[.I425]-[.$B$20];0) -> 0 | K425: of:=IF([.J425] > 0; ROUND([.$B$23] *MIN([.J425];[.H425])); 0) -> 0 | L425: of:=IF((ROW() - [.$B$13] < 3);0;FLOOR(IFERROR(OFFSET([.$F425];-1*[.$B$13];0 );0) * [.$B$14])) -> 0 | M425: of:=SUM([.L$3:.L425]) -> 6061951
D426: of:=[.D425]+1 -> 2021-03-18T00:00:00.000 | F426: of:=IF([.G425] < [.$B$25];CEILING([.G425]*[.$B$3];1);0) -> 0 | G426: of:=IF([.G425] < [.$B$25];SUM([.F$3:.F426]);[.$B$25]) -> 222350062.5 | H426: of:=IF((ROW() - [.$B$21] < 3);0;FLOOR(IFERROR(OFFSET([.$F426];-1*[.$B$21];0 );0) * [.$B$10])) -> 0 | I426: of:=SUM(INDEX([.H$1:.H$736];MAX(ROW()+(-1*[.$B$22])+1;3);1):INDEX([.H$1:.H$736];ROW();1)) -> 0 | J426: of:=IF([.I426] > [.$B$20];[.I426]-[.$B$20];0) -> 0 | K426: of:=IF([.J426] > 0; ROUND([.$B$23] *MIN([.J426];[.H426])); 0) -> 0 | L426: of:=IF((ROW() - [.$B$13] < 3);0;FLOOR(IFERROR(OFFSET([.$F426];-1*[.$B$13];0 );0) * [.$B$14])) -> 0 | M426: of:=SUM([.L$3:.L426]) -> 6061951
D427: of:=[.D426]+1 -> 2021-03-19T00:00:00.000 | F427: of:=IF([.G426] < [.$B$25];CEILING([.G426]*[.$B$3];1);0) -> 0 | G427: of:=IF([.G426] < [.$B$25];SUM([.F$3:.F427]);[.$B$25]) -> 222350062.5 | H427: of:=IF((ROW() - [.$B$21] < 3);0;FLOOR(IFERROR(OFFSET([.$F427];-1*[.$B$21];0 );0) * [.$B$10])) -> 0 | I427: of:=SUM(INDEX([.H$1:.H$736];MAX(ROW()+(-1*[.$B$22])+1;3);1):INDEX([.H$1:.H$736];ROW();1)) -> 0 | J427: of:=IF([.I427] > [.$B$20];[.I427]-[.$B$20];0) -> 0 | K427: of:=IF([.J427] > 0; ROUND([.$B$23] *MIN([.J427];[.H427])); 0) -> 0 | L427: of:=IF((ROW() - [.$B$13] < 3);0;FLOOR(IFERROR(OFFSET([.$F427];-1*[.$B$13];0 );0) * [.$B$14])) -> 0 | M427: of:=SUM([.L$3:.L427]) -> 6061951
D428: of:=[.D427]+1 -> 2021-03-20T00:00:00.000 | F428: of:=IF([.G427] < [.$B$25];CEILING([.G427]*[.$B$3];1);0) -> 0 | G428: of:=IF([.G427] < [.$B$25];SUM([.F$3:.F428]);[.$B$25]) -> 222350062.5 | H428: of:=IF((ROW() - [.$B$21] < 3);0;FLOOR(IFERROR(OFFSET([.$F428];-1*[.$B$21];0 );0) * [.$B$10])) -> 0 | I428: of:=SUM(INDEX([.H$1:.H$736];MAX(ROW()+(-1*[.$B$22])+1;3);1):INDEX([.H$1:.H$736];ROW();1)) -> 0 | J428: of:=IF([.I428] > [.$B$20];[.I428]-[.$B$20];0) -> 0 | K428: of:=IF([.J428] > 0; ROUND([.$B$23] *MIN([.J428];[.H428])); 0) -> 0 | L428: of:=IF((ROW() - [.$B$13] < 3);0;FLOOR(IFERROR(OFFSET([.$F428];-1*[.$B$13];0 );0) * [.$B$14])) -> 0 | M428: of:=SUM([.L$3:.L428]) -> 6061951
D429: of:=[.D428]+1 -> 2021-03-21T00:00:00.000 | F429: of:=IF([.G428] < [.$B$25];CEILING([.G428]*[.$B$3];1);0) -> 0 | G429: of:=IF([.G428] < [.$B$25];SUM([.F$3:.F429]);[.$B$25]) -> 222350062.5 | H429: of:=IF((ROW() - [.$B$21] < 3);0;FLOOR(IFERROR(OFFSET([.$F429];-1*[.$B$21];0 );0) * [.$B$10])) -> 0 | I429: of:=SUM(INDEX([.H$1:.H$736];MAX(ROW()+(-1*[.$B$22])+1;3);1):INDEX([.H$1:.H$736];ROW();1)) -> 0 | J429: of:=IF([.I429] > [.$B$20];[.I429]-[.$B$20];0) -> 0 | K429: of:=IF([.J429] > 0; ROUND([.$B$23] *MIN([.J429];[.H429])); 0) -> 0 | L429: of:=IF((ROW() - [.$B$13] < 3);0;FLOOR(IFERROR(OFFSET([.$F429];-1*[.$B$13];0 );0) * [.$B$14])) -> 0 | M429: of:=SUM([.L$3:.L429]) -> 6061951
D430: of:=[.D429]+1 -> 2021-03-22T00:00:00.000 | F430: of:=IF([.G429] < [.$B$25];CEILING([.G429]*[.$B$3];1);0) -> 0 | G430: of:=IF([.G429] < [.$B$25];SUM([.F$3:.F430]);[.$B$25]) -> 222350062.5 | H430: of:=IF((ROW() - [.$B$21] < 3);0;FLOOR(IFERROR(OFFSET([.$F430];-1*[.$B$21];0 );0) * [.$B$10])) -> 0 | I430: of:=SUM(INDEX([.H$1:.H$736];MAX(ROW()+(-1*[.$B$22])+1;3);1):INDEX([.H$1:.H$736];ROW();1)) -> 0 | J430: of:=IF([.I430] > [.$B$20];[.I430]-[.$B$20];0) -> 0 | K430: of:=IF([.J430] > 0; ROUND([.$B$23] *MIN([.J430];[.H430])); 0) -> 0 | L430: of:=IF((ROW() - [.$B$13] < 3);0;FLOOR(IFERROR(OFFSET([.$F430];-1*[.$B$13];0 );0) * [.$B$14])) -> 0 | M430: of:=SUM([.L$3:.L430]) -> 6061951
D431: of:=[.D430]+1 -> 2021-03-23T00:00:00.000 | F431: of:=IF([.G430] < [.$B$25];CEILING([.G430]*[.$B$3];1);0) -> 0 | G431: of:=IF([.G430] < [.$B$25];SUM([.F$3:.F431]);[.$B$25]) -> 222350062.5 | H431: of:=IF((ROW() - [.$B$21] < 3);0;FLOOR(IFERROR(OFFSET([.$F431];-1*[.$B$21];0 );0) * [.$B$10])) -> 0 | I431: of:=SUM(INDEX([.H$1:.H$736];MAX(ROW()+(-1*[.$B$22])+1;3);1):INDEX([.H$1:.H$736];ROW();1)) -> 0 | J431: of:=IF([.I431] > [.$B$20];[.I431]-[.$B$20];0) -> 0 | K431: of:=IF([.J431] > 0; ROUND([.$B$23] *MIN([.J431];[.H431])); 0) -> 0 | L431: of:=IF((ROW() - [.$B$13] < 3);0;FLOOR(IFERROR(OFFSET([.$F431];-1*[.$B$13];0 );0) * [.$B$14])) -> 0 | M431: of:=SUM([.L$3:.L431]) -> 6061951
D432: of:=[.D431]+1 -> 2021-03-24T00:00:00.000 | F432: of:=IF([.G431] < [.$B$25];CEILING([.G431]*[.$B$3];1);0) -> 0 | G432: of:=IF([.G431] < [.$B$25];SUM([.F$3:.F432]);[.$B$25]) -> 222350062.5 | H432: of:=IF((ROW() - [.$B$21] < 3);0;FLOOR(IFERROR(OFFSET([.$F432];-1*[.$B$21];0 );0) * [.$B$10])) -> 0 | I432: of:=SUM(INDEX([.H$1:.H$736];MAX(ROW()+(-1*[.$B$22])+1;3);1):INDEX([.H$1:.H$736];ROW();1)) -> 0 | J432: of:=IF([.I432] > [.$B$20];[.I432]-[.$B$20];0) -> 0 | K432: of:=IF([.J432] > 0; ROUND([.$B$23] *MIN([.J432];[.H432])); 0) -> 0 | L432: of:=IF((ROW() - [.$B$13] < 3);0;FLOOR(IFERROR(OFFSET([.$F432];-1*[.$B$13];0 );0) * [.$B$14])) -> 0 | M432: of:=SUM([.L$3:.L432]) -> 6061951
D433: of:=[.D432]+1 -> 2021-03-25T00:00:00.000 | F433: of:=IF([.G432] < [.$B$25];CEILING([.G432]*[.$B$3];1);0) -> 0 | G433: of:=IF([.G432] < [.$B$25];SUM([.F$3:.F433]);[.$B$25]) -> 222350062.5 | H433: of:=IF((ROW() - [.$B$21] < 3);0;FLOOR(IFERROR(OFFSET([.$F433];-1*[.$B$21];0 );0) * [.$B$10])) -> 0 | I433: of:=SUM(INDEX([.H$1:.H$736];MAX(ROW()+(-1*[.$B$22])+1;3);1):INDEX([.H$1:.H$736];ROW();1)) -> 0 | J433: of:=IF([.I433] > [.$B$20];[.I433]-[.$B$20];0) -> 0 | K433: of:=IF([.J433] > 0; ROUND([.$B$23] *MIN([.J433];[.H433])); 0) -> 0 | L433: of:=IF((ROW() - [.$B$13] < 3);0;FLOOR(IFERROR(OFFSET([.$F433];-1*[.$B$13];0 );0) * [.$B$14])) -> 0 | M433: of:=SUM([.L$3:.L433]) -> 6061951
D434: of:=[.D433]+1 -> 2021-03-26T00:00:00.000 | F434: of:=IF([.G433] < [.$B$25];CEILING([.G433]*[.$B$3];1);0) -> 0 | G434: of:=IF([.G433] < [.$B$25];SUM([.F$3:.F434]);[.$B$25]) -> 222350062.5 | H434: of:=IF((ROW() - [.$B$21] < 3);0;FLOOR(IFERROR(OFFSET([.$F434];-1*[.$B$21];0 );0) * [.$B$10])) -> 0 | I434: of:=SUM(INDEX([.H$1:.H$736];MAX(ROW()+(-1*[.$B$22])+1;3);1):INDEX([.H$1:.H$736];ROW();1)) -> 0 | J434: of:=IF([.I434] > [.$B$20];[.I434]-[.$B$20];0) -> 0 | K434: of:=IF([.J434] > 0; ROUND([.$B$23] *MIN([.J434];[.H434])); 0) -> 0 | L434: of:=IF((ROW() - [.$B$13] < 3);0;FLOOR(IFERROR(OFFSET([.$F434];-1*[.$B$13];0 );0) * [.$B$14])) -> 0 | M434: of:=SUM([.L$3:.L434]) -> 6061951
D435: of:=[.D434]+1 -> 2021-03-27T00:00:00.000 | F435: of:=IF([.G434] < [.$B$25];CEILING([.G434]*[.$B$3];1);0) -> 0 | G435: of:=IF([.G434] < [.$B$25];SUM([.F$3:.F435]);[.$B$25]) -> 222350062.5 | H435: of:=IF((ROW() - [.$B$21] < 3);0;FLOOR(IFERROR(OFFSET([.$F435];-1*[.$B$21];0 );0) * [.$B$10])) -> 0 | I435: of:=SUM(INDEX([.H$1:.H$736];MAX(ROW()+(-1*[.$B$22])+1;3);1):INDEX([.H$1:.H$736];ROW();1)) -> 0 | J435: of:=IF([.I435] > [.$B$20];[.I435]-[.$B$20];0) -> 0 | K435: of:=IF([.J435] > 0; ROUND([.$B$23] *MIN([.J435];[.H435])); 0) -> 0 | L435: of:=IF((ROW() - [.$B$13] < 3);0;FLOOR(IFERROR(OFFSET([.$F435];-1*[.$B$13];0 );0) * [.$B$14])) -> 0 | M435: of:=SUM([.L$3:.L435]) -> 6061951
D436: of:=[.D435]+1 -> 2021-03-28T00:00:00.000 | F436: of:=IF([.G435] < [.$B$25];CEILING([.G435]*[.$B$3];1);0) -> 0 | G436: of:=IF([.G435] < [.$B$25];SUM([.F$3:.F436]);[.$B$25]) -> 222350062.5 | H436: of:=IF((ROW() - [.$B$21] < 3);0;FLOOR(IFERROR(OFFSET([.$F436];-1*[.$B$21];0 );0) * [.$B$10])) -> 0 | I436: of:=SUM(INDEX([.H$1:.H$736];MAX(ROW()+(-1*[.$B$22])+1;3);1):INDEX([.H$1:.H$736];ROW();1)) -> 0 | J436: of:=IF([.I436] > [.$B$20];[.I436]-[.$B$20];0) -> 0 | K436: of:=IF([.J436] > 0; ROUND([.$B$23] *MIN([.J436];[.H436])); 0) -> 0 | L436: of:=IF((ROW() - [.$B$13] < 3);0;FLOOR(IFERROR(OFFSET([.$F436];-1*[.$B$13];0 );0) * [.$B$14])) -> 0 | M436: of:=SUM([.L$3:.L436]) -> 6061951
D437: of:=[.D436]+1 -> 2021-03-29T00:00:00.000 | F437: of:=IF([.G436] < [.$B$25];CEILING([.G436]*[.$B$3];1);0) -> 0 | G437: of:=IF([.G436] < [.$B$25];SUM([.F$3:.F437]);[.$B$25]) -> 222350062.5 | H437: of:=IF((ROW() - [.$B$21] < 3);0;FLOOR(IFERROR(OFFSET([.$F437];-1*[.$B$21];0 );0) * [.$B$10])) -> 0 | I437: of:=SUM(INDEX([.H$1:.H$736];MAX(ROW()+(-1*[.$B$22])+1;3);1):INDEX([.H$1:.H$736];ROW();1)) -> 0 | J437: of:=IF([.I437] > [.$B$20];[.I437]-[.$B$20];0) -> 0 | K437: of:=IF([.J437] > 0; ROUND([.$B$23] *MIN([.J437];[.H437])); 0) -> 0 | L437: of:=IF((ROW() - [.$B$13] < 3);0;FLOOR(IFERROR(OFFSET([.$F437];-1*[.$B$13];0 );0) * [.$B$14])) -> 0 | M437: of:=SUM([.L$3:.L437]) -> 6061951
D438: of:=[.D437]+1 -> 2021-03-30T00:00:00.000 | F438: of:=IF([.G437] < [.$B$25];CEILING([.G437]*[.$B$3];1);0) -> 0 | G438: of:=IF([.G437] < [.$B$25];SUM([.F$3:.F438]);[.$B$25]) -> 222350062.5 | H438: of:=IF((ROW() - [.$B$21] < 3);0;FLOOR(IFERROR(OFFSET([.$F438];-1*[.$B$21];0 );0) * [.$B$10])) -> 0 | I438: of:=SUM(INDEX([.H$1:.H$736];MAX(ROW()+(-1*[.$B$22])+1;3);1):INDEX([.H$1:.H$736];ROW();1)) -> 0 | J438: of:=IF([.I438] > [.$B$20];[.I438]-[.$B$20];0) -> 0 | K438: of:=IF([.J438] > 0; ROUND([.$B$23] *MIN([.J438];[.H438])); 0) -> 0 | L438: of:=IF((ROW() - [.$B$13] < 3);0;FLOOR(IFERROR(OFFSET([.$F438];-1*[.$B$13];0 );0) * [.$B$14])) -> 0 | M438: of:=SUM([.L$3:.L438]) -> 6061951
D439: of:=[.D438]+1 -> 2021-03-31T00:00:00.000 | F439: of:=IF([.G438] < [.$B$25];CEILING([.G438]*[.$B$3];1);0) -> 0 | G439: of:=IF([.G438] < [.$B$25];SUM([.F$3:.F439]);[.$B$25]) -> 222350062.5 | H439: of:=IF((ROW() - [.$B$21] < 3);0;FLOOR(IFERROR(OFFSET([.$F439];-1*[.$B$21];0 );0) * [.$B$10])) -> 0 | I439: of:=SUM(INDEX([.H$1:.H$736];MAX(ROW()+(-1*[.$B$22])+1;3);1):INDEX([.H$1:.H$736];ROW();1)) -> 0 | J439: of:=IF([.I439] > [.$B$20];[.I439]-[.$B$20];0) -> 0 | K439: of:=IF([.J439] > 0; ROUND([.$B$23] *MIN([.J439];[.H439])); 0) -> 0 | L439: of:=IF((ROW() - [.$B$13] < 3);0;FLOOR(IFERROR(OFFSET([.$F439];-1*[.$B$13];0 );0) * [.$B$14])) -> 0 | M439: of:=SUM([.L$3:.L439]) -> 6061951
D440: of:=[.D439]+1 -> 2021-04-01T00:00:00.000 | F440: of:=IF([.G439] < [.$B$25];CEILING([.G439]*[.$B$3];1);0) -> 0 | G440: of:=IF([.G439] < [.$B$25];SUM([.F$3:.F440]);[.$B$25]) -> 222350062.5 | H440: of:=IF((ROW() - [.$B$21] < 3);0;FLOOR(IFERROR(OFFSET([.$F440];-1*[.$B$21];0 );0) * [.$B$10])) -> 0 | I440: of:=SUM(INDEX([.H$1:.H$736];MAX(ROW()+(-1*[.$B$22])+1;3);1):INDEX([.H$1:.H$736];ROW();1)) -> 0 | J440: of:=IF([.I440] > [.$B$20];[.I440]-[.$B$20];0) -> 0 | K440: of:=IF([.J440] > 0; ROUND([.$B$23] *MIN([.J440];[.H440])); 0) -> 0 | L440: of:=IF((ROW() - [.$B$13] < 3);0;FLOOR(IFERROR(OFFSET([.$F440];-1*[.$B$13];0 );0) * [.$B$14])) -> 0 | M440: of:=SUM([.L$3:.L440]) -> 6061951
D441: of:=[.D440]+1 -> 2021-04-02T00:00:00.000 | F441: of:=IF([.G440] < [.$B$25];CEILING([.G440]*[.$B$3];1);0) -> 0 | G441: of:=IF([.G440] < [.$B$25];SUM([.F$3:.F441]);[.$B$25]) -> 222350062.5 | H441: of:=IF((ROW() - [.$B$21] < 3);0;FLOOR(IFERROR(OFFSET([.$F441];-1*[.$B$21];0 );0) * [.$B$10])) -> 0 | I441: of:=SUM(INDEX([.H$1:.H$736];MAX(ROW()+(-1*[.$B$22])+1;3);1):INDEX([.H$1:.H$736];ROW();1)) -> 0 | J441: of:=IF([.I441] > [.$B$20];[.I441]-[.$B$20];0) -> 0 | K441: of:=IF([.J441] > 0; ROUND([.$B$23] *MIN([.J441];[.H441])); 0) -> 0 | L441: of:=IF((ROW() - [.$B$13] < 3);0;FLOOR(IFERROR(OFFSET([.$F441];-1*[.$B$13];0 );0) * [.$B$14])) -> 0 | M441: of:=SUM([.L$3:.L441]) -> 6061951
D442: of:=[.D441]+1 -> 2021-04-03T00:00:00.000 | F442: of:=IF([.G441] < [.$B$25];CEILING([.G441]*[.$B$3];1);0) -> 0 | G442: of:=IF([.G441] < [.$B$25];SUM([.F$3:.F442]);[.$B$25]) -> 222350062.5 | H442: of:=IF((ROW() - [.$B$21] < 3);0;FLOOR(IFERROR(OFFSET([.$F442];-1*[.$B$21];0 );0) * [.$B$10])) -> 0 | I442: of:=SUM(INDEX([.H$1:.H$736];MAX(ROW()+(-1*[.$B$22])+1;3);1):INDEX([.H$1:.H$736];ROW();1)) -> 0 | J442: of:=IF([.I442] > [.$B$20];[.I442]-[.$B$20];0) -> 0 | K442: of:=IF([.J442] > 0; ROUND([.$B$23] *MIN([.J442];[.H442])); 0) -> 0 | L442: of:=IF((ROW() - [.$B$13] < 3);0;FLOOR(IFERROR(OFFSET([.$F442];-1*[.$B$13];0 );0) * [.$B$14])) -> 0 | M442: of:=SUM([.L$3:.L442]) -> 6061951
D443: of:=[.D442]+1 -> 2021-04-04T00:00:00.000 | F443: of:=IF([.G442] < [.$B$25];CEILING([.G442]*[.$B$3];1);0) -> 0 | G443: of:=IF([.G442] < [.$B$25];SUM([.F$3:.F443]);[.$B$25]) -> 222350062.5 | H443: of:=IF((ROW() - [.$B$21] < 3);0;FLOOR(IFERROR(OFFSET([.$F443];-1*[.$B$21];0 );0) * [.$B$10])) -> 0 | I443: of:=SUM(INDEX([.H$1:.H$736];MAX(ROW()+(-1*[.$B$22])+1;3);1):INDEX([.H$1:.H$736];ROW();1)) -> 0 | J443: of:=IF([.I443] > [.$B$20];[.I443]-[.$B$20];0) -> 0 | K443: of:=IF([.J443] > 0; ROUND([.$B$23] *MIN([.J443];[.H443])); 0) -> 0 | L443: of:=IF((ROW() - [.$B$13] < 3);0;FLOOR(IFERROR(OFFSET([.$F443];-1*[.$B$13];0 );0) * [.$B$14])) -> 0 | M443: of:=SUM([.L$3:.L443]) -> 6061951
D444: of:=[.D443]+1 -> 2021-04-05T00:00:00.000 | F444: of:=IF([.G443] < [.$B$25];CEILING([.G443]*[.$B$3];1);0) -> 0 | G444: of:=IF([.G443] < [.$B$25];SUM([.F$3:.F444]);[.$B$25]) -> 222350062.5 | H444: of:=IF((ROW() - [.$B$21] < 3);0;FLOOR(IFERROR(OFFSET([.$F444];-1*[.$B$21];0 );0) * [.$B$10])) -> 0 | I444: of:=SUM(INDEX([.H$1:.H$736];MAX(ROW()+(-1*[.$B$22])+1;3);1):INDEX([.H$1:.H$736];ROW();1)) -> 0 | J444: of:=IF([.I444] > [.$B$20];[.I444]-[.$B$20];0) -> 0 | K444: of:=IF([.J444] > 0; ROUND([.$B$23] *MIN([.J444];[.H444])); 0) -> 0 | L444: of:=IF((ROW() - [.$B$13] < 3);0;FLOOR(IFERROR(OFFSET([.$F444];-1*[.$B$13];0 );0) * [.$B$14])) -> 0 | M444: of:=SUM([.L$3:.L444]) -> 6061951
D445: of:=[.D444]+1 -> 2021-04-06T00:00:00.000 | F445: of:=IF([.G444] < [.$B$25];CEILING([.G444]*[.$B$3];1);0) -> 0 | G445: of:=IF([.G444] < [.$B$25];SUM([.F$3:.F445]);[.$B$25]) -> 222350062.5 | H445: of:=IF((ROW() - [.$B$21] < 3);0;FLOOR(IFERROR(OFFSET([.$F445];-1*[.$B$21];0 );0) * [.$B$10])) -> 0 | I445: of:=SUM(INDEX([.H$1:.H$736];MAX(ROW()+(-1*[.$B$22])+1;3);1):INDEX([.H$1:.H$736];ROW();1)) -> 0 | J445: of:=IF([.I445] > [.$B$20];[.I445]-[.$B$20];0) -> 0 | K445: of:=IF([.J445] > 0; ROUND([.$B$23] *MIN([.J445];[.H445])); 0) -> 0 | L445: of:=IF((ROW() - [.$B$13] < 3);0;FLOOR(IFERROR(OFFSET([.$F445];-1*[.$B$13];0 );0) * [.$B$14])) -> 0 | M445: of:=SUM([.L$3:.L445]) -> 6061951
D446: of:=[.D445]+1 -> 2021-04-07T00:00:00.000 | F446: of:=IF([.G445] < [.$B$25];CEILING([.G445]*[.$B$3];1);0) -> 0 | G446: of:=IF([.G445] < [.$B$25];SUM([.F$3:.F446]);[.$B$25]) -> 222350062.5 | H446: of:=IF((ROW() - [.$B$21] < 3);0;FLOOR(IFERROR(OFFSET([.$F446];-1*[.$B$21];0 );0) * [.$B$10])) -> 0 | I446: of:=SUM(INDEX([.H$1:.H$736];MAX(ROW()+(-1*[.$B$22])+1;3);1):INDEX([.H$1:.H$736];ROW();1)) -> 0 | J446: of:=IF([.I446] > [.$B$20];[.I446]-[.$B$20];0) -> 0 | K446: of:=IF([.J446] > 0; ROUND([.$B$23] *MIN([.J446];[.H446])); 0) -> 0 | L446: of:=IF((ROW() - [.$B$13] < 3);0;FLOOR(IFERROR(OFFSET([.$F446];-1*[.$B$13];0 );0) * [.$B$14])) -> 0 | M446: of:=SUM([.L$3:.L446]) -> 6061951
D447: of:=[.D446]+1 -> 2021-04-08T00:00:00.000 | F447: of:=IF([.G446] < [.$B$25];CEILING([.G446]*[.$B$3];1);0) -> 0 | G447: of:=IF([.G446] < [.$B$25];SUM([.F$3:.F447]);[.$B$25]) -> 222350062.5 | H447: of:=IF((ROW() - [.$B$21] < 3);0;FLOOR(IFERROR(OFFSET([.$F447];-1*[.$B$21];0 );0) * [.$B$10])) -> 0 | I447: of:=SUM(INDEX([.H$1:.H$736];MAX(ROW()+(-1*[.$B$22])+1;3);1):INDEX([.H$1:.H$736];ROW();1)) -> 0 | J447: of:=IF([.I447] > [.$B$20];[.I447]-[.$B$20];0) -> 0 | K447: of:=IF([.J447] > 0; ROUND([.$B$23] *MIN([.J447];[.H447])); 0) -> 0 | L447: of:=IF((ROW() - [.$B$13] < 3);0;FLOOR(IFERROR(OFFSET([.$F447];-1*[.$B$13];0 );0) * [.$B$14])) -> 0 | M447: of:=SUM([.L$3:.L447]) -> 6061951
D448: of:=[.D447]+1 -> 2021-04-09T00:00:00.000 | F448: of:=IF([.G447] < [.$B$25];CEILING([.G447]*[.$B$3];1);0) -> 0 | G448: of:=IF([.G447] < [.$B$25];SUM([.F$3:.F448]);[.$B$25]) -> 222350062.5 | H448: of:=IF((ROW() - [.$B$21] < 3);0;FLOOR(IFERROR(OFFSET([.$F448];-1*[.$B$21];0 );0) * [.$B$10])) -> 0 | I448: of:=SUM(INDEX([.H$1:.H$736];MAX(ROW()+(-1*[.$B$22])+1;3);1):INDEX([.H$1:.H$736];ROW();1)) -> 0 | J448: of:=IF([.I448] > [.$B$20];[.I448]-[.$B$20];0) -> 0 | K448: of:=IF([.J448] > 0; ROUND([.$B$23] *MIN([.J448];[.H448])); 0) -> 0 | L448: of:=IF((ROW() - [.$B$13] < 3);0;FLOOR(IFERROR(OFFSET([.$F448];-1*[.$B$13];0 );0) * [.$B$14])) -> 0 | M448: of:=SUM([.L$3:.L448]) -> 6061951
D449: of:=[.D448]+1 -> 2021-04-10T00:00:00.000 | F449: of:=IF([.G448] < [.$B$25];CEILING([.G448]*[.$B$3];1);0) -> 0 | G449: of:=IF([.G448] < [.$B$25];SUM([.F$3:.F449]);[.$B$25]) -> 222350062.5 | H449: of:=IF((ROW() - [.$B$21] < 3);0;FLOOR(IFERROR(OFFSET([.$F449];-1*[.$B$21];0 );0) * [.$B$10])) -> 0 | I449: of:=SUM(INDEX([.H$1:.H$736];MAX(ROW()+(-1*[.$B$22])+1;3);1):INDEX([.H$1:.H$736];ROW();1)) -> 0 | J449: of:=IF([.I449] > [.$B$20];[.I449]-[.$B$20];0) -> 0 | K449: of:=IF([.J449] > 0; ROUND([.$B$23] *MIN([.J449];[.H449])); 0) -> 0 | L449: of:=IF((ROW() - [.$B$13] < 3);0;FLOOR(IFERROR(OFFSET([.$F449];-1*[.$B$13];0 );0) * [.$B$14])) -> 0 | M449: of:=SUM([.L$3:.L449]) -> 6061951
D450: of:=[.D449]+1 -> 2021-04-11T00:00:00.000 | F450: of:=IF([.G449] < [.$B$25];CEILING([.G449]*[.$B$3];1);0) -> 0 | G450: of:=IF([.G449] < [.$B$25];SUM([.F$3:.F450]);[.$B$25]) -> 222350062.5 | H450: of:=IF((ROW() - [.$B$21] < 3);0;FLOOR(IFERROR(OFFSET([.$F450];-1*[.$B$21];0 );0) * [.$B$10])) -> 0 | I450: of:=SUM(INDEX([.H$1:.H$736];MAX(ROW()+(-1*[.$B$22])+1;3);1):INDEX([.H$1:.H$736];ROW();1)) -> 0 | J450: of:=IF([.I450] > [.$B$20];[.I450]-[.$B$20];0) -> 0 | K450: of:=IF([.J450] > 0; ROUND([.$B$23] *MIN([.J450];[.H450])); 0) -> 0 | L450: of:=IF((ROW() - [.$B$13] < 3);0;FLOOR(IFERROR(OFFSET([.$F450];-1*[.$B$13];0 );0) * [.$B$14])) -> 0 | M450: of:=SUM([.L$3:.L450]) -> 6061951
D451: of:=[.D450]+1 -> 2021-04-12T00:00:00.000 | F451: of:=IF([.G450] < [.$B$25];CEILING([.G450]*[.$B$3];1);0) -> 0 | G451: of:=IF([.G450] < [.$B$25];SUM([.F$3:.F451]);[.$B$25]) -> 222350062.5 | H451: of:=IF((ROW() - [.$B$21] < 3);0;FLOOR(IFERROR(OFFSET([.$F451];-1*[.$B$21];0 );0) * [.$B$10])) -> 0 | I451: of:=SUM(INDEX([.H$1:.H$736];MAX(ROW()+(-1*[.$B$22])+1;3);1):INDEX([.H$1:.H$736];ROW();1)) -> 0 | J451: of:=IF([.I451] > [.$B$20];[.I451]-[.$B$20];0) -> 0 | K451: of:=IF([.J451] > 0; ROUND([.$B$23] *MIN([.J451];[.H451])); 0) -> 0 | L451: of:=IF((ROW() - [.$B$13] < 3);0;FLOOR(IFERROR(OFFSET([.$F451];-1*[.$B$13];0 );0) * [.$B$14])) -> 0 | M451: of:=SUM([.L$3:.L451]) -> 6061951
D452: of:=[.D451]+1 -> 2021-04-13T00:00:00.000 | F452: of:=IF([.G451] < [.$B$25];CEILING([.G451]*[.$B$3];1);0) -> 0 | G452: of:=IF([.G451] < [.$B$25];SUM([.F$3:.F452]);[.$B$25]) -> 222350062.5 | H452: of:=IF((ROW() - [.$B$21] < 3);0;FLOOR(IFERROR(OFFSET([.$F452];-1*[.$B$21];0 );0) * [.$B$10])) -> 0 | I452: of:=SUM(INDEX([.H$1:.H$736];MAX(ROW()+(-1*[.$B$22])+1;3);1):INDEX([.H$1:.H$736];ROW();1)) -> 0 | J452: of:=IF([.I452] > [.$B$20];[.I452]-[.$B$20];0) -> 0 | K452: of:=IF([.J452] > 0; ROUND([.$B$23] *MIN([.J452];[.H452])); 0) -> 0 | L452: of:=IF((ROW() - [.$B$13] < 3);0;FLOOR(IFERROR(OFFSET([.$F452];-1*[.$B$13];0 );0) * [.$B$14])) -> 0 | M452: of:=SUM([.L$3:.L452]) -> 6061951
D453: of:=[.D452]+1 -> 2021-04-14T00:00:00.000 | F453: of:=IF([.G452] < [.$B$25];CEILING([.G452]*[.$B$3];1);0) -> 0 | G453: of:=IF([.G452] < [.$B$25];SUM([.F$3:.F453]);[.$B$25]) -> 222350062.5 | H453: of:=IF((ROW() - [.$B$21] < 3);0;FLOOR(IFERROR(OFFSET([.$F453];-1*[.$B$21];0 );0) * [.$B$10])) -> 0 | I453: of:=SUM(INDEX([.H$1:.H$736];MAX(ROW()+(-1*[.$B$22])+1;3);1):INDEX([.H$1:.H$736];ROW();1)) -> 0 | J453: of:=IF([.I453] > [.$B$20];[.I453]-[.$B$20];0) -> 0 | K453: of:=IF([.J453] > 0; ROUND([.$B$23] *MIN([.J453];[.H453])); 0) -> 0 | L453: of:=IF((ROW() - [.$B$13] < 3);0;FLOOR(IFERROR(OFFSET([.$F453];-1*[.$B$13];0 );0) * [.$B$14])) -> 0 | M453: of:=SUM([.L$3:.L453]) -> 6061951
D454: of:=[.D453]+1 -> 2021-04-15T00:00:00.000 | F454: of:=IF([.G453] < [.$B$25];CEILING([.G453]*[.$B$3];1);0) -> 0 | G454: of:=IF([.G453] < [.$B$25];SUM([.F$3:.F454]);[.$B$25]) -> 222350062.5 | H454: of:=IF((ROW() - [.$B$21] < 3);0;FLOOR(IFERROR(OFFSET([.$F454];-1*[.$B$21];0 );0) * [.$B$10])) -> 0 | I454: of:=SUM(INDEX([.H$1:.H$736];MAX(ROW()+(-1*[.$B$22])+1;3);1):INDEX([.H$1:.H$736];ROW();1)) -> 0 | J454: of:=IF([.I454] > [.$B$20];[.I454]-[.$B$20];0) -> 0 | K454: of:=IF([.J454] > 0; ROUND([.$B$23] *MIN([.J454];[.H454])); 0) -> 0 | L454: of:=IF((ROW() - [.$B$13] < 3);0;FLOOR(IFERROR(OFFSET([.$F454];-1*[.$B$13];0 );0) * [.$B$14])) -> 0 | M454: of:=SUM([.L$3:.L454]) -> 6061951
D455: of:=[.D454]+1 -> 2021-04-16T00:00:00.000 | F455: of:=IF([.G454] < [.$B$25];CEILING([.G454]*[.$B$3];1);0) -> 0 | G455: of:=IF([.G454] < [.$B$25];SUM([.F$3:.F455]);[.$B$25]) -> 222350062.5 | H455: of:=IF((ROW() - [.$B$21] < 3);0;FLOOR(IFERROR(OFFSET([.$F455];-1*[.$B$21];0 );0) * [.$B$10])) -> 0 | I455: of:=SUM(INDEX([.H$1:.H$736];MAX(ROW()+(-1*[.$B$22])+1;3);1):INDEX([.H$1:.H$736];ROW();1)) -> 0 | J455: of:=IF([.I455] > [.$B$20];[.I455]-[.$B$20];0) -> 0 | K455: of:=IF([.J455] > 0; ROUND([.$B$23] *MIN([.J455];[.H455])); 0) -> 0 | L455: of:=IF((ROW() - [.$B$13] < 3);0;FLOOR(IFERROR(OFFSET([.$F455];-1*[.$B$13];0 );0) * [.$B$14])) -> 0 | M455: of:=SUM([.L$3:.L455]) -> 6061951
D456: of:=[.D455]+1 -> 2021-04-17T00:00:00.000 | F456: of:=IF([.G455] < [.$B$25];CEILING([.G455]*[.$B$3];1);0) -> 0 | G456: of:=IF([.G455] < [.$B$25];SUM([.F$3:.F456]);[.$B$25]) -> 222350062.5 | H456: of:=IF((ROW() - [.$B$21] < 3);0;FLOOR(IFERROR(OFFSET([.$F456];-1*[.$B$21];0 );0) * [.$B$10])) -> 0 | I456: of:=SUM(INDEX([.H$1:.H$736];MAX(ROW()+(-1*[.$B$22])+1;3);1):INDEX([.H$1:.H$736];ROW();1)) -> 0 | J456: of:=IF([.I456] > [.$B$20];[.I456]-[.$B$20];0) -> 0 | K456: of:=IF([.J456] > 0; ROUND([.$B$23] *MIN([.J456];[.H456])); 0) -> 0 | L456: of:=IF((ROW() - [.$B$13] < 3);0;FLOOR(IFERROR(OFFSET([.$F456];-1*[.$B$13];0 );0) * [.$B$14])) -> 0 | M456: of:=SUM([.L$3:.L456]) -> 6061951
D457: of:=[.D456]+1 -> 2021-04-18T00:00:00.000 | F457: of:=IF([.G456] < [.$B$25];CEILING([.G456]*[.$B$3];1);0) -> 0 | G457: of:=IF([.G456] < [.$B$25];SUM([.F$3:.F457]);[.$B$25]) -> 222350062.5 | H457: of:=IF((ROW() - [.$B$21] < 3);0;FLOOR(IFERROR(OFFSET([.$F457];-1*[.$B$21];0 );0) * [.$B$10])) -> 0 | I457: of:=SUM(INDEX([.H$1:.H$736];MAX(ROW()+(-1*[.$B$22])+1;3);1):INDEX([.H$1:.H$736];ROW();1)) -> 0 | J457: of:=IF([.I457] > [.$B$20];[.I457]-[.$B$20];0) -> 0 | K457: of:=IF([.J457] > 0; ROUND([.$B$23] *MIN([.J457];[.H457])); 0) -> 0 | L457: of:=IF((ROW() - [.$B$13] < 3);0;FLOOR(IFERROR(OFFSET([.$F457];-1*[.$B$13];0 );0) * [.$B$14])) -> 0 | M457: of:=SUM([.L$3:.L457]) -> 6061951
D458: of:=[.D457]+1 -> 2021-04-19T00:00:00.000 | F458: of:=IF([.G457] < [.$B$25];CEILING([.G457]*[.$B$3];1);0) -> 0 | G458: of:=IF([.G457] < [.$B$25];SUM([.F$3:.F458]);[.$B$25]) -> 222350062.5 | H458: of:=IF((ROW() - [.$B$21] < 3);0;FLOOR(IFERROR(OFFSET([.$F458];-1*[.$B$21];0 );0) * [.$B$10])) -> 0 | I458: of:=SUM(INDEX([.H$1:.H$736];MAX(ROW()+(-1*[.$B$22])+1;3);1):INDEX([.H$1:.H$736];ROW();1)) -> 0 | J458: of:=IF([.I458] > [.$B$20];[.I458]-[.$B$20];0) -> 0 | K458: of:=IF([.J458] > 0; ROUND([.$B$23] *MIN([.J458];[.H458])); 0) -> 0 | L458: of:=IF((ROW() - [.$B$13] < 3);0;FLOOR(IFERROR(OFFSET([.$F458];-1*[.$B$13];0 );0) * [.$B$14])) -> 0 | M458: of:=SUM([.L$3:.L458]) -> 6061951
D459: of:=[.D458]+1 -> 2021-04-20T00:00:00.000 | F459: of:=IF([.G458] < [.$B$25];CEILING([.G458]*[.$B$3];1);0) -> 0 | G459: of:=IF([.G458] < [.$B$25];SUM([.F$3:.F459]);[.$B$25]) -> 222350062.5 | H459: of:=IF((ROW() - [.$B$21] < 3);0;FLOOR(IFERROR(OFFSET([.$F459];-1*[.$B$21];0 );0) * [.$B$10])) -> 0 | I459: of:=SUM(INDEX([.H$1:.H$736];MAX(ROW()+(-1*[.$B$22])+1;3);1):INDEX([.H$1:.H$736];ROW();1)) -> 0 | J459: of:=IF([.I459] > [.$B$20];[.I459]-[.$B$20];0) -> 0 | K459: of:=IF([.J459] > 0; ROUND([.$B$23] *MIN([.J459];[.H459])); 0) -> 0 | L459: of:=IF((ROW() - [.$B$13] < 3);0;FLOOR(IFERROR(OFFSET([.$F459];-1*[.$B$13];0 );0) * [.$B$14])) -> 0 | M459: of:=SUM([.L$3:.L459]) -> 6061951
D460: of:=[.D459]+1 -> 2021-04-21T00:00:00.000 | F460: of:=IF([.G459] < [.$B$25];CEILING([.G459]*[.$B$3];1);0) -> 0 | G460: of:=IF([.G459] < [.$B$25];SUM([.F$3:.F460]);[.$B$25]) -> 222350062.5 | H460: of:=IF((ROW() - [.$B$21] < 3);0;FLOOR(IFERROR(OFFSET([.$F460];-1*[.$B$21];0 );0) * [.$B$10])) -> 0 | I460: of:=SUM(INDEX([.H$1:.H$736];MAX(ROW()+(-1*[.$B$22])+1;3);1):INDEX([.H$1:.H$736];ROW();1)) -> 0 | J460: of:=IF([.I460] > [.$B$20];[.I460]-[.$B$20];0) -> 0 | K460: of:=IF([.J460] > 0; ROUND([.$B$23] *MIN([.J460];[.H460])); 0) -> 0 | L460: of:=IF((ROW() - [.$B$13] < 3);0;FLOOR(IFERROR(OFFSET([.$F460];-1*[.$B$13];0 );0) * [.$B$14])) -> 0 | M460: of:=SUM([.L$3:.L460]) -> 6061951
D461: of:=[.D460]+1 -> 2021-04-22T00:00:00.000 | F461: of:=IF([.G460] < [.$B$25];CEILING([.G460]*[.$B$3];1);0) -> 0 | G461: of:=IF([.G460] < [.$B$25];SUM([.F$3:.F461]);[.$B$25]) -> 222350062.5 | H461: of:=IF((ROW() - [.$B$21] < 3);0;FLOOR(IFERROR(OFFSET([.$F461];-1*[.$B$21];0 );0) * [.$B$10])) -> 0 | I461: of:=SUM(INDEX([.H$1:.H$736];MAX(ROW()+(-1*[.$B$22])+1;3);1):INDEX([.H$1:.H$736];ROW();1)) -> 0 | J461: of:=IF([.I461] > [.$B$20];[.I461]-[.$B$20];0) -> 0 | K461: of:=IF([.J461] > 0; ROUND([.$B$23] *MIN([.J461];[.H461])); 0) -> 0 | L461: of:=IF((ROW() - [.$B$13] < 3);0;FLOOR(IFERROR(OFFSET([.$F461];-1*[.$B$13];0 );0) * [.$B$14])) -> 0 | M461: of:=SUM([.L$3:.L461]) -> 6061951
D462: of:=[.D461]+1 -> 2021-04-23T00:00:00.000 | F462: of:=IF([.G461] < [.$B$25];CEILING([.G461]*[.$B$3];1);0) -> 0 | G462: of:=IF([.G461] < [.$B$25];SUM([.F$3:.F462]);[.$B$25]) -> 222350062.5 | H462: of:=IF((ROW() - [.$B$21] < 3);0;FLOOR(IFERROR(OFFSET([.$F462];-1*[.$B$21];0 );0) * [.$B$10])) -> 0 | I462: of:=SUM(INDEX([.H$1:.H$736];MAX(ROW()+(-1*[.$B$22])+1;3);1):INDEX([.H$1:.H$736];ROW();1)) -> 0 | J462: of:=IF([.I462] > [.$B$20];[.I462]-[.$B$20];0) -> 0 | K462: of:=IF([.J462] > 0; ROUND([.$B$23] *MIN([.J462];[.H462])); 0) -> 0 | L462: of:=IF((ROW() - [.$B$13] < 3);0;FLOOR(IFERROR(OFFSET([.$F462];-1*[.$B$13];0 );0) * [.$B$14])) -> 0 | M462: of:=SUM([.L$3:.L462]) -> 6061951
D463: of:=[.D462]+1 -> 2021-04-24T00:00:00.000 | F463: of:=IF([.G462] < [.$B$25];CEILING([.G462]*[.$B$3];1);0) -> 0 | G463: of:=IF([.G462] < [.$B$25];SUM([.F$3:.F463]);[.$B$25]) -> 222350062.5 | H463: of:=IF((ROW() - [.$B$21] < 3);0;FLOOR(IFERROR(OFFSET([.$F463];-1*[.$B$21];0 );0) * [.$B$10])) -> 0 | I463: of:=SUM(INDEX([.H$1:.H$736];MAX(ROW()+(-1*[.$B$22])+1;3);1):INDEX([.H$1:.H$736];ROW();1)) -> 0 | J463: of:=IF([.I463] > [.$B$20];[.I463]-[.$B$20];0) -> 0 | K463: of:=IF([.J463] > 0; ROUND([.$B$23] *MIN([.J463];[.H463])); 0) -> 0 | L463: of:=IF((ROW() - [.$B$13] < 3);0;FLOOR(IFERROR(OFFSET([.$F463];-1*[.$B$13];0 );0) * [.$B$14])) -> 0 | M463: of:=SUM([.L$3:.L463]) -> 6061951
D464: of:=[.D463]+1 -> 2021-04-25T00:00:00.000 | F464: of:=IF([.G463] < [.$B$25];CEILING([.G463]*[.$B$3];1);0) -> 0 | G464: of:=IF([.G463] < [.$B$25];SUM([.F$3:.F464]);[.$B$25]) -> 222350062.5 | H464: of:=IF((ROW() - [.$B$21] < 3);0;FLOOR(IFERROR(OFFSET([.$F464];-1*[.$B$21];0 );0) * [.$B$10])) -> 0 | I464: of:=SUM(INDEX([.H$1:.H$736];MAX(ROW()+(-1*[.$B$22])+1;3);1):INDEX([.H$1:.H$736];ROW();1)) -> 0 | J464: of:=IF([.I464] > [.$B$20];[.I464]-[.$B$20];0) -> 0 | K464: of:=IF([.J464] > 0; ROUND([.$B$23] *MIN([.J464];[.H464])); 0) -> 0 | L464: of:=IF((ROW() - [.$B$13] < 3);0;FLOOR(IFERROR(OFFSET([.$F464];-1*[.$B$13];0 );0) * [.$B$14])) -> 0 | M464: of:=SUM([.L$3:.L464]) -> 6061951
D465: of:=[.D464]+1 -> 2021-04-26T00:00:00.000 | F465: of:=IF([.G464] < [.$B$25];CEILING([.G464]*[.$B$3];1);0) -> 0 | G465: of:=IF([.G464] < [.$B$25];SUM([.F$3:.F465]);[.$B$25]) -> 222350062.5 | H465: of:=IF((ROW() - [.$B$21] < 3);0;FLOOR(IFERROR(OFFSET([.$F465];-1*[.$B$21];0 );0) * [.$B$10])) -> 0 | I465: of:=SUM(INDEX([.H$1:.H$736];MAX(ROW()+(-1*[.$B$22])+1;3);1):INDEX([.H$1:.H$736];ROW();1)) -> 0 | J465: of:=IF([.I465] > [.$B$20];[.I465]-[.$B$20];0) -> 0 | K465: of:=IF([.J465] > 0; ROUND([.$B$23] *MIN([.J465];[.H465])); 0) -> 0 | L465: of:=IF((ROW() - [.$B$13] < 3);0;FLOOR(IFERROR(OFFSET([.$F465];-1*[.$B$13];0 );0) * [.$B$14])) -> 0 | M465: of:=SUM([.L$3:.L465]) -> 6061951
D466: of:=[.D465]+1 -> 2021-04-27T00:00:00.000 | F466: of:=IF([.G465] < [.$B$25];CEILING([.G465]*[.$B$3];1);0) -> 0 | G466: of:=IF([.G465] < [.$B$25];SUM([.F$3:.F466]);[.$B$25]) -> 222350062.5 | H466: of:=IF((ROW() - [.$B$21] < 3);0;FLOOR(IFERROR(OFFSET([.$F466];-1*[.$B$21];0 );0) * [.$B$10])) -> 0 | I466: of:=SUM(INDEX([.H$1:.H$736];MAX(ROW()+(-1*[.$B$22])+1;3);1):INDEX([.H$1:.H$736];ROW();1)) -> 0 | J466: of:=IF([.I466] > [.$B$20];[.I466]-[.$B$20];0) -> 0 | K466: of:=IF([.J466] > 0; ROUND([.$B$23] *MIN([.J466];[.H466])); 0) -> 0 | L466: of:=IF((ROW() - [.$B$13] < 3);0;FLOOR(IFERROR(OFFSET([.$F466];-1*[.$B$13];0 );0) * [.$B$14])) -> 0 | M466: of:=SUM([.L$3:.L466]) -> 6061951
D467: of:=[.D466]+1 -> 2021-04-28T00:00:00.000 | F467: of:=IF([.G466] < [.$B$25];CEILING([.G466]*[.$B$3];1);0) -> 0 | G467: of:=IF([.G466] < [.$B$25];SUM([.F$3:.F467]);[.$B$25]) -> 222350062.5 | H467: of:=IF((ROW() - [.$B$21] < 3);0;FLOOR(IFERROR(OFFSET([.$F467];-1*[.$B$21];0 );0) * [.$B$10])) -> 0 | I467: of:=SUM(INDEX([.H$1:.H$736];MAX(ROW()+(-1*[.$B$22])+1;3);1):INDEX([.H$1:.H$736];ROW();1)) -> 0 | J467: of:=IF([.I467] > [.$B$20];[.I467]-[.$B$20];0) -> 0 | K467: of:=IF([.J467] > 0; ROUND([.$B$23] *MIN([.J467];[.H467])); 0) -> 0 | L467: of:=IF((ROW() - [.$B$13] < 3);0;FLOOR(IFERROR(OFFSET([.$F467];-1*[.$B$13];0 );0) * [.$B$14])) -> 0 | M467: of:=SUM([.L$3:.L467]) -> 6061951
D468: of:=[.D467]+1 -> 2021-04-29T00:00:00.000 | F468: of:=IF([.G467] < [.$B$25];CEILING([.G467]*[.$B$3];1);0) -> 0 | G468: of:=IF([.G467] < [.$B$25];SUM([.F$3:.F468]);[.$B$25]) -> 222350062.5 | H468: of:=IF((ROW() - [.$B$21] < 3);0;FLOOR(IFERROR(OFFSET([.$F468];-1*[.$B$21];0 );0) * [.$B$10])) -> 0 | I468: of:=SUM(INDEX([.H$1:.H$736];MAX(ROW()+(-1*[.$B$22])+1;3);1):INDEX([.H$1:.H$736];ROW();1)) -> 0 | J468: of:=IF([.I468] > [.$B$20];[.I468]-[.$B$20];0) -> 0 | K468: of:=IF([.J468] > 0; ROUND([.$B$23] *MIN([.J468];[.H468])); 0) -> 0 | L468: of:=IF((ROW() - [.$B$13] < 3);0;FLOOR(IFERROR(OFFSET([.$F468];-1*[.$B$13];0 );0) * [.$B$14])) -> 0 | M468: of:=SUM([.L$3:.L468]) -> 6061951
D469: of:=[.D468]+1 -> 2021-04-30T00:00:00.000 | F469: of:=IF([.G468] < [.$B$25];CEILING([.G468]*[.$B$3];1);0) -> 0 | G469: of:=IF([.G468] < [.$B$25];SUM([.F$3:.F469]);[.$B$25]) -> 222350062.5 | H469: of:=IF((ROW() - [.$B$21] < 3);0;FLOOR(IFERROR(OFFSET([.$F469];-1*[.$B$21];0 );0) * [.$B$10])) -> 0 | I469: of:=SUM(INDEX([.H$1:.H$736];MAX(ROW()+(-1*[.$B$22])+1;3);1):INDEX([.H$1:.H$736];ROW();1)) -> 0 | J469: of:=IF([.I469] > [.$B$20];[.I469]-[.$B$20];0) -> 0 | K469: of:=IF([.J469] > 0; ROUND([.$B$23] *MIN([.J469];[.H469])); 0) -> 0 | L469: of:=IF((ROW() - [.$B$13] < 3);0;FLOOR(IFERROR(OFFSET([.$F469];-1*[.$B$13];0 );0) * [.$B$14])) -> 0 | M469: of:=SUM([.L$3:.L469]) -> 6061951
D470: of:=[.D469]+1 -> 2021-05-01T00:00:00.000 | F470: of:=IF([.G469] < [.$B$25];CEILING([.G469]*[.$B$3];1);0) -> 0 | G470: of:=IF([.G469] < [.$B$25];SUM([.F$3:.F470]);[.$B$25]) -> 222350062.5 | H470: of:=IF((ROW() - [.$B$21] < 3);0;FLOOR(IFERROR(OFFSET([.$F470];-1*[.$B$21];0 );0) * [.$B$10])) -> 0 | I470: of:=SUM(INDEX([.H$1:.H$736];MAX(ROW()+(-1*[.$B$22])+1;3);1):INDEX([.H$1:.H$736];ROW();1)) -> 0 | J470: of:=IF([.I470] > [.$B$20];[.I470]-[.$B$20];0) -> 0 | K470: of:=IF([.J470] > 0; ROUND([.$B$23] *MIN([.J470];[.H470])); 0) -> 0 | L470: of:=IF((ROW() - [.$B$13] < 3);0;FLOOR(IFERROR(OFFSET([.$F470];-1*[.$B$13];0 );0) * [.$B$14])) -> 0 | M470: of:=SUM([.L$3:.L470]) -> 6061951
D471: of:=[.D470]+1 -> 2021-05-02T00:00:00.000 | F471: of:=IF([.G470] < [.$B$25];CEILING([.G470]*[.$B$3];1);0) -> 0 | G471: of:=IF([.G470] < [.$B$25];SUM([.F$3:.F471]);[.$B$25]) -> 222350062.5 | H471: of:=IF((ROW() - [.$B$21] < 3);0;FLOOR(IFERROR(OFFSET([.$F471];-1*[.$B$21];0 );0) * [.$B$10])) -> 0 | I471: of:=SUM(INDEX([.H$1:.H$736];MAX(ROW()+(-1*[.$B$22])+1;3);1):INDEX([.H$1:.H$736];ROW();1)) -> 0 | J471: of:=IF([.I471] > [.$B$20];[.I471]-[.$B$20];0) -> 0 | K471: of:=IF([.J471] > 0; ROUND([.$B$23] *MIN([.J471];[.H471])); 0) -> 0 | L471: of:=IF((ROW() - [.$B$13] < 3);0;FLOOR(IFERROR(OFFSET([.$F471];-1*[.$B$13];0 );0) * [.$B$14])) -> 0 | M471: of:=SUM([.L$3:.L471]) -> 6061951
D472: of:=[.D471]+1 -> 2021-05-03T00:00:00.000 | F472: of:=IF([.G471] < [.$B$25];CEILING([.G471]*[.$B$3];1);0) -> 0 | G472: of:=IF([.G471] < [.$B$25];SUM([.F$3:.F472]);[.$B$25]) -> 222350062.5 | H472: of:=IF((ROW() - [.$B$21] < 3);0;FLOOR(IFERROR(OFFSET([.$F472];-1*[.$B$21];0 );0) * [.$B$10])) -> 0 | I472: of:=SUM(INDEX([.H$1:.H$736];MAX(ROW()+(-1*[.$B$22])+1;3);1):INDEX([.H$1:.H$736];ROW();1)) -> 0 | J472: of:=IF([.I472] > [.$B$20];[.I472]-[.$B$20];0) -> 0 | K472: of:=IF([.J472] > 0; ROUND([.$B$23] *MIN([.J472];[.H472])); 0) -> 0 | L472: of:=IF((ROW() - [.$B$13] < 3);0;FLOOR(IFERROR(OFFSET([.$F472];-1*[.$B$13];0 );0) * [.$B$14])) -> 0 | M472: of:=SUM([.L$3:.L472]) -> 6061951
D473: of:=[.D472]+1 -> 2021-05-04T00:00:00.000 | F473: of:=IF([.G472] < [.$B$25];CEILING([.G472]*[.$B$3];1);0) -> 0 | G473: of:=IF([.G472] < [.$B$25];SUM([.F$3:.F473]);[.$B$25]) -> 222350062.5 | H473: of:=IF((ROW() - [.$B$21] < 3);0;FLOOR(IFERROR(OFFSET([.$F473];-1*[.$B$21];0 );0) * [.$B$10])) -> 0 | I473: of:=SUM(INDEX([.H$1:.H$736];MAX(ROW()+(-1*[.$B$22])+1;3);1):INDEX([.H$1:.H$736];ROW();1)) -> 0 | J473: of:=IF([.I473] > [.$B$20];[.I473]-[.$B$20];0) -> 0 | K473: of:=IF([.J473] > 0; ROUND([.$B$23] *MIN([.J473];[.H473])); 0) -> 0 | L473: of:=IF((ROW() - [.$B$13] < 3);0;FLOOR(IFERROR(OFFSET([.$F473];-1*[.$B$13];0 );0) * [.$B$14])) -> 0 | M473: of:=SUM([.L$3:.L473]) -> 6061951
D474: of:=[.D473]+1 -> 2021-05-05T00:00:00.000 | F474: of:=IF([.G473] < [.$B$25];CEILING([.G473]*[.$B$3];1);0) -> 0 | G474: of:=IF([.G473] < [.$B$25];SUM([.F$3:.F474]);[.$B$25]) -> 222350062.5 | H474: of:=IF((ROW() - [.$B$21] < 3);0;FLOOR(IFERROR(OFFSET([.$F474];-1*[.$B$21];0 );0) * [.$B$10])) -> 0 | I474: of:=SUM(INDEX([.H$1:.H$736];MAX(ROW()+(-1*[.$B$22])+1;3);1):INDEX([.H$1:.H$736];ROW();1)) -> 0 | J474: of:=IF([.I474] > [.$B$20];[.I474]-[.$B$20];0) -> 0 | K474: of:=IF([.J474] > 0; ROUND([.$B$23] *MIN([.J474];[.H474])); 0) -> 0 | L474: of:=IF((ROW() - [.$B$13] < 3);0;FLOOR(IFERROR(OFFSET([.$F474];-1*[.$B$13];0 );0) * [.$B$14])) -> 0 | M474: of:=SUM([.L$3:.L474]) -> 6061951
D475: of:=[.D474]+1 -> 2021-05-06T00:00:00.000 | F475: of:=IF([.G474] < [.$B$25];CEILING([.G474]*[.$B$3];1);0) -> 0 | G475: of:=IF([.G474] < [.$B$25];SUM([.F$3:.F475]);[.$B$25]) -> 222350062.5 | H475: of:=IF((ROW() - [.$B$21] < 3);0;FLOOR(IFERROR(OFFSET([.$F475];-1*[.$B$21];0 );0) * [.$B$10])) -> 0 | I475: of:=SUM(INDEX([.H$1:.H$736];MAX(ROW()+(-1*[.$B$22])+1;3);1):INDEX([.H$1:.H$736];ROW();1)) -> 0 | J475: of:=IF([.I475] > [.$B$20];[.I475]-[.$B$20];0) -> 0 | K475: of:=IF([.J475] > 0; ROUND([.$B$23] *MIN([.J475];[.H475])); 0) -> 0 | L475: of:=IF((ROW() - [.$B$13] < 3);0;FLOOR(IFERROR(OFFSET([.$F475];-1*[.$B$13];0 );0) * [.$B$14])) -> 0 | M475: of:=SUM([.L$3:.L475]) -> 6061951
D476: of:=[.D475]+1 -> 2021-05-07T00:00:00.000 | F476: of:=IF([.G475] < [.$B$25];CEILING([.G475]*[.$B$3];1);0) -> 0 | G476: of:=IF([.G475] < [.$B$25];SUM([.F$3:.F476]);[.$B$25]) -> 222350062.5 | H476: of:=IF((ROW() - [.$B$21] < 3);0;FLOOR(IFERROR(OFFSET([.$F476];-1*[.$B$21];0 );0) * [.$B$10])) -> 0 | I476: of:=SUM(INDEX([.H$1:.H$736];MAX(ROW()+(-1*[.$B$22])+1;3);1):INDEX([.H$1:.H$736];ROW();1)) -> 0 | J476: of:=IF([.I476] > [.$B$20];[.I476]-[.$B$20];0) -> 0 | K476: of:=IF([.J476] > 0; ROUND([.$B$23] *MIN([.J476];[.H476])); 0) -> 0 | L476: of:=IF((ROW() - [.$B$13] < 3);0;FLOOR(IFERROR(OFFSET([.$F476];-1*[.$B$13];0 );0) * [.$B$14])) -> 0 | M476: of:=SUM([.L$3:.L476]) -> 6061951
D477: of:=[.D476]+1 -> 2021-05-08T00:00:00.000 | F477: of:=IF([.G476] < [.$B$25];CEILING([.G476]*[.$B$3];1);0) -> 0 | G477: of:=IF([.G476] < [.$B$25];SUM([.F$3:.F477]);[.$B$25]) -> 222350062.5 | H477: of:=IF((ROW() - [.$B$21] < 3);0;FLOOR(IFERROR(OFFSET([.$F477];-1*[.$B$21];0 );0) * [.$B$10])) -> 0 | I477: of:=SUM(INDEX([.H$1:.H$736];MAX(ROW()+(-1*[.$B$22])+1;3);1):INDEX([.H$1:.H$736];ROW();1)) -> 0 | J477: of:=IF([.I477] > [.$B$20];[.I477]-[.$B$20];0) -> 0 | K477: of:=IF([.J477] > 0; ROUND([.$B$23] *MIN([.J477];[.H477])); 0) -> 0 | L477: of:=IF((ROW() - [.$B$13] < 3);0;FLOOR(IFERROR(OFFSET([.$F477];-1*[.$B$13];0 );0) * [.$B$14])) -> 0 | M477: of:=SUM([.L$3:.L477]) -> 6061951
D478: of:=[.D477]+1 -> 2021-05-09T00:00:00.000 | F478: of:=IF([.G477] < [.$B$25];CEILING([.G477]*[.$B$3];1);0) -> 0 | G478: of:=IF([.G477] < [.$B$25];SUM([.F$3:.F478]);[.$B$25]) -> 222350062.5 | H478: of:=IF((ROW() - [.$B$21] < 3);0;FLOOR(IFERROR(OFFSET([.$F478];-1*[.$B$21];0 );0) * [.$B$10])) -> 0 | I478: of:=SUM(INDEX([.H$1:.H$736];MAX(ROW()+(-1*[.$B$22])+1;3);1):INDEX([.H$1:.H$736];ROW();1)) -> 0 | J478: of:=IF([.I478] > [.$B$20];[.I478]-[.$B$20];0) -> 0 | K478: of:=IF([.J478] > 0; ROUND([.$B$23] *MIN([.J478];[.H478])); 0) -> 0 | L478: of:=IF((ROW() - [.$B$13] < 3);0;FLOOR(IFERROR(OFFSET([.$F478];-1*[.$B$13];0 );0) * [.$B$14])) -> 0 | M478: of:=SUM([.L$3:.L478]) -> 6061951
D479: of:=[.D478]+1 -> 2021-05-10T00:00:00.000 | F479: of:=IF([.G478] < [.$B$25];CEILING([.G478]*[.$B$3];1);0) -> 0 | G479: of:=IF([.G478] < [.$B$25];SUM([.F$3:.F479]);[.$B$25]) -> 222350062.5 | H479: of:=IF((ROW() - [.$B$21] < 3);0;FLOOR(IFERROR(OFFSET([.$F479];-1*[.$B$21];0 );0) * [.$B$10])) -> 0 | I479: of:=SUM(INDEX([.H$1:.H$736];MAX(ROW()+(-1*[.$B$22])+1;3);1):INDEX([.H$1:.H$736];ROW();1)) -> 0 | J479: of:=IF([.I479] > [.$B$20];[.I479]-[.$B$20];0) -> 0 | K479: of:=IF([.J479] > 0; ROUND([.$B$23] *MIN([.J479];[.H479])); 0) -> 0 | L479: of:=IF((ROW() - [.$B$13] < 3);0;FLOOR(IFERROR(OFFSET([.$F479];-1*[.$B$13];0 );0) * [.$B$14])) -> 0 | M479: of:=SUM([.L$3:.L479]) -> 6061951
D480: of:=[.D479]+1 -> 2021-05-11T00:00:00.000 | F480: of:=IF([.G479] < [.$B$25];CEILING([.G479]*[.$B$3];1);0) -> 0 | G480: of:=IF([.G479] < [.$B$25];SUM([.F$3:.F480]);[.$B$25]) -> 222350062.5 | H480: of:=IF((ROW() - [.$B$21] < 3);0;FLOOR(IFERROR(OFFSET([.$F480];-1*[.$B$21];0 );0) * [.$B$10])) -> 0 | I480: of:=SUM(INDEX([.H$1:.H$736];MAX(ROW()+(-1*[.$B$22])+1;3);1):INDEX([.H$1:.H$736];ROW();1)) -> 0 | J480: of:=IF([.I480] > [.$B$20];[.I480]-[.$B$20];0) -> 0 | K480: of:=IF([.J480] > 0; ROUND([.$B$23] *MIN([.J480];[.H480])); 0) -> 0 | L480: of:=IF((ROW() - [.$B$13] < 3);0;FLOOR(IFERROR(OFFSET([.$F480];-1*[.$B$13];0 );0) * [.$B$14])) -> 0 | M480: of:=SUM([.L$3:.L480]) -> 6061951
D481: of:=[.D480]+1 -> 2021-05-12T00:00:00.000 | F481: of:=IF([.G480] < [.$B$25];CEILING([.G480]*[.$B$3];1);0) -> 0 | G481: of:=IF([.G480] < [.$B$25];SUM([.F$3:.F481]);[.$B$25]) -> 222350062.5 | H481: of:=IF((ROW() - [.$B$21] < 3);0;FLOOR(IFERROR(OFFSET([.$F481];-1*[.$B$21];0 );0) * [.$B$10])) -> 0 | I481: of:=SUM(INDEX([.H$1:.H$736];MAX(ROW()+(-1*[.$B$22])+1;3);1):INDEX([.H$1:.H$736];ROW();1)) -> 0 | J481: of:=IF([.I481] > [.$B$20];[.I481]-[.$B$20];0) -> 0 | K481: of:=IF([.J481] > 0; ROUND([.$B$23] *MIN([.J481];[.H481])); 0) -> 0 | L481: of:=IF((ROW() - [.$B$13] < 3);0;FLOOR(IFERROR(OFFSET([.$F481];-1*[.$B$13];0 );0) * [.$B$14])) -> 0 | M481: of:=SUM([.L$3:.L481]) -> 6061951
D482: of:=[.D481]+1 -> 2021-05-13T00:00:00.000 | F482: of:=IF([.G481] < [.$B$25];CEILING([.G481]*[.$B$3];1);0) -> 0 | G482: of:=IF([.G481] < [.$B$25];SUM([.F$3:.F482]);[.$B$25]) -> 222350062.5 | H482: of:=IF((ROW() - [.$B$21] < 3);0;FLOOR(IFERROR(OFFSET([.$F482];-1*[.$B$21];0 );0) * [.$B$10])) -> 0 | I482: of:=SUM(INDEX([.H$1:.H$736];MAX(ROW()+(-1*[.$B$22])+1;3);1):INDEX([.H$1:.H$736];ROW();1)) -> 0 | J482: of:=IF([.I482] > [.$B$20];[.I482]-[.$B$20];0) -> 0 | K482: of:=IF([.J482] > 0; ROUND([.$B$23] *MIN([.J482];[.H482])); 0) -> 0 | L482: of:=IF((ROW() - [.$B$13] < 3);0;FLOOR(IFERROR(OFFSET([.$F482];-1*[.$B$13];0 );0) * [.$B$14])) -> 0 | M482: of:=SUM([.L$3:.L482]) -> 6061951
D483: of:=[.D482]+1 -> 2021-05-14T00:00:00.000 | F483: of:=IF([.G482] < [.$B$25];CEILING([.G482]*[.$B$3];1);0) -> 0 | G483: of:=IF([.G482] < [.$B$25];SUM([.F$3:.F483]);[.$B$25]) -> 222350062.5 | H483: of:=IF((ROW() - [.$B$21] < 3);0;FLOOR(IFERROR(OFFSET([.$F483];-1*[.$B$21];0 );0) * [.$B$10])) -> 0 | I483: of:=SUM(INDEX([.H$1:.H$736];MAX(ROW()+(-1*[.$B$22])+1;3);1):INDEX([.H$1:.H$736];ROW();1)) -> 0 | J483: of:=IF([.I483] > [.$B$20];[.I483]-[.$B$20];0) -> 0 | K483: of:=IF([.J483] > 0; ROUND([.$B$23] *MIN([.J483];[.H483])); 0) -> 0 | L483: of:=IF((ROW() - [.$B$13] < 3);0;FLOOR(IFERROR(OFFSET([.$F483];-1*[.$B$13];0 );0) * [.$B$14])) -> 0 | M483: of:=SUM([.L$3:.L483]) -> 6061951
D484: of:=[.D483]+1 -> 2021-05-15T00:00:00.000 | F484: of:=IF([.G483] < [.$B$25];CEILING([.G483]*[.$B$3];1);0) -> 0 | G484: of:=IF([.G483] < [.$B$25];SUM([.F$3:.F484]);[.$B$25]) -> 222350062.5 | H484: of:=IF((ROW() - [.$B$21] < 3);0;FLOOR(IFERROR(OFFSET([.$F484];-1*[.$B$21];0 );0) * [.$B$10])) -> 0 | I484: of:=SUM(INDEX([.H$1:.H$736];MAX(ROW()+(-1*[.$B$22])+1;3);1):INDEX([.H$1:.H$736];ROW();1)) -> 0 | J484: of:=IF([.I484] > [.$B$20];[.I484]-[.$B$20];0) -> 0 | K484: of:=IF([.J484] > 0; ROUND([.$B$23] *MIN([.J484];[.H484])); 0) -> 0 | L484: of:=IF((ROW() - [.$B$13] < 3);0;FLOOR(IFERROR(OFFSET([.$F484];-1*[.$B$13];0 );0) * [.$B$14])) -> 0 | M484: of:=SUM([.L$3:.L484]) -> 6061951
D485: of:=[.D484]+1 -> 2021-05-16T00:00:00.000 | F485: of:=IF([.G484] < [.$B$25];CEILING([.G484]*[.$B$3];1);0) -> 0 | G485: of:=IF([.G484] < [.$B$25];SUM([.F$3:.F485]);[.$B$25]) -> 222350062.5 | H485: of:=IF((ROW() - [.$B$21] < 3);0;FLOOR(IFERROR(OFFSET([.$F485];-1*[.$B$21];0 );0) * [.$B$10])) -> 0 | I485: of:=SUM(INDEX([.H$1:.H$736];MAX(ROW()+(-1*[.$B$22])+1;3);1):INDEX([.H$1:.H$736];ROW();1)) -> 0 | J485: of:=IF([.I485] > [.$B$20];[.I485]-[.$B$20];0) -> 0 | K485: of:=IF([.J485] > 0; ROUND([.$B$23] *MIN([.J485];[.H485])); 0) -> 0 | L485: of:=IF((ROW() - [.$B$13] < 3);0;FLOOR(IFERROR(OFFSET([.$F485];-1*[.$B$13];0 );0) * [.$B$14])) -> 0 | M485: of:=SUM([.L$3:.L485]) -> 6061951
D486: of:=[.D485]+1 -> 2021-05-17T00:00:00.000 | F486: of:=IF([.G485] < [.$B$25];CEILING([.G485]*[.$B$3];1);0) -> 0 | G486: of:=IF([.G485] < [.$B$25];SUM([.F$3:.F486]);[.$B$25]) -> 222350062.5 | H486: of:=IF((ROW() - [.$B$21] < 3);0;FLOOR(IFERROR(OFFSET([.$F486];-1*[.$B$21];0 );0) * [.$B$10])) -> 0 | I486: of:=SUM(INDEX([.H$1:.H$736];MAX(ROW()+(-1*[.$B$22])+1;3);1):INDEX([.H$1:.H$736];ROW();1)) -> 0 | J486: of:=IF([.I486] > [.$B$20];[.I486]-[.$B$20];0) -> 0 | K486: of:=IF([.J486] > 0; ROUND([.$B$23] *MIN([.J486];[.H486])); 0) -> 0 | L486: of:=IF((ROW() - [.$B$13] < 3);0;FLOOR(IFERROR(OFFSET([.$F486];-1*[.$B$13];0 );0) * [.$B$14])) -> 0 | M486: of:=SUM([.L$3:.L486]) -> 6061951
D487: of:=[.D486]+1 -> 2021-05-18T00:00:00.000 | F487: of:=IF([.G486] < [.$B$25];CEILING([.G486]*[.$B$3];1);0) -> 0 | G487: of:=IF([.G486] < [.$B$25];SUM([.F$3:.F487]);[.$B$25]) -> 222350062.5 | H487: of:=IF((ROW() - [.$B$21] < 3);0;FLOOR(IFERROR(OFFSET([.$F487];-1*[.$B$21];0 );0) * [.$B$10])) -> 0 | I487: of:=SUM(INDEX([.H$1:.H$736];MAX(ROW()+(-1*[.$B$22])+1;3);1):INDEX([.H$1:.H$736];ROW();1)) -> 0 | J487: of:=IF([.I487] > [.$B$20];[.I487]-[.$B$20];0) -> 0 | K487: of:=IF([.J487] > 0; ROUND([.$B$23] *MIN([.J487];[.H487])); 0) -> 0 | L487: of:=IF((ROW() - [.$B$13] < 3);0;FLOOR(IFERROR(OFFSET([.$F487];-1*[.$B$13];0 );0) * [.$B$14])) -> 0 | M487: of:=SUM([.L$3:.L487]) -> 6061951
D488: of:=[.D487]+1 -> 2021-05-19T00:00:00.000 | F488: of:=IF([.G487] < [.$B$25];CEILING([.G487]*[.$B$3];1);0) -> 0 | G488: of:=IF([.G487] < [.$B$25];SUM([.F$3:.F488]);[.$B$25]) -> 222350062.5 | H488: of:=IF((ROW() - [.$B$21] < 3);0;FLOOR(IFERROR(OFFSET([.$F488];-1*[.$B$21];0 );0) * [.$B$10])) -> 0 | I488: of:=SUM(INDEX([.H$1:.H$736];MAX(ROW()+(-1*[.$B$22])+1;3);1):INDEX([.H$1:.H$736];ROW();1)) -> 0 | J488: of:=IF([.I488] > [.$B$20];[.I488]-[.$B$20];0) -> 0 | K488: of:=IF([.J488] > 0; ROUND([.$B$23] *MIN([.J488];[.H488])); 0) -> 0 | L488: of:=IF((ROW() - [.$B$13] < 3);0;FLOOR(IFERROR(OFFSET([.$F488];-1*[.$B$13];0 );0) * [.$B$14])) -> 0 | M488: of:=SUM([.L$3:.L488]) -> 6061951
D489: of:=[.D488]+1 -> 2021-05-20T00:00:00.000 | F489: of:=IF([.G488] < [.$B$25];CEILING([.G488]*[.$B$3];1);0) -> 0 | G489: of:=IF([.G488] < [.$B$25];SUM([.F$3:.F489]);[.$B$25]) -> 222350062.5 | H489: of:=IF((ROW() - [.$B$21] < 3);0;FLOOR(IFERROR(OFFSET([.$F489];-1*[.$B$21];0 );0) * [.$B$10])) -> 0 | I489: of:=SUM(INDEX([.H$1:.H$736];MAX(ROW()+(-1*[.$B$22])+1;3);1):INDEX([.H$1:.H$736];ROW();1)) -> 0 | J489: of:=IF([.I489] > [.$B$20];[.I489]-[.$B$20];0) -> 0 | K489: of:=IF([.J489] > 0; ROUND([.$B$23] *MIN([.J489];[.H489])); 0) -> 0 | L489: of:=IF((ROW() - [.$B$13] < 3);0;FLOOR(IFERROR(OFFSET([.$F489];-1*[.$B$13];0 );0) * [.$B$14])) -> 0 | M489: of:=SUM([.L$3:.L489]) -> 6061951
D490: of:=[.D489]+1 -> 2021-05-21T00:00:00.000 | F490: of:=IF([.G489] < [.$B$25];CEILING([.G489]*[.$B$3];1);0) -> 0 | G490: of:=IF([.G489] < [.$B$25];SUM([.F$3:.F490]);[.$B$25]) -> 222350062.5 | H490: of:=IF((ROW() - [.$B$21] < 3);0;FLOOR(IFERROR(OFFSET([.$F490];-1*[.$B$21];0 );0) * [.$B$10])) -> 0 | I490: of:=SUM(INDEX([.H$1:.H$736];MAX(ROW()+(-1*[.$B$22])+1;3);1):INDEX([.H$1:.H$736];ROW();1)) -> 0 | J490: of:=IF([.I490] > [.$B$20];[.I490]-[.$B$20];0) -> 0 | K490: of:=IF([.J490] > 0; ROUND([.$B$23] *MIN([.J490];[.H490])); 0) -> 0 | L490: of:=IF((ROW() - [.$B$13] < 3);0;FLOOR(IFERROR(OFFSET([.$F490];-1*[.$B$13];0 );0) * [.$B$14])) -> 0 | M490: of:=SUM([.L$3:.L490]) -> 6061951
D491: of:=[.D490]+1 -> 2021-05-22T00:00:00.000 | F491: of:=IF([.G490] < [.$B$25];CEILING([.G490]*[.$B$3];1);0) -> 0 | G491: of:=IF([.G490] < [.$B$25];SUM([.F$3:.F491]);[.$B$25]) -> 222350062.5 | H491: of:=IF((ROW() - [.$B$21] < 3);0;FLOOR(IFERROR(OFFSET([.$F491];-1*[.$B$21];0 );0) * [.$B$10])) -> 0 | I491: of:=SUM(INDEX([.H$1:.H$736];MAX(ROW()+(-1*[.$B$22])+1;3);1):INDEX([.H$1:.H$736];ROW();1)) -> 0 | J491: of:=IF([.I491] > [.$B$20];[.I491]-[.$B$20];0) -> 0 | K491: of:=IF([.J491] > 0; ROUND([.$B$23] *MIN([.J491];[.H491])); 0) -> 0 | L491: of:=IF((ROW() - [.$B$13] < 3);0;FLOOR(IFERROR(OFFSET([.$F491];-1*[.$B$13];0 );0) * [.$B$14])) -> 0 | M491: of:=SUM([.L$3:.L491]) -> 6061951
D492: of:=[.D491]+1 -> 2021-05-23T00:00:00.000 | F492: of:=IF([.G491] < [.$B$25];CEILING([.G491]*[.$B$3];1);0) -> 0 | G492: of:=IF([.G491] < [.$B$25];SUM([.F$3:.F492]);[.$B$25]) -> 222350062.5 | H492: of:=IF((ROW() - [.$B$21] < 3);0;FLOOR(IFERROR(OFFSET([.$F492];-1*[.$B$21];0 );0) * [.$B$10])) -> 0 | I492: of:=SUM(INDEX([.H$1:.H$736];MAX(ROW()+(-1*[.$B$22])+1;3);1):INDEX([.H$1:.H$736];ROW();1)) -> 0 | J492: of:=IF([.I492] > [.$B$20];[.I492]-[.$B$20];0) -> 0 | K492: of:=IF([.J492] > 0; ROUND([.$B$23] *MIN([.J492];[.H492])); 0) -> 0 | L492: of:=IF((ROW() - [.$B$13] < 3);0;FLOOR(IFERROR(OFFSET([.$F492];-1*[.$B$13];0 );0) * [.$B$14])) -> 0 | M492: of:=SUM([.L$3:.L492]) -> 6061951
D493: of:=[.D492]+1 -> 2021-05-24T00:00:00.000 | F493: of:=IF([.G492] < [.$B$25];CEILING([.G492]*[.$B$3];1);0) -> 0 | G493: of:=IF([.G492] < [.$B$25];SUM([.F$3:.F493]);[.$B$25]) -> 222350062.5 | H493: of:=IF((ROW() - [.$B$21] < 3);0;FLOOR(IFERROR(OFFSET([.$F493];-1*[.$B$21];0 );0) * [.$B$10])) -> 0 | I493: of:=SUM(INDEX([.H$1:.H$736];MAX(ROW()+(-1*[.$B$22])+1;3);1):INDEX([.H$1:.H$736];ROW();1)) -> 0 | J493: of:=IF([.I493] > [.$B$20];[.I493]-[.$B$20];0) -> 0 | K493: of:=IF([.J493] > 0; ROUND([.$B$23] *MIN([.J493];[.H493])); 0) -> 0 | L493: of:=IF((ROW() - [.$B$13] < 3);0;FLOOR(IFERROR(OFFSET([.$F493];-1*[.$B$13];0 );0) * [.$B$14])) -> 0 | M493: of:=SUM([.L$3:.L493]) -> 6061951
D494: of:=[.D493]+1 -> 2021-05-25T00:00:00.000 | F494: of:=IF([.G493] < [.$B$25];CEILING([.G493]*[.$B$3];1);0) -> 0 | G494: of:=IF([.G493] < [.$B$25];SUM([.F$3:.F494]);[.$B$25]) -> 222350062.5 | H494: of:=IF((ROW() - [.$B$21] < 3);0;FLOOR(IFERROR(OFFSET([.$F494];-1*[.$B$21];0 );0) * [.$B$10])) -> 0 | I494: of:=SUM(INDEX([.H$1:.H$736];MAX(ROW()+(-1*[.$B$22])+1;3);1):INDEX([.H$1:.H$736];ROW();1)) -> 0 | J494: of:=IF([.I494] > [.$B$20];[.I494]-[.$B$20];0) -> 0 | K494: of:=IF([.J494] > 0; ROUND([.$B$23] *MIN([.J494];[.H494])); 0) -> 0 | L494: of:=IF((ROW() - [.$B$13] < 3);0;FLOOR(IFERROR(OFFSET([.$F494];-1*[.$B$13];0 );0) * [.$B$14])) -> 0 | M494: of:=SUM([.L$3:.L494]) -> 6061951
D495: of:=[.D494]+1 -> 2021-05-26T00:00:00.000 | F495: of:=IF([.G494] < [.$B$25];CEILING([.G494]*[.$B$3];1);0) -> 0 | G495: of:=IF([.G494] < [.$B$25];SUM([.F$3:.F495]);[.$B$25]) -> 222350062.5 | H495: of:=IF((ROW() - [.$B$21] < 3);0;FLOOR(IFERROR(OFFSET([.$F495];-1*[.$B$21];0 );0) * [.$B$10])) -> 0 | I495: of:=SUM(INDEX([.H$1:.H$736];MAX(ROW()+(-1*[.$B$22])+1;3);1):INDEX([.H$1:.H$736];ROW();1)) -> 0 | J495: of:=IF([.I495] > [.$B$20];[.I495]-[.$B$20];0) -> 0 | K495: of:=IF([.J495] > 0; ROUND([.$B$23] *MIN([.J495];[.H495])); 0) -> 0 | L495: of:=IF((ROW() - [.$B$13] < 3);0;FLOOR(IFERROR(OFFSET([.$F495];-1*[.$B$13];0 );0) * [.$B$14])) -> 0 | M495: of:=SUM([.L$3:.L495]) -> 6061951
D496: of:=[.D495]+1 -> 2021-05-27T00:00:00.000 | F496: of:=IF([.G495] < [.$B$25];CEILING([.G495]*[.$B$3];1);0) -> 0 | G496: of:=IF([.G495] < [.$B$25];SUM([.F$3:.F496]);[.$B$25]) -> 222350062.5 | H496: of:=IF((ROW() - [.$B$21] < 3);0;FLOOR(IFERROR(OFFSET([.$F496];-1*[.$B$21];0 );0) * [.$B$10])) -> 0 | I496: of:=SUM(INDEX([.H$1:.H$736];MAX(ROW()+(-1*[.$B$22])+1;3);1):INDEX([.H$1:.H$736];ROW();1)) -> 0 | J496: of:=IF([.I496] > [.$B$20];[.I496]-[.$B$20];0) -> 0 | K496: of:=IF([.J496] > 0; ROUND([.$B$23] *MIN([.J496];[.H496])); 0) -> 0 | L496: of:=IF((ROW() - [.$B$13] < 3);0;FLOOR(IFERROR(OFFSET([.$F496];-1*[.$B$13];0 );0) * [.$B$14])) -> 0 | M496: of:=SUM([.L$3:.L496]) -> 6061951
D497: of:=[.D496]+1 -> 2021-05-28T00:00:00.000 | F497: of:=IF([.G496] < [.$B$25];CEILING([.G496]*[.$B$3];1);0) -> 0 | G497: of:=IF([.G496] < [.$B$25];SUM([.F$3:.F497]);[.$B$25]) -> 222350062.5 | H497: of:=IF((ROW() - [.$B$21] < 3);0;FLOOR(IFERROR(OFFSET([.$F497];-1*[.$B$21];0 );0) * [.$B$10])) -> 0 | I497: of:=SUM(INDEX([.H$1:.H$736];MAX(ROW()+(-1*[.$B$22])+1;3);1):INDEX([.H$1:.H$736];ROW();1)) -> 0 | J497: of:=IF([.I497] > [.$B$20];[.I497]-[.$B$20];0) -> 0 | K497: of:=IF([.J497] > 0; ROUND([.$B$23] *MIN([.J497];[.H497])); 0) -> 0 | L497: of:=IF((ROW() - [.$B$13] < 3);0;FLOOR(IFERROR(OFFSET([.$F497];-1*[.$B$13];0 );0) * [.$B$14])) -> 0 | M497: of:=SUM([.L$3:.L497]) -> 6061951
D498: of:=[.D497]+1 -> 2021-05-29T00:00:00.000 | F498: of:=IF([.G497] < [.$B$25];CEILING([.G497]*[.$B$3];1);0) -> 0 | G498: of:=IF([.G497] < [.$B$25];SUM([.F$3:.F498]);[.$B$25]) -> 222350062.5 | H498: of:=IF((ROW() - [.$B$21] < 3);0;FLOOR(IFERROR(OFFSET([.$F498];-1*[.$B$21];0 );0) * [.$B$10])) -> 0 | I498: of:=SUM(INDEX([.H$1:.H$736];MAX(ROW()+(-1*[.$B$22])+1;3);1):INDEX([.H$1:.H$736];ROW();1)) -> 0 | J498: of:=IF([.I498] > [.$B$20];[.I498]-[.$B$20];0) -> 0 | K498: of:=IF([.J498] > 0; ROUND([.$B$23] *MIN([.J498];[.H498])); 0) -> 0 | L498: of:=IF((ROW() - [.$B$13] < 3);0;FLOOR(IFERROR(OFFSET([.$F498];-1*[.$B$13];0 );0) * [.$B$14])) -> 0 | M498: of:=SUM([.L$3:.L498]) -> 6061951
D499: of:=[.D498]+1 -> 2021-05-30T00:00:00.000 | F499: of:=IF([.G498] < [.$B$25];CEILING([.G498]*[.$B$3];1);0) -> 0 | G499: of:=IF([.G498] < [.$B$25];SUM([.F$3:.F499]);[.$B$25]) -> 222350062.5 | H499: of:=IF((ROW() - [.$B$21] < 3);0;FLOOR(IFERROR(OFFSET([.$F499];-1*[.$B$21];0 );0) * [.$B$10])) -> 0 | I499: of:=SUM(INDEX([.H$1:.H$736];MAX(ROW()+(-1*[.$B$22])+1;3);1):INDEX([.H$1:.H$736];ROW();1)) -> 0 | J499: of:=IF([.I499] > [.$B$20];[.I499]-[.$B$20];0) -> 0 | K499: of:=IF([.J499] > 0; ROUND([.$B$23] *MIN([.J499];[.H499])); 0) -> 0 | L499: of:=IF((ROW() - [.$B$13] < 3);0;FLOOR(IFERROR(OFFSET([.$F499];-1*[.$B$13];0 );0) * [.$B$14])) -> 0 | M499: of:=SUM([.L$3:.L499]) -> 6061951
D500: of:=[.D499]+1 -> 2021-05-31T00:00:00.000 | F500: of:=IF([.G499] < [.$B$25];CEILING([.G499]*[.$B$3];1);0) -> 0 | G500: of:=IF([.G499] < [.$B$25];SUM([.F$3:.F500]);[.$B$25]) -> 222350062.5 | H500: of:=IF((ROW() - [.$B$21] < 3);0;FLOOR(IFERROR(OFFSET([.$F500];-1*[.$B$21];0 );0) * [.$B$10])) -> 0 | I500: of:=SUM(INDEX([.H$1:.H$736];MAX(ROW()+(-1*[.$B$22])+1;3);1):INDEX([.H$1:.H$736];ROW();1)) -> 0 | J500: of:=IF([.I500] > [.$B$20];[.I500]-[.$B$20];0) -> 0 | K500: of:=IF([.J500] > 0; ROUND([.$B$23] *MIN([.J500];[.H500])); 0) -> 0 | L500: of:=IF((ROW() - [.$B$13] < 3);0;FLOOR(IFERROR(OFFSET([.$F500];-1*[.$B$13];0 );0) * [.$B$14])) -> 0 | M500: of:=SUM([.L$3:.L500]) -> 6061951
D501: of:=[.D500]+1 -> 2021-06-01T00:00:00.000 | F501: of:=IF([.G500] < [.$B$25];CEILING([.G500]*[.$B$3];1);0) -> 0 | G501: of:=IF([.G500] < [.$B$25];SUM([.F$3:.F501]);[.$B$25]) -> 222350062.5 | H501: of:=IF((ROW() - [.$B$21] < 3);0;FLOOR(IFERROR(OFFSET([.$F501];-1*[.$B$21];0 );0) * [.$B$10])) -> 0 | I501: of:=SUM(INDEX([.H$1:.H$736];MAX(ROW()+(-1*[.$B$22])+1;3);1):INDEX([.H$1:.H$736];ROW();1)) -> 0 | J501: of:=IF([.I501] > [.$B$20];[.I501]-[.$B$20];0) -> 0 | K501: of:=IF([.J501] > 0; ROUND([.$B$23] *MIN([.J501];[.H501])); 0) -> 0 | L501: of:=IF((ROW() - [.$B$13] < 3);0;FLOOR(IFERROR(OFFSET([.$F501];-1*[.$B$13];0 );0) * [.$B$14])) -> 0 | M501: of:=SUM([.L$3:.L501]) -> 6061951
D502: of:=[.D501]+1 -> 2021-06-02T00:00:00.000 | F502: of:=IF([.G501] < [.$B$25];CEILING([.G501]*[.$B$3];1);0) -> 0 | G502: of:=IF([.G501] < [.$B$25];SUM([.F$3:.F502]);[.$B$25]) -> 222350062.5 | H502: of:=IF((ROW() - [.$B$21] < 3);0;FLOOR(IFERROR(OFFSET([.$F502];-1*[.$B$21];0 );0) * [.$B$10])) -> 0 | I502: of:=SUM(INDEX([.H$1:.H$736];MAX(ROW()+(-1*[.$B$22])+1;3);1):INDEX([.H$1:.H$736];ROW();1)) -> 0 | J502: of:=IF([.I502] > [.$B$20];[.I502]-[.$B$20];0) -> 0 | K502: of:=IF([.J502] > 0; ROUND([.$B$23] *MIN([.J502];[.H502])); 0) -> 0 | L502: of:=IF((ROW() - [.$B$13] < 3);0;FLOOR(IFERROR(OFFSET([.$F502];-1*[.$B$13];0 );0) * [.$B$14])) -> 0 | M502: of:=SUM([.L$3:.L502]) -> 6061951
D503: of:=[.D502]+1 -> 2021-06-03T00:00:00.000 | F503: of:=IF([.G502] < [.$B$25];CEILING([.G502]*[.$B$3];1);0) -> 0 | G503: of:=IF([.G502] < [.$B$25];SUM([.F$3:.F503]);[.$B$25]) -> 222350062.5 | H503: of:=IF((ROW() - [.$B$21] < 3);0;FLOOR(IFERROR(OFFSET([.$F503];-1*[.$B$21];0 );0) * [.$B$10])) -> 0 | I503: of:=SUM(INDEX([.H$1:.H$736];MAX(ROW()+(-1*[.$B$22])+1;3);1):INDEX([.H$1:.H$736];ROW();1)) -> 0 | J503: of:=IF([.I503] > [.$B$20];[.I503]-[.$B$20];0) -> 0 | K503: of:=IF([.J503] > 0; ROUND([.$B$23] *MIN([.J503];[.H503])); 0) -> 0 | L503: of:=IF((ROW() - [.$B$13] < 3);0;FLOOR(IFERROR(OFFSET([.$F503];-1*[.$B$13];0 );0) * [.$B$14])) -> 0 | M503: of:=SUM([.L$3:.L503]) -> 6061951
D504: of:=[.D503]+1 -> 2021-06-04T00:00:00.000 | F504: of:=IF([.G503] < [.$B$25];CEILING([.G503]*[.$B$3];1);0) -> 0 | G504: of:=IF([.G503] < [.$B$25];SUM([.F$3:.F504]);[.$B$25]) -> 222350062.5 | H504: of:=IF((ROW() - [.$B$21] < 3);0;FLOOR(IFERROR(OFFSET([.$F504];-1*[.$B$21];0 );0) * [.$B$10])) -> 0 | I504: of:=SUM(INDEX([.H$1:.H$736];MAX(ROW()+(-1*[.$B$22])+1;3);1):INDEX([.H$1:.H$736];ROW();1)) -> 0 | J504: of:=IF([.I504] > [.$B$20];[.I504]-[.$B$20];0) -> 0 | K504: of:=IF([.J504] > 0; ROUND([.$B$23] *MIN([.J504];[.H504])); 0) -> 0 | L504: of:=IF((ROW() - [.$B$13] < 3);0;FLOOR(IFERROR(OFFSET([.$F504];-1*[.$B$13];0 );0) * [.$B$14])) -> 0 | M504: of:=SUM([.L$3:.L504]) -> 6061951
D505: of:=[.D504]+1 -> 2021-06-05T00:00:00.000 | F505: of:=IF([.G504] < [.$B$25];CEILING([.G504]*[.$B$3];1);0) -> 0 | G505: of:=IF([.G504] < [.$B$25];SUM([.F$3:.F505]);[.$B$25]) -> 222350062.5 | H505: of:=IF((ROW() - [.$B$21] < 3);0;FLOOR(IFERROR(OFFSET([.$F505];-1*[.$B$21];0 );0) * [.$B$10])) -> 0 | I505: of:=SUM(INDEX([.H$1:.H$736];MAX(ROW()+(-1*[.$B$22])+1;3);1):INDEX([.H$1:.H$736];ROW();1)) -> 0 | J505: of:=IF([.I505] > [.$B$20];[.I505]-[.$B$20];0) -> 0 | K505: of:=IF([.J505] > 0; ROUND([.$B$23] *MIN([.J505];[.H505])); 0) -> 0 | L505: of:=IF((ROW() - [.$B$13] < 3);0;FLOOR(IFERROR(OFFSET([.$F505];-1*[.$B$13];0 );0) * [.$B$14])) -> 0 | M505: of:=SUM([.L$3:.L505]) -> 6061951
D506: of:=[.D505]+1 -> 2021-06-06T00:00:00.000 | F506: of:=IF([.G505] < [.$B$25];CEILING([.G505]*[.$B$3];1);0) -> 0 | G506: of:=IF([.G505] < [.$B$25];SUM([.F$3:.F506]);[.$B$25]) -> 222350062.5 | H506: of:=IF((ROW() - [.$B$21] < 3);0;FLOOR(IFERROR(OFFSET([.$F506];-1*[.$B$21];0 );0) * [.$B$10])) -> 0 | I506: of:=SUM(INDEX([.H$1:.H$736];MAX(ROW()+(-1*[.$B$22])+1;3);1):INDEX([.H$1:.H$736];ROW();1)) -> 0 | J506: of:=IF([.I506] > [.$B$20];[.I506]-[.$B$20];0) -> 0 | K506: of:=IF([.J506] > 0; ROUND([.$B$23] *MIN([.J506];[.H506])); 0) -> 0 | L506: of:=IF((ROW() - [.$B$13] < 3);0;FLOOR(IFERROR(OFFSET([.$F506];-1*[.$B$13];0 );0) * [.$B$14])) -> 0 | M506: of:=SUM([.L$3:.L506]) -> 6061951
D507: of:=[.D506]+1 -> 2021-06-07T00:00:00.000 | F507: of:=IF([.G506] < [.$B$25];CEILING([.G506]*[.$B$3];1);0) -> 0 | G507: of:=IF([.G506] < [.$B$25];SUM([.F$3:.F507]);[.$B$25]) -> 222350062.5 | H507: of:=IF((ROW() - [.$B$21] < 3);0;FLOOR(IFERROR(OFFSET([.$F507];-1*[.$B$21];0 );0) * [.$B$10])) -> 0 | I507: of:=SUM(INDEX([.H$1:.H$736];MAX(ROW()+(-1*[.$B$22])+1;3);1):INDEX([.H$1:.H$736];ROW();1)) -> 0 | J507: of:=IF([.I507] > [.$B$20];[.I507]-[.$B$20];0) -> 0 | K507: of:=IF([.J507] > 0; ROUND([.$B$23] *MIN([.J507];[.H507])); 0) -> 0 | L507: of:=IF((ROW() - [.$B$13] < 3);0;FLOOR(IFERROR(OFFSET([.$F507];-1*[.$B$13];0 );0) * [.$B$14])) -> 0 | M507: of:=SUM([.L$3:.L507]) -> 6061951
D508: of:=[.D507]+1 -> 2021-06-08T00:00:00.000 | F508: of:=IF([.G507] < [.$B$25];CEILING([.G507]*[.$B$3];1);0) -> 0 | G508: of:=IF([.G507] < [.$B$25];SUM([.F$3:.F508]);[.$B$25]) -> 222350062.5 | H508: of:=IF((ROW() - [.$B$21] < 3);0;FLOOR(IFERROR(OFFSET([.$F508];-1*[.$B$21];0 );0) * [.$B$10])) -> 0 | I508: of:=SUM(INDEX([.H$1:.H$736];MAX(ROW()+(-1*[.$B$22])+1;3);1):INDEX([.H$1:.H$736];ROW();1)) -> 0 | J508: of:=IF([.I508] > [.$B$20];[.I508]-[.$B$20];0) -> 0 | K508: of:=IF([.J508] > 0; ROUND([.$B$23] *MIN([.J508];[.H508])); 0) -> 0 | L508: of:=IF((ROW() - [.$B$13] < 3);0;FLOOR(IFERROR(OFFSET([.$F508];-1*[.$B$13];0 );0) * [.$B$14])) -> 0 | M508: of:=SUM([.L$3:.L508]) -> 6061951
D509: of:=[.D508]+1 -> 2021-06-09T00:00:00.000 | F509: of:=IF([.G508] < [.$B$25];CEILING([.G508]*[.$B$3];1);0) -> 0 | G509: of:=IF([.G508] < [.$B$25];SUM([.F$3:.F509]);[.$B$25]) -> 222350062.5 | H509: of:=IF((ROW() - [.$B$21] < 3);0;FLOOR(IFERROR(OFFSET([.$F509];-1*[.$B$21];0 );0) * [.$B$10])) -> 0 | I509: of:=SUM(INDEX([.H$1:.H$736];MAX(ROW()+(-1*[.$B$22])+1;3);1):INDEX([.H$1:.H$736];ROW();1)) -> 0 | J509: of:=IF([.I509] > [.$B$20];[.I509]-[.$B$20];0) -> 0 | K509: of:=IF([.J509] > 0; ROUND([.$B$23] *MIN([.J509];[.H509])); 0) -> 0 | L509: of:=IF((ROW() - [.$B$13] < 3);0;FLOOR(IFERROR(OFFSET([.$F509];-1*[.$B$13];0 );0) * [.$B$14])) -> 0 | M509: of:=SUM([.L$3:.L509]) -> 6061951
D510: of:=[.D509]+1 -> 2021-06-10T00:00:00.000 | F510: of:=IF([.G509] < [.$B$25];CEILING([.G509]*[.$B$3];1);0) -> 0 | G510: of:=IF([.G509] < [.$B$25];SUM([.F$3:.F510]);[.$B$25]) -> 222350062.5 | H510: of:=IF((ROW() - [.$B$21] < 3);0;FLOOR(IFERROR(OFFSET([.$F510];-1*[.$B$21];0 );0) * [.$B$10])) -> 0 | I510: of:=SUM(INDEX([.H$1:.H$736];MAX(ROW()+(-1*[.$B$22])+1;3);1):INDEX([.H$1:.H$736];ROW();1)) -> 0 | J510: of:=IF([.I510] > [.$B$20];[.I510]-[.$B$20];0) -> 0 | K510: of:=IF([.J510] > 0; ROUND([.$B$23] *MIN([.J510];[.H510])); 0) -> 0 | L510: of:=IF((ROW() - [.$B$13] < 3);0;FLOOR(IFERROR(OFFSET([.$F510];-1*[.$B$13];0 );0) * [.$B$14])) -> 0 | M510: of:=SUM([.L$3:.L510]) -> 6061951
D511: of:=[.D510]+1 -> 2021-06-11T00:00:00.000 | F511: of:=IF([.G510] < [.$B$25];CEILING([.G510]*[.$B$3];1);0) -> 0 | G511: of:=IF([.G510] < [.$B$25];SUM([.F$3:.F511]);[.$B$25]) -> 222350062.5 | H511: of:=IF((ROW() - [.$B$21] < 3);0;FLOOR(IFERROR(OFFSET([.$F511];-1*[.$B$21];0 );0) * [.$B$10])) -> 0 | I511: of:=SUM(INDEX([.H$1:.H$736];MAX(ROW()+(-1*[.$B$22])+1;3);1):INDEX([.H$1:.H$736];ROW();1)) -> 0 | J511: of:=IF([.I511] > [.$B$20];[.I511]-[.$B$20];0) -> 0 | K511: of:=IF([.J511] > 0; ROUND([.$B$23] *MIN([.J511];[.H511])); 0) -> 0 | L511: of:=IF((ROW() - [.$B$13] < 3);0;FLOOR(IFERROR(OFFSET([.$F511];-1*[.$B$13];0 );0) * [.$B$14])) -> 0 | M511: of:=SUM([.L$3:.L511]) -> 6061951
D512: of:=[.D511]+1 -> 2021-06-12T00:00:00.000 | F512: of:=IF([.G511] < [.$B$25];CEILING([.G511]*[.$B$3];1);0) -> 0 | G512: of:=IF([.G511] < [.$B$25];SUM([.F$3:.F512]);[.$B$25]) -> 222350062.5 | H512: of:=IF((ROW() - [.$B$21] < 3);0;FLOOR(IFERROR(OFFSET([.$F512];-1*[.$B$21];0 );0) * [.$B$10])) -> 0 | I512: of:=SUM(INDEX([.H$1:.H$736];MAX(ROW()+(-1*[.$B$22])+1;3);1):INDEX([.H$1:.H$736];ROW();1)) -> 0 | J512: of:=IF([.I512] > [.$B$20];[.I512]-[.$B$20];0) -> 0 | K512: of:=IF([.J512] > 0; ROUND([.$B$23] *MIN([.J512];[.H512])); 0) -> 0 | L512: of:=IF((ROW() - [.$B$13] < 3);0;FLOOR(IFERROR(OFFSET([.$F512];-1*[.$B$13];0 );0) * [.$B$14])) -> 0 | M512: of:=SUM([.L$3:.L512]) -> 6061951
D513: of:=[.D512]+1 -> 2021-06-13T00:00:00.000 | F513: of:=IF([.G512] < [.$B$25];CEILING([.G512]*[.$B$3];1);0) -> 0 | G513: of:=IF([.G512] < [.$B$25];SUM([.F$3:.F513]);[.$B$25]) -> 222350062.5 | H513: of:=IF((ROW() - [.$B$21] < 3);0;FLOOR(IFERROR(OFFSET([.$F513];-1*[.$B$21];0 );0) * [.$B$10])) -> 0 | I513: of:=SUM(INDEX([.H$1:.H$736];MAX(ROW()+(-1*[.$B$22])+1;3);1):INDEX([.H$1:.H$736];ROW();1)) -> 0 | J513: of:=IF([.I513] > [.$B$20];[.I513]-[.$B$20];0) -> 0 | K513: of:=IF([.J513] > 0; ROUND([.$B$23] *MIN([.J513];[.H513])); 0) -> 0 | L513: of:=IF((ROW() - [.$B$13] < 3);0;FLOOR(IFERROR(OFFSET([.$F513];-1*[.$B$13];0 );0) * [.$B$14])) -> 0 | M513: of:=SUM([.L$3:.L513]) -> 6061951
D514: of:=[.D513]+1 -> 2021-06-14T00:00:00.000 | F514: of:=IF([.G513] < [.$B$25];CEILING([.G513]*[.$B$3];1);0) -> 0 | G514: of:=IF([.G513] < [.$B$25];SUM([.F$3:.F514]);[.$B$25]) -> 222350062.5 | H514: of:=IF((ROW() - [.$B$21] < 3);0;FLOOR(IFERROR(OFFSET([.$F514];-1*[.$B$21];0 );0) * [.$B$10])) -> 0 | I514: of:=SUM(INDEX([.H$1:.H$736];MAX(ROW()+(-1*[.$B$22])+1;3);1):INDEX([.H$1:.H$736];ROW();1)) -> 0 | J514: of:=IF([.I514] > [.$B$20];[.I514]-[.$B$20];0) -> 0 | K514: of:=IF([.J514] > 0; ROUND([.$B$23] *MIN([.J514];[.H514])); 0) -> 0 | L514: of:=IF((ROW() - [.$B$13] < 3);0;FLOOR(IFERROR(OFFSET([.$F514];-1*[.$B$13];0 );0) * [.$B$14])) -> 0 | M514: of:=SUM([.L$3:.L514]) -> 6061951
D515: of:=[.D514]+1 -> 2021-06-15T00:00:00.000 | F515: of:=IF([.G514] < [.$B$25];CEILING([.G514]*[.$B$3];1);0) -> 0 | G515: of:=IF([.G514] < [.$B$25];SUM([.F$3:.F515]);[.$B$25]) -> 222350062.5 | H515: of:=IF((ROW() - [.$B$21] < 3);0;FLOOR(IFERROR(OFFSET([.$F515];-1*[.$B$21];0 );0) * [.$B$10])) -> 0 | I515: of:=SUM(INDEX([.H$1:.H$736];MAX(ROW()+(-1*[.$B$22])+1;3);1):INDEX([.H$1:.H$736];ROW();1)) -> 0 | J515: of:=IF([.I515] > [.$B$20];[.I515]-[.$B$20];0) -> 0 | K515: of:=IF([.J515] > 0; ROUND([.$B$23] *MIN([.J515];[.H515])); 0) -> 0 | L515: of:=IF((ROW() - [.$B$13] < 3);0;FLOOR(IFERROR(OFFSET([.$F515];-1*[.$B$13];0 );0) * [.$B$14])) -> 0 | M515: of:=SUM([.L$3:.L515]) -> 6061951
D516: of:=[.D515]+1 -> 2021-06-16T00:00:00.000 | F516: of:=IF([.G515] < [.$B$25];CEILING([.G515]*[.$B$3];1);0) -> 0 | G516: of:=IF([.G515] < [.$B$25];SUM([.F$3:.F516]);[.$B$25]) -> 222350062.5 | H516: of:=IF((ROW() - [.$B$21] < 3);0;FLOOR(IFERROR(OFFSET([.$F516];-1*[.$B$21];0 );0) * [.$B$10])) -> 0 | I516: of:=SUM(INDEX([.H$1:.H$736];MAX(ROW()+(-1*[.$B$22])+1;3);1):INDEX([.H$1:.H$736];ROW();1)) -> 0 | J516: of:=IF([.I516] > [.$B$20];[.I516]-[.$B$20];0) -> 0 | K516: of:=IF([.J516] > 0; ROUND([.$B$23] *MIN([.J516];[.H516])); 0) -> 0 | L516: of:=IF((ROW() - [.$B$13] < 3);0;FLOOR(IFERROR(OFFSET([.$F516];-1*[.$B$13];0 );0) * [.$B$14])) -> 0 | M516: of:=SUM([.L$3:.L516]) -> 6061951
D517: of:=[.D516]+1 -> 2021-06-17T00:00:00.000 | F517: of:=IF([.G516] < [.$B$25];CEILING([.G516]*[.$B$3];1);0) -> 0 | G517: of:=IF([.G516] < [.$B$25];SUM([.F$3:.F517]);[.$B$25]) -> 222350062.5 | H517: of:=IF((ROW() - [.$B$21] < 3);0;FLOOR(IFERROR(OFFSET([.$F517];-1*[.$B$21];0 );0) * [.$B$10])) -> 0 | I517: of:=SUM(INDEX([.H$1:.H$736];MAX(ROW()+(-1*[.$B$22])+1;3);1):INDEX([.H$1:.H$736];ROW();1)) -> 0 | J517: of:=IF([.I517] > [.$B$20];[.I517]-[.$B$20];0) -> 0 | K517: of:=IF([.J517] > 0; ROUND([.$B$23] *MIN([.J517];[.H517])); 0) -> 0 | L517: of:=IF((ROW() - [.$B$13] < 3);0;FLOOR(IFERROR(OFFSET([.$F517];-1*[.$B$13];0 );0) * [.$B$14])) -> 0 | M517: of:=SUM([.L$3:.L517]) -> 6061951
D518: of:=[.D517]+1 -> 2021-06-18T00:00:00.000 | F518: of:=IF([.G517] < [.$B$25];CEILING([.G517]*[.$B$3];1);0) -> 0 | G518: of:=IF([.G517] < [.$B$25];SUM([.F$3:.F518]);[.$B$25]) -> 222350062.5 | H518: of:=IF((ROW() - [.$B$21] < 3);0;FLOOR(IFERROR(OFFSET([.$F518];-1*[.$B$21];0 );0) * [.$B$10])) -> 0 | I518: of:=SUM(INDEX([.H$1:.H$736];MAX(ROW()+(-1*[.$B$22])+1;3);1):INDEX([.H$1:.H$736];ROW();1)) -> 0 | J518: of:=IF([.I518] > [.$B$20];[.I518]-[.$B$20];0) -> 0 | K518: of:=IF([.J518] > 0; ROUND([.$B$23] *MIN([.J518];[.H518])); 0) -> 0 | L518: of:=IF((ROW() - [.$B$13] < 3);0;FLOOR(IFERROR(OFFSET([.$F518];-1*[.$B$13];0 );0) * [.$B$14])) -> 0 | M518: of:=SUM([.L$3:.L518]) -> 6061951
D519: of:=[.D518]+1 -> 2021-06-19T00:00:00.000 | F519: of:=IF([.G518] < [.$B$25];CEILING([.G518]*[.$B$3];1);0) -> 0 | G519: of:=IF([.G518] < [.$B$25];SUM([.F$3:.F519]);[.$B$25]) -> 222350062.5 | H519: of:=IF((ROW() - [.$B$21] < 3);0;FLOOR(IFERROR(OFFSET([.$F519];-1*[.$B$21];0 );0) * [.$B$10])) -> 0 | I519: of:=SUM(INDEX([.H$1:.H$736];MAX(ROW()+(-1*[.$B$22])+1;3);1):INDEX([.H$1:.H$736];ROW();1)) -> 0 | J519: of:=IF([.I519] > [.$B$20];[.I519]-[.$B$20];0) -> 0 | K519: of:=IF([.J519] > 0; ROUND([.$B$23] *MIN([.J519];[.H519])); 0) -> 0 | L519: of:=IF((ROW() - [.$B$13] < 3);0;FLOOR(IFERROR(OFFSET([.$F519];-1*[.$B$13];0 );0) * [.$B$14])) -> 0 | M519: of:=SUM([.L$3:.L519]) -> 6061951
D520: of:=[.D519]+1 -> 2021-06-20T00:00:00.000 | F520: of:=IF([.G519] < [.$B$25];CEILING([.G519]*[.$B$3];1);0) -> 0 | G520: of:=IF([.G519] < [.$B$25];SUM([.F$3:.F520]);[.$B$25]) -> 222350062.5 | H520: of:=IF((ROW() - [.$B$21] < 3);0;FLOOR(IFERROR(OFFSET([.$F520];-1*[.$B$21];0 );0) * [.$B$10])) -> 0 | I520: of:=SUM(INDEX([.H$1:.H$736];MAX(ROW()+(-1*[.$B$22])+1;3);1):INDEX([.H$1:.H$736];ROW();1)) -> 0 | J520: of:=IF([.I520] > [.$B$20];[.I520]-[.$B$20];0) -> 0 | K520: of:=IF([.J520] > 0; ROUND([.$B$23] *MIN([.J520];[.H520])); 0) -> 0 | L520: of:=IF((ROW() - [.$B$13] < 3);0;FLOOR(IFERROR(OFFSET([.$F520];-1*[.$B$13];0 );0) * [.$B$14])) -> 0 | M520: of:=SUM([.L$3:.L520]) -> 6061951
D521: of:=[.D520]+1 -> 2021-06-21T00:00:00.000 | F521: of:=IF([.G520] < [.$B$25];CEILING([.G520]*[.$B$3];1);0) -> 0 | G521: of:=IF([.G520] < [.$B$25];SUM([.F$3:.F521]);[.$B$25]) -> 222350062.5 | H521: of:=IF((ROW() - [.$B$21] < 3);0;FLOOR(IFERROR(OFFSET([.$F521];-1*[.$B$21];0 );0) * [.$B$10])) -> 0 | I521: of:=SUM(INDEX([.H$1:.H$736];MAX(ROW()+(-1*[.$B$22])+1;3);1):INDEX([.H$1:.H$736];ROW();1)) -> 0 | J521: of:=IF([.I521] > [.$B$20];[.I521]-[.$B$20];0) -> 0 | K521: of:=IF([.J521] > 0; ROUND([.$B$23] *MIN([.J521];[.H521])); 0) -> 0 | L521: of:=IF((ROW() - [.$B$13] < 3);0;FLOOR(IFERROR(OFFSET([.$F521];-1*[.$B$13];0 );0) * [.$B$14])) -> 0 | M521: of:=SUM([.L$3:.L521]) -> 6061951
D522: of:=[.D521]+1 -> 2021-06-22T00:00:00.000 | F522: of:=IF([.G521] < [.$B$25];CEILING([.G521]*[.$B$3];1);0) -> 0 | G522: of:=IF([.G521] < [.$B$25];SUM([.F$3:.F522]);[.$B$25]) -> 222350062.5 | H522: of:=IF((ROW() - [.$B$21] < 3);0;FLOOR(IFERROR(OFFSET([.$F522];-1*[.$B$21];0 );0) * [.$B$10])) -> 0 | I522: of:=SUM(INDEX([.H$1:.H$736];MAX(ROW()+(-1*[.$B$22])+1;3);1):INDEX([.H$1:.H$736];ROW();1)) -> 0 | J522: of:=IF([.I522] > [.$B$20];[.I522]-[.$B$20];0) -> 0 | K522: of:=IF([.J522] > 0; ROUND([.$B$23] *MIN([.J522];[.H522])); 0) -> 0 | L522: of:=IF((ROW() - [.$B$13] < 3);0;FLOOR(IFERROR(OFFSET([.$F522];-1*[.$B$13];0 );0) * [.$B$14])) -> 0 | M522: of:=SUM([.L$3:.L522]) -> 6061951
D523: of:=[.D522]+1 -> 2021-06-23T00:00:00.000 | F523: of:=IF([.G522] < [.$B$25];CEILING([.G522]*[.$B$3];1);0) -> 0 | G523: of:=IF([.G522] < [.$B$25];SUM([.F$3:.F523]);[.$B$25]) -> 222350062.5 | H523: of:=IF((ROW() - [.$B$21] < 3);0;FLOOR(IFERROR(OFFSET([.$F523];-1*[.$B$21];0 );0) * [.$B$10])) -> 0 | I523: of:=SUM(INDEX([.H$1:.H$736];MAX(ROW()+(-1*[.$B$22])+1;3);1):INDEX([.H$1:.H$736];ROW();1)) -> 0 | J523: of:=IF([.I523] > [.$B$20];[.I523]-[.$B$20];0) -> 0 | K523: of:=IF([.J523] > 0; ROUND([.$B$23] *MIN([.J523];[.H523])); 0) -> 0 | L523: of:=IF((ROW() - [.$B$13] < 3);0;FLOOR(IFERROR(OFFSET([.$F523];-1*[.$B$13];0 );0) * [.$B$14])) -> 0 | M523: of:=SUM([.L$3:.L523]) -> 6061951
D524: of:=[.D523]+1 -> 2021-06-24T00:00:00.000 | F524: of:=IF([.G523] < [.$B$25];CEILING([.G523]*[.$B$3];1);0) -> 0 | G524: of:=IF([.G523] < [.$B$25];SUM([.F$3:.F524]);[.$B$25]) -> 222350062.5 | H524: of:=IF((ROW() - [.$B$21] < 3);0;FLOOR(IFERROR(OFFSET([.$F524];-1*[.$B$21];0 );0) * [.$B$10])) -> 0 | I524: of:=SUM(INDEX([.H$1:.H$736];MAX(ROW()+(-1*[.$B$22])+1;3);1):INDEX([.H$1:.H$736];ROW();1)) -> 0 | J524: of:=IF([.I524] > [.$B$20];[.I524]-[.$B$20];0) -> 0 | K524: of:=IF([.J524] > 0; ROUND([.$B$23] *MIN([.J524];[.H524])); 0) -> 0 | L524: of:=IF((ROW() - [.$B$13] < 3);0;FLOOR(IFERROR(OFFSET([.$F524];-1*[.$B$13];0 );0) * [.$B$14])) -> 0 | M524: of:=SUM([.L$3:.L524]) -> 6061951
D525: of:=[.D524]+1 -> 2021-06-25T00:00:00.000 | F525: of:=IF([.G524] < [.$B$25];CEILING([.G524]*[.$B$3];1);0) -> 0 | G525: of:=IF([.G524] < [.$B$25];SUM([.F$3:.F525]);[.$B$25]) -> 222350062.5 | H525: of:=IF((ROW() - [.$B$21] < 3);0;FLOOR(IFERROR(OFFSET([.$F525];-1*[.$B$21];0 );0) * [.$B$10])) -> 0 | I525: of:=SUM(INDEX([.H$1:.H$736];MAX(ROW()+(-1*[.$B$22])+1;3);1):INDEX([.H$1:.H$736];ROW();1)) -> 0 | J525: of:=IF([.I525] > [.$B$20];[.I525]-[.$B$20];0) -> 0 | K525: of:=IF([.J525] > 0; ROUND([.$B$23] *MIN([.J525];[.H525])); 0) -> 0 | L525: of:=IF((ROW() - [.$B$13] < 3);0;FLOOR(IFERROR(OFFSET([.$F525];-1*[.$B$13];0 );0) * [.$B$14])) -> 0 | M525: of:=SUM([.L$3:.L525]) -> 6061951
D526: of:=[.D525]+1 -> 2021-06-26T00:00:00.000 | F526: of:=IF([.G525] < [.$B$25];CEILING([.G525]*[.$B$3];1);0) -> 0 | G526: of:=IF([.G525] < [.$B$25];SUM([.F$3:.F526]);[.$B$25]) -> 222350062.5 | H526: of:=IF((ROW() - [.$B$21] < 3);0;FLOOR(IFERROR(OFFSET([.$F526];-1*[.$B$21];0 );0) * [.$B$10])) -> 0 | I526: of:=SUM(INDEX([.H$1:.H$736];MAX(ROW()+(-1*[.$B$22])+1;3);1):INDEX([.H$1:.H$736];ROW();1)) -> 0 | J526: of:=IF([.I526] > [.$B$20];[.I526]-[.$B$20];0) -> 0 | K526: of:=IF([.J526] > 0; ROUND([.$B$23] *MIN([.J526];[.H526])); 0) -> 0 | L526: of:=IF((ROW() - [.$B$13] < 3);0;FLOOR(IFERROR(OFFSET([.$F526];-1*[.$B$13];0 );0) * [.$B$14])) -> 0 | M526: of:=SUM([.L$3:.L526]) -> 6061951
D527: of:=[.D526]+1 -> 2021-06-27T00:00:00.000 | F527: of:=IF([.G526] < [.$B$25];CEILING([.G526]*[.$B$3];1);0) -> 0 | G527: of:=IF([.G526] < [.$B$25];SUM([.F$3:.F527]);[.$B$25]) -> 222350062.5 | H527: of:=IF((ROW() - [.$B$21] < 3);0;FLOOR(IFERROR(OFFSET([.$F527];-1*[.$B$21];0 );0) * [.$B$10])) -> 0 | I527: of:=SUM(INDEX([.H$1:.H$736];MAX(ROW()+(-1*[.$B$22])+1;3);1):INDEX([.H$1:.H$736];ROW();1)) -> 0 | J527: of:=IF([.I527] > [.$B$20];[.I527]-[.$B$20];0) -> 0 | K527: of:=IF([.J527] > 0; ROUND([.$B$23] *MIN([.J527];[.H527])); 0) -> 0 | L527: of:=IF((ROW() - [.$B$13] < 3);0;FLOOR(IFERROR(OFFSET([.$F527];-1*[.$B$13];0 );0) * [.$B$14])) -> 0 | M527: of:=SUM([.L$3:.L527]) -> 6061951
D528: of:=[.D527]+1 -> 2021-06-28T00:00:00.000 | F528: of:=IF([.G527] < [.$B$25];CEILING([.G527]*[.$B$3];1);0) -> 0 | G528: of:=IF([.G527] < [.$B$25];SUM([.F$3:.F528]);[.$B$25]) -> 222350062.5 | H528: of:=IF((ROW() - [.$B$21] < 3);0;FLOOR(IFERROR(OFFSET([.$F528];-1*[.$B$21];0 );0) * [.$B$10])) -> 0 | I528: of:=SUM(INDEX([.H$1:.H$736];MAX(ROW()+(-1*[.$B$22])+1;3);1):INDEX([.H$1:.H$736];ROW();1)) -> 0 | J528: of:=IF([.I528] > [.$B$20];[.I528]-[.$B$20];0) -> 0 | K528: of:=IF([.J528] > 0; ROUND([.$B$23] *MIN([.J528];[.H528])); 0) -> 0 | L528: of:=IF((ROW() - [.$B$13] < 3);0;FLOOR(IFERROR(OFFSET([.$F528];-1*[.$B$13];0 );0) * [.$B$14])) -> 0 | M528: of:=SUM([.L$3:.L528]) -> 6061951
D529: of:=[.D528]+1 -> 2021-06-29T00:00:00.000 | F529: of:=IF([.G528] < [.$B$25];CEILING([.G528]*[.$B$3];1);0) -> 0 | G529: of:=IF([.G528] < [.$B$25];SUM([.F$3:.F529]);[.$B$25]) -> 222350062.5 | H529: of:=IF((ROW() - [.$B$21] < 3);0;FLOOR(IFERROR(OFFSET([.$F529];-1*[.$B$21];0 );0) * [.$B$10])) -> 0 | I529: of:=SUM(INDEX([.H$1:.H$736];MAX(ROW()+(-1*[.$B$22])+1;3);1):INDEX([.H$1:.H$736];ROW();1)) -> 0 | J529: of:=IF([.I529] > [.$B$20];[.I529]-[.$B$20];0) -> 0 | K529: of:=IF([.J529] > 0; ROUND([.$B$23] *MIN([.J529];[.H529])); 0) -> 0 | L529: of:=IF((ROW() - [.$B$13] < 3);0;FLOOR(IFERROR(OFFSET([.$F529];-1*[.$B$13];0 );0) * [.$B$14])) -> 0 | M529: of:=SUM([.L$3:.L529]) -> 6061951
D530: of:=[.D529]+1 -> 2021-06-30T00:00:00.000 | F530: of:=IF([.G529] < [.$B$25];CEILING([.G529]*[.$B$3];1);0) -> 0 | G530: of:=IF([.G529] < [.$B$25];SUM([.F$3:.F530]);[.$B$25]) -> 222350062.5 | H530: of:=IF((ROW() - [.$B$21] < 3);0;FLOOR(IFERROR(OFFSET([.$F530];-1*[.$B$21];0 );0) * [.$B$10])) -> 0 | I530: of:=SUM(INDEX([.H$1:.H$736];MAX(ROW()+(-1*[.$B$22])+1;3);1):INDEX([.H$1:.H$736];ROW();1)) -> 0 | J530: of:=IF([.I530] > [.$B$20];[.I530]-[.$B$20];0) -> 0 | K530: of:=IF([.J530] > 0; ROUND([.$B$23] *MIN([.J530];[.H530])); 0) -> 0 | L530: of:=IF((ROW() - [.$B$13] < 3);0;FLOOR(IFERROR(OFFSET([.$F530];-1*[.$B$13];0 );0) * [.$B$14])) -> 0 | M530: of:=SUM([.L$3:.L530]) -> 6061951
D531: of:=[.D530]+1 -> 2021-07-01T00:00:00.000 | F531: of:=IF([.G530] < [.$B$25];CEILING([.G530]*[.$B$3];1);0) -> 0 | G531: of:=IF([.G530] < [.$B$25];SUM([.F$3:.F531]);[.$B$25]) -> 222350062.5 | H531: of:=IF((ROW() - [.$B$21] < 3);0;FLOOR(IFERROR(OFFSET([.$F531];-1*[.$B$21];0 );0) * [.$B$10])) -> 0 | I531: of:=SUM(INDEX([.H$1:.H$736];MAX(ROW()+(-1*[.$B$22])+1;3);1):INDEX([.H$1:.H$736];ROW();1)) -> 0 | J531: of:=IF([.I531] > [.$B$20];[.I531]-[.$B$20];0) -> 0 | K531: of:=IF([.J531] > 0; ROUND([.$B$23] *MIN([.J531];[.H531])); 0) -> 0 | L531: of:=IF((ROW() - [.$B$13] < 3);0;FLOOR(IFERROR(OFFSET([.$F531];-1*[.$B$13];0 );0) * [.$B$14])) -> 0 | M531: of:=SUM([.L$3:.L531]) -> 6061951
D532: of:=[.D531]+1 -> 2021-07-02T00:00:00.000 | F532: of:=IF([.G531] < [.$B$25];CEILING([.G531]*[.$B$3];1);0) -> 0 | G532: of:=IF([.G531] < [.$B$25];SUM([.F$3:.F532]);[.$B$25]) -> 222350062.5 | H532: of:=IF((ROW() - [.$B$21] < 3);0;FLOOR(IFERROR(OFFSET([.$F532];-1*[.$B$21];0 );0) * [.$B$10])) -> 0 | I532: of:=SUM(INDEX([.H$1:.H$736];MAX(ROW()+(-1*[.$B$22])+1;3);1):INDEX([.H$1:.H$736];ROW();1)) -> 0 | J532: of:=IF([.I532] > [.$B$20];[.I532]-[.$B$20];0) -> 0 | K532: of:=IF([.J532] > 0; ROUND([.$B$23] *MIN([.J532];[.H532])); 0) -> 0 | L532: of:=IF((ROW() - [.$B$13] < 3);0;FLOOR(IFERROR(OFFSET([.$F532];-1*[.$B$13];0 );0) * [.$B$14])) -> 0 | M532: of:=SUM([.L$3:.L532]) -> 6061951
D533: of:=[.D532]+1 -> 2021-07-03T00:00:00.000 | F533: of:=IF([.G532] < [.$B$25];CEILING([.G532]*[.$B$3];1);0) -> 0 | G533: of:=IF([.G532] < [.$B$25];SUM([.F$3:.F533]);[.$B$25]) -> 222350062.5 | H533: of:=IF((ROW() - [.$B$21] < 3);0;FLOOR(IFERROR(OFFSET([.$F533];-1*[.$B$21];0 );0) * [.$B$10])) -> 0 | I533: of:=SUM(INDEX([.H$1:.H$736];MAX(ROW()+(-1*[.$B$22])+1;3);1):INDEX([.H$1:.H$736];ROW();1)) -> 0 | J533: of:=IF([.I533] > [.$B$20];[.I533]-[.$B$20];0) -> 0 | K533: of:=IF([.J533] > 0; ROUND([.$B$23] *MIN([.J533];[.H533])); 0) -> 0 | L533: of:=IF((ROW() - [.$B$13] < 3);0;FLOOR(IFERROR(OFFSET([.$F533];-1*[.$B$13];0 );0) * [.$B$14])) -> 0 | M533: of:=SUM([.L$3:.L533]) -> 6061951
D534: of:=[.D533]+1 -> 2021-07-04T00:00:00.000 | F534: of:=IF([.G533] < [.$B$25];CEILING([.G533]*[.$B$3];1);0) -> 0 | G534: of:=IF([.G533] < [.$B$25];SUM([.F$3:.F534]);[.$B$25]) -> 222350062.5 | H534: of:=IF((ROW() - [.$B$21] < 3);0;FLOOR(IFERROR(OFFSET([.$F534];-1*[.$B$21];0 );0) * [.$B$10])) -> 0 | I534: of:=SUM(INDEX([.H$1:.H$736];MAX(ROW()+(-1*[.$B$22])+1;3);1):INDEX([.H$1:.H$736];ROW();1)) -> 0 | J534: of:=IF([.I534] > [.$B$20];[.I534]-[.$B$20];0) -> 0 | K534: of:=IF([.J534] > 0; ROUND([.$B$23] *MIN([.J534];[.H534])); 0) -> 0 | L534: of:=IF((ROW() - [.$B$13] < 3);0;FLOOR(IFERROR(OFFSET([.$F534];-1*[.$B$13];0 );0) * [.$B$14])) -> 0 | M534: of:=SUM([.L$3:.L534]) -> 6061951
D535: of:=[.D534]+1 -> 2021-07-05T00:00:00.000 | F535: of:=IF([.G534] < [.$B$25];CEILING([.G534]*[.$B$3];1);0) -> 0 | G535: of:=IF([.G534] < [.$B$25];SUM([.F$3:.F535]);[.$B$25]) -> 222350062.5 | H535: of:=IF((ROW() - [.$B$21] < 3);0;FLOOR(IFERROR(OFFSET([.$F535];-1*[.$B$21];0 );0) * [.$B$10])) -> 0 | I535: of:=SUM(INDEX([.H$1:.H$736];MAX(ROW()+(-1*[.$B$22])+1;3);1):INDEX([.H$1:.H$736];ROW();1)) -> 0 | J535: of:=IF([.I535] > [.$B$20];[.I535]-[.$B$20];0) -> 0 | K535: of:=IF([.J535] > 0; ROUND([.$B$23] *MIN([.J535];[.H535])); 0) -> 0 | L535: of:=IF((ROW() - [.$B$13] < 3);0;FLOOR(IFERROR(OFFSET([.$F535];-1*[.$B$13];0 );0) * [.$B$14])) -> 0 | M535: of:=SUM([.L$3:.L535]) -> 6061951
D536: of:=[.D535]+1 -> 2021-07-06T00:00:00.000 | F536: of:=IF([.G535] < [.$B$25];CEILING([.G535]*[.$B$3];1);0) -> 0 | G536: of:=IF([.G535] < [.$B$25];SUM([.F$3:.F536]);[.$B$25]) -> 222350062.5 | H536: of:=IF((ROW() - [.$B$21] < 3);0;FLOOR(IFERROR(OFFSET([.$F536];-1*[.$B$21];0 );0) * [.$B$10])) -> 0 | I536: of:=SUM(INDEX([.H$1:.H$736];MAX(ROW()+(-1*[.$B$22])+1;3);1):INDEX([.H$1:.H$736];ROW();1)) -> 0 | J536: of:=IF([.I536] > [.$B$20];[.I536]-[.$B$20];0) -> 0 | K536: of:=IF([.J536] > 0; ROUND([.$B$23] *MIN([.J536];[.H536])); 0) -> 0 | L536: of:=IF((ROW() - [.$B$13] < 3);0;FLOOR(IFERROR(OFFSET([.$F536];-1*[.$B$13];0 );0) * [.$B$14])) -> 0 | M536: of:=SUM([.L$3:.L536]) -> 6061951
D537: of:=[.D536]+1 -> 2021-07-07T00:00:00.000 | F537: of:=IF([.G536] < [.$B$25];CEILING([.G536]*[.$B$3];1);0) -> 0 | G537: of:=IF([.G536] < [.$B$25];SUM([.F$3:.F537]);[.$B$25]) -> 222350062.5 | H537: of:=IF((ROW() - [.$B$21] < 3);0;FLOOR(IFERROR(OFFSET([.$F537];-1*[.$B$21];0 );0) * [.$B$10])) -> 0 | I537: of:=SUM(INDEX([.H$1:.H$736];MAX(ROW()+(-1*[.$B$22])+1;3);1):INDEX([.H$1:.H$736];ROW();1)) -> 0 | J537: of:=IF([.I537] > [.$B$20];[.I537]-[.$B$20];0) -> 0 | K537: of:=IF([.J537] > 0; ROUND([.$B$23] *MIN([.J537];[.H537])); 0) -> 0 | L537: of:=IF((ROW() - [.$B$13] < 3);0;FLOOR(IFERROR(OFFSET([.$F537];-1*[.$B$13];0 );0) * [.$B$14])) -> 0 | M537: of:=SUM([.L$3:.L537]) -> 6061951
D538: of:=[.D537]+1 -> 2021-07-08T00:00:00.000 | F538: of:=IF([.G537] < [.$B$25];CEILING([.G537]*[.$B$3];1);0) -> 0 | G538: of:=IF([.G537] < [.$B$25];SUM([.F$3:.F538]);[.$B$25]) -> 222350062.5 | H538: of:=IF((ROW() - [.$B$21] < 3);0;FLOOR(IFERROR(OFFSET([.$F538];-1*[.$B$21];0 );0) * [.$B$10])) -> 0 | I538: of:=SUM(INDEX([.H$1:.H$736];MAX(ROW()+(-1*[.$B$22])+1;3);1):INDEX([.H$1:.H$736];ROW();1)) -> 0 | J538: of:=IF([.I538] > [.$B$20];[.I538]-[.$B$20];0) -> 0 | K538: of:=IF([.J538] > 0; ROUND([.$B$23] *MIN([.J538];[.H538])); 0) -> 0 | L538: of:=IF((ROW() - [.$B$13] < 3);0;FLOOR(IFERROR(OFFSET([.$F538];-1*[.$B$13];0 );0) * [.$B$14])) -> 0 | M538: of:=SUM([.L$3:.L538]) -> 6061951
D539: of:=[.D538]+1 -> 2021-07-09T00:00:00.000 | F539: of:=IF([.G538] < [.$B$25];CEILING([.G538]*[.$B$3];1);0) -> 0 | G539: of:=IF([.G538] < [.$B$25];SUM([.F$3:.F539]);[.$B$25]) -> 222350062.5 | H539: of:=IF((ROW() - [.$B$21] < 3);0;FLOOR(IFERROR(OFFSET([.$F539];-1*[.$B$21];0 );0) * [.$B$10])) -> 0 | I539: of:=SUM(INDEX([.H$1:.H$736];MAX(ROW()+(-1*[.$B$22])+1;3);1):INDEX([.H$1:.H$736];ROW();1)) -> 0 | J539: of:=IF([.I539] > [.$B$20];[.I539]-[.$B$20];0) -> 0 | K539: of:=IF([.J539] > 0; ROUND([.$B$23] *MIN([.J539];[.H539])); 0) -> 0 | L539: of:=IF((ROW() - [.$B$13] < 3);0;FLOOR(IFERROR(OFFSET([.$F539];-1*[.$B$13];0 );0) * [.$B$14])) -> 0 | M539: of:=SUM([.L$3:.L539]) -> 6061951
D540: of:=[.D539]+1 -> 2021-07-10T00:00:00.000 | F540: of:=IF([.G539] < [.$B$25];CEILING([.G539]*[.$B$3];1);0) -> 0 | G540: of:=IF([.G539] < [.$B$25];SUM([.F$3:.F540]);[.$B$25]) -> 222350062.5 | H540: of:=IF((ROW() - [.$B$21] < 3);0;FLOOR(IFERROR(OFFSET([.$F540];-1*[.$B$21];0 );0) * [.$B$10])) -> 0 | I540: of:=SUM(INDEX([.H$1:.H$736];MAX(ROW()+(-1*[.$B$22])+1;3);1):INDEX([.H$1:.H$736];ROW();1)) -> 0 | J540: of:=IF([.I540] > [.$B$20];[.I540]-[.$B$20];0) -> 0 | K540: of:=IF([.J540] > 0; ROUND([.$B$23] *MIN([.J540];[.H540])); 0) -> 0 | L540: of:=IF((ROW() - [.$B$13] < 3);0;FLOOR(IFERROR(OFFSET([.$F540];-1*[.$B$13];0 );0) * [.$B$14])) -> 0 | M540: of:=SUM([.L$3:.L540]) -> 6061951
D541: of:=[.D540]+1 -> 2021-07-11T00:00:00.000 | F541: of:=IF([.G540] < [.$B$25];CEILING([.G540]*[.$B$3];1);0) -> 0 | G541: of:=IF([.G540] < [.$B$25];SUM([.F$3:.F541]);[.$B$25]) -> 222350062.5 | H541: of:=IF((ROW() - [.$B$21] < 3);0;FLOOR(IFERROR(OFFSET([.$F541];-1*[.$B$21];0 );0) * [.$B$10])) -> 0 | I541: of:=SUM(INDEX([.H$1:.H$736];MAX(ROW()+(-1*[.$B$22])+1;3);1):INDEX([.H$1:.H$736];ROW();1)) -> 0 | J541: of:=IF([.I541] > [.$B$20];[.I541]-[.$B$20];0) -> 0 | K541: of:=IF([.J541] > 0; ROUND([.$B$23] *MIN([.J541];[.H541])); 0) -> 0 | L541: of:=IF((ROW() - [.$B$13] < 3);0;FLOOR(IFERROR(OFFSET([.$F541];-1*[.$B$13];0 );0) * [.$B$14])) -> 0 | M541: of:=SUM([.L$3:.L541]) -> 6061951
D542: of:=[.D541]+1 -> 2021-07-12T00:00:00.000 | F542: of:=IF([.G541] < [.$B$25];CEILING([.G541]*[.$B$3];1);0) -> 0 | G542: of:=IF([.G541] < [.$B$25];SUM([.F$3:.F542]);[.$B$25]) -> 222350062.5 | H542: of:=IF((ROW() - [.$B$21] < 3);0;FLOOR(IFERROR(OFFSET([.$F542];-1*[.$B$21];0 );0) * [.$B$10])) -> 0 | I542: of:=SUM(INDEX([.H$1:.H$736];MAX(ROW()+(-1*[.$B$22])+1;3);1):INDEX([.H$1:.H$736];ROW();1)) -> 0 | J542: of:=IF([.I542] > [.$B$20];[.I542]-[.$B$20];0) -> 0 | K542: of:=IF([.J542] > 0; ROUND([.$B$23] *MIN([.J542];[.H542])); 0) -> 0 | L542: of:=IF((ROW() - [.$B$13] < 3);0;FLOOR(IFERROR(OFFSET([.$F542];-1*[.$B$13];0 );0) * [.$B$14])) -> 0 | M542: of:=SUM([.L$3:.L542]) -> 6061951
D543: of:=[.D542]+1 -> 2021-07-13T00:00:00.000 | F543: of:=IF([.G542] < [.$B$25];CEILING([.G542]*[.$B$3];1);0) -> 0 | G543: of:=IF([.G542] < [.$B$25];SUM([.F$3:.F543]);[.$B$25]) -> 222350062.5 | H543: of:=IF((ROW() - [.$B$21] < 3);0;FLOOR(IFERROR(OFFSET([.$F543];-1*[.$B$21];0 );0) * [.$B$10])) -> 0 | I543: of:=SUM(INDEX([.H$1:.H$736];MAX(ROW()+(-1*[.$B$22])+1;3);1):INDEX([.H$1:.H$736];ROW();1)) -> 0 | J543: of:=IF([.I543] > [.$B$20];[.I543]-[.$B$20];0) -> 0 | K543: of:=IF([.J543] > 0; ROUND([.$B$23] *MIN([.J543];[.H543])); 0) -> 0 | L543: of:=IF((ROW() - [.$B$13] < 3);0;FLOOR(IFERROR(OFFSET([.$F543];-1*[.$B$13];0 );0) * [.$B$14])) -> 0 | M543: of:=SUM([.L$3:.L543]) -> 6061951
D544: of:=[.D543]+1 -> 2021-07-14T00:00:00.000 | F544: of:=IF([.G543] < [.$B$25];CEILING([.G543]*[.$B$3];1);0) -> 0 | G544: of:=IF([.G543] < [.$B$25];SUM([.F$3:.F544]);[.$B$25]) -> 222350062.5 | H544: of:=IF((ROW() - [.$B$21] < 3);0;FLOOR(IFERROR(OFFSET([.$F544];-1*[.$B$21];0 );0) * [.$B$10])) -> 0 | I544: of:=SUM(INDEX([.H$1:.H$736];MAX(ROW()+(-1*[.$B$22])+1;3);1):INDEX([.H$1:.H$736];ROW();1)) -> 0 | J544: of:=IF([.I544] > [.$B$20];[.I544]-[.$B$20];0) -> 0 | K544: of:=IF([.J544] > 0; ROUND([.$B$23] *MIN([.J544];[.H544])); 0) -> 0 | L544: of:=IF((ROW() - [.$B$13] < 3);0;FLOOR(IFERROR(OFFSET([.$F544];-1*[.$B$13];0 );0) * [.$B$14])) -> 0 | M544: of:=SUM([.L$3:.L544]) -> 6061951
D545: of:=[.D544]+1 -> 2021-07-15T00:00:00.000 | F545: of:=IF([.G544] < [.$B$25];CEILING([.G544]*[.$B$3];1);0) -> 0 | G545: of:=IF([.G544] < [.$B$25];SUM([.F$3:.F545]);[.$B$25]) -> 222350062.5 | H545: of:=IF((ROW() - [.$B$21] < 3);0;FLOOR(IFERROR(OFFSET([.$F545];-1*[.$B$21];0 );0) * [.$B$10])) -> 0 | I545: of:=SUM(INDEX([.H$1:.H$736];MAX(ROW()+(-1*[.$B$22])+1;3);1):INDEX([.H$1:.H$736];ROW();1)) -> 0 | J545: of:=IF([.I545] > [.$B$20];[.I545]-[.$B$20];0) -> 0 | K545: of:=IF([.J545] > 0; ROUND([.$B$23] *MIN([.J545];[.H545])); 0) -> 0 | L545: of:=IF((ROW() - [.$B$13] < 3);0;FLOOR(IFERROR(OFFSET([.$F545];-1*[.$B$13];0 );0) * [.$B$14])) -> 0 | M545: of:=SUM([.L$3:.L545]) -> 6061951
D546: of:=[.D545]+1 -> 2021-07-16T00:00:00.000 | F546: of:=IF([.G545] < [.$B$25];CEILING([.G545]*[.$B$3];1);0) -> 0 | G546: of:=IF([.G545] < [.$B$25];SUM([.F$3:.F546]);[.$B$25]) -> 222350062.5 | H546: of:=IF((ROW() - [.$B$21] < 3);0;FLOOR(IFERROR(OFFSET([.$F546];-1*[.$B$21];0 );0) * [.$B$10])) -> 0 | I546: of:=SUM(INDEX([.H$1:.H$736];MAX(ROW()+(-1*[.$B$22])+1;3);1):INDEX([.H$1:.H$736];ROW();1)) -> 0 | J546: of:=IF([.I546] > [.$B$20];[.I546]-[.$B$20];0) -> 0 | K546: of:=IF([.J546] > 0; ROUND([.$B$23] *MIN([.J546];[.H546])); 0) -> 0 | L546: of:=IF((ROW() - [.$B$13] < 3);0;FLOOR(IFERROR(OFFSET([.$F546];-1*[.$B$13];0 );0) * [.$B$14])) -> 0 | M546: of:=SUM([.L$3:.L546]) -> 6061951
D547: of:=[.D546]+1 -> 2021-07-17T00:00:00.000 | F547: of:=IF([.G546] < [.$B$25];CEILING([.G546]*[.$B$3];1);0) -> 0 | G547: of:=IF([.G546] < [.$B$25];SUM([.F$3:.F547]);[.$B$25]) -> 222350062.5 | H547: of:=IF((ROW() - [.$B$21] < 3);0;FLOOR(IFERROR(OFFSET([.$F547];-1*[.$B$21];0 );0) * [.$B$10])) -> 0 | I547: of:=SUM(INDEX([.H$1:.H$736];MAX(ROW()+(-1*[.$B$22])+1;3);1):INDEX([.H$1:.H$736];ROW();1)) -> 0 | J547: of:=IF([.I547] > [.$B$20];[.I547]-[.$B$20];0) -> 0 | K547: of:=IF([.J547] > 0; ROUND([.$B$23] *MIN([.J547];[.H547])); 0) -> 0 | L547: of:=IF((ROW() - [.$B$13] < 3);0;FLOOR(IFERROR(OFFSET([.$F547];-1*[.$B$13];0 );0) * [.$B$14])) -> 0 | M547: of:=SUM([.L$3:.L547]) -> 6061951
D548: of:=[.D547]+1 -> 2021-07-18T00:00:00.000 | F548: of:=IF([.G547] < [.$B$25];CEILING([.G547]*[.$B$3];1);0) -> 0 | G548: of:=IF([.G547] < [.$B$25];SUM([.F$3:.F548]);[.$B$25]) -> 222350062.5 | H548: of:=IF((ROW() - [.$B$21] < 3);0;FLOOR(IFERROR(OFFSET([.$F548];-1*[.$B$21];0 );0) * [.$B$10])) -> 0 | I548: of:=SUM(INDEX([.H$1:.H$736];MAX(ROW()+(-1*[.$B$22])+1;3);1):INDEX([.H$1:.H$736];ROW();1)) -> 0 | J548: of:=IF([.I548] > [.$B$20];[.I548]-[.$B$20];0) -> 0 | K548: of:=IF([.J548] > 0; ROUND([.$B$23] *MIN([.J548];[.H548])); 0) -> 0 | L548: of:=IF((ROW() - [.$B$13] < 3);0;FLOOR(IFERROR(OFFSET([.$F548];-1*[.$B$13];0 );0) * [.$B$14])) -> 0 | M548: of:=SUM([.L$3:.L548]) -> 6061951
D549: of:=[.D548]+1 -> 2021-07-19T00:00:00.000 | F549: of:=IF([.G548] < [.$B$25];CEILING([.G548]*[.$B$3];1);0) -> 0 | G549: of:=IF([.G548] < [.$B$25];SUM([.F$3:.F549]);[.$B$25]) -> 222350062.5 | H549: of:=IF((ROW() - [.$B$21] < 3);0;FLOOR(IFERROR(OFFSET([.$F549];-1*[.$B$21];0 );0) * [.$B$10])) -> 0 | I549: of:=SUM(INDEX([.H$1:.H$736];MAX(ROW()+(-1*[.$B$22])+1;3);1):INDEX([.H$1:.H$736];ROW();1)) -> 0 | J549: of:=IF([.I549] > [.$B$20];[.I549]-[.$B$20];0) -> 0 | K549: of:=IF([.J549] > 0; ROUND([.$B$23] *MIN([.J549];[.H549])); 0) -> 0 | L549: of:=IF((ROW() - [.$B$13] < 3);0;FLOOR(IFERROR(OFFSET([.$F549];-1*[.$B$13];0 );0) * [.$B$14])) -> 0 | M549: of:=SUM([.L$3:.L549]) -> 6061951
D550: of:=[.D549]+1 -> 2021-07-20T00:00:00.000 | F550: of:=IF([.G549] < [.$B$25];CEILING([.G549]*[.$B$3];1);0) -> 0 | G550: of:=IF([.G549] < [.$B$25];SUM([.F$3:.F550]);[.$B$25]) -> 222350062.5 | H550: of:=IF((ROW() - [.$B$21] < 3);0;FLOOR(IFERROR(OFFSET([.$F550];-1*[.$B$21];0 );0) * [.$B$10])) -> 0 | I550: of:=SUM(INDEX([.H$1:.H$736];MAX(ROW()+(-1*[.$B$22])+1;3);1):INDEX([.H$1:.H$736];ROW();1)) -> 0 | J550: of:=IF([.I550] > [.$B$20];[.I550]-[.$B$20];0) -> 0 | K550: of:=IF([.J550] > 0; ROUND([.$B$23] *MIN([.J550];[.H550])); 0) -> 0 | L550: of:=IF((ROW() - [.$B$13] < 3);0;FLOOR(IFERROR(OFFSET([.$F550];-1*[.$B$13];0 );0) * [.$B$14])) -> 0 | M550: of:=SUM([.L$3:.L550]) -> 6061951
D551: of:=[.D550]+1 -> 2021-07-21T00:00:00.000 | F551: of:=IF([.G550] < [.$B$25];CEILING([.G550]*[.$B$3];1);0) -> 0 | G551: of:=IF([.G550] < [.$B$25];SUM([.F$3:.F551]);[.$B$25]) -> 222350062.5 | H551: of:=IF((ROW() - [.$B$21] < 3);0;FLOOR(IFERROR(OFFSET([.$F551];-1*[.$B$21];0 );0) * [.$B$10])) -> 0 | I551: of:=SUM(INDEX([.H$1:.H$736];MAX(ROW()+(-1*[.$B$22])+1;3);1):INDEX([.H$1:.H$736];ROW();1)) -> 0 | J551: of:=IF([.I551] > [.$B$20];[.I551]-[.$B$20];0) -> 0 | K551: of:=IF([.J551] > 0; ROUND([.$B$23] *MIN([.J551];[.H551])); 0) -> 0 | L551: of:=IF((ROW() - [.$B$13] < 3);0;FLOOR(IFERROR(OFFSET([.$F551];-1*[.$B$13];0 );0) * [.$B$14])) -> 0 | M551: of:=SUM([.L$3:.L551]) -> 6061951
D552: of:=[.D551]+1 -> 2021-07-22T00:00:00.000 | F552: of:=IF([.G551] < [.$B$25];CEILING([.G551]*[.$B$3];1);0) -> 0 | G552: of:=IF([.G551] < [.$B$25];SUM([.F$3:.F552]);[.$B$25]) -> 222350062.5 | H552: of:=IF((ROW() - [.$B$21] < 3);0;FLOOR(IFERROR(OFFSET([.$F552];-1*[.$B$21];0 );0) * [.$B$10])) -> 0 | I552: of:=SUM(INDEX([.H$1:.H$736];MAX(ROW()+(-1*[.$B$22])+1;3);1):INDEX([.H$1:.H$736];ROW();1)) -> 0 | J552: of:=IF([.I552] > [.$B$20];[.I552]-[.$B$20];0) -> 0 | K552: of:=IF([.J552] > 0; ROUND([.$B$23] *MIN([.J552];[.H552])); 0) -> 0 | L552: of:=IF((ROW() - [.$B$13] < 3);0;FLOOR(IFERROR(OFFSET([.$F552];-1*[.$B$13];0 );0) * [.$B$14])) -> 0 | M552: of:=SUM([.L$3:.L552]) -> 6061951
D553: of:=[.D552]+1 -> 2021-07-23T00:00:00.000 | F553: of:=IF([.G552] < [.$B$25];CEILING([.G552]*[.$B$3];1);0) -> 0 | G553: of:=IF([.G552] < [.$B$25];SUM([.F$3:.F553]);[.$B$25]) -> 222350062.5 | H553: of:=IF((ROW() - [.$B$21] < 3);0;FLOOR(IFERROR(OFFSET([.$F553];-1*[.$B$21];0 );0) * [.$B$10])) -> 0 | I553: of:=SUM(INDEX([.H$1:.H$736];MAX(ROW()+(-1*[.$B$22])+1;3);1):INDEX([.H$1:.H$736];ROW();1)) -> 0 | J553: of:=IF([.I553] > [.$B$20];[.I553]-[.$B$20];0) -> 0 | K553: of:=IF([.J553] > 0; ROUND([.$B$23] *MIN([.J553];[.H553])); 0) -> 0 | L553: of:=IF((ROW() - [.$B$13] < 3);0;FLOOR(IFERROR(OFFSET([.$F553];-1*[.$B$13];0 );0) * [.$B$14])) -> 0 | M553: of:=SUM([.L$3:.L553]) -> 6061951
D554: of:=[.D553]+1 -> 2021-07-24T00:00:00.000 | F554: of:=IF([.G553] < [.$B$25];CEILING([.G553]*[.$B$3];1);0) -> 0 | G554: of:=IF([.G553] < [.$B$25];SUM([.F$3:.F554]);[.$B$25]) -> 222350062.5 | H554: of:=IF((ROW() - [.$B$21] < 3);0;FLOOR(IFERROR(OFFSET([.$F554];-1*[.$B$21];0 );0) * [.$B$10])) -> 0 | I554: of:=SUM(INDEX([.H$1:.H$736];MAX(ROW()+(-1*[.$B$22])+1;3);1):INDEX([.H$1:.H$736];ROW();1)) -> 0 | J554: of:=IF([.I554] > [.$B$20];[.I554]-[.$B$20];0) -> 0 | K554: of:=IF([.J554] > 0; ROUND([.$B$23] *MIN([.J554];[.H554])); 0) -> 0 | L554: of:=IF((ROW() - [.$B$13] < 3);0;FLOOR(IFERROR(OFFSET([.$F554];-1*[.$B$13];0 );0) * [.$B$14])) -> 0 | M554: of:=SUM([.L$3:.L554]) -> 6061951
D555: of:=[.D554]+1 -> 2021-07-25T00:00:00.000 | F555: of:=IF([.G554] < [.$B$25];CEILING([.G554]*[.$B$3];1);0) -> 0 | G555: of:=IF([.G554] < [.$B$25];SUM([.F$3:.F555]);[.$B$25]) -> 222350062.5 | H555: of:=IF((ROW() - [.$B$21] < 3);0;FLOOR(IFERROR(OFFSET([.$F555];-1*[.$B$21];0 );0) * [.$B$10])) -> 0 | I555: of:=SUM(INDEX([.H$1:.H$736];MAX(ROW()+(-1*[.$B$22])+1;3);1):INDEX([.H$1:.H$736];ROW();1)) -> 0 | J555: of:=IF([.I555] > [.$B$20];[.I555]-[.$B$20];0) -> 0 | K555: of:=IF([.J555] > 0; ROUND([.$B$23] *MIN([.J555];[.H555])); 0) -> 0 | L555: of:=IF((ROW() - [.$B$13] < 3);0;FLOOR(IFERROR(OFFSET([.$F555];-1*[.$B$13];0 );0) * [.$B$14])) -> 0 | M555: of:=SUM([.L$3:.L555]) -> 6061951
D556: of:=[.D555]+1 -> 2021-07-26T00:00:00.000 | F556: of:=IF([.G555] < [.$B$25];CEILING([.G555]*[.$B$3];1);0) -> 0 | G556: of:=IF([.G555] < [.$B$25];SUM([.F$3:.F556]);[.$B$25]) -> 222350062.5 | H556: of:=IF((ROW() - [.$B$21] < 3);0;FLOOR(IFERROR(OFFSET([.$F556];-1*[.$B$21];0 );0) * [.$B$10])) -> 0 | I556: of:=SUM(INDEX([.H$1:.H$736];MAX(ROW()+(-1*[.$B$22])+1;3);1):INDEX([.H$1:.H$736];ROW();1)) -> 0 | J556: of:=IF([.I556] > [.$B$20];[.I556]-[.$B$20];0) -> 0 | K556: of:=IF([.J556] > 0; ROUND([.$B$23] *MIN([.J556];[.H556])); 0) -> 0 | L556: of:=IF((ROW() - [.$B$13] < 3);0;FLOOR(IFERROR(OFFSET([.$F556];-1*[.$B$13];0 );0) * [.$B$14])) -> 0 | M556: of:=SUM([.L$3:.L556]) -> 6061951
D557: of:=[.D556]+1 -> 2021-07-27T00:00:00.000 | F557: of:=IF([.G556] < [.$B$25];CEILING([.G556]*[.$B$3];1);0) -> 0 | G557: of:=IF([.G556] < [.$B$25];SUM([.F$3:.F557]);[.$B$25]) -> 222350062.5 | H557: of:=IF((ROW() - [.$B$21] < 3);0;FLOOR(IFERROR(OFFSET([.$F557];-1*[.$B$21];0 );0) * [.$B$10])) -> 0 | I557: of:=SUM(INDEX([.H$1:.H$736];MAX(ROW()+(-1*[.$B$22])+1;3);1):INDEX([.H$1:.H$736];ROW();1)) -> 0 | J557: of:=IF([.I557] > [.$B$20];[.I557]-[.$B$20];0) -> 0 | K557: of:=IF([.J557] > 0; ROUND([.$B$23] *MIN([.J557];[.H557])); 0) -> 0 | L557: of:=IF((ROW() - [.$B$13] < 3);0;FLOOR(IFERROR(OFFSET([.$F557];-1*[.$B$13];0 );0) * [.$B$14])) -> 0 | M557: of:=SUM([.L$3:.L557]) -> 6061951
D558: of:=[.D557]+1 -> 2021-07-28T00:00:00.000 | F558: of:=IF([.G557] < [.$B$25];CEILING([.G557]*[.$B$3];1);0) -> 0 | G558: of:=IF([.G557] < [.$B$25];SUM([.F$3:.F558]);[.$B$25]) -> 222350062.5 | H558: of:=IF((ROW() - [.$B$21] < 3);0;FLOOR(IFERROR(OFFSET([.$F558];-1*[.$B$21];0 );0) * [.$B$10])) -> 0 | I558: of:=SUM(INDEX([.H$1:.H$736];MAX(ROW()+(-1*[.$B$22])+1;3);1):INDEX([.H$1:.H$736];ROW();1)) -> 0 | J558: of:=IF([.I558] > [.$B$20];[.I558]-[.$B$20];0) -> 0 | K558: of:=IF([.J558] > 0; ROUND([.$B$23] *MIN([.J558];[.H558])); 0) -> 0 | L558: of:=IF((ROW() - [.$B$13] < 3);0;FLOOR(IFERROR(OFFSET([.$F558];-1*[.$B$13];0 );0) * [.$B$14])) -> 0 | M558: of:=SUM([.L$3:.L558]) -> 6061951
D559: of:=[.D558]+1 -> 2021-07-29T00:00:00.000 | F559: of:=IF([.G558] < [.$B$25];CEILING([.G558]*[.$B$3];1);0) -> 0 | G559: of:=IF([.G558] < [.$B$25];SUM([.F$3:.F559]);[.$B$25]) -> 222350062.5 | H559: of:=IF((ROW() - [.$B$21] < 3);0;FLOOR(IFERROR(OFFSET([.$F559];-1*[.$B$21];0 );0) * [.$B$10])) -> 0 | I559: of:=SUM(INDEX([.H$1:.H$736];MAX(ROW()+(-1*[.$B$22])+1;3);1):INDEX([.H$1:.H$736];ROW();1)) -> 0 | J559: of:=IF([.I559] > [.$B$20];[.I559]-[.$B$20];0) -> 0 | K559: of:=IF([.J559] > 0; ROUND([.$B$23] *MIN([.J559];[.H559])); 0) -> 0 | L559: of:=IF((ROW() - [.$B$13] < 3);0;FLOOR(IFERROR(OFFSET([.$F559];-1*[.$B$13];0 );0) * [.$B$14])) -> 0 | M559: of:=SUM([.L$3:.L559]) -> 6061951
D560: of:=[.D559]+1 -> 2021-07-30T00:00:00.000 | F560: of:=IF([.G559] < [.$B$25];CEILING([.G559]*[.$B$3];1);0) -> 0 | G560: of:=IF([.G559] < [.$B$25];SUM([.F$3:.F560]);[.$B$25]) -> 222350062.5 | H560: of:=IF((ROW() - [.$B$21] < 3);0;FLOOR(IFERROR(OFFSET([.$F560];-1*[.$B$21];0 );0) * [.$B$10])) -> 0 | I560: of:=SUM(INDEX([.H$1:.H$736];MAX(ROW()+(-1*[.$B$22])+1;3);1):INDEX([.H$1:.H$736];ROW();1)) -> 0 | J560: of:=IF([.I560] > [.$B$20];[.I560]-[.$B$20];0) -> 0 | K560: of:=IF([.J560] > 0; ROUND([.$B$23] *MIN([.J560];[.H560])); 0) -> 0 | L560: of:=IF((ROW() - [.$B$13] < 3);0;FLOOR(IFERROR(OFFSET([.$F560];-1*[.$B$13];0 );0) * [.$B$14])) -> 0 | M560: of:=SUM([.L$3:.L560]) -> 6061951
D561: of:=[.D560]+1 -> 2021-07-31T00:00:00.000 | F561: of:=IF([.G560] < [.$B$25];CEILING([.G560]*[.$B$3];1);0) -> 0 | G561: of:=IF([.G560] < [.$B$25];SUM([.F$3:.F561]);[.$B$25]) -> 222350062.5 | H561: of:=IF((ROW() - [.$B$21] < 3);0;FLOOR(IFERROR(OFFSET([.$F561];-1*[.$B$21];0 );0) * [.$B$10])) -> 0 | I561: of:=SUM(INDEX([.H$1:.H$736];MAX(ROW()+(-1*[.$B$22])+1;3);1):INDEX([.H$1:.H$736];ROW();1)) -> 0 | J561: of:=IF([.I561] > [.$B$20];[.I561]-[.$B$20];0) -> 0 | K561: of:=IF([.J561] > 0; ROUND([.$B$23] *MIN([.J561];[.H561])); 0) -> 0 | L561: of:=IF((ROW() - [.$B$13] < 3);0;FLOOR(IFERROR(OFFSET([.$F561];-1*[.$B$13];0 );0) * [.$B$14])) -> 0 | M561: of:=SUM([.L$3:.L561]) -> 6061951
D562: of:=[.D561]+1 -> 2021-08-01T00:00:00.000 | F562: of:=IF([.G561] < [.$B$25];CEILING([.G561]*[.$B$3];1);0) -> 0 | G562: of:=IF([.G561] < [.$B$25];SUM([.F$3:.F562]);[.$B$25]) -> 222350062.5 | H562: of:=IF((ROW() - [.$B$21] < 3);0;FLOOR(IFERROR(OFFSET([.$F562];-1*[.$B$21];0 );0) * [.$B$10])) -> 0 | I562: of:=SUM(INDEX([.H$1:.H$736];MAX(ROW()+(-1*[.$B$22])+1;3);1):INDEX([.H$1:.H$736];ROW();1)) -> 0 | J562: of:=IF([.I562] > [.$B$20];[.I562]-[.$B$20];0) -> 0 | K562: of:=IF([.J562] > 0; ROUND([.$B$23] *MIN([.J562];[.H562])); 0) -> 0 | L562: of:=IF((ROW() - [.$B$13] < 3);0;FLOOR(IFERROR(OFFSET([.$F562];-1*[.$B$13];0 );0) * [.$B$14])) -> 0 | M562: of:=SUM([.L$3:.L562]) -> 6061951
D563: of:=[.D562]+1 -> 2021-08-02T00:00:00.000 | F563: of:=IF([.G562] < [.$B$25];CEILING([.G562]*[.$B$3];1);0) -> 0 | G563: of:=IF([.G562] < [.$B$25];SUM([.F$3:.F563]);[.$B$25]) -> 222350062.5 | H563: of:=IF((ROW() - [.$B$21] < 3);0;FLOOR(IFERROR(OFFSET([.$F563];-1*[.$B$21];0 );0) * [.$B$10])) -> 0 | I563: of:=SUM(INDEX([.H$1:.H$736];MAX(ROW()+(-1*[.$B$22])+1;3);1):INDEX([.H$1:.H$736];ROW();1)) -> 0 | J563: of:=IF([.I563] > [.$B$20];[.I563]-[.$B$20];0) -> 0 | K563: of:=IF([.J563] > 0; ROUND([.$B$23] *MIN([.J563];[.H563])); 0) -> 0 | L563: of:=IF((ROW() - [.$B$13] < 3);0;FLOOR(IFERROR(OFFSET([.$F563];-1*[.$B$13];0 );0) * [.$B$14])) -> 0 | M563: of:=SUM([.L$3:.L563]) -> 6061951
D564: of:=[.D563]+1 -> 2021-08-03T00:00:00.000 | F564: of:=IF([.G563] < [.$B$25];CEILING([.G563]*[.$B$3];1);0) -> 0 | G564: of:=IF([.G563] < [.$B$25];SUM([.F$3:.F564]);[.$B$25]) -> 222350062.5 | H564: of:=IF((ROW() - [.$B$21] < 3);0;FLOOR(IFERROR(OFFSET([.$F564];-1*[.$B$21];0 );0) * [.$B$10])) -> 0 | I564: of:=SUM(INDEX([.H$1:.H$736];MAX(ROW()+(-1*[.$B$22])+1;3);1):INDEX([.H$1:.H$736];ROW();1)) -> 0 | J564: of:=IF([.I564] > [.$B$20];[.I564]-[.$B$20];0) -> 0 | K564: of:=IF([.J564] > 0; ROUND([.$B$23] *MIN([.J564];[.H564])); 0) -> 0 | L564: of:=IF((ROW() - [.$B$13] < 3);0;FLOOR(IFERROR(OFFSET([.$F564];-1*[.$B$13];0 );0) * [.$B$14])) -> 0 | M564: of:=SUM([.L$3:.L564]) -> 6061951
D565: of:=[.D564]+1 -> 2021-08-04T00:00:00.000 | F565: of:=IF([.G564] < [.$B$25];CEILING([.G564]*[.$B$3];1);0) -> 0 | G565: of:=IF([.G564] < [.$B$25];SUM([.F$3:.F565]);[.$B$25]) -> 222350062.5 | H565: of:=IF((ROW() - [.$B$21] < 3);0;FLOOR(IFERROR(OFFSET([.$F565];-1*[.$B$21];0 );0) * [.$B$10])) -> 0 | I565: of:=SUM(INDEX([.H$1:.H$736];MAX(ROW()+(-1*[.$B$22])+1;3);1):INDEX([.H$1:.H$736];ROW();1)) -> 0 | J565: of:=IF([.I565] > [.$B$20];[.I565]-[.$B$20];0) -> 0 | K565: of:=IF([.J565] > 0; ROUND([.$B$23] *MIN([.J565];[.H565])); 0) -> 0 | L565: of:=IF((ROW() - [.$B$13] < 3);0;FLOOR(IFERROR(OFFSET([.$F565];-1*[.$B$13];0 );0) * [.$B$14])) -> 0 | M565: of:=SUM([.L$3:.L565]) -> 6061951
D566: of:=[.D565]+1 -> 2021-08-05T00:00:00.000 | F566: of:=IF([.G565] < [.$B$25];CEILING([.G565]*[.$B$3];1);0) -> 0 | G566: of:=IF([.G565] < [.$B$25];SUM([.F$3:.F566]);[.$B$25]) -> 222350062.5 | H566: of:=IF((ROW() - [.$B$21] < 3);0;FLOOR(IFERROR(OFFSET([.$F566];-1*[.$B$21];0 );0) * [.$B$10])) -> 0 | I566: of:=SUM(INDEX([.H$1:.H$736];MAX(ROW()+(-1*[.$B$22])+1;3);1):INDEX([.H$1:.H$736];ROW();1)) -> 0 | J566: of:=IF([.I566] > [.$B$20];[.I566]-[.$B$20];0) -> 0 | K566: of:=IF([.J566] > 0; ROUND([.$B$23] *MIN([.J566];[.H566])); 0) -> 0 | L566: of:=IF((ROW() - [.$B$13] < 3);0;FLOOR(IFERROR(OFFSET([.$F566];-1*[.$B$13];0 );0) * [.$B$14])) -> 0 | M566: of:=SUM([.L$3:.L566]) -> 6061951
D567: of:=[.D566]+1 -> 2021-08-06T00:00:00.000 | F567: of:=IF([.G566] < [.$B$25];CEILING([.G566]*[.$B$3];1);0) -> 0 | G567: of:=IF([.G566] < [.$B$25];SUM([.F$3:.F567]);[.$B$25]) -> 222350062.5 | H567: of:=IF((ROW() - [.$B$21] < 3);0;FLOOR(IFERROR(OFFSET([.$F567];-1*[.$B$21];0 );0) * [.$B$10])) -> 0 | I567: of:=SUM(INDEX([.H$1:.H$736];MAX(ROW()+(-1*[.$B$22])+1;3);1):INDEX([.H$1:.H$736];ROW();1)) -> 0 | J567: of:=IF([.I567] > [.$B$20];[.I567]-[.$B$20];0) -> 0 | K567: of:=IF([.J567] > 0; ROUND([.$B$23] *MIN([.J567];[.H567])); 0) -> 0 | L567: of:=IF((ROW() - [.$B$13] < 3);0;FLOOR(IFERROR(OFFSET([.$F567];-1*[.$B$13];0 );0) * [.$B$14])) -> 0 | M567: of:=SUM([.L$3:.L567]) -> 6061951
D568: of:=[.D567]+1 -> 2021-08-07T00:00:00.000 | F568: of:=IF([.G567] < [.$B$25];CEILING([.G567]*[.$B$3];1);0) -> 0 | G568: of:=IF([.G567] < [.$B$25];SUM([.F$3:.F568]);[.$B$25]) -> 222350062.5 | H568: of:=IF((ROW() - [.$B$21] < 3);0;FLOOR(IFERROR(OFFSET([.$F568];-1*[.$B$21];0 );0) * [.$B$10])) -> 0 | I568: of:=SUM(INDEX([.H$1:.H$736];MAX(ROW()+(-1*[.$B$22])+1;3);1):INDEX([.H$1:.H$736];ROW();1)) -> 0 | J568: of:=IF([.I568] > [.$B$20];[.I568]-[.$B$20];0) -> 0 | K568: of:=IF([.J568] > 0; ROUND([.$B$23] *MIN([.J568];[.H568])); 0) -> 0 | L568: of:=IF((ROW() - [.$B$13] < 3);0;FLOOR(IFERROR(OFFSET([.$F568];-1*[.$B$13];0 );0) * [.$B$14])) -> 0 | M568: of:=SUM([.L$3:.L568]) -> 6061951
D569: of:=[.D568]+1 -> 2021-08-08T00:00:00.000 | F569: of:=IF([.G568] < [.$B$25];CEILING([.G568]*[.$B$3];1);0) -> 0 | G569: of:=IF([.G568] < [.$B$25];SUM([.F$3:.F569]);[.$B$25]) -> 222350062.5 | H569: of:=IF((ROW() - [.$B$21] < 3);0;FLOOR(IFERROR(OFFSET([.$F569];-1*[.$B$21];0 );0) * [.$B$10])) -> 0 | I569: of:=SUM(INDEX([.H$1:.H$736];MAX(ROW()+(-1*[.$B$22])+1;3);1):INDEX([.H$1:.H$736];ROW();1)) -> 0 | J569: of:=IF([.I569] > [.$B$20];[.I569]-[.$B$20];0) -> 0 | K569: of:=IF([.J569] > 0; ROUND([.$B$23] *MIN([.J569];[.H569])); 0) -> 0 | L569: of:=IF((ROW() - [.$B$13] < 3);0;FLOOR(IFERROR(OFFSET([.$F569];-1*[.$B$13];0 );0) * [.$B$14])) -> 0 | M569: of:=SUM([.L$3:.L569]) -> 6061951
D570: of:=[.D569]+1 -> 2021-08-09T00:00:00.000 | F570: of:=IF([.G569] < [.$B$25];CEILING([.G569]*[.$B$3];1);0) -> 0 | G570: of:=IF([.G569] < [.$B$25];SUM([.F$3:.F570]);[.$B$25]) -> 222350062.5 | H570: of:=IF((ROW() - [.$B$21] < 3);0;FLOOR(IFERROR(OFFSET([.$F570];-1*[.$B$21];0 );0) * [.$B$10])) -> 0 | I570: of:=SUM(INDEX([.H$1:.H$736];MAX(ROW()+(-1*[.$B$22])+1;3);1):INDEX([.H$1:.H$736];ROW();1)) -> 0 | J570: of:=IF([.I570] > [.$B$20];[.I570]-[.$B$20];0) -> 0 | K570: of:=IF([.J570] > 0; ROUND([.$B$23] *MIN([.J570];[.H570])); 0) -> 0 | L570: of:=IF((ROW() - [.$B$13] < 3);0;FLOOR(IFERROR(OFFSET([.$F570];-1*[.$B$13];0 );0) * [.$B$14])) -> 0 | M570: of:=SUM([.L$3:.L570]) -> 6061951
D571: of:=[.D570]+1 -> 2021-08-10T00:00:00.000 | F571: of:=IF([.G570] < [.$B$25];CEILING([.G570]*[.$B$3];1);0) -> 0 | G571: of:=IF([.G570] < [.$B$25];SUM([.F$3:.F571]);[.$B$25]) -> 222350062.5 | H571: of:=IF((ROW() - [.$B$21] < 3);0;FLOOR(IFERROR(OFFSET([.$F571];-1*[.$B$21];0 );0) * [.$B$10])) -> 0 | I571: of:=SUM(INDEX([.H$1:.H$736];MAX(ROW()+(-1*[.$B$22])+1;3);1):INDEX([.H$1:.H$736];ROW();1)) -> 0 | J571: of:=IF([.I571] > [.$B$20];[.I571]-[.$B$20];0) -> 0 | K571: of:=IF([.J571] > 0; ROUND([.$B$23] *MIN([.J571];[.H571])); 0) -> 0 | L571: of:=IF((ROW() - [.$B$13] < 3);0;FLOOR(IFERROR(OFFSET([.$F571];-1*[.$B$13];0 );0) * [.$B$14])) -> 0 | M571: of:=SUM([.L$3:.L571]) -> 6061951
D572: of:=[.D571]+1 -> 2021-08-11T00:00:00.000 | F572: of:=IF([.G571] < [.$B$25];CEILING([.G571]*[.$B$3];1);0) -> 0 | G572: of:=IF([.G571] < [.$B$25];SUM([.F$3:.F572]);[.$B$25]) -> 222350062.5 | H572: of:=IF((ROW() - [.$B$21] < 3);0;FLOOR(IFERROR(OFFSET([.$F572];-1*[.$B$21];0 );0) * [.$B$10])) -> 0 | I572: of:=SUM(INDEX([.H$1:.H$736];MAX(ROW()+(-1*[.$B$22])+1;3);1):INDEX([.H$1:.H$736];ROW();1)) -> 0 | J572: of:=IF([.I572] > [.$B$20];[.I572]-[.$B$20];0) -> 0 | K572: of:=IF([.J572] > 0; ROUND([.$B$23] *MIN([.J572];[.H572])); 0) -> 0 | L572: of:=IF((ROW() - [.$B$13] < 3);0;FLOOR(IFERROR(OFFSET([.$F572];-1*[.$B$13];0 );0) * [.$B$14])) -> 0 | M572: of:=SUM([.L$3:.L572]) -> 6061951
D573: of:=[.D572]+1 -> 2021-08-12T00:00:00.000 | F573: of:=IF([.G572] < [.$B$25];CEILING([.G572]*[.$B$3];1);0) -> 0 | G573: of:=IF([.G572] < [.$B$25];SUM([.F$3:.F573]);[.$B$25]) -> 222350062.5 | H573: of:=IF((ROW() - [.$B$21] < 3);0;FLOOR(IFERROR(OFFSET([.$F573];-1*[.$B$21];0 );0) * [.$B$10])) -> 0 | I573: of:=SUM(INDEX([.H$1:.H$736];MAX(ROW()+(-1*[.$B$22])+1;3);1):INDEX([.H$1:.H$736];ROW();1)) -> 0 | J573: of:=IF([.I573] > [.$B$20];[.I573]-[.$B$20];0) -> 0 | K573: of:=IF([.J573] > 0; ROUND([.$B$23] *MIN([.J573];[.H573])); 0) -> 0 | L573: of:=IF((ROW() - [.$B$13] < 3);0;FLOOR(IFERROR(OFFSET([.$F573];-1*[.$B$13];0 );0) * [.$B$14])) -> 0 | M573: of:=SUM([.L$3:.L573]) -> 6061951
D574: of:=[.D573]+1 -> 2021-08-13T00:00:00.000 | F574: of:=IF([.G573] < [.$B$25];CEILING([.G573]*[.$B$3];1);0) -> 0 | G574: of:=IF([.G573] < [.$B$25];SUM([.F$3:.F574]);[.$B$25]) -> 222350062.5 | H574: of:=IF((ROW() - [.$B$21] < 3);0;FLOOR(IFERROR(OFFSET([.$F574];-1*[.$B$21];0 );0) * [.$B$10])) -> 0 | I574: of:=SUM(INDEX([.H$1:.H$736];MAX(ROW()+(-1*[.$B$22])+1;3);1):INDEX([.H$1:.H$736];ROW();1)) -> 0 | J574: of:=IF([.I574] > [.$B$20];[.I574]-[.$B$20];0) -> 0 | K574: of:=IF([.J574] > 0; ROUND([.$B$23] *MIN([.J574];[.H574])); 0) -> 0 | L574: of:=IF((ROW() - [.$B$13] < 3);0;FLOOR(IFERROR(OFFSET([.$F574];-1*[.$B$13];0 );0) * [.$B$14])) -> 0 | M574: of:=SUM([.L$3:.L574]) -> 6061951
D575: of:=[.D574]+1 -> 2021-08-14T00:00:00.000 | F575: of:=IF([.G574] < [.$B$25];CEILING([.G574]*[.$B$3];1);0) -> 0 | G575: of:=IF([.G574] < [.$B$25];SUM([.F$3:.F575]);[.$B$25]) -> 222350062.5 | H575: of:=IF((ROW() - [.$B$21] < 3);0;FLOOR(IFERROR(OFFSET([.$F575];-1*[.$B$21];0 );0) * [.$B$10])) -> 0 | I575: of:=SUM(INDEX([.H$1:.H$736];MAX(ROW()+(-1*[.$B$22])+1;3);1):INDEX([.H$1:.H$736];ROW();1)) -> 0 | J575: of:=IF([.I575] > [.$B$20];[.I575]-[.$B$20];0) -> 0 | K575: of:=IF([.J575] > 0; ROUND([.$B$23] *MIN([.J575];[.H575])); 0) -> 0 | L575: of:=IF((ROW() - [.$B$13] < 3);0;FLOOR(IFERROR(OFFSET([.$F575];-1*[.$B$13];0 );0) * [.$B$14])) -> 0 | M575: of:=SUM([.L$3:.L575]) -> 6061951
D576: of:=[.D575]+1 -> 2021-08-15T00:00:00.000 | F576: of:=IF([.G575] < [.$B$25];CEILING([.G575]*[.$B$3];1);0) -> 0 | G576: of:=IF([.G575] < [.$B$25];SUM([.F$3:.F576]);[.$B$25]) -> 222350062.5 | H576: of:=IF((ROW() - [.$B$21] < 3);0;FLOOR(IFERROR(OFFSET([.$F576];-1*[.$B$21];0 );0) * [.$B$10])) -> 0 | I576: of:=SUM(INDEX([.H$1:.H$736];MAX(ROW()+(-1*[.$B$22])+1;3);1):INDEX([.H$1:.H$736];ROW();1)) -> 0 | J576: of:=IF([.I576] > [.$B$20];[.I576]-[.$B$20];0) -> 0 | K576: of:=IF([.J576] > 0; ROUND([.$B$23] *MIN([.J576];[.H576])); 0) -> 0 | L576: of:=IF((ROW() - [.$B$13] < 3);0;FLOOR(IFERROR(OFFSET([.$F576];-1*[.$B$13];0 );0) * [.$B$14])) -> 0 | M576: of:=SUM([.L$3:.L576]) -> 6061951
D577: of:=[.D576]+1 -> 2021-08-16T00:00:00.000 | F577: of:=IF([.G576] < [.$B$25];CEILING([.G576]*[.$B$3];1);0) -> 0 | G577: of:=IF([.G576] < [.$B$25];SUM([.F$3:.F577]);[.$B$25]) -> 222350062.5 | H577: of:=IF((ROW() - [.$B$21] < 3);0;FLOOR(IFERROR(OFFSET([.$F577];-1*[.$B$21];0 );0) * [.$B$10])) -> 0 | I577: of:=SUM(INDEX([.H$1:.H$736];MAX(ROW()+(-1*[.$B$22])+1;3);1):INDEX([.H$1:.H$736];ROW();1)) -> 0 | J577: of:=IF([.I577] > [.$B$20];[.I577]-[.$B$20];0) -> 0 | K577: of:=IF([.J577] > 0; ROUND([.$B$23] *MIN([.J577];[.H577])); 0) -> 0 | L577: of:=IF((ROW() - [.$B$13] < 3);0;FLOOR(IFERROR(OFFSET([.$F577];-1*[.$B$13];0 );0) * [.$B$14])) -> 0 | M577: of:=SUM([.L$3:.L577]) -> 6061951
D578: of:=[.D577]+1 -> 2021-08-17T00:00:00.000 | F578: of:=IF([.G577] < [.$B$25];CEILING([.G577]*[.$B$3];1);0) -> 0 | G578: of:=IF([.G577] < [.$B$25];SUM([.F$3:.F578]);[.$B$25]) -> 222350062.5 | H578: of:=IF((ROW() - [.$B$21] < 3);0;FLOOR(IFERROR(OFFSET([.$F578];-1*[.$B$21];0 );0) * [.$B$10])) -> 0 | I578: of:=SUM(INDEX([.H$1:.H$736];MAX(ROW()+(-1*[.$B$22])+1;3);1):INDEX([.H$1:.H$736];ROW();1)) -> 0 | J578: of:=IF([.I578] > [.$B$20];[.I578]-[.$B$20];0) -> 0 | K578: of:=IF([.J578] > 0; ROUND([.$B$23] *MIN([.J578];[.H578])); 0) -> 0 | L578: of:=IF((ROW() - [.$B$13] < 3);0;FLOOR(IFERROR(OFFSET([.$F578];-1*[.$B$13];0 );0) * [.$B$14])) -> 0 | M578: of:=SUM([.L$3:.L578]) -> 6061951
D579: of:=[.D578]+1 -> 2021-08-18T00:00:00.000 | F579: of:=IF([.G578] < [.$B$25];CEILING([.G578]*[.$B$3];1);0) -> 0 | G579: of:=IF([.G578] < [.$B$25];SUM([.F$3:.F579]);[.$B$25]) -> 222350062.5 | H579: of:=IF((ROW() - [.$B$21] < 3);0;FLOOR(IFERROR(OFFSET([.$F579];-1*[.$B$21];0 );0) * [.$B$10])) -> 0 | I579: of:=SUM(INDEX([.H$1:.H$736];MAX(ROW()+(-1*[.$B$22])+1;3);1):INDEX([.H$1:.H$736];ROW();1)) -> 0 | J579: of:=IF([.I579] > [.$B$20];[.I579]-[.$B$20];0) -> 0 | K579: of:=IF([.J579] > 0; ROUND([.$B$23] *MIN([.J579];[.H579])); 0) -> 0 | L579: of:=IF((ROW() - [.$B$13] < 3);0;FLOOR(IFERROR(OFFSET([.$F579];-1*[.$B$13];0 );0) * [.$B$14])) -> 0 | M579: of:=SUM([.L$3:.L579]) -> 6061951
D580: of:=[.D579]+1 -> 2021-08-19T00:00:00.000 | F580: of:=IF([.G579] < [.$B$25];CEILING([.G579]*[.$B$3];1);0) -> 0 | G580: of:=IF([.G579] < [.$B$25];SUM([.F$3:.F580]);[.$B$25]) -> 222350062.5 | H580: of:=IF((ROW() - [.$B$21] < 3);0;FLOOR(IFERROR(OFFSET([.$F580];-1*[.$B$21];0 );0) * [.$B$10])) -> 0 | I580: of:=SUM(INDEX([.H$1:.H$736];MAX(ROW()+(-1*[.$B$22])+1;3);1):INDEX([.H$1:.H$736];ROW();1)) -> 0 | J580: of:=IF([.I580] > [.$B$20];[.I580]-[.$B$20];0) -> 0 | K580: of:=IF([.J580] > 0; ROUND([.$B$23] *MIN([.J580];[.H580])); 0) -> 0 | L580: of:=IF((ROW() - [.$B$13] < 3);0;FLOOR(IFERROR(OFFSET([.$F580];-1*[.$B$13];0 );0) * [.$B$14])) -> 0 | M580: of:=SUM([.L$3:.L580]) -> 6061951
D581: of:=[.D580]+1 -> 2021-08-20T00:00:00.000 | F581: of:=IF([.G580] < [.$B$25];CEILING([.G580]*[.$B$3];1);0) -> 0 | G581: of:=IF([.G580] < [.$B$25];SUM([.F$3:.F581]);[.$B$25]) -> 222350062.5 | H581: of:=IF((ROW() - [.$B$21] < 3);0;FLOOR(IFERROR(OFFSET([.$F581];-1*[.$B$21];0 );0) * [.$B$10])) -> 0 | I581: of:=SUM(INDEX([.H$1:.H$736];MAX(ROW()+(-1*[.$B$22])+1;3);1):INDEX([.H$1:.H$736];ROW();1)) -> 0 | J581: of:=IF([.I581] > [.$B$20];[.I581]-[.$B$20];0) -> 0 | K581: of:=IF([.J581] > 0; ROUND([.$B$23] *MIN([.J581];[.H581])); 0) -> 0 | L581: of:=IF((ROW() - [.$B$13] < 3);0;FLOOR(IFERROR(OFFSET([.$F581];-1*[.$B$13];0 );0) * [.$B$14])) -> 0 | M581: of:=SUM([.L$3:.L581]) -> 6061951
D582: of:=[.D581]+1 -> 2021-08-21T00:00:00.000 | F582: of:=IF([.G581] < [.$B$25];CEILING([.G581]*[.$B$3];1);0) -> 0 | G582: of:=IF([.G581] < [.$B$25];SUM([.F$3:.F582]);[.$B$25]) -> 222350062.5 | H582: of:=IF((ROW() - [.$B$21] < 3);0;FLOOR(IFERROR(OFFSET([.$F582];-1*[.$B$21];0 );0) * [.$B$10])) -> 0 | I582: of:=SUM(INDEX([.H$1:.H$736];MAX(ROW()+(-1*[.$B$22])+1;3);1):INDEX([.H$1:.H$736];ROW();1)) -> 0 | J582: of:=IF([.I582] > [.$B$20];[.I582]-[.$B$20];0) -> 0 | K582: of:=IF([.J582] > 0; ROUND([.$B$23] *MIN([.J582];[.H582])); 0) -> 0 | L582: of:=IF((ROW() - [.$B$13] < 3);0;FLOOR(IFERROR(OFFSET([.$F582];-1*[.$B$13];0 );0) * [.$B$14])) -> 0 | M582: of:=SUM([.L$3:.L582]) -> 6061951
D583: of:=[.D582]+1 -> 2021-08-22T00:00:00.000 | F583: of:=IF([.G582] < [.$B$25];CEILING([.G582]*[.$B$3];1);0) -> 0 | G583: of:=IF([.G582] < [.$B$25];SUM([.F$3:.F583]);[.$B$25]) -> 222350062.5 | H583: of:=IF((ROW() - [.$B$21] < 3);0;FLOOR(IFERROR(OFFSET([.$F583];-1*[.$B$21];0 );0) * [.$B$10])) -> 0 | I583: of:=SUM(INDEX([.H$1:.H$736];MAX(ROW()+(-1*[.$B$22])+1;3);1):INDEX([.H$1:.H$736];ROW();1)) -> 0 | J583: of:=IF([.I583] > [.$B$20];[.I583]-[.$B$20];0) -> 0 | K583: of:=IF([.J583] > 0; ROUND([.$B$23] *MIN([.J583];[.H583])); 0) -> 0 | L583: of:=IF((ROW() - [.$B$13] < 3);0;FLOOR(IFERROR(OFFSET([.$F583];-1*[.$B$13];0 );0) * [.$B$14])) -> 0 | M583: of:=SUM([.L$3:.L583]) -> 6061951
D584: of:=[.D583]+1 -> 2021-08-23T00:00:00.000 | F584: of:=IF([.G583] < [.$B$25];CEILING([.G583]*[.$B$3];1);0) -> 0 | G584: of:=IF([.G583] < [.$B$25];SUM([.F$3:.F584]);[.$B$25]) -> 222350062.5 | H584: of:=IF((ROW() - [.$B$21] < 3);0;FLOOR(IFERROR(OFFSET([.$F584];-1*[.$B$21];0 );0) * [.$B$10])) -> 0 | I584: of:=SUM(INDEX([.H$1:.H$736];MAX(ROW()+(-1*[.$B$22])+1;3);1):INDEX([.H$1:.H$736];ROW();1)) -> 0 | J584: of:=IF([.I584] > [.$B$20];[.I584]-[.$B$20];0) -> 0 | K584: of:=IF([.J584] > 0; ROUND([.$B$23] *MIN([.J584];[.H584])); 0) -> 0 | L584: of:=IF((ROW() - [.$B$13] < 3);0;FLOOR(IFERROR(OFFSET([.$F584];-1*[.$B$13];0 );0) * [.$B$14])) -> 0 | M584: of:=SUM([.L$3:.L584]) -> 6061951
D585: of:=[.D584]+1 -> 2021-08-24T00:00:00.000 | F585: of:=IF([.G584] < [.$B$25];CEILING([.G584]*[.$B$3];1);0) -> 0 | G585: of:=IF([.G584] < [.$B$25];SUM([.F$3:.F585]);[.$B$25]) -> 222350062.5 | H585: of:=IF((ROW() - [.$B$21] < 3);0;FLOOR(IFERROR(OFFSET([.$F585];-1*[.$B$21];0 );0) * [.$B$10])) -> 0 | I585: of:=SUM(INDEX([.H$1:.H$736];MAX(ROW()+(-1*[.$B$22])+1;3);1):INDEX([.H$1:.H$736];ROW();1)) -> 0 | J585: of:=IF([.I585] > [.$B$20];[.I585]-[.$B$20];0) -> 0 | K585: of:=IF([.J585] > 0; ROUND([.$B$23] *MIN([.J585];[.H585])); 0) -> 0 | L585: of:=IF((ROW() - [.$B$13] < 3);0;FLOOR(IFERROR(OFFSET([.$F585];-1*[.$B$13];0 );0) * [.$B$14])) -> 0 | M585: of:=SUM([.L$3:.L585]) -> 6061951
D586: of:=[.D585]+1 -> 2021-08-25T00:00:00.000 | F586: of:=IF([.G585] < [.$B$25];CEILING([.G585]*[.$B$3];1);0) -> 0 | G586: of:=IF([.G585] < [.$B$25];SUM([.F$3:.F586]);[.$B$25]) -> 222350062.5 | H586: of:=IF((ROW() - [.$B$21] < 3);0;FLOOR(IFERROR(OFFSET([.$F586];-1*[.$B$21];0 );0) * [.$B$10])) -> 0 | I586: of:=SUM(INDEX([.H$1:.H$736];MAX(ROW()+(-1*[.$B$22])+1;3);1):INDEX([.H$1:.H$736];ROW();1)) -> 0 | J586: of:=IF([.I586] > [.$B$20];[.I586]-[.$B$20];0) -> 0 | K586: of:=IF([.J586] > 0; ROUND([.$B$23] *MIN([.J586];[.H586])); 0) -> 0 | L586: of:=IF((ROW() - [.$B$13] < 3);0;FLOOR(IFERROR(OFFSET([.$F586];-1*[.$B$13];0 );0) * [.$B$14])) -> 0 | M586: of:=SUM([.L$3:.L586]) -> 6061951
D587: of:=[.D586]+1 -> 2021-08-26T00:00:00.000 | F587: of:=IF([.G586] < [.$B$25];CEILING([.G586]*[.$B$3];1);0) -> 0 | G587: of:=IF([.G586] < [.$B$25];SUM([.F$3:.F587]);[.$B$25]) -> 222350062.5 | H587: of:=IF((ROW() - [.$B$21] < 3);0;FLOOR(IFERROR(OFFSET([.$F587];-1*[.$B$21];0 );0) * [.$B$10])) -> 0 | I587: of:=SUM(INDEX([.H$1:.H$736];MAX(ROW()+(-1*[.$B$22])+1;3);1):INDEX([.H$1:.H$736];ROW();1)) -> 0 | J587: of:=IF([.I587] > [.$B$20];[.I587]-[.$B$20];0) -> 0 | K587: of:=IF([.J587] > 0; ROUND([.$B$23] *MIN([.J587];[.H587])); 0) -> 0 | L587: of:=IF((ROW() - [.$B$13] < 3);0;FLOOR(IFERROR(OFFSET([.$F587];-1*[.$B$13];0 );0) * [.$B$14])) -> 0 | M587: of:=SUM([.L$3:.L587]) -> 6061951
D588: of:=[.D587]+1 -> 2021-08-27T00:00:00.000 | F588: of:=IF([.G587] < [.$B$25];CEILING([.G587]*[.$B$3];1);0) -> 0 | G588: of:=IF([.G587] < [.$B$25];SUM([.F$3:.F588]);[.$B$25]) -> 222350062.5 | H588: of:=IF((ROW() - [.$B$21] < 3);0;FLOOR(IFERROR(OFFSET([.$F588];-1*[.$B$21];0 );0) * [.$B$10])) -> 0 | I588: of:=SUM(INDEX([.H$1:.H$736];MAX(ROW()+(-1*[.$B$22])+1;3);1):INDEX([.H$1:.H$736];ROW();1)) -> 0 | J588: of:=IF([.I588] > [.$B$20];[.I588]-[.$B$20];0) -> 0 | K588: of:=IF([.J588] > 0; ROUND([.$B$23] *MIN([.J588];[.H588])); 0) -> 0 | L588: of:=IF((ROW() - [.$B$13] < 3);0;FLOOR(IFERROR(OFFSET([.$F588];-1*[.$B$13];0 );0) * [.$B$14])) -> 0 | M588: of:=SUM([.L$3:.L588]) -> 6061951
D589: of:=[.D588]+1 -> 2021-08-28T00:00:00.000 | F589: of:=IF([.G588] < [.$B$25];CEILING([.G588]*[.$B$3];1);0) -> 0 | G589: of:=IF([.G588] < [.$B$25];SUM([.F$3:.F589]);[.$B$25]) -> 222350062.5 | H589: of:=IF((ROW() - [.$B$21] < 3);0;FLOOR(IFERROR(OFFSET([.$F589];-1*[.$B$21];0 );0) * [.$B$10])) -> 0 | I589: of:=SUM(INDEX([.H$1:.H$736];MAX(ROW()+(-1*[.$B$22])+1;3);1):INDEX([.H$1:.H$736];ROW();1)) -> 0 | J589: of:=IF([.I589] > [.$B$20];[.I589]-[.$B$20];0) -> 0 | K589: of:=IF([.J589] > 0; ROUND([.$B$23] *MIN([.J589];[.H589])); 0) -> 0 | L589: of:=IF((ROW() - [.$B$13] < 3);0;FLOOR(IFERROR(OFFSET([.$F589];-1*[.$B$13];0 );0) * [.$B$14])) -> 0 | M589: of:=SUM([.L$3:.L589]) -> 6061951
D590: of:=[.D589]+1 -> 2021-08-29T00:00:00.000 | F590: of:=IF([.G589] < [.$B$25];CEILING([.G589]*[.$B$3];1);0) -> 0 | G590: of:=IF([.G589] < [.$B$25];SUM([.F$3:.F590]);[.$B$25]) -> 222350062.5 | H590: of:=IF((ROW() - [.$B$21] < 3);0;FLOOR(IFERROR(OFFSET([.$F590];-1*[.$B$21];0 );0) * [.$B$10])) -> 0 | I590: of:=SUM(INDEX([.H$1:.H$736];MAX(ROW()+(-1*[.$B$22])+1;3);1):INDEX([.H$1:.H$736];ROW();1)) -> 0 | J590: of:=IF([.I590] > [.$B$20];[.I590]-[.$B$20];0) -> 0 | K590: of:=IF([.J590] > 0; ROUND([.$B$23] *MIN([.J590];[.H590])); 0) -> 0 | L590: of:=IF((ROW() - [.$B$13] < 3);0;FLOOR(IFERROR(OFFSET([.$F590];-1*[.$B$13];0 );0) * [.$B$14])) -> 0 | M590: of:=SUM([.L$3:.L590]) -> 6061951
D591: of:=[.D590]+1 -> 2021-08-30T00:00:00.000 | F591: of:=IF([.G590] < [.$B$25];CEILING([.G590]*[.$B$3];1);0) -> 0 | G591: of:=IF([.G590] < [.$B$25];SUM([.F$3:.F591]);[.$B$25]) -> 222350062.5 | H591: of:=IF((ROW() - [.$B$21] < 3);0;FLOOR(IFERROR(OFFSET([.$F591];-1*[.$B$21];0 );0) * [.$B$10])) -> 0 | I591: of:=SUM(INDEX([.H$1:.H$736];MAX(ROW()+(-1*[.$B$22])+1;3);1):INDEX([.H$1:.H$736];ROW();1)) -> 0 | J591: of:=IF([.I591] > [.$B$20];[.I591]-[.$B$20];0) -> 0 | K591: of:=IF([.J591] > 0; ROUND([.$B$23] *MIN([.J591];[.H591])); 0) -> 0 | L591: of:=IF((ROW() - [.$B$13] < 3);0;FLOOR(IFERROR(OFFSET([.$F591];-1*[.$B$13];0 );0) * [.$B$14])) -> 0 | M591: of:=SUM([.L$3:.L591]) -> 6061951
D592: of:=[.D591]+1 -> 2021-08-31T00:00:00.000 | F592: of:=IF([.G591] < [.$B$25];CEILING([.G591]*[.$B$3];1);0) -> 0 | G592: of:=IF([.G591] < [.$B$25];SUM([.F$3:.F592]);[.$B$25]) -> 222350062.5 | H592: of:=IF((ROW() - [.$B$21] < 3);0;FLOOR(IFERROR(OFFSET([.$F592];-1*[.$B$21];0 );0) * [.$B$10])) -> 0 | I592: of:=SUM(INDEX([.H$1:.H$736];MAX(ROW()+(-1*[.$B$22])+1;3);1):INDEX([.H$1:.H$736];ROW();1)) -> 0 | J592: of:=IF([.I592] > [.$B$20];[.I592]-[.$B$20];0) -> 0 | K592: of:=IF([.J592] > 0; ROUND([.$B$23] *MIN([.J592];[.H592])); 0) -> 0 | L592: of:=IF((ROW() - [.$B$13] < 3);0;FLOOR(IFERROR(OFFSET([.$F592];-1*[.$B$13];0 );0) * [.$B$14])) -> 0 | M592: of:=SUM([.L$3:.L592]) -> 6061951
D593: of:=[.D592]+1 -> 2021-09-01T00:00:00.000 | F593: of:=IF([.G592] < [.$B$25];CEILING([.G592]*[.$B$3];1);0) -> 0 | G593: of:=IF([.G592] < [.$B$25];SUM([.F$3:.F593]);[.$B$25]) -> 222350062.5 | H593: of:=IF((ROW() - [.$B$21] < 3);0;FLOOR(IFERROR(OFFSET([.$F593];-1*[.$B$21];0 );0) * [.$B$10])) -> 0 | I593: of:=SUM(INDEX([.H$1:.H$736];MAX(ROW()+(-1*[.$B$22])+1;3);1):INDEX([.H$1:.H$736];ROW();1)) -> 0 | J593: of:=IF([.I593] > [.$B$20];[.I593]-[.$B$20];0) -> 0 | K593: of:=IF([.J593] > 0; ROUND([.$B$23] *MIN([.J593];[.H593])); 0) -> 0 | L593: of:=IF((ROW() - [.$B$13] < 3);0;FLOOR(IFERROR(OFFSET([.$F593];-1*[.$B$13];0 );0) * [.$B$14])) -> 0 | M593: of:=SUM([.L$3:.L593]) -> 6061951
D594: of:=[.D593]+1 -> 2021-09-02T00:00:00.000 | F594: of:=IF([.G593] < [.$B$25];CEILING([.G593]*[.$B$3];1);0) -> 0 | G594: of:=IF([.G593] < [.$B$25];SUM([.F$3:.F594]);[.$B$25]) -> 222350062.5 | H594: of:=IF((ROW() - [.$B$21] < 3);0;FLOOR(IFERROR(OFFSET([.$F594];-1*[.$B$21];0 );0) * [.$B$10])) -> 0 | I594: of:=SUM(INDEX([.H$1:.H$736];MAX(ROW()+(-1*[.$B$22])+1;3);1):INDEX([.H$1:.H$736];ROW();1)) -> 0 | J594: of:=IF([.I594] > [.$B$20];[.I594]-[.$B$20];0) -> 0 | K594: of:=IF([.J594] > 0; ROUND([.$B$23] *MIN([.J594];[.H594])); 0) -> 0 | L594: of:=IF((ROW() - [.$B$13] < 3);0;FLOOR(IFERROR(OFFSET([.$F594];-1*[.$B$13];0 );0) * [.$B$14])) -> 0 | M594: of:=SUM([.L$3:.L594]) -> 6061951
D595: of:=[.D594]+1 -> 2021-09-03T00:00:00.000 | F595: of:=IF([.G594] < [.$B$25];CEILING([.G594]*[.$B$3];1);0) -> 0 | G595: of:=IF([.G594] < [.$B$25];SUM([.F$3:.F595]);[.$B$25]) -> 222350062.5 | H595: of:=IF((ROW() - [.$B$21] < 3);0;FLOOR(IFERROR(OFFSET([.$F595];-1*[.$B$21];0 );0) * [.$B$10])) -> 0 | I595: of:=SUM(INDEX([.H$1:.H$736];MAX(ROW()+(-1*[.$B$22])+1;3);1):INDEX([.H$1:.H$736];ROW();1)) -> 0 | J595: of:=IF([.I595] > [.$B$20];[.I595]-[.$B$20];0) -> 0 | K595: of:=IF([.J595] > 0; ROUND([.$B$23] *MIN([.J595];[.H595])); 0) -> 0 | L595: of:=IF((ROW() - [.$B$13] < 3);0;FLOOR(IFERROR(OFFSET([.$F595];-1*[.$B$13];0 );0) * [.$B$14])) -> 0 | M595: of:=SUM([.L$3:.L595]) -> 6061951
D596: of:=[.D595]+1 -> 2021-09-04T00:00:00.000 | F596: of:=IF([.G595] < [.$B$25];CEILING([.G595]*[.$B$3];1);0) -> 0 | G596: of:=IF([.G595] < [.$B$25];SUM([.F$3:.F596]);[.$B$25]) -> 222350062.5 | H596: of:=IF((ROW() - [.$B$21] < 3);0;FLOOR(IFERROR(OFFSET([.$F596];-1*[.$B$21];0 );0) * [.$B$10])) -> 0 | I596: of:=SUM(INDEX([.H$1:.H$736];MAX(ROW()+(-1*[.$B$22])+1;3);1):INDEX([.H$1:.H$736];ROW();1)) -> 0 | J596: of:=IF([.I596] > [.$B$20];[.I596]-[.$B$20];0) -> 0 | K596: of:=IF([.J596] > 0; ROUND([.$B$23] *MIN([.J596];[.H596])); 0) -> 0 | L596: of:=IF((ROW() - [.$B$13] < 3);0;FLOOR(IFERROR(OFFSET([.$F596];-1*[.$B$13];0 );0) * [.$B$14])) -> 0 | M596: of:=SUM([.L$3:.L596]) -> 6061951
D597: of:=[.D596]+1 -> 2021-09-05T00:00:00.000 | F597: of:=IF([.G596] < [.$B$25];CEILING([.G596]*[.$B$3];1);0) -> 0 | G597: of:=IF([.G596] < [.$B$25];SUM([.F$3:.F597]);[.$B$25]) -> 222350062.5 | H597: of:=IF((ROW() - [.$B$21] < 3);0;FLOOR(IFERROR(OFFSET([.$F597];-1*[.$B$21];0 );0) * [.$B$10])) -> 0 | I597: of:=SUM(INDEX([.H$1:.H$736];MAX(ROW()+(-1*[.$B$22])+1;3);1):INDEX([.H$1:.H$736];ROW();1)) -> 0 | J597: of:=IF([.I597] > [.$B$20];[.I597]-[.$B$20];0) -> 0 | K597: of:=IF([.J597] > 0; ROUND([.$B$23] *MIN([.J597];[.H597])); 0) -> 0 | L597: of:=IF((ROW() - [.$B$13] < 3);0;FLOOR(IFERROR(OFFSET([.$F597];-1*[.$B$13];0 );0) * [.$B$14])) -> 0 | M597: of:=SUM([.L$3:.L597]) -> 6061951
D598: of:=[.D597]+1 -> 2021-09-06T00:00:00.000 | F598: of:=IF([.G597] < [.$B$25];CEILING([.G597]*[.$B$3];1);0) -> 0 | G598: of:=IF([.G597] < [.$B$25];SUM([.F$3:.F598]);[.$B$25]) -> 222350062.5 | H598: of:=IF((ROW() - [.$B$21] < 3);0;FLOOR(IFERROR(OFFSET([.$F598];-1*[.$B$21];0 );0) * [.$B$10])) -> 0 | I598: of:=SUM(INDEX([.H$1:.H$736];MAX(ROW()+(-1*[.$B$22])+1;3);1):INDEX([.H$1:.H$736];ROW();1)) -> 0 | J598: of:=IF([.I598] > [.$B$20];[.I598]-[.$B$20];0) -> 0 | K598: of:=IF([.J598] > 0; ROUND([.$B$23] *MIN([.J598];[.H598])); 0) -> 0 | L598: of:=IF((ROW() - [.$B$13] < 3);0;FLOOR(IFERROR(OFFSET([.$F598];-1*[.$B$13];0 );0) * [.$B$14])) -> 0 | M598: of:=SUM([.L$3:.L598]) -> 6061951
D599: of:=[.D598]+1 -> 2021-09-07T00:00:00.000 | F599: of:=IF([.G598] < [.$B$25];CEILING([.G598]*[.$B$3];1);0) -> 0 | G599: of:=IF([.G598] < [.$B$25];SUM([.F$3:.F599]);[.$B$25]) -> 222350062.5 | H599: of:=IF((ROW() - [.$B$21] < 3);0;FLOOR(IFERROR(OFFSET([.$F599];-1*[.$B$21];0 );0) * [.$B$10])) -> 0 | I599: of:=SUM(INDEX([.H$1:.H$736];MAX(ROW()+(-1*[.$B$22])+1;3);1):INDEX([.H$1:.H$736];ROW();1)) -> 0 | J599: of:=IF([.I599] > [.$B$20];[.I599]-[.$B$20];0) -> 0 | K599: of:=IF([.J599] > 0; ROUND([.$B$23] *MIN([.J599];[.H599])); 0) -> 0 | L599: of:=IF((ROW() - [.$B$13] < 3);0;FLOOR(IFERROR(OFFSET([.$F599];-1*[.$B$13];0 );0) * [.$B$14])) -> 0 | M599: of:=SUM([.L$3:.L599]) -> 6061951
D600: of:=[.D599]+1 -> 2021-09-08T00:00:00.000 | F600: of:=IF([.G599] < [.$B$25];CEILING([.G599]*[.$B$3];1);0) -> 0 | G600: of:=IF([.G599] < [.$B$25];SUM([.F$3:.F600]);[.$B$25]) -> 222350062.5 | H600: of:=IF((ROW() - [.$B$21] < 3);0;FLOOR(IFERROR(OFFSET([.$F600];-1*[.$B$21];0 );0) * [.$B$10])) -> 0 | I600: of:=SUM(INDEX([.H$1:.H$736];MAX(ROW()+(-1*[.$B$22])+1;3);1):INDEX([.H$1:.H$736];ROW();1)) -> 0 | J600: of:=IF([.I600] > [.$B$20];[.I600]-[.$B$20];0) -> 0 | K600: of:=IF([.J600] > 0; ROUND([.$B$23] *MIN([.J600];[.H600])); 0) -> 0 | L600: of:=IF((ROW() - [.$B$13] < 3);0;FLOOR(IFERROR(OFFSET([.$F600];-1*[.$B$13];0 );0) * [.$B$14])) -> 0 | M600: of:=SUM([.L$3:.L600]) -> 6061951
D601: of:=[.D600]+1 -> 2021-09-09T00:00:00.000 | F601: of:=IF([.G600] < [.$B$25];CEILING([.G600]*[.$B$3];1);0) -> 0 | G601: of:=IF([.G600] < [.$B$25];SUM([.F$3:.F601]);[.$B$25]) -> 222350062.5 | H601: of:=IF((ROW() - [.$B$21] < 3);0;FLOOR(IFERROR(OFFSET([.$F601];-1*[.$B$21];0 );0) * [.$B$10])) -> 0 | I601: of:=SUM(INDEX([.H$1:.H$736];MAX(ROW()+(-1*[.$B$22])+1;3);1):INDEX([.H$1:.H$736];ROW();1)) -> 0 | J601: of:=IF([.I601] > [.$B$20];[.I601]-[.$B$20];0) -> 0 | K601: of:=IF([.J601] > 0; ROUND([.$B$23] *MIN([.J601];[.H601])); 0) -> 0 | L601: of:=IF((ROW() - [.$B$13] < 3);0;FLOOR(IFERROR(OFFSET([.$F601];-1*[.$B$13];0 );0) * [.$B$14])) -> 0 | M601: of:=SUM([.L$3:.L601]) -> 6061951
D602: of:=[.D601]+1 -> 2021-09-10T00:00:00.000 | F602: of:=IF([.G601] < [.$B$25];CEILING([.G601]*[.$B$3];1);0) -> 0 | G602: of:=IF([.G601] < [.$B$25];SUM([.F$3:.F602]);[.$B$25]) -> 222350062.5 | H602: of:=IF((ROW() - [.$B$21] < 3);0;FLOOR(IFERROR(OFFSET([.$F602];-1*[.$B$21];0 );0) * [.$B$10])) -> 0 | I602: of:=SUM(INDEX([.H$1:.H$736];MAX(ROW()+(-1*[.$B$22])+1;3);1):INDEX([.H$1:.H$736];ROW();1)) -> 0 | J602: of:=IF([.I602] > [.$B$20];[.I602]-[.$B$20];0) -> 0 | K602: of:=IF([.J602] > 0; ROUND([.$B$23] *MIN([.J602];[.H602])); 0) -> 0 | L602: of:=IF((ROW() - [.$B$13] < 3);0;FLOOR(IFERROR(OFFSET([.$F602];-1*[.$B$13];0 );0) * [.$B$14])) -> 0 | M602: of:=SUM([.L$3:.L602]) -> 6061951
D603: of:=[.D602]+1 -> 2021-09-11T00:00:00.000 | F603: of:=IF([.G602] < [.$B$25];CEILING([.G602]*[.$B$3];1);0) -> 0 | G603: of:=IF([.G602] < [.$B$25];SUM([.F$3:.F603]);[.$B$25]) -> 222350062.5 | H603: of:=IF((ROW() - [.$B$21] < 3);0;FLOOR(IFERROR(OFFSET([.$F603];-1*[.$B$21];0 );0) * [.$B$10])) -> 0 | I603: of:=SUM(INDEX([.H$1:.H$736];MAX(ROW()+(-1*[.$B$22])+1;3);1):INDEX([.H$1:.H$736];ROW();1)) -> 0 | J603: of:=IF([.I603] > [.$B$20];[.I603]-[.$B$20];0) -> 0 | K603: of:=IF([.J603] > 0; ROUND([.$B$23] *MIN([.J603];[.H603])); 0) -> 0 | L603: of:=IF((ROW() - [.$B$13] < 3);0;FLOOR(IFERROR(OFFSET([.$F603];-1*[.$B$13];0 );0) * [.$B$14])) -> 0 | M603: of:=SUM([.L$3:.L603]) -> 6061951
D604: of:=[.D603]+1 -> 2021-09-12T00:00:00.000 | F604: of:=IF([.G603] < [.$B$25];CEILING([.G603]*[.$B$3];1);0) -> 0 | G604: of:=IF([.G603] < [.$B$25];SUM([.F$3:.F604]);[.$B$25]) -> 222350062.5 | H604: of:=IF((ROW() - [.$B$21] < 3);0;FLOOR(IFERROR(OFFSET([.$F604];-1*[.$B$21];0 );0) * [.$B$10])) -> 0 | I604: of:=SUM(INDEX([.H$1:.H$736];MAX(ROW()+(-1*[.$B$22])+1;3);1):INDEX([.H$1:.H$736];ROW();1)) -> 0 | J604: of:=IF([.I604] > [.$B$20];[.I604]-[.$B$20];0) -> 0 | K604: of:=IF([.J604] > 0; ROUND([.$B$23] *MIN([.J604];[.H604])); 0) -> 0 | L604: of:=IF((ROW() - [.$B$13] < 3);0;FLOOR(IFERROR(OFFSET([.$F604];-1*[.$B$13];0 );0) * [.$B$14])) -> 0 | M604: of:=SUM([.L$3:.L604]) -> 6061951
D605: of:=[.D604]+1 -> 2021-09-13T00:00:00.000 | F605: of:=IF([.G604] < [.$B$25];CEILING([.G604]*[.$B$3];1);0) -> 0 | G605: of:=IF([.G604] < [.$B$25];SUM([.F$3:.F605]);[.$B$25]) -> 222350062.5 | H605: of:=IF((ROW() - [.$B$21] < 3);0;FLOOR(IFERROR(OFFSET([.$F605];-1*[.$B$21];0 );0) * [.$B$10])) -> 0 | I605: of:=SUM(INDEX([.H$1:.H$736];MAX(ROW()+(-1*[.$B$22])+1;3);1):INDEX([.H$1:.H$736];ROW();1)) -> 0 | J605: of:=IF([.I605] > [.$B$20];[.I605]-[.$B$20];0) -> 0 | K605: of:=IF([.J605] > 0; ROUND([.$B$23] *MIN([.J605];[.H605])); 0) -> 0 | L605: of:=IF((ROW() - [.$B$13] < 3);0;FLOOR(IFERROR(OFFSET([.$F605];-1*[.$B$13];0 );0) * [.$B$14])) -> 0 | M605: of:=SUM([.L$3:.L605]) -> 6061951
D606: of:=[.D605]+1 -> 2021-09-14T00:00:00.000 | F606: of:=IF([.G605] < [.$B$25];CEILING([.G605]*[.$B$3];1);0) -> 0 | G606: of:=IF([.G605] < [.$B$25];SUM([.F$3:.F606]);[.$B$25]) -> 222350062.5 | H606: of:=IF((ROW() - [.$B$21] < 3);0;FLOOR(IFERROR(OFFSET([.$F606];-1*[.$B$21];0 );0) * [.$B$10])) -> 0 | I606: of:=SUM(INDEX([.H$1:.H$736];MAX(ROW()+(-1*[.$B$22])+1;3);1):INDEX([.H$1:.H$736];ROW();1)) -> 0 | J606: of:=IF([.I606] > [.$B$20];[.I606]-[.$B$20];0) -> 0 | K606: of:=IF([.J606] > 0; ROUND([.$B$23] *MIN([.J606];[.H606])); 0) -> 0 | L606: of:=IF((ROW() - [.$B$13] < 3);0;FLOOR(IFERROR(OFFSET([.$F606];-1*[.$B$13];0 );0) * [.$B$14])) -> 0 | M606: of:=SUM([.L$3:.L606]) -> 6061951
D607: of:=[.D606]+1 -> 2021-09-15T00:00:00.000 | F607: of:=IF([.G606] < [.$B$25];CEILING([.G606]*[.$B$3];1);0) -> 0 | G607: of:=IF([.G606] < [.$B$25];SUM([.F$3:.F607]);[.$B$25]) -> 222350062.5 | H607: of:=IF((ROW() - [.$B$21] < 3);0;FLOOR(IFERROR(OFFSET([.$F607];-1*[.$B$21];0 );0) * [.$B$10])) -> 0 | I607: of:=SUM(INDEX([.H$1:.H$736];MAX(ROW()+(-1*[.$B$22])+1;3);1):INDEX([.H$1:.H$736];ROW();1)) -> 0 | J607: of:=IF([.I607] > [.$B$20];[.I607]-[.$B$20];0) -> 0 | K607: of:=IF([.J607] > 0; ROUND([.$B$23] *MIN([.J607];[.H607])); 0) -> 0 | L607: of:=IF((ROW() - [.$B$13] < 3);0;FLOOR(IFERROR(OFFSET([.$F607];-1*[.$B$13];0 );0) * [.$B$14])) -> 0 | M607: of:=SUM([.L$3:.L607]) -> 6061951
D608: of:=[.D607]+1 -> 2021-09-16T00:00:00.000 | F608: of:=IF([.G607] < [.$B$25];CEILING([.G607]*[.$B$3];1);0) -> 0 | G608: of:=IF([.G607] < [.$B$25];SUM([.F$3:.F608]);[.$B$25]) -> 222350062.5 | H608: of:=IF((ROW() - [.$B$21] < 3);0;FLOOR(IFERROR(OFFSET([.$F608];-1*[.$B$21];0 );0) * [.$B$10])) -> 0 | I608: of:=SUM(INDEX([.H$1:.H$736];MAX(ROW()+(-1*[.$B$22])+1;3);1):INDEX([.H$1:.H$736];ROW();1)) -> 0 | J608: of:=IF([.I608] > [.$B$20];[.I608]-[.$B$20];0) -> 0 | K608: of:=IF([.J608] > 0; ROUND([.$B$23] *MIN([.J608];[.H608])); 0) -> 0 | L608: of:=IF((ROW() - [.$B$13] < 3);0;FLOOR(IFERROR(OFFSET([.$F608];-1*[.$B$13];0 );0) * [.$B$14])) -> 0 | M608: of:=SUM([.L$3:.L608]) -> 6061951
D609: of:=[.D608]+1 -> 2021-09-17T00:00:00.000 | F609: of:=IF([.G608] < [.$B$25];CEILING([.G608]*[.$B$3];1);0) -> 0 | G609: of:=IF([.G608] < [.$B$25];SUM([.F$3:.F609]);[.$B$25]) -> 222350062.5 | H609: of:=IF((ROW() - [.$B$21] < 3);0;FLOOR(IFERROR(OFFSET([.$F609];-1*[.$B$21];0 );0) * [.$B$10])) -> 0 | I609: of:=SUM(INDEX([.H$1:.H$736];MAX(ROW()+(-1*[.$B$22])+1;3);1):INDEX([.H$1:.H$736];ROW();1)) -> 0 | J609: of:=IF([.I609] > [.$B$20];[.I609]-[.$B$20];0) -> 0 | K609: of:=IF([.J609] > 0; ROUND([.$B$23] *MIN([.J609];[.H609])); 0) -> 0 | L609: of:=IF((ROW() - [.$B$13] < 3);0;FLOOR(IFERROR(OFFSET([.$F609];-1*[.$B$13];0 );0) * [.$B$14])) -> 0 | M609: of:=SUM([.L$3:.L609]) -> 6061951
D610: of:=[.D609]+1 -> 2021-09-18T00:00:00.000 | F610: of:=IF([.G609] < [.$B$25];CEILING([.G609]*[.$B$3];1);0) -> 0 | G610: of:=IF([.G609] < [.$B$25];SUM([.F$3:.F610]);[.$B$25]) -> 222350062.5 | H610: of:=IF((ROW() - [.$B$21] < 3);0;FLOOR(IFERROR(OFFSET([.$F610];-1*[.$B$21];0 );0) * [.$B$10])) -> 0 | I610: of:=SUM(INDEX([.H$1:.H$736];MAX(ROW()+(-1*[.$B$22])+1;3);1):INDEX([.H$1:.H$736];ROW();1)) -> 0 | J610: of:=IF([.I610] > [.$B$20];[.I610]-[.$B$20];0) -> 0 | K610: of:=IF([.J610] > 0; ROUND([.$B$23] *MIN([.J610];[.H610])); 0) -> 0 | L610: of:=IF((ROW() - [.$B$13] < 3);0;FLOOR(IFERROR(OFFSET([.$F610];-1*[.$B$13];0 );0) * [.$B$14])) -> 0 | M610: of:=SUM([.L$3:.L610]) -> 6061951
D611: of:=[.D610]+1 -> 2021-09-19T00:00:00.000 | F611: of:=IF([.G610] < [.$B$25];CEILING([.G610]*[.$B$3];1);0) -> 0 | G611: of:=IF([.G610] < [.$B$25];SUM([.F$3:.F611]);[.$B$25]) -> 222350062.5 | H611: of:=IF((ROW() - [.$B$21] < 3);0;FLOOR(IFERROR(OFFSET([.$F611];-1*[.$B$21];0 );0) * [.$B$10])) -> 0 | I611: of:=SUM(INDEX([.H$1:.H$736];MAX(ROW()+(-1*[.$B$22])+1;3);1):INDEX([.H$1:.H$736];ROW();1)) -> 0 | J611: of:=IF([.I611] > [.$B$20];[.I611]-[.$B$20];0) -> 0 | K611: of:=IF([.J611] > 0; ROUND([.$B$23] *MIN([.J611];[.H611])); 0) -> 0 | L611: of:=IF((ROW() - [.$B$13] < 3);0;FLOOR(IFERROR(OFFSET([.$F611];-1*[.$B$13];0 );0) * [.$B$14])) -> 0 | M611: of:=SUM([.L$3:.L611]) -> 6061951
D612: of:=[.D611]+1 -> 2021-09-20T00:00:00.000 | F612: of:=IF([.G611] < [.$B$25];CEILING([.G611]*[.$B$3];1);0) -> 0 | G612: of:=IF([.G611] < [.$B$25];SUM([.F$3:.F612]);[.$B$25]) -> 222350062.5 | H612: of:=IF((ROW() - [.$B$21] < 3);0;FLOOR(IFERROR(OFFSET([.$F612];-1*[.$B$21];0 );0) * [.$B$10])) -> 0 | I612: of:=SUM(INDEX([.H$1:.H$736];MAX(ROW()+(-1*[.$B$22])+1;3);1):INDEX([.H$1:.H$736];ROW();1)) -> 0 | J612: of:=IF([.I612] > [.$B$20];[.I612]-[.$B$20];0) -> 0 | K612: of:=IF([.J612] > 0; ROUND([.$B$23] *MIN([.J612];[.H612])); 0) -> 0 | L612: of:=IF((ROW() - [.$B$13] < 3);0;FLOOR(IFERROR(OFFSET([.$F612];-1*[.$B$13];0 );0) * [.$B$14])) -> 0 | M612: of:=SUM([.L$3:.L612]) -> 6061951
D613: of:=[.D612]+1 -> 2021-09-21T00:00:00.000 | F613: of:=IF([.G612] < [.$B$25];CEILING([.G612]*[.$B$3];1);0) -> 0 | G613: of:=IF([.G612] < [.$B$25];SUM([.F$3:.F613]);[.$B$25]) -> 222350062.5 | H613: of:=IF((ROW() - [.$B$21] < 3);0;FLOOR(IFERROR(OFFSET([.$F613];-1*[.$B$21];0 );0) * [.$B$10])) -> 0 | I613: of:=SUM(INDEX([.H$1:.H$736];MAX(ROW()+(-1*[.$B$22])+1;3);1):INDEX([.H$1:.H$736];ROW();1)) -> 0 | J613: of:=IF([.I613] > [.$B$20];[.I613]-[.$B$20];0) -> 0 | K613: of:=IF([.J613] > 0; ROUND([.$B$23] *MIN([.J613];[.H613])); 0) -> 0 | L613: of:=IF((ROW() - [.$B$13] < 3);0;FLOOR(IFERROR(OFFSET([.$F613];-1*[.$B$13];0 );0) * [.$B$14])) -> 0 | M613: of:=SUM([.L$3:.L613]) -> 6061951
D614: of:=[.D613]+1 -> 2021-09-22T00:00:00.000 | F614: of:=IF([.G613] < [.$B$25];CEILING([.G613]*[.$B$3];1);0) -> 0 | G614: of:=IF([.G613] < [.$B$25];SUM([.F$3:.F614]);[.$B$25]) -> 222350062.5 | H614: of:=IF((ROW() - [.$B$21] < 3);0;FLOOR(IFERROR(OFFSET([.$F614];-1*[.$B$21];0 );0) * [.$B$10])) -> 0 | I614: of:=SUM(INDEX([.H$1:.H$736];MAX(ROW()+(-1*[.$B$22])+1;3);1):INDEX([.H$1:.H$736];ROW();1)) -> 0 | J614: of:=IF([.I614] > [.$B$20];[.I614]-[.$B$20];0) -> 0 | K614: of:=IF([.J614] > 0; ROUND([.$B$23] *MIN([.J614];[.H614])); 0) -> 0 | L614: of:=IF((ROW() - [.$B$13] < 3);0;FLOOR(IFERROR(OFFSET([.$F614];-1*[.$B$13];0 );0) * [.$B$14])) -> 0 | M614: of:=SUM([.L$3:.L614]) -> 6061951
D615: of:=[.D614]+1 -> 2021-09-23T00:00:00.000 | F615: of:=IF([.G614] < [.$B$25];CEILING([.G614]*[.$B$3];1);0) -> 0 | G615: of:=IF([.G614] < [.$B$25];SUM([.F$3:.F615]);[.$B$25]) -> 222350062.5 | H615: of:=IF((ROW() - [.$B$21] < 3);0;FLOOR(IFERROR(OFFSET([.$F615];-1*[.$B$21];0 );0) * [.$B$10])) -> 0 | I615: of:=SUM(INDEX([.H$1:.H$736];MAX(ROW()+(-1*[.$B$22])+1;3);1):INDEX([.H$1:.H$736];ROW();1)) -> 0 | J615: of:=IF([.I615] > [.$B$20];[.I615]-[.$B$20];0) -> 0 | K615: of:=IF([.J615] > 0; ROUND([.$B$23] *MIN([.J615];[.H615])); 0) -> 0 | L615: of:=IF((ROW() - [.$B$13] < 3);0;FLOOR(IFERROR(OFFSET([.$F615];-1*[.$B$13];0 );0) * [.$B$14])) -> 0 | M615: of:=SUM([.L$3:.L615]) -> 6061951
D616: of:=[.D615]+1 -> 2021-09-24T00:00:00.000 | F616: of:=IF([.G615] < [.$B$25];CEILING([.G615]*[.$B$3];1);0) -> 0 | G616: of:=IF([.G615] < [.$B$25];SUM([.F$3:.F616]);[.$B$25]) -> 222350062.5 | H616: of:=IF((ROW() - [.$B$21] < 3);0;FLOOR(IFERROR(OFFSET([.$F616];-1*[.$B$21];0 );0) * [.$B$10])) -> 0 | I616: of:=SUM(INDEX([.H$1:.H$736];MAX(ROW()+(-1*[.$B$22])+1;3);1):INDEX([.H$1:.H$736];ROW();1)) -> 0 | J616: of:=IF([.I616] > [.$B$20];[.I616]-[.$B$20];0) -> 0 | K616: of:=IF([.J616] > 0; ROUND([.$B$23] *MIN([.J616];[.H616])); 0) -> 0 | L616: of:=IF((ROW() - [.$B$13] < 3);0;FLOOR(IFERROR(OFFSET([.$F616];-1*[.$B$13];0 );0) * [.$B$14])) -> 0 | M616: of:=SUM([.L$3:.L616]) -> 6061951
D617: of:=[.D616]+1 -> 2021-09-25T00:00:00.000 | F617: of:=IF([.G616] < [.$B$25];CEILING([.G616]*[.$B$3];1);0) -> 0 | G617: of:=IF([.G616] < [.$B$25];SUM([.F$3:.F617]);[.$B$25]) -> 222350062.5 | H617: of:=IF((ROW() - [.$B$21] < 3);0;FLOOR(IFERROR(OFFSET([.$F617];-1*[.$B$21];0 );0) * [.$B$10])) -> 0 | I617: of:=SUM(INDEX([.H$1:.H$736];MAX(ROW()+(-1*[.$B$22])+1;3);1):INDEX([.H$1:.H$736];ROW();1)) -> 0 | J617: of:=IF([.I617] > [.$B$20];[.I617]-[.$B$20];0) -> 0 | K617: of:=IF([.J617] > 0; ROUND([.$B$23] *MIN([.J617];[.H617])); 0) -> 0 | L617: of:=IF((ROW() - [.$B$13] < 3);0;FLOOR(IFERROR(OFFSET([.$F617];-1*[.$B$13];0 );0) * [.$B$14])) -> 0 | M617: of:=SUM([.L$3:.L617]) -> 6061951
D618: of:=[.D617]+1 -> 2021-09-26T00:00:00.000 | F618: of:=IF([.G617] < [.$B$25];CEILING([.G617]*[.$B$3];1);0) -> 0 | G618: of:=IF([.G617] < [.$B$25];SUM([.F$3:.F618]);[.$B$25]) -> 222350062.5 | H618: of:=IF((ROW() - [.$B$21] < 3);0;FLOOR(IFERROR(OFFSET([.$F618];-1*[.$B$21];0 );0) * [.$B$10])) -> 0 | I618: of:=SUM(INDEX([.H$1:.H$736];MAX(ROW()+(-1*[.$B$22])+1;3);1):INDEX([.H$1:.H$736];ROW();1)) -> 0 | J618: of:=IF([.I618] > [.$B$20];[.I618]-[.$B$20];0) -> 0 | K618: of:=IF([.J618] > 0; ROUND([.$B$23] *MIN([.J618];[.H618])); 0) -> 0 | L618: of:=IF((ROW() - [.$B$13] < 3);0;FLOOR(IFERROR(OFFSET([.$F618];-1*[.$B$13];0 );0) * [.$B$14])) -> 0 | M618: of:=SUM([.L$3:.L618]) -> 6061951
D619: of:=[.D618]+1 -> 2021-09-27T00:00:00.000 | F619: of:=IF([.G618] < [.$B$25];CEILING([.G618]*[.$B$3];1);0) -> 0 | G619: of:=IF([.G618] < [.$B$25];SUM([.F$3:.F619]);[.$B$25]) -> 222350062.5 | H619: of:=IF((ROW() - [.$B$21] < 3);0;FLOOR(IFERROR(OFFSET([.$F619];-1*[.$B$21];0 );0) * [.$B$10])) -> 0 | I619: of:=SUM(INDEX([.H$1:.H$736];MAX(ROW()+(-1*[.$B$22])+1;3);1):INDEX([.H$1:.H$736];ROW();1)) -> 0 | J619: of:=IF([.I619] > [.$B$20];[.I619]-[.$B$20];0) -> 0 | K619: of:=IF([.J619] > 0; ROUND([.$B$23] *MIN([.J619];[.H619])); 0) -> 0 | L619: of:=IF((ROW() - [.$B$13] < 3);0;FLOOR(IFERROR(OFFSET([.$F619];-1*[.$B$13];0 );0) * [.$B$14])) -> 0 | M619: of:=SUM([.L$3:.L619]) -> 6061951
D620: of:=[.D619]+1 -> 2021-09-28T00:00:00.000 | F620: of:=IF([.G619] < [.$B$25];CEILING([.G619]*[.$B$3];1);0) -> 0 | G620: of:=IF([.G619] < [.$B$25];SUM([.F$3:.F620]);[.$B$25]) -> 222350062.5 | H620: of:=IF((ROW() - [.$B$21] < 3);0;FLOOR(IFERROR(OFFSET([.$F620];-1*[.$B$21];0 );0) * [.$B$10])) -> 0 | I620: of:=SUM(INDEX([.H$1:.H$736];MAX(ROW()+(-1*[.$B$22])+1;3);1):INDEX([.H$1:.H$736];ROW();1)) -> 0 | J620: of:=IF([.I620] > [.$B$20];[.I620]-[.$B$20];0) -> 0 | K620: of:=IF([.J620] > 0; ROUND([.$B$23] *MIN([.J620];[.H620])); 0) -> 0 | L620: of:=IF((ROW() - [.$B$13] < 3);0;FLOOR(IFERROR(OFFSET([.$F620];-1*[.$B$13];0 );0) * [.$B$14])) -> 0 | M620: of:=SUM([.L$3:.L620]) -> 6061951
D621: of:=[.D620]+1 -> 2021-09-29T00:00:00.000 | F621: of:=IF([.G620] < [.$B$25];CEILING([.G620]*[.$B$3];1);0) -> 0 | G621: of:=IF([.G620] < [.$B$25];SUM([.F$3:.F621]);[.$B$25]) -> 222350062.5 | H621: of:=IF((ROW() - [.$B$21] < 3);0;FLOOR(IFERROR(OFFSET([.$F621];-1*[.$B$21];0 );0) * [.$B$10])) -> 0 | I621: of:=SUM(INDEX([.H$1:.H$736];MAX(ROW()+(-1*[.$B$22])+1;3);1):INDEX([.H$1:.H$736];ROW();1)) -> 0 | J621: of:=IF([.I621] > [.$B$20];[.I621]-[.$B$20];0) -> 0 | K621: of:=IF([.J621] > 0; ROUND([.$B$23] *MIN([.J621];[.H621])); 0) -> 0 | L621: of:=IF((ROW() - [.$B$13] < 3);0;FLOOR(IFERROR(OFFSET([.$F621];-1*[.$B$13];0 );0) * [.$B$14])) -> 0 | M621: of:=SUM([.L$3:.L621]) -> 6061951
D622: of:=[.D621]+1 -> 2021-09-30T00:00:00.000 | F622: of:=IF([.G621] < [.$B$25];CEILING([.G621]*[.$B$3];1);0) -> 0 | G622: of:=IF([.G621] < [.$B$25];SUM([.F$3:.F622]);[.$B$25]) -> 222350062.5 | H622: of:=IF((ROW() - [.$B$21] < 3);0;FLOOR(IFERROR(OFFSET([.$F622];-1*[.$B$21];0 );0) * [.$B$10])) -> 0 | I622: of:=SUM(INDEX([.H$1:.H$736];MAX(ROW()+(-1*[.$B$22])+1;3);1):INDEX([.H$1:.H$736];ROW();1)) -> 0 | J622: of:=IF([.I622] > [.$B$20];[.I622]-[.$B$20];0) -> 0 | K622: of:=IF([.J622] > 0; ROUND([.$B$23] *MIN([.J622];[.H622])); 0) -> 0 | L622: of:=IF((ROW() - [.$B$13] < 3);0;FLOOR(IFERROR(OFFSET([.$F622];-1*[.$B$13];0 );0) * [.$B$14])) -> 0 | M622: of:=SUM([.L$3:.L622]) -> 6061951
D623: of:=[.D622]+1 -> 2021-10-01T00:00:00.000 | F623: of:=IF([.G622] < [.$B$25];CEILING([.G622]*[.$B$3];1);0) -> 0 | G623: of:=IF([.G622] < [.$B$25];SUM([.F$3:.F623]);[.$B$25]) -> 222350062.5 | H623: of:=IF((ROW() - [.$B$21] < 3);0;FLOOR(IFERROR(OFFSET([.$F623];-1*[.$B$21];0 );0) * [.$B$10])) -> 0 | I623: of:=SUM(INDEX([.H$1:.H$736];MAX(ROW()+(-1*[.$B$22])+1;3);1):INDEX([.H$1:.H$736];ROW();1)) -> 0 | J623: of:=IF([.I623] > [.$B$20];[.I623]-[.$B$20];0) -> 0 | K623: of:=IF([.J623] > 0; ROUND([.$B$23] *MIN([.J623];[.H623])); 0) -> 0 | L623: of:=IF((ROW() - [.$B$13] < 3);0;FLOOR(IFERROR(OFFSET([.$F623];-1*[.$B$13];0 );0) * [.$B$14])) -> 0 | M623: of:=SUM([.L$3:.L623]) -> 6061951
D624: of:=[.D623]+1 -> 2021-10-02T00:00:00.000 | F624: of:=IF([.G623] < [.$B$25];CEILING([.G623]*[.$B$3];1);0) -> 0 | G624: of:=IF([.G623] < [.$B$25];SUM([.F$3:.F624]);[.$B$25]) -> 222350062.5 | H624: of:=IF((ROW() - [.$B$21] < 3);0;FLOOR(IFERROR(OFFSET([.$F624];-1*[.$B$21];0 );0) * [.$B$10])) -> 0 | I624: of:=SUM(INDEX([.H$1:.H$736];MAX(ROW()+(-1*[.$B$22])+1;3);1):INDEX([.H$1:.H$736];ROW();1)) -> 0 | J624: of:=IF([.I624] > [.$B$20];[.I624]-[.$B$20];0) -> 0 | K624: of:=IF([.J624] > 0; ROUND([.$B$23] *MIN([.J624];[.H624])); 0) -> 0 | L624: of:=IF((ROW() - [.$B$13] < 3);0;FLOOR(IFERROR(OFFSET([.$F624];-1*[.$B$13];0 );0) * [.$B$14])) -> 0 | M624: of:=SUM([.L$3:.L624]) -> 6061951
D625: of:=[.D624]+1 -> 2021-10-03T00:00:00.000 | F625: of:=IF([.G624] < [.$B$25];CEILING([.G624]*[.$B$3];1);0) -> 0 | G625: of:=IF([.G624] < [.$B$25];SUM([.F$3:.F625]);[.$B$25]) -> 222350062.5 | H625: of:=IF((ROW() - [.$B$21] < 3);0;FLOOR(IFERROR(OFFSET([.$F625];-1*[.$B$21];0 );0) * [.$B$10])) -> 0 | I625: of:=SUM(INDEX([.H$1:.H$736];MAX(ROW()+(-1*[.$B$22])+1;3);1):INDEX([.H$1:.H$736];ROW();1)) -> 0 | J625: of:=IF([.I625] > [.$B$20];[.I625]-[.$B$20];0) -> 0 | K625: of:=IF([.J625] > 0; ROUND([.$B$23] *MIN([.J625];[.H625])); 0) -> 0 | L625: of:=IF((ROW() - [.$B$13] < 3);0;FLOOR(IFERROR(OFFSET([.$F625];-1*[.$B$13];0 );0) * [.$B$14])) -> 0 | M625: of:=SUM([.L$3:.L625]) -> 6061951
D626: of:=[.D625]+1 -> 2021-10-04T00:00:00.000 | F626: of:=IF([.G625] < [.$B$25];CEILING([.G625]*[.$B$3];1);0) -> 0 | G626: of:=IF([.G625] < [.$B$25];SUM([.F$3:.F626]);[.$B$25]) -> 222350062.5 | H626: of:=IF((ROW() - [.$B$21] < 3);0;FLOOR(IFERROR(OFFSET([.$F626];-1*[.$B$21];0 );0) * [.$B$10])) -> 0 | I626: of:=SUM(INDEX([.H$1:.H$736];MAX(ROW()+(-1*[.$B$22])+1;3);1):INDEX([.H$1:.H$736];ROW();1)) -> 0 | J626: of:=IF([.I626] > [.$B$20];[.I626]-[.$B$20];0) -> 0 | K626: of:=IF([.J626] > 0; ROUND([.$B$23] *MIN([.J626];[.H626])); 0) -> 0 | L626: of:=IF((ROW() - [.$B$13] < 3);0;FLOOR(IFERROR(OFFSET([.$F626];-1*[.$B$13];0 );0) * [.$B$14])) -> 0 | M626: of:=SUM([.L$3:.L626]) -> 6061951
D627: of:=[.D626]+1 -> 2021-10-05T00:00:00.000 | F627: of:=IF([.G626] < [.$B$25];CEILING([.G626]*[.$B$3];1);0) -> 0 | G627: of:=IF([.G626] < [.$B$25];SUM([.F$3:.F627]);[.$B$25]) -> 222350062.5 | H627: of:=IF((ROW() - [.$B$21] < 3);0;FLOOR(IFERROR(OFFSET([.$F627];-1*[.$B$21];0 );0) * [.$B$10])) -> 0 | I627: of:=SUM(INDEX([.H$1:.H$736];MAX(ROW()+(-1*[.$B$22])+1;3);1):INDEX([.H$1:.H$736];ROW();1)) -> 0 | J627: of:=IF([.I627] > [.$B$20];[.I627]-[.$B$20];0) -> 0 | K627: of:=IF([.J627] > 0; ROUND([.$B$23] *MIN([.J627];[.H627])); 0) -> 0 | L627: of:=IF((ROW() - [.$B$13] < 3);0;FLOOR(IFERROR(OFFSET([.$F627];-1*[.$B$13];0 );0) * [.$B$14])) -> 0 | M627: of:=SUM([.L$3:.L627]) -> 6061951
D628: of:=[.D627]+1 -> 2021-10-06T00:00:00.000 | F628: of:=IF([.G627] < [.$B$25];CEILING([.G627]*[.$B$3];1);0) -> 0 | G628: of:=IF([.G627] < [.$B$25];SUM([.F$3:.F628]);[.$B$25]) -> 222350062.5 | H628: of:=IF((ROW() - [.$B$21] < 3);0;FLOOR(IFERROR(OFFSET([.$F628];-1*[.$B$21];0 );0) * [.$B$10])) -> 0 | I628: of:=SUM(INDEX([.H$1:.H$736];MAX(ROW()+(-1*[.$B$22])+1;3);1):INDEX([.H$1:.H$736];ROW();1)) -> 0 | J628: of:=IF([.I628] > [.$B$20];[.I628]-[.$B$20];0) -> 0 | K628: of:=IF([.J628] > 0; ROUND([.$B$23] *MIN([.J628];[.H628])); 0) -> 0 | L628: of:=IF((ROW() - [.$B$13] < 3);0;FLOOR(IFERROR(OFFSET([.$F628];-1*[.$B$13];0 );0) * [.$B$14])) -> 0 | M628: of:=SUM([.L$3:.L628]) -> 6061951
D629: of:=[.D628]+1 -> 2021-10-07T00:00:00.000 | F629: of:=IF([.G628] < [.$B$25];CEILING([.G628]*[.$B$3];1);0) -> 0 | G629: of:=IF([.G628] < [.$B$25];SUM([.F$3:.F629]);[.$B$25]) -> 222350062.5 | H629: of:=IF((ROW() - [.$B$21] < 3);0;FLOOR(IFERROR(OFFSET([.$F629];-1*[.$B$21];0 );0) * [.$B$10])) -> 0 | I629: of:=SUM(INDEX([.H$1:.H$736];MAX(ROW()+(-1*[.$B$22])+1;3);1):INDEX([.H$1:.H$736];ROW();1)) -> 0 | J629: of:=IF([.I629] > [.$B$20];[.I629]-[.$B$20];0) -> 0 | K629: of:=IF([.J629] > 0; ROUND([.$B$23] *MIN([.J629];[.H629])); 0) -> 0 | L629: of:=IF((ROW() - [.$B$13] < 3);0;FLOOR(IFERROR(OFFSET([.$F629];-1*[.$B$13];0 );0) * [.$B$14])) -> 0 | M629: of:=SUM([.L$3:.L629]) -> 6061951
D630: of:=[.D629]+1 -> 2021-10-08T00:00:00.000 | F630: of:=IF([.G629] < [.$B$25];CEILING([.G629]*[.$B$3];1);0) -> 0 | G630: of:=IF([.G629] < [.$B$25];SUM([.F$3:.F630]);[.$B$25]) -> 222350062.5 | H630: of:=IF((ROW() - [.$B$21] < 3);0;FLOOR(IFERROR(OFFSET([.$F630];-1*[.$B$21];0 );0) * [.$B$10])) -> 0 | I630: of:=SUM(INDEX([.H$1:.H$736];MAX(ROW()+(-1*[.$B$22])+1;3);1):INDEX([.H$1:.H$736];ROW();1)) -> 0 | J630: of:=IF([.I630] > [.$B$20];[.I630]-[.$B$20];0) -> 0 | K630: of:=IF([.J630] > 0; ROUND([.$B$23] *MIN([.J630];[.H630])); 0) -> 0 | L630: of:=IF((ROW() - [.$B$13] < 3);0;FLOOR(IFERROR(OFFSET([.$F630];-1*[.$B$13];0 );0) * [.$B$14])) -> 0 | M630: of:=SUM([.L$3:.L630]) -> 6061951
D631: of:=[.D630]+1 -> 2021-10-09T00:00:00.000 | F631: of:=IF([.G630] < [.$B$25];CEILING([.G630]*[.$B$3];1);0) -> 0 | G631: of:=IF([.G630] < [.$B$25];SUM([.F$3:.F631]);[.$B$25]) -> 222350062.5 | H631: of:=IF((ROW() - [.$B$21] < 3);0;FLOOR(IFERROR(OFFSET([.$F631];-1*[.$B$21];0 );0) * [.$B$10])) -> 0 | I631: of:=SUM(INDEX([.H$1:.H$736];MAX(ROW()+(-1*[.$B$22])+1;3);1):INDEX([.H$1:.H$736];ROW();1)) -> 0 | J631: of:=IF([.I631] > [.$B$20];[.I631]-[.$B$20];0) -> 0 | K631: of:=IF([.J631] > 0; ROUND([.$B$23] *MIN([.J631];[.H631])); 0) -> 0 | L631: of:=IF((ROW() - [.$B$13] < 3);0;FLOOR(IFERROR(OFFSET([.$F631];-1*[.$B$13];0 );0) * [.$B$14])) -> 0 | M631: of:=SUM([.L$3:.L631]) -> 6061951
D632: of:=[.D631]+1 -> 2021-10-10T00:00:00.000 | F632: of:=IF([.G631] < [.$B$25];CEILING([.G631]*[.$B$3];1);0) -> 0 | G632: of:=IF([.G631] < [.$B$25];SUM([.F$3:.F632]);[.$B$25]) -> 222350062.5 | H632: of:=IF((ROW() - [.$B$21] < 3);0;FLOOR(IFERROR(OFFSET([.$F632];-1*[.$B$21];0 );0) * [.$B$10])) -> 0 | I632: of:=SUM(INDEX([.H$1:.H$736];MAX(ROW()+(-1*[.$B$22])+1;3);1):INDEX([.H$1:.H$736];ROW();1)) -> 0 | J632: of:=IF([.I632] > [.$B$20];[.I632]-[.$B$20];0) -> 0 | K632: of:=IF([.J632] > 0; ROUND([.$B$23] *MIN([.J632];[.H632])); 0) -> 0 | L632: of:=IF((ROW() - [.$B$13] < 3);0;FLOOR(IFERROR(OFFSET([.$F632];-1*[.$B$13];0 );0) * [.$B$14])) -> 0 | M632: of:=SUM([.L$3:.L632]) -> 6061951
D633: of:=[.D632]+1 -> 2021-10-11T00:00:00.000 | F633: of:=IF([.G632] < [.$B$25];CEILING([.G632]*[.$B$3];1);0) -> 0 | G633: of:=IF([.G632] < [.$B$25];SUM([.F$3:.F633]);[.$B$25]) -> 222350062.5 | H633: of:=IF((ROW() - [.$B$21] < 3);0;FLOOR(IFERROR(OFFSET([.$F633];-1*[.$B$21];0 );0) * [.$B$10])) -> 0 | I633: of:=SUM(INDEX([.H$1:.H$736];MAX(ROW()+(-1*[.$B$22])+1;3);1):INDEX([.H$1:.H$736];ROW();1)) -> 0 | J633: of:=IF([.I633] > [.$B$20];[.I633]-[.$B$20];0) -> 0 | K633: of:=IF([.J633] > 0; ROUND([.$B$23] *MIN([.J633];[.H633])); 0) -> 0 | L633: of:=IF((ROW() - [.$B$13] < 3);0;FLOOR(IFERROR(OFFSET([.$F633];-1*[.$B$13];0 );0) * [.$B$14])) -> 0 | M633: of:=SUM([.L$3:.L633]) -> 6061951
D634: of:=[.D633]+1 -> 2021-10-12T00:00:00.000 | F634: of:=IF([.G633] < [.$B$25];CEILING([.G633]*[.$B$3];1);0) -> 0 | G634: of:=IF([.G633] < [.$B$25];SUM([.F$3:.F634]);[.$B$25]) -> 222350062.5 | H634: of:=IF((ROW() - [.$B$21] < 3);0;FLOOR(IFERROR(OFFSET([.$F634];-1*[.$B$21];0 );0) * [.$B$10])) -> 0 | I634: of:=SUM(INDEX([.H$1:.H$736];MAX(ROW()+(-1*[.$B$22])+1;3);1):INDEX([.H$1:.H$736];ROW();1)) -> 0 | J634: of:=IF([.I634] > [.$B$20];[.I634]-[.$B$20];0) -> 0 | K634: of:=IF([.J634] > 0; ROUND([.$B$23] *MIN([.J634];[.H634])); 0) -> 0 | L634: of:=IF((ROW() - [.$B$13] < 3);0;FLOOR(IFERROR(OFFSET([.$F634];-1*[.$B$13];0 );0) * [.$B$14])) -> 0 | M634: of:=SUM([.L$3:.L634]) -> 6061951
D635: of:=[.D634]+1 -> 2021-10-13T00:00:00.000 | F635: of:=IF([.G634] < [.$B$25];CEILING([.G634]*[.$B$3];1);0) -> 0 | G635: of:=IF([.G634] < [.$B$25];SUM([.F$3:.F635]);[.$B$25]) -> 222350062.5 | H635: of:=IF((ROW() - [.$B$21] < 3);0;FLOOR(IFERROR(OFFSET([.$F635];-1*[.$B$21];0 );0) * [.$B$10])) -> 0 | I635: of:=SUM(INDEX([.H$1:.H$736];MAX(ROW()+(-1*[.$B$22])+1;3);1):INDEX([.H$1:.H$736];ROW();1)) -> 0 | J635: of:=IF([.I635] > [.$B$20];[.I635]-[.$B$20];0) -> 0 | K635: of:=IF([.J635] > 0; ROUND([.$B$23] *MIN([.J635];[.H635])); 0) -> 0 | L635: of:=IF((ROW() - [.$B$13] < 3);0;FLOOR(IFERROR(OFFSET([.$F635];-1*[.$B$13];0 );0) * [.$B$14])) -> 0 | M635: of:=SUM([.L$3:.L635]) -> 6061951
D636: of:=[.D635]+1 -> 2021-10-14T00:00:00.000 | F636: of:=IF([.G635] < [.$B$25];CEILING([.G635]*[.$B$3];1);0) -> 0 | G636: of:=IF([.G635] < [.$B$25];SUM([.F$3:.F636]);[.$B$25]) -> 222350062.5 | H636: of:=IF((ROW() - [.$B$21] < 3);0;FLOOR(IFERROR(OFFSET([.$F636];-1*[.$B$21];0 );0) * [.$B$10])) -> 0 | I636: of:=SUM(INDEX([.H$1:.H$736];MAX(ROW()+(-1*[.$B$22])+1;3);1):INDEX([.H$1:.H$736];ROW();1)) -> 0 | J636: of:=IF([.I636] > [.$B$20];[.I636]-[.$B$20];0) -> 0 | K636: of:=IF([.J636] > 0; ROUND([.$B$23] *MIN([.J636];[.H636])); 0) -> 0 | L636: of:=IF((ROW() - [.$B$13] < 3);0;FLOOR(IFERROR(OFFSET([.$F636];-1*[.$B$13];0 );0) * [.$B$14])) -> 0 | M636: of:=SUM([.L$3:.L636]) -> 6061951
D637: of:=[.D636]+1 -> 2021-10-15T00:00:00.000 | F637: of:=IF([.G636] < [.$B$25];CEILING([.G636]*[.$B$3];1);0) -> 0 | G637: of:=IF([.G636] < [.$B$25];SUM([.F$3:.F637]);[.$B$25]) -> 222350062.5 | H637: of:=IF((ROW() - [.$B$21] < 3);0;FLOOR(IFERROR(OFFSET([.$F637];-1*[.$B$21];0 );0) * [.$B$10])) -> 0 | I637: of:=SUM(INDEX([.H$1:.H$736];MAX(ROW()+(-1*[.$B$22])+1;3);1):INDEX([.H$1:.H$736];ROW();1)) -> 0 | J637: of:=IF([.I637] > [.$B$20];[.I637]-[.$B$20];0) -> 0 | K637: of:=IF([.J637] > 0; ROUND([.$B$23] *MIN([.J637];[.H637])); 0) -> 0 | L637: of:=IF((ROW() - [.$B$13] < 3);0;FLOOR(IFERROR(OFFSET([.$F637];-1*[.$B$13];0 );0) * [.$B$14])) -> 0 | M637: of:=SUM([.L$3:.L637]) -> 6061951
D638: of:=[.D637]+1 -> 2021-10-16T00:00:00.000 | F638: of:=IF([.G637] < [.$B$25];CEILING([.G637]*[.$B$3];1);0) -> 0 | G638: of:=IF([.G637] < [.$B$25];SUM([.F$3:.F638]);[.$B$25]) -> 222350062.5 | H638: of:=IF((ROW() - [.$B$21] < 3);0;FLOOR(IFERROR(OFFSET([.$F638];-1*[.$B$21];0 );0) * [.$B$10])) -> 0 | I638: of:=SUM(INDEX([.H$1:.H$736];MAX(ROW()+(-1*[.$B$22])+1;3);1):INDEX([.H$1:.H$736];ROW();1)) -> 0 | J638: of:=IF([.I638] > [.$B$20];[.I638]-[.$B$20];0) -> 0 | K638: of:=IF([.J638] > 0; ROUND([.$B$23] *MIN([.J638];[.H638])); 0) -> 0 | L638: of:=IF((ROW() - [.$B$13] < 3);0;FLOOR(IFERROR(OFFSET([.$F638];-1*[.$B$13];0 );0) * [.$B$14])) -> 0 | M638: of:=SUM([.L$3:.L638]) -> 6061951
D639: of:=[.D638]+1 -> 2021-10-17T00:00:00.000 | F639: of:=IF([.G638] < [.$B$25];CEILING([.G638]*[.$B$3];1);0) -> 0 | G639: of:=IF([.G638] < [.$B$25];SUM([.F$3:.F639]);[.$B$25]) -> 222350062.5 | H639: of:=IF((ROW() - [.$B$21] < 3);0;FLOOR(IFERROR(OFFSET([.$F639];-1*[.$B$21];0 );0) * [.$B$10])) -> 0 | I639: of:=SUM(INDEX([.H$1:.H$736];MAX(ROW()+(-1*[.$B$22])+1;3);1):INDEX([.H$1:.H$736];ROW();1)) -> 0 | J639: of:=IF([.I639] > [.$B$20];[.I639]-[.$B$20];0) -> 0 | K639: of:=IF([.J639] > 0; ROUND([.$B$23] *MIN([.J639];[.H639])); 0) -> 0 | L639: of:=IF((ROW() - [.$B$13] < 3);0;FLOOR(IFERROR(OFFSET([.$F639];-1*[.$B$13];0 );0) * [.$B$14])) -> 0 | M639: of:=SUM([.L$3:.L639]) -> 6061951
D640: of:=[.D639]+1 -> 2021-10-18T00:00:00.000 | F640: of:=IF([.G639] < [.$B$25];CEILING([.G639]*[.$B$3];1);0) -> 0 | G640: of:=IF([.G639] < [.$B$25];SUM([.F$3:.F640]);[.$B$25]) -> 222350062.5 | H640: of:=IF((ROW() - [.$B$21] < 3);0;FLOOR(IFERROR(OFFSET([.$F640];-1*[.$B$21];0 );0) * [.$B$10])) -> 0 | I640: of:=SUM(INDEX([.H$1:.H$736];MAX(ROW()+(-1*[.$B$22])+1;3);1):INDEX([.H$1:.H$736];ROW();1)) -> 0 | J640: of:=IF([.I640] > [.$B$20];[.I640]-[.$B$20];0) -> 0 | K640: of:=IF([.J640] > 0; ROUND([.$B$23] *MIN([.J640];[.H640])); 0) -> 0 | L640: of:=IF((ROW() - [.$B$13] < 3);0;FLOOR(IFERROR(OFFSET([.$F640];-1*[.$B$13];0 );0) * [.$B$14])) -> 0 | M640: of:=SUM([.L$3:.L640]) -> 6061951
D641: of:=[.D640]+1 -> 2021-10-19T00:00:00.000 | F641: of:=IF([.G640] < [.$B$25];CEILING([.G640]*[.$B$3];1);0) -> 0 | G641: of:=IF([.G640] < [.$B$25];SUM([.F$3:.F641]);[.$B$25]) -> 222350062.5 | H641: of:=IF((ROW() - [.$B$21] < 3);0;FLOOR(IFERROR(OFFSET([.$F641];-1*[.$B$21];0 );0) * [.$B$10])) -> 0 | I641: of:=SUM(INDEX([.H$1:.H$736];MAX(ROW()+(-1*[.$B$22])+1;3);1):INDEX([.H$1:.H$736];ROW();1)) -> 0 | J641: of:=IF([.I641] > [.$B$20];[.I641]-[.$B$20];0) -> 0 | K641: of:=IF([.J641] > 0; ROUND([.$B$23] *MIN([.J641];[.H641])); 0) -> 0 | L641: of:=IF((ROW() - [.$B$13] < 3);0;FLOOR(IFERROR(OFFSET([.$F641];-1*[.$B$13];0 );0) * [.$B$14])) -> 0 | M641: of:=SUM([.L$3:.L641]) -> 6061951
D642: of:=[.D641]+1 -> 2021-10-20T00:00:00.000 | F642: of:=IF([.G641] < [.$B$25];CEILING([.G641]*[.$B$3];1);0) -> 0 | G642: of:=IF([.G641] < [.$B$25];SUM([.F$3:.F642]);[.$B$25]) -> 222350062.5 | H642: of:=IF((ROW() - [.$B$21] < 3);0;FLOOR(IFERROR(OFFSET([.$F642];-1*[.$B$21];0 );0) * [.$B$10])) -> 0 | I642: of:=SUM(INDEX([.H$1:.H$736];MAX(ROW()+(-1*[.$B$22])+1;3);1):INDEX([.H$1:.H$736];ROW();1)) -> 0 | J642: of:=IF([.I642] > [.$B$20];[.I642]-[.$B$20];0) -> 0 | K642: of:=IF([.J642] > 0; ROUND([.$B$23] *MIN([.J642];[.H642])); 0) -> 0 | L642: of:=IF((ROW() - [.$B$13] < 3);0;FLOOR(IFERROR(OFFSET([.$F642];-1*[.$B$13];0 );0) * [.$B$14])) -> 0 | M642: of:=SUM([.L$3:.L642]) -> 6061951
D643: of:=[.D642]+1 -> 2021-10-21T00:00:00.000 | F643: of:=IF([.G642] < [.$B$25];CEILING([.G642]*[.$B$3];1);0) -> 0 | G643: of:=IF([.G642] < [.$B$25];SUM([.F$3:.F643]);[.$B$25]) -> 222350062.5 | H643: of:=IF((ROW() - [.$B$21] < 3);0;FLOOR(IFERROR(OFFSET([.$F643];-1*[.$B$21];0 );0) * [.$B$10])) -> 0 | I643: of:=SUM(INDEX([.H$1:.H$736];MAX(ROW()+(-1*[.$B$22])+1;3);1):INDEX([.H$1:.H$736];ROW();1)) -> 0 | J643: of:=IF([.I643] > [.$B$20];[.I643]-[.$B$20];0) -> 0 | K643: of:=IF([.J643] > 0; ROUND([.$B$23] *MIN([.J643];[.H643])); 0) -> 0 | L643: of:=IF((ROW() - [.$B$13] < 3);0;FLOOR(IFERROR(OFFSET([.$F643];-1*[.$B$13];0 );0) * [.$B$14])) -> 0 | M643: of:=SUM([.L$3:.L643]) -> 6061951
D644: of:=[.D643]+1 -> 2021-10-22T00:00:00.000 | F644: of:=IF([.G643] < [.$B$25];CEILING([.G643]*[.$B$3];1);0) -> 0 | G644: of:=IF([.G643] < [.$B$25];SUM([.F$3:.F644]);[.$B$25]) -> 222350062.5 | H644: of:=IF((ROW() - [.$B$21] < 3);0;FLOOR(IFERROR(OFFSET([.$F644];-1*[.$B$21];0 );0) * [.$B$10])) -> 0 | I644: of:=SUM(INDEX([.H$1:.H$736];MAX(ROW()+(-1*[.$B$22])+1;3);1):INDEX([.H$1:.H$736];ROW();1)) -> 0 | J644: of:=IF([.I644] > [.$B$20];[.I644]-[.$B$20];0) -> 0 | K644: of:=IF([.J644] > 0; ROUND([.$B$23] *MIN([.J644];[.H644])); 0) -> 0 | L644: of:=IF((ROW() - [.$B$13] < 3);0;FLOOR(IFERROR(OFFSET([.$F644];-1*[.$B$13];0 );0) * [.$B$14])) -> 0 | M644: of:=SUM([.L$3:.L644]) -> 6061951
D645: of:=[.D644]+1 -> 2021-10-23T00:00:00.000 | F645: of:=IF([.G644] < [.$B$25];CEILING([.G644]*[.$B$3];1);0) -> 0 | G645: of:=IF([.G644] < [.$B$25];SUM([.F$3:.F645]);[.$B$25]) -> 222350062.5 | H645: of:=IF((ROW() - [.$B$21] < 3);0;FLOOR(IFERROR(OFFSET([.$F645];-1*[.$B$21];0 );0) * [.$B$10])) -> 0 | I645: of:=SUM(INDEX([.H$1:.H$736];MAX(ROW()+(-1*[.$B$22])+1;3);1):INDEX([.H$1:.H$736];ROW();1)) -> 0 | J645: of:=IF([.I645] > [.$B$20];[.I645]-[.$B$20];0) -> 0 | K645: of:=IF([.J645] > 0; ROUND([.$B$23] *MIN([.J645];[.H645])); 0) -> 0 | L645: of:=IF((ROW() - [.$B$13] < 3);0;FLOOR(IFERROR(OFFSET([.$F645];-1*[.$B$13];0 );0) * [.$B$14])) -> 0 | M645: of:=SUM([.L$3:.L645]) -> 6061951
D646: of:=[.D645]+1 -> 2021-10-24T00:00:00.000 | F646: of:=IF([.G645] < [.$B$25];CEILING([.G645]*[.$B$3];1);0) -> 0 | G646: of:=IF([.G645] < [.$B$25];SUM([.F$3:.F646]);[.$B$25]) -> 222350062.5 | H646: of:=IF((ROW() - [.$B$21] < 3);0;FLOOR(IFERROR(OFFSET([.$F646];-1*[.$B$21];0 );0) * [.$B$10])) -> 0 | I646: of:=SUM(INDEX([.H$1:.H$736];MAX(ROW()+(-1*[.$B$22])+1;3);1):INDEX([.H$1:.H$736];ROW();1)) -> 0 | J646: of:=IF([.I646] > [.$B$20];[.I646]-[.$B$20];0) -> 0 | K646: of:=IF([.J646] > 0; ROUND([.$B$23] *MIN([.J646];[.H646])); 0) -> 0 | L646: of:=IF((ROW() - [.$B$13] < 3);0;FLOOR(IFERROR(OFFSET([.$F646];-1*[.$B$13];0 );0) * [.$B$14])) -> 0 | M646: of:=SUM([.L$3:.L646]) -> 6061951
D647: of:=[.D646]+1 -> 2021-10-25T00:00:00.000 | F647: of:=IF([.G646] < [.$B$25];CEILING([.G646]*[.$B$3];1);0) -> 0 | G647: of:=IF([.G646] < [.$B$25];SUM([.F$3:.F647]);[.$B$25]) -> 222350062.5 | H647: of:=IF((ROW() - [.$B$21] < 3);0;FLOOR(IFERROR(OFFSET([.$F647];-1*[.$B$21];0 );0) * [.$B$10])) -> 0 | I647: of:=SUM(INDEX([.H$1:.H$736];MAX(ROW()+(-1*[.$B$22])+1;3);1):INDEX([.H$1:.H$736];ROW();1)) -> 0 | J647: of:=IF([.I647] > [.$B$20];[.I647]-[.$B$20];0) -> 0 | K647: of:=IF([.J647] > 0; ROUND([.$B$23] *MIN([.J647];[.H647])); 0) -> 0 | L647: of:=IF((ROW() - [.$B$13] < 3);0;FLOOR(IFERROR(OFFSET([.$F647];-1*[.$B$13];0 );0) * [.$B$14])) -> 0 | M647: of:=SUM([.L$3:.L647]) -> 6061951
D648: of:=[.D647]+1 -> 2021-10-26T00:00:00.000 | F648: of:=IF([.G647] < [.$B$25];CEILING([.G647]*[.$B$3];1);0) -> 0 | G648: of:=IF([.G647] < [.$B$25];SUM([.F$3:.F648]);[.$B$25]) -> 222350062.5 | H648: of:=IF((ROW() - [.$B$21] < 3);0;FLOOR(IFERROR(OFFSET([.$F648];-1*[.$B$21];0 );0) * [.$B$10])) -> 0 | I648: of:=SUM(INDEX([.H$1:.H$736];MAX(ROW()+(-1*[.$B$22])+1;3);1):INDEX([.H$1:.H$736];ROW();1)) -> 0 | J648: of:=IF([.I648] > [.$B$20];[.I648]-[.$B$20];0) -> 0 | K648: of:=IF([.J648] > 0; ROUND([.$B$23] *MIN([.J648];[.H648])); 0) -> 0 | L648: of:=IF((ROW() - [.$B$13] < 3);0;FLOOR(IFERROR(OFFSET([.$F648];-1*[.$B$13];0 );0) * [.$B$14])) -> 0 | M648: of:=SUM([.L$3:.L648]) -> 6061951
D649: of:=[.D648]+1 -> 2021-10-27T00:00:00.000 | F649: of:=IF([.G648] < [.$B$25];CEILING([.G648]*[.$B$3];1);0) -> 0 | G649: of:=IF([.G648] < [.$B$25];SUM([.F$3:.F649]);[.$B$25]) -> 222350062.5 | H649: of:=IF((ROW() - [.$B$21] < 3);0;FLOOR(IFERROR(OFFSET([.$F649];-1*[.$B$21];0 );0) * [.$B$10])) -> 0 | I649: of:=SUM(INDEX([.H$1:.H$736];MAX(ROW()+(-1*[.$B$22])+1;3);1):INDEX([.H$1:.H$736];ROW();1)) -> 0 | J649: of:=IF([.I649] > [.$B$20];[.I649]-[.$B$20];0) -> 0 | K649: of:=IF([.J649] > 0; ROUND([.$B$23] *MIN([.J649];[.H649])); 0) -> 0 | L649: of:=IF((ROW() - [.$B$13] < 3);0;FLOOR(IFERROR(OFFSET([.$F649];-1*[.$B$13];0 );0) * [.$B$14])) -> 0 | M649: of:=SUM([.L$3:.L649]) -> 6061951
D650: of:=[.D649]+1 -> 2021-10-28T00:00:00.000 | F650: of:=IF([.G649] < [.$B$25];CEILING([.G649]*[.$B$3];1);0) -> 0 | G650: of:=IF([.G649] < [.$B$25];SUM([.F$3:.F650]);[.$B$25]) -> 222350062.5 | H650: of:=IF((ROW() - [.$B$21] < 3);0;FLOOR(IFERROR(OFFSET([.$F650];-1*[.$B$21];0 );0) * [.$B$10])) -> 0 | I650: of:=SUM(INDEX([.H$1:.H$736];MAX(ROW()+(-1*[.$B$22])+1;3);1):INDEX([.H$1:.H$736];ROW();1)) -> 0 | J650: of:=IF([.I650] > [.$B$20];[.I650]-[.$B$20];0) -> 0 | K650: of:=IF([.J650] > 0; ROUND([.$B$23] *MIN([.J650];[.H650])); 0) -> 0 | L650: of:=IF((ROW() - [.$B$13] < 3);0;FLOOR(IFERROR(OFFSET([.$F650];-1*[.$B$13];0 );0) * [.$B$14])) -> 0 | M650: of:=SUM([.L$3:.L650]) -> 6061951
D651: of:=[.D650]+1 -> 2021-10-29T00:00:00.000 | F651: of:=IF([.G650] < [.$B$25];CEILING([.G650]*[.$B$3];1);0) -> 0 | G651: of:=IF([.G650] < [.$B$25];SUM([.F$3:.F651]);[.$B$25]) -> 222350062.5 | H651: of:=IF((ROW() - [.$B$21] < 3);0;FLOOR(IFERROR(OFFSET([.$F651];-1*[.$B$21];0 );0) * [.$B$10])) -> 0 | I651: of:=SUM(INDEX([.H$1:.H$736];MAX(ROW()+(-1*[.$B$22])+1;3);1):INDEX([.H$1:.H$736];ROW();1)) -> 0 | J651: of:=IF([.I651] > [.$B$20];[.I651]-[.$B$20];0) -> 0 | K651: of:=IF([.J651] > 0; ROUND([.$B$23] *MIN([.J651];[.H651])); 0) -> 0 | L651: of:=IF((ROW() - [.$B$13] < 3);0;FLOOR(IFERROR(OFFSET([.$F651];-1*[.$B$13];0 );0) * [.$B$14])) -> 0 | M651: of:=SUM([.L$3:.L651]) -> 6061951
D652: of:=[.D651]+1 -> 2021-10-30T00:00:00.000 | F652: of:=IF([.G651] < [.$B$25];CEILING([.G651]*[.$B$3];1);0) -> 0 | G652: of:=IF([.G651] < [.$B$25];SUM([.F$3:.F652]);[.$B$25]) -> 222350062.5 | H652: of:=IF((ROW() - [.$B$21] < 3);0;FLOOR(IFERROR(OFFSET([.$F652];-1*[.$B$21];0 );0) * [.$B$10])) -> 0 | I652: of:=SUM(INDEX([.H$1:.H$736];MAX(ROW()+(-1*[.$B$22])+1;3);1):INDEX([.H$1:.H$736];ROW();1)) -> 0 | J652: of:=IF([.I652] > [.$B$20];[.I652]-[.$B$20];0) -> 0 | K652: of:=IF([.J652] > 0; ROUND([.$B$23] *MIN([.J652];[.H652])); 0) -> 0 | L652: of:=IF((ROW() - [.$B$13] < 3);0;FLOOR(IFERROR(OFFSET([.$F652];-1*[.$B$13];0 );0) * [.$B$14])) -> 0 | M652: of:=SUM([.L$3:.L652]) -> 6061951
D653: of:=[.D652]+1 -> 2021-10-31T00:00:00.000 | F653: of:=IF([.G652] < [.$B$25];CEILING([.G652]*[.$B$3];1);0) -> 0 | G653: of:=IF([.G652] < [.$B$25];SUM([.F$3:.F653]);[.$B$25]) -> 222350062.5 | H653: of:=IF((ROW() - [.$B$21] < 3);0;FLOOR(IFERROR(OFFSET([.$F653];-1*[.$B$21];0 );0) * [.$B$10])) -> 0 | I653: of:=SUM(INDEX([.H$1:.H$736];MAX(ROW()+(-1*[.$B$22])+1;3);1):INDEX([.H$1:.H$736];ROW();1)) -> 0 | J653: of:=IF([.I653] > [.$B$20];[.I653]-[.$B$20];0) -> 0 | K653: of:=IF([.J653] > 0; ROUND([.$B$23] *MIN([.J653];[.H653])); 0) -> 0 | L653: of:=IF((ROW() - [.$B$13] < 3);0;FLOOR(IFERROR(OFFSET([.$F653];-1*[.$B$13];0 );0) * [.$B$14])) -> 0 | M653: of:=SUM([.L$3:.L653]) -> 6061951
D654: of:=[.D653]+1 -> 2021-11-01T00:00:00.000 | F654: of:=IF([.G653] < [.$B$25];CEILING([.G653]*[.$B$3];1);0) -> 0 | G654: of:=IF([.G653] < [.$B$25];SUM([.F$3:.F654]);[.$B$25]) -> 222350062.5 | H654: of:=IF((ROW() - [.$B$21] < 3);0;FLOOR(IFERROR(OFFSET([.$F654];-1*[.$B$21];0 );0) * [.$B$10])) -> 0 | I654: of:=SUM(INDEX([.H$1:.H$736];MAX(ROW()+(-1*[.$B$22])+1;3);1):INDEX([.H$1:.H$736];ROW();1)) -> 0 | J654: of:=IF([.I654] > [.$B$20];[.I654]-[.$B$20];0) -> 0 | K654: of:=IF([.J654] > 0; ROUND([.$B$23] *MIN([.J654];[.H654])); 0) -> 0 | L654: of:=IF((ROW() - [.$B$13] < 3);0;FLOOR(IFERROR(OFFSET([.$F654];-1*[.$B$13];0 );0) * [.$B$14])) -> 0 | M654: of:=SUM([.L$3:.L654]) -> 6061951
D655: of:=[.D654]+1 -> 2021-11-02T00:00:00.000 | F655: of:=IF([.G654] < [.$B$25];CEILING([.G654]*[.$B$3];1);0) -> 0 | G655: of:=IF([.G654] < [.$B$25];SUM([.F$3:.F655]);[.$B$25]) -> 222350062.5 | H655: of:=IF((ROW() - [.$B$21] < 3);0;FLOOR(IFERROR(OFFSET([.$F655];-1*[.$B$21];0 );0) * [.$B$10])) -> 0 | I655: of:=SUM(INDEX([.H$1:.H$736];MAX(ROW()+(-1*[.$B$22])+1;3);1):INDEX([.H$1:.H$736];ROW();1)) -> 0 | J655: of:=IF([.I655] > [.$B$20];[.I655]-[.$B$20];0) -> 0 | K655: of:=IF([.J655] > 0; ROUND([.$B$23] *MIN([.J655];[.H655])); 0) -> 0 | L655: of:=IF((ROW() - [.$B$13] < 3);0;FLOOR(IFERROR(OFFSET([.$F655];-1*[.$B$13];0 );0) * [.$B$14])) -> 0 | M655: of:=SUM([.L$3:.L655]) -> 6061951
D656: of:=[.D655]+1 -> 2021-11-03T00:00:00.000 | F656: of:=IF([.G655] < [.$B$25];CEILING([.G655]*[.$B$3];1);0) -> 0 | G656: of:=IF([.G655] < [.$B$25];SUM([.F$3:.F656]);[.$B$25]) -> 222350062.5 | H656: of:=IF((ROW() - [.$B$21] < 3);0;FLOOR(IFERROR(OFFSET([.$F656];-1*[.$B$21];0 );0) * [.$B$10])) -> 0 | I656: of:=SUM(INDEX([.H$1:.H$736];MAX(ROW()+(-1*[.$B$22])+1;3);1):INDEX([.H$1:.H$736];ROW();1)) -> 0 | J656: of:=IF([.I656] > [.$B$20];[.I656]-[.$B$20];0) -> 0 | K656: of:=IF([.J656] > 0; ROUND([.$B$23] *MIN([.J656];[.H656])); 0) -> 0 | L656: of:=IF((ROW() - [.$B$13] < 3);0;FLOOR(IFERROR(OFFSET([.$F656];-1*[.$B$13];0 );0) * [.$B$14])) -> 0 | M656: of:=SUM([.L$3:.L656]) -> 6061951
D657: of:=[.D656]+1 -> 2021-11-04T00:00:00.000 | F657: of:=IF([.G656] < [.$B$25];CEILING([.G656]*[.$B$3];1);0) -> 0 | G657: of:=IF([.G656] < [.$B$25];SUM([.F$3:.F657]);[.$B$25]) -> 222350062.5 | H657: of:=IF((ROW() - [.$B$21] < 3);0;FLOOR(IFERROR(OFFSET([.$F657];-1*[.$B$21];0 );0) * [.$B$10])) -> 0 | I657: of:=SUM(INDEX([.H$1:.H$736];MAX(ROW()+(-1*[.$B$22])+1;3);1):INDEX([.H$1:.H$736];ROW();1)) -> 0 | J657: of:=IF([.I657] > [.$B$20];[.I657]-[.$B$20];0) -> 0 | K657: of:=IF([.J657] > 0; ROUND([.$B$23] *MIN([.J657];[.H657])); 0) -> 0 | L657: of:=IF((ROW() - [.$B$13] < 3);0;FLOOR(IFERROR(OFFSET([.$F657];-1*[.$B$13];0 );0) * [.$B$14])) -> 0 | M657: of:=SUM([.L$3:.L657]) -> 6061951
D658: of:=[.D657]+1 -> 2021-11-05T00:00:00.000 | F658: of:=IF([.G657] < [.$B$25];CEILING([.G657]*[.$B$3];1);0) -> 0 | G658: of:=IF([.G657] < [.$B$25];SUM([.F$3:.F658]);[.$B$25]) -> 222350062.5 | H658: of:=IF((ROW() - [.$B$21] < 3);0;FLOOR(IFERROR(OFFSET([.$F658];-1*[.$B$21];0 );0) * [.$B$10])) -> 0 | I658: of:=SUM(INDEX([.H$1:.H$736];MAX(ROW()+(-1*[.$B$22])+1;3);1):INDEX([.H$1:.H$736];ROW();1)) -> 0 | J658: of:=IF([.I658] > [.$B$20];[.I658]-[.$B$20];0) -> 0 | K658: of:=IF([.J658] > 0; ROUND([.$B$23] *MIN([.J658];[.H658])); 0) -> 0 | L658: of:=IF((ROW() - [.$B$13] < 3);0;FLOOR(IFERROR(OFFSET([.$F658];-1*[.$B$13];0 );0) * [.$B$14])) -> 0 | M658: of:=SUM([.L$3:.L658]) -> 6061951
D659: of:=[.D658]+1 -> 2021-11-06T00:00:00.000 | F659: of:=IF([.G658] < [.$B$25];CEILING([.G658]*[.$B$3];1);0) -> 0 | G659: of:=IF([.G658] < [.$B$25];SUM([.F$3:.F659]);[.$B$25]) -> 222350062.5 | H659: of:=IF((ROW() - [.$B$21] < 3);0;FLOOR(IFERROR(OFFSET([.$F659];-1*[.$B$21];0 );0) * [.$B$10])) -> 0 | I659: of:=SUM(INDEX([.H$1:.H$736];MAX(ROW()+(-1*[.$B$22])+1;3);1):INDEX([.H$1:.H$736];ROW();1)) -> 0 | J659: of:=IF([.I659] > [.$B$20];[.I659]-[.$B$20];0) -> 0 | K659: of:=IF([.J659] > 0; ROUND([.$B$23] *MIN([.J659];[.H659])); 0) -> 0 | L659: of:=IF((ROW() - [.$B$13] < 3);0;FLOOR(IFERROR(OFFSET([.$F659];-1*[.$B$13];0 );0) * [.$B$14])) -> 0 | M659: of:=SUM([.L$3:.L659]) -> 6061951
D660: of:=[.D659]+1 -> 2021-11-07T00:00:00.000 | F660: of:=IF([.G659] < [.$B$25];CEILING([.G659]*[.$B$3];1);0) -> 0 | G660: of:=IF([.G659] < [.$B$25];SUM([.F$3:.F660]);[.$B$25]) -> 222350062.5 | H660: of:=IF((ROW() - [.$B$21] < 3);0;FLOOR(IFERROR(OFFSET([.$F660];-1*[.$B$21];0 );0) * [.$B$10])) -> 0 | I660: of:=SUM(INDEX([.H$1:.H$736];MAX(ROW()+(-1*[.$B$22])+1;3);1):INDEX([.H$1:.H$736];ROW();1)) -> 0 | J660: of:=IF([.I660] > [.$B$20];[.I660]-[.$B$20];0) -> 0 | K660: of:=IF([.J660] > 0; ROUND([.$B$23] *MIN([.J660];[.H660])); 0) -> 0 | L660: of:=IF((ROW() - [.$B$13] < 3);0;FLOOR(IFERROR(OFFSET([.$F660];-1*[.$B$13];0 );0) * [.$B$14])) -> 0 | M660: of:=SUM([.L$3:.L660]) -> 6061951
D661: of:=[.D660]+1 -> 2021-11-08T00:00:00.000 | F661: of:=IF([.G660] < [.$B$25];CEILING([.G660]*[.$B$3];1);0) -> 0 | G661: of:=IF([.G660] < [.$B$25];SUM([.F$3:.F661]);[.$B$25]) -> 222350062.5 | H661: of:=IF((ROW() - [.$B$21] < 3);0;FLOOR(IFERROR(OFFSET([.$F661];-1*[.$B$21];0 );0) * [.$B$10])) -> 0 | I661: of:=SUM(INDEX([.H$1:.H$736];MAX(ROW()+(-1*[.$B$22])+1;3);1):INDEX([.H$1:.H$736];ROW();1)) -> 0 | J661: of:=IF([.I661] > [.$B$20];[.I661]-[.$B$20];0) -> 0 | K661: of:=IF([.J661] > 0; ROUND([.$B$23] *MIN([.J661];[.H661])); 0) -> 0 | L661: of:=IF((ROW() - [.$B$13] < 3);0;FLOOR(IFERROR(OFFSET([.$F661];-1*[.$B$13];0 );0) * [.$B$14])) -> 0 | M661: of:=SUM([.L$3:.L661]) -> 6061951
D662: of:=[.D661]+1 -> 2021-11-09T00:00:00.000 | F662: of:=IF([.G661] < [.$B$25];CEILING([.G661]*[.$B$3];1);0) -> 0 | G662: of:=IF([.G661] < [.$B$25];SUM([.F$3:.F662]);[.$B$25]) -> 222350062.5 | H662: of:=IF((ROW() - [.$B$21] < 3);0;FLOOR(IFERROR(OFFSET([.$F662];-1*[.$B$21];0 );0) * [.$B$10])) -> 0 | I662: of:=SUM(INDEX([.H$1:.H$736];MAX(ROW()+(-1*[.$B$22])+1;3);1):INDEX([.H$1:.H$736];ROW();1)) -> 0 | J662: of:=IF([.I662] > [.$B$20];[.I662]-[.$B$20];0) -> 0 | K662: of:=IF([.J662] > 0; ROUND([.$B$23] *MIN([.J662];[.H662])); 0) -> 0 | L662: of:=IF((ROW() - [.$B$13] < 3);0;FLOOR(IFERROR(OFFSET([.$F662];-1*[.$B$13];0 );0) * [.$B$14])) -> 0 | M662: of:=SUM([.L$3:.L662]) -> 6061951
D663: of:=[.D662]+1 -> 2021-11-10T00:00:00.000 | F663: of:=IF([.G662] < [.$B$25];CEILING([.G662]*[.$B$3];1);0) -> 0 | G663: of:=IF([.G662] < [.$B$25];SUM([.F$3:.F663]);[.$B$25]) -> 222350062.5 | H663: of:=IF((ROW() - [.$B$21] < 3);0;FLOOR(IFERROR(OFFSET([.$F663];-1*[.$B$21];0 );0) * [.$B$10])) -> 0 | I663: of:=SUM(INDEX([.H$1:.H$736];MAX(ROW()+(-1*[.$B$22])+1;3);1):INDEX([.H$1:.H$736];ROW();1)) -> 0 | J663: of:=IF([.I663] > [.$B$20];[.I663]-[.$B$20];0) -> 0 | K663: of:=IF([.J663] > 0; ROUND([.$B$23] *MIN([.J663];[.H663])); 0) -> 0 | L663: of:=IF((ROW() - [.$B$13] < 3);0;FLOOR(IFERROR(OFFSET([.$F663];-1*[.$B$13];0 );0) * [.$B$14])) -> 0 | M663: of:=SUM([.L$3:.L663]) -> 6061951
D664: of:=[.D663]+1 -> 2021-11-11T00:00:00.000 | F664: of:=IF([.G663] < [.$B$25];CEILING([.G663]*[.$B$3];1);0) -> 0 | G664: of:=IF([.G663] < [.$B$25];SUM([.F$3:.F664]);[.$B$25]) -> 222350062.5 | H664: of:=IF((ROW() - [.$B$21] < 3);0;FLOOR(IFERROR(OFFSET([.$F664];-1*[.$B$21];0 );0) * [.$B$10])) -> 0 | I664: of:=SUM(INDEX([.H$1:.H$736];MAX(ROW()+(-1*[.$B$22])+1;3);1):INDEX([.H$1:.H$736];ROW();1)) -> 0 | J664: of:=IF([.I664] > [.$B$20];[.I664]-[.$B$20];0) -> 0 | K664: of:=IF([.J664] > 0; ROUND([.$B$23] *MIN([.J664];[.H664])); 0) -> 0 | L664: of:=IF((ROW() - [.$B$13] < 3);0;FLOOR(IFERROR(OFFSET([.$F664];-1*[.$B$13];0 );0) * [.$B$14])) -> 0 | M664: of:=SUM([.L$3:.L664]) -> 6061951
D665: of:=[.D664]+1 -> 2021-11-12T00:00:00.000 | F665: of:=IF([.G664] < [.$B$25];CEILING([.G664]*[.$B$3];1);0) -> 0 | G665: of:=IF([.G664] < [.$B$25];SUM([.F$3:.F665]);[.$B$25]) -> 222350062.5 | H665: of:=IF((ROW() - [.$B$21] < 3);0;FLOOR(IFERROR(OFFSET([.$F665];-1*[.$B$21];0 );0) * [.$B$10])) -> 0 | I665: of:=SUM(INDEX([.H$1:.H$736];MAX(ROW()+(-1*[.$B$22])+1;3);1):INDEX([.H$1:.H$736];ROW();1)) -> 0 | J665: of:=IF([.I665] > [.$B$20];[.I665]-[.$B$20];0) -> 0 | K665: of:=IF([.J665] > 0; ROUND([.$B$23] *MIN([.J665];[.H665])); 0) -> 0 | L665: of:=IF((ROW() - [.$B$13] < 3);0;FLOOR(IFERROR(OFFSET([.$F665];-1*[.$B$13];0 );0) * [.$B$14])) -> 0 | M665: of:=SUM([.L$3:.L665]) -> 6061951
D666: of:=[.D665]+1 -> 2021-11-13T00:00:00.000 | F666: of:=IF([.G665] < [.$B$25];CEILING([.G665]*[.$B$3];1);0) -> 0 | G666: of:=IF([.G665] < [.$B$25];SUM([.F$3:.F666]);[.$B$25]) -> 222350062.5 | H666: of:=IF((ROW() - [.$B$21] < 3);0;FLOOR(IFERROR(OFFSET([.$F666];-1*[.$B$21];0 );0) * [.$B$10])) -> 0 | I666: of:=SUM(INDEX([.H$1:.H$736];MAX(ROW()+(-1*[.$B$22])+1;3);1):INDEX([.H$1:.H$736];ROW();1)) -> 0 | J666: of:=IF([.I666] > [.$B$20];[.I666]-[.$B$20];0) -> 0 | K666: of:=IF([.J666] > 0; ROUND([.$B$23] *MIN([.J666];[.H666])); 0) -> 0 | L666: of:=IF((ROW() - [.$B$13] < 3);0;FLOOR(IFERROR(OFFSET([.$F666];-1*[.$B$13];0 );0) * [.$B$14])) -> 0 | M666: of:=SUM([.L$3:.L666]) -> 6061951
D667: of:=[.D666]+1 -> 2021-11-14T00:00:00.000 | F667: of:=IF([.G666] < [.$B$25];CEILING([.G666]*[.$B$3];1);0) -> 0 | G667: of:=IF([.G666] < [.$B$25];SUM([.F$3:.F667]);[.$B$25]) -> 222350062.5 | H667: of:=IF((ROW() - [.$B$21] < 3);0;FLOOR(IFERROR(OFFSET([.$F667];-1*[.$B$21];0 );0) * [.$B$10])) -> 0 | I667: of:=SUM(INDEX([.H$1:.H$736];MAX(ROW()+(-1*[.$B$22])+1;3);1):INDEX([.H$1:.H$736];ROW();1)) -> 0 | J667: of:=IF([.I667] > [.$B$20];[.I667]-[.$B$20];0) -> 0 | K667: of:=IF([.J667] > 0; ROUND([.$B$23] *MIN([.J667];[.H667])); 0) -> 0 | L667: of:=IF((ROW() - [.$B$13] < 3);0;FLOOR(IFERROR(OFFSET([.$F667];-1*[.$B$13];0 );0) * [.$B$14])) -> 0 | M667: of:=SUM([.L$3:.L667]) -> 6061951
D668: of:=[.D667]+1 -> 2021-11-15T00:00:00.000 | F668: of:=IF([.G667] < [.$B$25];CEILING([.G667]*[.$B$3];1);0) -> 0 | G668: of:=IF([.G667] < [.$B$25];SUM([.F$3:.F668]);[.$B$25]) -> 222350062.5 | H668: of:=IF((ROW() - [.$B$21] < 3);0;FLOOR(IFERROR(OFFSET([.$F668];-1*[.$B$21];0 );0) * [.$B$10])) -> 0 | I668: of:=SUM(INDEX([.H$1:.H$736];MAX(ROW()+(-1*[.$B$22])+1;3);1):INDEX([.H$1:.H$736];ROW();1)) -> 0 | J668: of:=IF([.I668] > [.$B$20];[.I668]-[.$B$20];0) -> 0 | K668: of:=IF([.J668] > 0; ROUND([.$B$23] *MIN([.J668];[.H668])); 0) -> 0 | L668: of:=IF((ROW() - [.$B$13] < 3);0;FLOOR(IFERROR(OFFSET([.$F668];-1*[.$B$13];0 );0) * [.$B$14])) -> 0 | M668: of:=SUM([.L$3:.L668]) -> 6061951
D669: of:=[.D668]+1 -> 2021-11-16T00:00:00.000 | F669: of:=IF([.G668] < [.$B$25];CEILING([.G668]*[.$B$3];1);0) -> 0 | G669: of:=IF([.G668] < [.$B$25];SUM([.F$3:.F669]);[.$B$25]) -> 222350062.5 | H669: of:=IF((ROW() - [.$B$21] < 3);0;FLOOR(IFERROR(OFFSET([.$F669];-1*[.$B$21];0 );0) * [.$B$10])) -> 0 | I669: of:=SUM(INDEX([.H$1:.H$736];MAX(ROW()+(-1*[.$B$22])+1;3);1):INDEX([.H$1:.H$736];ROW();1)) -> 0 | J669: of:=IF([.I669] > [.$B$20];[.I669]-[.$B$20];0) -> 0 | K669: of:=IF([.J669] > 0; ROUND([.$B$23] *MIN([.J669];[.H669])); 0) -> 0 | L669: of:=IF((ROW() - [.$B$13] < 3);0;FLOOR(IFERROR(OFFSET([.$F669];-1*[.$B$13];0 );0) * [.$B$14])) -> 0 | M669: of:=SUM([.L$3:.L669]) -> 6061951
D670: of:=[.D669]+1 -> 2021-11-17T00:00:00.000 | F670: of:=IF([.G669] < [.$B$25];CEILING([.G669]*[.$B$3];1);0) -> 0 | G670: of:=IF([.G669] < [.$B$25];SUM([.F$3:.F670]);[.$B$25]) -> 222350062.5 | H670: of:=IF((ROW() - [.$B$21] < 3);0;FLOOR(IFERROR(OFFSET([.$F670];-1*[.$B$21];0 );0) * [.$B$10])) -> 0 | I670: of:=SUM(INDEX([.H$1:.H$736];MAX(ROW()+(-1*[.$B$22])+1;3);1):INDEX([.H$1:.H$736];ROW();1)) -> 0 | J670: of:=IF([.I670] > [.$B$20];[.I670]-[.$B$20];0) -> 0 | K670: of:=IF([.J670] > 0; ROUND([.$B$23] *MIN([.J670];[.H670])); 0) -> 0 | L670: of:=IF((ROW() - [.$B$13] < 3);0;FLOOR(IFERROR(OFFSET([.$F670];-1*[.$B$13];0 );0) * [.$B$14])) -> 0 | M670: of:=SUM([.L$3:.L670]) -> 6061951
D671: of:=[.D670]+1 -> 2021-11-18T00:00:00.000 | F671: of:=IF([.G670] < [.$B$25];CEILING([.G670]*[.$B$3];1);0) -> 0 | G671: of:=IF([.G670] < [.$B$25];SUM([.F$3:.F671]);[.$B$25]) -> 222350062.5 | H671: of:=IF((ROW() - [.$B$21] < 3);0;FLOOR(IFERROR(OFFSET([.$F671];-1*[.$B$21];0 );0) * [.$B$10])) -> 0 | I671: of:=SUM(INDEX([.H$1:.H$736];MAX(ROW()+(-1*[.$B$22])+1;3);1):INDEX([.H$1:.H$736];ROW();1)) -> 0 | J671: of:=IF([.I671] > [.$B$20];[.I671]-[.$B$20];0) -> 0 | K671: of:=IF([.J671] > 0; ROUND([.$B$23] *MIN([.J671];[.H671])); 0) -> 0 | L671: of:=IF((ROW() - [.$B$13] < 3);0;FLOOR(IFERROR(OFFSET([.$F671];-1*[.$B$13];0 );0) * [.$B$14])) -> 0 | M671: of:=SUM([.L$3:.L671]) -> 6061951
D672: of:=[.D671]+1 -> 2021-11-19T00:00:00.000 | F672: of:=IF([.G671] < [.$B$25];CEILING([.G671]*[.$B$3];1);0) -> 0 | G672: of:=IF([.G671] < [.$B$25];SUM([.F$3:.F672]);[.$B$25]) -> 222350062.5 | H672: of:=IF((ROW() - [.$B$21] < 3);0;FLOOR(IFERROR(OFFSET([.$F672];-1*[.$B$21];0 );0) * [.$B$10])) -> 0 | I672: of:=SUM(INDEX([.H$1:.H$736];MAX(ROW()+(-1*[.$B$22])+1;3);1):INDEX([.H$1:.H$736];ROW();1)) -> 0 | J672: of:=IF([.I672] > [.$B$20];[.I672]-[.$B$20];0) -> 0 | K672: of:=IF([.J672] > 0; ROUND([.$B$23] *MIN([.J672];[.H672])); 0) -> 0 | L672: of:=IF((ROW() - [.$B$13] < 3);0;FLOOR(IFERROR(OFFSET([.$F672];-1*[.$B$13];0 );0) * [.$B$14])) -> 0 | M672: of:=SUM([.L$3:.L672]) -> 6061951
D673: of:=[.D672]+1 -> 2021-11-20T00:00:00.000 | F673: of:=IF([.G672] < [.$B$25];CEILING([.G672]*[.$B$3];1);0) -> 0 | G673: of:=IF([.G672] < [.$B$25];SUM([.F$3:.F673]);[.$B$25]) -> 222350062.5 | H673: of:=IF((ROW() - [.$B$21] < 3);0;FLOOR(IFERROR(OFFSET([.$F673];-1*[.$B$21];0 );0) * [.$B$10])) -> 0 | I673: of:=SUM(INDEX([.H$1:.H$736];MAX(ROW()+(-1*[.$B$22])+1;3);1):INDEX([.H$1:.H$736];ROW();1)) -> 0 | J673: of:=IF([.I673] > [.$B$20];[.I673]-[.$B$20];0) -> 0 | K673: of:=IF([.J673] > 0; ROUND([.$B$23] *MIN([.J673];[.H673])); 0) -> 0 | L673: of:=IF((ROW() - [.$B$13] < 3);0;FLOOR(IFERROR(OFFSET([.$F673];-1*[.$B$13];0 );0) * [.$B$14])) -> 0 | M673: of:=SUM([.L$3:.L673]) -> 6061951
D674: of:=[.D673]+1 -> 2021-11-21T00:00:00.000 | F674: of:=IF([.G673] < [.$B$25];CEILING([.G673]*[.$B$3];1);0) -> 0 | G674: of:=IF([.G673] < [.$B$25];SUM([.F$3:.F674]);[.$B$25]) -> 222350062.5 | H674: of:=IF((ROW() - [.$B$21] < 3);0;FLOOR(IFERROR(OFFSET([.$F674];-1*[.$B$21];0 );0) * [.$B$10])) -> 0 | I674: of:=SUM(INDEX([.H$1:.H$736];MAX(ROW()+(-1*[.$B$22])+1;3);1):INDEX([.H$1:.H$736];ROW();1)) -> 0 | J674: of:=IF([.I674] > [.$B$20];[.I674]-[.$B$20];0) -> 0 | K674: of:=IF([.J674] > 0; ROUND([.$B$23] *MIN([.J674];[.H674])); 0) -> 0 | L674: of:=IF((ROW() - [.$B$13] < 3);0;FLOOR(IFERROR(OFFSET([.$F674];-1*[.$B$13];0 );0) * [.$B$14])) -> 0 | M674: of:=SUM([.L$3:.L674]) -> 6061951
D675: of:=[.D674]+1 -> 2021-11-22T00:00:00.000 | F675: of:=IF([.G674] < [.$B$25];CEILING([.G674]*[.$B$3];1);0) -> 0 | G675: of:=IF([.G674] < [.$B$25];SUM([.F$3:.F675]);[.$B$25]) -> 222350062.5 | H675: of:=IF((ROW() - [.$B$21] < 3);0;FLOOR(IFERROR(OFFSET([.$F675];-1*[.$B$21];0 );0) * [.$B$10])) -> 0 | I675: of:=SUM(INDEX([.H$1:.H$736];MAX(ROW()+(-1*[.$B$22])+1;3);1):INDEX([.H$1:.H$736];ROW();1)) -> 0 | J675: of:=IF([.I675] > [.$B$20];[.I675]-[.$B$20];0) -> 0 | K675: of:=IF([.J675] > 0; ROUND([.$B$23] *MIN([.J675];[.H675])); 0) -> 0 | L675: of:=IF((ROW() - [.$B$13] < 3);0;FLOOR(IFERROR(OFFSET([.$F675];-1*[.$B$13];0 );0) * [.$B$14])) -> 0 | M675: of:=SUM([.L$3:.L675]) -> 6061951
D676: of:=[.D675]+1 -> 2021-11-23T00:00:00.000 | F676: of:=IF([.G675] < [.$B$25];CEILING([.G675]*[.$B$3];1);0) -> 0 | G676: of:=IF([.G675] < [.$B$25];SUM([.F$3:.F676]);[.$B$25]) -> 222350062.5 | H676: of:=IF((ROW() - [.$B$21] < 3);0;FLOOR(IFERROR(OFFSET([.$F676];-1*[.$B$21];0 );0) * [.$B$10])) -> 0 | I676: of:=SUM(INDEX([.H$1:.H$736];MAX(ROW()+(-1*[.$B$22])+1;3);1):INDEX([.H$1:.H$736];ROW();1)) -> 0 | J676: of:=IF([.I676] > [.$B$20];[.I676]-[.$B$20];0) -> 0 | K676: of:=IF([.J676] > 0; ROUND([.$B$23] *MIN([.J676];[.H676])); 0) -> 0 | L676: of:=IF((ROW() - [.$B$13] < 3);0;FLOOR(IFERROR(OFFSET([.$F676];-1*[.$B$13];0 );0) * [.$B$14])) -> 0 | M676: of:=SUM([.L$3:.L676]) -> 6061951
D677: of:=[.D676]+1 -> 2021-11-24T00:00:00.000 | F677: of:=IF([.G676] < [.$B$25];CEILING([.G676]*[.$B$3];1);0) -> 0 | G677: of:=IF([.G676] < [.$B$25];SUM([.F$3:.F677]);[.$B$25]) -> 222350062.5 | H677: of:=IF((ROW() - [.$B$21] < 3);0;FLOOR(IFERROR(OFFSET([.$F677];-1*[.$B$21];0 );0) * [.$B$10])) -> 0 | I677: of:=SUM(INDEX([.H$1:.H$736];MAX(ROW()+(-1*[.$B$22])+1;3);1):INDEX([.H$1:.H$736];ROW();1)) -> 0 | J677: of:=IF([.I677] > [.$B$20];[.I677]-[.$B$20];0) -> 0 | K677: of:=IF([.J677] > 0; ROUND([.$B$23] *MIN([.J677];[.H677])); 0) -> 0 | L677: of:=IF((ROW() - [.$B$13] < 3);0;FLOOR(IFERROR(OFFSET([.$F677];-1*[.$B$13];0 );0) * [.$B$14])) -> 0 | M677: of:=SUM([.L$3:.L677]) -> 6061951
D678: of:=[.D677]+1 -> 2021-11-25T00:00:00.000 | F678: of:=IF([.G677] < [.$B$25];CEILING([.G677]*[.$B$3];1);0) -> 0 | G678: of:=IF([.G677] < [.$B$25];SUM([.F$3:.F678]);[.$B$25]) -> 222350062.5 | H678: of:=IF((ROW() - [.$B$21] < 3);0;FLOOR(IFERROR(OFFSET([.$F678];-1*[.$B$21];0 );0) * [.$B$10])) -> 0 | I678: of:=SUM(INDEX([.H$1:.H$736];MAX(ROW()+(-1*[.$B$22])+1;3);1):INDEX([.H$1:.H$736];ROW();1)) -> 0 | J678: of:=IF([.I678] > [.$B$20];[.I678]-[.$B$20];0) -> 0 | K678: of:=IF([.J678] > 0; ROUND([.$B$23] *MIN([.J678];[.H678])); 0) -> 0 | L678: of:=IF((ROW() - [.$B$13] < 3);0;FLOOR(IFERROR(OFFSET([.$F678];-1*[.$B$13];0 );0) * [.$B$14])) -> 0 | M678: of:=SUM([.L$3:.L678]) -> 6061951
D679: of:=[.D678]+1 -> 2021-11-26T00:00:00.000 | F679: of:=IF([.G678] < [.$B$25];CEILING([.G678]*[.$B$3];1);0) -> 0 | G679: of:=IF([.G678] < [.$B$25];SUM([.F$3:.F679]);[.$B$25]) -> 222350062.5 | H679: of:=IF((ROW() - [.$B$21] < 3);0;FLOOR(IFERROR(OFFSET([.$F679];-1*[.$B$21];0 );0) * [.$B$10])) -> 0 | I679: of:=SUM(INDEX([.H$1:.H$736];MAX(ROW()+(-1*[.$B$22])+1;3);1):INDEX([.H$1:.H$736];ROW();1)) -> 0 | J679: of:=IF([.I679] > [.$B$20];[.I679]-[.$B$20];0) -> 0 | K679: of:=IF([.J679] > 0; ROUND([.$B$23] *MIN([.J679];[.H679])); 0) -> 0 | L679: of:=IF((ROW() - [.$B$13] < 3);0;FLOOR(IFERROR(OFFSET([.$F679];-1*[.$B$13];0 );0) * [.$B$14])) -> 0 | M679: of:=SUM([.L$3:.L679]) -> 6061951
D680: of:=[.D679]+1 -> 2021-11-27T00:00:00.000 | F680: of:=IF([.G679] < [.$B$25];CEILING([.G679]*[.$B$3];1);0) -> 0 | G680: of:=IF([.G679] < [.$B$25];SUM([.F$3:.F680]);[.$B$25]) -> 222350062.5 | H680: of:=IF((ROW() - [.$B$21] < 3);0;FLOOR(IFERROR(OFFSET([.$F680];-1*[.$B$21];0 );0) * [.$B$10])) -> 0 | I680: of:=SUM(INDEX([.H$1:.H$736];MAX(ROW()+(-1*[.$B$22])+1;3);1):INDEX([.H$1:.H$736];ROW();1)) -> 0 | J680: of:=IF([.I680] > [.$B$20];[.I680]-[.$B$20];0) -> 0 | K680: of:=IF([.J680] > 0; ROUND([.$B$23] *MIN([.J680];[.H680])); 0) -> 0 | L680: of:=IF((ROW() - [.$B$13] < 3);0;FLOOR(IFERROR(OFFSET([.$F680];-1*[.$B$13];0 );0) * [.$B$14])) -> 0 | M680: of:=SUM([.L$3:.L680]) -> 6061951
D681: of:=[.D680]+1 -> 2021-11-28T00:00:00.000 | F681: of:=IF([.G680] < [.$B$25];CEILING([.G680]*[.$B$3];1);0) -> 0 | G681: of:=IF([.G680] < [.$B$25];SUM([.F$3:.F681]);[.$B$25]) -> 222350062.5 | H681: of:=IF((ROW() - [.$B$21] < 3);0;FLOOR(IFERROR(OFFSET([.$F681];-1*[.$B$21];0 );0) * [.$B$10])) -> 0 | I681: of:=SUM(INDEX([.H$1:.H$736];MAX(ROW()+(-1*[.$B$22])+1;3);1):INDEX([.H$1:.H$736];ROW();1)) -> 0 | J681: of:=IF([.I681] > [.$B$20];[.I681]-[.$B$20];0) -> 0 | K681: of:=IF([.J681] > 0; ROUND([.$B$23] *MIN([.J681];[.H681])); 0) -> 0 | L681: of:=IF((ROW() - [.$B$13] < 3);0;FLOOR(IFERROR(OFFSET([.$F681];-1*[.$B$13];0 );0) * [.$B$14])) -> 0 | M681: of:=SUM([.L$3:.L681]) -> 6061951
D682: of:=[.D681]+1 -> 2021-11-29T00:00:00.000 | F682: of:=IF([.G681] < [.$B$25];CEILING([.G681]*[.$B$3];1);0) -> 0 | G682: of:=IF([.G681] < [.$B$25];SUM([.F$3:.F682]);[.$B$25]) -> 222350062.5 | H682: of:=IF((ROW() - [.$B$21] < 3);0;FLOOR(IFERROR(OFFSET([.$F682];-1*[.$B$21];0 );0) * [.$B$10])) -> 0 | I682: of:=SUM(INDEX([.H$1:.H$736];MAX(ROW()+(-1*[.$B$22])+1;3);1):INDEX([.H$1:.H$736];ROW();1)) -> 0 | J682: of:=IF([.I682] > [.$B$20];[.I682]-[.$B$20];0) -> 0 | K682: of:=IF([.J682] > 0; ROUND([.$B$23] *MIN([.J682];[.H682])); 0) -> 0 | L682: of:=IF((ROW() - [.$B$13] < 3);0;FLOOR(IFERROR(OFFSET([.$F682];-1*[.$B$13];0 );0) * [.$B$14])) -> 0 | M682: of:=SUM([.L$3:.L682]) -> 6061951
D683: of:=[.D682]+1 -> 2021-11-30T00:00:00.000 | F683: of:=IF([.G682] < [.$B$25];CEILING([.G682]*[.$B$3];1);0) -> 0 | G683: of:=IF([.G682] < [.$B$25];SUM([.F$3:.F683]);[.$B$25]) -> 222350062.5 | H683: of:=IF((ROW() - [.$B$21] < 3);0;FLOOR(IFERROR(OFFSET([.$F683];-1*[.$B$21];0 );0) * [.$B$10])) -> 0 | I683: of:=SUM(INDEX([.H$1:.H$736];MAX(ROW()+(-1*[.$B$22])+1;3);1):INDEX([.H$1:.H$736];ROW();1)) -> 0 | J683: of:=IF([.I683] > [.$B$20];[.I683]-[.$B$20];0) -> 0 | K683: of:=IF([.J683] > 0; ROUND([.$B$23] *MIN([.J683];[.H683])); 0) -> 0 | L683: of:=IF((ROW() - [.$B$13] < 3);0;FLOOR(IFERROR(OFFSET([.$F683];-1*[.$B$13];0 );0) * [.$B$14])) -> 0 | M683: of:=SUM([.L$3:.L683]) -> 6061951
D684: of:=[.D683]+1 -> 2021-12-01T00:00:00.000 | F684: of:=IF([.G683] < [.$B$25];CEILING([.G683]*[.$B$3];1);0) -> 0 | G684: of:=IF([.G683] < [.$B$25];SUM([.F$3:.F684]);[.$B$25]) -> 222350062.5 | H684: of:=IF((ROW() - [.$B$21] < 3);0;FLOOR(IFERROR(OFFSET([.$F684];-1*[.$B$21];0 );0) * [.$B$10])) -> 0 | I684: of:=SUM(INDEX([.H$1:.H$736];MAX(ROW()+(-1*[.$B$22])+1;3);1):INDEX([.H$1:.H$736];ROW();1)) -> 0 | J684: of:=IF([.I684] > [.$B$20];[.I684]-[.$B$20];0) -> 0 | K684: of:=IF([.J684] > 0; ROUND([.$B$23] *MIN([.J684];[.H684])); 0) -> 0 | L684: of:=IF((ROW() - [.$B$13] < 3);0;FLOOR(IFERROR(OFFSET([.$F684];-1*[.$B$13];0 );0) * [.$B$14])) -> 0 | M684: of:=SUM([.L$3:.L684]) -> 6061951
D685: of:=[.D684]+1 -> 2021-12-02T00:00:00.000 | F685: of:=IF([.G684] < [.$B$25];CEILING([.G684]*[.$B$3];1);0) -> 0 | G685: of:=IF([.G684] < [.$B$25];SUM([.F$3:.F685]);[.$B$25]) -> 222350062.5 | H685: of:=IF((ROW() - [.$B$21] < 3);0;FLOOR(IFERROR(OFFSET([.$F685];-1*[.$B$21];0 );0) * [.$B$10])) -> 0 | I685: of:=SUM(INDEX([.H$1:.H$736];MAX(ROW()+(-1*[.$B$22])+1;3);1):INDEX([.H$1:.H$736];ROW();1)) -> 0 | J685: of:=IF([.I685] > [.$B$20];[.I685]-[.$B$20];0) -> 0 | K685: of:=IF([.J685] > 0; ROUND([.$B$23] *MIN([.J685];[.H685])); 0) -> 0 | L685: of:=IF((ROW() - [.$B$13] < 3);0;FLOOR(IFERROR(OFFSET([.$F685];-1*[.$B$13];0 );0) * [.$B$14])) -> 0 | M685: of:=SUM([.L$3:.L685]) -> 6061951
D686: of:=[.D685]+1 -> 2021-12-03T00:00:00.000 | F686: of:=IF([.G685] < [.$B$25];CEILING([.G685]*[.$B$3];1);0) -> 0 | G686: of:=IF([.G685] < [.$B$25];SUM([.F$3:.F686]);[.$B$25]) -> 222350062.5 | H686: of:=IF((ROW() - [.$B$21] < 3);0;FLOOR(IFERROR(OFFSET([.$F686];-1*[.$B$21];0 );0) * [.$B$10])) -> 0 | I686: of:=SUM(INDEX([.H$1:.H$736];MAX(ROW()+(-1*[.$B$22])+1;3);1):INDEX([.H$1:.H$736];ROW();1)) -> 0 | J686: of:=IF([.I686] > [.$B$20];[.I686]-[.$B$20];0) -> 0 | K686: of:=IF([.J686] > 0; ROUND([.$B$23] *MIN([.J686];[.H686])); 0) -> 0 | L686: of:=IF((ROW() - [.$B$13] < 3);0;FLOOR(IFERROR(OFFSET([.$F686];-1*[.$B$13];0 );0) * [.$B$14])) -> 0 | M686: of:=SUM([.L$3:.L686]) -> 6061951
D687: of:=[.D686]+1 -> 2021-12-04T00:00:00.000 | F687: of:=IF([.G686] < [.$B$25];CEILING([.G686]*[.$B$3];1);0) -> 0 | G687: of:=IF([.G686] < [.$B$25];SUM([.F$3:.F687]);[.$B$25]) -> 222350062.5 | H687: of:=IF((ROW() - [.$B$21] < 3);0;FLOOR(IFERROR(OFFSET([.$F687];-1*[.$B$21];0 );0) * [.$B$10])) -> 0 | I687: of:=SUM(INDEX([.H$1:.H$736];MAX(ROW()+(-1*[.$B$22])+1;3);1):INDEX([.H$1:.H$736];ROW();1)) -> 0 | J687: of:=IF([.I687] > [.$B$20];[.I687]-[.$B$20];0) -> 0 | K687: of:=IF([.J687] > 0; ROUND([.$B$23] *MIN([.J687];[.H687])); 0) -> 0 | L687: of:=IF((ROW() - [.$B$13] < 3);0;FLOOR(IFERROR(OFFSET([.$F687];-1*[.$B$13];0 );0) * [.$B$14])) -> 0 | M687: of:=SUM([.L$3:.L687]) -> 6061951
D688: of:=[.D687]+1 -> 2021-12-05T00:00:00.000 | F688: of:=IF([.G687] < [.$B$25];CEILING([.G687]*[.$B$3];1);0) -> 0 | G688: of:=IF([.G687] < [.$B$25];SUM([.F$3:.F688]);[.$B$25]) -> 222350062.5 | H688: of:=IF((ROW() - [.$B$21] < 3);0;FLOOR(IFERROR(OFFSET([.$F688];-1*[.$B$21];0 );0) * [.$B$10])) -> 0 | I688: of:=SUM(INDEX([.H$1:.H$736];MAX(ROW()+(-1*[.$B$22])+1;3);1):INDEX([.H$1:.H$736];ROW();1)) -> 0 | J688: of:=IF([.I688] > [.$B$20];[.I688]-[.$B$20];0) -> 0 | K688: of:=IF([.J688] > 0; ROUND([.$B$23] *MIN([.J688];[.H688])); 0) -> 0 | L688: of:=IF((ROW() - [.$B$13] < 3);0;FLOOR(IFERROR(OFFSET([.$F688];-1*[.$B$13];0 );0) * [.$B$14])) -> 0 | M688: of:=SUM([.L$3:.L688]) -> 6061951
D689: of:=[.D688]+1 -> 2021-12-06T00:00:00.000 | F689: of:=IF([.G688] < [.$B$25];CEILING([.G688]*[.$B$3];1);0) -> 0 | G689: of:=IF([.G688] < [.$B$25];SUM([.F$3:.F689]);[.$B$25]) -> 222350062.5 | H689: of:=IF((ROW() - [.$B$21] < 3);0;FLOOR(IFERROR(OFFSET([.$F689];-1*[.$B$21];0 );0) * [.$B$10])) -> 0 | I689: of:=SUM(INDEX([.H$1:.H$736];MAX(ROW()+(-1*[.$B$22])+1;3);1):INDEX([.H$1:.H$736];ROW();1)) -> 0 | J689: of:=IF([.I689] > [.$B$20];[.I689]-[.$B$20];0) -> 0 | K689: of:=IF([.J689] > 0; ROUND([.$B$23] *MIN([.J689];[.H689])); 0) -> 0 | L689: of:=IF((ROW() - [.$B$13] < 3);0;FLOOR(IFERROR(OFFSET([.$F689];-1*[.$B$13];0 );0) * [.$B$14])) -> 0 | M689: of:=SUM([.L$3:.L689]) -> 6061951
D690: of:=[.D689]+1 -> 2021-12-07T00:00:00.000 | F690: of:=IF([.G689] < [.$B$25];CEILING([.G689]*[.$B$3];1);0) -> 0 | G690: of:=IF([.G689] < [.$B$25];SUM([.F$3:.F690]);[.$B$25]) -> 222350062.5 | H690: of:=IF((ROW() - [.$B$21] < 3);0;FLOOR(IFERROR(OFFSET([.$F690];-1*[.$B$21];0 );0) * [.$B$10])) -> 0 | I690: of:=SUM(INDEX([.H$1:.H$736];MAX(ROW()+(-1*[.$B$22])+1;3);1):INDEX([.H$1:.H$736];ROW();1)) -> 0 | J690: of:=IF([.I690] > [.$B$20];[.I690]-[.$B$20];0) -> 0 | K690: of:=IF([.J690] > 0; ROUND([.$B$23] *MIN([.J690];[.H690])); 0) -> 0 | L690: of:=IF((ROW() - [.$B$13] < 3);0;FLOOR(IFERROR(OFFSET([.$F690];-1*[.$B$13];0 );0) * [.$B$14])) -> 0 | M690: of:=SUM([.L$3:.L690]) -> 6061951
D691: of:=[.D690]+1 -> 2021-12-08T00:00:00.000 | F691: of:=IF([.G690] < [.$B$25];CEILING([.G690]*[.$B$3];1);0) -> 0 | G691: of:=IF([.G690] < [.$B$25];SUM([.F$3:.F691]);[.$B$25]) -> 222350062.5 | H691: of:=IF((ROW() - [.$B$21] < 3);0;FLOOR(IFERROR(OFFSET([.$F691];-1*[.$B$21];0 );0) * [.$B$10])) -> 0 | I691: of:=SUM(INDEX([.H$1:.H$736];MAX(ROW()+(-1*[.$B$22])+1;3);1):INDEX([.H$1:.H$736];ROW();1)) -> 0 | J691: of:=IF([.I691] > [.$B$20];[.I691]-[.$B$20];0) -> 0 | K691: of:=IF([.J691] > 0; ROUND([.$B$23] *MIN([.J691];[.H691])); 0) -> 0 | L691: of:=IF((ROW() - [.$B$13] < 3);0;FLOOR(IFERROR(OFFSET([.$F691];-1*[.$B$13];0 );0) * [.$B$14])) -> 0 | M691: of:=SUM([.L$3:.L691]) -> 6061951
D692: of:=[.D691]+1 -> 2021-12-09T00:00:00.000 | F692: of:=IF([.G691] < [.$B$25];CEILING([.G691]*[.$B$3];1);0) -> 0 | G692: of:=IF([.G691] < [.$B$25];SUM([.F$3:.F692]);[.$B$25]) -> 222350062.5 | H692: of:=IF((ROW() - [.$B$21] < 3);0;FLOOR(IFERROR(OFFSET([.$F692];-1*[.$B$21];0 );0) * [.$B$10])) -> 0 | I692: of:=SUM(INDEX([.H$1:.H$736];MAX(ROW()+(-1*[.$B$22])+1;3);1):INDEX([.H$1:.H$736];ROW();1)) -> 0 | J692: of:=IF([.I692] > [.$B$20];[.I692]-[.$B$20];0) -> 0 | K692: of:=IF([.J692] > 0; ROUND([.$B$23] *MIN([.J692];[.H692])); 0) -> 0 | L692: of:=IF((ROW() - [.$B$13] < 3);0;FLOOR(IFERROR(OFFSET([.$F692];-1*[.$B$13];0 );0) * [.$B$14])) -> 0 | M692: of:=SUM([.L$3:.L692]) -> 6061951
D693: of:=[.D692]+1 -> 2021-12-10T00:00:00.000 | F693: of:=IF([.G692] < [.$B$25];CEILING([.G692]*[.$B$3];1);0) -> 0 | G693: of:=IF([.G692] < [.$B$25];SUM([.F$3:.F693]);[.$B$25]) -> 222350062.5 | H693: of:=IF((ROW() - [.$B$21] < 3);0;FLOOR(IFERROR(OFFSET([.$F693];-1*[.$B$21];0 );0) * [.$B$10])) -> 0 | I693: of:=SUM(INDEX([.H$1:.H$736];MAX(ROW()+(-1*[.$B$22])+1;3);1):INDEX([.H$1:.H$736];ROW();1)) -> 0 | J693: of:=IF([.I693] > [.$B$20];[.I693]-[.$B$20];0) -> 0 | K693: of:=IF([.J693] > 0; ROUND([.$B$23] *MIN([.J693];[.H693])); 0) -> 0 | L693: of:=IF((ROW() - [.$B$13] < 3);0;FLOOR(IFERROR(OFFSET([.$F693];-1*[.$B$13];0 );0) * [.$B$14])) -> 0 | M693: of:=SUM([.L$3:.L693]) -> 6061951
D694: of:=[.D693]+1 -> 2021-12-11T00:00:00.000 | F694: of:=IF([.G693] < [.$B$25];CEILING([.G693]*[.$B$3];1);0) -> 0 | G694: of:=IF([.G693] < [.$B$25];SUM([.F$3:.F694]);[.$B$25]) -> 222350062.5 | H694: of:=IF((ROW() - [.$B$21] < 3);0;FLOOR(IFERROR(OFFSET([.$F694];-1*[.$B$21];0 );0) * [.$B$10])) -> 0 | I694: of:=SUM(INDEX([.H$1:.H$736];MAX(ROW()+(-1*[.$B$22])+1;3);1):INDEX([.H$1:.H$736];ROW();1)) -> 0 | J694: of:=IF([.I694] > [.$B$20];[.I694]-[.$B$20];0) -> 0 | K694: of:=IF([.J694] > 0; ROUND([.$B$23] *MIN([.J694];[.H694])); 0) -> 0 | L694: of:=IF((ROW() - [.$B$13] < 3);0;FLOOR(IFERROR(OFFSET([.$F694];-1*[.$B$13];0 );0) * [.$B$14])) -> 0 | M694: of:=SUM([.L$3:.L694]) -> 6061951
D695: of:=[.D694]+1 -> 2021-12-12T00:00:00.000 | F695: of:=IF([.G694] < [.$B$25];CEILING([.G694]*[.$B$3];1);0) -> 0 | G695: of:=IF([.G694] < [.$B$25];SUM([.F$3:.F695]);[.$B$25]) -> 222350062.5 | H695: of:=IF((ROW() - [.$B$21] < 3);0;FLOOR(IFERROR(OFFSET([.$F695];-1*[.$B$21];0 );0) * [.$B$10])) -> 0 | I695: of:=SUM(INDEX([.H$1:.H$736];MAX(ROW()+(-1*[.$B$22])+1;3);1):INDEX([.H$1:.H$736];ROW();1)) -> 0 | J695: of:=IF([.I695] > [.$B$20];[.I695]-[.$B$20];0) -> 0 | K695: of:=IF([.J695] > 0; ROUND([.$B$23] *MIN([.J695];[.H695])); 0) -> 0 | L695: of:=IF((ROW() - [.$B$13] < 3);0;FLOOR(IFERROR(OFFSET([.$F695];-1*[.$B$13];0 );0) * [.$B$14])) -> 0 | M695: of:=SUM([.L$3:.L695]) -> 6061951
D696: of:=[.D695]+1 -> 2021-12-13T00:00:00.000 | F696: of:=IF([.G695] < [.$B$25];CEILING([.G695]*[.$B$3];1);0) -> 0 | G696: of:=IF([.G695] < [.$B$25];SUM([.F$3:.F696]);[.$B$25]) -> 222350062.5 | H696: of:=IF((ROW() - [.$B$21] < 3);0;FLOOR(IFERROR(OFFSET([.$F696];-1*[.$B$21];0 );0) * [.$B$10])) -> 0 | I696: of:=SUM(INDEX([.H$1:.H$736];MAX(ROW()+(-1*[.$B$22])+1;3);1):INDEX([.H$1:.H$736];ROW();1)) -> 0 | J696: of:=IF([.I696] > [.$B$20];[.I696]-[.$B$20];0) -> 0 | K696: of:=IF([.J696] > 0; ROUND([.$B$23] *MIN([.J696];[.H696])); 0) -> 0 | L696: of:=IF((ROW() - [.$B$13] < 3);0;FLOOR(IFERROR(OFFSET([.$F696];-1*[.$B$13];0 );0) * [.$B$14])) -> 0 | M696: of:=SUM([.L$3:.L696]) -> 6061951
D697: of:=[.D696]+1 -> 2021-12-14T00:00:00.000 | F697: of:=IF([.G696] < [.$B$25];CEILING([.G696]*[.$B$3];1);0) -> 0 | G697: of:=IF([.G696] < [.$B$25];SUM([.F$3:.F697]);[.$B$25]) -> 222350062.5 | H697: of:=IF((ROW() - [.$B$21] < 3);0;FLOOR(IFERROR(OFFSET([.$F697];-1*[.$B$21];0 );0) * [.$B$10])) -> 0 | I697: of:=SUM(INDEX([.H$1:.H$736];MAX(ROW()+(-1*[.$B$22])+1;3);1):INDEX([.H$1:.H$736];ROW();1)) -> 0 | J697: of:=IF([.I697] > [.$B$20];[.I697]-[.$B$20];0) -> 0 | K697: of:=IF([.J697] > 0; ROUND([.$B$23] *MIN([.J697];[.H697])); 0) -> 0 | L697: of:=IF((ROW() - [.$B$13] < 3);0;FLOOR(IFERROR(OFFSET([.$F697];-1*[.$B$13];0 );0) * [.$B$14])) -> 0 | M697: of:=SUM([.L$3:.L697]) -> 6061951
D698: of:=[.D697]+1 -> 2021-12-15T00:00:00.000 | F698: of:=IF([.G697] < [.$B$25];CEILING([.G697]*[.$B$3];1);0) -> 0 | G698: of:=IF([.G697] < [.$B$25];SUM([.F$3:.F698]);[.$B$25]) -> 222350062.5 | H698: of:=IF((ROW() - [.$B$21] < 3);0;FLOOR(IFERROR(OFFSET([.$F698];-1*[.$B$21];0 );0) * [.$B$10])) -> 0 | I698: of:=SUM(INDEX([.H$1:.H$736];MAX(ROW()+(-1*[.$B$22])+1;3);1):INDEX([.H$1:.H$736];ROW();1)) -> 0 | J698: of:=IF([.I698] > [.$B$20];[.I698]-[.$B$20];0) -> 0 | K698: of:=IF([.J698] > 0; ROUND([.$B$23] *MIN([.J698];[.H698])); 0) -> 0 | L698: of:=IF((ROW() - [.$B$13] < 3);0;FLOOR(IFERROR(OFFSET([.$F698];-1*[.$B$13];0 );0) * [.$B$14])) -> 0 | M698: of:=SUM([.L$3:.L698]) -> 6061951
D699: of:=[.D698]+1 -> 2021-12-16T00:00:00.000 | F699: of:=IF([.G698] < [.$B$25];CEILING([.G698]*[.$B$3];1);0) -> 0 | G699: of:=IF([.G698] < [.$B$25];SUM([.F$3:.F699]);[.$B$25]) -> 222350062.5 | H699: of:=IF((ROW() - [.$B$21] < 3);0;FLOOR(IFERROR(OFFSET([.$F699];-1*[.$B$21];0 );0) * [.$B$10])) -> 0 | I699: of:=SUM(INDEX([.H$1:.H$736];MAX(ROW()+(-1*[.$B$22])+1;3);1):INDEX([.H$1:.H$736];ROW();1)) -> 0 | J699: of:=IF([.I699] > [.$B$20];[.I699]-[.$B$20];0) -> 0 | K699: of:=IF([.J699] > 0; ROUND([.$B$23] *MIN([.J699];[.H699])); 0) -> 0 | L699: of:=IF((ROW() - [.$B$13] < 3);0;FLOOR(IFERROR(OFFSET([.$F699];-1*[.$B$13];0 );0) * [.$B$14])) -> 0 | M699: of:=SUM([.L$3:.L699]) -> 6061951
D700: of:=[.D699]+1 -> 2021-12-17T00:00:00.000 | F700: of:=IF([.G699] < [.$B$25];CEILING([.G699]*[.$B$3];1);0) -> 0 | G700: of:=IF([.G699] < [.$B$25];SUM([.F$3:.F700]);[.$B$25]) -> 222350062.5 | H700: of:=IF((ROW() - [.$B$21] < 3);0;FLOOR(IFERROR(OFFSET([.$F700];-1*[.$B$21];0 );0) * [.$B$10])) -> 0 | I700: of:=SUM(INDEX([.H$1:.H$736];MAX(ROW()+(-1*[.$B$22])+1;3);1):INDEX([.H$1:.H$736];ROW();1)) -> 0 | J700: of:=IF([.I700] > [.$B$20];[.I700]-[.$B$20];0) -> 0 | K700: of:=IF([.J700] > 0; ROUND([.$B$23] *MIN([.J700];[.H700])); 0) -> 0 | L700: of:=IF((ROW() - [.$B$13] < 3);0;FLOOR(IFERROR(OFFSET([.$F700];-1*[.$B$13];0 );0) * [.$B$14])) -> 0 | M700: of:=SUM([.L$3:.L700]) -> 6061951
D701: of:=[.D700]+1 -> 2021-12-18T00:00:00.000 | F701: of:=IF([.G700] < [.$B$25];CEILING([.G700]*[.$B$3];1);0) -> 0 | G701: of:=IF([.G700] < [.$B$25];SUM([.F$3:.F701]);[.$B$25]) -> 222350062.5 | H701: of:=IF((ROW() - [.$B$21] < 3);0;FLOOR(IFERROR(OFFSET([.$F701];-1*[.$B$21];0 );0) * [.$B$10])) -> 0 | I701: of:=SUM(INDEX([.H$1:.H$736];MAX(ROW()+(-1*[.$B$22])+1;3);1):INDEX([.H$1:.H$736];ROW();1)) -> 0 | J701: of:=IF([.I701] > [.$B$20];[.I701]-[.$B$20];0) -> 0 | K701: of:=IF([.J701] > 0; ROUND([.$B$23] *MIN([.J701];[.H701])); 0) -> 0 | L701: of:=IF((ROW() - [.$B$13] < 3);0;FLOOR(IFERROR(OFFSET([.$F701];-1*[.$B$13];0 );0) * [.$B$14])) -> 0 | M701: of:=SUM([.L$3:.L701]) -> 6061951
D702: of:=[.D701]+1 -> 2021-12-19T00:00:00.000 | F702: of:=IF([.G701] < [.$B$25];CEILING([.G701]*[.$B$3];1);0) -> 0 | G702: of:=IF([.G701] < [.$B$25];SUM([.F$3:.F702]);[.$B$25]) -> 222350062.5 | H702: of:=IF((ROW() - [.$B$21] < 3);0;FLOOR(IFERROR(OFFSET([.$F702];-1*[.$B$21];0 );0) * [.$B$10])) -> 0 | I702: of:=SUM(INDEX([.H$1:.H$736];MAX(ROW()+(-1*[.$B$22])+1;3);1):INDEX([.H$1:.H$736];ROW();1)) -> 0 | J702: of:=IF([.I702] > [.$B$20];[.I702]-[.$B$20];0) -> 0 | K702: of:=IF([.J702] > 0; ROUND([.$B$23] *MIN([.J702];[.H702])); 0) -> 0 | L702: of:=IF((ROW() - [.$B$13] < 3);0;FLOOR(IFERROR(OFFSET([.$F702];-1*[.$B$13];0 );0) * [.$B$14])) -> 0 | M702: of:=SUM([.L$3:.L702]) -> 6061951
D703: of:=[.D702]+1 -> 2021-12-20T00:00:00.000 | F703: of:=IF([.G702] < [.$B$25];CEILING([.G702]*[.$B$3];1);0) -> 0 | G703: of:=IF([.G702] < [.$B$25];SUM([.F$3:.F703]);[.$B$25]) -> 222350062.5 | H703: of:=IF((ROW() - [.$B$21] < 3);0;FLOOR(IFERROR(OFFSET([.$F703];-1*[.$B$21];0 );0) * [.$B$10])) -> 0 | I703: of:=SUM(INDEX([.H$1:.H$736];MAX(ROW()+(-1*[.$B$22])+1;3);1):INDEX([.H$1:.H$736];ROW();1)) -> 0 | J703: of:=IF([.I703] > [.$B$20];[.I703]-[.$B$20];0) -> 0 | K703: of:=IF([.J703] > 0; ROUND([.$B$23] *MIN([.J703];[.H703])); 0) -> 0 | L703: of:=IF((ROW() - [.$B$13] < 3);0;FLOOR(IFERROR(OFFSET([.$F703];-1*[.$B$13];0 );0) * [.$B$14])) -> 0 | M703: of:=SUM([.L$3:.L703]) -> 6061951
D704: of:=[.D703]+1 -> 2021-12-21T00:00:00.000 | F704: of:=IF([.G703] < [.$B$25];CEILING([.G703]*[.$B$3];1);0) -> 0 | G704: of:=IF([.G703] < [.$B$25];SUM([.F$3:.F704]);[.$B$25]) -> 222350062.5 | H704: of:=IF((ROW() - [.$B$21] < 3);0;FLOOR(IFERROR(OFFSET([.$F704];-1*[.$B$21];0 );0) * [.$B$10])) -> 0 | I704: of:=SUM(INDEX([.H$1:.H$736];MAX(ROW()+(-1*[.$B$22])+1;3);1):INDEX([.H$1:.H$736];ROW();1)) -> 0 | J704: of:=IF([.I704] > [.$B$20];[.I704]-[.$B$20];0) -> 0 | K704: of:=IF([.J704] > 0; ROUND([.$B$23] *MIN([.J704];[.H704])); 0) -> 0 | L704: of:=IF((ROW() - [.$B$13] < 3);0;FLOOR(IFERROR(OFFSET([.$F704];-1*[.$B$13];0 );0) * [.$B$14])) -> 0 | M704: of:=SUM([.L$3:.L704]) -> 6061951
D705: of:=[.D704]+1 -> 2021-12-22T00:00:00.000 | F705: of:=IF([.G704] < [.$B$25];CEILING([.G704]*[.$B$3];1);0) -> 0 | G705: of:=IF([.G704] < [.$B$25];SUM([.F$3:.F705]);[.$B$25]) -> 222350062.5 | H705: of:=IF((ROW() - [.$B$21] < 3);0;FLOOR(IFERROR(OFFSET([.$F705];-1*[.$B$21];0 );0) * [.$B$10])) -> 0 | I705: of:=SUM(INDEX([.H$1:.H$736];MAX(ROW()+(-1*[.$B$22])+1;3);1):INDEX([.H$1:.H$736];ROW();1)) -> 0 | J705: of:=IF([.I705] > [.$B$20];[.I705]-[.$B$20];0) -> 0 | K705: of:=IF([.J705] > 0; ROUND([.$B$23] *MIN([.J705];[.H705])); 0) -> 0 | L705: of:=IF((ROW() - [.$B$13] < 3);0;FLOOR(IFERROR(OFFSET([.$F705];-1*[.$B$13];0 );0) * [.$B$14])) -> 0 | M705: of:=SUM([.L$3:.L705]) -> 6061951
D706: of:=[.D705]+1 -> 2021-12-23T00:00:00.000 | F706: of:=IF([.G705] < [.$B$25];CEILING([.G705]*[.$B$3];1);0) -> 0 | G706: of:=IF([.G705] < [.$B$25];SUM([.F$3:.F706]);[.$B$25]) -> 222350062.5 | H706: of:=IF((ROW() - [.$B$21] < 3);0;FLOOR(IFERROR(OFFSET([.$F706];-1*[.$B$21];0 );0) * [.$B$10])) -> 0 | I706: of:=SUM(INDEX([.H$1:.H$736];MAX(ROW()+(-1*[.$B$22])+1;3);1):INDEX([.H$1:.H$736];ROW();1)) -> 0 | J706: of:=IF([.I706] > [.$B$20];[.I706]-[.$B$20];0) -> 0 | K706: of:=IF([.J706] > 0; ROUND([.$B$23] *MIN([.J706];[.H706])); 0) -> 0 | L706: of:=IF((ROW() - [.$B$13] < 3);0;FLOOR(IFERROR(OFFSET([.$F706];-1*[.$B$13];0 );0) * [.$B$14])) -> 0 | M706: of:=SUM([.L$3:.L706]) -> 6061951
D707: of:=[.D706]+1 -> 2021-12-24T00:00:00.000 | F707: of:=IF([.G706] < [.$B$25];CEILING([.G706]*[.$B$3];1);0) -> 0 | G707: of:=IF([.G706] < [.$B$25];SUM([.F$3:.F707]);[.$B$25]) -> 222350062.5 | H707: of:=IF((ROW() - [.$B$21] < 3);0;FLOOR(IFERROR(OFFSET([.$F707];-1*[.$B$21];0 );0) * [.$B$10])) -> 0 | I707: of:=SUM(INDEX([.H$1:.H$736];MAX(ROW()+(-1*[.$B$22])+1;3);1):INDEX([.H$1:.H$736];ROW();1)) -> 0 | J707: of:=IF([.I707] > [.$B$20];[.I707]-[.$B$20];0) -> 0 | K707: of:=IF([.J707] > 0; ROUND([.$B$23] *MIN([.J707];[.H707])); 0) -> 0 | L707: of:=IF((ROW() - [.$B$13] < 3);0;FLOOR(IFERROR(OFFSET([.$F707];-1*[.$B$13];0 );0) * [.$B$14])) -> 0 | M707: of:=SUM([.L$3:.L707]) -> 6061951
D708: of:=[.D707]+1 -> 2021-12-25T00:00:00.000 | F708: of:=IF([.G707] < [.$B$25];CEILING([.G707]*[.$B$3];1);0) -> 0 | G708: of:=IF([.G707] < [.$B$25];SUM([.F$3:.F708]);[.$B$25]) -> 222350062.5 | H708: of:=IF((ROW() - [.$B$21] < 3);0;FLOOR(IFERROR(OFFSET([.$F708];-1*[.$B$21];0 );0) * [.$B$10])) -> 0 | I708: of:=SUM(INDEX([.H$1:.H$736];MAX(ROW()+(-1*[.$B$22])+1;3);1):INDEX([.H$1:.H$736];ROW();1)) -> 0 | J708: of:=IF([.I708] > [.$B$20];[.I708]-[.$B$20];0) -> 0 | K708: of:=IF([.J708] > 0; ROUND([.$B$23] *MIN([.J708];[.H708])); 0) -> 0 | L708: of:=IF((ROW() - [.$B$13] < 3);0;FLOOR(IFERROR(OFFSET([.$F708];-1*[.$B$13];0 );0) * [.$B$14])) -> 0 | M708: of:=SUM([.L$3:.L708]) -> 6061951
D709: of:=[.D708]+1 -> 2021-12-26T00:00:00.000 | F709: of:=IF([.G708] < [.$B$25];CEILING([.G708]*[.$B$3];1);0) -> 0 | G709: of:=IF([.G708] < [.$B$25];SUM([.F$3:.F709]);[.$B$25]) -> 222350062.5 | H709: of:=IF((ROW() - [.$B$21] < 3);0;FLOOR(IFERROR(OFFSET([.$F709];-1*[.$B$21];0 );0) * [.$B$10])) -> 0 | I709: of:=SUM(INDEX([.H$1:.H$736];MAX(ROW()+(-1*[.$B$22])+1;3);1):INDEX([.H$1:.H$736];ROW();1)) -> 0 | J709: of:=IF([.I709] > [.$B$20];[.I709]-[.$B$20];0) -> 0 | K709: of:=IF([.J709] > 0; ROUND([.$B$23] *MIN([.J709];[.H709])); 0) -> 0 | L709: of:=IF((ROW() - [.$B$13] < 3);0;FLOOR(IFERROR(OFFSET([.$F709];-1*[.$B$13];0 );0) * [.$B$14])) -> 0 | M709: of:=SUM([.L$3:.L709]) -> 6061951
D710: of:=[.D709]+1 -> 2021-12-27T00:00:00.000 | F710: of:=IF([.G709] < [.$B$25];CEILING([.G709]*[.$B$3];1);0) -> 0 | G710: of:=IF([.G709] < [.$B$25];SUM([.F$3:.F710]);[.$B$25]) -> 222350062.5 | H710: of:=IF((ROW() - [.$B$21] < 3);0;FLOOR(IFERROR(OFFSET([.$F710];-1*[.$B$21];0 );0) * [.$B$10])) -> 0 | I710: of:=SUM(INDEX([.H$1:.H$736];MAX(ROW()+(-1*[.$B$22])+1;3);1):INDEX([.H$1:.H$736];ROW();1)) -> 0 | J710: of:=IF([.I710] > [.$B$20];[.I710]-[.$B$20];0) -> 0 | K710: of:=IF([.J710] > 0; ROUND([.$B$23] *MIN([.J710];[.H710])); 0) -> 0 | L710: of:=IF((ROW() - [.$B$13] < 3);0;FLOOR(IFERROR(OFFSET([.$F710];-1*[.$B$13];0 );0) * [.$B$14])) -> 0 | M710: of:=SUM([.L$3:.L710]) -> 6061951
D711: of:=[.D710]+1 -> 2021-12-28T00:00:00.000 | F711: of:=IF([.G710] < [.$B$25];CEILING([.G710]*[.$B$3];1);0) -> 0 | G711: of:=IF([.G710] < [.$B$25];SUM([.F$3:.F711]);[.$B$25]) -> 222350062.5 | H711: of:=IF((ROW() - [.$B$21] < 3);0;FLOOR(IFERROR(OFFSET([.$F711];-1*[.$B$21];0 );0) * [.$B$10])) -> 0 | I711: of:=SUM(INDEX([.H$1:.H$736];MAX(ROW()+(-1*[.$B$22])+1;3);1):INDEX([.H$1:.H$736];ROW();1)) -> 0 | J711: of:=IF([.I711] > [.$B$20];[.I711]-[.$B$20];0) -> 0 | K711: of:=IF([.J711] > 0; ROUND([.$B$23] *MIN([.J711];[.H711])); 0) -> 0 | L711: of:=IF((ROW() - [.$B$13] < 3);0;FLOOR(IFERROR(OFFSET([.$F711];-1*[.$B$13];0 );0) * [.$B$14])) -> 0 | M711: of:=SUM([.L$3:.L711]) -> 6061951
D712: of:=[.D711]+1 -> 2021-12-29T00:00:00.000 | F712: of:=IF([.G711] < [.$B$25];CEILING([.G711]*[.$B$3];1);0) -> 0 | G712: of:=IF([.G711] < [.$B$25];SUM([.F$3:.F712]);[.$B$25]) -> 222350062.5 | H712: of:=IF((ROW() - [.$B$21] < 3);0;FLOOR(IFERROR(OFFSET([.$F712];-1*[.$B$21];0 );0) * [.$B$10])) -> 0 | I712: of:=SUM(INDEX([.H$1:.H$736];MAX(ROW()+(-1*[.$B$22])+1;3);1):INDEX([.H$1:.H$736];ROW();1)) -> 0 | J712: of:=IF([.I712] > [.$B$20];[.I712]-[.$B$20];0) -> 0 | K712: of:=IF([.J712] > 0; ROUND([.$B$23] *MIN([.J712];[.H712])); 0) -> 0 | L712: of:=IF((ROW() - [.$B$13] < 3);0;FLOOR(IFERROR(OFFSET([.$F712];-1*[.$B$13];0 );0) * [.$B$14])) -> 0 | M712: of:=SUM([.L$3:.L712]) -> 6061951
D713: of:=[.D712]+1 -> 2021-12-30T00:00:00.000 | F713: of:=IF([.G712] < [.$B$25];CEILING([.G712]*[.$B$3];1);0) -> 0 | G713: of:=IF([.G712] < [.$B$25];SUM([.F$3:.F713]);[.$B$25]) -> 222350062.5 | H713: of:=IF((ROW() - [.$B$21] < 3);0;FLOOR(IFERROR(OFFSET([.$F713];-1*[.$B$21];0 );0) * [.$B$10])) -> 0 | I713: of:=SUM(INDEX([.H$1:.H$736];MAX(ROW()+(-1*[.$B$22])+1;3);1):INDEX([.H$1:.H$736];ROW();1)) -> 0 | J713: of:=IF([.I713] > [.$B$20];[.I713]-[.$B$20];0) -> 0 | K713: of:=IF([.J713] > 0; ROUND([.$B$23] *MIN([.J713];[.H713])); 0) -> 0 | L713: of:=IF((ROW() - [.$B$13] < 3);0;FLOOR(IFERROR(OFFSET([.$F713];-1*[.$B$13];0 );0) * [.$B$14])) -> 0 | M713: of:=SUM([.L$3:.L713]) -> 6061951
D714: of:=[.D713]+1 -> 2021-12-31T00:00:00.000 | F714: of:=IF([.G713] < [.$B$25];CEILING([.G713]*[.$B$3];1);0) -> 0 | G714: of:=IF([.G713] < [.$B$25];SUM([.F$3:.F714]);[.$B$25]) -> 222350062.5 | H714: of:=IF((ROW() - [.$B$21] < 3);0;FLOOR(IFERROR(OFFSET([.$F714];-1*[.$B$21];0 );0) * [.$B$10])) -> 0 | I714: of:=SUM(INDEX([.H$1:.H$736];MAX(ROW()+(-1*[.$B$22])+1;3);1):INDEX([.H$1:.H$736];ROW();1)) -> 0 | J714: of:=IF([.I714] > [.$B$20];[.I714]-[.$B$20];0) -> 0 | K714: of:=IF([.J714] > 0; ROUND([.$B$23] *MIN([.J714];[.H714])); 0) -> 0 | L714: of:=IF((ROW() - [.$B$13] < 3);0;FLOOR(IFERROR(OFFSET([.$F714];-1*[.$B$13];0 );0) * [.$B$14])) -> 0 | M714: of:=SUM([.L$3:.L714]) -> 6061951
D715: of:=[.D714]+1 -> 2022-01-01T00:00:00.000 | F715: of:=IF([.G714] < [.$B$25];CEILING([.G714]*[.$B$3];1);0) -> 0 | G715: of:=IF([.G714] < [.$B$25];SUM([.F$3:.F715]);[.$B$25]) -> 222350062.5 | H715: of:=IF((ROW() - [.$B$21] < 3);0;FLOOR(IFERROR(OFFSET([.$F715];-1*[.$B$21];0 );0) * [.$B$10])) -> 0 | I715: of:=SUM(INDEX([.H$1:.H$736];MAX(ROW()+(-1*[.$B$22])+1;3);1):INDEX([.H$1:.H$736];ROW();1)) -> 0 | J715: of:=IF([.I715] > [.$B$20];[.I715]-[.$B$20];0) -> 0 | K715: of:=IF([.J715] > 0; ROUND([.$B$23] *MIN([.J715];[.H715])); 0) -> 0 | L715: of:=IF((ROW() - [.$B$13] < 3);0;FLOOR(IFERROR(OFFSET([.$F715];-1*[.$B$13];0 );0) * [.$B$14])) -> 0 | M715: of:=SUM([.L$3:.L715]) -> 6061951
D716: of:=[.D715]+1 -> 2022-01-02T00:00:00.000 | F716: of:=IF([.G715] < [.$B$25];CEILING([.G715]*[.$B$3];1);0) -> 0 | G716: of:=IF([.G715] < [.$B$25];SUM([.F$3:.F716]);[.$B$25]) -> 222350062.5 | H716: of:=IF((ROW() - [.$B$21] < 3);0;FLOOR(IFERROR(OFFSET([.$F716];-1*[.$B$21];0 );0) * [.$B$10])) -> 0 | I716: of:=SUM(INDEX([.H$1:.H$736];MAX(ROW()+(-1*[.$B$22])+1;3);1):INDEX([.H$1:.H$736];ROW();1)) -> 0 | J716: of:=IF([.I716] > [.$B$20];[.I716]-[.$B$20];0) -> 0 | K716: of:=IF([.J716] > 0; ROUND([.$B$23] *MIN([.J716];[.H716])); 0) -> 0 | L716: of:=IF((ROW() - [.$B$13] < 3);0;FLOOR(IFERROR(OFFSET([.$F716];-1*[.$B$13];0 );0) * [.$B$14])) -> 0 | M716: of:=SUM([.L$3:.L716]) -> 6061951
D717: of:=[.D716]+1 -> 2022-01-03T00:00:00.000 | F717: of:=IF([.G716] < [.$B$25];CEILING([.G716]*[.$B$3];1);0) -> 0 | G717: of:=IF([.G716] < [.$B$25];SUM([.F$3:.F717]);[.$B$25]) -> 222350062.5 | H717: of:=IF((ROW() - [.$B$21] < 3);0;FLOOR(IFERROR(OFFSET([.$F717];-1*[.$B$21];0 );0) * [.$B$10])) -> 0 | I717: of:=SUM(INDEX([.H$1:.H$736];MAX(ROW()+(-1*[.$B$22])+1;3);1):INDEX([.H$1:.H$736];ROW();1)) -> 0 | J717: of:=IF([.I717] > [.$B$20];[.I717]-[.$B$20];0) -> 0 | K717: of:=IF([.J717] > 0; ROUND([.$B$23] *MIN([.J717];[.H717])); 0) -> 0 | L717: of:=IF((ROW() - [.$B$13] < 3);0;FLOOR(IFERROR(OFFSET([.$F717];-1*[.$B$13];0 );0) * [.$B$14])) -> 0 | M717: of:=SUM([.L$3:.L717]) -> 6061951
D718: of:=[.D717]+1 -> 2022-01-04T00:00:00.000 | F718: of:=IF([.G717] < [.$B$25];CEILING([.G717]*[.$B$3];1);0) -> 0 | G718: of:=IF([.G717] < [.$B$25];SUM([.F$3:.F718]);[.$B$25]) -> 222350062.5 | H718: of:=IF((ROW() - [.$B$21] < 3);0;FLOOR(IFERROR(OFFSET([.$F718];-1*[.$B$21];0 );0) * [.$B$10])) -> 0 | I718: of:=SUM(INDEX([.H$1:.H$736];MAX(ROW()+(-1*[.$B$22])+1;3);1):INDEX([.H$1:.H$736];ROW();1)) -> 0 | J718: of:=IF([.I718] > [.$B$20];[.I718]-[.$B$20];0) -> 0 | K718: of:=IF([.J718] > 0; ROUND([.$B$23] *MIN([.J718];[.H718])); 0) -> 0 | L718: of:=IF((ROW() - [.$B$13] < 3);0;FLOOR(IFERROR(OFFSET([.$F718];-1*[.$B$13];0 );0) * [.$B$14])) -> 0 | M718: of:=SUM([.L$3:.L718]) -> 6061951
D719: of:=[.D718]+1 -> 2022-01-05T00:00:00.000 | F719: of:=IF([.G718] < [.$B$25];CEILING([.G718]*[.$B$3];1);0) -> 0 | G719: of:=IF([.G718] < [.$B$25];SUM([.F$3:.F719]);[.$B$25]) -> 222350062.5 | H719: of:=IF((ROW() - [.$B$21] < 3);0;FLOOR(IFERROR(OFFSET([.$F719];-1*[.$B$21];0 );0) * [.$B$10])) -> 0 | I719: of:=SUM(INDEX([.H$1:.H$736];MAX(ROW()+(-1*[.$B$22])+1;3);1):INDEX([.H$1:.H$736];ROW();1)) -> 0 | J719: of:=IF([.I719] > [.$B$20];[.I719]-[.$B$20];0) -> 0 | K719: of:=IF([.J719] > 0; ROUND([.$B$23] *MIN([.J719];[.H719])); 0) -> 0 | L719: of:=IF((ROW() - [.$B$13] < 3);0;FLOOR(IFERROR(OFFSET([.$F719];-1*[.$B$13];0 );0) * [.$B$14])) -> 0 | M719: of:=SUM([.L$3:.L719]) -> 6061951
D720: of:=[.D719]+1 -> 2022-01-06T00:00:00.000 | F720: of:=IF([.G719] < [.$B$25];CEILING([.G719]*[.$B$3];1);0) -> 0 | G720: of:=IF([.G719] < [.$B$25];SUM([.F$3:.F720]);[.$B$25]) -> 222350062.5 | H720: of:=IF((ROW() - [.$B$21] < 3);0;FLOOR(IFERROR(OFFSET([.$F720];-1*[.$B$21];0 );0) * [.$B$10])) -> 0 | I720: of:=SUM(INDEX([.H$1:.H$736];MAX(ROW()+(-1*[.$B$22])+1;3);1):INDEX([.H$1:.H$736];ROW();1)) -> 0 | J720: of:=IF([.I720] > [.$B$20];[.I720]-[.$B$20];0) -> 0 | K720: of:=IF([.J720] > 0; ROUND([.$B$23] *MIN([.J720];[.H720])); 0) -> 0 | L720: of:=IF((ROW() - [.$B$13] < 3);0;FLOOR(IFERROR(OFFSET([.$F720];-1*[.$B$13];0 );0) * [.$B$14])) -> 0 | M720: of:=SUM([.L$3:.L720]) -> 6061951
D721: of:=[.D720]+1 -> 2022-01-07T00:00:00.000 | F721: of:=IF([.G720] < [.$B$25];CEILING([.G720]*[.$B$3];1);0) -> 0 | G721: of:=IF([.G720] < [.$B$25];SUM([.F$3:.F721]);[.$B$25]) -> 222350062.5 | H721: of:=IF((ROW() - [.$B$21] < 3);0;FLOOR(IFERROR(OFFSET([.$F721];-1*[.$B$21];0 );0) * [.$B$10])) -> 0 | I721: of:=SUM(INDEX([.H$1:.H$736];MAX(ROW()+(-1*[.$B$22])+1;3);1):INDEX([.H$1:.H$736];ROW();1)) -> 0 | J721: of:=IF([.I721] > [.$B$20];[.I721]-[.$B$20];0) -> 0 | K721: of:=IF([.J721] > 0; ROUND([.$B$23] *MIN([.J721];[.H721])); 0) -> 0 | L721: of:=IF((ROW() - [.$B$13] < 3);0;FLOOR(IFERROR(OFFSET([.$F721];-1*[.$B$13];0 );0) * [.$B$14])) -> 0 | M721: of:=SUM([.L$3:.L721]) -> 6061951
D722: of:=[.D721]+1 -> 2022-01-08T00:00:00.000 | F722: of:=IF([.G721] < [.$B$25];CEILING([.G721]*[.$B$3];1);0) -> 0 | G722: of:=IF([.G721] < [.$B$25];SUM([.F$3:.F722]);[.$B$25]) -> 222350062.5 | H722: of:=IF((ROW() - [.$B$21] < 3);0;FLOOR(IFERROR(OFFSET([.$F722];-1*[.$B$21];0 );0) * [.$B$10])) -> 0 | I722: of:=SUM(INDEX([.H$1:.H$736];MAX(ROW()+(-1*[.$B$22])+1;3);1):INDEX([.H$1:.H$736];ROW();1)) -> 0 | J722: of:=IF([.I722] > [.$B$20];[.I722]-[.$B$20];0) -> 0 | K722: of:=IF([.J722] > 0; ROUND([.$B$23] *MIN([.J722];[.H722])); 0) -> 0 | L722: of:=IF((ROW() - [.$B$13] < 3);0;FLOOR(IFERROR(OFFSET([.$F722];-1*[.$B$13];0 );0) * [.$B$14])) -> 0 | M722: of:=SUM([.L$3:.L722]) -> 6061951
D723: of:=[.D722]+1 -> 2022-01-09T00:00:00.000 | F723: of:=IF([.G722] < [.$B$25];CEILING([.G722]*[.$B$3];1);0) -> 0 | G723: of:=IF([.G722] < [.$B$25];SUM([.F$3:.F723]);[.$B$25]) -> 222350062.5 | H723: of:=IF((ROW() - [.$B$21] < 3);0;FLOOR(IFERROR(OFFSET([.$F723];-1*[.$B$21];0 );0) * [.$B$10])) -> 0 | I723: of:=SUM(INDEX([.H$1:.H$736];MAX(ROW()+(-1*[.$B$22])+1;3);1):INDEX([.H$1:.H$736];ROW();1)) -> 0 | J723: of:=IF([.I723] > [.$B$20];[.I723]-[.$B$20];0) -> 0 | K723: of:=IF([.J723] > 0; ROUND([.$B$23] *MIN([.J723];[.H723])); 0) -> 0 | L723: of:=IF((ROW() - [.$B$13] < 3);0;FLOOR(IFERROR(OFFSET([.$F723];-1*[.$B$13];0 );0) * [.$B$14])) -> 0 | M723: of:=SUM([.L$3:.L723]) -> 6061951
D724: of:=[.D723]+1 -> 2022-01-10T00:00:00.000 | F724: of:=IF([.G723] < [.$B$25];CEILING([.G723]*[.$B$3];1);0) -> 0 | G724: of:=IF([.G723] < [.$B$25];SUM([.F$3:.F724]);[.$B$25]) -> 222350062.5 | H724: of:=IF((ROW() - [.$B$21] < 3);0;FLOOR(IFERROR(OFFSET([.$F724];-1*[.$B$21];0 );0) * [.$B$10])) -> 0 | I724: of:=SUM(INDEX([.H$1:.H$736];MAX(ROW()+(-1*[.$B$22])+1;3);1):INDEX([.H$1:.H$736];ROW();1)) -> 0 | J724: of:=IF([.I724] > [.$B$20];[.I724]-[.$B$20];0) -> 0 | K724: of:=IF([.J724] > 0; ROUND([.$B$23] *MIN([.J724];[.H724])); 0) -> 0 | L724: of:=IF((ROW() - [.$B$13] < 3);0;FLOOR(IFERROR(OFFSET([.$F724];-1*[.$B$13];0 );0) * [.$B$14])) -> 0 | M724: of:=SUM([.L$3:.L724]) -> 6061951
D725: of:=[.D724]+1 -> 2022-01-11T00:00:00.000 | F725: of:=IF([.G724] < [.$B$25];CEILING([.G724]*[.$B$3];1);0) -> 0 | G725: of:=IF([.G724] < [.$B$25];SUM([.F$3:.F725]);[.$B$25]) -> 222350062.5 | H725: of:=IF((ROW() - [.$B$21] < 3);0;FLOOR(IFERROR(OFFSET([.$F725];-1*[.$B$21];0 );0) * [.$B$10])) -> 0 | I725: of:=SUM(INDEX([.H$1:.H$736];MAX(ROW()+(-1*[.$B$22])+1;3);1):INDEX([.H$1:.H$736];ROW();1)) -> 0 | J725: of:=IF([.I725] > [.$B$20];[.I725]-[.$B$20];0) -> 0 | K725: of:=IF([.J725] > 0; ROUND([.$B$23] *MIN([.J725];[.H725])); 0) -> 0 | L725: of:=IF((ROW() - [.$B$13] < 3);0;FLOOR(IFERROR(OFFSET([.$F725];-1*[.$B$13];0 );0) * [.$B$14])) -> 0 | M725: of:=SUM([.L$3:.L725]) -> 6061951
D726: of:=[.D725]+1 -> 2022-01-12T00:00:00.000 | F726: of:=IF([.G725] < [.$B$25];CEILING([.G725]*[.$B$3];1);0) -> 0 | G726: of:=IF([.G725] < [.$B$25];SUM([.F$3:.F726]);[.$B$25]) -> 222350062.5 | H726: of:=IF((ROW() - [.$B$21] < 3);0;FLOOR(IFERROR(OFFSET([.$F726];-1*[.$B$21];0 );0) * [.$B$10])) -> 0 | I726: of:=SUM(INDEX([.H$1:.H$736];MAX(ROW()+(-1*[.$B$22])+1;3);1):INDEX([.H$1:.H$736];ROW();1)) -> 0 | J726: of:=IF([.I726] > [.$B$20];[.I726]-[.$B$20];0) -> 0 | K726: of:=IF([.J726] > 0; ROUND([.$B$23] *MIN([.J726];[.H726])); 0) -> 0 | L726: of:=IF((ROW() - [.$B$13] < 3);0;FLOOR(IFERROR(OFFSET([.$F726];-1*[.$B$13];0 );0) * [.$B$14])) -> 0 | M726: of:=SUM([.L$3:.L726]) -> 6061951
D727: of:=[.D726]+1 -> 2022-01-13T00:00:00.000 | F727: of:=IF([.G726] < [.$B$25];CEILING([.G726]*[.$B$3];1);0) -> 0 | G727: of:=IF([.G726] < [.$B$25];SUM([.F$3:.F727]);[.$B$25]) -> 222350062.5 | H727: of:=IF((ROW() - [.$B$21] < 3);0;FLOOR(IFERROR(OFFSET([.$F727];-1*[.$B$21];0 );0) * [.$B$10])) -> 0 | I727: of:=SUM(INDEX([.H$1:.H$736];MAX(ROW()+(-1*[.$B$22])+1;3);1):INDEX([.H$1:.H$736];ROW();1)) -> 0 | J727: of:=IF([.I727] > [.$B$20];[.I727]-[.$B$20];0) -> 0 | K727: of:=IF([.J727] > 0; ROUND([.$B$23] *MIN([.J727];[.H727])); 0) -> 0 | L727: of:=IF((ROW() - [.$B$13] < 3);0;FLOOR(IFERROR(OFFSET([.$F727];-1*[.$B$13];0 );0) * [.$B$14])) -> 0 | M727: of:=SUM([.L$3:.L727]) -> 6061951
D728: of:=[.D727]+1 -> 2022-01-14T00:00:00.000 | F728: of:=IF([.G727] < [.$B$25];CEILING([.G727]*[.$B$3];1);0) -> 0 | G728: of:=IF([.G727] < [.$B$25];SUM([.F$3:.F728]);[.$B$25]) -> 222350062.5 | H728: of:=IF((ROW() - [.$B$21] < 3);0;FLOOR(IFERROR(OFFSET([.$F728];-1*[.$B$21];0 );0) * [.$B$10])) -> 0 | I728: of:=SUM(INDEX([.H$1:.H$736];MAX(ROW()+(-1*[.$B$22])+1;3);1):INDEX([.H$1:.H$736];ROW();1)) -> 0 | J728: of:=IF([.I728] > [.$B$20];[.I728]-[.$B$20];0) -> 0 | K728: of:=IF([.J728] > 0; ROUND([.$B$23] *MIN([.J728];[.H728])); 0) -> 0 | L728: of:=IF((ROW() - [.$B$13] < 3);0;FLOOR(IFERROR(OFFSET([.$F728];-1*[.$B$13];0 );0) * [.$B$14])) -> 0 | M728: of:=SUM([.L$3:.L728]) -> 6061951
D729: of:=[.D728]+1 -> 2022-01-15T00:00:00.000 | F729: of:=IF([.G728] < [.$B$25];CEILING([.G728]*[.$B$3];1);0) -> 0 | G729: of:=IF([.G728] < [.$B$25];SUM([.F$3:.F729]);[.$B$25]) -> 222350062.5 | H729: of:=IF((ROW() - [.$B$21] < 3);0;FLOOR(IFERROR(OFFSET([.$F729];-1*[.$B$21];0 );0) * [.$B$10])) -> 0 | I729: of:=SUM(INDEX([.H$1:.H$736];MAX(ROW()+(-1*[.$B$22])+1;3);1):INDEX([.H$1:.H$736];ROW();1)) -> 0 | J729: of:=IF([.I729] > [.$B$20];[.I729]-[.$B$20];0) -> 0 | K729: of:=IF([.J729] > 0; ROUND([.$B$23] *MIN([.J729];[.H729])); 0) -> 0 | L729: of:=IF((ROW() - [.$B$13] < 3);0;FLOOR(IFERROR(OFFSET([.$F729];-1*[.$B$13];0 );0) * [.$B$14])) -> 0 | M729: of:=SUM([.L$3:.L729]) -> 6061951
D730: of:=[.D729]+1 -> 2022-01-16T00:00:00.000 | F730: of:=IF([.G729] < [.$B$25];CEILING([.G729]*[.$B$3];1);0) -> 0 | G730: of:=IF([.G729] < [.$B$25];SUM([.F$3:.F730]);[.$B$25]) -> 222350062.5 | H730: of:=IF((ROW() - [.$B$21] < 3);0;FLOOR(IFERROR(OFFSET([.$F730];-1*[.$B$21];0 );0) * [.$B$10])) -> 0 | I730: of:=SUM(INDEX([.H$1:.H$736];MAX(ROW()+(-1*[.$B$22])+1;3);1):INDEX([.H$1:.H$736];ROW();1)) -> 0 | J730: of:=IF([.I730] > [.$B$20];[.I730]-[.$B$20];0) -> 0 | K730: of:=IF([.J730] > 0; ROUND([.$B$23] *MIN([.J730];[.H730])); 0) -> 0 | L730: of:=IF((ROW() - [.$B$13] < 3);0;FLOOR(IFERROR(OFFSET([.$F730];-1*[.$B$13];0 );0) * [.$B$14])) -> 0 | M730: of:=SUM([.L$3:.L730]) -> 6061951
D731: of:=[.D730]+1 -> 2022-01-17T00:00:00.000 | F731: of:=IF([.G730] < [.$B$25];CEILING([.G730]*[.$B$3];1);0) -> 0 | G731: of:=IF([.G730] < [.$B$25];SUM([.F$3:.F731]);[.$B$25]) -> 222350062.5 | H731: of:=IF((ROW() - [.$B$21] < 3);0;FLOOR(IFERROR(OFFSET([.$F731];-1*[.$B$21];0 );0) * [.$B$10])) -> 0 | I731: of:=SUM(INDEX([.H$1:.H$736];MAX(ROW()+(-1*[.$B$22])+1;3);1):INDEX([.H$1:.H$736];ROW();1)) -> 0 | J731: of:=IF([.I731] > [.$B$20];[.I731]-[.$B$20];0) -> 0 | K731: of:=IF([.J731] > 0; ROUND([.$B$23] *MIN([.J731];[.H731])); 0) -> 0 | L731: of:=IF((ROW() - [.$B$13] < 3);0;FLOOR(IFERROR(OFFSET([.$F731];-1*[.$B$13];0 );0) * [.$B$14])) -> 0 | M731: of:=SUM([.L$3:.L731]) -> 6061951
D732: of:=[.D731]+1 -> 2022-01-18T00:00:00.000 | F732: of:=IF([.G731] < [.$B$25];CEILING([.G731]*[.$B$3];1);0) -> 0 | G732: of:=IF([.G731] < [.$B$25];SUM([.F$3:.F732]);[.$B$25]) -> 222350062.5 | H732: of:=IF((ROW() - [.$B$21] < 3);0;FLOOR(IFERROR(OFFSET([.$F732];-1*[.$B$21];0 );0) * [.$B$10])) -> 0 | I732: of:=SUM(INDEX([.H$1:.H$736];MAX(ROW()+(-1*[.$B$22])+1;3);1):INDEX([.H$1:.H$736];ROW();1)) -> 0 | J732: of:=IF([.I732] > [.$B$20];[.I732]-[.$B$20];0) -> 0 | K732: of:=IF([.J732] > 0; ROUND([.$B$23] *MIN([.J732];[.H732])); 0) -> 0 | L732: of:=IF((ROW() - [.$B$13] < 3);0;FLOOR(IFERROR(OFFSET([.$F732];-1*[.$B$13];0 );0) * [.$B$14])) -> 0 | M732: of:=SUM([.L$3:.L732]) -> 6061951
D733: of:=[.D732]+1 -> 2022-01-19T00:00:00.000 | F733: of:=IF([.G732] < [.$B$25];CEILING([.G732]*[.$B$3];1);0) -> 0 | G733: of:=IF([.G732] < [.$B$25];SUM([.F$3:.F733]);[.$B$25]) -> 222350062.5 | H733: of:=IF((ROW() - [.$B$21] < 3);0;FLOOR(IFERROR(OFFSET([.$F733];-1*[.$B$21];0 );0) * [.$B$10])) -> 0 | I733: of:=SUM(INDEX([.H$1:.H$736];MAX(ROW()+(-1*[.$B$22])+1;3);1):INDEX([.H$1:.H$736];ROW();1)) -> 0 | J733: of:=IF([.I733] > [.$B$20];[.I733]-[.$B$20];0) -> 0 | K733: of:=IF([.J733] > 0; ROUND([.$B$23] *MIN([.J733];[.H733])); 0) -> 0 | L733: of:=IF((ROW() - [.$B$13] < 3);0;FLOOR(IFERROR(OFFSET([.$F733];-1*[.$B$13];0 );0) * [.$B$14])) -> 0 | M733: of:=SUM([.L$3:.L733]) -> 6061951
D734: of:=[.D733]+1 -> 2022-01-20T00:00:00.000 | F734: of:=IF([.G733] < [.$B$25];CEILING([.G733]*[.$B$3];1);0) -> 0 | G734: of:=IF([.G733] < [.$B$25];SUM([.F$3:.F734]);[.$B$25]) -> 222350062.5 | H734: of:=IF((ROW() - [.$B$21] < 3);0;FLOOR(IFERROR(OFFSET([.$F734];-1*[.$B$21];0 );0) * [.$B$10])) -> 0 | I734: of:=SUM(INDEX([.H$1:.H$736];MAX(ROW()+(-1*[.$B$22])+1;3);1):INDEX([.H$1:.H$736];ROW();1)) -> 0 | J734: of:=IF([.I734] > [.$B$20];[.I734]-[.$B$20];0) -> 0 | K734: of:=IF([.J734] > 0; ROUND([.$B$23] *MIN([.J734];[.H734])); 0) -> 0 | L734: of:=IF((ROW() - [.$B$13] < 3);0;FLOOR(IFERROR(OFFSET([.$F734];-1*[.$B$13];0 );0) * [.$B$14])) -> 0 | M734: of:=SUM([.L$3:.L734]) -> 6061951
D735: of:=[.D734]+1 -> 2022-01-21T00:00:00.000 | F735: of:=IF([.G734] < [.$B$25];CEILING([.G734]*[.$B$3];1);0) -> 0 | G735: of:=IF([.G734] < [.$B$25];SUM([.F$3:.F735]);[.$B$25]) -> 222350062.5 | H735: of:=IF((ROW() - [.$B$21] < 3);0;FLOOR(IFERROR(OFFSET([.$F735];-1*[.$B$21];0 );0) * [.$B$10])) -> 0 | I735: of:=SUM(INDEX([.H$1:.H$736];MAX(ROW()+(-1*[.$B$22])+1;3);1):INDEX([.H$1:.H$736];ROW();1)) -> 0 | J735: of:=IF([.I735] > [.$B$20];[.I735]-[.$B$20];0) -> 0 | K735: of:=IF([.J735] > 0; ROUND([.$B$23] *MIN([.J735];[.H735])); 0) -> 0 | L735: of:=IF((ROW() - [.$B$13] < 3);0;FLOOR(IFERROR(OFFSET([.$F735];-1*[.$B$13];0 );0) * [.$B$14])) -> 0 | M735: of:=SUM([.L$3:.L735]) -> 6061951
D736: of:=[.D735]+1 -> 2022-01-22T00:00:00.000 | F736: of:=IF([.G735] < [.$B$25];CEILING([.G735]*[.$B$3];1);0) -> 0 | G736: of:=IF([.G735] < [.$B$25];SUM([.F$3:.F736]);[.$B$25]) -> 222350062.5 | H736: of:=IF((ROW() - [.$B$21] < 3);0;FLOOR(IFERROR(OFFSET([.$F736];-1*[.$B$21];0 );0) * [.$B$10])) -> 0 | I736: of:=SUM(INDEX([.H$1:.H$736];MAX(ROW()+(-1*[.$B$22])+1;3);1):INDEX([.H$1:.H$736];ROW();1)) -> 0 | J736: of:=IF([.I736] > [.$B$20];[.I736]-[.$B$20];0) -> 0 | K736: of:=IF([.J736] > 0; ROUND([.$B$23] *MIN([.J736];[.H736])); 0) -> 0 | L736: of:=IF((ROW() - [.$B$13] < 3);0;FLOOR(IFERROR(OFFSET([.$F736];-1*[.$B$13];0 );0) * [.$B$14])) -> 0 | M736: of:=SUM([.L$3:.L736]) -> 6061951